tweet_id,text,language,type,bookmark_count,favorite_count,retweet_count,reply_count,view_count,created_at,client,hashtags,urls,media_type,media_urls
'1970531825173823717',"Up and down our state, I'm hearing from people and organizations alike who are worried about the impact of Republicans' health care cuts.

@senatedems aren't going to stand by while this administration makes people sicker and poorer. https://t.co/cZP0rfKBpP",en,Tweet,0,16,4,5,432,2025-09-23 17:52:52,"<a href=""https://mobile.twitter.com"" rel=""nofollow"">Twitter Web App</a>",,,video,https://video.twimg.com/amplify_video/1970531692658982912/vid/avc1/1080x1920/qu0jrlsxwi49D1uq.mp4?tag=21
'1970505380464566367',"Last week, Democrats voted for a bill that would keep the government open and restore health care funding for millions of Americans.

Republicans blocked that bill and left town.

If the government shuts down, it's because they refused to negotiate.",en,Tweet,10,389,179,203,45727,2025-09-23 16:07:47,"<a href=""https://mobile.twitter.com"" rel=""nofollow"">Twitter Web App</a>",,,,
'1970484883031261444',"From bullying networks to threatening reporters who report anything beyond talking points, the Trump administration is undermining the First Amendment.

We must stand up for journalists and their vital role in protecting against corruption and abuse.",en,Tweet,0,5,3,2,737,2025-09-23 14:46:20,"<a href=""https://mobile.twitter.com"" rel=""nofollow"">Twitter Web App</a>",,,,
'1970279762888143349',"Shana Tova to everyone in Delaware celebrating Rosh Hashanah!

Wishing you a new year full of good health, happiness, and plenty of time spent with loved ones.",en,Tweet,0,8,2,3,765,2025-09-23 01:11:16,"<a href=""https://mobile.twitter.com"" rel=""nofollow"">Twitter Web App</a>",,,,
'1970138171133608096',"It’s alarming that in the same weekend the president says he ‘hates’ his political opponents, we also learned he's trying to use the DOJ to baselessly prosecute them.

This is an outrageous abuse of power- we need a president who serves us all, not just his supporters.",en,Tweet,0,21,15,7,1239,2025-09-22 15:48:38,"<a href=""https://mobile.twitter.com"" rel=""nofollow"">Twitter Web App</a>",,,,
'1969134136330740098',"Today, I was proud to vote for a bill that would fund the government AND address the health care crisis created by President Trump and his allies in Congress.

My full statement on the ongoing  government funding negotiations: https://t.co/NKgNbRYs05",en,Tweet,0,7,3,8,525,2025-09-19 21:18:57,"<a href=""https://mobile.twitter.com"" rel=""nofollow"">Twitter Web App</a>",,,photo,https://pbs.twimg.com/media/G1PEuYAX0AALVnB.jpg
'1969069965798932750',"This week, we found out just how hard Sec. Kennedy is working to undermine vaccines at the CDC.

Now, his hand-picked committee is changing a science-based vaccine recommendation, making it harder for parents to keep their kids safe and healthy.

Our families deserve better.",en,Tweet,0,11,5,8,794,2025-09-19 17:03:58,"<a href=""https://mobile.twitter.com"" rel=""nofollow"">Twitter Web App</a>",,,,
'1968784316604813448',"Our kids need to be AI-literate.

They need to know the problems, the protections, and the possibilities. https://t.co/Td7ToqKVSS",en,Tweet,1,21,9,6,844,2025-09-18 22:08:53,"<a href=""https://mobile.twitter.com"" rel=""nofollow"">Twitter Web App</a>",,,video,https://video.twimg.com/amplify_video/1968783383774834688/vid/avc1/1080x1920/Xy7UtBh60SDxZp4l.mp4?tag=21
'1968744336905957614',"The dignity of work is essential to what it means to be an American.

I know jobs. I love jobs. And I know that for Americans to find purpose in their work, we need a different approach to jobs in this country. https://t.co/0czBdRbjRb",en,Tweet,0,18,7,7,623,2025-09-18 19:30:02,"<a href=""https://mobile.twitter.com"" rel=""nofollow"">Twitter Web App</a>",,,video,https://video.twimg.com/amplify_video/1968741405037125633/vid/avc1/1080x1920/oCn50ihtT8OIsVa8.mp4?tag=21
'1968672678832668792',"You don’t have to agree with Jimmy Kimmel to be outraged by his suspension. 

Punishing someone for exercising free speech is what autocrats do.

If you care about the freedoms this country was built on, now is the time to speak up.
https://t.co/c62cEJlPHT",en,Tweet,7,213,71,622,14869,2025-09-18 14:45:17,"<a href=""https://mobile.twitter.com"" rel=""nofollow"">Twitter Web App</a>",,https://www.cnn.com/2025/09/17/media/jimmy-kimmel-charlie-kirk-trump-fcc-brendan-carr,,
'1968428534331855196',"I opened my speech with a quote from the late, great Barbara Jordan, whose questions about division in our nation ring as true today as they did nearly 50 years ago.

The question before us is clear: how do we rekindle Bright Hope for America? https://t.co/sEVPnQhzKa",en,Tweet,2,11,9,3,551,2025-09-17 22:35:08,"<a href=""https://mobile.twitter.com"" rel=""nofollow"">Twitter Web App</a>",,,video,https://video.twimg.com/amplify_video/1968428287471788032/vid/avc1/1080x1920/8znm_dcIfne4QXV7.mp4?tag=21
'1968391875603091756',"The recommendation to vaccinate babies against hepatitis B nearly eliminated infections.

So why is RFK Jr. letting his anti-vaccine allies put that recommendation in jeopardy?

Today I asked former Director Monarez to explain how CDC recommendations help keep our kids safe. https://t.co/G0CEv6pyAU",en,Tweet,3,19,12,5,1247,2025-09-17 20:09:28,"<a href=""https://mobile.twitter.com"" rel=""nofollow"">Twitter Web App</a>",,,video,https://video.twimg.com/amplify_video/1968386763489001472/vid/avc1/1080x1920/h_wRiaKFLIDrs3Xs.mp4?tag=21
'1968360229286125958',"Yesterday, in my Maiden Speech, I talked about Bright Hope.

For me, Bright Hope is more than the church my grandmother attended— it’s a call to action, it’s what keeps me going in the darkest times. It’s a goal we set for ourselves as Americans. https://t.co/jksWC0YoPx",en,Tweet,7,142,42,44,27277,2025-09-17 18:03:43,"<a href=""https://mobile.twitter.com"" rel=""nofollow"">Twitter Web App</a>",,,video,https://video.twimg.com/amplify_video/1968359278076416000/vid/avc1/1080x1920/n71lA7AMhg-OTlym.mp4?tag=21
'1968321051634618436',Secretary Kennedy needs to go. https://t.co/pEUbLVZh4k,en,Tweet,1,62,16,36,2265,2025-09-17 15:28:03,"<a href=""https://mobile.twitter.com"" rel=""nofollow"">Twitter Web App</a>",,,photo,https://pbs.twimg.com/media/G1DhdrEXoAARWUZ.jpg
'1968035249167683803',I'm on the Senate Floor to deliver my maiden speech: Bright Hope for Our American Future. https://t.co/SOrneAaKm3,en,Tweet,7,146,29,47,34540,2025-09-16 20:32:22,"<a href=""https://studio.twitter.com"" rel=""nofollow"">Twitter Media Studio</a>",,https://x.com/i/broadcasts/1vAxRQjNeNqJl,,
'1968026422003589462',"I'm heading to the floor of the Senate to deliver my maiden speech.

Tune in! https://t.co/qGb1K5B96v",en,Tweet,1,31,3,2,937,2025-09-16 19:57:17,"<a href=""https://mobile.twitter.com"" rel=""nofollow"">Twitter Web App</a>",,,video,https://video.twimg.com/amplify_video/1968019135276646400/vid/avc1/1080x1920/GcgHPSoO67W83VQF.mp4?tag=21
'1967704908108534065',"It shouldn't be this hard for medical professionals - people caring for our kids, sick, and elderly - to get access to vaccines that will protect them and their patients.

This administration is making us sicker. https://t.co/gQdaDQN6iy",en,Tweet,0,7,4,6,538,2025-09-15 22:39:42,"<a href=""https://mobile.twitter.com"" rel=""nofollow"">Twitter Web App</a>",,,video,https://video.twimg.com/amplify_video/1967700353345781760/vid/avc1/1080x1920/ANT6yZQOrjOVheVZ.mp4?tag=21
'1967617702362771730',"For parents trying to keep their kids healthy and safe, accurate and consistent information is vital.

We need to continue doing all we can to ensure access to vaccines. https://t.co/HJzRs48NK5",en,Tweet,0,11,5,6,556,2025-09-15 16:53:11,"<a href=""https://mobile.twitter.com"" rel=""nofollow"">Twitter Web App</a>",,,video,https://video.twimg.com/amplify_video/1967615757203714048/vid/avc1/1080x1920/_nMBq_wW1rUH8_y4.mp4?tag=21
'1966906466868359267',"As we continue to process this dark and disturbing week, there can be no doubt: we need to come together, focused on keeping guns away from people who seek to carry out these senseless acts.

The safety of our communities demands that we stay in the fight to end gun violence.",en,Tweet,1,13,8,12,978,2025-09-13 17:46:59,"<a href=""https://mobile.twitter.com"" rel=""nofollow"">Twitter Web App</a>",,,,
'1966601731019608527',"DE is the lowest state in the nation and pollution in our air has caused serious harm to our communities' health.

This administration turning a blind eye to polluters won't stop rising sea levels or make our air safer to breathe.

It'll only make these problems harder to fix.",en,Tweet,0,12,3,5,1364,2025-09-12 21:36:05,"<a href=""https://mobile.twitter.com"" rel=""nofollow"">Twitter Web App</a>",,,,
'1966555522368254260',"But this is just the start.

Read the full report at: https://t.co/SuRh9IRQhS",en,Reply,0,5,3,0,416,2025-09-12 18:32:28,"<a href=""https://mobile.twitter.com"" rel=""nofollow"">Twitter Web App</a>",,https://www.bluntrochester.senate.gov/wp-content/uploads/2025/09/The-New-Way-Home-Full-Agenda.pdf,,
'1966555520254263382',"Smart tax policy will be key to unlocking the public-private partnerships we need to take on the housing crisis.

It's time for Congress to re-evaluate and modernize tried and tested policies to open new doors for first time homebuyers. https://t.co/7WONqVq3HV",en,Reply,0,4,3,1,480,2025-09-12 18:32:27,"<a href=""https://mobile.twitter.com"" rel=""nofollow"">Twitter Web App</a>",,,photo,https://pbs.twimg.com/media/G0p_rykXcAACY9n.jpg
'1966555517880250821',"Homeownership is a major wealth-building tool for the middle class.

We should be doing everything we can to extend those opportunities to more folks all across the country. https://t.co/GAIcQ6m8Qi",en,Reply,0,3,1,1,43,2025-09-12 18:32:26,"<a href=""https://mobile.twitter.com"" rel=""nofollow"">Twitter Web App</a>",,,photo,https://pbs.twimg.com/media/G0p-0l2WQAE_RAq.jpg
'1966555515493785879',"Taking on the housing crisis means prioritizing those facing the greatest housing challenges: seniors, veterans, people with disabilities, unhoused people, and people in rural communities.

We need to make easier for these folks to find – and retain – stable housing. https://t.co/DP4Kgg4wdC",en,Reply,0,3,0,1,34,2025-09-12 18:32:26,"<a href=""https://mobile.twitter.com"" rel=""nofollow"">Twitter Web App</a>",,,photo,https://pbs.twimg.com/media/G0p9ssaXUAAt_ux.jpg
'1966555513031688538',"Despite good intentions, public housing in America was set up to fail.

The laws that created these programs also reinforced segregation and permitted substandard construction.

In order to truly address this crisis, we need to invest in communities that have been left behind. https://t.co/5XOvYE0SGb",en,Reply,0,3,0,1,38,2025-09-12 18:32:25,"<a href=""https://mobile.twitter.com"" rel=""nofollow"">Twitter Web App</a>",,,photo,https://pbs.twimg.com/media/G0p8-z1W4AAv_Qh.jpg
'1966555510204686560',"For nearly 50 years, new housing construction in our country has declined.

It's time to take steps that will accelerate construction and expand housing supply. https://t.co/rRgGaHBLEe",en,Reply,0,4,0,1,41,2025-09-12 18:32:25,"<a href=""https://mobile.twitter.com"" rel=""nofollow"">Twitter Web App</a>",,,photo,https://pbs.twimg.com/media/G0p4x_wXkAAZxPy.jpg
'1966555508006846901',"We have a housing crisis in this country, and we need A New Way Home.

Here’s a look at my 5-pillar plan to leverage new and existing policy tools to make sure everyone in our communities has a safe, affordable place to call home.

🧵 https://t.co/LNpHgDWh8a",en,Tweet,0,15,6,9,1019,2025-09-12 18:32:24,"<a href=""https://mobile.twitter.com"" rel=""nofollow"">Twitter Web App</a>",,,photo,https://pbs.twimg.com/media/G0p4tFjWkAAXO2j.jpg
'1966510471348900283',"Let Me Be Blunt: RFK Jr should resign.

This ain’t political, it’s public health. https://t.co/PzJhgxvpyO",en,Tweet,0,31,9,7,836,2025-09-12 15:33:27,"<a href=""https://mobile.twitter.com"" rel=""nofollow"">Twitter Web App</a>",,,video,https://video.twimg.com/amplify_video/1966508160513871872/vid/avc1/1080x1920/VVuSeAU7_oCviiSI.mp4?tag=21
'1966258652794458542',"Our kids can’t learn if they’re home sick.

Take it from the president of the DE School Nurse Association: clear, science-based leadership is what keeps our kids in classrooms and our communities healthy. https://t.co/Ij0NCxwVQp",en,Tweet,0,6,3,3,738,2025-09-11 22:52:48,"<a href=""https://mobile.twitter.com"" rel=""nofollow"">Twitter Web App</a>",,,video,https://video.twimg.com/amplify_video/1966257303708966912/vid/avc1/1080x1920/wZp80gYlUifW9DLi.mp4?tag=21
'1966226234784063605',"Dangerous diseases don’t respect state boundaries.

If, God forbid, Florida has another outbreak - of COVID, measles, or even polio - how are neighboring states supposed to protect their communities? https://t.co/emCpPKTiOM",en,Tweet,0,13,10,5,804,2025-09-11 20:43:59,"<a href=""https://mobile.twitter.com"" rel=""nofollow"">Twitter Web App</a>",,,video,https://video.twimg.com/amplify_video/1966226131234729984/vid/avc1/1080x1920/1LcgWegwrWnWqpj_.mp4?tag=21
'1966208128870990095',"Thanks to RFK Jr, states are left to their own devices and the health of students depends on their ZIP code.

It's unacceptable— our kids and our communities deserve better. https://t.co/8w3mDXMXEq",en,Tweet,1,11,3,5,917,2025-09-11 19:32:02,"<a href=""https://mobile.twitter.com"" rel=""nofollow"">Twitter Web App</a>",,,video,https://video.twimg.com/amplify_video/1966207394356076544/vid/avc1/1080x1920/spuPWdTq7ZaHFslv.mp4?tag=21
'1966189489791070394',"When the president nominated RFK Jr to be the Secretary of Health and Human Services, @senatedems sounded the alarm. We were ignored.

This week, I brought parents, doctors, and legislators together to shine a light on just how harmful his leadership has been. https://t.co/Q9Dkn1o3z9",en,Tweet,0,14,5,4,708,2025-09-11 18:17:59,"<a href=""https://mobile.twitter.com"" rel=""nofollow"">Twitter Web App</a>",,,video,https://video.twimg.com/amplify_video/1966183405738971136/vid/avc1/1080x1920/1R58fZ-MI_jMAEuq.mp4?tag=21
'1966161736224092427',"Today, we take a moment to remember all those who lost their lives in the devastating 9/11 attacks and honor the first responders who stepped up to serve our communities.

We will never forget.",en,Tweet,0,16,7,1,790,2025-09-11 16:27:42,"<a href=""https://mobile.twitter.com"" rel=""nofollow"">Twitter Web App</a>",,,,
'1965873366088536075',"From Utah Valley University to Evergreen High School in Denver, we have seen tragic shootings at multiple schools, minutes apart. 

It's reprehensible. We owe our kids a future free from the fear of gun violence.",en,Tweet,1,37,13,16,8403,2025-09-10 21:21:49,"<a href=""https://mobile.twitter.com"" rel=""nofollow"">Twitter Web App</a>",,,,
'1965860813165805587',"Horrified by the shooting of Charlie Kirk and praying for his recovery. 

Political violence has no place in this country. It must be condemned in all forms.",en,Tweet,1,31,6,11,2665,2025-09-10 20:31:56,"<a href=""https://mobile.twitter.com"" rel=""nofollow"">Twitter Web App</a>",,,,
'1965489150603517958',"Communities across the country are facing a housing affordability crisis— we need to take action.

That's why last week, I released the blueprint for A New Way Home – to help people everywhere find safe, affordable places to call home.

Let's get to work.
https://t.co/QILn4VbMfQ",en,Tweet,0,9,3,8,738,2025-09-09 19:55:05,"<a href=""https://mobile.twitter.com"" rel=""nofollow"">Twitter Web App</a>",,https://delawarebusinesstimes.com/news/blunt-rochester-new-way-home/,,
'1965412647165411640',"Nothing about kicking millions off their health insurance, supercharging vaccine skepticism, or letting care costs skyrocket is ‘making America healthy again’.

This administration has been a disaster for our nation’s health, and RFK Jr has been at the head.

He needs to resign.",en,Tweet,0,30,11,11,1180,2025-09-09 14:51:05,"<a href=""https://mobile.twitter.com"" rel=""nofollow"">Twitter Web App</a>",,,,
'1965152655048892552',"We should demand that the people leading our nation’s energy policy have a basic understanding of how the technology they regulate works.

This is embarrassing.",en,Tweet,6,241,74,24,6425,2025-09-08 21:37:58,"<a href=""https://mobile.twitter.com"" rel=""nofollow"">Twitter Web App</a>",,,,
'1965116589466157107',"We shouldn’t accept that this administration can profile people who look a certain way, talk a certain way, or work a certain job as criminals. That presumption of guilt is fundamentally un-American.

We can't stand idly by in the face of this blatant attack on our civil rights.",en,Tweet,0,26,13,7,1493,2025-09-08 19:14:39,"<a href=""https://mobile.twitter.com"" rel=""nofollow"">Twitter Web App</a>",,,,
'1964056444778529197',"Let Me Be Blunt: I have big news.

We need to be tackling the housing crisis head-on, and today I release a sweeping agenda to do just that. Together, we’ll chart a path to a new way home. https://t.co/RMyFmM71h4",en,Tweet,0,14,9,26,677,2025-09-05 21:02:01,"<a href=""http://twitter.com/download/iphone"" rel=""nofollow"">Twitter for iPhone</a>",,,video,https://video.twimg.com/amplify_video/1964056060034965504/vid/avc1/1080x1920/g-LiFCwIuJDsw91d.mp4?tag=21
'1963943266686017857',"When BLS reported how bad this administration’s economy is, Trump fired the commissioner.

Now, as another weak jobs report looms, there are “technical difficulties” with the BLS site that publishes job data.

This admin can’t hide from their record, no matter how hard they try.",en,Tweet,0,13,7,10,1781,2025-09-05 13:32:17,"<a href=""http://twitter.com/download/iphone"" rel=""nofollow"">Twitter for iPhone</a>",,,,
'1963759100048646306',Kinda strange for the guy who wants a Nobel Peace Prize.,en,Tweet,1,150,21,8,8188,2025-09-05 01:20:28,"<a href=""http://twitter.com/download/iphone"" rel=""nofollow"">Twitter for iPhone</a>",,,,
'1963757770978504777',GO BIRDS!!,en,Tweet,0,9,2,1,1159,2025-09-05 01:15:12,"<a href=""http://twitter.com/download/iphone"" rel=""nofollow"">Twitter for iPhone</a>",,,,
'1963661414708425206',".@SenatorWarnock is right - In addition to RFK Jr's lack of credentials, his agenda is a threat to the health of the American people.
 
It's time for @SecKennedy to resign.

 https://t.co/zHz6GcWmUZ",en,Tweet,2,96,17,143,4530,2025-09-04 18:52:18,"<a href=""http://twitter.com/download/iphone"" rel=""nofollow"">Twitter for iPhone</a>",,,video,https://video.twimg.com/amplify_video/1963644916158140416/vid/avc1/1280x720/yl4dxJNOmeTFURka.mp4?tag=14
'1963237065904078925',"The Trump administration promised to bring down costs for everyday Americans, but day after day we see costs continue to rise.

They continue to prove they’re not looking out for everyday Americans, only their billionaire friends and donors.",en,Tweet,5,85,41,46,6530,2025-09-03 14:46:06,"<a href=""https://mobile.twitter.com"" rel=""nofollow"">Twitter Web App</a>",,,,
'1962999213546963322',"When congressional Republicans and the Trump administration forced through the largest health care cuts in history, they put hospitals up and down our state at risk.

They were so desperate to give rich people tax cuts, they made it harder for Americans everywhere to get care.",en,Tweet,0,30,15,30,3768,2025-09-02 23:00:57,"<a href=""https://mobile.twitter.com"" rel=""nofollow"">Twitter Web App</a>",,,,
'1961902773617762485',"Thanks to the mess this administration and RFK Jr. have created, many in our communities can't access the vaccines they need to keep themselves safe and healthy.

They’re not only failing to make us healthier, they’re actively putting lives at risk.

https://t.co/HGAY2f0rS6",en,Tweet,0,13,8,15,908,2025-08-30 22:24:06,"<a href=""https://mobile.twitter.com"" rel=""nofollow"">Twitter Web App</a>",,https://www.nytimes.com/2025/08/28/well/cvs-pharmacy-covid-vaccine-16-states.html,,
'1961480403954303434',"Decisions about how to spend your taxpayer dollars should be made by your representatives.

The Trump administration is trying to silence your voice, take Congress out of the picture, and make even deeper cuts to already-appropriated federal investments.

It’s unacceptable.",en,Tweet,3,91,34,68,4960,2025-08-29 18:25:45,"<a href=""https://mobile.twitter.com"" rel=""nofollow"">Twitter Web App</a>",,,,
'1961070562878341605',"We knew this was coming. This administration put totally unqualified children in charge of millions of Americans Social Security data.

This is yet another example of this administration putting the wellbeing of everyday Americans at risk in the name of ‘efficiency’.",en,Tweet,2,25,10,9,1480,2025-08-28 15:17:11,"<a href=""https://mobile.twitter.com"" rel=""nofollow"">Twitter Web App</a>",,,,
'1960816449360159153',"This is ridiculous. Just one month after her confirmation, the CDC Director has been fired.

If reports that her ouster is related to support of basic vaccine science, we should all be very concerned.",en,Tweet,1,20,10,4,1454,2025-08-27 22:27:26,"<a href=""https://mobile.twitter.com"" rel=""nofollow"">Twitter Web App</a>",,,,
'1960807355140243948',Hmm. https://t.co/A4tbgs8kuC,und,Tweet,1,69,19,4,3809,2025-08-27 21:51:18,"<a href=""https://mobile.twitter.com"" rel=""nofollow"">Twitter Web App</a>",,,photo,https://pbs.twimg.com/media/GzYv1STWMAA4dPZ.jpg
'1960767168540254471',"Lisa Cook's illegal firing is yet another attempt by this admin to denigrate public servants in favor of political loyalists tasked with covering up their struggling economy.

Stability &amp; impartiality in the Federal Reserve is critical.

This administration is threatening both.",en,Tweet,0,13,9,9,1121,2025-08-27 19:11:36,"<a href=""https://mobile.twitter.com"" rel=""nofollow"">Twitter Web App</a>",,,,
'1960750058292568405',"My prayers and condolences are with the students whose lives were taken and the community that will forever be marred by this senseless act of violence.

We don’t have to accept this as a part of daily life.

We can - and must - keep up the fight for commonsense gun safety laws.",en,Tweet,1,22,8,16,1456,2025-08-27 18:03:37,"<a href=""https://mobile.twitter.com"" rel=""nofollow"">Twitter Web App</a>",,,,
'1960450773839384747',"I'm glad Mr. Antoni will heed our calls to testify before our committee. Replacing the BLS head won’t change the reality that the economy is suffering.

If our businesses and trade partners can't trust the data we produce, the impact on our economy could be disastrous.",en,Tweet,0,16,7,8,1286,2025-08-26 22:14:22,"<a href=""https://mobile.twitter.com"" rel=""nofollow"">Twitter Web App</a>",,,,
'1960371112870547930',"The Trump administration has undone nearly ALL the progress we’ve made in over two decades since Hurricane Katrina.

As extreme weather becomes more frequent, dismantling systems that help us prepare and recover will have devastating consequences.",en,Tweet,0,18,5,7,1021,2025-08-26 16:57:49,"<a href=""https://mobile.twitter.com"" rel=""nofollow"">Twitter Web App</a>",,,,
'1960104158843089219',"RFK Jr. is continuing his crusade to undermine trust in the vaccines that keep our communities safe and healthy.

This isn’t making America healthier— there are no winners when we let deadly diseases go unchecked.",en,Tweet,0,26,8,13,1570,2025-08-25 23:17:03,"<a href=""https://mobile.twitter.com"" rel=""nofollow"">Twitter Web App</a>",,,,
'1959749418363830443',"Shutting this project down isn’t just bad for the planet, it’s bad for Americans’ bottom line.

As energy costs and demand for electricity continue to rise, taking power offline -just to score political points - is as shortsighted as it is harmful.",en,Tweet,2,59,18,13,3486,2025-08-24 23:47:26,"<a href=""http://twitter.com/download/iphone"" rel=""nofollow"">Twitter for iPhone</a>",,,,
'1958947870729544078',"Bad news: Delawareans who get their health insurance on the marketplace will be paying higher rates this coming year - the highest since the last time President Trump was in office.

And it’s directly because of actions taken by the Trump administration.
https://t.co/7G1jtTYzEa",en,Tweet,0,12,5,15,633,2025-08-22 18:42:22,"<a href=""https://mobile.twitter.com"" rel=""nofollow"">Twitter Web App</a>",,https://news.delaware.gov/2025/08/22/marketplace-health-insurance-rates-return-to-trump-era-highs/,,
'1956455144209424529',"President Trump's pick for BLS commissioner is an extremist with a history of peddling lies and manipulating data. His appointment would be devastating for our economy. 

I'm calling on Mr. Antoni to testify to the HELP Committee to explain his positions to the American people.",en,Tweet,1,28,12,21,2713,2025-08-15 21:37:10,"<a href=""https://mobile.twitter.com"" rel=""nofollow"">Twitter Web App</a>",,,,
