tweet_id,text,language,type,bookmark_count,favorite_count,retweet_count,reply_count,view_count,created_at,client,hashtags,urls,media_type,media_urls
'1940081794310652379',"Republicans just made it clear where they stand. By passing their big bad bill, they’re selling out working Americans and families everywhere to help those who need no extra help.

But make no mistake: We’ll never stop fighting to protect the people Republicans left behind today.",en,Tweet,0,10,8,4,553,2025-07-01 17:15:19,"<a href=""https://mobile.twitter.com"" rel=""nofollow"">Twitter Web App</a>",,,,
'1940066692165710013',"With the way they’re trying to rush this bill - handwritten notes, backroom deals, and all - it’s like they don’t want you to know what’s in it. That’s because they don’t.

This big bad bill sells out the American people, and they’re doing everything they can to sneak it through.",en,Tweet,0,29,14,5,2060,2025-07-01 16:15:18,"<a href=""https://mobile.twitter.com"" rel=""nofollow"">Twitter Web App</a>",,,,
'1939879189563228470',"There are plenty of words to describe Republicans' effort to cut off families’ access to health care, nutritious meals, home heating, and more.

Tonight I asked my @SenateDems colleagues to tell me one word they'd use. https://t.co/KCQzx6NuFs",en,Tweet,35,706,305,107,29521,2025-07-01 03:50:14,"<a href=""https://mobile.twitter.com"" rel=""nofollow"">Twitter Web App</a>",,,video,https://video.twimg.com/amplify_video/1939878946213867521/vid/avc1/1080x1920/gUNMweNvL5Ba_HnV.mp4?tag=21
'1939848742326136956',"They want to take health care away from enough people to fill Frawley Stadium 2,500 times.

No way. https://t.co/jkKfdOum5V",en,Tweet,2,18,7,2,1883,2025-07-01 01:49:15,"<a href=""https://mobile.twitter.com"" rel=""nofollow"">Twitter Web App</a>",,,photo,https://pbs.twimg.com/media/Guu6ES0XcAAlrdd.jpg
'1939787133775970579',"Today, Republicans rejected my amendment that would have protected Medicaid and access to maternal care. 

They could have stood up for moms and families, but chose to stand up for billionaires instead. https://t.co/DykXQTyYRu",en,Tweet,2,71,25,12,3104,2025-06-30 21:44:26,"<a href=""https://mobile.twitter.com"" rel=""nofollow"">Twitter Web App</a>",,,video,https://video.twimg.com/amplify_video/1939786915030401024/vid/avc1/1080x1920/Kd4mwA06_Nr5rxu4.mp4?tag=21
'1939392441813246044',"Republicans’ newest version of their Big Bad Budget bill cuts $100 billion MORE from Medicaid than the original.

It’s not just cruel, it makes no sense.

But this fight isn’t over. Keep making your voice heard, and together we’ll do everything we can to kill this bill.",en,Tweet,1,39,16,23,2666,2025-06-29 19:36:04,"<a href=""http://twitter.com/download/iphone"" rel=""nofollow"">Twitter for iPhone</a>",,,,
'1938653043303878984',"This decision further constrains the courts’ ability to serve as a check on an executive branch that continues to demonstrate its willingness to put political goals above the Constitution.
 
Trump’s hand-picked Justices just weakened our ability to stand up for our communities.",en,Tweet,1,13,10,22,1499,2025-06-27 18:37:58,"<a href=""https://mobile.twitter.com"" rel=""nofollow"">Twitter Web App</a>",,,,
'1938271658349105273',"For so many across the country on Medicaid, @PPFA  means access to reproductive care, cancer screenings, STD testing and treatment, and much more.

This disastrous ruling is going to cut millions of Americans off from the care they need.",en,Tweet,0,12,5,20,1306,2025-06-26 17:22:29,"<a href=""https://mobile.twitter.com"" rel=""nofollow"">Twitter Web App</a>",,,,
'1938262520239718855',"In our meeting, the nominee to lead the CDC told me she didn’t believe members of ACIP had conflicts of interest. 

Now, after RFK Jr. fired them all, she’s changed her tune.

We need to pass my VACCINE Act to prevent reckless leaders from putting our kids’ health at risk. https://t.co/OolvvCJP1A",en,Tweet,0,17,10,8,2775,2025-06-26 16:46:10,"<a href=""https://mobile.twitter.com"" rel=""nofollow"">Twitter Web App</a>",,,video,https://video.twimg.com/amplify_video/1938262296905531392/vid/avc1/1080x1920/U7fyK-tGpYJMLMfI.mp4?tag=21
'1937900994232250703',"ACIP exists to make sure vaccines are safe &amp; effective. By replacing experts with vaccine skeptics, RFK Jr. has undone the credibility of this nonpartisan panel and put public health at risk.

This meeting isn't about safety— it's a further effort to undermine faith in vaccines.",en,Tweet,0,9,5,8,1094,2025-06-25 16:49:36,"<a href=""https://mobile.twitter.com"" rel=""nofollow"">Twitter Web App</a>",,,,
'1937873974496526778',"Constituents have told me how Medicaid empowers them to hold jobs, live normal lives, and participate as full members of society. 

They’re not going to just “get over it.”

When we hear from people back home about policies we’re voting on, our job is to listen.",en,Tweet,0,6,5,2,768,2025-06-25 15:02:14,"<a href=""https://mobile.twitter.com"" rel=""nofollow"">Twitter Web App</a>",,,,
'1937618207092699529',"Three years ago today, American women woke up with fewer rights than our mothers &amp; grandmothers.

My @SenateDems colleagues &amp; I are on the Senate floor to shine a light on the state of reproductive rights in the aftermath of the Dobbs decision. 

Tune in: https://t.co/R3bln6X4Ae",en,Tweet,2,24,11,8,2040,2025-06-24 22:05:54,"<a href=""https://studio.twitter.com"" rel=""nofollow"">Twitter Media Studio</a>",,https://x.com/i/broadcasts/1BdGYqQmPnEGX,,
'1937592266794659947',"Republicans want a national abortion ban, but they can’t pass it outright, so they’re building one piece-by-piece.

It started 3 years ago with the Dobbs decision— but now they’re trying to go further.

Together, we’re fighting to make sure this is one puzzle they never finish.",en,Tweet,14,330,141,180,37163,2025-06-24 20:22:49,"<a href=""https://mobile.twitter.com"" rel=""nofollow"">Twitter Web App</a>",,,video,https://video.twimg.com/amplify_video/1937591732171866112/vid/avc1/1080x1920/Te3CFReFibD0CEVM.mp4?tag=21
'1936634349425770841',"The President’s unilateral military engagement in Iran without Congressional approval is illegal and could potentially move us closer to a war in the Middle East. Congress deserves answers regarding the facts that led to the decision to strike and what subsequent plans are in place to avoid retaliation and further escalation.

Tonight, we pray for the safety of Americans at home and abroad and call on the President to provide an immediate explanation to Congress.",en,Tweet,5,30,15,54,2341,2025-06-22 04:56:24,"<a href=""https://mobile.twitter.com"" rel=""nofollow"">Twitter Web App</a>",,,,
'1936539490828382363',Thank you to @TheDebcc for hosting their 5th Annual Juneteenth Celebration last night in Wilmington and for all they do for businesses in our state. https://t.co/IWbDTfFPN8,en,Tweet,0,7,3,1,845,2025-06-21 22:39:28,"<a href=""https://mobile.twitter.com"" rel=""nofollow"">Twitter Web App</a>",,,photo,https://pbs.twimg.com/media/Gt_4ZMTWQAArBPG.jpg
'1936454752037957868',"Had a great time at the @hbcuweek Awards Gala! 

Saw some familiar faces and celebrated the success of #HBCUWeek. https://t.co/d4sZwiyVy6",en,Tweet,0,17,2,5,865,2025-06-21 17:02:45,"<a href=""https://mobile.twitter.com"" rel=""nofollow"">Twitter Web App</a>",#HBCUWeek,,photo,"https://pbs.twimg.com/media/Gt-qqGXXwAAebKv.jpg,https://pbs.twimg.com/media/Gt-qZI2XcAAXwFd.jpg,https://pbs.twimg.com/media/Gt-qZ3JWwAASI7B.jpg,https://pbs.twimg.com/media/Gt-rGYLWYAAH6wx.jpg"
'1936420885524529423',"Proud to stand alongside women leaders from all corners of our country in this moment.

We’re speaking with one voice to make it clear: there is no place for political violence in our communities.

Together, we will demand - and create - a safer democracy.",en,Tweet,2,79,21,42,4428,2025-06-21 14:48:10,"<a href=""http://twitter.com/download/iphone"" rel=""nofollow"">Twitter for iPhone</a>",,,,
'1936148939410919930',"Thank you to @DelawareNG and General Benson for the lovely surprise this morning!

I’m always proud to support our National Guard in their work to keep our communities safe. https://t.co/GB4E9LOxjn",en,Tweet,0,31,4,2,947,2025-06-20 20:47:33,"<a href=""https://mobile.twitter.com"" rel=""nofollow"">Twitter Web App</a>",,,photo,https://pbs.twimg.com/media/Gt6U-bhWwAEtUMG.jpg
'1936077746524061891',"Was proud to be in Lewes yesterday to kick off the ‘Hate Has No Home Here’ Campaign.

We are in a dark moment in our history — a moment where the powerful are targeting the weak to divide us for their gain. But as long as groups like this come together, hate has no home. https://t.co/BEPriQuKCF",en,Tweet,0,11,7,6,689,2025-06-20 16:04:40,"<a href=""https://mobile.twitter.com"" rel=""nofollow"">Twitter Web App</a>",,,photo,"https://pbs.twimg.com/media/Gt5UaUhXkAAIC9y.jpg,https://pbs.twimg.com/media/Gt5UT97W8AA0yPd.jpg"
'1936038280442855732',"I felt the joy and spirit of the community in West Rehoboth at yesterday’s Juneteenth celebration.

It was great to celebrate with everyone! https://t.co/3ibyzTPlR4",en,Tweet,1,14,4,3,858,2025-06-20 13:27:50,"<a href=""https://mobile.twitter.com"" rel=""nofollow"">Twitter Web App</a>",,,photo,"https://pbs.twimg.com/media/Gt4wWDGXwAAdcd-.jpg,https://pbs.twimg.com/media/Gt4wdQEXoAAKiuh.jpg,https://pbs.twimg.com/media/Gt4wWDJWAAAukBI.jpg"
'1935849594405240961',"Up and down our state, Delawareans are commemorating Juneteenth. While we celebrate how far we’ve come on Freedom Day, let us not forget how far we have yet to go.

Happy Juneteenth, Delaware! https://t.co/Gz5bZrl48P",en,Tweet,0,49,9,22,1432,2025-06-20 00:58:04,"<a href=""https://mobile.twitter.com"" rel=""nofollow"">Twitter Web App</a>",,,photo,https://pbs.twimg.com/media/Gt2E5YvWIAAkt_5.jpg
'1935325023381897634',"This administration is openly advocating for discrimination at the @DeptVetAffairs for patients and providers alike.

It’s both cruel and dystopian that this president would deny our VETERANS care because they are unmarried or voted for his opponents.

https://t.co/oJPuXNZhOa",en,Tweet,1,35,10,11,2064,2025-06-18 14:13:36,"<a href=""https://mobile.twitter.com"" rel=""nofollow"">Twitter Web App</a>",,https://www.theguardian.com/us-news/2025/jun/16/va-doctors-refuse-treat-patients,,
'1935075671652368442',"10 years ago, a gunman motivated by racial hatred came into Mother Emanuel AME Church in Charleston and took nine lives. 

This solemn moment is a reminder how much work remains to end gun violence and disarm hate.",en,Tweet,0,16,4,4,737,2025-06-17 21:42:46,"<a href=""https://mobile.twitter.com"" rel=""nofollow"">Twitter Web App</a>",,,,
'1935045333559689377',"We knew RFK Jr’s record on vaccines and public health— it was part of the reason I voted against his confirmation. But our Republican colleagues believed his assurances.

Now that he’s gone back on his word, it’s time for them to join us and take action. https://t.co/9laveqtele",en,Tweet,0,20,8,6,784,2025-06-17 19:42:13,"<a href=""https://mobile.twitter.com"" rel=""nofollow"">Twitter Web App</a>",,,video,https://video.twimg.com/amplify_video/1935036440464744448/vid/avc1/1080x1920/a0CE51Mqpmd4xJ__.mp4?tag=21
'1935018829236629709',"I’m on the Senate floor to stand with @SenAlexPadilla.

This administration’s escalatory response to protests and accountability has been astounding. No one should be subject to violence simply for making their voice and the voices of their community heard.",en,Tweet,1,84,31,60,3395,2025-06-17 17:56:54,"<a href=""http://twitter.com/download/iphone"" rel=""nofollow"">Twitter for iPhone</a>",,,,
'1934667452450836507',"Looking forward to joining @BPC_Bipartisan’s #HousingSummit25 on Wednesday to talk about all we're doing to increase access to affordable housing across our nation.

Together we will increase supply, cut costs, and ensure that every American has a roof over their head.",en,Tweet,0,17,10,8,1940,2025-06-16 18:40:39,"<a href=""https://mobile.twitter.com"" rel=""nofollow"">Twitter Web App</a>",#HousingSummit25,,,
'1933960574070825373',"On behalf of all Delawareans, I am proud to stand alongside my fellow elected leaders - Democrat and Republican - to say that political violence has no place in America.

I urge everyone to participate in our democracy peacefully. https://t.co/8Nm7DT8tJO",en,Tweet,2,84,19,31,2129,2025-06-14 19:51:46,"<a href=""https://mobile.twitter.com"" rel=""nofollow"">Twitter Web App</a>",,,photo,https://pbs.twimg.com/media/GtbO3ZUW4AAih8n.jpg
'1933917634992447929',"This is a dark day.

Political violence has no place in our democracy. All of our leaders must stand united in condemning this terrible news out of Minnesota.

I am praying for the victims, their families, and their constituents as they process an unspeakable tragedy.",en,Tweet,0,123,22,76,5113,2025-06-14 17:01:09,"<a href=""https://mobile.twitter.com"" rel=""nofollow"">Twitter Web App</a>",,,,
'1933890273144369429',"This morning, we came together to declare that we love our country and know that in the United States of America, there are no kings! https://t.co/FTFT3XM0nG",en,Tweet,12,1053,152,972,30470,2025-06-14 15:12:25,"<a href=""https://mobile.twitter.com"" rel=""nofollow"">Twitter Web App</a>",,,photo,"https://pbs.twimg.com/media/GtaOzTHW8AA-sbV.jpg,https://pbs.twimg.com/media/GtaOunMWcAAhr7u.jpg"
'1933591631325692092',"My team and I are aware of the partial derailment in Bear this morning.

We have received no reports of spillage or injuries, but will continue to monitor the situation.",en,Tweet,0,15,6,1,1284,2025-06-13 19:25:43,"<a href=""https://mobile.twitter.com"" rel=""nofollow"">Twitter Web App</a>",,,,
'1933583408283738370',"Alongside our regional partners, we must remain committed to finding a diplomatic solution and work toward a path of safety and stability.

(3/3)",en,Reply,0,16,4,0,634,2025-06-13 18:53:03,"<a href=""https://mobile.twitter.com"" rel=""nofollow"">Twitter Web App</a>",,,,
'1933583406949876017',"Israel striking unilaterally during the Trump administration’s nuclear agreement negotiations is counterproductive and increases the risk of a full-scale regional war. 

I urge Prime Minister Netanyahu to show restraint and avoid escalation.

(2/3)",en,Reply,1,23,5,3,1078,2025-06-13 18:53:03,"<a href=""https://mobile.twitter.com"" rel=""nofollow"">Twitter Web App</a>",,,,
'1933583405502869960',"Israel’s latest military operation against Iran is concerning.

First and foremost, I am praying for the men and women stationed overseas, for their families, and for the civilians impacted by this strike.

(1/3)",en,Tweet,1,50,9,3,2649,2025-06-13 18:53:02,"<a href=""https://mobile.twitter.com"" rel=""nofollow"">Twitter Web App</a>",,,,
'1933512428576256102',"Are you a Delaware student who wants to get an up-close look at government and help us make an impact on people's lives?

Apply for a fall internship in my Delaware and DC offices today! https://t.co/CnCQjQ7V4r",en,Tweet,0,15,6,2,804,2025-06-13 14:11:00,"<a href=""https://mobile.twitter.com"" rel=""nofollow"">Twitter Web App</a>",,,photo,https://pbs.twimg.com/media/GtG-sZlXAAACiSz.jpg
'1933238641049923869',"This is a shocking video. I've texted @SenAlexPadilla to let him know that we support him and will speak out against this injustice. 

There is no excuse for this.
https://t.co/6fbWcN1Tan",en,Tweet,6,706,161,208,11423,2025-06-12 20:03:04,"<a href=""https://mobile.twitter.com"" rel=""nofollow"">Twitter Web App</a>",,https://x.com/i/status/1933222907398008912,,
'1933214240002719774',"Let Me Be Blunt: RFK is continuing his war on vaccines - this time firing all 17 members of the CDC's vaccine advisory panel.

Replacing them with hand-picked vaccine skeptics puts lives at risk— I'll do everything I can to investigate and reverse this decision. https://t.co/37YrcqWeh3",en,Tweet,4,118,33,34,3710,2025-06-12 18:26:06,"<a href=""https://mobile.twitter.com"" rel=""nofollow"">Twitter Web App</a>",,,video,https://video.twimg.com/amplify_video/1933213968580927488/vid/avc1/1080x1920/jQXO1vuyAdpDhH6c.mp4?tag=21
'1932911971025715380',"We're fighting this fight not just for the generations today who stand to lose jobs, homes, and health care if Republicans' cruel budget passes.

We're fighting this fight for the next generation— their future is on the line.

Kill this bill. https://t.co/tHzIMl3ZL7",en,Tweet,1,18,9,29,986,2025-06-11 22:25:00,"<a href=""https://mobile.twitter.com"" rel=""nofollow"">Twitter Web App</a>",,,video,https://video.twimg.com/amplify_video/1932903680509956096/vid/avc1/1080x1920/62aghAaH8KqJwYh3.mp4?tag=21
'1932836712956269012',"We’re fighting Republicans’ big, bad budget for people:

People who say ‘my energy costs are too high’– this bill raises costs

People who say ‘I need my job’– this cuts millions of jobs

People who say ‘I love my kids’– this puts their future at risk

We need to kill this bill. https://t.co/62qZxStYA8",en,Tweet,1,20,10,21,1790,2025-06-11 17:25:57,"<a href=""https://mobile.twitter.com"" rel=""nofollow"">Twitter Web App</a>",,,photo,"https://pbs.twimg.com/media/GtLQnOmWIAAsIzQ.jpg,https://pbs.twimg.com/media/GtLQoiJXkAIGLVr.jpg"
'1932790420423258184',"For countless Delawareans and folks across the country, Medicaid plays a vital role in everyday life.

This month, I called Emmanuel - who is able to work and pay rent thanks to Medicaid - and Nancy - whose son relies on Medicaid for long-term care - to hear their stories. https://t.co/lAanaak75L",en,Tweet,1,12,4,4,618,2025-06-11 14:22:00,"<a href=""https://mobile.twitter.com"" rel=""nofollow"">Twitter Web App</a>",,,video,https://video.twimg.com/amplify_video/1932546638712614913/vid/avc1/1080x1920/Q98SdimpDtnKgMZx.mp4?tag=21
'1932570470810825204',"As this administration continues to stoke fear and chaos around the country, don’t forget: if this big bad budget passes, millions of people lose health care and will go without food so the richest people in America can get another major tax break.",en,Tweet,0,17,5,7,785,2025-06-10 23:48:00,"<a href=""https://mobile.twitter.com"" rel=""nofollow"">Twitter Web App</a>",,,,
'1932516168876863663',"From firing on reporters to detaining them on-air, we’re seeing new levels of intimidation leveled at members of the press trying to hold this administration to account.

It’s totally unacceptable.",en,Tweet,15,448,121,39,37817,2025-06-10 20:12:13,"<a href=""https://mobile.twitter.com"" rel=""nofollow"">Twitter Web App</a>",,,,
'1932497571873714235',https://t.co/0KVIYFZaa8,zxx,Tweet,2,60,18,9,1944,2025-06-10 18:58:19,"<a href=""https://mobile.twitter.com"" rel=""nofollow"">Twitter Web App</a>",,,photo,https://pbs.twimg.com/media/GtGcEcUXMAAvJrN.jpg
'1932425012927136208',"We have a housing crisis in this country, and for our veterans the outlook is even worse.

Proud to introduce the Veterans Housing Stability Act with @SenatorRounds to keep veterans who are struggling to keep up with their mortgage in their homes.
https://t.co/Tam805keDq",en,Tweet,1,7,3,3,481,2025-06-10 14:10:00,"<a href=""https://mobile.twitter.com"" rel=""nofollow"">Twitter Web App</a>",,https://www.delawarepublic.org/politics-government/2025-06-07/sen-blunt-rochester-files-veterans-housing-bill,,
'1932208586933100824',"As the situation in California continues to develop, we’re seeing yet another example of this administration overstepping its authority, creating chaos, and suppressing opposition.

This is no way to lead a country. https://t.co/HnimHkF0f2",en,Tweet,3,66,18,70,2014,2025-06-09 23:50:00,"<a href=""https://mobile.twitter.com"" rel=""nofollow"">Twitter Web App</a>",,,video,https://video.twimg.com/amplify_video/1932196237794578432/vid/avc1/1080x1920/CL7q164s6-pFv1be.mp4?tag=21
'1932198878712869229',"For months, I’ve been pressing RFK Jr to restore our vaccine approval process after he delayed and obstructed this key body. He never responded.

Now, he’s dismissed every member without cause.

This is a dangerous, thoughtless decision with our communities’ health on the line.",en,Tweet,2,24,12,4,1445,2025-06-09 23:11:25,"<a href=""https://mobile.twitter.com"" rel=""nofollow"">Twitter Web App</a>",,,,
'1932185401030037785',"The last time the President tried to enforce his discriminatory travel ban, I was against it— today is no different.

These bans do nothing for the safety of American families, they only continue to stoke fear and mass disruption. This order should be reversed immediately.",en,Tweet,6,144,38,41,3145,2025-06-09 22:17:52,"<a href=""https://mobile.twitter.com"" rel=""nofollow"">Twitter Web App</a>",,,,
'1931417876021621004',"It’s my honor to nominate Delaware students to our nation's prestigious service academies every year.

Grateful to join @ChrisCoons and @Rep_McBride at our annual delegation Service Academy Night last night. https://t.co/M9s4bNilwx",en,Tweet,0,10,3,4,857,2025-06-07 19:28:00,"<a href=""https://mobile.twitter.com"" rel=""nofollow"">Twitter Web App</a>",,,photo,https://pbs.twimg.com/media/Gs2YkqcWgAAnHJF.jpg
'1931355784035663986',"In June 1776, Delaware declared independence not only from the British but also from Pennsylvania - and we haven’t looked back since.

Happy Separation Day, Delaware!",en,Tweet,2,62,7,8,1960,2025-06-07 15:21:16,"<a href=""https://mobile.twitter.com"" rel=""nofollow"">Twitter Web App</a>",,,,
'1931135515845341483',"Wishing many blessings to everyone starting the celebration of Eid al-Adha this evening.

In Delaware, across our nation, and around the world - Eid Mubarak!",en,Tweet,1,8,3,4,971,2025-06-07 00:46:00,"<a href=""https://mobile.twitter.com"" rel=""nofollow"">Twitter Web App</a>",,,,
'1931056685847838918',"Take it from the people administering these programs every day. Cuts to SNAP aren’t about eliminating waste, fraud, or abuse.

They’re about abandoning families who need help the most to give a massive tax break to those who need it least. https://t.co/Shfef1wKjM",en,Tweet,1,17,5,8,666,2025-06-06 19:32:45,"<a href=""https://mobile.twitter.com"" rel=""nofollow"">Twitter Web App</a>",,,video,https://video.twimg.com/amplify_video/1931056297257971712/vid/avc1/1080x1920/ZvgPnK68JS-lRZEJ.mp4?tag=21
'1930714902668128559',"SNAP is about giving families the tools they need to succeed – I know, because one of those families was mine.

I’ll never stop pushing back against Republican cuts to programs like this one so families across this country get the same chance I did. https://t.co/FAQip3WLCQ",en,Tweet,1,26,12,2,1012,2025-06-05 20:54:38,"<a href=""https://mobile.twitter.com"" rel=""nofollow"">Twitter Web App</a>",,,video,https://video.twimg.com/amplify_video/1930713642191687681/vid/avc1/1080x1920/dGglSR8JVNMCXJ47.mp4?tag=21
'1930657899375702466',"These efforts to erase our histories and relegate civil rights history-makers are despicable.

Try as they might, we’re not going back.",en,Tweet,2,25,8,7,1114,2025-06-05 17:08:07,"<a href=""https://mobile.twitter.com"" rel=""nofollow"">Twitter Web App</a>",,,,
'1930400673465864538',"Garnishing Social Security payments won’t speed up repayment, but it would be a catastrophe for countless seniors across the country.

I’m glad they backed down from this bad policy, but we can’t count on them to keep their word. Keep speaking out. Your voice matters. https://t.co/FElGJ55pr0",en,Tweet,0,29,18,7,921,2025-06-05 00:06:00,"<a href=""https://mobile.twitter.com"" rel=""nofollow"">Twitter Web App</a>",,,video,https://video.twimg.com/amplify_video/1930385258706276353/vid/avc1/1080x1920/vcYBOC7ik6MJ1XF3.mp4?tag=21
'1930372659763916828',"I was glad to welcome @alexismcgill from @PPFA to my office to talk about how we can work together to thwart Republicans’ backdoor abortion bans.

They’re trying to use their budget to go after reproductive care in states with protections, but we won’t stand by and let it happen. https://t.co/cJ8dr4d46W",en,Tweet,0,10,5,6,556,2025-06-04 22:14:41,"<a href=""https://mobile.twitter.com"" rel=""nofollow"">Twitter Web App</a>",,,photo,https://pbs.twimg.com/media/GsoPqGgWgAAqEOy.jpg
'1930278950510444715',"This assumption that people on Medicaid don’t want to work is just wrong.

For folks like my constituent Emmanuel, Medicaid is the lifeline they need to get and hold a job.

The best health care is health care.",en,Tweet,1,57,12,15,1956,2025-06-04 16:02:19,"<a href=""https://mobile.twitter.com"" rel=""nofollow"">Twitter Web App</a>",,,,
'1930263162751758541',"Every year, @ChrisCoons, @Rep_McBride, &amp; I have the honor of nominating outstanding Delaware students to our nation’s service academies.

Come join us in Dover on Friday to meet representatives of these prestigious institutions and learn more about the application process. https://t.co/EpiuMJfNXa",en,Tweet,0,7,1,1,517,2025-06-04 14:59:35,"<a href=""https://mobile.twitter.com"" rel=""nofollow"">Twitter Web App</a>",,,photo,https://pbs.twimg.com/media/GsmsGmPXkAAE5If.jpg
'1929372184763347308',"I am shocked and saddened by this act of hate in Boulder, Colorado. 

I’m praying for all those affected. As the investigation continues, we must all stand together in strongly condemning hate and antisemitism.",en,Tweet,1,22,4,15,2280,2025-06-02 03:59:09,"<a href=""http://twitter.com/download/iphone"" rel=""nofollow"">Twitter for iPhone</a>",,,,
