tweet_id,text,language,type,bookmark_count,favorite_count,retweet_count,reply_count,view_count,created_at,client,hashtags,urls,media_type,media_urls
'1897129173241749696',"Early results of the ""Make America Healthy Again"" campaign: https://t.co/bim42rEZLv",en,Tweet,3,44,16,10,1796,2025-03-05 03:36:56,"<a href=""https://mobile.twitter.com"" rel=""nofollow"">Twitter Web App</a>",,,photo,https://pbs.twimg.com/media/GlP07JoWgAANxMm.png
'1897128253334360255',"The *bipartisan* CHIPS and Science Act has brought billions in manufacturing investments in communities all across the country.

Republicans know that – they loudly cheered those investments.

This is what Trump wants to repeal?",en,Tweet,4,63,36,7,6107,2025-03-05 03:33:17,"<a href=""https://mobile.twitter.com"" rel=""nofollow"">Twitter Web App</a>",,,,
'1897121191204413933',"We should be doing everything we can to bring down grocery costs for families, not starting pointless trade wars to raise prices even further.

As the cost-of-living crisis gets even worse, it's clear @POTUS isn't looking out for our communities. https://t.co/lkuX8GFgUD",en,Tweet,0,22,6,10,997,2025-03-05 03:05:13,"<a href=""https://mobile.twitter.com"" rel=""nofollow"">Twitter Web App</a>",,,photo,https://pbs.twimg.com/media/GlPtTBjXEAA8kuw.jpg
'1897120072008917182',"Don't be fooled: every time he says ‘tariffs’, Trump is talking about alienating our allies and raising the cost of everything you buy.

He doesn’t care about you, he cares about the chaos he can use as a distraction to enrich himself and his friends.",en,Tweet,1,74,23,21,2756,2025-03-05 03:00:46,"<a href=""https://mobile.twitter.com"" rel=""nofollow"">Twitter Web App</a>",,,,
'1897119713232331021',"During his first term, Trump ran up the national debt giving his rich friends massive tax breaks.

Now in his second term, he wants to pay for another huge tax cut by slashing your Medicare, Medicaid, and Social Security.

This time is different, and so much worse.",en,Tweet,1,38,14,18,2445,2025-03-05 02:59:21,"<a href=""https://mobile.twitter.com"" rel=""nofollow"">Twitter Web App</a>",,,,
'1897118202393702494',"Federal workers who show up every day looking for ways to improve the lives of people all across the country deserve better than the treatment they’ve received from this administration.

Playing games with the lives of hard working public servants isn’t efficiency, it’s cruelty.",en,Tweet,0,28,11,3,1237,2025-03-05 02:53:20,"<a href=""https://mobile.twitter.com"" rel=""nofollow"">Twitter Web App</a>",,,,
'1897094426528522380',"Dr. Wallace has dedicated her life to becoming the best public servant for our kids and families. But a week after receiving a glowing performance review, she was fired.

Please, take two minutes to hear her share the human impact of Trump’s thoughtless ‘chainsaw’ approach. https://t.co/fJAF6OHKlE",en,Tweet,2,40,9,3,1507,2025-03-05 01:18:52,"<a href=""https://mobile.twitter.com"" rel=""nofollow"">Twitter Web App</a>",,,video,https://video.twimg.com/ext_tw_video/1897093318670008320/pu/vid/avc1/1080x1920/ZEI-qhWn4RD2njrL.mp4?tag=14
'1897041545557385562',"This is yet another installment in Trump’s long history of demeaning the brave men and women who served in our nation’s armed forces.

It's insult to cruel injury for the thousands of veterans who now find themselves unemployed at the hands of this administration.",en,Tweet,2,37,8,15,1969,2025-03-04 21:48:44,"<a href=""https://mobile.twitter.com"" rel=""nofollow"">Twitter Web App</a>",,,,
'1897017331060236744',"My guest for tonight’s address is a fired federal worker from Middletown. Unlike the DOGE boys, her job was actually making sure your tax dollars are spent efficiently.

Trump is focused on letting billionaires win and families lose, and we’re all at risk as a result. https://t.co/T4myR1fEL1",en,Tweet,0,41,11,24,1358,2025-03-04 20:12:31,"<a href=""https://mobile.twitter.com"" rel=""nofollow"">Twitter Web App</a>",,,video,https://video.twimg.com/ext_tw_video/1897016700211449856/pu/vid/avc1/1080x1920/ZQfRYYByq1dN9-DV.mp4?tag=14
'1896702665238966590',"For the kids, parents, teachers, and schools across Delaware that rely on the Department of Education, I’m headed to the Senate floor to vote 'no' on Linda McMahon’s nomination. https://t.co/pLUDNebW0t",en,Tweet,13,480,82,106,38031,2025-03-03 23:22:09,"<a href=""https://mobile.twitter.com"" rel=""nofollow"">Twitter Web App</a>",,,video,https://video.twimg.com/ext_tw_video/1896702443884363776/pu/vid/avc1/1080x1920/0IxzcNsnbf11uAp7.mp4?tag=14
'1896209630692606207',"Today and every day, we celebrate everything that makes the First State so special.

Happy 302 Day, Delaware! https://t.co/JZCcRI7PKE",en,Tweet,1,69,22,9,2111,2025-03-02 14:43:00,"<a href=""https://mobile.twitter.com"" rel=""nofollow"">Twitter Web App</a>",,,photo,https://pbs.twimg.com/media/Gk-ZZygWIAA8jL2.jpg
'1895946647705972818',"There’s no question, we have a lot of work ahead of us, and the fight to improve the lives of hardworking families is never-ending.

But among the hard work and hardship, it’s absolutely vital we don’t forget to acknowledge the moments of joy. https://t.co/8kH1uVrN99",en,Tweet,2,44,12,8,1269,2025-03-01 21:18:00,"<a href=""https://mobile.twitter.com"" rel=""nofollow"">Twitter Web App</a>",,,video,https://video.twimg.com/ext_tw_video/1895901584539656192/pu/vid/avc1/1080x1920/FmvLch_1z72nbcC6.mp4?tag=14
'1895900433996267558',"As we get settled into our new office here in the Senate, my team and I are so excited to welcome our first class of Senate interns!

Are you a Delaware student who wants to get an up-close look at government and help us make an impact on people's lives? Apply today! https://t.co/YTOhQRffqK",en,Tweet,1,62,17,10,1818,2025-03-01 18:14:22,"<a href=""https://mobile.twitter.com"" rel=""nofollow"">Twitter Web App</a>",,,photo,https://pbs.twimg.com/media/Gk-XQLPXQAAuvuX.jpg
'1895597668711481806',"Using the bully pulpit doesn’t actually mean being a bully. 

This is a totally unreasonable way to conduct diplomacy, and a disgraceful way to treat an ally. We should all be standing with Ukraine as they continue their fight on the frontline of democracy.",en,Tweet,2,94,28,29,3529,2025-02-28 22:11:17,"<a href=""http://twitter.com/download/iphone"" rel=""nofollow"">Twitter for iPhone</a>",,,,
'1895574441914188261',"It’s about the impact.

Sat down with my Sister Senator @Sen_Alsobrooks to talk about the importance of this moment and our shared determination to make an impact for our communities. https://t.co/0T92FXokuF",en,Tweet,1,14,6,9,941,2025-02-28 20:38:59,"<a href=""https://mobile.twitter.com"" rel=""nofollow"">Twitter Web App</a>",,,video,https://video.twimg.com/ext_tw_video/1895574249651236864/pu/vid/avc1/1080x1920/8DUjxKrxso1jOsLg.mp4?tag=14
'1895514926006808895',"It's almost that time again! The Delaware Delegation Youth Conference, is coming up on May 19 in Dover.

Looking forward to joining @ChrisCoons and @Rep_McBride to host some of the best and brightest DE students around! For more information contact DEYouthConference@coons.senate.gov",en,Tweet,0,6,2,1,636,2025-02-28 16:42:29,"<a href=""https://mobile.twitter.com"" rel=""nofollow"">Twitter Web App</a>",,,photo,https://pbs.twimg.com/media/Gk44n7jXsAA9g3V.jpg
'1895499753015878074',"The last time we lost a child to measles in this country was 2003. My heart goes out to all the families affected by the ongoing outbreak.

This terrible disease making a comeback is NOT normal. We need and deserve leaders who understand the urgency of this moment.",en,Tweet,3,54,17,11,2379,2025-02-28 15:42:12,"<a href=""https://mobile.twitter.com"" rel=""nofollow"">Twitter Web App</a>",,,,
'1895257285989138873',"Big news, Delaware! Tomorrow is the big day—we’re moving into our permanent office here in the Senate!
 
We can’t wait to welcome Delawareans to our new home away from home. Stay tuned for the big reveal! https://t.co/KoozlAbiVW",en,Tweet,10,236,32,15,5080,2025-02-27 23:38:43,"<a href=""https://mobile.twitter.com"" rel=""nofollow"">Twitter Web App</a>",,,video,https://video.twimg.com/ext_tw_video/1895256933776420864/pu/vid/avc1/540x960/lFrGdzcVULw7io1r.mp4?tag=12
'1895201858651856994',"From breathable air to drinkable water, Delawareans rely on the staff at @EPA to protect our valuable natural resources and keep our communities healthy.

This proposal is outrageous— rolling back decades of progress.

Unacceptable.",en,Tweet,2,38,12,4,1651,2025-02-27 19:58:28,"<a href=""https://mobile.twitter.com"" rel=""nofollow"">Twitter Web App</a>",,,,
'1895178425318678693',"The Trump administration claims they want to protect American workers.

But staying silent as thousands of federal workers are intimidated and fired isn't what 'putting American workers first' looks like. https://t.co/gBATJpajsk",en,Tweet,3,77,18,15,1743,2025-02-27 18:25:21,"<a href=""https://mobile.twitter.com"" rel=""nofollow"">Twitter Web App</a>",,,video,https://video.twimg.com/ext_tw_video/1895177620360163328/pu/vid/avc1/720x1280/jqDUwPS4SFdGlY2U.mp4?tag=12
'1894878777479700933',"The way this administration has intimidated and mistreated thousands of dedicated federal workers is unacceptable, and I'm fighting to hold them accountable.

Grateful to the workers who stopped me in the hall to discuss how, together, we can stand up to the chaos. https://t.co/w579hpDHHj",en,Tweet,3,139,20,19,2409,2025-02-26 22:34:40,"<a href=""https://mobile.twitter.com"" rel=""nofollow"">Twitter Web App</a>",,,video,https://video.twimg.com/ext_tw_video/1894878556871663616/pu/vid/avc1/360x640/b9_1L44NZDiDtD_f.mp4?tag=12
'1894784809169285240',"Last night, House Republicans passed a bill to slash programs that deliver health care and food to poor kids and families all across the country while cutting taxes for their ultra-rich friends.

The American people voted for lower costs and safer communities, not this cruelty.",en,Tweet,3,55,24,16,2489,2025-02-26 16:21:16,"<a href=""https://mobile.twitter.com"" rel=""nofollow"">Twitter Web App</a>",,,,
'1894522827539116301',"America’s veterans answered the call to serve our nation but now, thanks to the Trump admin's reckless cuts, there's no one to answer those veterans' calls when they need help.

Listen to how one former CFPB employee describes what that means for our veterans and their families. https://t.co/XqnPyuLKKy",en,Tweet,10,180,76,91,31238,2025-02-25 23:00:15,"<a href=""https://mobile.twitter.com"" rel=""nofollow"">Twitter Web App</a>",,,video,https://video.twimg.com/ext_tw_video/1894519796936433664/pu/vid/avc1/1080x1920/5tpjC6t0BIfh80v0.mp4?tag=14
'1894497939566854625',"We may have made history, but we are really here to make an impact.

So proud to be serving with my sister senator, @Sen_Alsobrooks! https://t.co/WyYIltraBS",en,Tweet,4,134,31,2,4380,2025-02-25 21:21:21,"<a href=""https://mobile.twitter.com"" rel=""nofollow"">Twitter Web App</a>",,,photo,https://pbs.twimg.com/media/Gkqa7OuW8AAlE2s.jpg
'1894468938680902129',"Mass, indiscriminate firings of our scientists, engineers, and researchers are a risk to our national security and economic competitiveness.

Any person tasked with leading the Office of Science and Technology Policy should be able to admit that. https://t.co/BkcNJRRlTa",en,Tweet,2,19,8,4,723,2025-02-25 19:26:07,"<a href=""https://mobile.twitter.com"" rel=""nofollow"">Twitter Web App</a>",,,video,https://video.twimg.com/ext_tw_video/1894468407652757504/pu/vid/avc1/720x1280/O9K2to7kzLe1ixz6.mp4?tag=12
'1894197260092645624',"Today marks 3 years since Russia’s unprovoked invasion of Ukraine.

Countless lives have been lost in Ukraine’s fight for freedom, sovereignty, and democracy. 

I continue to stand with Ukraine and call for an end to Russia’s aggression.",en,Tweet,0,54,20,12,1406,2025-02-25 01:26:33,"<a href=""http://twitter.com/download/iphone"" rel=""nofollow"">Twitter for iPhone</a>",,,,
'1894146973898351066',"Since its founding, The Connect has been focused on educating, empowering, &amp; retaining young professionals here in Delaware.

It was great to be at their Inaugural Young Professionals Gala this weekend in Wilmington to celebrate all they do for our community. https://t.co/1m0SRbUnW0",en,Tweet,1,27,5,3,999,2025-02-24 22:06:44,"<a href=""https://mobile.twitter.com"" rel=""nofollow"">Twitter Web App</a>",,,photo,"https://pbs.twimg.com/media/GklcjUkWgAAhf8X.jpg,https://pbs.twimg.com/media/GklcW80WwAAVZrO.jpg,https://pbs.twimg.com/media/GklcXtIXkAATSFl.jpg"
'1893749689176011000',"🚨Happening tomorrow!🚨

@ChrisCoons, @Rep_McBride, and I will be hosting a virtual town hall tomorrow at 12:30pm. With so much going on in Washington these last few weeks, we want to hear directly from you. 

Sign up here ⤵️ 
https://t.co/QrXtRTnpTA https://t.co/InCauIHJgE",en,Tweet,0,14,7,3,1016,2025-02-23 19:48:04,"<a href=""http://twitter.com/download/iphone"" rel=""nofollow"">Twitter for iPhone</a>",,https://docs.google.com/forms/d/e/1FAIpQLScJjLJzFlC3nxcgzBV7bkaXlvZ40B2QPoUTarXyhPS70GGQhg/viewform,photo,https://pbs.twimg.com/media/GkfzTiNXcAAgzcn.jpg
'1893436385820115197',"I was proud to be at Delaware Technical Community College in Dover today to celebrate National TRIO Day and 60 years of the TRIO Programs!

Over the last six decades, these programs have propelled millions of students to new heights, breaking barriers on the way to achieving incredible success.",en,Tweet,1,17,6,4,984,2025-02-22 23:03:07,"<a href=""https://mobile.twitter.com"" rel=""nofollow"">Twitter Web App</a>",,,photo,"https://pbs.twimg.com/media/GkbUGHRWMAEutIV.jpg,https://pbs.twimg.com/media/GkbT4QfX0AAB99y.jpg,https://pbs.twimg.com/media/GkbT5EMXwAAg3BA.jpg,https://pbs.twimg.com/media/GkbT59JWcAEeIc3.jpg"
'1893035746618925142',"These NIH funding cuts threaten research happening in Delaware on heart disease, cancer, diabetes, stroke recovery, &amp; more.

This is what this administration is focused on. Not lowering your household costs.
https://t.co/bl3FjiCXpB",en,Tweet,1,16,10,10,803,2025-02-21 20:31:07,"<a href=""https://mobile.twitter.com"" rel=""nofollow"">Twitter Web App</a>",,https://delawarebusinesstimes.com/insider-only/life-science-nih-funding/,,
'1893003633328803967',"This morning, around 4:15 am, I put forth an amendment to the Senate Republicans' budget that would have addressed the wrongful termination of federal employees who protect the health and safety of Americans. 
 
Republicans voted it down. https://t.co/XpSbgxxckT",en,Tweet,1,55,21,9,1678,2025-02-21 18:23:31,"<a href=""https://mobile.twitter.com"" rel=""nofollow"">Twitter Web App</a>",,,video,https://video.twimg.com/ext_tw_video/1893002747819040768/pu/vid/avc1/1280x720/fl2qky-nG0uOTVw0.mp4?tag=12
'1892804971663442189',"It’s a little past 11:30 PM and we’re about to vote on my amendment to protect our health care workforce.

I want to see if Republicans care about keeping Americans safe and healthy or passing a tax cut for billionaires. https://t.co/eXSV1yp5rM",en,Tweet,0,115,17,13,2043,2025-02-21 05:14:06,"<a href=""https://mobile.twitter.com"" rel=""nofollow"">Twitter Web App</a>",,,video,https://video.twimg.com/ext_tw_video/1892804508415045632/pu/vid/avc1/360x640/b3BQObDL74LDcvm1.mp4?tag=12
'1892729584359010313',"Hey Delaware, wanted to share a quick update as the Senate heads into a long night.

We are doing what’s called a vote-a-rama where we’ll vote on several amendments to the Republicans’ partisan budget.

Stay tuned! https://t.co/YGRw1gARgn",en,Tweet,2,70,19,6,1845,2025-02-21 00:14:32,"<a href=""https://mobile.twitter.com"" rel=""nofollow"">Twitter Web App</a>",,,video,https://video.twimg.com/ext_tw_video/1892727525979136000/pu/vid/avc1/360x640/J5hIeQaW7f6ZRsMn.mp4?tag=12
'1892689188086075852',"Republicans are passing a bill to cut Medicaid so Trump and his billionaire friends can pay for their tax cuts.

This means ripping health care away from millions to lower taxes for the ultra wealthy.

This isn't what Americans meant when they said they wanted lower costs. https://t.co/7EKhVEFrBo",en,Tweet,0,20,10,10,993,2025-02-20 21:34:01,"<a href=""https://mobile.twitter.com"" rel=""nofollow"">Twitter Web App</a>",,,photo,https://pbs.twimg.com/media/GkQuxdnXIAEez7L.png
'1892366890040783080',"A quick update on our @HELPCmteDems hearing to examine Trump's pick to lead the Department of Labor earlier today.

I hope she is as committed to protecting our nation’s workers as I am. https://t.co/xsim2AhUCb",en,Tweet,2,25,10,31,1227,2025-02-20 00:13:19,"<a href=""https://mobile.twitter.com"" rel=""nofollow"">Twitter Web App</a>",,,video,https://video.twimg.com/ext_tw_video/1892366374191652864/pu/vid/avc1/360x640/PZUfK18EHN6i7xKY.mp4?tag=12
'1892303504514879500',"Poultry farming is huge in Delaware and as we contend with outbreaks of the avian flu, it is critical that our farmers don’t pay the price.

I'm proud to cosponsor this bipartisan bill with @ChrisCoons to provide our farmers a lifeline. https://t.co/N5P3QL9e5O",en,Tweet,0,16,8,2,737,2025-02-19 20:01:27,"<a href=""https://mobile.twitter.com"" rel=""nofollow"">Twitter Web App</a>",,https://www.coastalpoint.com/news/business/agriculture/coons-wicker-introduce-bill-to-protect-poultry-growers-against-avian-flu-outbreaks/article_65f13640-eafb-11ef-9e82-a7cfc3237cb0.html,,
'1892270999745274304',"How it started: President Trump promised that he would bring down food prices on day one of his presidency.

How it’s going: Egg prices are at a record high.
https://t.co/QmrccRmRh2",en,Tweet,0,31,10,17,1285,2025-02-19 17:52:17,"<a href=""https://mobile.twitter.com"" rel=""nofollow"">Twitter Web App</a>",,https://www.wdel.com/news/us-eggs-prices-hit-a-record-high-of-4-95-and-are-likely-to-keep/article_7085935b-8a12-51a6-8d16-f788fc5fdc26.html/,,
'1891643643611513277',"The American people deserve answers immediately.

Who was fired and why? 

Dismissing critical staff from the FAA has dangerous implications.
https://t.co/TrNqOjE9Dz",en,Tweet,10,479,184,39,8941,2025-02-18 00:19:24,"<a href=""http://twitter.com/download/iphone"" rel=""nofollow"">Twitter for iPhone</a>",,https://apnews.com/article/doge-faa-air-traffic-firings-safety-67981aec33b6ee72cbad8dcee31f3437,,
'1890555478721065044',"Read my full statement ⤵️
https://t.co/NkUyQlGSt2",en,Reply,0,9,5,12,952,2025-02-15 00:15:25,"<a href=""https://mobile.twitter.com"" rel=""nofollow"">Twitter Web App</a>",,https://www.bluntrochester.senate.gov/press-releases/senator-blunt-rochester-statement-on-illegal-cuts-to-nih-threatening-lifesaving-research-at-universities/,,
'1890555477513130284',"I am deeply concerned that the President and his unelected billionaire friend are illegally cutting funding for lifesaving medical research administered through the National Institutes of Health (NIH).

We cannot and will not sacrifice research for recklessness.",en,Tweet,2,178,43,47,6176,2025-02-15 00:15:25,"<a href=""https://mobile.twitter.com"" rel=""nofollow"">Twitter Web App</a>",,,,
'1890503276778385747',"I am proud of our federal workers. I've heard from many of them about the unacceptable chaos and mistreatment they've experienced over the past several weeks.

I was glad to meet with @AFGENational District 3 and express my commitment to protecting our dedicated public servants. https://t.co/cn9eZ1Rpr0",en,Tweet,0,63,13,10,1557,2025-02-14 20:47:59,"<a href=""https://mobile.twitter.com"" rel=""nofollow"">Twitter Web App</a>",,,photo,https://pbs.twimg.com/media/Gjxqnd1WUAAgwz5.jpg
'1890486927721124137',"The @DEWGCAP represents the future of the growing aviation opportunities in Delaware, including at @DelStateUniv.

It was great to host these outstanding future aviators in the Capitol this week. I look forward to working in the Senate to support the Civil Air Patrol. https://t.co/TBZhDhYF0e",en,Tweet,0,26,6,4,911,2025-02-14 19:43:01,"<a href=""https://mobile.twitter.com"" rel=""nofollow"">Twitter Web App</a>",,,photo,"https://pbs.twimg.com/media/GjxbwWgXcAA8LhF.jpg,https://pbs.twimg.com/media/GjxbsJZXEAA97me.jpg"
'1890473207708160061',"This administration wants to cut HALF of our housing workforce at HUD while we are in the middle of a housing crisis.

They are solely focused on creating more problems, not solving them.",en,Tweet,1,54,14,10,2781,2025-02-14 18:48:30,"<a href=""https://mobile.twitter.com"" rel=""nofollow"">Twitter Web App</a>",,,,
'1890452415154946359',"Seven years ago today, our nation witnessed the horrific shooting at Marjory Stoneman Douglas High School in Florida. What was supposed to be a day filled with love turned into a day of heartbreak.

As we join the Parkland community in mourning and remembering the 17 lives lost, let us recommit to stopping gun violence and its terrible cycle of tragedy across our nation.",en,Tweet,0,28,5,5,1162,2025-02-14 17:25:53,"<a href=""https://mobile.twitter.com"" rel=""nofollow"">Twitter Web App</a>",,,,
'1890177871395872887',"No school that receives federal funding should be able to turn a student away based on their race or ethnicity, or because they have a disability. https://t.co/azkrt0Ug2j",en,Tweet,3,72,20,24,2023,2025-02-13 23:14:57,"<a href=""https://mobile.twitter.com"" rel=""nofollow"">Twitter Web App</a>",,,video,https://video.twimg.com/ext_tw_video/1890177469971415040/pu/vid/avc1/1280x720/EbW5yvfHAsQFUN-O.mp4?tag=12
'1889749099034923448',"Day 23 update.

The headline speaks for itself. https://t.co/xSnXTtdSQO",en,Tweet,2,79,23,47,5781,2025-02-12 18:51:09,"<a href=""https://mobile.twitter.com"" rel=""nofollow"">Twitter Web App</a>",,,photo,https://pbs.twimg.com/media/Gjm8aHdXAAE1fPM.jpg
'1889430923768480027',"Providing a high-quality education for our future generations is among our greatest responsibilities.

And understanding how our students are doing and what they need to be successful is invaluable, not wasteful.

They need to stop playing games with our schools.",en,Tweet,0,26,9,27,2266,2025-02-11 21:46:50,"<a href=""https://mobile.twitter.com"" rel=""nofollow"">Twitter Web App</a>",,,,
'1889409546684342391',"Created during the Great Depression, the FDIC is critical to the security of our banking system.

Along with their team of billionaires, the Trump Administration wants to ensure the FDIC can't properly do its job.

My colleagues &amp; I are demanding answers. https://t.co/vs3zXiJQeS",en,Tweet,10,355,115,609,46292,2025-02-11 20:21:54,"<a href=""https://mobile.twitter.com"" rel=""nofollow"">Twitter Web App</a>",,https://www.cnbc.com/2025/02/11/elizabeth-warren-fdic-staffing-shortages-put-banking-system-at-risk.html?utm_campaign=trueanthem&utm_medium=social&utm_source=linkedin%7Cmain,,
'1889090449547112583',Thank you all so much for the birthday wishes! Here's to another year of serving Delaware. ❤️ https://t.co/1k5holhZQk,en,Tweet,14,593,64,25,24487,2025-02-10 23:13:55,"<a href=""https://mobile.twitter.com"" rel=""nofollow"">Twitter Web App</a>",,,video,https://video.twimg.com/ext_tw_video/1889090179173842944/pu/vid/avc1/720x1280/rO2vzRYyTMr6tehC.mp4?tag=12
'1889005292400320823',"Hey Delaware, #TeamLBR here. 

Please join us in wishing a very happy birthday to the one and only, Senator LBR! 🎂🎉 https://t.co/ClD0BeYFax",en,Tweet,1,165,19,24,3558,2025-02-10 17:35:32,"<a href=""https://mobile.twitter.com"" rel=""nofollow"">Twitter Web App</a>",#TeamLBR,,photo,https://pbs.twimg.com/media/GjcYKnCWQAArcEl.jpg
'1888799176328134888',SUPER BOWL CHAMPIONS!! 🦅🏆 https://t.co/wMpErgBwGT,en,Tweet,4,147,11,6,3261,2025-02-10 03:56:30,"<a href=""http://twitter.com/download/iphone"" rel=""nofollow"">Twitter for iPhone</a>",,,video,https://video.twimg.com/amplify_video/1888799120841658368/vid/avc1/360x640/rbeOVcOa3JbG3OKv.mp4?tag=16
'1888789948054347947',GO BIRDS! 🦅🦅🦅,en,Tweet,2,115,13,3,3252,2025-02-10 03:19:50,"<a href=""http://twitter.com/download/iphone"" rel=""nofollow"">Twitter for iPhone</a>",,,,
'1888724601271685596',"Delaware, I’m ready. Are you ready?

#FlyEaglesFly on the road to #SuperBowl victory! 🦅🦅 https://t.co/4GwpprKeBs",en,Tweet,3,161,22,8,4358,2025-02-09 23:00:10,"<a href=""https://mobile.twitter.com"" rel=""nofollow"">Twitter Web App</a>","#FlyEaglesFly,#SuperBowl",,video,https://video.twimg.com/ext_tw_video/1888724212275167232/pu/vid/avc1/360x640/yICSX1ysvDwnlPiv.mp4?tag=12
'1888710041056039112',"It was a pleasure to attend the MLK Voice 4 Youth finals today in Wilmington.

I am so proud of these outstanding students and their inspiring perspectives on Dr. King’s legacy. https://t.co/Y2EeqT3hEz",en,Tweet,0,42,3,3,1254,2025-02-09 22:02:18,"<a href=""https://mobile.twitter.com"" rel=""nofollow"">Twitter Web App</a>",,,photo,"https://pbs.twimg.com/media/GjYLBbSWIAA0GEU.jpg,https://pbs.twimg.com/media/GjYK1kpXIAA17UN.jpg,https://pbs.twimg.com/media/GjYK2gMW0AAaS3f.jpg"
'1887995717287035310',"The Treasury's systems handle your sensitive personal & financial info, as well as trillions of dollars in Social Security payments for retirees & tax refunds for families.

We want answers on who has access to these systems & what they are doing with them. https://t.co/hAsjDa5oMh",en,Tweet,2,63,18,35,2540,2025-02-07 22:43:50,"<a href=""https://mobile.twitter.com"" rel=""nofollow"">Twitter Web App</a>",,,,
'1887922097684414787',"This week, our bipartisan Promoting Resilient Supply Chains Act was passed out of @commercedems.

We must fix our broken supply chains to lower costs, create jobs, strengthen our economy, be more competitive, &amp; bolster our national security. https://t.co/ewhvqZlL2p",en,Tweet,0,14,7,4,1081,2025-02-07 17:51:18,"<a href=""https://mobile.twitter.com"" rel=""nofollow"">Twitter Web App</a>",,https://www.axios.com/pro/tech-policy/2025/02/05/senate-commerce-advances-kids-online-safety-supply-chain-bills,,
