tweet_id,text,language,type,bookmark_count,favorite_count,retweet_count,reply_count,view_count,created_at,client,hashtags,urls,media_type,media_urls
'1917648461299868129',"Joining @SenateDems on the steps of the Capitol to highlight how the first 100 days of the Trump administration have been nothing but bad news for our families, communities, and future.

Tune in:
https://t.co/RE86qzFMM2",en,Tweet,2,12,4,5,737,2025-04-30 19:33:16,"<a href=""https://mobile.twitter.com"" rel=""nofollow"">Twitter Web App</a>",,https://x.com/i/broadcasts/1eaKbWlazavGX,,
'1917614984487375022',"Today we're marking Second Chance month by announcing the reintroduction of the Clean Slate Act.

This bipartisan bill will offer a fresh start to those who have served their time and paid their debt. It’s about jobs, housing, and education – and offering people a second chance. https://t.co/zAZaKWg7Nb",en,Tweet,1,27,8,5,1038,2025-04-30 17:20:14,"<a href=""https://mobile.twitter.com"" rel=""nofollow"">Twitter Web App</a>",,,photo,"https://pbs.twimg.com/media/Gpy7x5SWMAE2x0W.jpg,https://pbs.twimg.com/media/Gpy7x50WIAAvM_k.jpg,https://pbs.twimg.com/media/Gpy7x54WMAQcHVw.jpg"
'1917585393618125047',"Heartbroken by the tragedy that took place on the @UDelaware campus yesterday. 

I'm praying for the family, friends, and loved ones of the student who lost their life and for the other community members who were injured to make a full recovery.

https://t.co/HtajKTXBrg",en,Tweet,1,10,3,2,764,2025-04-30 15:22:39,"<a href=""https://mobile.twitter.com"" rel=""nofollow"">Twitter Web App</a>",,https://www.newarkpostonline.com/news/ud-student-killed-eight-people-injured-in-main-street-crash-involving-u-haul-van/article_d33cab47-efcc-4192-9023-de2499d7e576.html,,
'1917566270393680186',"Excited to announce the reintroduction of my bipartisan bill, the Clean Slate Act, outside the Capitol this morning.

Tune in: https://t.co/JTzKfBHGmY",en,Tweet,0,19,7,3,1387,2025-04-30 14:06:40,"<a href=""https://studio.twitter.com"" rel=""nofollow"">Twitter Media Studio</a>",,https://x.com/i/broadcasts/1yNGaLABkkEKj,,
'1917283791858544988',"Let Me Be Blunt: today marks 100 days of this administration, and it's been nothing but chaos, confusion, and uncertainty.

Here are ten major ways they've made life worse for American families ⬇️ https://t.co/4lsOTk5FVx",en,Tweet,36,769,282,2266,69173,2025-04-29 19:24:12,"<a href=""https://mobile.twitter.com"" rel=""nofollow"">Twitter Web App</a>",,,video,https://video.twimg.com/amplify_video/1917283053656805376/vid/avc1/1080x1920/Wn0cZJcEtRd0Ksgh.mp4?tag=16
'1916955185496154455',"Was proud to join the sit-in at the Capitol as a reminder that as we face a Republican budget that threatens our communities, we can't forget where the power comes from.

The power of the people will always be greater than the people in power. Let's make sure we let 'em know. https://t.co/Y5JC2ZL2aB",en,Tweet,3,142,37,314,9485,2025-04-28 21:38:26,"<a href=""https://mobile.twitter.com"" rel=""nofollow"">Twitter Web App</a>",,,video,https://video.twimg.com/amplify_video/1916954888895893505/vid/avc1/1080x1920/-QZsZEljSE7yi3cS.mp4?tag=16
'1916623442461495454',"Just spent a few hours on the steps of the capitol with @SenBooker and @RepJeffries as people from all across the country shone a light on the harms of the Republicans' budget.

There are all sorts of ways for you to show up in this moment— all you're called to do is your part. https://t.co/ibsw5MOZer",en,Tweet,5,442,112,471,16987,2025-04-27 23:40:12,"<a href=""https://mobile.twitter.com"" rel=""nofollow"">Twitter Web App</a>",,,video,https://video.twimg.com/amplify_video/1916623170427117568/vid/avc1/1080x1920/tTj6OTYkR5oB6nOA.mp4?tag=16
'1916582544293691697',"Just joined @SenBooker and @RepJeffries on the steps of the capitol.

Tune in:",en,Tweet,2,182,45,183,9851,2025-04-27 20:57:41,"<a href=""http://twitter.com/download/iphone"" rel=""nofollow"">Twitter for iPhone</a>",,,,
'1916196612646326527',"I’m thankful to all the Delawareans who showed up today to make their voices heard at our town hall.

In this moment, everyone has a role to play to defend our democracy.

As your elected officials, we are working together to hold this administration accountable &amp; fight for you. https://t.co/1UPL4GLgzk",en,Tweet,1,117,21,27,2960,2025-04-26 19:24:08,"<a href=""https://mobile.twitter.com"" rel=""nofollow"">Twitter Web App</a>",,,photo,"https://pbs.twimg.com/media/GpeyNQSWoAEnFbI.jpg,https://pbs.twimg.com/media/GpeymrSWcAARmF3.jpg"
'1916139220487258295',"Our Delaware delegation town hall is starting now! 

Tune in:
https://t.co/Vw9BIpGyJH",en,Tweet,1,23,14,9,2167,2025-04-26 15:36:04,"<a href=""https://mobile.twitter.com"" rel=""nofollow"">Twitter Web App</a>",,https://www.youtube.com/watch?v=1b_N6hPBet4,,
'1916137375333552179',"Saddened to learn that Alexis Herman, our first Black Secretary of Labor, has passed.

Her deep sense of justice guided her efforts to uplift workers, empower women, and fight for racial and economic equality.

Her memory will be an inspiration for generations to come.",en,Tweet,0,15,6,0,720,2025-04-26 15:28:45,"<a href=""https://mobile.twitter.com"" rel=""nofollow"">Twitter Web App</a>",,,,
'1915833489707933819',"The Trump administration is now trying to use the FBI to go after judges they don’t like.

Make no mistake: this is an administration relentlessly attacking the judicial system to stifle opposition and get their way. This is a red-alert moment.",en,Tweet,45,2966,979,2382,90345,2025-04-25 19:21:13,"<a href=""https://mobile.twitter.com"" rel=""nofollow"">Twitter Web App</a>",,,,
'1915528816023294424',"Today is Yom HaShoah - Holocaust Remembrance Day.

I join those around the world in remembering the atrocities of the Holocaust and the millions of people - including 6 million Jews - who were killed in one of humanity’s darkest and most evil acts.",en,Tweet,1,23,12,6,1192,2025-04-24 23:10:33,"<a href=""https://mobile.twitter.com"" rel=""nofollow"">Twitter Web App</a>",,,,
'1915467805052592379',"My deepest condolences are with @RepMcGovern and his family as they mourn the loss of their daughter, Molly.

I pray that they find strength in this tremendously challenging time and that everyone who knew and loved Molly will find space to celebrate her memory.",en,Tweet,0,17,3,0,1187,2025-04-24 19:08:07,"<a href=""https://mobile.twitter.com"" rel=""nofollow"">Twitter Web App</a>",,,,
'1915413565588033849',"They stripped the Education Department of all the programs to help our kids and kept the parts that go after borrowers already struggling to make ends meet.

Let’s be clear: They’re selling out families everywhere to pay for their billionaire tax cuts.",en,Tweet,9,424,157,588,21946,2025-04-24 15:32:35,"<a href=""https://mobile.twitter.com"" rel=""nofollow"">Twitter Web App</a>",,,,
'1915123250515812485',"Pete Hegseth’s consistent irresponsible mishandling of sensitive information endangers our national security. 

I said it before and I’ll say it again, he is not qualified to lead our military.",en,Tweet,1,30,11,6,799,2025-04-23 20:18:58,"<a href=""https://mobile.twitter.com"" rel=""nofollow"">Twitter Web App</a>",,,,
'1914830392944701921',"This Earth Day, take a moment to appreciate the beautiful place we call home. From our beaches to our farms, our outdoor spaces make Delaware a truly special place.
 
I’ll never stop working to protect our communities and secure a livable planet for future generations. https://t.co/Ucn7O3iS6E",en,Tweet,1,26,5,4,807,2025-04-23 00:55:16,"<a href=""http://twitter.com/download/iphone"" rel=""nofollow"">Twitter for iPhone</a>",,,photo,https://pbs.twimg.com/media/GpLYF7fXcAAwXsT.jpg
'1914348929900040383',"Pope Francis led with compassion and humility as he worked to protect our planet and the most vulnerable people on it.

Today we come together to mourn his loss, honor his memory and celebrate his life.",en,Tweet,0,26,3,3,760,2025-04-21 17:02:06,"<a href=""https://mobile.twitter.com"" rel=""nofollow"">Twitter Web App</a>",,,,
'1913983441378435504',"Happy Easter, Delaware!

Wishing everyone celebrating across our state a blessed day of joy and reflection.",en,Tweet,0,58,9,5,1327,2025-04-20 16:49:47,"<a href=""https://mobile.twitter.com"" rel=""nofollow"">Twitter Web App</a>",,,,
'1913635052358955339',"Thank you to Network Connect for a great evening celebrating authenticity, transparency, and the power of community.

Congratulations to all my fellow awardees! https://t.co/WJTrxAbJbK",en,Tweet,1,13,6,6,823,2025-04-19 17:45:24,"<a href=""http://twitter.com/download/iphone"" rel=""nofollow"">Twitter for iPhone</a>",,,photo,"https://pbs.twimg.com/media/Go6Y728W4AAPLNC.jpg,https://pbs.twimg.com/media/Go6Y72-W8AEYaDI.jpg"
'1913222029282619686',"Public housing is a lifeline for countless families working hard every single day to keep a roof over their head.

With Trump's tariffs driving up the cost of everything from groceries to housing supplies, deep cuts to the public housing system would be a catastrophe.",en,Tweet,0,13,6,8,1446,2025-04-18 14:24:12,"<a href=""https://mobile.twitter.com"" rel=""nofollow"">Twitter Web App</a>",,,,
'1912968307512066158',The Supreme court must uphold the 14th Amendment and protect citizenship for children born in America.,en,Tweet,0,43,14,3,1891,2025-04-17 21:36:00,"<a href=""https://mobile.twitter.com"" rel=""nofollow"">Twitter Web App</a>",,,,
'1912945462417719692',"From a university in Florida to a high school in Texas, our communities can't escape the horrors of gun violence— my heart is with everyone affected by school shootings this week.

Heartbreaking reminders that there's still work to be done in the fight to end gun violence.",en,Tweet,0,15,5,8,885,2025-04-17 20:05:13,"<a href=""https://mobile.twitter.com"" rel=""nofollow"">Twitter Web App</a>",,,,
'1912935340186452330',"Some people ask, what good does sending a letter do? In this case, the answer is: a lot.

Here's how sending a letter to @CommerceGov Secretary Lutnick scored a big win for manufacturers and small businesses across Delaware. https://t.co/whMuXjhXPb",en,Tweet,0,40,12,4,1113,2025-04-17 19:25:00,"<a href=""https://mobile.twitter.com"" rel=""nofollow"">Twitter Web App</a>",,,video,https://video.twimg.com/amplify_video/1912917044896419840/vid/avc1/1080x1920/cFmqtEgJ-yGKxxq-.mp4?tag=16
'1912900109584474526',"The Ramble represents an amazing vision for the redevelopment of the Broad Creek waterfront.

From clean water and green infrastructure to workforce development and an unbelievable new park – there are exciting things happening in Laurel!",en,Tweet,1,16,5,2,795,2025-04-17 17:05:00,"<a href=""http://twitter.com"" rel=""nofollow"">Twitter Web Client</a>",,,photo,"https://pbs.twimg.com/media/GovcQ8IW4AEPKXr.jpg,https://pbs.twimg.com/media/GovcQ8KWUAAZeVJ.jpg,https://pbs.twimg.com/media/GovcTF7W0AA10pR.jpg"
'1912858650198024464',"Visited Laurel High School for important conversations with both students and educators about how we can best support our kids.

Great to be back home in Delaware! https://t.co/D2ZuUNjdcc",en,Tweet,0,29,9,7,705,2025-04-17 14:20:16,"<a href=""https://mobile.twitter.com"" rel=""nofollow"">Twitter Web App</a>",,,video,https://video.twimg.com/amplify_video/1912858438247317504/vid/avc1/1080x1920/G8mg7cKRvo8jMNFs.mp4?tag=16
'1912271717080395874',"Thank you to @HJmedicalcenter for the opportunity to see their care work firsthand and for shining a light on how devastating cuts to Medicaid would be to their patients.

These cuts aren’t just a numbers game - there are lives on the line. https://t.co/IsEj6Erha6",en,Tweet,1,16,6,6,834,2025-04-15 23:28:00,"<a href=""https://mobile.twitter.com"" rel=""nofollow"">Twitter Web App</a>",,,photo,"https://pbs.twimg.com/media/GomjQ0wXgAAy4uQ.jpg,https://pbs.twimg.com/media/GomjQ0-XQAEYacP.jpg,https://pbs.twimg.com/media/GomjQ0vWUAE0zai.jpg,https://pbs.twimg.com/media/GomjQ0pXoAAS1vf.jpg"
'1912198431788994884',"You might have heard about the Trump administration's decision to halt 19 truckloads of food destined for @FoodBankofDE.

This morning, I was in Newark talking to their team about the impacts of this terrible decision, and what we can do to look out for our fellow Delawareans. https://t.co/3ZuXXeCVFJ",en,Tweet,0,25,5,10,939,2025-04-15 18:36:47,"<a href=""https://mobile.twitter.com"" rel=""nofollow"">Twitter Web App</a>",,,video,https://video.twimg.com/amplify_video/1912197600721137665/vid/avc1/540x960/xz4Ze_CdkOnmR9aD.mp4?tag=16
'1911859133629759912',"This administration is getting bolder in its defiance of the Courts and we should all be alarmed.

From refusing to return a mistakenly deported man to denying freedom of the press, their dangerous ignorance of checks and balances threatens our nation's very foundation.",en,Tweet,186,13505,3391,3388,356400,2025-04-14 20:08:32,"<a href=""https://mobile.twitter.com"" rel=""nofollow"">Twitter Web App</a>",,,,
'1911829610817265978',"Grateful to know that @GovernorShapiro and his family are safe this morning. What happened last night at the Governor's Residence is outrageous and unacceptable.

In this moment, it's on all of us to make clear that violence has no place in our politics and our communities. https://t.co/vpn5K5nkB9",en,Tweet,1,11,6,15,1548,2025-04-14 18:11:13,"<a href=""https://mobile.twitter.com"" rel=""nofollow"">Twitter Web App</a>",,,photo,https://pbs.twimg.com/media/Goguv3IW8AAFoPL.jpg
'1911209296190222672',Wishing a happy Passover to all the Delawareans gathering around the Seder table this evening!,en,Tweet,0,25,5,4,1347,2025-04-13 01:06:19,"<a href=""http://twitter.com/download/iphone"" rel=""nofollow"">Twitter for iPhone</a>",,,,
'1910815496951521574',"As stories swirl about the housing crisis we face and prices going up, I’m working across the aisle to bring your costs down.

I just introduced my bipartisan Housing Supply Frameworks Act to help our cities and towns build more affordable housing and lower housing costs. https://t.co/mrTSvRsO8Y",en,Tweet,2,38,11,16,1445,2025-04-11 23:01:30,"<a href=""https://mobile.twitter.com"" rel=""nofollow"">Twitter Web App</a>",,,video,https://video.twimg.com/amplify_video/1910814918250467328/vid/avc1/1080x1920/DYo8Sl_Z0TJz2bUb.mp4?tag=16
'1910794227404914913',"I just introduced my first bill as your Senator to help our communities build more housing and bring down housing costs.

I know the housing crisis is top of mind for Delawareans, and I'm working across the aisle to do something about it. https://t.co/FpaWGNbegL",en,Tweet,2,14,9,4,2302,2025-04-11 21:36:59,"<a href=""https://mobile.twitter.com"" rel=""nofollow"">Twitter Web App</a>",,,photo,https://pbs.twimg.com/media/GoSBAVgXgAANBEP.jpg
'1910787331105472817',"A new poll shows that more than 70% of Americans worried about their finances.
 
This President doesn't care about the hard choices families have to make when money gets tight – he's never had to make them.
 
He may not care, but I'll never stop fighting to bring down costs.",en,Tweet,0,14,10,7,968,2025-04-11 21:09:35,"<a href=""https://mobile.twitter.com"" rel=""nofollow"">Twitter Web App</a>",,,,
'1910459827991544176',"It’s unbelievable that this administration’s bar for success is ‘avoiding a depression.’

They’re fine setting your retirement savings on fire and leaving millions of families to fend for themselves. https://t.co/aTTnVK9EVv",en,Tweet,0,24,8,12,1050,2025-04-10 23:28:12,"<a href=""https://mobile.twitter.com"" rel=""nofollow"">Twitter Web App</a>",,,photo,https://pbs.twimg.com/media/GoNQ0bhW0AElUs9.jpg
'1910422168178921924',"What happened to bringing down the cost of eggs on “day one”?

With this administration, it’s broken promise after broken promise.",en,Tweet,0,30,8,16,2005,2025-04-10 20:58:33,"<a href=""https://mobile.twitter.com"" rel=""nofollow"">Twitter Web App</a>",,,,
'1910379180052619744',"Republicans just took another step to advance their terrible budget – threatening care for nearly 250,000 Delawareans to give their super-rich friends a massive tax break.

It’s unacceptable, and I won't stop fighting to lessen the blow of this bad deal on our communities.",en,Tweet,0,24,8,6,1060,2025-04-10 18:07:44,"<a href=""https://mobile.twitter.com"" rel=""nofollow"">Twitter Web App</a>",,,,
'1910097749095182453',"When I heard my brother in law was being honored as a Lung Force Hero here at the Capitol, I made sure I could be there.

I'm proud to stand with @LungAssociation to support people living with lung cancer and I'll always fight to protect access to care. https://t.co/1KbCNBmfOI",en,Tweet,0,22,5,1,673,2025-04-09 23:29:25,"<a href=""https://mobile.twitter.com"" rel=""nofollow"">Twitter Web App</a>",,,photo,"https://pbs.twimg.com/media/GoIHEECWgAESAvd.jpg,https://pbs.twimg.com/media/GoIHEEIXIAAazLh.jpg,https://pbs.twimg.com/media/GoIHEEAXEAAGYDe.jpg"
'1910071604706677021',"This administration just brought us to the brink of a global economic meltdown only to change their mind at the drop of a hat.

This chaos is on brand. America’s success depends on stability – this is no way to govern.",en,Tweet,1,46,12,12,1326,2025-04-09 21:45:32,"<a href=""https://mobile.twitter.com"" rel=""nofollow"">Twitter Web App</a>",,,,
'1909733529992257686',"The EPA needs a strong, experienced counsel to help make sure our environmental laws are enforced and our vital natural resources are protected.

This administration doesn’t care about any of that. That’s why they appointed someone completely unqualified.",en,Tweet,1,21,8,7,1489,2025-04-08 23:22:09,"<a href=""https://mobile.twitter.com"" rel=""nofollow"">Twitter Web App</a>",,,,
'1909624926845214859',"This is a stark look at what this administration’s economic policy means for the vast majority of families across this country.

The ultra-rich get even richer while the rest get crushed. https://t.co/XieiCZkutE",en,Tweet,0,18,6,9,816,2025-04-08 16:10:36,"<a href=""https://mobile.twitter.com"" rel=""nofollow"">Twitter Web App</a>",,,photo,https://pbs.twimg.com/media/GoBZc8ZXIAErERM.jpg
'1909309086543344078',"This is a cartoonish waste of taxpayers’ money and abuse of government resources.

If only there was a department looking into this sort of thing.🤔",en,Tweet,2,64,30,13,3513,2025-04-07 19:15:34,"<a href=""https://mobile.twitter.com"" rel=""nofollow"">Twitter Web App</a>",,,,
'1909252631525990569',"For as long as I've been in Congress, I've been working to give those who have served their time &amp; paid their debt to society a second chance &amp; a clean slate.

April is Second Chance Month, a chance to redouble our commitment to this bipartisan work - let's get it done.",en,Tweet,0,18,4,5,685,2025-04-07 15:31:14,"<a href=""https://mobile.twitter.com"" rel=""nofollow"">Twitter Web App</a>",,,,
'1908994829012336844',".@ymcade's @DelawareYIG program does an incredible job helping students learn about our government.

These are challenging times, but our young people are our future. I can’t wait to see all they go on to achieve in our state and beyond! https://t.co/3XXuF8Z5xv",en,Tweet,0,19,5,4,886,2025-04-06 22:26:49,"<a href=""https://mobile.twitter.com"" rel=""nofollow"">Twitter Web App</a>",,,photo,"https://pbs.twimg.com/media/Gn4cmjHXkAA_Wj9.jpg,https://pbs.twimg.com/media/Gn4ca5eWMAABnQA.jpg,https://pbs.twimg.com/media/Gn4ca5hXMAAhpNm.jpg,https://pbs.twimg.com/media/Gn4ca6EW8AA99rl.jpg"
'1908515541175726408',"While you were asleep, Republicans forced through their terrible budget.

They rejected amendments to protect access to Social Security, support grants that fund Meals on Wheels, and direct tax breaks to working families.

More proof of where their priorities are. https://t.co/6lBAXRTd02",en,Tweet,3,58,21,41,1973,2025-04-05 14:42:18,"<a href=""https://mobile.twitter.com"" rel=""nofollow"">Twitter Web App</a>",,,video,https://video.twimg.com/ext_tw_video/1908515327866019840/pu/vid/avc1/720x1280/O0Xm9Cug8Po7o2SO.mp4?tag=12
'1908358431460761617',"Ever wonder how we keep things moving during all night votes? Here's a behind the scenes look.

I'll be running around the capitol tonight to make sure my colleagues and I are on the floor, holding the line, and fighting for you. https://t.co/BOqCx60JY0",en,Tweet,5,142,32,23,2574,2025-04-05 04:18:00,"<a href=""https://mobile.twitter.com"" rel=""nofollow"">Twitter Web App</a>",,,video,https://video.twimg.com/ext_tw_video/1908343660799803392/pu/vid/avc1/1080x1920/eC9ceUqpw8yejukF.mp4?tag=14
'1908282263441465574',"The cost of a home is the sum of the cost of the materials used to build it. Thanks to the Trump admin, we're seeing costs of everything from foundations to roofs skyrocket.

This budget will worsen our housing crisis, and I went to the floor to urge my colleagues to vote no. https://t.co/hRnbp9ybbu",en,Tweet,1,19,11,5,706,2025-04-04 23:15:20,"<a href=""https://mobile.twitter.com"" rel=""nofollow"">Twitter Web App</a>",,,video,https://video.twimg.com/ext_tw_video/1908282043307368448/pu/vid/avc1/1080x1920/sKzRiIi_JDk-E6mK.mp4?tag=14
'1908246962278982047',"I just offered an amendment to this terrible Republican budget bill to keep housing costs from skyrocketing.

My colleagues and I won't stop trying to lessen the blow of this bad budget on American families.

Stay tuned, it's going to be a long night. https://t.co/ArrCjSth6f",en,Tweet,6,300,83,332,10263,2025-04-04 20:55:03,"<a href=""https://mobile.twitter.com"" rel=""nofollow"">Twitter Web App</a>",,,video,https://video.twimg.com/ext_tw_video/1908246625673256960/pu/vid/avc1/1080x1920/BdhLmZy994FQiqpI.mp4?tag=14
'1908213394592747971',"I'm headed to the Senate Floor to speak on my amendment aimed at preventing this harmful republican budget from raising material costs and making our housing crisis worse.
 
Tune in: https://t.co/n3nRekr70L",en,Tweet,0,17,7,7,684,2025-04-04 18:41:40,"<a href=""https://studio.twitter.com"" rel=""nofollow"">Twitter Media Studio</a>",,https://x.com/i/broadcasts/1lPJqMlWRbZJb,,
'1907922511356100633',"We're waiting on Senate Republicans to figure out how they want to push through their massive billionaire tax cut.

They're worried because so many of you have raised your voice and stood up to their efforts to rob Social Security, Medicare, Medicaid.

Keep it up. https://t.co/W4AYrRQEhA",en,Tweet,1,142,43,83,3358,2025-04-03 23:25:48,"<a href=""https://mobile.twitter.com"" rel=""nofollow"">Twitter Web App</a>",,,video,https://video.twimg.com/ext_tw_video/1907922275212328960/pu/vid/avc1/720x1280/o13uWrQJcD5HX7Wn.mp4?tag=12
'1907857854494568586',"This administration’s economic leadership has been a disaster.

He promised to bring down costs on day one – instead, he’s tanking the economy and threatening your retirement.",en,Tweet,0,12,8,10,1083,2025-04-03 19:08:53,"<a href=""https://mobile.twitter.com"" rel=""nofollow"">Twitter Web App</a>",,,,
'1907565204864741678',So good to welcome Delaware students from @Gateway_Lab to the Capitol today! https://t.co/FyoFlXEsGl,en,Tweet,1,9,4,2,705,2025-04-02 23:46:00,"<a href=""https://mobile.twitter.com"" rel=""nofollow"">Twitter Web App</a>",,,photo,"https://pbs.twimg.com/media/Gnj2shBWoAALF9O.jpg,https://pbs.twimg.com/media/Gnj2shJWkAAhCkM.jpg,https://pbs.twimg.com/media/Gnj2sigXgAAkjdJ.jpg"
'1907518374072168469',"We should all be able to call out the dangerous mismanagement of sensitive information.

Proud to join my colleagues in calling on @AGPamBondi to do the right thing, investigate this Signal chat security breach, and hold accountable all those responsible.",en,Tweet,1,21,6,8,1036,2025-04-02 20:39:55,"<a href=""https://mobile.twitter.com"" rel=""nofollow"">Twitter Web App</a>",,,,
'1907492243675484558',"Nothing more liberating than the beginning of a recession.

These careless Trump tariffs are going to send costs for Americans through the roof, and they want to celebrate. https://t.co/o4EQzMmggR",en,Tweet,1,12,8,3,609,2025-04-02 18:56:05,"<a href=""https://mobile.twitter.com"" rel=""nofollow"">Twitter Web App</a>",,,photo,https://pbs.twimg.com/media/GnjFw6gXEAAUZoi.jpg
'1907456220622938333',"This isn't efficient. This isn't helping patients or providers.

This is chaos and cruelty that will hurt the health of our communities.

Also, it's just a horrible way to treat good people who signed up to serve their country.",en,Tweet,1,40,13,9,1679,2025-04-02 16:32:56,"<a href=""https://mobile.twitter.com"" rel=""nofollow"">Twitter Web App</a>",,,,
'1907250484219416750',"I’m inspired by my friend @SenBooker. He stood up for the American people over the last 24 hours, and we must be clear about why it was necessary. 

He raised the alarm and shined a light on the harm already caused by this administration.

Now, we work to redeem the dream. https://t.co/TbmwvHrZS1",en,Tweet,5,356,62,50,4495,2025-04-02 02:55:25,"<a href=""http://twitter.com/download/iphone"" rel=""nofollow"">Twitter for iPhone</a>",,,video,https://video.twimg.com/amplify_video/1907250311858692097/vid/avc1/720x1280/sLpiugEwBjJ0Yudl.mp4?tag=16
'1907159184207974523',"I just stepped off the Senate floor where I've been watching @SenBooker give one of the most passionate and moving speeches I've ever witnessed. He's calling on us to stand up for our country and fight for its principles.

If you're not watching, now is the time to tune in. https://t.co/U2HUydwJlj",en,Tweet,69,5165,810,416,38568,2025-04-01 20:52:37,"<a href=""https://mobile.twitter.com"" rel=""nofollow"">Twitter Web App</a>",,,video,https://video.twimg.com/ext_tw_video/1907157860313702400/pu/vid/avc1/720x1280/sJ0rDHosmDcCo4Of.mp4?tag=12
