tweet_id,text,language,type,bookmark_count,favorite_count,retweet_count,reply_count,view_count,created_at,client,hashtags,urls,media_type,media_urls
'1970632544581308816',The last people you should turn to for medical advice are Secretary Kennedy and President Trump. https://t.co/JmkCkNYwsx,en,Tweet,0,26,4,24,1838,2025-09-24 00:33:05,"<a href=""http://twitter.com/download/iphone"" rel=""nofollow"">Twitter for iPhone</a>",,,video,https://video.twimg.com/amplify_video/1970632288468688896/vid/avc1/1080x1920/UFrbD4W41ixk6jrc.mp4?tag=21
'1970612268036403581',"The Republican budget bill that was passed into law earlier this summer threatens health care access for thousands of Granite Staters.
 
I visited Amoskeag Health and spoke directly with health care workers about the ways in which this law will harm New Hampshire as I continue to push for the reversal of these health care cuts.",en,Tweet,1,16,9,15,1723,2025-09-23 23:12:31,"<a href=""https://mobile.twitter.com"" rel=""nofollow"">Twitter Web App</a>",,,photo,https://pbs.twimg.com/media/G1kFaGqWEAAd4Xp.jpg
'1970563533172854944',"Every Granite Stater deserves access to safe, clean drinking water.
 
Today I met with leaders in Merrimack to discuss how we can prevent and clean up PFAS contamination in our water. https://t.co/ml6ovsgiTR",en,Tweet,1,7,4,2,945,2025-09-23 19:58:52,"<a href=""https://mobile.twitter.com"" rel=""nofollow"">Twitter Web App</a>",,,photo,https://pbs.twimg.com/media/G1jZCASWkAA_98L.jpg
'1970284416758096337',"The Administration should be doubling down on the progress we have made researching the complicated causes of autism — instead, they continue to ask questions and then refuse to listen to the answers while also spreading unproven theories.",en,Reply,0,10,2,3,871,2025-09-23 01:29:45,"<a href=""http://twitter.com/download/iphone"" rel=""nofollow"">Twitter for iPhone</a>",,,,
'1970284405416423511',Firing scientists and researchers and then telling pregnant women to “tough it out” during dangerous health conditions because of unproven theories is not how we will find the cause of autism.,en,Tweet,0,24,10,13,1406,2025-09-23 01:29:43,"<a href=""http://twitter.com/download/iphone"" rel=""nofollow"">Twitter for iPhone</a>",,,,
'1970253572920221864',"L’Shanah Tovah New Hampshire!

Wishing all celebrating Rosh Hashanah a sweet and happy new year.",en,Tweet,1,9,1,3,979,2025-09-22 23:27:11,"<a href=""https://mobile.twitter.com"" rel=""nofollow"">Twitter Web App</a>",,,,
'1970222546009415827',"I’ve heard repeatedly, including from business owners in Keene today, that President Trump’s tariffs are raising prices for Granite Staters and hurting small businesses. 

The President must listen to the bipartisan majority in Congress and end these reckless tariffs. https://t.co/8IwxubYKHF",en,Tweet,1,14,9,8,1298,2025-09-22 21:23:54,"<a href=""https://mobile.twitter.com"" rel=""nofollow"">Twitter Web App</a>",,,photo,https://pbs.twimg.com/media/G1ei9dbWEAASj-n.jpg
'1970184105615860003',"Bottom line: Republicans are ripping away the health care that Americans count on. It's wrong and here’s what it means:

⬆️Higher costs for all Americans
⬇️Fewer Americans will have access to health care",en,Tweet,0,8,4,8,1271,2025-09-22 18:51:09,"<a href=""https://mobile.twitter.com"" rel=""nofollow"">Twitter Web App</a>",,,,
'1970159895896043994',"In case you missed it, the Senate unanimously passed a reauthorization of the SUPPORT Act, improving and expanding funding for addiction treatment, recovery, and training for first responders.
https://t.co/GV5bfone2X",en,Tweet,2,16,8,6,1014,2025-09-22 17:14:57,"<a href=""https://mobile.twitter.com"" rel=""nofollow"">Twitter Web App</a>",,https://www.unionleader.com/news/politics/state/bipartisan-bill-to-fight-drug-overdoses-heads-to-trumps-desk/article_9ec8e906-376e-4855-8c70-780ccbddc8e3.html,,
'1969583294116479415',"As we learn more about tonight’s shooting in Nashua, my heart goes out to the families of those impacted. And I’m grateful for the work of the law enforcement officers and first responders at the scene.",en,Tweet,1,16,4,14,3922,2025-09-21 03:03:45,"<a href=""http://twitter.com/download/iphone"" rel=""nofollow"">Twitter for iPhone</a>",,,,
'1969481372130562089',"Let’s be clear: The Trump Administration is taking health insurance away from millions of Americans and raising the cost of premiums for everyone else. 

That puts the health and safety of our communities at risk.",en,Tweet,0,14,7,11,1738,2025-09-20 20:18:44,"<a href=""http://twitter.com/download/iphone"" rel=""nofollow"">Twitter for iPhone</a>",,,,
'1969138789688717561',"On the third Friday in September, we recognize POW/MIA Day and pay tribute to our service members who became prisoners of war or went missing in action, including the more than 80,000 still missing.
 
Thank you for your service and your sacrifice. You are not forgotten.",en,Tweet,0,11,5,3,976,2025-09-19 21:37:26,"<a href=""http://twitter.com/download/iphone"" rel=""nofollow"">Twitter for iPhone</a>",,,,
'1969102883070046451',"I’ve reintroduced my annual resolution to recognize today as National Concussion Awareness Day. These brain injuries can happen to anyone &amp; we must keep raising awareness to prevent them.

Thanks to advocates like Granite Stater Brooke Schuessler for driving meaningful progress. https://t.co/RkJFWzoYHm",en,Tweet,0,2,1,0,686,2025-09-19 19:14:46,"<a href=""http://twitter.com/download/iphone"" rel=""nofollow"">Twitter for iPhone</a>",,,photo,https://pbs.twimg.com/media/G1OoouGWgAA31Hq.jpg
'1968780361556447606',"Happy Birthday to the @usairforce!

And thank you to the men and women who have helped keep our country safe, secure, and free for 78 years.",en,Tweet,0,4,2,1,919,2025-09-18 21:53:11,"<a href=""https://mobile.twitter.com"" rel=""nofollow"">Twitter Web App</a>",,,,
'1968767643994780059',"BREAKING NEWS: The SUPPORT Act has been reauthorized and is headed to the President’s desk to be signed into law.

This bipartisan bill will be a landmark investment in addiction prevention, treatment, recovery, and first responder efforts. https://t.co/GSGiChZXiQ",en,Tweet,0,12,9,7,1109,2025-09-18 21:02:38,"<a href=""http://twitter.com/download/iphone"" rel=""nofollow"">Twitter for iPhone</a>",,,video,https://video.twimg.com/amplify_video/1968767566391676928/vid/avc1/1080x1920/gjsUyzoIlsqiOy-F.mp4?tag=21
'1968423904537432357',"Dr. Monarez testified today that Secretary Kennedy ordered her to fire scientists without cause and to approve vaccine recommendations without evidence. She refused, and he fired her. 

Secretary Kennedy is putting American families at risk. https://t.co/wtZ4nGnnsd",en,Tweet,0,22,11,15,1252,2025-09-17 22:16:45,"<a href=""http://twitter.com/download/iphone"" rel=""nofollow"">Twitter for iPhone</a>",,,video,https://video.twimg.com/amplify_video/1968423830138900480/vid/avc1/960x1200/k_MT-FKhZLsDkXzD.mp4?tag=21
'1968052668036944052',"September is National Suicide Prevention Month – an important time to amplify mental health resources and remind our communities that hope and help are always within reach. If you’re struggling, calling or texting 988 will connect you to free and confidential support.",en,Tweet,0,13,9,4,1308,2025-09-16 21:41:35,"<a href=""https://mobile.twitter.com"" rel=""nofollow"">Twitter Web App</a>",,,,
'1967666456948248783',"People across New Hampshire rely on SNAP to feed their families, but the Trump Administration and Congressional Republicans cut its funding to pay for tax breaks for billionaires and corporate special interests. 
https://t.co/2x9klLW9id",en,Tweet,2,14,6,10,1209,2025-09-15 20:06:55,"<a href=""https://mobile.twitter.com"" rel=""nofollow"">Twitter Web App</a>",,https://www.seacoastonline.com/story/news/local/2025/09/11/nh-residents-snap-food-stamp-cuts-trump-beautiful-bill/85989872007/,,
'1966159028251512889',"24 years after the horrific events of 9/11, we must continue to remember and honor the victims and first responders that lost their lives. https://t.co/Z8OGgyzRvZ",en,Tweet,0,27,11,6,4350,2025-09-11 16:16:56,"<a href=""https://mobile.twitter.com"" rel=""nofollow"">Twitter Web App</a>",,,photo,https://pbs.twimg.com/media/G0kzIBjW4AAP4gv.jpg
'1965861670305292498',"I'm shocked and horrified by the reports that Charlie Kirk was shot while speaking at an event.

Political violence is never acceptable. I'm praying for him and his family.",en,Tweet,2,78,18,89,9797,2025-09-10 20:35:20,"<a href=""https://mobile.twitter.com"" rel=""nofollow"">Twitter Web App</a>",,,,
'1965846497289027670',"Putin’s incursion into Poland – a NATO ally – is alarming and comes days after reports that the Trump Administration is ending security programs that deter Russian aggression.

There is no appeasing Putin and we must always stand up to tyrants.",en,Tweet,1,15,7,7,1551,2025-09-10 19:35:03,"<a href=""https://mobile.twitter.com"" rel=""nofollow"">Twitter Web App</a>",,,,
'1965527129795543366',"Costs keep going up. American manufacturing is contracting. Businesses don’t know whether to invest or hire. This is all a direct result of the President’s reckless tariffs and the uncertainty he has created.
 https://t.co/lRTzmxHKFv",en,Tweet,1,15,6,18,3121,2025-09-09 22:26:00,"<a href=""https://mobile.twitter.com"" rel=""nofollow"">Twitter Web App</a>",,https://www.ft.com/content/f98caaf8-545b-41cb-abdf-d9ea674799fc,,
'1964693654410567924',"The Trump Administration continues to wreak havoc on our communities through constantly changing decisions on federal funding &amp; reckless tariffs.
 
I’ve heard from Granite Staters, including recently in Lancaster, about the impact that this uncertainty has had on their work. https://t.co/oNTfhS4Px2",en,Tweet,0,11,7,34,1867,2025-09-07 15:14:04,"<a href=""http://twitter.com/download/iphone"" rel=""nofollow"">Twitter for iPhone</a>",,,photo,https://pbs.twimg.com/media/G0P-dWcWcAAdBpc.jpg
'1964377813022363674',"Last year alone, scammers stole over $1 trillion worldwide.
 
I’m working to combat scams, and I spoke to law enforcement, experts, and the victim of a scam about this issue in Dover.

https://t.co/hQT3Vsvg5u",en,Tweet,2,4,3,22,1279,2025-09-06 18:19:01,"<a href=""http://twitter.com/download/iphone"" rel=""nofollow"">Twitter for iPhone</a>",,https://www.unionleader.com/news/politics/state/hassan-hosts-roundtable-on-how-to-prevent-scams/article_55231bd4-4cfa-4623-a667-3cafc4977a6a.html?mc_cid=8d6bae80c9,,
'1964058075624546388',"It was great to join Dan Mitchell on WKBK last week to talk about what I’m hearing from Granite Staters about the rising cost of living, made worse by the President’s reckless tariffs. 

Read more and listen below:
https://t.co/gXsMajJy0Y",en,Tweet,1,7,5,9,929,2025-09-05 21:08:30,"<a href=""https://mobile.twitter.com"" rel=""nofollow"">Twitter Web App</a>",,https://mykeenenow.com/news/219912-hassan-talks-tariffs-safety-and-rising-costs-in-radio-interview/?mc_cid=8d6bae80c9&mc_eid=377a4dc1b8,,
'1963669898782973962',"Secretary Kennedy once again demonstrated that he is a threat to Americans’ safety and wellbeing.

He is lying to the public and needs to resign. https://t.co/NlWCqtnhQg",en,Tweet,85,2385,702,1121,79842,2025-09-04 19:26:01,"<a href=""https://mobile.twitter.com"" rel=""nofollow"">Twitter Web App</a>",,,video,https://video.twimg.com/amplify_video/1963669431441059840/vid/avc1/960x1200/vlpKKwsAY8aBsaaS.mp4?tag=21
'1963352977315410362',"Secretary Kennedy is putting Americans’ health at risk by refusing to even be briefed by scientists who have dedicated their careers to making people healthier, by changing accepted vaccine recommendations, and by rejecting the science that has allowed our country to eradicate polio.",en,Tweet,1,73,27,203,4256,2025-09-03 22:26:41,"<a href=""http://twitter.com/download/iphone"" rel=""nofollow"">Twitter for iPhone</a>",,,video,https://video.twimg.com/amplify_video/1963352915650768896/vid/avc1/960x1200/r22bayi1j_I-eExf.mp4?tag=21
'1962945694320238764',"As part of my efforts to combat scams, I met with local, state, and federal law enforcement, experts, and a Granite Stater who has been the victim of a scam.

I’m grateful for the insights of everyone who joined the discussion this morning in Dover as we work to fight scammers who steal from Americans.",en,Tweet,0,15,3,33,1813,2025-09-02 19:28:17,"<a href=""https://mobile.twitter.com"" rel=""nofollow"">Twitter Web App</a>",,,photo,https://pbs.twimg.com/media/Gz3IsjoWYAA3fwK.jpg
'1962518325302337715',"Labor Day is a time to reflect on the strides that the labor movement has made to help secure fair working conditions for everyone.
 
I will continue to stand with workers and working families.",en,Tweet,0,9,3,10,1380,2025-09-01 15:10:05,"<a href=""http://twitter.com/download/iphone"" rel=""nofollow"">Twitter for iPhone</a>",,,,
'1961889949822693797',"Domestic violence survivor and baker Sarah Guinther of Bow donates half of the proceeds from her company, Maddi Hatter Cookie Company, to domestic violence survivor support organizations.

Her generosity and dedication to supporting other survivors is why I named her August’s Granite Stater of the Month.",en,Tweet,0,37,11,7,2185,2025-08-30 21:33:08,"<a href=""http://twitter.com/download/iphone"" rel=""nofollow"">Twitter for iPhone</a>",,,,
'1961450217355575616',"The Piscataqua Region Estuaries Partnership helps to protect and restore the waterways in the region.
 
It was great to hear more about this partnership and how it’s connected to the health of the entire Seacoast community yesterday. https://t.co/gpUKucWPZN",en,Tweet,0,4,2,4,989,2025-08-29 16:25:48,"<a href=""https://mobile.twitter.com"" rel=""nofollow"">Twitter Web App</a>",,,photo,"https://pbs.twimg.com/media/Gzh4jwhXwAEz7WV.jpg,https://pbs.twimg.com/media/Gzh4jw4X0AAJl0i.jpg"
'1961089558482719008',"Was great to have @RepDavid in New Hampshire for a bipartisan Joint Economic Committee event on cutting-edge innovation and research happening here. NH businesses are driving innovation that is preparing us for the future, safeguarding our national security, and helping us outcompete China.
https://t.co/YTpjAghB9X",en,Tweet,0,6,2,6,1069,2025-08-28 16:32:40,"<a href=""https://mobile.twitter.com"" rel=""nofollow"">Twitter Web App</a>",,,,
'1960874521952448545',"The resignation of top leaders at the CDC is a result of Secretary Kennedy’s refusal to listen to nonpartisan scientists who devoted their lives to public health.

The consequences for the health of our communities are devastating — and Secretary Kennedy should be the one resigning",en,Tweet,4,96,25,29,4247,2025-08-28 02:18:11,"<a href=""http://twitter.com/download/iphone"" rel=""nofollow"">Twitter for iPhone</a>",,,,
'1960800560530997541',"The Republican budget bill that was signed into law by President Trump threatens health care access for thousands of Granite Staters, and raises costs for everyone.
 
I will keep standing up against these attacks to protect health care for Granite Staters.",en,Tweet,0,10,4,3,1372,2025-08-27 21:24:18,"<a href=""https://mobile.twitter.com"" rel=""nofollow"">Twitter Web App</a>",,,,
'1960745917642162540',"I’m devastated by the news of a mass shooting at Annunciation Catholic School this morning in Minneapolis.

The start of school should be a time of excitement – not fear and violence. We can and must do more to protect our children.",en,Tweet,0,10,7,11,1538,2025-08-27 17:47:10,"<a href=""https://mobile.twitter.com"" rel=""nofollow"">Twitter Web App</a>",,,,
'1960431288013435053',"I was honored to attend a performance of Voices from Ukraine: Stories of War and Hope last week, presented by Common Man for Ukraine and Arts & Big Hearts.

I was deeply moved by the young actors who brought their experiences and stories of their country to the stage.
https://t.co/I6sLMTTbDV",en,Tweet,0,7,7,3,1252,2025-08-26 20:56:56,"<a href=""https://mobile.twitter.com"" rel=""nofollow"">Twitter Web App</a>",,,,
'1960054998492156248',"It was great to be in Plymouth last week and see two projects, made possible by federal funding, that will help strengthen and modernize the town’s infrastructure: the new stormwater drainage system and the solar array. https://t.co/RzNkprlCFU",en,Tweet,0,12,5,9,1377,2025-08-25 20:01:42,"<a href=""https://mobile.twitter.com"" rel=""nofollow"">Twitter Web App</a>",,,photo,https://pbs.twimg.com/media/GzODnfeXAAAs0pl.jpg
'1959997851976732685',"This back-to-school season, parents are paying more for apparel and other essentials because of the President's reckless tariffs.
 
I met with Granite State moms to talk about how rising costs under the Trump Administration are making life harder for families. https://t.co/7ifCw90vtt",en,Tweet,1,8,7,7,1088,2025-08-25 16:14:37,"<a href=""https://mobile.twitter.com"" rel=""nofollow"">Twitter Web App</a>",,,photo,https://pbs.twimg.com/media/GzNPoyJXAAMsppC.jpg
'1958968850449670209',"The Republican budget bill signed by President Trump takes health care away from millions of Americans to pay for tax breaks for billionaires. 
 
I heard today from community health organizations about how this bill will harm patients and put our health care system at risk. https://t.co/ZODbnYY0LT",en,Tweet,0,15,8,17,1644,2025-08-22 20:05:44,"<a href=""http://twitter.com/download/iphone"" rel=""nofollow"">Twitter for iPhone</a>",,,photo,https://pbs.twimg.com/media/Gy-nyPvWIAAcgSP.jpg
'1958568778163220687',"New Hampshire is all too familiar with the devastating impacts of the fentanyl crisis on our families. On National Fentanyl Prevention and Awareness Day, join me in remembering those we’ve lost and spreading the word about the dangers of fentanyl.",en,Tweet,0,7,4,10,1211,2025-08-21 17:35:59,"<a href=""https://mobile.twitter.com"" rel=""nofollow"">Twitter Web App</a>",,,,
'1958265959917175035',It was great to meet with nonprofit and local leaders in Lancaster and hear about the importance of federal funding in making their work possible. I will continue to push back on the Trump Administration’s cuts that are causing chaos and uncertainty across our state. https://t.co/OFCIeWY4Ko,en,Tweet,0,7,3,7,934,2025-08-20 21:32:42,"<a href=""https://mobile.twitter.com"" rel=""nofollow"">Twitter Web App</a>",,,photo,https://pbs.twimg.com/media/Gy0of4DXQAABcEB.jpg
'1958226683921932333',Ammonoosuc Community Health Services' Franconia location is set to close in part because of cuts in the Republican budget bill. Today I met with Ammonoosuc staff to discuss the care that they provide for Granite Staters and what they are seeing in the face of these health care cuts.,en,Tweet,0,6,6,2,1007,2025-08-20 18:56:38,"<a href=""https://mobile.twitter.com"" rel=""nofollow"">Twitter Web App</a>",,,photo,"https://pbs.twimg.com/media/Gy0EyXOWQAAIWm9.jpg,https://pbs.twimg.com/media/Gy0EyXGWcAAjkoj.jpg"
'1957859669537436118',"11 years ago New Hampshire native James Foley was murdered by ISIS terrorists.

Today we honor his memory and his legacy by continuing to advocate for the safety of journalists around the world as they work to share the truth.",en,Tweet,0,20,7,4,1334,2025-08-19 18:38:15,"<a href=""https://mobile.twitter.com"" rel=""nofollow"">Twitter Web App</a>",,,,
'1957541788249473284',"The Cold Stone Springs Water Project in Jaffrey and Peterborough will help strengthen the drinking water infrastructure in the Monadnock region, and improve access to clean drinking water for more Granite Staters. https://t.co/OXyqNjOLkE",en,Tweet,0,15,4,7,1255,2025-08-18 21:35:06,"<a href=""http://twitter.com/download/iphone"" rel=""nofollow"">Twitter for iPhone</a>",,,photo,https://pbs.twimg.com/media/GyqV4axWEAQ574-.jpg
'1957503779953340767',"Because President Trump and Republicans chose tax cuts for billionaires over tax cuts for working families in their budget bill, heath care premiums under the Affordable Care Act are set to spike for people across the country.

I visited Monadnock Community Hospital and heard about how these cuts will affect patients’ access to care.",en,Tweet,1,17,3,24,2485,2025-08-18 19:04:04,"<a href=""https://mobile.twitter.com"" rel=""nofollow"">Twitter Web App</a>",,,photo,"https://pbs.twimg.com/media/GypzSf_XUAA2ELB.jpg,https://pbs.twimg.com/media/GypzSgAXoAAlc7j.jpg"
'1957079605535232140',"Data brokers have a responsibility to prevent the misuse of consumer data, and Americans have a right to know how their personal information is being used.

I’m pushing five major data broker companies to improve the transparency of their opt-out options.",en,Tweet,0,24,10,10,1921,2025-08-17 14:58:33,"<a href=""http://twitter.com/download/iphone"" rel=""nofollow"">Twitter for iPhone</a>",,,,
'1956825761534685563',"Granite Staters are already losing access to health care because of the Republican budget bill. Sadly, the planned clinic closures in Franconia, Canaan, and Concord, are only the beginning. I will keep pushing back against this devastating bill.

https://t.co/kBGreXpRRl",en,Tweet,0,20,8,35,5126,2025-08-16 22:09:52,"<a href=""http://twitter.com/download/iphone"" rel=""nofollow"">Twitter for iPhone</a>",,https://www.bostonglobe.com/2025/08/10/metro/trump-medicaid-cuts-health-centers-closing-new-hampshire/,,
'1956397159357600026',"President Trump’s reckless tariffs are making NH’s housing crisis worse. 

New Hampshire companies like MADCO3D are working to tackle this crisis with innovative solutions. 
https://t.co/WHrTiJaNBy",en,Tweet,2,6,5,17,1139,2025-08-15 17:46:45,"<a href=""https://mobile.twitter.com"" rel=""nofollow"">Twitter Web App</a>",,https://www.fosters.com/story/news/local/2025/08/08/3d-printed-affordable-homes-madco3d-senator-hassan-rochester/85564486007/,,
'1955995990973874563',"90 years ago, Social Security was signed into law. Since then, Americans have paid in, confident that they can count on it in retirement. 

The Trump Administration is undermining that confidence &amp; I'm going to continue to stand up to anyone who threatens this critical lifeline.",en,Tweet,0,28,10,36,4762,2025-08-14 15:12:39,"<a href=""https://mobile.twitter.com"" rel=""nofollow"">Twitter Web App</a>",,,,
'1955635839255613660',"MADCO3D is one of many Granite State businesses on the cutting edge of innovation. Great to visit their facility in Rochester last week to see how their 3D printing tech is saving time and money on new housing construction, helping tackle our housing crisis. https://t.co/Z4MtKxgNTe",en,Tweet,1,5,5,5,922,2025-08-13 15:21:32,"<a href=""https://mobile.twitter.com"" rel=""nofollow"">Twitter Web App</a>",,,photo,"https://pbs.twimg.com/media/GyPQYUFWoAAgt08.jpg,https://pbs.twimg.com/media/GyPQYUDWUAAo3us.jpg,https://pbs.twimg.com/media/GyPQYUOWcAAUca3.jpg"
'1955301387211808999',"Great to visit the Kilham Bear Center in Lyme last week and learn about the work that volunteers and staff do to rehabilitate and release injured, orphaned, and abandoned black bear cubs. https://t.co/uEguWz8OAu",en,Tweet,1,9,4,3,1054,2025-08-12 17:12:33,"<a href=""https://mobile.twitter.com"" rel=""nofollow"">Twitter Web App</a>",,,photo,"https://pbs.twimg.com/media/GyKgPhAXIAEjvR8.jpg,https://pbs.twimg.com/media/GyKgPhGXoAEZCyx.jpg"
'1954932103092813969',"President Trump keeps claiming that other countries pay his tariffs. The reality? American families, workers, and businesses foot the bill.

His chaotic trade policies are driving up costs when people are already struggling.

https://t.co/pp9HQEqS8f",en,Tweet,3,22,13,16,2993,2025-08-11 16:45:08,"<a href=""https://mobile.twitter.com"" rel=""nofollow"">Twitter Web App</a>",,https://www.bostonglobe.com/2025/08/07/nation/tariffs-taxes-trump/?s_campaign=sharetool_copypaste_view,,
'1953881575491273140',"The right to collectively bargain strengthens the middle class & workforces. 

The President's move to take that right away from VA employees, many of whom are veterans themselves, will make it harder for the VA to attract and retain the high-quality workers veterans deserve access to. Our veterans have earned the best possible care, and this reckless decision jeopardizes that.

https://t.co/TyOfchYQ4J",en,Tweet,0,13,2,14,1255,2025-08-08 19:10:43,"<a href=""https://mobile.twitter.com"" rel=""nofollow"">Twitter Web App</a>",,,,
'1953843147185742276',"I visited HealthFirst in Laconia and heard directly from providers how Republican Medicaid cuts are already putting health care at risk in rural Granite State communities – including forcing the upcoming closure of the HealthFirst clinic in Canaan.

WATCH ⬇️ https://t.co/Y30LvSdHWN",en,Tweet,0,4,1,8,859,2025-08-08 16:38:01,"<a href=""https://mobile.twitter.com"" rel=""nofollow"">Twitter Web App</a>",,,video,https://video.twimg.com/amplify_video/1953842883011686400/vid/avc1/960x1200/JhIkffRZ5PcaO2e_.mp4?tag=21
'1953554631247995034',"President Trump's reckless tariffs are a national sales tax, driving up costs for families and small businesses.

I will continue to stand up against the President's tariffs.
https://t.co/hxpg3iss4T",en,Tweet,2,21,4,21,1629,2025-08-07 21:31:34,"<a href=""https://mobile.twitter.com"" rel=""nofollow"">Twitter Web App</a>",,https://www.nhpr.org/2025-08-07/trumps-broad-tariffs-go-into-effect-just-as-economic-pain-is-surfacing,,
'1953544865780052266',"Meals on Wheels of Grafton County exemplifies the Granite State spirit of generosity and service, and it was great to join volunteers there today. I will keep fighting against the cuts in the GOP budget bill that will leave more Granite Staters hungry. https://t.co/KF69A8gUK3",en,Tweet,0,18,3,7,1189,2025-08-07 20:52:45,"<a href=""https://mobile.twitter.com"" rel=""nofollow"">Twitter Web App</a>",,,photo,"https://pbs.twimg.com/media/GxxibGWWoAAwFq7.jpg,https://pbs.twimg.com/media/GxxibGxXQAAtolz.jpg,https://pbs.twimg.com/media/GxxibGxX0AA1n1j.jpg"
