tweet_id,text,language,type,bookmark_count,favorite_count,retweet_count,reply_count,view_count,created_at,client,hashtags,urls,media_type,media_urls
'1935118135637786968',"Melissa Hortman was only 55 years old. She had a lot more to do. It is so bitter and so sad that her life was taken - assassinated for fighting for what she believed in. It will now be up to us to carry on these fights.

I will miss her leadership and her friendship as our state navigates these uncertain times. May the memory of Melissa and Mark be a blessing for all who knew and loved them.",en,Tweet,160,8829,1619,215,171178,2025-06-18 00:31:30,"<a href=""https://mobile.twitter.com"" rel=""nofollow"">Twitter Web App</a>",,,video,https://video.twimg.com/amplify_video/1935116340060372994/vid/avc1/1920x1080/4_JwlxWh982IJ-DU.mp4?tag=21
'1934441364806119745',Thank you for the incredible effort of law enforcement.,en,Tweet,4,1315,92,70,51391,2025-06-16 03:42:16,"<a href=""http://twitter.com/download/iphone"" rel=""nofollow"">Twitter for iPhone</a>",,,,
'1934271426128748883',"Times like this weekend make me so glad to have Archie — a loving and very fun father and grandfather — by my side.

Happy Father’s Day Archie. I love you. https://t.co/4ySYphBfwg",en,Tweet,1,449,21,23,13830,2025-06-15 16:26:59,"<a href=""http://twitter.com/download/iphone"" rel=""nofollow"">Twitter for iPhone</a>",,,photo,"https://pbs.twimg.com/media/Gtfpms6WIAA4HIm.jpg,https://pbs.twimg.com/media/Gtfpms3W0AAt1ts.jpg"
'1933915104031994001',I am heartbroken beyond words that Speaker Melissa Hortman and her husband Mark have died in a violent and politically motivated shooting.  Melissa was an exceptional public servant.  She was smart and funny and so dedicated to making Minnesota work better for all of us.  We cannot tolerate allowing our political differences to explode into political violence that threatens our safety and our democratic form of government.  We are praying for Senator John Hoffman and his wife Yvette. Archie and I send our prayers to the Hortman and Hoffman families.  We are bereft.,en,Tweet,33,2472,302,322,114184,2025-06-14 16:51:05,"<a href=""http://twitter.com/download/iphone"" rel=""nofollow"">Twitter for iPhone</a>",,,,
'1933897594087850417',"This morning Minnesota woke up to news of a brutal act of violence targeting public servants.  I am heartbroken to learn that our Speaker Melissa Hortman, Sen. John Hoffman and their spouses have been shot. I’ve worked closely with these fine legislators for many years. Archie and I are grateful for the incredible response of law enforcement and hope that everyone will be safe today.",en,Tweet,45,2196,367,343,588164,2025-06-14 15:41:31,"<a href=""http://twitter.com/download/iphone"" rel=""nofollow"">Twitter for iPhone</a>",,,,
'1933250200124207530',"It’s not illegal for a United States Senator to go to a public press conference and ask questions about your constituents safety.

It's our job.",en,Tweet,105,23413,2970,3036,420444,2025-06-12 20:49:00,"<a href=""https://mobile.twitter.com"" rel=""nofollow"">Twitter Web App</a>",,,,
'1933243629088149865',"Liars.

""I am Senator Alex Padilla."" https://t.co/iiINwoXfGZ",ca,Tweet,332,19616,2833,2420,748170,2025-06-12 20:22:53,"<a href=""https://mobile.twitter.com"" rel=""nofollow"">Twitter Web App</a>",,,video,https://video.twimg.com/amplify_video/1933243540928086016/vid/avc1/886x482/y2orBs4KwxffFBkn.mp4?tag=21
'1933240353101922638',Kristi Noem should resign in disgrace.,en,Tweet,78,21605,2426,2653,436025,2025-06-12 20:09:52,"<a href=""https://mobile.twitter.com"" rel=""nofollow"">Twitter Web App</a>",,,,
'1933232236372820232',"This is disgusting.

If this is how they treat Alex Padilla, a United States Senator, how do you think they’ll treat you?",en,Tweet,138,11082,1875,7444,767317,2025-06-12 19:37:37,"<a href=""https://mobile.twitter.com"" rel=""nofollow"">Twitter Web App</a>",,,,
'1933226056040821015',Millions of acres of some of the most beautiful places in the country just to pay for tax breaks for their rich friends – who already have more money than they know what to do with.,en,Tweet,4,45,17,6,4625,2025-06-12 19:13:04,"<a href=""http://twitter.com/download/iphone"" rel=""nofollow"">Twitter for iPhone</a>",,,,
'1932953493918355671',"Using pseudoscience to justify bad actions is pretty par for the course for these guys.

Not this mine. Not this place. The Boundary Waters are too precious. 

See you in court.",en,Tweet,1,237,54,26,8978,2025-06-12 01:10:00,"<a href=""http://twitter.com/download/iphone"" rel=""nofollow"">Twitter for iPhone</a>",,,,
'1932947843175887067',"What “careful review”?

The one that showed this kind of mining nearly always pollutes?

Or the one that showed that mining in this place could irreversibly pollute the Boundary Waters?",en,Tweet,2,100,23,12,12140,2025-06-12 00:47:32,"<a href=""http://twitter.com/download/iphone"" rel=""nofollow"">Twitter for iPhone</a>",,,,
'1932904462173036900',"If more Americans learn about your bill… and they really don’t like what they’re seeing… change course.
 
#KillTheBill",en,Tweet,3,75,26,19,5603,2025-06-11 21:55:10,"<a href=""http://twitter.com/download/iphone"" rel=""nofollow"">Twitter for iPhone</a>",#KillTheBill,,,
'1932845267063022009',"Republicans are jamming through the GENIUS Act which will turbocharge Donald Trump’s crypto corruption.

We need an amendment vote to stop the President, Vice President, and senior government officials from directly or indirectly profiting from a stablecoin venture.

The GENIUS Act should not pass without a vote on this fix.",en,Tweet,5,209,86,67,25693,2025-06-11 17:59:56,"<a href=""http://twitter.com/download/iphone"" rel=""nofollow"">Twitter for iPhone</a>",,,,
'1932603569280045163',"Today marks a victory in our fight to protect the Boundary Waters.

Buried deep in President Trump and Republicans’ Big Beautiful Bill was a provision that gave a foreign mining company full permission to build a copper-nickel sulfide mine right on the doorstep of the Boundary Waters. 

I vowed to do everything in my power to protect this precious place.  Today, I am relieved to announce that we were successful in forcing Republicans to drop this language attacking the Boundary Waters from the bill.   
 
However, the fight is far from over.

Donald Trump and House Republicans are determined to revoke the protections I worked to put in place and that Minnesotans have made clear they support. Republicans want to sell off our public lands to the highest bidder, and the Boundary Waters is no exception.
 
We need to pass my bill to permanently protect the Boundary Waters from sulfide mining. Minnesotans who love the Boundary Waters and want it to be there for our children and grandchildren need to continue to organize and use their voices.

This win shows that when we speak out and stand strong, together we have the power to stop this.",en,Tweet,2,143,52,19,12326,2025-06-11 01:59:31,"<a href=""http://twitter.com/download/iphone"" rel=""nofollow"">Twitter for iPhone</a>",,,photo,https://pbs.twimg.com/media/GtH8s-bWcAEsrGD.jpg
'1932574288160133261',So he told us not to take his medical advice and now he’s… firing the people who give medical advice?,en,Tweet,3,147,30,12,5781,2025-06-11 00:03:10,"<a href=""http://twitter.com/download/iphone"" rel=""nofollow"">Twitter for iPhone</a>",,,,
'1932189091246002270',"Arresting and detaining SEIU leader and American citizen David Huerta is sickening.

This is not how we do things in America. We do not accept these kinds of abuses of power.",en,Tweet,0,173,47,85,10313,2025-06-09 22:32:32,"<a href=""https://mobile.twitter.com"" rel=""nofollow"">Twitter Web App</a>",,,,
'1932187837090218381',"What’s happening in Los Angeles right now is yet another example of Donald Trump using the powers of the federal government to attack and intimidate his political enemies.

It’s despicable.",en,Tweet,11,778,186,586,17757,2025-06-09 22:27:33,"<a href=""https://mobile.twitter.com"" rel=""nofollow"">Twitter Web App</a>",,,,
'1931084900498567587',"The breakup has been quieter today but let’s remember what they’re arguing about — that despite all the talk about cuts, Trump’s Big Beautiful Bill will add $2.6 trillion to the national debt.

It’s fiscal insanity, and only a matter of time before the dam broke.",en,Tweet,10,338,52,61,29464,2025-06-06 21:24:52,"<a href=""http://twitter.com/download/iphone"" rel=""nofollow"">Twitter for iPhone</a>",,,,
'1930729792959082629',Who gets custody of JD in the divorce?,en,Tweet,168,7382,605,280,181234,2025-06-05 21:53:48,"<a href=""https://mobile.twitter.com"" rel=""nofollow"">Twitter Web App</a>",,,,
'1930717806388994098',As a grandma (and on behalf of toddlers everywhere) I’ll say this Musk/Trump tantrum is worse than anything I’ve ever seen.,en,Tweet,3,428,38,45,9275,2025-06-05 21:06:10,"<a href=""https://mobile.twitter.com"" rel=""nofollow"">Twitter Web App</a>",,,,
'1930706406715339106',Does anyone have popcorn??,en,Tweet,17,2265,124,135,35470,2025-06-05 20:20:52,"<a href=""https://mobile.twitter.com"" rel=""nofollow"">Twitter Web App</a>",,,,
'1930684595751747818',https://t.co/FrHHbdSFsz,zxx,Reply,52,574,18,3,55260,2025-06-05 18:54:12,"<a href=""https://mobile.twitter.com"" rel=""nofollow"">Twitter Web App</a>",,https://open.spotify.com/playlist/5CFRw0qZbmxwFU4cIKhcWS,,
'1930684453833085363',Thought you could use this @realDonaldTrump https://t.co/M7kvJ7fgh4,en,Tweet,683,20802,1962,111,3237230,2025-06-05 18:53:38,"<a href=""https://mobile.twitter.com"" rel=""nofollow"">Twitter Web App</a>",,,photo,https://pbs.twimg.com/media/GssrHi-WAAA0ArY.jpg
'1930671472894230619',"If it helps tank the “Big, Beautiful Bill” I’m all for it.",en,Reply,0,53,1,7,3227,2025-06-05 18:02:03,"<a href=""https://mobile.twitter.com"" rel=""nofollow"">Twitter Web App</a>",,,,
'1930671471740768565',Break ups are really hard but I sure do love watching the one between the Trump and Musk play out publicly.,en,Tweet,5,507,38,34,11414,2025-06-05 18:02:03,"<a href=""https://mobile.twitter.com"" rel=""nofollow"">Twitter Web App</a>",,,,
'1930412542934823357',"Your bill is the single largest health care rollback in American history.

If you’re going to do it, at least have the guts to own it. Federal Medicaid $ does not cover undocumented people, period. Surely you know this.",en,Tweet,18,1611,501,199,42989,2025-06-05 00:53:10,"<a href=""http://twitter.com/download/iphone"" rel=""nofollow"">Twitter for iPhone</a>",,,,
'1930401416809492659',Hell must be frozen over.,en,Tweet,3,147,27,23,11393,2025-06-05 00:08:57,"<a href=""http://twitter.com/download/iphone"" rel=""nofollow"">Twitter for iPhone</a>",,,,
'1930335999634096556',"It’s important to celebrate the strides we've taken with the 19th Amendment, but we have to recognize that the fight for universal suffrage began long before 1920 and continues today.

Republicans are hell-bent on making it harder for a whole lot of people, including women, to vote. This fight is far from over.",en,Tweet,0,23,7,10,2025,2025-06-04 19:49:00,"<a href=""https://mobile.twitter.com"" rel=""nofollow"">Twitter Web App</a>",,,,
'1930320366456672462',"Harvey Milk served our nation in the Navy for 4 years. He was forced out because he was gay.

Hegseth should focus on the chronic mismanagement of the Pentagon under his (hopefully limited) tenure and protecting those who serve instead of scoring political points by demonizing a former servicemember.",en,Reply,0,43,8,5,1548,2025-06-04 18:46:53,"<a href=""https://mobile.twitter.com"" rel=""nofollow"">Twitter Web App</a>",,,,
'1930320060561621239',Pete Hegseth can't go a single day without making headlines for something ridiculous.,en,Tweet,1,51,17,17,4465,2025-06-04 18:45:40,"<a href=""https://mobile.twitter.com"" rel=""nofollow"">Twitter Web App</a>",,,,
'1930304728103030834',Hey @FoxNews you left out the 10 million people who lose their health insurance and the $2 trillion tacked onto the deficit… and the part where all of this is to pay for rich people and big corporations’ tax cuts https://t.co/MSyOby5oy6,en,Tweet,2,223,87,109,30103,2025-06-04 17:44:45,"<a href=""https://mobile.twitter.com"" rel=""nofollow"">Twitter Web App</a>",,,photo,https://pbs.twimg.com/media/GsnR6sjWUAArnQf.jpg
'1930286741690237354',Hmmm..... https://t.co/MwqkWwjPPG,und,Tweet,11,526,133,14,21863,2025-06-04 16:33:16,"<a href=""https://mobile.twitter.com"" rel=""nofollow"">Twitter Web App</a>",,,photo,https://pbs.twimg.com/media/GsnBeFAWoAAMb0R.png
'1930279621481693235',"We've made so much progress between PrEP and PEP and HIV awareness campaigns that this kind of move feels even darker.

America cannot fall behind in leading the world in science. We can't cede ground, but that's exactly what this decision does.",en,Reply,1,35,11,4,1650,2025-06-04 16:04:59,"<a href=""https://mobile.twitter.com"" rel=""nofollow"">Twitter Web App</a>",,,,
'1930279620164661687',"We were on the cusp of an immense breakthrough: A cure to our HIV epidemic. A vaccine to prevent one of the world’s deadliest diseases.

Until RFK Jr. defunded vaccine trials because a cure to HIV isn't as important as tax breaks for rich people like Big Pharma CEOs.",en,Tweet,25,1713,738,155,15748,2025-06-04 16:04:58,"<a href=""https://mobile.twitter.com"" rel=""nofollow"">Twitter Web App</a>",,,,
'1930268325814137036',How can I explain to Minnesotans that they are losing their health insurance because Republicans couldn’t be bothered to read the bill?,en,Tweet,8,746,185,91,11069,2025-06-04 15:20:06,"<a href=""https://mobile.twitter.com"" rel=""nofollow"">Twitter Web App</a>",,,,
'1930042879193288796',He bought one Republican and it didn’t work out… so he’s going to try it again?,en,Tweet,2,33,8,15,3847,2025-06-04 00:24:15,"<a href=""http://twitter.com/download/iphone"" rel=""nofollow"">Twitter for iPhone</a>",,,,
'1930035695759818755',"We know what this means. Women in this country have already died in states with abortion bans.

Doctors are forced to consult the lawyers — can they do what’s best for their patient or do they need to wait for her condition to get worse? https://t.co/nYVl5Xx7dc",en,Tweet,1,23,8,1,2037,2025-06-03 23:55:42,"<a href=""http://twitter.com/download/iphone"" rel=""nofollow"">Twitter for iPhone</a>",,,photo,https://pbs.twimg.com/media/GsjdPB6XcAAD2pk.jpg
'1929964391836869018',"Sue Abderholden is a force of nature, and her advocacy for people experiencing mental health challenges is unmatched.  She started at the grassroots, working for Paul Wellstone and then working with kids with developmental disabilities.  As Executive Director of NAMI Minnesota she passed laws to  require mental health training for teachers, expand crisis and early intervention services, strengthen how insurance companies cover mental health care.  As Sue retires from leading NAMI, we owe her a huge debt of gratitude.

We have made progress these last few years, like launching the 9-8-8 hotline nationwide, and we have huge challenges ahead.  With Sue as our mentor and model, we will keep on fighting back against attacks on the largest source of insurance for children’s mental health treatment in the nation (Medicaid), and renewed efforts by people up to the Secretary of HHS to stigmatize folks with mental illness and behavior health challenges.

Congratulations Sue as you begin a new phase of your life, and thank you so much for your service.",en,Tweet,1,30,8,3,3538,2025-06-03 19:12:22,"<a href=""http://twitter.com/download/iphone"" rel=""nofollow"">Twitter for iPhone</a>",,,,
'1929946455802032161',"I am still thinking about the atrocity of the attacks last weekend in Boulder. The rise of antisemitic violence across this country is unmistakable and unacceptable, and we all need to strongly stand against it. I hope for justice for those hurt in this attack and that every American can feel safe in this country.",en,Tweet,2,64,13,59,6506,2025-06-03 18:01:06,"<a href=""https://mobile.twitter.com"" rel=""nofollow"">Twitter Web App</a>",,,,
'1929625077790003227',Math is hard... but Google is free. https://t.co/XnlakO0UzD,en,Tweet,20,946,251,42,71569,2025-06-02 20:44:03,"<a href=""https://mobile.twitter.com"" rel=""nofollow"">Twitter Web App</a>",,,photo,https://pbs.twimg.com/media/GsdnpO7XMAAg5Zb.jpg
'1929264720470573263',"Progress isn’t always a straight line, but I have to believe America will one day protect all our neighbors under law. 

That’s what brings me hope this month. Happy Pride.",en,Tweet,1,142,22,72,5231,2025-06-01 20:52:08,"<a href=""http://twitter.com/download/iphone"" rel=""nofollow"">Twitter for iPhone</a>",,,,
'1928571147311866055',https://t.co/GFTw1lj2HZ,zxx,Tweet,0,153,16,21,11488,2025-05-30 22:56:07,"<a href=""http://twitter.com/download/iphone"" rel=""nofollow"">Twitter for iPhone</a>",,,photo,https://pbs.twimg.com/media/GsOpPN2WEAAmEoA.jpg
'1928558666187153661',"There you go: the Big Beautiful Bill is going to blow up the deficit by another $1.7 TRILLION that they’re trying to hide using budget gimmicks.

Unfortunately you can't just shut your eyes and pretend giving massive tax breaks to wealthy people and corporations won't make our deficit spiral out of control and leave regular Americans to foot the bill.",en,Tweet,3,83,41,33,7454,2025-05-30 22:06:31,"<a href=""http://twitter.com/download/iphone"" rel=""nofollow"">Twitter for iPhone</a>",,,,
'1928468710399852575',I thought my job as Senator was to try to keep my constituents alive.,en,Tweet,478,40353,5067,1925,1032863,2025-05-30 16:09:04,"<a href=""http://twitter.com/download/iphone"" rel=""nofollow"">Twitter for iPhone</a>",,,,
'1928168625136951614',"RFK Jr. not knowing how to cite research and just making shit up as he goes is… not that surprising.

Mind boggling that four Republicans couldn’t grow a spine and block this guy. Now look where we are.",en,Tweet,16,1652,374,81,29312,2025-05-29 20:16:38,"<a href=""https://mobile.twitter.com"" rel=""nofollow"">Twitter Web App</a>",,,,
'1927788974480736650',https://t.co/Dmpo39tPjl,zxx,Tweet,12,911,143,52,32470,2025-05-28 19:08:02,"<a href=""http://twitter.com/download/iphone"" rel=""nofollow"">Twitter for iPhone</a>",,,photo,https://pbs.twimg.com/media/GsDh2r4XIAE7UVM.jpg
'1927415646603575396',"A lot of Minnesotans struggle to keep up with how fast technology is changing – so we have programs to help teach them. It helps them land good-paying jobs and keep up with the day-to-day tasks that we use technology for.

DOGE just cancelled these programs.",en,Tweet,2,81,32,154,7572,2025-05-27 18:24:34,"<a href=""https://mobile.twitter.com"" rel=""nofollow"">Twitter Web App</a>",,,,
'1927065522585178207',Thinking of the countless American lives lost and the thousands of brave men and women who answered the call of our nation with great courage and honor. Memorial Day and all days we thank those who made the ultimate sacrifice to protect our freedoms and keep us safe 🇺🇸,en,Tweet,0,57,13,11,3123,2025-05-26 19:13:18,"<a href=""http://twitter.com/download/iphone"" rel=""nofollow"">Twitter for iPhone</a>",,,,
'1926687570127134723',"On this 5th anniversary of George Floyd’s murder, I’ve been remembering the anguish, trauma, and moral outrage of my Minnesota community. Since that terrible day there have been important victories and progress made, but also terrible losses and retreats. George Floyd’s killer is paying the price for his crimes, and nothing Donald Trump can do will change that. The Minneapolis Police Department and my city will continue to make slow but meaningful steps toward reform and systemic change. Donald Trump’s Justice Department has abandoned the Consent Decree, but we will not. Congress has failed so far to pass the George Floyd Justice in Policing Act, but local communities like mine have banned no-knock warrants and the use of choke holds.
 
It is also true that across our nation the number of police killings continues to go up, and the people who are dying are much more likely to be Native, Black and Latino people. Only a fool would look at how Donald Trump lifted up White Afrikaners as the victims of genocide and see anything but the race baiting and racism that it is. Big corporations that embraced Black businesses and a more diverse workforce only a year ago have erased those efforts as they shamefully kowtow to Trump and MAGA. So, there have been retreats and losses also.
 
James Baldwin said, “not everything that is faced can be changed, but nothing can be changed unless it is faced.” Today, I’m inspired by the strength of the young leaders I see here in Minnesota who refuse to give in, give up or forget. I’m with them.",en,Tweet,2,172,41,278,13199,2025-05-25 18:11:27,"<a href=""http://twitter.com/download/iphone"" rel=""nofollow"">Twitter for iPhone</a>",,,,
'1925993543442501690',"In the Ojibwe language, the Menaandawiwe Wellness Campus means “a place where healing happens.” 

The clinic opens during a time when many in our Native communities are carrying grief. Today, we celebrate wellness, connection, and breaking ground here in Minneapolis. https://t.co/ifZDTEIkcZ",en,Tweet,1,80,15,33,4453,2025-05-23 20:13:38,"<a href=""http://twitter.com/download/iphone"" rel=""nofollow"">Twitter for iPhone</a>",,,photo,https://pbs.twimg.com/media/GrqA6p7XoAEMgic.jpg
'1925939675086102838',"If you have to Google what your job is, I think it’s safe to say you’re not good at it.",en,Tweet,10,1403,174,87,29280,2025-05-23 16:39:35,"<a href=""http://twitter.com/download/iphone"" rel=""nofollow"">Twitter for iPhone</a>",,,,
'1925640263008911614',Build it and they will come! 🛤️,en,Tweet,19,729,59,47,33202,2025-05-22 20:49:50,"<a href=""https://mobile.twitter.com"" rel=""nofollow"">Twitter Web App</a>",,,,
'1925566200798384229',"This is horrifying. Archie and I are grieving for Yaron and Sarah, and our hearts go out to their loved ones and the Jewish community in pain right now.

We must condemn this horrific act of antisemitic violence and hate.",en,Tweet,0,32,6,10,3271,2025-05-22 15:55:32,"<a href=""https://mobile.twitter.com"" rel=""nofollow"">Twitter Web App</a>",,,,
'1925287750351094237',"Taking health care and food assistance from working Americans while he accepts lavish gifts from foreign governments.

Got it.",en,Tweet,1,144,35,43,6971,2025-05-21 21:29:04,"<a href=""https://mobile.twitter.com"" rel=""nofollow"">Twitter Web App</a>",,,,
'1925278823290921199',Retreating from the world stage just creates a leadership vacuum that China is more than willing to fill.,en,Tweet,1,52,15,37,4497,2025-05-21 20:53:36,"<a href=""https://mobile.twitter.com"" rel=""nofollow"">Twitter Web App</a>",,,,
'1925253530224336923',"It’s especially painful that this decision comes on the eve of the fifth anniversary of George Floyd’s murder — the very tragedy that sparked this investigation and the urgent push for reform. Walking away from this agreement, after confirming the need for it, is unconscionable.

This decree was based on the DOJ's own investigation, which found a pattern of unconstitutional and discriminatory policing practices that have hurt our community, especially Black and Native American people and people will mental illness, for decades. Abandoning it is deeply disturbing.

Thankfully, the City of Minneapolis and Minnesota state leaders continue to stand on the side of justice. The state-negotiated consent decree remains in place to continue working toward meaningful reform.

The Minneapolis Police Department has taken steps in the right direction and is committed to continuing that work even as the federal government walks away.

Every Minnesotan deserves to be safe in their homes and neighborhoods, and that safety must include freedom from unconstitutional and discriminatory policing. This work isn’t finished yet, and we will keep holding ourselves accountable.",en,Tweet,2,134,33,161,28959,2025-05-21 19:13:05,"<a href=""https://mobile.twitter.com"" rel=""nofollow"">Twitter Web App</a>",,,,
'1924958857576472963',Minnesota is right where we belong – at the top. Now we finish the job.,en,Tweet,1,34,2,10,4976,2025-05-20 23:42:10,"<a href=""http://twitter.com/download/iphone"" rel=""nofollow"">Twitter for iPhone</a>",,,,
'1924888499372589465',"Why do Republicans only talk about fiscal responsibility when it’s about paying for Medicaid and SNAP which helps regular Americans, but not when it’s about giving giant tax breaks to corporations?

Seriously hypocritical.",en,Tweet,4,267,92,111,6020,2025-05-20 19:02:35,"<a href=""https://mobile.twitter.com"" rel=""nofollow"">Twitter Web App</a>",,,,
'1924869317222375855',"Data doesn't lie. When they say they're giving out tax breaks, remember WHO they're skewing them towards (probably not you). https://t.co/rGUZzeXKlm",en,Tweet,14,382,178,132,11605,2025-05-20 17:46:22,"<a href=""https://mobile.twitter.com"" rel=""nofollow"">Twitter Web App</a>",,,photo,https://pbs.twimg.com/media/GraCZuRWEAAFGp4.jpg
'1924854771292266779',"If you talk to a lot of rural hospitals they’ll tell you the same thing: They can’t afford to keep their doors open if that happens. Many of them will close, and that hurts everyone – not just the folks who rely on Medicaid.",en,Reply,0,14,5,1,1306,2025-05-20 16:48:34,"<a href=""https://mobile.twitter.com"" rel=""nofollow"">Twitter Web App</a>",,,,
'1924854770050715827',"Rural hospitals are already squeezed – they can't afford to give out care without some form of payment from insurance companies. So, when our neighbors show up to the ER for care, and they don’t have Medicaid anymore, the hospital has to foot the bill.",en,Reply,0,10,4,2,1387,2025-05-20 16:48:33,"<a href=""https://mobile.twitter.com"" rel=""nofollow"">Twitter Web App</a>",,,,
