tweet_id,text,language,type,bookmark_count,favorite_count,retweet_count,reply_count,view_count,created_at,client,hashtags,urls,media_type,media_urls
'1869793871640834255',"President-elect Musk and VP Trump are billionaires who don't have to worry about how to pay for Christmas dinner if the government shuts down.

Who does have to worry? Military families. Farmers. Childcare providers. Air traffic controllers. That's who will suffer.",en,Tweet,1,59,18,26,2942,2024-12-19 17:16:12,"<a href=""https://mobile.twitter.com"" rel=""nofollow"">Twitter Web App</a>",,,,
'1869737467445919893',"If you hold onto your old stuff long enough, it comes back into style. https://t.co/0HHeQLsDZN",en,Tweet,0,101,13,61,13530,2024-12-19 13:32:04,"<a href=""http://twitter.com/download/iphone"" rel=""nofollow"">Twitter for iPhone</a>",,,photo,https://pbs.twimg.com/media/GfKkUNiWYAALFUU.jpg
'1869524997880033578',The billionaire giving orders to Trump and Congressional Republicans thinks it’s a good idea for millions of workers including military families to go without pay during the holidays. https://t.co/qNWOQ57tIj,en,Tweet,0,30,16,12,1941,2024-12-18 23:27:48,"<a href=""http://twitter.com/download/iphone"" rel=""nofollow"">Twitter for iPhone</a>",,,photo,https://pbs.twimg.com/media/GfHjE8rXQAAReYP.jpg
'1869507625714651297',"Notice that Trump didn’t say a word about the CR until after Elon did. 

Good indication of who is really calling the shots. Keep an eye on this going forward…",en,Tweet,14,1405,436,179,21482,2024-12-18 22:18:46,"<a href=""http://twitter.com/download/iphone"" rel=""nofollow"">Twitter for iPhone</a>",,,,
'1869499400101507515',"Donald Trump isn’t even President yet and he is already about to shut down the government right before the holidays…for no clear reason.

We’re off to a great start guys.",en,Tweet,9,1226,325,459,29554,2024-12-18 21:46:05,"<a href=""http://twitter.com/download/iphone"" rel=""nofollow"">Twitter for iPhone</a>",,,,
'1868694554549068022',"As I head down to DC for the last time in 2024, really nice to come across @HendrickenHawks student musicians adding some holiday cheer at @IFlyRhodeIsland! https://t.co/5o53ysAvR2",en,Tweet,0,14,3,1,1049,2024-12-16 16:27:55,"<a href=""http://twitter.com/download/iphone"" rel=""nofollow"">Twitter for iPhone</a>",,,video,https://video.twimg.com/ext_tw_video/1868694495971196935/pu/vid/avc1/1280x720/Sunv4ZWxLREj2lHc.mp4?tag=12
'1868504558974165155',"For the first time in 20 years there will be no women chairing any of the 17 committees in the House of Reps.

Says a lot about House Republicans.

And there’s more. Rs have no women in the top 3 leadership roles in House or Senate.Or Prez or VP.

But at least they aren’t woke!🙄",en,Tweet,2,70,10,79,7756,2024-12-16 03:52:56,"<a href=""http://twitter.com/download/iphone"" rel=""nofollow"">Twitter for iPhone</a>",,,,
'1868006025888211094',"The Community Angels Toy &amp; Coat Drive in South Providence embodies the spirit of giving, and it was a pleasure to volunteer today with members of the community who are brightening the holiday season for so many families. 🧸🎁 https://t.co/Hb96I1j5fX",en,Tweet,0,3,0,1,435,2024-12-14 18:51:57,"<a href=""http://twitter.com/download/iphone"" rel=""nofollow"">Twitter for iPhone</a>",,,photo,"https://pbs.twimg.com/media/Gex9k0kXAAATBbl.jpg,https://pbs.twimg.com/media/Gex9k0mWsAAniK8.jpg,https://pbs.twimg.com/media/Gex9k0kWgAAS9MR.jpg,https://pbs.twimg.com/media/Gex9k0jWcAAEMY9.jpg"
'1866865386353988059',"Get ready for a lot more stories like this. The grift is so staggering, and they are not even trying to hide it. https://t.co/uYjh5LKmXC",en,Tweet,0,7,3,2,792,2024-12-11 15:19:27,"<a href=""http://twitter.com/download/iphone"" rel=""nofollow"">Twitter for iPhone</a>",,,photo,https://pbs.twimg.com/media/GehwLNuXYAA1B3R.jpg
'1864408942354252279',"@Rep_Magaziner And for those who are wondering, here is the real Spotify Wrapped from the account my wife and I share. I call it, “Millenial Parents”. 😂😂😂

@OfficialBlueyTV @carlyraejepsen @theweeknd https://t.co/QaTrPLfQqh",en,Reply,0,2,0,0,186,2024-12-04 20:38:25,"<a href=""http://twitter.com/download/iphone"" rel=""nofollow"">Twitter for iPhone</a>",,,photo,https://pbs.twimg.com/media/Gd-2DZUWAAAvPnI.jpg
'1864032657979425064',Russian State Media celebrating Kash Patel being nominated for FBI Director. They know the will get away with murder.,en,Tweet,1,10,6,5,1832,2024-12-03 19:43:12,"<a href=""https://mobile.twitter.com"" rel=""nofollow"">Twitter Web App</a>",,,,
'1863324769392750920',"Would you hire someone to be police chief in your city if they’d never been a police officer before?

Would rank and file officers stand for that? Of course not.

This guy’s never worked a day in law enforcement,but Trump wants him to run the country’s top law enforcement agency.",en,Tweet,0,42,9,41,11510,2024-12-01 20:50:18,"<a href=""http://twitter.com/download/iphone"" rel=""nofollow"">Twitter for iPhone</a>",,,,
'1862215148481450043',"Every year @HendrickenHawks and Iggy’s Boardwalk at Oakland Beach come together to provide Thanksgiving meals to seniors and others in the area.

It’s a wonderful tradition that I was happy to join today, along with my son Max the littlest volunteer! https://t.co/tHosH19Bko",en,Tweet,0,22,1,2,1216,2024-11-28 19:21:04,"<a href=""http://twitter.com/download/iphone"" rel=""nofollow"">Twitter for iPhone</a>",,,photo,https://pbs.twimg.com/media/Gdfqy29WQAAzczW.jpg
'1859695768602562903',How it started… https://t.co/outhNxS8Zx,en,Tweet,3,73,4,25,8395,2024-11-21 20:29:57,"<a href=""http://twitter.com/download/iphone"" rel=""nofollow"">Twitter for iPhone</a>",,,photo,https://pbs.twimg.com/media/Gc73cVSX0AAzjFR.jpg
'1858276006005477672',Family fun day in South County ☀️ 🌊 https://t.co/0JcSn0Skk7,en,Tweet,0,13,0,3,1108,2024-11-17 22:28:19,"<a href=""http://twitter.com/download/iphone"" rel=""nofollow"">Twitter for iPhone</a>",,,photo,"https://pbs.twimg.com/media/GcnsISuWAAAnEKN.jpg,https://pbs.twimg.com/media/GcnsISxWMAA_tBD.jpg,https://pbs.twimg.com/media/GcnsISwXAAAKwvJ.jpg,https://pbs.twimg.com/media/GcnsISwWcAAT3rw.jpg"
'1858263916411039938',Love to see it from Rhode Island’s own @OfficialKwity!,en,Tweet,0,27,2,2,4247,2024-11-17 21:40:17,"<a href=""http://twitter.com/download/iphone"" rel=""nofollow"">Twitter for iPhone</a>",,,,
'1857471974278046192',What are they hiding?,en,Tweet,0,21,0,11,2725,2024-11-15 17:13:23,"<a href=""http://twitter.com/download/iphone"" rel=""nofollow"">Twitter for iPhone</a>",,,,
'1857462388741517396',"For decades, Presidential nominees have been subject to FBI background checks to ensure that those individuals do not have ties foreign governments or criminal groups.

If Gaetz and Gabbard have nothing to hide, they should do the background checks.

https://t.co/rWLZjsCr0n",en,Tweet,1,20,6,9,1720,2024-11-15 16:35:18,"<a href=""https://mobile.twitter.com"" rel=""nofollow"">Twitter Web App</a>",,https://www.cnn.com/2024/11/15/politics/security-clearances-fbi-gabbard-gaetz,,
'1856829293847851399',"Today I received a classified briefing about the recently reported Russian attempt to smuggle explosives onto planes bound for the US.

Later, I learned that Trump intends to appoint a pro-Russian Director of National Intelligence. This is incredibly dangerous. 

Statement:",en,Tweet,4,105,29,60,16076,2024-11-13 22:39:36,"<a href=""https://mobile.twitter.com"" rel=""nofollow"">Twitter Web App</a>",,,,
'1856067025615106301',"Joined the Cranston Veterans Day Parade today, honoring the brave men and women who’ve served our nation. Their dedication and courage are the foundation of our freedoms, and today we stand united in gratitude.

Thank you to everyone who came out. https://t.co/H654SMrB8y",en,Tweet,0,16,2,3,1087,2024-11-11 20:10:37,"<a href=""http://twitter.com/download/iphone"" rel=""nofollow"">Twitter for iPhone</a>",,,photo,"https://pbs.twimg.com/media/GcITHTfXkAAXBbF.jpg,https://pbs.twimg.com/media/GcITHTgXgAAAsel.jpg,https://pbs.twimg.com/media/GcITHTfXQAA-xNF.jpg,https://pbs.twimg.com/media/GcITHTfWoAA1FCs.jpg"
'1856036755239252449',"Honored to march in the East Greenwich Veterans Day Parade this morning.

Standing alongside our veterans and their families reminds us of the sacrifices they’ve made to protect our freedoms. 🇺🇸 https://t.co/FauHsTCnG2",en,Tweet,0,5,1,0,575,2024-11-11 18:10:20,"<a href=""http://twitter.com/download/iphone"" rel=""nofollow"">Twitter for iPhone</a>",,,photo,"https://pbs.twimg.com/media/GcH3lrkWMAAAxID.jpg,https://pbs.twimg.com/media/GcH3lrjW8AAMUus.jpg,https://pbs.twimg.com/media/GcH3lrmWIAA-_5B.jpg"
'1854685294009737623',"In Lincoln tonight for @riilsrmedia’s 42nd Annual Awards Evening, honoring Rhode Islanders who are making a difference in the lives of working people.

Bill Kennedy, Mary Barden, Chris Buffery, Justin Kelley, &amp; Bob Delaney were recognized for their outstanding service to workers. https://t.co/subQ1C2e7t",en,Tweet,0,3,0,0,710,2024-11-08 00:40:07,"<a href=""http://twitter.com/download/iphone"" rel=""nofollow"">Twitter for iPhone</a>",,,photo,"https://pbs.twimg.com/media/Gb0qbOqWUA0lTrs.jpg,https://pbs.twimg.com/media/Gb0qbOrXkAAGAOC.jpg,https://pbs.twimg.com/media/Gb0qbOpWAAwhAKF.jpg,https://pbs.twimg.com/media/Gb0qbOqXIAo-8yO.jpg"
'1854002239741780450',"Thank you to the people of Rhode Island’s Second District for trusting me to represent you for another term. I remain committed to fighting for Rhode Island values in the years to come.

Full statement: https://t.co/8oGqvVuJFP",en,Tweet,0,66,4,24,6817,2024-11-06 03:25:54,"<a href=""http://twitter.com/download/iphone"" rel=""nofollow"">Twitter for iPhone</a>",,,photo,https://pbs.twimg.com/media/Gbq9NQIWwBsYb91.jpg
'1853928371841028465',Rounding out the day in Providence and Johnston. Polls are open until 8:00 - still plenty of time to get out to vote! https://t.co/yn2J7djZme,en,Tweet,0,21,4,0,1254,2024-11-05 22:32:22,"<a href=""http://twitter.com/download/iphone"" rel=""nofollow"">Twitter for iPhone</a>",,,photo,"https://pbs.twimg.com/media/Gbp6BGbXIAQ_egI.jpg,https://pbs.twimg.com/media/Gbp6BGgW8AMn_tL.jpg"
'1853923043166634029',"Back in Cranston at Orchard Farms Elementary with State Senate Candidate Todd Patalano and @SenJackReed.

This election is the most important of our lives—so much is on the line, and every vote matters. This is not the time to sit out. https://t.co/PxryHMHbhL",en,Tweet,0,6,1,0,908,2024-11-05 22:11:12,"<a href=""http://twitter.com/download/iphone"" rel=""nofollow"">Twitter for iPhone</a>",,,photo,"https://pbs.twimg.com/media/Gbp1Kr6XIAAA7Qm.jpg,https://pbs.twimg.com/media/Gbp1Kr_XcAAcj4r.jpg,https://pbs.twimg.com/media/Gbp1Kr9WQAELqze.jpg"
'1853903481834254591',"Swinging by Tiogue School in Coventry and St. Mary’s Church in West Warwick w/ @LouRaptakis, Senator Burke, &amp; @RepPatSerpa.

This election is about protecting freedom, democracy, &amp; America’s future.

Your vote is your voice, &amp; it’s up to all of us to defend what matters most. https://t.co/eiWQBhCJKm",en,Tweet,0,6,1,0,1067,2024-11-05 20:53:28,"<a href=""http://twitter.com/download/iphone"" rel=""nofollow"">Twitter for iPhone</a>",,,photo,"https://pbs.twimg.com/media/GbpjVPCXkAA1xxd.jpg,https://pbs.twimg.com/media/GbpjVOYWcAAi9I2.jpg,https://pbs.twimg.com/media/GbpjVP-WoAAwmeb.jpg"
'1853887550043427187',"A+ sign spotted in Coventry. 

(If you have a toddler at home, you know). https://t.co/u6XTOsYiR7",en,Tweet,0,3,0,0,845,2024-11-05 19:50:10,"<a href=""http://twitter.com/download/iphone"" rel=""nofollow"">Twitter for iPhone</a>",,,photo,https://pbs.twimg.com/media/GbpU3JDWgAABneH.jpg
'1853885981574983838',"It’s a beautiful day out here in Westerly, the perfect weather for a nice walk to your local polling place.

Great to stop by Westerly Middle School with Rep. Azzinaro and @Victoria4RI and see so many people out voting today. https://t.co/vTfvJBhimC",en,Tweet,0,16,3,1,868,2024-11-05 19:43:56,"<a href=""http://twitter.com/download/iphone"" rel=""nofollow"">Twitter for iPhone</a>",,,photo,https://pbs.twimg.com/media/GbpTb_8WcAALcFH.jpg
'1853869442616156189',"We’ve gone past the tower and made it to Southern Rhode Island, where we visited the Narragansett Pier School and SK Community Rec Center.

Love seeing the turnout in both towns—this is how we make a difference. https://t.co/NUrga6CBOh",en,Tweet,0,15,2,3,1072,2024-11-05 18:38:13,"<a href=""http://twitter.com/download/iphone"" rel=""nofollow"">Twitter for iPhone</a>",,,photo,"https://pbs.twimg.com/media/GbpETbLWgAAUByq.jpg,https://pbs.twimg.com/media/GbpETbTW4AEhsag.jpg"
'1853840639835668983',"Some great non-election news today as well! This is the power of a union!

https://t.co/P7Shdcy8aP",en,Tweet,0,3,0,0,379,2024-11-05 16:43:45,"<a href=""http://twitter.com/download/iphone"" rel=""nofollow"">Twitter for iPhone</a>",,https://www.washingtonpost.com/transportation/2024/11/05/boeing-strike-machinists-contract-vote/,,
'1853828359672709212',"Stopped by Hanaford Elementary School in East Greenwich and Davisville Middle School in North Kingstown, and these communities are coming out in full force.

Voting is how we shape the future of our state and of our country, make sure you get to the polls today! https://t.co/X6gFYbiwSj",en,Tweet,0,9,1,1,959,2024-11-05 15:54:58,"<a href=""http://twitter.com/download/iphone"" rel=""nofollow"">Twitter for iPhone</a>",,,photo,"https://pbs.twimg.com/media/GbofBh1XcAAOa_q.jpg,https://pbs.twimg.com/media/GbofBh2WUAAZvAm.jpg"
'1853808631277347026',"Next stop: Hoxsie Elementary in Warwick with State Senate Candidate Peter Appollonio Jr. and State Rep Candidate James McElroy.

Excited to see so many people exercising their right to vote. Keep it up, Warwick! 🗳️ https://t.co/IN4hMOgmHG",en,Tweet,0,19,2,5,1366,2024-11-05 14:36:34,"<a href=""http://twitter.com/download/iphone"" rel=""nofollow"">Twitter for iPhone</a>",,,photo,"https://pbs.twimg.com/media/GboNHe5WIAEeQdJ.jpg,https://pbs.twimg.com/media/GboNHe8WkAAnx2r.jpg,https://pbs.twimg.com/media/GboNHfBXUAAZScW.jpg"
'1853797514664640803',"Good morning, Cranston! ☀️

Today is the big day, and we’re kicking it off at the Garden City School.

Awesome to see so many people getting out to vote first thing in the morning. https://t.co/tBLKtdkOfz",en,Tweet,0,49,5,10,3290,2024-11-05 13:52:24,"<a href=""http://twitter.com/download/iphone"" rel=""nofollow"">Twitter for iPhone</a>",,,photo,https://pbs.twimg.com/media/GboDAEpXEAExbi2.jpg
'1853525775258984928',"If indeed Russia is plotting to blow up US commercial airplanes, this would represent an unacceptable escalation by Vladimir Putin. Congress must investigate immediately.",en,Tweet,0,9,3,1,729,2024-11-04 19:52:36,"<a href=""https://mobile.twitter.com"" rel=""nofollow"">Twitter Web App</a>",,,,
'1853164356453745056',"A few final shots from the Philly suburbs before heading home to RI for the home stretch.  

Knocked on over a hundred doors, rallied some volunteers and ate some food *almost* as good as we have back home! 🇺🇸 https://t.co/Nuuocv6YN8",en,Tweet,0,61,5,13,3137,2024-11-03 19:56:27,"<a href=""http://twitter.com/download/iphone"" rel=""nofollow"">Twitter for iPhone</a>",,,photo,"https://pbs.twimg.com/media/GbfDJgFbkAAFTO_.jpg,https://pbs.twimg.com/media/GbfDJgEboAADG4x.jpg,https://pbs.twimg.com/media/GbfDJgDbUAAz51w.jpg,https://pbs.twimg.com/media/GbfDJgCaAAAUB0M.jpg"
'1852764071470276834',"Hello from Delaware County, Pennsylvania where we are working to get out the vote with my friend and colleague @marygayscanlon! 

Strong support for @KamalaHarris out on the doors! https://t.co/ze9dI2xULn",en,Tweet,0,79,13,20,5358,2024-11-02 17:25:51,"<a href=""http://twitter.com/download/iphone"" rel=""nofollow"">Twitter for iPhone</a>",,,photo,"https://pbs.twimg.com/media/GbZXF-tasAAK7aH.jpg,https://pbs.twimg.com/media/GbZXF-0a8AAExzz.jpg"
'1852486907097473074',Wheels up to Philadelphia to do some volunteering for @KamalaHarris. Let’s sprint to the finish! https://t.co/Z6yn1K1vpU,en,Tweet,0,159,7,20,7733,2024-11-01 23:04:30,"<a href=""http://twitter.com/download/iphone"" rel=""nofollow"">Twitter for iPhone</a>",,,photo,https://pbs.twimg.com/media/GbVbBVCW8AAeTj5.jpg
'1852045955954282645',"At Sparrows Point in Warwick with @SenWhitehouse &amp; @senatormckenney to chat with residents of about what issues are on their minds as we approach election day.

Had some important conversations about lowering costs and protecting our democracy so that all voices are heard. https://t.co/c9xM1LOWhU",en,Tweet,0,7,0,0,392,2024-10-31 17:52:19,"<a href=""http://twitter.com/download/iphone"" rel=""nofollow"">Twitter for iPhone</a>",,,photo,"https://pbs.twimg.com/media/GbPJ-rWbAAAgswa.jpg,https://pbs.twimg.com/media/GbPJ-qiXIAAvY8c.jpg,https://pbs.twimg.com/media/GbPJ-qiWgAAz9vI.jpg"
'1851773974763483140',"Thank you to everyone who joined phone banking session for the Harris-Walz campaign. ☎️ 

Connecting with voters and hearing their excitement is so inspiring—it’s incredible to see so many people energized and ready to make a difference! https://t.co/cSgAbV4Xp9",en,Tweet,0,17,2,3,706,2024-10-30 23:51:34,"<a href=""http://twitter.com/download/iphone"" rel=""nofollow"">Twitter for iPhone</a>",,,photo,https://pbs.twimg.com/media/GbLSm3QWgAAAdRB.jpg
'1851638199073775777',Good take from a real tough guy:,en,Tweet,0,30,4,11,3938,2024-10-30 14:52:03,"<a href=""https://mobile.twitter.com"" rel=""nofollow"">Twitter Web App</a>",,,,
'1851636512854520144',"We’re in the home stretch of the 2024 election cycle, if there was ever a time to take action – it's now.

Please join me for a virtual phone bank on tonight to share Kamala Harris's vision with swing voters, and encourage participation in this election.

https://t.co/UkBLOLnCfe",en,Tweet,0,11,2,1,517,2024-10-30 14:45:21,"<a href=""https://mobile.twitter.com"" rel=""nofollow"">Twitter Web App</a>",,https://events.democrats.org/event/698920/,,
'1851420168972595240',"Grateful for the passion of the @egdemocrats, as we work together to elect candidates who are focused on delivering for Rhode Islanders and our country. 

We’re in the home stretch of this election now—let’s keep this momentum going! https://t.co/SBzdPER7vx",en,Tweet,0,5,3,5,741,2024-10-30 00:25:40,"<a href=""http://twitter.com/download/iphone"" rel=""nofollow"">Twitter for iPhone</a>",,,photo,"https://pbs.twimg.com/media/GbGQ1HyW0AA2HDs.jpg,https://pbs.twimg.com/media/GbGQ1HyWgAA-sJb.jpg"
'1851263090702041202',"It’s get out the vote time! 

Join me for a virtual phone bank TOMORROW to help make sure every swing state voter has a plan to vote in the coming week.

https://t.co/UkBLOLnCfe",en,Tweet,0,5,1,1,423,2024-10-29 14:01:30,"<a href=""http://twitter.com/download/iphone"" rel=""nofollow"">Twitter for iPhone</a>",,https://events.democrats.org/event/698920/,,
'1851239837132587356',One week until Election Day. https://t.co/NMpE63Ghpy,en,Tweet,0,50,6,6,1976,2024-10-29 12:29:06,"<a href=""http://twitter.com/download/iphone"" rel=""nofollow"">Twitter for iPhone</a>",,,photo,https://pbs.twimg.com/media/GbDs0YaWcAEEL-A.jpg
'1851060973765046585',Congratulations Pat Crowley and Karen Hazard! I look forward to continuing to work with you both to fight for working Rhode Islanders.,en,Tweet,0,4,0,1,775,2024-10-29 00:38:21,"<a href=""http://twitter.com/download/iphone"" rel=""nofollow"">Twitter for iPhone</a>",,,,
'1851055991174922486',"Great meeting with the Providence Democratic Committee tonight!

Grateful for the grassroots volunteers committed to electing Democrats who will deliver for working people.

Let’s bring it home next Tuesday! https://t.co/ilVCI0SZ7h",en,Tweet,0,15,1,3,642,2024-10-29 00:18:33,"<a href=""http://twitter.com/download/iphone"" rel=""nofollow"">Twitter for iPhone</a>",,,photo,"https://pbs.twimg.com/media/GbBFnMwWMAA4iKO.jpg,https://pbs.twimg.com/media/GbBFnM1XMAA5WqZ.jpg,https://pbs.twimg.com/media/GbBFnMuWEAA8b_s.jpg"
'1850125857370644554',"Great to join @KimKalunian from @wpri12 yesterday to talk about how I’ve been working hard to deliver results for Rhode Island. Check out the interview here:

https://t.co/Q8Kq1sazTM",en,Tweet,0,6,0,1,534,2024-10-26 11:42:32,"<a href=""http://twitter.com/download/iphone"" rel=""nofollow"">Twitter for iPhone</a>",,https://www.wpri.com/news/local-news/community-focus/community-focus-congressman-seth-magaziner-3/,,
'1849593476679172135',"Had a great evening meeting with the Westerly Democratic Town Committees!

We’re focused on electing Democrats up and down the ballot who prioritize cutting costs, building a stronger economy, and safeguarding our democracy. https://t.co/x6SpJ1M2FK",en,Tweet,0,3,0,1,496,2024-10-25 00:27:03,"<a href=""http://twitter.com/download/iphone"" rel=""nofollow"">Twitter for iPhone</a>",,,photo,"https://pbs.twimg.com/media/GasTcOvWwAAN2pR.jpg,https://pbs.twimg.com/media/GasTcOpW0AAVxmq.jpg,https://pbs.twimg.com/media/GasTcOoWQAA8Gg1.jpg,https://pbs.twimg.com/media/GasTcPAXgAEqNlw.jpg"
'1849116544019870195',"Breaking: I have a new favorite constituent

@RWPZoo 

https://t.co/MIJIW2WnKE",en,Tweet,0,39,2,5,5523,2024-10-23 16:51:53,"<a href=""http://twitter.com/download/iphone"" rel=""nofollow"">Twitter for iPhone</a>",,https://www.bostonglobe.com/2024/10/22/metro/baby-sloth-providence-ri-roger-williams-park-zoo/,,
'1849062233310998575',"Proud to be a 2024 @MomsDemand Gun Sense Candidate. Together, we can build a safer future for everyone by passing common-sense gun safety laws that protect Rhode Islanders and all Americans. https://t.co/kuTAliCbDn",en,Tweet,2,33,1,16,2629,2024-10-23 13:16:04,"<a href=""https://mobile.twitter.com"" rel=""nofollow"">Twitter Web App</a>",,,photo,https://pbs.twimg.com/media/GakwH6rXYAAHGNn.png
'1848893334091170133',Happy opening night to all who celebrate! ☘️ https://t.co/HjKlepWgWQ,en,Tweet,0,16,0,3,735,2024-10-23 02:04:56,"<a href=""http://twitter.com/download/iphone"" rel=""nofollow"">Twitter for iPhone</a>",,,photo,https://pbs.twimg.com/media/GaiWrgQXUAADsMS.jpg
'1848514140765040909',"Another successful night of making calls for the Harris-Walz ticket and Democrats up and down the ballot. 📱

Every call counts—let’s keep the momentum going, register for our virtual phone bank next week here: https://t.co/UkBLOLnCfe https://t.co/M3kYIToIJX",en,Tweet,0,8,1,2,902,2024-10-22 00:58:09,"<a href=""http://twitter.com/download/iphone"" rel=""nofollow"">Twitter for iPhone</a>",,https://events.democrats.org/event/698920/,photo,"https://pbs.twimg.com/media/Gac9zN9XMAA-XXo.jpg,https://pbs.twimg.com/media/Gac9zN-W4AAmRHl.jpg"
'1848336185724129470',"Join me TONIGHT for a virtual phone bank to help elect Kamala Harris and support Democrats up and down the ballot. 📷

This election is only a few short weeks away - now is the time to take action, and you can do it from home!

https://t.co/RrEDjMFQI8",en,Tweet,0,9,1,6,844,2024-10-21 13:11:01,"<a href=""https://mobile.twitter.com"" rel=""nofollow"">Twitter Web App</a>",,https://events.democrats.org/event/698904/,,
'1848001995384266873',"Happy Birthday @KamalaHarris. 🎂🥳

And the best birthday gift we can give is making a plan to vote for her.

Find your voting location, sample ballot, and more at https://t.co/yVgqD7HC1g. 🗳️

Remember: the future is shaped by those who show up! https://t.co/xLpbdG5vLP",en,Tweet,0,84,8,24,3827,2024-10-20 15:03:04,"<a href=""http://twitter.com/download/iphone"" rel=""nofollow"">Twitter for iPhone</a>",,http://vote.ri.gov,photo,https://pbs.twimg.com/media/GaVsBMvXQAAeQmA.jpg
'1847983001386340863',"Ready to make a difference? All you need is a computer and a phone to join me for a phone bank to support the Harris-Walz ticket! 

Together, we’ll connect with voters and encourage turnout for the 2024 election.

Register here:

https://t.co/RrEDjMFQI8",en,Tweet,0,18,6,3,2375,2024-10-20 13:47:36,"<a href=""http://twitter.com/download/iphone"" rel=""nofollow"">Twitter for iPhone</a>",,https://events.democrats.org/event/698904/,,
'1847788662215627263',"Congratulations to the Italo American Club of Rhode Island on a wonderful event, and to my friend @ErnieAlmonte on being honored as tonight’s Person of the Year! 🇮🇹 🇺🇸 https://t.co/NICRLhHbJu",en,Tweet,0,6,0,0,497,2024-10-20 00:55:21,"<a href=""http://twitter.com/download/iphone"" rel=""nofollow"">Twitter for iPhone</a>",,,photo,"https://pbs.twimg.com/media/GaSp_iyXoAA6wn0.jpg,https://pbs.twimg.com/media/GaSp_iyXMAA7o0K.jpg,https://pbs.twimg.com/media/GaSp_i0XIAAtZM5.jpg,https://pbs.twimg.com/media/GaSp_iyXYAAOWVH.jpg"
'1847347065241616768',"Had a great visit to Scituate Vista in Cranston today with Rep. @JackieBag and State Senate candidate Todd Patalano.

We’re committed to ensuring that Rhode Island’s seniors have the support and resources they need to age with dignity. https://t.co/1LGs7xigMv",en,Tweet,0,2,0,0,423,2024-10-18 19:40:37,"<a href=""http://twitter.com/download/iphone"" rel=""nofollow"">Twitter for iPhone</a>",,,photo,"https://pbs.twimg.com/media/GaMYWSDXoAAGVu2.jpg,https://pbs.twimg.com/media/GaMYWSEXwAA4Tit.jpg,https://pbs.twimg.com/media/GaMYWSEXEAAgRzG.jpg,https://pbs.twimg.com/media/GaMYWSDWQAAdG-x.jpg"
'1847104248091144538',"Just wrapped up another successful virtual phone bank for @KamalaHarris, connecting with voters in swing states across the country. 📞 

Thank you to everyone who participated!

We’ve got another one next week, register here:

https://t.co/RrEDjMFQI8 https://t.co/fmqwNRX4Yk",en,Tweet,0,9,1,1,938,2024-10-18 03:35:44,"<a href=""http://twitter.com/download/iphone"" rel=""nofollow"">Twitter for iPhone</a>",,https://events.democrats.org/event/698904/,photo,"https://pbs.twimg.com/media/GaI7hNEWkAAj3_8.jpg,https://pbs.twimg.com/media/GaI7hM5XAAAa0o_.jpg"
