tweet_id,text,language,type,bookmark_count,favorite_count,retweet_count,reply_count,view_count,created_at,client,hashtags,urls,media_type,media_urls
'1939011937146483064',"Everyday costs are continuing to rise on essentials like groceries and baby supplies. Instead of working to deliver relief, President Trump and Congressional Republicans are trying to jack up costs even higher and give tax breaks to billionaires and corporations.",en,Tweet,0,11,5,20,1731,2025-06-28 18:24:05,"<a href=""http://twitter.com/download/iphone"" rel=""nofollow"">Twitter for iPhone</a>",,,,
'1938959257468018980',"Make no mistake: Congressional Republicans and President Trump are taking money from the wallets of hardworking Americans like fire fighters, teachers, truck drivers, and police officers while giving a massive tax break to the wealthiest Americans.",en,Tweet,0,50,26,29,3667,2025-06-28 14:54:45,"<a href=""http://twitter.com/download/iphone"" rel=""nofollow"">Twitter for iPhone</a>",,,,
'1938677749834534932',"If the Republican budget bill passes, combined with the President’s tariffs, next year police officers will lose $250 and fire fighters will lose $470 of income.

On the other hand, someone in the top 0.1% will get a tax break of $348,500.",en,Tweet,0,17,5,12,1646,2025-06-27 20:16:09,"<a href=""http://twitter.com/download/iphone"" rel=""nofollow"">Twitter for iPhone</a>",,,,
'1938593305102557366',"Under the Republican budget bill, more than 43,000 Granite Staters would lose their health coverage.

This bill is unacceptable and I will keep working to stop it.",en,Tweet,1,71,21,32,6756,2025-06-27 14:40:35,"<a href=""https://mobile.twitter.com"" rel=""nofollow"">Twitter Web App</a>",,,,
'1938342094470353279',"Lynette Kaichen of Effingham started The Pass Along Project to ensure that children entering emergency placement for foster care had access to clothes and shoes in their own size. 

Her compassion is why I named her June’s Granite Stater of the Month.",en,Tweet,0,7,2,1,1011,2025-06-26 22:02:22,"<a href=""https://mobile.twitter.com"" rel=""nofollow"">Twitter Web App</a>",,,,
'1938323230282141949',"Families are facing rising costs and need relief now – but Congressional Republicans are pushing a bill that would raise costs for people.

This bill is bad for Granite Staters and it’s bad for our country.",en,Tweet,0,6,1,15,1923,2025-06-26 20:47:25,"<a href=""https://mobile.twitter.com"" rel=""nofollow"">Twitter Web App</a>",,,,
'1938244168121278650',"Congressional Republicans have a plan to kick millions of Americans off of their health insurance to pay for tax breaks for billionaires.

That’s unacceptable, and I’m going to keep fighting it. https://t.co/qx1TugzTWA",en,Tweet,0,21,6,37,2009,2025-06-26 15:33:15,"<a href=""https://mobile.twitter.com"" rel=""nofollow"">Twitter Web App</a>",,,video,https://video.twimg.com/amplify_video/1938244037472874496/vid/avc1/1080x1350/EN7OINc_M0iKB_d_.mp4?tag=21
'1937997381909303520',"People are struggling to make ends meet. The Republican budget bill raises the cost of health care for everybody.

That’s unacceptable. https://t.co/oyemDRhhcT",en,Tweet,3,37,12,59,3682,2025-06-25 23:12:36,"<a href=""https://mobile.twitter.com"" rel=""nofollow"">Twitter Web App</a>",,,video,https://video.twimg.com/amplify_video/1937997258441523200/vid/avc1/1080x1350/e03lWJSusXn91LGl.mp4?tag=21
'1937897792820621690',"The bill pushed by Congressional Republicans would result in more than 43,000 Granite Staters losing their health care coverage.

I will keep speaking out about how this so-called “big beautiful bill” will hurt New Hampshire.",en,Tweet,0,21,14,15,4179,2025-06-25 16:36:52,"<a href=""https://mobile.twitter.com"" rel=""nofollow"">Twitter Web App</a>",,,,
'1937639200553123864',"I just spoke on the Senate floor about reproductive freedom on the third anniversary of the Supreme Court's decision to overturn Roe v Wade. 

WATCH: https://t.co/sCixR5OI9V",en,Tweet,1,18,8,9,1732,2025-06-24 23:29:19,"<a href=""https://mobile.twitter.com"" rel=""nofollow"">Twitter Web App</a>",,,video,https://video.twimg.com/amplify_video/1937638799913230336/vid/avc1/1080x1080/rcWS1KvULM7u9PCL.mp4?tag=21
'1937565642141376696',"Three years ago today the Supreme Court overturned Roe v Wade.

Since then, partisan politicians have continued to take away from more and more women the freedom to make their own health care decisions.

We must all continue to stand up for a woman’s fundamental freedom.",en,Tweet,1,12,5,23,3613,2025-06-24 18:37:01,"<a href=""https://mobile.twitter.com"" rel=""nofollow"">Twitter Web App</a>",,,,
'1937537604481876001',"President Trump and Congressional Republicans are pushing ahead with a plan that makes massive cuts to Medicaid to give billionaires more tax breaks. 

Congress should be making health care more affordable for patients, not increasing health care costs for millions of Americans.",en,Tweet,3,22,13,204,112820,2025-06-24 16:45:37,"<a href=""https://mobile.twitter.com"" rel=""nofollow"">Twitter Web App</a>",,,,
'1937252111571394652',"W.H. Bagshaw is one example of the many incredible New Hampshire small business that make our state a great place to live and work.

Great to celebrate their new home this morning. https://t.co/eSo4Mp3uyE",en,Tweet,0,8,3,2,1375,2025-06-23 21:51:10,"<a href=""https://mobile.twitter.com"" rel=""nofollow"">Twitter Web App</a>",,,photo,"https://pbs.twimg.com/media/GuKAhX8XQAACuoc.jpg,https://pbs.twimg.com/media/GuKAhYJXgAAfmjs.jpg"
'1937215180821368951',"Women shouldn’t have to travel hours for basic maternal care. 

While Republicans push tax breaks for billionaires that will harm rural hospitals, I am pushing for commonsense legislation to give these hospitals the resources they need to keep labor and delivery units open. https://t.co/jGcifo4Esc",en,Tweet,1,16,7,22,20798,2025-06-23 19:24:25,"<a href=""https://mobile.twitter.com"" rel=""nofollow"">Twitter Web App</a>",,,video,https://video.twimg.com/amplify_video/1937215072830361600/vid/avc1/1080x1350/mw9TP6nNzl0NaKJl.mp4?tag=21
'1937170105974350099',"It was great to be at the opening of the Madison Food Pantry’s new building last weekend.

This new building will help more Granite Staters access critical assistance.
https://t.co/DLiO4kOx0Q",en,Tweet,0,3,2,0,845,2025-06-23 16:25:18,"<a href=""https://mobile.twitter.com"" rel=""nofollow"">Twitter Web App</a>",,https://www.conwaydailysun.com/business/local/madison-food-pantry-celebrates-new-building/article_414920de-b858-44b7-8cdb-b6583068a354.html,,
'1936775302803234829',"We need more information about the U.S. strikes in Iran, including the intelligence that led to this decision. The priority now is to protect U.S. troops in the Middle East and around the globe, and to avoid a broader conflict or U.S. entanglement. Iran must never have a nuclear weapon. It is Congress' constitutional role to declare war and authorize the use of military force, and the President should be working with Congress to address national security issues.",en,Tweet,0,10,6,25,5400,2025-06-22 14:16:30,"<a href=""http://twitter.com/download/iphone"" rel=""nofollow"">Twitter for iPhone</a>",,,,
'1936541051042353221',"237 years ago, New Hampshire became the 9th state to ratify the constitution! 

Grateful to call the Live Free or Die state home.",en,Tweet,1,15,4,3,1639,2025-06-21 22:45:40,"<a href=""http://twitter.com/download/iphone"" rel=""nofollow"">Twitter for iPhone</a>",,,,
'1936162364279202071',"I appreciated the opportunity to answer questions from New Hampshire small business leaders and workers this morning at an event hosted by the Southern New Hampshire Chamber of Commerce. 

I will continue to work to get small businesses the support that they need. https://t.co/8hZjmlyWIH",en,Tweet,1,7,3,6,1236,2025-06-20 21:40:54,"<a href=""https://mobile.twitter.com"" rel=""nofollow"">Twitter Web App</a>",,,photo,https://pbs.twimg.com/media/Gt6hZtPWgAAJsBa.jpg
'1935803064981565930',"Congressional Republicans and President Trump are pushing a bill that makes drastic cuts to Medicaid just to pay for tax breaks for billionaires and corporate special interests.
 
This bill will be disastrous for Granite Staters and I will continue to stand against it.",en,Tweet,6,28,15,210,110827,2025-06-19 21:53:10,"<a href=""http://twitter.com/download/iphone"" rel=""nofollow"">Twitter for iPhone</a>",,,,
'1935744238417068259',"Honored to celebrate Juneteenth at the Black Heritage Trail of New Hampshire today.
 
Juneteenth reminds us to reflect on the history of our state and our country, and to continue fighting for equality for all. https://t.co/jUb0k9E6XL",en,Tweet,0,12,4,5,1188,2025-06-19 17:59:25,"<a href=""http://twitter.com/download/iphone"" rel=""nofollow"">Twitter for iPhone</a>",,,photo,https://pbs.twimg.com/media/Gt0lIDYXwAAx8tQ.jpg
'1935056222245257308',"Congratulations to Arlo Mesinschi of Dover, your LEGO creations are truly amazing!

Best of luck in the next stage of the competition.
https://t.co/niVFZqX0yZ",en,Tweet,0,7,2,2,1160,2025-06-17 20:25:29,"<a href=""https://mobile.twitter.com"" rel=""nofollow"">Twitter Web App</a>",,https://www.bostonglobe.com/2025/06/16/multimedia/12-lego-master-builder-dover/?et_rid=14152260&s_campaign=NH:newsletter,,
'1934688658910835009',"This morning I heard from seniors in Manchester who are concerned about the $500 billion Medicare cut triggered by President Trump's budget bill.

Thank you to the Granite Staters who are speaking out about the harms these cuts will cause. https://t.co/xsuga84thG",en,Tweet,2,26,12,21,3417,2025-06-16 20:04:55,"<a href=""https://mobile.twitter.com"" rel=""nofollow"">Twitter Web App</a>",,,photo,https://pbs.twimg.com/media/GtllEycakAA_zcE.jpg
'1934306962595786759',"New parents already have their budgets stretched thin – and now President Trump’s tariffs have made essential baby items, including car seats, cribs, baby monitors, high chairs, and strollers, more expensive.

Families need relief from rising costs.

https://t.co/KauDBNijBE",en,Tweet,0,13,5,26,1471,2025-06-15 18:48:12,"<a href=""http://twitter.com/download/iphone"" rel=""nofollow"">Twitter for iPhone</a>",,https://www.glamour.com/story/the-trump-tariffs-have-already-made-these-5-essential-baby-products-24-more-expensive,,
'1933989873318269390',"Today marks 250 years of the @USArmy!
 
Thank you for keeping our country safe, secure, and free.",en,Tweet,0,21,5,5,1912,2025-06-14 21:48:12,"<a href=""http://twitter.com/download/iphone"" rel=""nofollow"">Twitter for iPhone</a>",,,,
'1933919404703498537',"I’m horrified by the assassination of a Minnesota lawmaker and her husband, and the attempted assassination of another lawmaker and his wife. Political violence should have no place in our country, and I am praying for the families of Representative Hortman and Senator Hoffman.",en,Tweet,0,47,19,24,6480,2025-06-14 17:08:11,"<a href=""http://twitter.com/download/iphone"" rel=""nofollow"">Twitter for iPhone</a>",,,,
'1933651677174734918',"Honored to attend the change of command ceremony at the Portsmouth Naval Shipyard today.
 
Thank you to Captain Oberdorf and Captain Nice for your service.",en,Tweet,0,5,2,2,1315,2025-06-13 23:24:20,"<a href=""http://twitter.com/download/iphone"" rel=""nofollow"">Twitter for iPhone</a>",,,,
'1933589855218307429',"Iran must never be allowed to obtain a nuclear weapon, and I have worked across the aisle to help ensure that does not happen. The Iranian regime has called for Israel's complete destruction and is a state sponsor of terrorism. Israel is our strongest partner in the Middle East and the United States will always help protect it. Israel has a right to defend itself; we need more information about the decision making and intelligence that led to this attack. And the Trump Administration must ensure the safety of Americans in the area and work to prevent a broader regional conflict.",en,Tweet,11,272,25,83,29464,2025-06-13 19:18:40,"<a href=""http://twitter.com/download/iphone"" rel=""nofollow"">Twitter for iPhone</a>",,,,
'1933244431592743411',"In a democracy, police don't treat elected representatives of the people standing up for their constituents in the way law enforcement officers just manhandled and cuffed Senator Padilla. We need more answers from the administration. Now.
https://t.co/OGtlKU3svD",en,Tweet,0,125,36,301,40108,2025-06-12 20:26:05,"<a href=""https://mobile.twitter.com"" rel=""nofollow"">Twitter Web App</a>",,https://www.nbclosangeles.com/news/local/alex-padilla-noem-los-angeles-protests/3722522/,,
'1933185648296444320',"Good news: My bipartisan bill to increase penalties on violent criminals who work on behalf of foreign adversaries such as Iran unanimously passed the Senate.

Congress is sending a clear message that such behavior will be met with severe consequences.",en,Tweet,2,53,14,8,9223,2025-06-12 16:32:30,"<a href=""https://mobile.twitter.com"" rel=""nofollow"">Twitter Web App</a>",,,,
'1932240879361692123',"Secretary Kennedy’s move to fire every member of the CDC's vaccine advisory panel is a direct attack on the health of our communities. 

Firing these independent experts who review vaccines is dangerous, reckless, and wrong - and is part of the Secretary's anti-science agenda.",en,Tweet,0,29,13,22,2471,2025-06-10 01:58:19,"<a href=""http://twitter.com/download/iphone"" rel=""nofollow"">Twitter for iPhone</a>",,,,
'1932183283430814028',We should support projects like the Exeter solar array because they save taxpayer dollars &amp; help build a cleaner energy future. But the tax bill proposed by President Trump &amp; Congressional Republicans threatens clean energy efforts &amp; will raise energy costs for Granite Staters. https://t.co/Nzqcceo1uQ,en,Tweet,0,11,5,11,1553,2025-06-09 22:09:27,"<a href=""https://mobile.twitter.com"" rel=""nofollow"">Twitter Web App</a>",,,photo,"https://pbs.twimg.com/media/GtB-bbdXwAExQak.jpg,https://pbs.twimg.com/media/GtB-bcLXgAE7Xfx.jpg"
'1931754268941300052',"Pride Month is a celebration of the LGBTQ+ community – and it is also a reminder that there is still work to do to end discrimination and ensure equal rights for all.
 
Happy Pride Month New Hampshire 🌈",en,Tweet,0,33,9,24,3855,2025-06-08 17:44:42,"<a href=""http://twitter.com/download/iphone"" rel=""nofollow"">Twitter for iPhone</a>",,,,
'1931437896369639781',"A little rain didn’t stop the Merrimack Valley High School commencement this morning!
 
It was great to celebrate the hard work of the class of 2025. https://t.co/kVUSdWUV4G",en,Tweet,0,10,2,9,1431,2025-06-07 20:47:33,"<a href=""http://twitter.com/download/iphone"" rel=""nofollow"">Twitter for iPhone</a>",,,photo,"https://pbs.twimg.com/media/Gs3Yh99WcAAC8Ry.jpg,https://pbs.twimg.com/media/Gs3Yh99XUAA8Uju.jpg"
'1931072145536237744',"Great to be at @UofNH this afternoon for the grand opening of the newly renovated and expanded Spaulding Hall.
 
This building will serve as an important hub for learning and cutting-edge research, helping New Hampshire stay at the forefront of innovation. https://t.co/nkWyc8SPp8",en,Tweet,0,4,1,1,1113,2025-06-06 20:34:11,"<a href=""https://mobile.twitter.com"" rel=""nofollow"">Twitter Web App</a>",,,photo,https://pbs.twimg.com/media/GsyLwx9WYAA3D1Q.jpg
'1931040583151161771',"Today marks the 81st anniversary of D-Day, and the battle that turned the tide of WWII.

Today we honor the memory of those who fought to rid the world of tyranny and made the ultimate sacrifice for our freedom.",en,Tweet,0,15,6,3,1012,2025-06-06 18:28:46,"<a href=""https://mobile.twitter.com"" rel=""nofollow"">Twitter Web App</a>",,,,
'1931022759716397191',"On National Gun Violence Awareness Day, we remember all the lives that have been senselessly lost to gun violence.

We must keep working to save lives and protect our communities from gun violence.",en,Tweet,0,8,2,5,890,2025-06-06 17:17:57,"<a href=""https://mobile.twitter.com"" rel=""nofollow"">Twitter Web App</a>",,,,
'1930692753047843101',"Big news: The FDA confirmed that following my bipartisan push, prescription drug manufacturers have improved medication safety labeling for pregnant women.
 
All drugs on the market now provide pregnant women with clearer information about health risks. https://t.co/d4nWpvXX4l",en,Tweet,0,6,2,3,855,2025-06-05 19:26:37,"<a href=""https://mobile.twitter.com"" rel=""nofollow"">Twitter Web App</a>",,,video,https://video.twimg.com/amplify_video/1930692638061043712/vid/avc1/1080x1350/due6zgwNQtfVb8-F.mp4?tag=21
'1930339721143824556',"Happy birthday @RepChrisPappas!

I’m proud to call you a colleague and a friend.",en,Tweet,0,8,1,2,1067,2025-06-04 20:03:48,"<a href=""https://mobile.twitter.com"" rel=""nofollow"">Twitter Web App</a>",,,,
'1929981433306853682',"Happy 603 Day Granite Staters!

Proud to represent this beautiful state in the U.S. Senate.",en,Tweet,0,8,3,7,1291,2025-06-03 20:20:05,"<a href=""https://mobile.twitter.com"" rel=""nofollow"">Twitter Web App</a>",,,,
'1929622329966923780',"AmeriCorps members do critical work for our communities, but the Trump Administration’s funding cuts and firing of AmeriCorps staff are threatening this work. 

This morning in Manchester, I heard about the impact that the cuts to these programs will have on our communities. https://t.co/xGhXdkqoXI",en,Tweet,1,11,6,3,1111,2025-06-02 20:33:08,"<a href=""https://mobile.twitter.com"" rel=""nofollow"">Twitter Web App</a>",,,photo,https://pbs.twimg.com/media/GsdlQKHWoAAxXwt.jpg
'1929514371484385580',"Horrified by the violent attack against peaceful protesters in Colorado yesterday. I am praying for the victims and their families. 

We must stand united against antisemitism and hate of all forms.",en,Tweet,0,12,3,13,1699,2025-06-02 13:24:09,"<a href=""http://twitter.com/download/iphone"" rel=""nofollow"">Twitter for iPhone</a>",,,,
'1929176987387515385',"Catherine Reed of Hanover started an innovative program to provide food assistance to Dartmouth Cancer Center patients, helping them access fresh &amp; healthy food donated from local nonprofits. Her determination &amp; compassion is why I named her May’s Granite Stater of the Month.",en,Tweet,0,9,4,4,1449,2025-06-01 15:03:30,"<a href=""http://twitter.com/download/iphone"" rel=""nofollow"">Twitter for iPhone</a>",,,,
'1928867780951978175',"It was an honor to be ""ducked"" in Bretton Woods during Gold Star Awareness Month. This duck from the New Hampshire Army and National Guard serves as a reminder of our commitment to honoring gold star families and working to build a country worthy of their loved ones’ sacrifice. https://t.co/jB0XgLuoVX",en,Tweet,0,16,3,6,1327,2025-05-31 18:34:50,"<a href=""http://twitter.com/download/iphone"" rel=""nofollow"">Twitter for iPhone</a>",,,photo,https://pbs.twimg.com/media/GsS3BfvXkAA4TyP.jpg
'1928533366082580583',I was honored to attend the Memorial Day Ceremony at the New Hampshire Veterans Cemetery this morning and express my gratitude for those who made the ultimate sacrifice to protect our freedom. We will continue to honor their memory for years to come. https://t.co/D9t0aKfLx7,en,Tweet,0,16,4,0,834,2025-05-30 20:25:59,"<a href=""https://mobile.twitter.com"" rel=""nofollow"">Twitter Web App</a>",,,photo,https://pbs.twimg.com/media/GsOG3nPXYAEly4J.jpg
'1928189564058792361',"Republicans' plan to give tax breaks to billionaires & corporate special interests is paid for by gutting the health care that millions of Americans rely on.

Today I heard from rural health care providers in Littleton about how gutting Medicaid & Medicare would devastate patient care.",en,Tweet,1,13,6,16,1285,2025-05-29 21:39:50,"<a href=""https://mobile.twitter.com"" rel=""nofollow"">Twitter Web App</a>",,,photo,https://pbs.twimg.com/media/GsJOLI5WAAADrjM.jpg
'1928168813369188698',"This court decision may provide a reprieve, but let's be clear, President Trump’s reckless tariffs are still causing chaos and uncertainty. The President should not have imposed these tariffs to begin with, and I urge him to instead focus on lowering costs for families and small businesses.",en,Tweet,0,13,6,13,2185,2025-05-29 20:17:23,"<a href=""https://mobile.twitter.com"" rel=""nofollow"">Twitter Web App</a>",,,,
'1927775558407983201',"As Mental Health Awareness Month comes to a close, take a minute to check in with yourself – your mental health is just as important as your physical health.
 
And remember that if you are ever in crisis, call or text 988 to be connected to free and confidential support.",en,Tweet,0,5,3,7,849,2025-05-28 18:14:44,"<a href=""https://mobile.twitter.com"" rel=""nofollow"">Twitter Web App</a>",,,,
'1927462073400701142',I heard from NH health care providers in Nashua today about the importance of protecting Granite Staters’ health care in the face of President Trump and Congressional Republicans’ efforts to gut Medicaid to pay for tax giveaways for billionaires and corporate special interests. https://t.co/cjwFpoB4KC,en,Tweet,0,11,7,11,3048,2025-05-27 21:29:03,"<a href=""https://mobile.twitter.com"" rel=""nofollow"">Twitter Web App</a>",,,photo,https://pbs.twimg.com/media/Gr-4hc4XQAAl-1i.jpg
'1927427675603263709',"The Trump Administration’s tariffs are already creating chaos and uncertainty that is hurting our communities.
 
This morning I heard from Seacoast small business owners about how these reckless tariffs with Canada will affect tourism for our state as we head into the summer. https://t.co/VKnIddqdm9",en,Tweet,0,7,5,8,1157,2025-05-27 19:12:22,"<a href=""https://mobile.twitter.com"" rel=""nofollow"">Twitter Web App</a>",,,photo,"https://pbs.twimg.com/media/Gr-ZOtbXkAAFEia.jpg,https://pbs.twimg.com/media/Gr-ZOtZWEAAKpee.jpg"
'1927007417444745567',"We owe our fallen service members a debt that we can never fully repay, and we must strive every day to build a country worthy of their sacrifice.

On Memorial Day, we remember those who gave their lives to protect our freedom.",en,Tweet,0,12,7,8,1313,2025-05-26 15:22:25,"<a href=""http://twitter.com/download/iphone"" rel=""nofollow"">Twitter for iPhone</a>",,,,
'1926350645700755720',"I’m pushing Spotify to crack down on fake podcasts that advertise illegal websites claiming to sell drugs without a prescription.

Read more from CNN: https://t.co/Oj39EOJCuy",en,Tweet,0,25,6,10,1802,2025-05-24 19:52:38,"<a href=""http://twitter.com/download/iphone"" rel=""nofollow"">Twitter for iPhone</a>",,https://edition.cnn.com/2025/05/22/tech/spotify-drug-podcasts-senator-hassan-letter,,
'1925962840604614705',"Great to visit the ReGen Valley Tech Hub this morning.
 
The biofabrication work happening right here in Manchester will be a game changer in innovation and entrepreneurship. https://t.co/WXEwgpBhV4",en,Tweet,0,7,2,8,963,2025-05-23 18:11:38,"<a href=""https://mobile.twitter.com"" rel=""nofollow"">Twitter Web App</a>",,,photo,https://pbs.twimg.com/media/Grpk_gdWYAA1caA.jpg
'1925583162387595406',"I am horrified by the murder of two Israeli embassy staff members last night, and my thoughts are with their families. 
 
There is absolutely no place for antisemitism and we must stand united against all forms of hate.",en,Tweet,0,18,9,22,10062,2025-05-22 17:02:56,"<a href=""https://mobile.twitter.com"" rel=""nofollow"">Twitter Web App</a>",,,,
'1925293408647626786',"JUST IN: In addition to exploding the deficit, the Congressional Republican tax giveaway to billionaires and corporate special interests would trigger a $490 billion cut to Medicare. 

Seniors should not have their health care costs raised even higher.
https://t.co/qwuA5GQx3K",en,Tweet,1,30,22,24,1970,2025-05-21 21:51:33,"<a href=""https://mobile.twitter.com"" rel=""nofollow"">Twitter Web App</a>",,https://www.hassan.senate.gov/news/press-releases/senator-hassan-slams-gops-490-billion-medicare-cut-in-tax-bill,,
'1924899446627709022',"Habeas corpus is one of our most basic constitutional rights, protecting people from unlawful imprisonment. https://t.co/VJ0LNqQWkq",en,Tweet,9,175,66,87,10033,2025-05-20 19:46:05,"<a href=""https://mobile.twitter.com"" rel=""nofollow"">Twitter Web App</a>",,,video,https://video.twimg.com/amplify_video/1924899287957381120/vid/avc1/1080x1350/8EZZz5qkMHrHNL3e.mp4?tag=21
'1924542596795208069',"This morning I heard directly from educators and school officials about the critical support that the Department of Education provides for students.

Make no mistake: dismantling the Department of Education will hurt our children and leave them less prepared for the future. https://t.co/u7dkrDfruo",en,Tweet,1,13,6,18,1896,2025-05-19 20:08:06,"<a href=""https://mobile.twitter.com"" rel=""nofollow"">Twitter Web App</a>",,,photo,https://pbs.twimg.com/media/GrVZR-aXYAAx-wr.jpg
'1924212517540114509',"Deeply saddened to hear this awful news. My prayers are with President Biden, Jill, and their family.",en,Tweet,4,328,40,31,7121,2025-05-18 22:16:28,"<a href=""http://twitter.com/download/iphone"" rel=""nofollow"">Twitter for iPhone</a>",,,,
'1924143254422901141',"I am very grateful to have been honored by the New Hampshire Women’s Foundation.
 
Representing New Hampshire is the honor of my life and it is a true privilege to serve the Live Free or Die State. https://t.co/myXcrPpJ8u",en,Tweet,0,25,3,13,2116,2025-05-18 17:41:15,"<a href=""http://twitter.com/download/iphone"" rel=""nofollow"">Twitter for iPhone</a>",,,photo,https://pbs.twimg.com/media/GrPuFwrWQAAfGHY.jpg
'1923779852861157820',"Union members help make our state and country stronger by protecting the rights of workers.

Great to speak at the New Hampshire AFL-CIO Convention today. https://t.co/k72GTgkwIw",en,Tweet,0,25,3,11,1982,2025-05-17 17:37:13,"<a href=""http://twitter.com/download/iphone"" rel=""nofollow"">Twitter for iPhone</a>",,,photo,https://pbs.twimg.com/media/GrKjlHJW0AAJGup.jpg
