tweet_id,text,language,type,bookmark_count,favorite_count,retweet_count,reply_count,view_count,created_at,client,hashtags,urls,media_type,media_urls
'1970554875684757807',Lots of ways for us to feed hungry families. Not tracking how many there are… is not one of them.,en,Tweet,2,110,24,70,6561,2025-09-23 19:24:28,"<a href=""https://mobile.twitter.com"" rel=""nofollow"">Twitter Web App</a>",,,,
'1970549291950170270',"1) Take food money from hungry families
2) Start trade war that drives up food costs
3) Stop tracking the # of hungry families
4) Declare hunger solved without actually feeding people",en,Tweet,4,194,77,98,11783,2025-09-23 19:02:16,"<a href=""https://mobile.twitter.com"" rel=""nofollow"">Twitter Web App</a>",,,,
'1970532396073119761',"People can’t afford a 70% hike in their health insurance costs. They’re already barely scraping by as it is. That’s what we’re trying to solve.

Meanwhile, he’s throwing a temper tantrum because we are using our leverage to get a deal to SAVE AMERICANS’ HEALTH CARE.",en,Tweet,8,287,107,346,18960,2025-09-23 17:55:08,"<a href=""https://mobile.twitter.com"" rel=""nofollow"">Twitter Web App</a>",,,,
'1970526391214248002',"Go ahead and ask Americans if they can afford a 70% hike in their health insurance premiums right now. See how that goes.

It’s a crisis in the making that we’re TRYING to avoid, but Trump is refusing to meet with us.",en,Tweet,10,738,307,810,36086,2025-09-23 17:31:16,"<a href=""https://mobile.twitter.com"" rel=""nofollow"">Twitter Web App</a>",,,,
'1970498472508826034',For a guy who screams about the ‘Art of the Deal’ he sure doesn’t seem to understand that a deal involves two sides…,en,Tweet,4,446,113,402,31509,2025-09-23 15:40:20,"<a href=""https://mobile.twitter.com"" rel=""nofollow"">Twitter Web App</a>",,,,
'1970238491163525136',To all Minnesotans gathering tonight at sundown to celebrate Rosh Hashanah: Archie and I are wishing you a sweet and meaningful New Year. Shanah Tovah!,en,Tweet,0,42,5,12,2773,2025-09-22 22:27:16,"<a href=""http://twitter.com/download/iphone"" rel=""nofollow"">Twitter for iPhone</a>",,,,
'1970227801518149966',https://t.co/H7QHY4H5Ff,zxx,Tweet,1,166,22,78,11227,2025-09-22 21:44:47,"<a href=""http://twitter.com/download/iphone"" rel=""nofollow"">Twitter for iPhone</a>",,,photo,https://pbs.twimg.com/media/G1envloWEAADNIu.jpg
'1970225256859058332',FREE SPEECH WINS 🦅🇺🇸,en,Tweet,1,271,24,641,29051,2025-09-22 21:34:40,"<a href=""http://twitter.com/download/iphone"" rel=""nofollow"">Twitter for iPhone</a>",,,,
'1970195065839722745',"For months they’ve known they’d need our votes, and they did nothing. 

They watched this car crash in slow motion… and sat on their hands.",en,Tweet,2,70,15,29,6412,2025-09-22 19:34:42,"<a href=""http://twitter.com/download/iphone"" rel=""nofollow"">Twitter for iPhone</a>",,,,
'1969054828174192783',"R’s: WE’RE GONNA KICK EVEN MORE PEOPLE OFF HEALTH INSURANCE

D’s: no

R’s: I CAN’T BELIEVE THEY’D DO THIS",en,Tweet,12,1141,265,184,58358,2025-09-19 16:03:48,"<a href=""http://twitter.com/download/iphone"" rel=""nofollow"">Twitter for iPhone</a>",,,,
'1968756842873393395',https://t.co/zw3raGzVls,zxx,Tweet,5,297,46,28,51557,2025-09-18 20:19:43,"<a href=""https://mobile.twitter.com"" rel=""nofollow"">Twitter Web App</a>",,,photo,https://pbs.twimg.com/media/G1Jt6F6WkAADvAm.jpg
'1968451751679279402',Very grateful for the bipartisan rejection of her attempted censure resolution.,en,Reply,2,230,13,35,8449,2025-09-18 00:07:24,"<a href=""http://twitter.com/download/iphone"" rel=""nofollow"">Twitter for iPhone</a>",,,,
'1968451750018343344',"Just took a dip into the cesspool that is Nancy Mace’s social media. It’s shameful the way she is vilifying my friend Ilhan Omar to raise money for herself.  

Honestly, what Representative Mace has been doing illustrates all that is wrong with our politics right now.",en,Tweet,93,9133,805,893,219207,2025-09-18 00:07:23,"<a href=""http://twitter.com/download/iphone"" rel=""nofollow"">Twitter for iPhone</a>",,,,
'1968357327758926028',"Her name was Melissa Hortman. She and her husband Mark were shot and killed in their home in an act of vicious political violence. She was Minnesota’s Speaker of the House Emerita. They were dog lovers. Amateur bakers. Great parents. Best friends. 

You should know their names.",en,Tweet,107,7391,1639,759,183014,2025-09-17 17:52:11,"<a href=""https://mobile.twitter.com"" rel=""nofollow"">Twitter Web App</a>",,,,
'1968039667124842649',Okay release the files then,en,Tweet,18,1089,255,52,54843,2025-09-16 20:49:55,"<a href=""https://mobile.twitter.com"" rel=""nofollow"">Twitter Web App</a>",,,,
'1967325880985813191',"I have so much gratitude and respect for the Moyski, Flavin, and Merkel families, and all the Annunciation School community who brought us together at the beautiful celebrations of life for their dear children. When it would be understandable to sink into despair, they urged us toward light and our higher angels. We won’t forget.",en,Tweet,1,108,22,18,5812,2025-09-14 21:33:35,"<a href=""http://twitter.com/download/iphone"" rel=""nofollow"">Twitter for iPhone</a>",,,,
'1966149220630671477',"An unthinkable tragedy. Thousands of Americans, who kissed their loved ones goodbye on a typical Tuesday morning, were lost in a horrific act of terror. Today we pause to honor their memory.",en,Tweet,0,67,13,19,11296,2025-09-11 15:37:58,"<a href=""https://mobile.twitter.com"" rel=""nofollow"">Twitter Web App</a>",,,,
'1965867056567562607',Horrific. We all need to condemn these acts of political violence that are becoming far too commonplace in this country. We can’t continue like this.,en,Tweet,7,286,32,126,11437,2025-09-10 20:56:44,"<a href=""http://twitter.com/download/iphone"" rel=""nofollow"">Twitter for iPhone</a>",,,,
'1965792897707684310',"BUT WAIT! There’s more! 

Now instead of humans denying your care, they’re letting AI decide if your procedure gets covered or not!",en,Tweet,1,201,51,30,12107,2025-09-10 16:02:04,"<a href=""https://mobile.twitter.com"" rel=""nofollow"">Twitter Web App</a>",,,,
'1965473929507864871',“It’s going to trickle down! Any day now! Just watch!” 🤡,en,Tweet,31,2530,290,81,51069,2025-09-09 18:54:36,"<a href=""http://twitter.com/download/iphone"" rel=""nofollow"">Twitter for iPhone</a>",,,,
'1965452761648320999',"Our health care system is broken, nobody disagrees with that... but “more prior authorizations” isn’t how we fix it.

Certainly isn’t ‘MAHA’ https://t.co/kJiCadHwg2",en,Tweet,1,53,15,20,15005,2025-09-09 17:30:29,"<a href=""https://mobile.twitter.com"" rel=""nofollow"">Twitter Web App</a>",,,photo,https://pbs.twimg.com/media/G0aw1rsXgAAtb-q.png
'1965144049943466008',"Knew it would be bad.

It’s so much worse.",en,Tweet,98,12540,1018,378,175597,2025-09-08 21:03:46,"<a href=""http://twitter.com/download/iphone"" rel=""nofollow"">Twitter for iPhone</a>",,,,
'1964027856977010803',Will we listen to our children’s pleas for help?,en,Tweet,4,395,66,303,21719,2025-09-05 19:08:25,"<a href=""http://twitter.com/download/iphone"" rel=""nofollow"">Twitter for iPhone</a>",,,,
'1963682386253615479',It's easier to buy an AR-15 in most parts of this country than it is to get mental health care.,en,Tweet,16,2328,382,1169,62353,2025-09-04 20:15:38,"<a href=""http://twitter.com/download/iphone"" rel=""nofollow"">Twitter for iPhone</a>",,,,
'1963644797736165493',You sure about that? https://t.co/IF26P1y6Fm,en,Tweet,294,5442,1293,313,245489,2025-09-04 17:46:17,"<a href=""http://twitter.com/download/iphone"" rel=""nofollow"">Twitter for iPhone</a>",,,video,https://video.twimg.com/amplify_video/1963644746816966656/vid/avc1/886x488/0X-7HEwBmx6bCIld.mp4?tag=21
'1962980381541433430',https://t.co/UhQM2TxKCn,zxx,Tweet,8,541,35,34,17764,2025-09-02 21:46:08,"<a href=""http://twitter.com/download/iphone"" rel=""nofollow"">Twitter for iPhone</a>",,,photo,https://pbs.twimg.com/media/Gz3oQQZWkAA_wN2.jpg
'1962960105143411089',https://t.co/fvTkNhDvZ0,zxx,Tweet,12,635,46,28,14044,2025-09-02 20:25:33,"<a href=""http://twitter.com/download/iphone"" rel=""nofollow"">Twitter for iPhone</a>",,,photo,https://pbs.twimg.com/media/Gz3V0ASXYAAU5DW.jpg
'1962956016946999727',"Minnesota can act to protect our kids. But we also need action at the national level.
 
Back to DC today. Our kids deserve better than R’s sitting back and saying there’s nothing we can do.",en,Tweet,1,130,17,120,8486,2025-09-02 20:09:19,"<a href=""http://twitter.com/download/iphone"" rel=""nofollow"">Twitter for iPhone</a>",,,,
'1961152633818742790',What civilian on God’s green Earth needs a gun that fires 116 rounds that quickly,en,Tweet,51,4099,549,1835,267338,2025-08-28 20:43:19,"<a href=""http://twitter.com/download/iphone"" rel=""nofollow"">Twitter for iPhone</a>",,,,
'1961143048504521027',https://t.co/sEfG2nwGNW,zxx,Reply,3,77,12,32,12033,2025-08-28 20:05:13,"<a href=""http://twitter.com/download/iphone"" rel=""nofollow"">Twitter for iPhone</a>",,https://www.startribune.com/annunciation-church-minneapolis-us-school-shootings/601462657,,
'1961142685000954275',"“Do not offer thoughts and prayers as you systematically enable such tragedies. Do not claim prayers are sufficient when children die as they pray. Do not pretend you do not understand.”

— Lydia, 16, Minneapolis",en,Tweet,34,2202,526,452,107467,2025-08-28 20:03:47,"<a href=""http://twitter.com/download/iphone"" rel=""nofollow"">Twitter for iPhone</a>",,,,
'1961061774767075744',"There are 400 million guns in this country. More guns than people.

In America, we are ten times more likely to be shot in a school or playground than any other developed nation.",en,Reply,17,828,146,1181,72489,2025-08-28 14:42:16,"<a href=""http://twitter.com/download/iphone"" rel=""nofollow"">Twitter for iPhone</a>",,,,
'1961061772221149678',"I dare you to go to Annunciation School and tell our grieving community, in effect, guns don’t kill kids, antidepressants do.

Just shut up. Stop peddling bullshit. You should be fired.",en,Tweet,491,22667,4376,7238,1799840,2025-08-28 14:42:15,"<a href=""http://twitter.com/download/iphone"" rel=""nofollow"">Twitter for iPhone</a>",,,,
'1960849107372925025',"It doesn’t have to be this way.

Even when it’s hard to find hope, I will keep working on it. https://t.co/gWUdHVQABV",en,Tweet,8,415,74,218,21502,2025-08-28 00:37:12,"<a href=""http://twitter.com/download/iphone"" rel=""nofollow"">Twitter for iPhone</a>",,,video,https://video.twimg.com/amplify_video/1960848977256976384/vid/avc1/444x960/Qxe45H2a1BXdUSZZ.mp4?tag=21
'1960743212110238075',"Please send all of your prayers and strength to the doctors, nurses and hospital staff caring for these children and the families in those waiting rooms.

All of Minnesota is with you ❤️",en,Tweet,10,1629,195,204,65766,2025-08-27 17:36:25,"<a href=""http://twitter.com/download/iphone"" rel=""nofollow"">Twitter for iPhone</a>",,,,
'1960713937919303987',"My staff and I are monitoring the situation at Annunciation Catholic School. I’m grateful for the quick response of law enforcement as we continue to gather information. 

It’s the first week of school. These kids should not be fearing for their lives.",en,Tweet,10,511,114,278,43610,2025-08-27 15:40:05,"<a href=""http://twitter.com/download/iphone"" rel=""nofollow"">Twitter for iPhone</a>",,,,
'1960359774572159135',Moose’s time to shine! https://t.co/5PW9posUH3,en,Tweet,1,237,15,12,11934,2025-08-26 16:12:46,"<a href=""http://twitter.com/download/iphone"" rel=""nofollow"">Twitter for iPhone</a>",,,photo,"https://pbs.twimg.com/media/GzSY0tlWIAAkUHB.jpg,https://pbs.twimg.com/media/GzSY0tnXgAAPS1R.jpg"
'1959296445862830358',"To whoever screamed “LOOK! IT’S SENATOR WHAT’S HER FACE!” at the State Fair, I hope you have an incredible day 😂",en,Tweet,60,5181,201,79,112838,2025-08-23 17:47:29,"<a href=""http://twitter.com/download/iphone"" rel=""nofollow"">Twitter for iPhone</a>",,,,
'1958966178182774870',"Does raspberry beer soft serve ice cream count as drinking on the job? 

Asking for a friend… https://t.co/smKm7YKaPs",en,Tweet,11,765,36,141,28728,2025-08-22 19:55:07,"<a href=""http://twitter.com/download/iphone"" rel=""nofollow"">Twitter for iPhone</a>",,,photo,https://pbs.twimg.com/media/Gy-lRlbWgAAxj66.jpg
'1958589731949666601',Opening Day: ✅ https://t.co/3jzv4eM7L0,en,Tweet,3,505,26,112,11203,2025-08-21 18:59:15,"<a href=""http://twitter.com/download/iphone"" rel=""nofollow"">Twitter for iPhone</a>",,,photo,https://pbs.twimg.com/media/Gy5O-ovWQAAqAeJ.jpg
'1957885825242616110',Republicans' energy plan: https://t.co/YKsvyJd0XS,en,Tweet,3,390,56,39,16926,2025-08-19 20:22:11,"<a href=""http://twitter.com/download/iphone"" rel=""nofollow"">Twitter for iPhone</a>",,,photo,https://pbs.twimg.com/media/GyvOx-BXcAAPmcC.jpg
'1956816684263641200',Let me put this in their own words: https://t.co/CR5xQdjI2m,en,Tweet,14,439,104,30,16226,2025-08-16 21:33:48,"<a href=""http://twitter.com/download/iphone"" rel=""nofollow"">Twitter for iPhone</a>",,,video,https://video.twimg.com/amplify_video/1956816633168556032/vid/avc1/720x622/i9KAbcjAbs_vWsiK.mp4?tag=21
'1956051967811154097',@SenatorHeinrich I thought the exact same thing,en,Reply,0,25,3,7,5338,2025-08-14 18:55:05,"<a href=""http://twitter.com/download/iphone"" rel=""nofollow"">Twitter for iPhone</a>",,,,
'1956049436053835982',We are going to see unheard of levels of spin after today’s inflation report – and they are going to do something unfathomably insane to try and wrestle media attention away from it.,en,Tweet,10,792,191,54,12933,2025-08-14 18:45:01,"<a href=""http://twitter.com/download/iphone"" rel=""nofollow"">Twitter for iPhone</a>",,,,
'1956029347719971113',https://t.co/cjG90KhYSx,zxx,Tweet,7,826,74,19,19960,2025-08-14 17:25:12,"<a href=""http://twitter.com/download/iphone"" rel=""nofollow"">Twitter for iPhone</a>",,,photo,https://pbs.twimg.com/media/GyU2U2YWYAAqi-P.jpg
'1955675041326371188',Add this to the LONG list of reasons why they’re desperately trying to talk about anything BESIDES the economy.,en,Tweet,4,240,64,55,8377,2025-08-13 17:57:19,"<a href=""http://twitter.com/download/iphone"" rel=""nofollow"">Twitter for iPhone</a>",,,,
'1955318208052826327',"Installing a crank economist to only publish favorable or distorted data on the economy (inflation, jobs numbers, etc.)
 
Textbook authoritarianism – mum from my GOP colleagues.",en,Tweet,10,1090,252,107,21986,2025-08-12 18:19:23,"<a href=""http://twitter.com/download/iphone"" rel=""nofollow"">Twitter for iPhone</a>",,,,
'1955294382225023294',4D CHESS! ARE WE TIRED OF WINNING?!,en,Tweet,5,476,69,64,19044,2025-08-12 16:44:42,"<a href=""http://twitter.com/download/iphone"" rel=""nofollow"">Twitter for iPhone</a>",,,,
'1954922473105047836',WHAT THE HECK IS IN THOSE FILES?!,en,Tweet,445,42708,5056,897,930148,2025-08-11 16:06:52,"<a href=""http://twitter.com/download/iphone"" rel=""nofollow"">Twitter for iPhone</a>",,,,
'1953528709299732531',"Many VA employees are veterans themselves. Canceling their union contracts is not only insulting to their service, but it’s going to make the quality of care for our veterans worse.

These men and women made incredible sacrifices for our country. This is not how we repay them.",en,Tweet,2,116,45,26,16708,2025-08-07 19:48:33,"<a href=""http://twitter.com/download/iphone"" rel=""nofollow"">Twitter for iPhone</a>",,,,
'1951753932197240845',"Reminder that insurrectionists attacked police officers on January 6th and Trump pardoned every one of them.
 
This one wanted to go after the officer he attacked.",en,Tweet,1,231,71,140,14473,2025-08-02 22:16:13,"<a href=""http://twitter.com/download/iphone"" rel=""nofollow"">Twitter for iPhone</a>",,,,
'1951389813090713900',A version of this happened under Obam—oh it was Nixon. That makes more sense. https://t.co/qBWm6yq8tl,en,Tweet,1,60,24,11,4640,2025-08-01 22:09:21,"<a href=""http://twitter.com/download/iphone"" rel=""nofollow"">Twitter for iPhone</a>",,,photo,https://pbs.twimg.com/media/GxS6sU1WwAAvGXc.jpg
'1951337191885402280',Ah so Trump did this intentionally?,en,Tweet,0,51,11,16,4332,2025-08-01 18:40:15,"<a href=""http://twitter.com/download/iphone"" rel=""nofollow"">Twitter for iPhone</a>",,,,
'1951300065357693196',This is a Soviet car — so close! https://t.co/HKnxlI6zgU,en,Tweet,65,4204,297,70,138345,2025-08-01 16:12:43,"<a href=""http://twitter.com/download/iphone"" rel=""nofollow"">Twitter for iPhone</a>",,,photo,https://pbs.twimg.com/media/GxRpEZNW8AItL4h.jpg
'1951059684766654649',Heard we’re discussing re-drawing districts so I wanted to drop an idea https://t.co/AdHK1anZe2,en,Tweet,177,7807,266,378,232111,2025-08-01 00:17:32,"<a href=""http://twitter.com/download/iphone"" rel=""nofollow"">Twitter for iPhone</a>",,,photo,https://pbs.twimg.com/media/GxOOcXtWgAAl0Sq.jpg
'1951050734612746625',Is this where you’re going to store the Epstein files?,en,Tweet,8,1397,193,382,61059,2025-07-31 23:41:58,"<a href=""http://twitter.com/download/iphone"" rel=""nofollow"">Twitter for iPhone</a>",,,,
'1950951715278037387',I hear about this all the time from constituents. People are repulsed by the inhumanity of this and how innocent people are being targeted when they are just trying to figure out how to get just a little bit of food – literally starving to death. I stand firmly against that.,en,Reply,1,16,2,3,1765,2025-07-31 17:08:30,"<a href=""https://mobile.twitter.com"" rel=""nofollow"">Twitter Web App</a>",,,,
'1950951713872941364',Civilians in Gaza have been turned into a weapon of war in a way that is despicable. The point of this letter and the point of what many of us have been doing for months is to put pressure on the Netanyahu government to change their policy.,en,Reply,1,15,3,3,1912,2025-07-31 17:08:30,"<a href=""https://mobile.twitter.com"" rel=""nofollow"">Twitter Web App</a>",,,,
'1950951712241451261',The humanitarian situation in Gaza is untenable. Netanyahu needs to take responsibility to solve this problem instead of continually pushing the blame off on others. The hostages need to be returned. We need an end to the fighting.,en,Tweet,5,80,26,37,12837,2025-07-31 17:08:29,"<a href=""https://mobile.twitter.com"" rel=""nofollow"">Twitter Web App</a>",,,,
'1950699542984179755',“I get to give $350 billion dollars to whoever I want”,en,Tweet,5,271,81,81,16378,2025-07-31 00:26:27,"<a href=""http://twitter.com/download/iphone"" rel=""nofollow"">Twitter for iPhone</a>",,,,
'1950611637422936329',"Medicare and Medicaid provide life-saving health insurance to the folks who need it.

Millions of Americans are better off, but Republicans brazenly gutted that care to cater to their rich friends and big corporations who'll never know what it's like to struggle. Shame on them.",en,Tweet,0,60,30,24,9066,2025-07-30 18:37:09,"<a href=""https://mobile.twitter.com"" rel=""nofollow"">Twitter Web App</a>",,,,
'1950556880545140806',"The laws of war don’t just apply when it’s convenient.
 
Hamas is a brutal terrorist organization. But Netanyahu doesn’t get a pass. He is responsible for the pervasive starvation and famine, which is morally repugnant.
 
Feed Gaza.",en,Tweet,3,102,23,91,5791,2025-07-30 14:59:34,"<a href=""http://twitter.com/download/iphone"" rel=""nofollow"">Twitter for iPhone</a>",,,,
'1950334808837468589',"If Trump were actually the strong-man he pretends to be, he'd tell Netanyahu to allow the food to flow, so innocent Palestinian children don't die of starvation.

Talking about how sad this is in between rounds at his golf course in Scotland is weak beyond words.
 
Feed Gaza.",en,Tweet,1,297,85,93,7649,2025-07-30 00:17:08,"<a href=""http://twitter.com/download/iphone"" rel=""nofollow"">Twitter for iPhone</a>",,,,
'1950313632572514389',"I've been in touch with Mayor Carter and am monitoring the situation in St. Paul.
 
A coordinated, malicious attack on one of Minnesota’s biggest cities is disruptive, but I’m grateful to Governor Walz and Mayor Carter for their leadership, and to all the experts working to get to the bottom of this. I’m prepared to help in any way I can.",en,Tweet,0,120,31,75,16467,2025-07-29 22:52:59,"<a href=""http://twitter.com/download/iphone"" rel=""nofollow"">Twitter for iPhone</a>",,,photo,https://pbs.twimg.com/media/GxDn6boXcAAOewq.jpg
'1950244936558707173',"Years of painstaking work finally paid off. Democrats and Republicans alike agreed that we need to address the housing crisis in this country. 

Next stop: Senate floor.",en,Tweet,2,96,33,32,8045,2025-07-29 18:20:01,"<a href=""https://mobile.twitter.com"" rel=""nofollow"">Twitter Web App</a>",,,,
'1950202666446917883',Not to mention they’re doing this a few weeks before school starts.,en,Tweet,3,181,48,67,11648,2025-07-29 15:32:03,"<a href=""https://mobile.twitter.com"" rel=""nofollow"">Twitter Web App</a>",,,,
'1949873434189496696',“Privilege” is quite the word choice,en,Tweet,33,4225,491,457,136502,2025-07-28 17:43:48,"<a href=""https://mobile.twitter.com"" rel=""nofollow"">Twitter Web App</a>",,,,
'1948746625049829535',A convicted sex offender open to pardoning a convicted child sex trafficker…,en,Tweet,154,9713,1730,970,286326,2025-07-25 15:06:16,"<a href=""http://twitter.com/download/iphone"" rel=""nofollow"">Twitter for iPhone</a>",,,,
'1948485871042281566',Sounds like they need to… release the Epstein files.,en,Tweet,7,971,164,43,20633,2025-07-24 21:50:07,"<a href=""http://twitter.com/download/iphone"" rel=""nofollow"">Twitter for iPhone</a>",,,,
'1948456187025895594',"Food and water should never be politicized. Netanyahu's disregard for civilian life is appalling. 

The near-total blockade of food and aid into Gaza must end – innocent children are being starved.",en,Tweet,3,146,49,39,12191,2025-07-24 19:52:10,"<a href=""https://mobile.twitter.com"" rel=""nofollow"">Twitter Web App</a>",,,,
'1948437849365237892',"Nothing about this is “routine.” 

The President of the United States was involved with a sex offender.",en,Tweet,11,1014,266,429,36490,2025-07-24 18:39:18,"<a href=""https://mobile.twitter.com"" rel=""nofollow"">Twitter Web App</a>",,,,
'1948356754539950210',https://t.co/zHI8IhxLkC,zxx,Tweet,12,1084,208,26,20344,2025-07-24 13:17:03,"<a href=""http://twitter.com/download/iphone"" rel=""nofollow"">Twitter for iPhone</a>",,,photo,https://pbs.twimg.com/media/Gwn0JEfXoAAq_43.jpg
'1948127853393989645',No way… you’re kidding! That’s crazy… https://t.co/NLhRc1MCXo,en,Tweet,24,3252,311,497,83553,2025-07-23 22:07:29,"<a href=""http://twitter.com/download/iphone"" rel=""nofollow"">Twitter for iPhone</a>",,,photo,"https://pbs.twimg.com/media/Gwkj9XTWkAAxiew.jpg,https://pbs.twimg.com/media/Gwkj9XRWgAMGHEC.jpg"
'1948125303647166896',https://t.co/jbk838LAkb,zxx,Tweet,62,4608,210,42,106092,2025-07-23 21:57:21,"<a href=""http://twitter.com/download/iphone"" rel=""nofollow"">Twitter for iPhone</a>",,,photo,https://pbs.twimg.com/media/Gwkho8aWEAAhZfP.jpg
'1948068953793638550',https://t.co/UDqKAXaV7l,zxx,Tweet,6,538,52,119,38951,2025-07-23 18:13:26,"<a href=""http://twitter.com/download/iphone"" rel=""nofollow"">Twitter for iPhone</a>",,,photo,https://pbs.twimg.com/media/GwjuY9_WwAEFGKs.jpg
'1948033276083605720',What announcement do we think Trump will manufacture today to cover up the fact Jeffrey Epstein was a guest at his wedding?,en,Tweet,1,63,28,47,5052,2025-07-23 15:51:40,"<a href=""https://mobile.twitter.com"" rel=""nofollow"">Twitter Web App</a>",,,,
'1947774017768985026',Epstein files are real but also they’re not but they’re on Pam Bondi’s desk and we’re going to release them but we also can’t (even though we promised we would) and let's talk about someone else because this is really inconvenient for us and even our own supporters are furious https://t.co/WWZ46n4WRY,en,Tweet,3,138,33,47,5011,2025-07-22 22:41:28,"<a href=""https://mobile.twitter.com"" rel=""nofollow"">Twitter Web App</a>",,,photo,https://pbs.twimg.com/media/Gwfh6ilXIAAAsYz.jpg
'1947764799556973048',"30 years of public service is no small feat - advocating for farmers, veterans, and working families in Buffalo and across the state. Senator Anderson will be remembered as a fighter for the state he loved.

May his memory be a blessing.",en,Tweet,0,49,9,4,3718,2025-07-22 22:04:50,"<a href=""https://mobile.twitter.com"" rel=""nofollow"">Twitter Web App</a>",,,,
'1947721821622575585',Per my previous email... https://t.co/1bW2IxN3oG,en,Tweet,22,2558,274,67,72933,2025-07-22 19:14:03,"<a href=""https://mobile.twitter.com"" rel=""nofollow"">Twitter Web App</a>",,,photo,https://pbs.twimg.com/media/GweyoH3XIAA2wxZ.jpg
'1947718525042495670',https://t.co/Tk6768N1Vz,zxx,Tweet,1,53,10,3,3561,2025-07-22 19:00:57,"<a href=""https://mobile.twitter.com"" rel=""nofollow"">Twitter Web App</a>",,,photo,https://pbs.twimg.com/media/GwevoR6WQAAf_N6.jpg
'1947690214853398732',The “most transparent administration in history” is shutting down a branch of government early because that’s how badly they don’t want to release the Epstein files.,en,Tweet,19,2498,619,183,47795,2025-07-22 17:08:28,"<a href=""https://mobile.twitter.com"" rel=""nofollow"">Twitter Web App</a>",,,,
'1947414941549662484',Amy’s right. Republicans are rewarding states for creating more waste and committing more fraud.,en,Tweet,1,141,56,92,28017,2025-07-21 22:54:37,"<a href=""http://twitter.com/download/iphone"" rel=""nofollow"">Twitter for iPhone</a>",,,,
'1947340962734170196',Has anyone checked Mar-A-Lago for the Epstein files? Heard he likes to keep sensitive documents there...,en,Tweet,3,934,170,355,22662,2025-07-21 18:00:40,"<a href=""https://mobile.twitter.com"" rel=""nofollow"">Twitter Web App</a>",,,,
