tweet_id,text,language,type,bookmark_count,favorite_count,retweet_count,reply_count,view_count,created_at,client,hashtags,urls,media_type,media_urls
'1970295202569998656',Wishing a sweet and joyful new year to all those celebrating around the world tonight. Shanah Tovah!,en,Tweet,3,546,77,246,42498,2025-09-23 02:12:37,"<a href=""http://twitter.com/download/iphone"" rel=""nofollow"">Twitter for iPhone</a>",,,,
'1970240273461502217',"Donald Trump wants you to be afraid.

But more and more, there are examples of everyday courage that should give us reason to hope. https://t.co/59bFipQQS2",en,Tweet,40,2372,549,1849,69741,2025-09-22 22:34:21,"<a href=""https://mobile.twitter.com"" rel=""nofollow"">Twitter Web App</a>",,,video,https://video.twimg.com/amplify_video/1970236453377429504/vid/avc1/1920x1080/sp5fcjqNF05MBRbL.mp4?tag=21
'1970162498792718492',"Donald Trump is making every possible effort to silence and intimidate his critics, and anyone else who stands up to him.

I won’t back down. https://t.co/IO2OMxBXFp",en,Tweet,74,6876,1579,2652,110820,2025-09-22 17:25:18,"<a href=""https://mobile.twitter.com"" rel=""nofollow"">Twitter Web App</a>",,,video,https://video.twimg.com/amplify_video/1970162362855432192/vid/avc1/1280x720/24hgK5r2fkrgV_2i.mp4?tag=21
'1969836198873932079',"Who takes $50,000 in cash in a bag if they're doing something legitimate? https://t.co/FDSUtrBI3M",en,Tweet,213,16105,3678,4742,319192,2025-09-21 19:48:42,"<a href=""https://mobile.twitter.com"" rel=""nofollow"">Twitter Web App</a>",,,video,https://video.twimg.com/amplify_video/1969833093293920256/vid/avc1/1280x720/ZaF_5eBCUJtQoOQ1.mp4?tag=21
'1969794792184803492',"Today, I join Armenians in California and around the world in celebrating the 34th anniversary of the independence of the Republic of Armenia.

While the road to independence has never been easy, time has proven that Armenians are survivors – survivors of foreign domination and survivors of the first genocide of the 20th century.

The Armenian community continues to illustrate what an essential part of the national fabric they are, breaking new ground socially, economically, and politically across the nation.

I stand with the Armenian people, always.",en,Tweet,11,500,91,446,46161,2025-09-21 17:04:10,"<a href=""https://mobile.twitter.com"" rel=""nofollow"">Twitter Web App</a>",,,,
'1969773571338571800',"Kash Patel wants you to believe the Bureau of Prisons’ decision to move Epstein’s co-conspirator to a minimum security prison after her interview was… a coincidence.

His false testimony is an insult to the intelligence of the America people. https://t.co/SLUoD2gbTc",en,Tweet,431,26935,6351,3004,438068,2025-09-21 15:39:50,"<a href=""https://mobile.twitter.com"" rel=""nofollow"">Twitter Web App</a>",,,video,https://video.twimg.com/amplify_video/1969773105477279745/vid/avc1/1920x1080/tt2rpAmZ1PK1ydi8.mp4?tag=21
'1969577975713534027',"There’s no hiding the political retaliation and weaponization. 

It’s all out in the open. https://t.co/5MF3z0ZSK5",en,Tweet,1033,38950,8168,9982,1409848,2025-09-21 02:42:37,"<a href=""http://twitter.com/download/iphone"" rel=""nofollow"">Twitter for iPhone</a>",,,photo,https://pbs.twimg.com/media/G1VYuxMWIAAv_Eb.jpg
'1969508887641391584',"Border Czar Tom Homan was caught by the FBI accepting bribes - on camera - to deliver government contracts in exchange for $50,000 in cash.

Pam Bondi knew.

Kash Patel knew.

Emil Bove knew.

And they made the investigation go away.

A corrupt attempt to conceal brazen graft.",en,Tweet,3178,95468,23614,17456,2874320,2025-09-20 22:08:05,"<a href=""http://twitter.com/download/iphone"" rel=""nofollow"">Twitter for iPhone</a>",,,,
'1969223464553750909',"The attack on Jimmy Kimmel is yet another page in the dictator's playbook. 

When will my more of my Republicans colleagues recognize that traveling down this road does not end well for any of us? https://t.co/Wdgzsl3rDW",en,Tweet,119,6282,1317,5608,193679,2025-09-20 03:13:55,"<a href=""https://mobile.twitter.com"" rel=""nofollow"">Twitter Web App</a>",,,video,https://video.twimg.com/amplify_video/1969211063678685184/vid/avc1/3840x2160/07b4XjMCKK-DzmTQ.mp4?tag=21
'1969187879755878577',"Blowing up boats in the Caribbean without any legal authority risks dragging the United States into another war, and provoking attacks against American citizens.

I'm getting ready to force a vote with @SenTimKaine to ensure Congress' power to declare war is not so easily trampled.",en,Tweet,80,4290,1194,3470,298462,2025-09-20 00:52:30,"<a href=""https://mobile.twitter.com"" rel=""nofollow"">Twitter Web App</a>",,,,
'1969160163270578304',"Republicans are marching us to the brink of a shutdown – at Trump’s command.

Democrats put forward a budget to keep government open and lower health care costs. The GOP said no.

They own this crisis and the steep hikes you are about to pay for your healthcare.",en,Tweet,31,2817,1018,2262,84364,2025-09-19 23:02:22,"<a href=""https://mobile.twitter.com"" rel=""nofollow"">Twitter Web App</a>",,,,
'1969054125204652423',"Democracy, at it's best, is an act of faith.

But it also takes work. And with a wannabe dictator trying to bend it to his will – that work is going to take all of us. https://t.co/a66o9wn0qK",en,Tweet,56,2973,750,2463,117199,2025-09-19 16:01:01,"<a href=""https://mobile.twitter.com"" rel=""nofollow"">Twitter Web App</a>",,,video,https://video.twimg.com/amplify_video/1969053980316590081/vid/avc1/1920x1080/BLHAJL4BsqwOWypG.mp4?tag=21
'1968822388272873863',"For all our flaws, all our stumbles, America has always embodied something precious. Something unique. 

Something worth defending. https://t.co/UZvW9sNqNt",en,Tweet,34,1058,276,1103,70786,2025-09-19 00:40:10,"<a href=""https://mobile.twitter.com"" rel=""nofollow"">Twitter Web App</a>",,,video,https://video.twimg.com/amplify_video/1968822223398993920/vid/avc1/1920x1080/YpUjeG2wX0HhpkQJ.mp4?tag=21
'1968748688316010567',"Every American should know the name Narciso Barranco. 

This is his story. https://t.co/4nEvHkfqC8",en,Tweet,24,330,116,439,39734,2025-09-18 19:47:19,"<a href=""https://mobile.twitter.com"" rel=""nofollow"">Twitter Web App</a>",,,video,https://video.twimg.com/amplify_video/1968748261247733760/vid/avc1/1920x1080/1jP9l8L1MR9CUGlg.mp4?tag=21
'1968641723900338548',"With all the attacks on vaccines and science, we need people to stand up.

I'm urging the nation’s largest health insurance companies to continue covering vaccines recommended by healthcare experts and science.  

Not RFK Jr.'s dangerous, anti-vax conspiracy theorists. https://t.co/D7R63Nk8UV",en,Tweet,16,882,268,773,46480,2025-09-18 12:42:17,"<a href=""https://mobile.twitter.com"" rel=""nofollow"">Twitter Web App</a>",,,photo,https://pbs.twimg.com/media/G1IFB0-WYAAt7Pz.jpg
'1968520785707810890',"In two weeks, the government may shut down because Republicans refuse to negotiate.

Tonight, we're showing the country what Democrats stand for:

-> Averting a shutdown

-> Reversing devastating healthcare cuts

-> Permanently blocking health insurance premium hikes

-> Preventing Donald Trump from reneging on spending agreements",en,Tweet,24,1162,364,1183,132647,2025-09-18 04:41:43,"<a href=""http://twitter.com/download/iphone"" rel=""nofollow"">Twitter for iPhone</a>",,,,
'1968460341206995055',"Kimmel.

Colbert.

Suits against the New York Times, Wall Street Journal, and 60 Minutes.

Extorting settlements from CBS, ABC, and others.

Blocking the AP's access to the White House. 

This administration is responsible for the most blatant attacks on the free press in American history.

What will be left of the First Amendment when he’s done?",en,Tweet,7861,179482,35235,25200,7600068,2025-09-18 00:41:32,"<a href=""http://twitter.com/download/iphone"" rel=""nofollow"">Twitter for iPhone</a>",,,,
'1968391358252769358',"The Trump Administration on Epstein: A Timeline

1) Release the list
2) The list is on our desk
3) There is no list
4) The list was fabricated by Democrats
5) Only Jeffrey Epstein is on the list https://t.co/XU4bB3kCzj",en,Tweet,62,3136,905,1128,72202,2025-09-17 20:07:25,"<a href=""https://mobile.twitter.com"" rel=""nofollow"">Twitter Web App</a>",,,video,https://video.twimg.com/amplify_video/1968391231106326528/vid/avc1/1280x720/cd94Lcfs5y5Bd6RN.mp4?tag=21
'1968361742490386726',"Mr. Patel is now saying there is ""no credible information"" that Jeffrey Epstein trafficked young women to anyone other than… himself.

And that the Epstein client list has only one name, Epstein. 

No one is buying that. https://t.co/4NjaRWGVbu",en,Tweet,132,7441,1335,1438,130041,2025-09-17 18:09:44,"<a href=""https://mobile.twitter.com"" rel=""nofollow"">Twitter Web App</a>",,,video,https://video.twimg.com/amplify_video/1968361580032094210/vid/avc1/1920x1080/guewxXS6PZ5MpuNM.mp4?tag=21
'1968310593162559525',"Democracy has never been under greater threat.

This Constitution Day, I’m rolling out legislation to overturn Citizens United, strengthen our checks and balances, and curb abuses of power by the White House.

Tune in: https://t.co/5bxXPYesuY",en,Tweet,82,3218,1032,2643,142459,2025-09-17 14:46:29,"<a href=""https://studio.twitter.com"" rel=""nofollow"">Twitter Media Studio</a>",,https://x.com/i/broadcasts/1zqKVdgOkqlJB,,
'1968140576760709469',"Kash Patel’s desperate audition to keep his job must have been deeply disturbing to the professionals at the FBI who deserve a real Director, not a troll. https://t.co/iGPLxND1cP",en,Tweet,239,11452,2126,7073,359138,2025-09-17 03:30:54,"<a href=""https://mobile.twitter.com"" rel=""nofollow"">Twitter Web App</a>",,,video,https://video.twimg.com/amplify_video/1968140485999955968/vid/avc1/640x360/iy9l3WMiMTzvk3i3.mp4?tag=21
'1968048787206836577',"Kash Patel testified he did not discipline or terminate FBI employees because of their assignment to specific cases involving the President, alone.

When I asked him if that meant they were terminated in part for work on those cases, he refused to give a straight answer.

Watch:",en,Tweet,272,6548,1292,3553,302154,2025-09-16 21:26:10,"<a href=""https://mobile.twitter.com"" rel=""nofollow"">Twitter Web App</a>",,,video,https://video.twimg.com/amplify_video/1968048526224445440/vid/avc1/1920x1080/YCLhnzRrUFyCwNKl.mp4?tag=21
'1968020988051984885',"Kash Patel came to the Senate today not to do his job, but to save his job. 

The hard-working men and women of the FBI deserve a Director who isn’t just performing for an audience of one.",en,Tweet,323,22484,3540,15156,1962673,2025-09-16 19:35:42,"<a href=""http://twitter.com/download/iphone"" rel=""nofollow"">Twitter for iPhone</a>",,,,
'1967744786502414677',"Donald Trump just blew up another boat in the middle of the ocean with no legal justification.

I'm drafting a resolution and forcing a vote to reclaim Congress’s power to declare war.

Before Trump’s actions provoke one. https://t.co/wwlbZC1ldf",en,Tweet,498,20445,5670,11362,612501,2025-09-16 01:18:10,"<a href=""http://twitter.com/download/iphone"" rel=""nofollow"">Twitter for iPhone</a>",,,video,https://video.twimg.com/amplify_video/1967744642956357632/vid/avc1/2160x3840/-ZrTlbOYfnkD1asV.mp4?tag=21
'1967714349189071184',"Hey @grok, did Donald Trump pardon violent criminals who beat cops? 

Did Kash Patel raise money for them?",en,Tweet,143,6589,751,1943,555319,2025-09-15 23:17:13,"<a href=""https://mobile.twitter.com"" rel=""nofollow"">Twitter Web App</a>",,,,
'1967678803846774810',"Democracy doesn’t disappear overnight – it is vanishes day by day, one lawless act after another. 

Oversized portraits on government buildings may look like vanity. But they are also a warning.

We must take it seriously.",en,Reply,19,1564,340,166,38332,2025-09-15 20:55:59,"<a href=""https://mobile.twitter.com"" rel=""nofollow"">Twitter Web App</a>",,,,
'1967678802437476443',"If you have information about other illegal propaganda purchases, my office wants to hear from you.

Whistleblowers can report directly to Congress.",en,Reply,13,1198,252,125,36157,2025-09-15 20:55:58,"<a href=""https://mobile.twitter.com"" rel=""nofollow"">Twitter Web App</a>",,,,
'1967678800776630496',"Let’s be clear: this is not normal. It’s not lawful. And it’s not democratic.

It’s propaganda – paid for with your money.

We are demanding answers, accountability, and a full halt to this abuse of taxpayer funds.",en,Reply,13,1428,266,17,16658,2025-09-15 20:55:58,"<a href=""https://mobile.twitter.com"" rel=""nofollow"">Twitter Web App</a>",,,,
'1967678797848952987',"This is not only a waste of taxpayer dollars. It’s also an authoritarian tactic.

Dictators from Stalin to Saddam plastered their images on government buildings to demonstrate power.

Now, the Trump Administration is doing the same in Washington. https://t.co/sPzrqoJBMs",en,Reply,30,1634,473,38,28692,2025-09-15 20:55:57,"<a href=""https://mobile.twitter.com"" rel=""nofollow"">Twitter Web App</a>",,,photo,"https://pbs.twimg.com/media/G06ZSHyXEAAr9Y2.png,https://pbs.twimg.com/media/G06ZTB9W4AAkNRH.jpg"
'1967678795470737871',"And my office uncovered a never-before-reported contract for a banner at HHS that goes even further – specifying that the propaganda banners should “last for 4 years.”

In other words: until the end of Trump’s term. https://t.co/vm0ZzGgUC3",en,Reply,17,1200,285,14,23109,2025-09-15 20:55:57,"<a href=""https://mobile.twitter.com"" rel=""nofollow"">Twitter Web App</a>",,,photo,https://pbs.twimg.com/media/G06ReGFWoAAe76p.jpg
'1967678793981788551',"Since 1951, federal law has explicitly prohibited using taxpayer funds for propaganda and self-aggrandizement.

This isn’t a gray area. It’s illegal.

And it violates the Constitution’s command that no funds leave the Treasury except as appropriated by Congress.",en,Reply,26,2014,515,28,43028,2025-09-15 20:55:56,"<a href=""https://mobile.twitter.com"" rel=""nofollow"">Twitter Web App</a>",,,,
'1967678791742099527',"These aren’t informational signs. They don’t explain programs, benefits, or public services.

They are giant portraits of the President. They look like they're straight out of North Korea.

And they are the textbook definition of propaganda.",en,Reply,24,1825,388,19,24913,2025-09-15 20:55:56,"<a href=""https://mobile.twitter.com"" rel=""nofollow"">Twitter Web App</a>",,,,
'1967678789561008334',"In just four months, three federal agencies have paid for massive political banners with your tax dollars:

- USDA: ~$16,400
- Dept. of Labor: ~$6,000
- HHS: ~$34,000

That’s at least $50,000 in taxpayer money for Trump propaganda. https://t.co/2pssfHHwyU",en,Reply,62,1776,680,93,56723,2025-09-15 20:55:55,"<a href=""https://mobile.twitter.com"" rel=""nofollow"">Twitter Web App</a>",,,photo,https://pbs.twimg.com/media/G06RS6BWkAAr0Ll.jpg
'1967678787245768887',"By now, you’ve probably seen these propaganda banners sprouting up on federal buildings.

We’ve uncovered how much these banners cost through never-before-seen documents. 

And why they’re illegal: 

(Thread 🧵) https://t.co/72IrASQLCw",en,Tweet,399,5616,2104,469,255161,2025-09-15 20:55:55,"<a href=""https://mobile.twitter.com"" rel=""nofollow"">Twitter Web App</a>",,,photo,https://pbs.twimg.com/media/G06RQJSWYAA1624.jpg
'1967641633782108287',"Big night for The Pitt and The Studio at The Emmys.

Love to see California-based productions taking home wins – more proof that the Golden State remains the gold standard for film production.",en,Tweet,4,375,59,205,31927,2025-09-15 18:28:17,"<a href=""http://twitter.com/download/iphone"" rel=""nofollow"">Twitter for iPhone</a>",,,,
'1967394550152151455',"On Tuesday, Kash Patel will testify in front of the Senate Judiciary Committee.

Needless to say, I have some questions for him. https://t.co/Zc36pFLsbk",en,Tweet,378,14490,3081,10722,2004969,2025-09-15 02:06:27,"<a href=""http://twitter.com/download/iphone"" rel=""nofollow"">Twitter for iPhone</a>",,,video,https://video.twimg.com/amplify_video/1967394219191877632/vid/avc1/2160x3840/Hg0To_bOcimRwbHx.mp4?tag=21
'1967304692805042186',"Los latinos siempre han luchado por California, y yo, como senador, siempre lucharé por la comunidad latina. https://t.co/2Dbf8A4Yvp",es,Tweet,4,531,123,540,40208,2025-09-14 20:09:24,"<a href=""http://twitter.com/download/iphone"" rel=""nofollow"">Twitter for iPhone</a>",,,video,https://video.twimg.com/amplify_video/1967304217858564096/vid/avc1/3840x2160/zVP0I-UjG8MYaiEt.mp4?tag=21
'1967234961146323142',"Donald Trump promised lower prices.

By every conceivable metric – he has betrayed that promise. https://t.co/yxAxmY7g7A",en,Tweet,96,5778,1421,2117,96149,2025-09-14 15:32:18,"<a href=""http://twitter.com/download/iphone"" rel=""nofollow"">Twitter for iPhone</a>",,,video,https://video.twimg.com/amplify_video/1967234146272526336/vid/avc1/3840x2160/7ZxBDEiflWP_Aztf.mp4?tag=21
'1966870587407822979',"Read every word of this.

Millions of Californians can now be profiled by the color of their skin and the language they speak, thanks to the Supreme Court.

This is not the slippery slope. We are already on the slide towards dictatorship. https://t.co/AD5jD5OB3p",en,Tweet,345,8010,3540,3181,216013,2025-09-13 15:24:25,"<a href=""http://twitter.com/download/iphone"" rel=""nofollow"">Twitter for iPhone</a>",,,photo,https://pbs.twimg.com/media/G0u6YAZWoAAk82A.jpg
'1966645249406591065',"Read more:

https://t.co/aEquiJoove",en,Reply,3,108,35,56,29262,2025-09-13 00:29:00,"<a href=""http://twitter.com/download/iphone"" rel=""nofollow"">Twitter for iPhone</a>",,https://www.schiff.senate.gov/news/press-releases/news-sens-schiff-padilla-lead-17-senators-in-amicus-brief-fighting-trump-abuse-of-military-deployments/,,
'1966645247523328302',"Giving Trump the legal cover to occupy an American city with American servicemembers will reverberate far beyond Los Angeles.

I'm leading Senators from across the country with @SenAlexPadilla to lay out why the court must end Trump's illegal military deployments to California.",en,Tweet,21,2313,644,1441,84220,2025-09-13 00:29:00,"<a href=""http://twitter.com/download/iphone"" rel=""nofollow"">Twitter for iPhone</a>",,,,
'1966580684643819858',"The Trump Administration has turned America’s foreign policy on its head.

Put tariffs and sanctions on democracy and the rule of law.

Export defense of insurrection to overturn elections. 

Defend autocracy around globe.",en,Tweet,7,572,180,679,80176,2025-09-12 20:12:27,"<a href=""http://twitter.com/download/iphone"" rel=""nofollow"">Twitter for iPhone</a>",,,,
'1966258562671525918',There is bipartisan agreement – Donald Trump does not have the authority to just start blowing up boats in the Caribbean. https://t.co/PD3wqtyPFW,en,Tweet,120,9764,1788,4381,221400,2025-09-11 22:52:27,"<a href=""http://twitter.com/download/iphone"" rel=""nofollow"">Twitter for iPhone</a>",,,video,https://video.twimg.com/amplify_video/1966257596303540224/vid/avc1/3840x2160/w30pSw6NCCaB3Z7N.mp4?tag=21
'1966208853659255202',"These are not normal times.

This is not a normal presidency. 

This cannot be a normal government funding debate. https://t.co/inw4Vc0fR2",en,Tweet,111,3268,577,5549,456810,2025-09-11 19:34:55,"<a href=""http://twitter.com/download/iphone"" rel=""nofollow"">Twitter for iPhone</a>",,,video,https://video.twimg.com/amplify_video/1966208315840417792/vid/avc1/3840x2160/GonhVs7vbGMNx2iy.mp4?tag=21
'1966124786138103981',"24 years later, 9/11 is still seared into the collective memory of our nation.

The first responders who ran into those towers. The families who lost loved ones. A country that mourned. 

We honor the memory of those lost. We will never forget.",en,Tweet,10,728,146,239,41364,2025-09-11 14:00:52,"<a href=""http://twitter.com/download/iphone"" rel=""nofollow"">Twitter for iPhone</a>",,,,
'1965942484363784450',This has to end. https://t.co/Jwq9XDuaFP,en,Tweet,101,1503,265,5302,615454,2025-09-11 01:56:28,"<a href=""http://twitter.com/download/iphone"" rel=""nofollow"">Twitter for iPhone</a>",,,video,https://video.twimg.com/amplify_video/1965942126899793920/vid/avc1/720x1280/EMnqBrGFyhRevITb.mp4?tag=21
'1965865411364389351',"Horrified to see reports that Charlie Kirk was shot at an event in Utah today. It's just awful.

The increasing degree of political violence in this country is a threat to everyone. And it must end.

My thoughts are with the Kirk family.",en,Tweet,79,4413,471,6802,701102,2025-09-10 20:50:12,"<a href=""http://twitter.com/download/iphone"" rel=""nofollow"">Twitter for iPhone</a>",,,,
'1965844728802648484',"Senate Democrats are not taking no for an answer on the Epstein Files. Now, Republicans are about to face a choice:

Release the files, or endorse the President's cover up. 

Will they choose transparency? Or Trump’s gaslighting?",en,Tweet,21,1984,634,611,96259,2025-09-10 19:28:01,"<a href=""http://twitter.com/download/iphone"" rel=""nofollow"">Twitter for iPhone</a>",,,,
'1965603229175349401',"Donald Trump is coming after me for the same reason he's gone after colleges, law firms, media organizations and more.

Like a dictator, he wants to silence and intimidate his opposition.

I’m doing just what I urge others to do. Fighting back. https://t.co/HRwL2qoovW",en,Tweet,230,19385,3802,6513,638088,2025-09-10 03:28:23,"<a href=""http://twitter.com/download/iphone"" rel=""nofollow"">Twitter for iPhone</a>",,,video,https://video.twimg.com/amplify_video/1965603121591123968/vid/avc1/1280x720/K4nS-COOKRfbURdn.mp4?tag=21
'1965588431549202551',"Today, two whistleblowers testified to the Judiciary Committee about harms to children by Meta – and reported destruction of data around it. 

Everyone should hear what they had to say: https://t.co/Y67zrl1hah",en,Tweet,39,1275,351,536,55146,2025-09-10 02:29:35,"<a href=""http://twitter.com/download/iphone"" rel=""nofollow"">Twitter for iPhone</a>",,,video,https://video.twimg.com/amplify_video/1965587447435120640/vid/avc1/3840x2160/ZmdS0AdF_SmQz4DL.mp4?tag=21
'1965238191482609726',"Right now, there's only one economy that's working – and that's Donald Trump's personal economy. https://t.co/YKuFcANtKb",en,Tweet,18,986,248,544,63370,2025-09-09 03:17:51,"<a href=""http://twitter.com/download/iphone"" rel=""nofollow"">Twitter for iPhone</a>",,,video,https://video.twimg.com/amplify_video/1965235244757352448/vid/avc1/3840x2160/jSfVq5OpqPiPm934.mp4?tag=21
'1965145718890377373',"This Administration rounded up and arrested California residents, including U.S. citizens and legal residents, based on the color of their skin or the language they speak.

This is blatantly illegal, yet the Supreme Court is allowing it to happen while the case proceeds.

When the history of this country’s rapid descent into dictatorship is written, Republicans in Congress and the Roberts Court will have been its primary enabler.",en,Tweet,220,7403,2860,2883,245802,2025-09-08 21:10:24,"<a href=""http://twitter.com/download/iphone"" rel=""nofollow"">Twitter for iPhone</a>",,,photo,https://pbs.twimg.com/media/G0WZncyXMAAMLN8.jpg
'1965072133471785235',"Today, I’m introducing the Empowering Striking Workers Act.

So that workers who have to go on strike can use their unemployment insurance to get by.

Because when workers have to fight for better wages, it shouldn’t be only the corporate executives who can feed their families.",en,Tweet,30,1401,371,2110,128881,2025-09-08 16:18:00,"<a href=""http://twitter.com/download/iphone"" rel=""nofollow"">Twitter for iPhone</a>",,,,
'1964809706914160991',"“There’s a lot of people out there that if we don’t fight for them... nobody’s going to fight for them.""

So said, John Burton – a true champion for California, someone with a passion for justice, and a dear friend. 

Saddened to hear of his passing. May his memory be a blessing.",en,Tweet,6,649,149,324,42206,2025-09-07 22:55:13,"<a href=""http://twitter.com/download/iphone"" rel=""nofollow"">Twitter for iPhone</a>",,,,
'1964410488600875211',"Donald Trump is purging people of independence and expertise and replacing them with sycophants.

Meet Retribution Row. https://t.co/FQlQZQa81I",en,Tweet,46,3251,1008,1540,78909,2025-09-06 20:28:52,"<a href=""http://twitter.com/download/iphone"" rel=""nofollow"">Twitter for iPhone</a>",,,video,https://video.twimg.com/amplify_video/1964409647239983104/vid/avc1/1280x720/KP2hU8UNLNH4akFo.mp4?tag=21
'1964113400654426165',This is your economy on Donald Trump.,en,Tweet,21,1283,400,441,92037,2025-09-06 00:48:20,"<a href=""http://twitter.com/download/iphone"" rel=""nofollow"">Twitter for iPhone</a>",,,,
'1964050987452100641',"Donald Trump and Big Oil are conspiring to restart the very same oil pipeline that 10 years ago spilled oil all along the Southern California coast.

I laid out serious dangers of this scheme, and what you can do to help protect our ecosystems and local economies, in a new @LATimes op-ed ⬇️

https://t.co/R9ggPC1x3P",en,Tweet,14,619,278,371,44716,2025-09-05 20:40:20,"<a href=""http://twitter.com/download/iphone"" rel=""nofollow"">Twitter for iPhone</a>",,,,
'1963982736349180100',"The Trump administration is making it harder for families to get their hard-earned tax refunds &amp; adding red tape for our hardworking families needing help with their taxes.

The admin needs to reverse course on this ill-conceived decision that will only hurt California taxpayers.",en,Tweet,9,426,182,282,57110,2025-09-05 16:09:08,"<a href=""http://twitter.com/download/iphone"" rel=""nofollow"">Twitter for iPhone</a>",,,,
'1963787286849405334',"Under RFK Jr's leadership – the CDC is being gutted.

People will die because of this. 

RFK Jr. needs to resign. Now. https://t.co/mHNSKhsEQC",en,Tweet,101,6224,1664,4415,258018,2025-09-05 03:12:29,"<a href=""http://twitter.com/download/iphone"" rel=""nofollow"">Twitter for iPhone</a>",,,video,https://video.twimg.com/amplify_video/1963785410477248512/vid/avc1/1920x1080/Y6u2siR7ehpJ3qEf.mp4?tag=21
