tweet_id,text,language,type,bookmark_count,favorite_count,retweet_count,reply_count,view_count,created_at,client,hashtags,urls,media_type,media_urls
'1892330338182979982',"I met with NH law enforcement &amp; the DEA to discuss a bipartisan bill I helped introduce to crack down on substances that are functionally the same as fentanyl. This will help ensure law enforcement has the tools they need to combat the fentanyl crisis.
https://t.co/ZhPJkQ4tiF",en,Tweet,0,14,6,16,2082,2025-02-19 21:48:05,"<a href=""https://mobile.twitter.com"" rel=""nofollow"">Twitter Web App</a>",,https://www.unionleader.com/news/crime/hassan-manchester-police-discuss-bill-to-combat-fentanyl-epidemic/article_11ac6454-ee2c-11ef-8dfe-0f8c2af88118.html?block_id=1128300/,,
'1892022550353375591',"As egg prices are soaring, President Trump and Elon Musk’s fired the people combatting bird flu as part of the Administration’s reckless firing spree.",en,Tweet,0,19,9,28,2164,2025-02-19 01:25:02,"<a href=""http://twitter.com/download/iphone"" rel=""nofollow"">Twitter for iPhone</a>",,,,
'1891935902991003974',"Granite Staters, did you know that February is Teen Dating Violence Awareness Month?
 
Spreading the word can empower young people to ensure that they are in healthy and safe relationships.
 
Head to https://t.co/mfNfzDFL90 to learn more.",en,Tweet,0,7,1,9,1176,2025-02-18 19:40:44,"<a href=""https://mobile.twitter.com"" rel=""nofollow"">Twitter Web App</a>",,http://loveisrespect.org,,
'1891508820599296266',"“It is not merely for today, but for all time to come that we should perpetuate for our children’s children this great and free government, which we have enjoyed all our lives.” - Abraham Lincoln
 
Wishing all Granite Staters a happy President’s Day!",en,Tweet,1,26,14,45,2919,2025-02-17 15:23:40,"<a href=""http://twitter.com/download/iphone"" rel=""nofollow"">Twitter for iPhone</a>",,,,
'1890506987357503769',"The Trump Administration’s hiring freeze and funding cuts are simply wrong. We should make it easier for the VA to provide care and benefits to veterans, not harder. 
 
The President must reverse course. https://t.co/fV4Cjm2lYm",en,Tweet,0,40,16,96,4470,2025-02-14 21:02:44,"<a href=""http://twitter.com/download/iphone"" rel=""nofollow"">Twitter for iPhone</a>",,,photo,https://pbs.twimg.com/media/GjxuFcZWMAAQ3j6.jpg
'1890491263218012496',"A drone hit Chernobyl's shield against radiation last night, and here in the U.S. President Trump is firing the people who oversee and safeguard our nuclear arsenal. How does this make America safer?",en,Tweet,5,106,42,114,7915,2025-02-14 20:00:15,"<a href=""http://twitter.com/download/iphone"" rel=""nofollow"">Twitter for iPhone</a>",,,,
'1890412398168678891',"This week, I met with the NH Association of Fire Chiefs to discuss strengthening resources and grant programs that support fire departments. 
 
Thank you for your dedication to keeping our communities safe. https://t.co/woG8gpxDrH",en,Tweet,0,21,9,26,2001,2025-02-14 14:46:52,"<a href=""http://twitter.com/download/iphone"" rel=""nofollow"">Twitter for iPhone</a>",,,photo,https://pbs.twimg.com/media/GjwYDs6XsAA8R2K.jpg
'1890227195949510901',"Keeping our communities safe requires experienced prosecutors who can go after violent criminals and drug traffickers. 

President Trump's decision to put politics above the rule of law and force out anyone who stands in the way is not only outrageous, but it makes us less safe.",en,Tweet,0,13,4,22,2190,2025-02-14 02:30:56,"<a href=""http://twitter.com/download/iphone"" rel=""nofollow"">Twitter for iPhone</a>",,,,
'1890185454621979104',💪💪💪,art,Tweet,0,28,4,12,3065,2025-02-13 23:45:04,"<a href=""http://twitter.com/download/iphone"" rel=""nofollow"">Twitter for iPhone</a>",,,,
'1890145505826754711',"Senator Tina Smith cares deeply about Minnesotans and all Americans — a commitment she carried with her in the Mayor’s office, State House, and now in the Senate.

You can hear it as she hones in on the things that really matter to her constituents during a hearing, as she lends a warm and principled voice to the issues of the day, and as she holds the line against those who seek to undermine our values. She is also a warm and treasured friend who I have the privilege of sitting next to on the Senate floor. 

Tina, looking forward to working with you for the next two years and beyond. And so grateful for a friendship that transcends our Senate service.",en,Tweet,0,25,5,25,3810,2025-02-13 21:06:20,"<a href=""http://twitter.com/download/iphone"" rel=""nofollow"">Twitter for iPhone</a>",,,,
'1890094976673149422',"Robert F. Kennedy Jr.’s record of promoting misinformation will put the health and safety of our children at risk.   

I was a NO on his nomination today. https://t.co/axeEkqRu81",en,Tweet,2,99,24,107,4787,2025-02-13 17:45:33,"<a href=""http://twitter.com/download/iphone"" rel=""nofollow"">Twitter for iPhone</a>",,,video,https://video.twimg.com/amplify_video/1890094889641086978/vid/avc1/1280x720/YKhVKoqXUGwxSXFy.mp4?tag=16
'1889771781998653861',"Tulsi Gabbard is not qualified to safeguard our national security as Director of National Intelligence. Anyone who would praise dictators like Putin and Assad cannot be trusted to keep America safe, secure, and free.

I voted no on her nomination.",en,Tweet,5,195,35,290,17967,2025-02-12 20:21:17,"<a href=""http://twitter.com/download/iphone"" rel=""nofollow"">Twitter for iPhone</a>",,,,
'1889430230403780894',"The Consumer Financial Protection Bureau protects Granite Staters from unfair fees &amp; predatory practices by big banks. To date, it has returned $21 billion directly to Americans.

Shutting it down will only make it easier to rip off hard-working families.
https://t.co/34QwbCbiJY",en,Tweet,0,8,7,28,1698,2025-02-11 21:44:05,"<a href=""https://mobile.twitter.com"" rel=""nofollow"">Twitter Web App</a>",,https://www.washingtonpost.com/business/2025/02/07/cfpb-doge-trump-musk-chopra/,,
'1889392096244543585',"The White Mountain National Forest powers NH’s winter tourism industry and our state’s economy.
 
I helped reintroduce bipartisan legislation to help ensure that ski fees are invested in maintaining our forests and supporting our local mountain communities.",en,Tweet,3,27,4,28,2289,2025-02-11 19:12:33,"<a href=""http://twitter.com/download/iphone"" rel=""nofollow"">Twitter for iPhone</a>",,,,
'1888328111521210563',"It is the middle of winter and Granite Staters need heat. 
 
Yesterday I met with Community Action Program Belknap-Merrimack Counties to hear about the devastating impact that President Trump’s illegal federal funding cuts could have on their work helping people heat their homes. https://t.co/PgMxcir5UP",en,Tweet,2,25,10,54,4262,2025-02-08 20:44:39,"<a href=""http://twitter.com/download/iphone"" rel=""nofollow"">Twitter for iPhone</a>",,,photo,https://pbs.twimg.com/media/GjSwaLtXkAAXGd9.jpg
'1887874699117437358',"President Trump’s illegal cuts to federal funding will cost NH communities millions and force devastating cuts to our schools and other critical services.
 
These cuts are hurting Granite Staters.
 https://t.co/Htdztz9jIS",en,Tweet,2,34,13,110,8796,2025-02-07 14:42:57,"<a href=""https://mobile.twitter.com"" rel=""nofollow"">Twitter Web App</a>",,https://www.seacoastonline.com/story/news/2025/02/05/portsmouth-trump-funding-freeze-3-million-dollars/78209631007/,,
'1887662677025018142',"Russell Vought is the architect of President Trump’s order to cut off federal grants to help fire fighters, police officers, and veterans. This chaos is no way to lead a country.
 
Today, I spoke on the Senate floor about why I opposed his nomination. https://t.co/KlkG2pfAAE",en,Tweet,7,116,33,81,6662,2025-02-07 00:40:27,"<a href=""http://twitter.com/download/iphone"" rel=""nofollow"">Twitter for iPhone</a>",,,video,https://video.twimg.com/amplify_video/1887662529305837569/vid/avc1/1280x720/q5E1QDcjvdFiEk04.mp4?tag=16
'1887594490363265369',"Robert F. Kennedy Jr. is the wrong choice for Secretary of Health and Human Services. He continues to spread misinformation and politicize our health care, further dividing Americans and putting our health at risk.",en,Tweet,8,108,26,122,8922,2025-02-06 20:09:30,"<a href=""https://mobile.twitter.com"" rel=""nofollow"">Twitter Web App</a>",,,,
'1887265210051838266',"Congratulations to Fritz Wetherbee on his well-deserved retirement!

Your work has educated and entertained Granite Staters for decades, and I want to thank you for bringing New Hampshire’s rich history to life.",en,Tweet,0,28,6,16,2950,2025-02-05 22:21:04,"<a href=""https://mobile.twitter.com"" rel=""nofollow"">Twitter Web App</a>",,,,
'1887249134136045916',"Today marks the anniversary of the Family and Medical Leave Act, which guarantees unpaid leave for parenting, medical, or caregiving needs.

As we celebrate our progress, we must also keep working to provide all workers access to paid family and medical leave.",en,Tweet,0,9,4,12,1706,2025-02-05 21:17:11,"<a href=""https://mobile.twitter.com"" rel=""nofollow"">Twitter Web App</a>",,,,
'1887230382736584906',"The Special Olympics provides a space for all Granite Staters to share in the joy of sports.

Thank you to the members of @SONewHampshire that stopped by my office yesterday! https://t.co/MaG8WbCpSB",en,Tweet,0,10,3,4,1250,2025-02-05 20:02:40,"<a href=""https://mobile.twitter.com"" rel=""nofollow"">Twitter Web App</a>",,,photo,https://pbs.twimg.com/media/GjDJ_PGWQAAwNJz.jpg
'1886932333556552052',"New Hampshire -- I hear you!

My office is receiving thousands of calls from Granite Staters &amp; we're working hard to answer everyone. 

The Senate phone system is experiencing technical issues from the increase in calls. Email me below:

https://t.co/QnCNXPRYL1",en,Tweet,2,100,26,83,7302,2025-02-05 00:18:20,"<a href=""http://twitter.com/download/iphone"" rel=""nofollow"">Twitter for iPhone</a>",,https://www.hassan.senate.gov/contact/email,,
'1886869567798173998',"No pregnant woman should struggle to access quality, affordable health care because of her zip code.

I introduced a bipartisan bill with @SenatorCollins, @SenKatieBritt, and @SenTinaSmith to support rural health facilities in providing urgent maternal health care.",en,Tweet,1,20,4,23,2244,2025-02-04 20:08:55,"<a href=""https://mobile.twitter.com"" rel=""nofollow"">Twitter Web App</a>",,,,
'1886488602848195026',"President Trump’s illegal cut off of federal funding threatens the work of organizations like Harbor Care, which help NH veterans, including through suicide prevention and housing.
 
Today I heard directly from @HarborCare about how this uncertainty is affecting their programs. https://t.co/EpPK3lmzrS",en,Tweet,1,29,8,68,2856,2025-02-03 18:55:06,"<a href=""https://mobile.twitter.com"" rel=""nofollow"">Twitter Web App</a>",,,photo,https://pbs.twimg.com/media/Gi4nUDWWQAAKmKM.jpg
'1885831485946577373',President Trump's tariffs on goods and services coming from Canada will rachet up prices for hard-working Granite Staters who are already struggling to make ends meet. It's the wrong move for New Hampshire families and businesses.,en,Tweet,1,127,34,129,7823,2025-02-01 23:23:57,"<a href=""http://twitter.com/download/iphone"" rel=""nofollow"">Twitter for iPhone</a>",,,,
'1885476117357760933',"Celma Silveira of Atkinson donates free house cleanings from her business, Cleaning by Celma, to cancer patients and disabled veterans.

Her dedication to helping Granite Staters who are struggling is why I am proud to name her January’s Granite Stater of the Month.",en,Tweet,0,38,7,34,4030,2025-01-31 23:51:51,"<a href=""http://twitter.com/download/iphone"" rel=""nofollow"">Twitter for iPhone</a>",,,,
'1885090844832587945',Real life matters. https://t.co/97SO6Rf4MN,en,Tweet,101,1507,418,1298,194760,2025-01-30 22:20:55,"<a href=""https://mobile.twitter.com"" rel=""nofollow"">Twitter Web App</a>",,,video,https://video.twimg.com/ext_tw_video/1885089976834035712/pu/vid/avc1/1280x720/YHtL--4ZI9q8TZ1s.mp4?tag=12
'1884815157605331209',The news of a passenger plane crash at DCA tonight is devastating. As we wait for more information my prayers are with everyone involved.,en,Tweet,1,53,6,99,13829,2025-01-30 04:05:26,"<a href=""http://twitter.com/download/iphone"" rel=""nofollow"">Twitter for iPhone</a>",,,,
'1884724598790381586',"Today I asked RFK Jr. point blank: When exactly did you decide to sell out your lifelong values to get power from Trump?

Instead of standing by his past statements, he made it clear he'll do whatever Trump tells him to do – including restricting reproductive health care. https://t.co/5Fesxrm1ij",en,Tweet,24,362,97,1064,55666,2025-01-29 22:05:35,"<a href=""https://mobile.twitter.com"" rel=""nofollow"">Twitter Web App</a>",,,video,https://video.twimg.com/ext_tw_video/1884724487469301760/pu/vid/avc1/1280x720/5Lqm_IHao24bzRT9.mp4?tag=12
'1884712926894055654',"This is creating more chaos and uncertainty. Instead of muddying the waters, the White House needs to simply stop trying to cut off funding for law enforcement, veterans, seniors, and disaster victims. https://t.co/cMrEh1M6Hw",en,Tweet,3,117,34,140,9173,2025-01-29 21:19:12,"<a href=""http://twitter.com/download/iphone"" rel=""nofollow"">Twitter for iPhone</a>",,,photo,https://pbs.twimg.com/media/GifYaz2XkAAU0Wo.jpg
'1884404426141511708',"President Trump's illegal freeze of federal funding defunds police, imperils disaster relief, halts cancer research, and shuts down veterans shelters.
 
President Trump is putting lives at risk. https://t.co/FHzBAoppqh",en,Tweet,13,194,54,782,22252,2025-01-29 00:53:20,"<a href=""http://twitter.com/download/iphone"" rel=""nofollow"">Twitter for iPhone</a>",,,video,https://video.twimg.com/amplify_video/1884404351797452801/vid/avc1/1280x720/Vdi2_HelT_L51yFP.mp4?tag=14
'1884304241260650818',"Calls are pouring into my office about President Trump’s illegal freeze of all federal grants, with critical funding suddenly shut off from health clinics, law enforcement, and schools.

President Trump's move is illegal, dangerous, and unacceptable. He must reverse course now.",en,Tweet,8,155,38,403,45622,2025-01-28 18:15:14,"<a href=""http://twitter.com/download/iphone"" rel=""nofollow"">Twitter for iPhone</a>",,,,
'1884299030332903533',"Today we remember the lives lost in the Challenger disaster, including the Granite State’s own Christa McAuliffe. Christa’s passion for teaching and exploration will live on in New Hampshire’s memory.",en,Tweet,1,31,4,34,3999,2025-01-28 17:54:32,"<a href=""http://twitter.com/download/iphone"" rel=""nofollow"">Twitter for iPhone</a>",,,,
'1883975273915576623',"Great to tour the Pembroke Road Apartments in Concord today and see how federal funding is being used to address New Hampshire’s housing shortage.
 
This development is helping more Granite Staters have safe, affordable housing, and is strengthening our economy. https://t.co/eedG6cQqDw",en,Tweet,0,15,5,39,3784,2025-01-27 20:28:02,"<a href=""https://mobile.twitter.com"" rel=""nofollow"">Twitter Web App</a>",,,photo,https://pbs.twimg.com/media/GiU5eP8WYAAUaAd.jpg
'1883924705545183518',"This International Holocaust Remembrance Day, we mourn the lives that were lost during the Holocaust and reflect on this dark chapter in our world’s history -- and we must also recommit ourselves to standing up to hate and antisemitism.",en,Tweet,2,23,7,20,2852,2025-01-27 17:07:06,"<a href=""https://mobile.twitter.com"" rel=""nofollow"">Twitter Web App</a>",,,,
'1883534671763677594',"The Northern Border Regional Commission provides vital support for projects across NH’s rural communities.
 
I’m excited to see more than $10 million heading to our state for projects that bolster local economies, create jobs, and provide essential services to Granite Staters.",en,Tweet,1,9,8,29,4025,2025-01-26 15:17:14,"<a href=""http://twitter.com/download/iphone"" rel=""nofollow"">Twitter for iPhone</a>",,,,
'1883211957047882032',"President Trump claims to be focused on improving government efficiency but in his first week in office he has illegally fired the very people whose job it is to root out waste, fraud, and abuse.",en,Tweet,2,17,13,39,2997,2025-01-25 17:54:53,"<a href=""http://twitter.com/download/iphone"" rel=""nofollow"">Twitter for iPhone</a>",,,,
'1883199615908073729',"I voted to confirm Kristi Noem as Secretary of Homeland Security because she has demonstrated that she’s willing to work together to tackle the challenges facing our country. While there are areas where we disagree, I believe she has the qualifications necessary for the role.",en,Tweet,2,48,8,56,8874,2025-01-25 17:05:51,"<a href=""http://twitter.com/download/iphone"" rel=""nofollow"">Twitter for iPhone</a>",,,,
'1882916862339752394',"Pete Hegseth does not have the skills, experience, record, or character to lead the Department of Defense.

The brave men and women who serve our country need a leader who they can have full faith in. America’s best deserves the best, and I will be voting NO on his nomination. https://t.co/IvQsdvSW2F",en,Tweet,5,275,70,113,13576,2025-01-24 22:22:17,"<a href=""https://mobile.twitter.com"" rel=""nofollow"">Twitter Web App</a>",,,video,https://video.twimg.com/ext_tw_video/1882916834392817666/pu/vid/avc1/640x360/_RdAkx3cAKgiwJ0u.mp4?tag=12
'1882554663431717016',"Instead of making life better for Americans, this is what a White House advisor is focused on. 

Antisemitism and hate need to be denounced and condemned, not laughed at. https://t.co/KPYN2dqIaT",en,Tweet,6,54,15,162,17807,2025-01-23 22:23:02,"<a href=""https://mobile.twitter.com"" rel=""nofollow"">Twitter Web App</a>",,,photo,https://pbs.twimg.com/media/GiAtdRIWcAAQHAB.jpg
'1882535828532138281',"Today we recognize Maternal Health Awareness Day. 

Right now too many women face significant barriers to prenatal and postpartum care.

I am working to increase access to high-quality, affordable health care to ensure that women can stay healthy during and after pregnancy.",en,Tweet,2,28,13,31,2658,2025-01-23 21:08:12,"<a href=""https://mobile.twitter.com"" rel=""nofollow"">Twitter Web App</a>",,,,
'1882145264875802654',"President Trump has pardoned convicted drug trafficker Ross Ulbricht, who ran a massive online criminal marketplace.

Fentanyl is flooding our streets &amp; the President is pardoning a criminal who helped make it happen. This pardon is an affront to public safety &amp; the rule of law.",en,Tweet,3,52,26,68,4195,2025-01-22 19:16:14,"<a href=""https://mobile.twitter.com"" rel=""nofollow"">Twitter Web App</a>",,,,
'1882130802223571228',"Today is the 52nd anniversary of the Roe v. Wade decision, which gave women the freedom to make their own reproductive health care choices until that right was ripped away by the Supreme Court in 2022. 
 
We must keep fighting for women to be treated as free and equal citizens.",en,Tweet,3,58,21,43,7053,2025-01-22 18:18:46,"<a href=""https://mobile.twitter.com"" rel=""nofollow"">Twitter Web App</a>",,,,
'1882090618736029789',"Instead of addressing the most pressing issues facing Americans, Senate Republicans are pushing a bill to curtail the freedom of women.

This bill won’t bring down the prices of groceries, but it will make life harder for women facing a painful situation.
https://t.co/FXgqvxImiS",en,Tweet,1,11,9,31,2680,2025-01-22 15:39:05,"<a href=""https://mobile.twitter.com"" rel=""nofollow"">Twitter Web App</a>",,https://youtu.be/BQNdyrkcTJY,,
'1881808048605552908',"The death of a U.S. Border Patrol agent serving in the line of duty yesterday near the Northern Border is a devastating loss. 

Law enforcement officers risk everything to keep our communities safe. My thoughts are with the agent’s family and coworkers at this time.",en,Tweet,1,16,8,23,1994,2025-01-21 20:56:15,"<a href=""https://mobile.twitter.com"" rel=""nofollow"">Twitter Web App</a>",,,,
'1881738636003274805',The January 6 rioters assaulted police officers and tried to overthrow our free and fair elections. They deserve neither praise nor pardon. The law enforcement officers who put their lives on the line that day were heroes and they deserve better.,en,Tweet,3,81,23,87,6285,2025-01-21 16:20:26,"<a href=""http://twitter.com/download/iphone"" rel=""nofollow"">Twitter for iPhone</a>",,,,
'1881410107218722901',My statement on the inauguration of President Trump: https://t.co/sEaGJ7iNwW,en,Tweet,2,24,5,29,2688,2025-01-20 18:34:59,"<a href=""http://twitter.com/download/iphone"" rel=""nofollow"">Twitter for iPhone</a>",,,photo,https://pbs.twimg.com/media/GhwchaIXMAAz_Bx.jpg
'1880630653592723725',"Good news: New Hampshire is receiving significant federal funding to help address homelessness.
 
This funding will help Granite Staters in need access safe temporary and permanent housing, and help them build more stable futures.",en,Tweet,1,36,8,28,2924,2025-01-18 14:57:42,"<a href=""http://twitter.com/download/iphone"" rel=""nofollow"">Twitter for iPhone</a>",,,,
'1879648594426482880',"The ceasefire agreement between Israel and Hamas is an important step towards bringing hostages home and allowing for more civilian aid to enter Gaza. 

I hope this brings the world closer to a future where the Israeli and Palestinian people can live together in peace.",en,Tweet,1,15,5,30,3221,2025-01-15 21:55:21,"<a href=""https://mobile.twitter.com"" rel=""nofollow"">Twitter Web App</a>",,,,
'1879564012402471104',"Last week, I visited the extraordinary students and teachers at Sunset Heights Elementary School in Nashua and congratulated them on their recent recognition as a National ESEA Distinguished School. 

Read more about my visit from Nashua Ink Link: https://t.co/8InWmh5I67",en,Tweet,0,5,4,5,1565,2025-01-15 16:19:15,"<a href=""https://mobile.twitter.com"" rel=""nofollow"">Twitter Web App</a>",,https://nashua.inklink.news/hassan-visits-sunset-heights-elementary-to-celebrate-national-distinguished-school-award/,,
'1878912731476295951',"We recently passed the bipartisan Senator Elizabeth Dole Act into law to expand access to home health care services for veterans, among other benefits. 

Today I met with New Hampshire veterans and Veterans Service Organizations to help spread the word about this new law. https://t.co/ukdxpqTVdc",en,Tweet,2,37,14,15,2681,2025-01-13 21:11:18,"<a href=""https://mobile.twitter.com"" rel=""nofollow"">Twitter Web App</a>",,,photo,https://pbs.twimg.com/media/GhM88-dWcAAbLDn.jpg
'1878181231768048051',"My heart goes out to all those impacted by the horrific fires in Southern California.

I am grateful for the fire fighters and police working to save lives, homes, and businesses — and I hope that the families affected by the flames can soon begin the path to recovery.",en,Tweet,1,17,5,8,1625,2025-01-11 20:44:35,"<a href=""http://twitter.com/download/iphone"" rel=""nofollow"">Twitter for iPhone</a>",,,,
'1878106472501977432',"The bipartisan DETECT Fentanyl and Xylazine Act is now law – giving law enforcement officials the tools to better detect &amp; crack down on deadly illegal drugs.
 
I will keep working to support bills like these that help law enforcement officials protect our communities.",en,Tweet,1,17,4,12,1585,2025-01-11 15:47:31,"<a href=""http://twitter.com/download/iphone"" rel=""nofollow"">Twitter for iPhone</a>",,,,
'1877803754356924872',"Great to visit Sunset Heights Elementary School in Nashua &amp; hear from students about how the school year is going!

I was also glad to congratulate Sunset Heights for being recognized as a National ESEA Distinguished School for exceptional student performance &amp; academic growth. https://t.co/9vHCPbEmZx",en,Tweet,0,9,2,4,1162,2025-01-10 19:44:37,"<a href=""http://twitter.com/download/iphone"" rel=""nofollow"">Twitter for iPhone</a>",,,photo,https://pbs.twimg.com/media/Gg9MkDbWYAA8Nz1.jpg
'1877455253114630202',"Today is Law Enforcement Appreciation Day, an opportunity to recognize the New Hampshire law enforcement officials who work to keep our communities safe.

Thank you to law enforcement officials in New Hampshire and across the country for your service.",en,Tweet,1,8,2,4,1098,2025-01-09 20:39:48,"<a href=""https://mobile.twitter.com"" rel=""nofollow"">Twitter Web App</a>",,,,
'1877444085784436770',I was at the State House today to join other Granite Staters in congratulating Governor Kelly Ayotte on her inauguration. I am committed to working constructively together to serve New Hampshire.,en,Tweet,0,31,3,7,2683,2025-01-09 19:55:25,"<a href=""https://mobile.twitter.com"" rel=""nofollow"">Twitter Web App</a>",,,,
'1877102026598781363',"I look forward to serving as the Ranking Member of the Joint Economic Committee for the 119th Congress. 

Through this committee, we can build support for commonsense ways to lower costs.",en,Tweet,1,22,9,14,2898,2025-01-08 21:16:12,"<a href=""https://mobile.twitter.com"" rel=""nofollow"">Twitter Web App</a>",,,,
'1876675468910604332',"Chief Michael Maloney exemplified the very best of New Hampshire law enforcement, serving with extraordinary courage. 

Designating the Greenland Post Office in his name will help honor his sacrifice and dedication to protecting our communities.",en,Tweet,0,7,1,5,1112,2025-01-07 17:01:13,"<a href=""https://mobile.twitter.com"" rel=""nofollow"">Twitter Web App</a>",,,,
'1876300750374260882',"Today Congress will meet to certify the 2024 election results – continuing our long history of peaceful transitions of power, which was violently threatened 4 years ago. 

We must always remember that living in a democracy means respecting the results of free and fair elections.",en,Tweet,0,29,9,43,2765,2025-01-06 16:12:13,"<a href=""https://mobile.twitter.com"" rel=""nofollow"">Twitter Web App</a>",,,,
