tweet_id,text,language,type,bookmark_count,favorite_count,retweet_count,reply_count,view_count,created_at,client,hashtags,urls,media_type,media_urls
'1970202933007421885',"This morning, I had the honor of meeting five members of the West Virginia National Guard. These young men expressed great pride in being in Washington, D.C. to fulfill their sworn duty. They shared their hope that our nation’s capital is not only seen as a symbol of beauty, but also as a place where all Americans can feel safe.",en,Tweet,1,3,1,2,390,2025-09-22 20:05:58,"<a href=""https://mobile.twitter.com"" rel=""nofollow"">Twitter Web App</a>",,,photo,https://pbs.twimg.com/media/G1eN3rZWcAAWZzI.jpg
'1968789496683532336',"Today, @HouseCommerce Comm&Tech Subcommittee met to discuss nationwide broadband deployment.

During the hearing, I emphasized the importance of removing unnecessary regulatory barriers to help broadband providers deliver reliable high-speed internet access to all Americans.

You can view my full remarks here:",en,Tweet,0,4,1,2,546,2025-09-18 22:29:29,"<a href=""https://mobile.twitter.com"" rel=""nofollow"">Twitter Web App</a>",,,video,https://video.twimg.com/amplify_video/1968789359999504384/vid/avc1/640x360/0jyTG7KQz_cmA8N3.mp4?tag=21
'1967975360357675461',"Thanks to the unwavering leadership of @POTUS and his administration, Republicans passed the largest rural health investment in history.

By investing $50 billion in rural communities, we can improve access and outcomes for rural patients, modernize rural hospitals, and ensure that rural hospitals will continue to serve American patients.

You can read more on this historic investment here: https://t.co/whlE4zMWsP",en,Tweet,0,12,11,7,1043,2025-09-16 16:34:23,"<a href=""https://mobile.twitter.com"" rel=""nofollow"">Twitter Web App</a>",,,,
'1967945371507736930',"It was an honor to join my Colleagues in Statuary Hall for a Vigil held in memory of Charlie Kirk.

As we pray for Charlie, his family, and our nation, I encourage everyone to partake in civil discourse to continue Charlie's incredible legacy of bridging the political divide through conversation, not violence.",en,Tweet,0,9,2,1,334,2025-09-16 14:35:13,"<a href=""https://mobile.twitter.com"" rel=""nofollow"">Twitter Web App</a>",,,photo,https://pbs.twimg.com/media/G0-L0rBWUAAei_c.jpg
'1966127846121943149',"Today, we honor the 2,977 Americans who lost their lives in the 9/11 terror attacks.

While we mourn their loss, we must never forget the courage of the 40 Passengers and Crew Members of Flight 93.

Their sacrifice saved thousands of lives - may their memory continue to serve as an inspiration for us all.",en,Tweet,0,3,4,0,377,2025-09-11 14:13:02,"<a href=""https://mobile.twitter.com"" rel=""nofollow"">Twitter Web App</a>",,,photo,https://pbs.twimg.com/media/G0kW1o3XwAAXmh6.jpg
'1965883581513011704',"I join the millions of Americans who mourn the loss of Charlie Kirk after a disgusting act of violence took his life earlier today. 
 
Charlie was a husband, a father, and a proud American who sought to find common ground with his fellow Americans through conversation. 
 
Political violence has no place in our society. I am praying for his wife, Erika, and his two beautiful children. May his memory be a blessing.",en,Tweet,0,17,3,5,2481,2025-09-10 22:02:24,"<a href=""https://mobile.twitter.com"" rel=""nofollow"">Twitter Web App</a>",,,photo,https://pbs.twimg.com/media/G0g4bP-WsAAZImL.jpg
'1965149703609200934',"Today, President Trump visited the Museum of the Bible in Washington, D.C., as he continues his work to preserve the Christian values that shaped the founding of our nation. 

President Trump emphasized, ""To have a great nation, you need to have religion— I believe that so strongly."" 

Thank you, @POTUS, for championing such a critical message!

https://t.co/zLNdVdZ9yh",en,Tweet,0,4,0,8,559,2025-09-08 21:26:14,"<a href=""https://mobile.twitter.com"" rel=""nofollow"">Twitter Web App</a>",,,,
'1964322370824372632',Great to be with @POTUS last evening at the White House to discuss the Working Family Tax Cuts legislation and its positive impact on America! https://t.co/PedXp8u6xr,en,Tweet,0,15,2,10,922,2025-09-06 14:38:43,"<a href=""https://mobile.twitter.com"" rel=""nofollow"">Twitter Web App</a>",,,photo,https://pbs.twimg.com/media/G0KswgeXwAA8WyX.jpg
'1963641594680139813',"Yesterday, NPR falsely claimed that I voted against the censure of Rep. LaMonica McIver for her blatant disregard for Federal law enforcement.  

NPR failing to get this simple detail correct is yet another example that they are undeserving of American taxpayer dollars, as they continue to peddle misinformation to the American people.",en,Tweet,0,18,4,14,902,2025-09-04 17:33:33,"<a href=""https://mobile.twitter.com"" rel=""nofollow"">Twitter Web App</a>",,,,
'1963363106186293708',"Discussed the potential of AI to transform the delivery of healthcare during today's @HouseCommerce Health Subcommittee hearing. 

View my remarks here: https://t.co/b0OSAMMKzv",en,Tweet,0,7,1,3,746,2025-09-03 23:06:56,"<a href=""https://mobile.twitter.com"" rel=""nofollow"">Twitter Web App</a>",,,video,https://video.twimg.com/amplify_video/1963361651366711297/vid/avc1/640x360/K3oWK8xJ30b5IrAB.mp4?tag=21
'1962982748563407150',"Proud to support a Joint Resolution to make September 12th the National Day of the Bible to honor the Good Book’s influence on our nation's values. 

Watch my remarks on the importance of the Bible in our nation’s history: https://t.co/tn41zqsrIJ",en,Tweet,0,6,3,12,463,2025-09-02 21:55:32,"<a href=""https://mobile.twitter.com"" rel=""nofollow"">Twitter Web App</a>",,,video,https://video.twimg.com/amplify_video/1962978761332183040/vid/avc1/640x360/xfuQI6bzCDZYOIOX.mp4?tag=21
'1960365847928512586',"Today, we honor the 13 American heroes who gave their lives at Abbey Gate four years ago. 
 
May their memory be a blessing for us all.",en,Tweet,0,5,0,8,751,2025-08-26 16:36:54,"<a href=""https://mobile.twitter.com"" rel=""nofollow"">Twitter Web App</a>",,,,
'1958954915411505431',"Enjoyed visiting the Williamsburg Community Farm Show this week with President Jeff Walason! 
 
Thank you to Katie Ross and Katie Webb for showing us their impressive livestock - like Honey the Cow pictured here! 
 
It’s always a pleasure to visit with Pennsylvania’s future farmers!",en,Tweet,0,3,1,8,348,2025-08-22 19:10:22,"<a href=""https://mobile.twitter.com"" rel=""nofollow"">Twitter Web App</a>",,,photo,https://pbs.twimg.com/media/Gy-adVxWQAAGrFk.jpg
'1957833393221022136',"Gavin Newsom and California Democrats continue to ignore Federal law in favor of their Green New Deal agenda.

Proud to support @POTUS and @TheJusticeDept as they fight to ensure that American consumers can choose which vehicle best fits their needs, not California bureaucrats.
https://t.co/BfZcx54G87",en,Tweet,0,11,6,13,1092,2025-08-19 16:53:50,"<a href=""https://mobile.twitter.com"" rel=""nofollow"">Twitter Web App</a>",,,,
'1957465933443658230',"Thank you to Matt Ott and Derek Martin of Mann Plumbing and Heating for a great discussion on the services they provide to both residential and commercial customers. 
 
For 40 years, Mann Plumbing and Heating has been a family-owned and operated business proudly serving the Fayetteville community!",en,Tweet,0,3,2,3,457,2025-08-18 16:33:41,"<a href=""https://mobile.twitter.com"" rel=""nofollow"">Twitter Web App</a>",,,photo,https://pbs.twimg.com/media/GypQrU4XIAAkVe9.jpg
'1955349903439274180',"Visited Hess Orchards today with Myron Hess and Washington Township Supervisor Stewart McCleaf to check out some of Chambersburg's incredible peaches, cantaloupes, and zucchinis! 

Agriculture in Pennsylvania's 13th District continues to thrive! https://t.co/BN8KU9c1fp",en,Tweet,0,5,0,8,421,2025-08-12 20:25:20,"<a href=""https://mobile.twitter.com"" rel=""nofollow"">Twitter Web App</a>",,,photo,https://pbs.twimg.com/media/GyLL01xWgAAlwLj.jpg
'1955295637274235242',"American consumers deserve the right to choose which vehicle they drive, not Gavin Newsom and California Democrats. 

Since arriving in Washington, I have fought to protect your right to choose which vehicle best fits your needs, and I will continue this fight to ensure California follows the law as written, not out-of-touch, green new deal policies.",en,Tweet,0,14,3,7,1440,2025-08-12 16:49:42,"<a href=""https://mobile.twitter.com"" rel=""nofollow"">Twitter Web App</a>",,,,
'1953805738523889799',"Great to be at the “Old Home Week“ parade in Greencastle last evening and meet up with the Blue Devil football players from Greencastle High School!

So proud of these young athletes and all of the coaches and boosters that support them! https://t.co/GCXZioLSl0",en,Tweet,0,4,2,8,416,2025-08-08 14:09:22,"<a href=""https://mobile.twitter.com"" rel=""nofollow"">Twitter Web App</a>",,,photo,https://pbs.twimg.com/media/Gx1PY4IWMAAMHpj.jpg
'1953503939246108756',"Enjoyed my visit to Hollabaugh Bros. in Biglerville with @EckerRep to check out their impressive facility and apple harvest. 
 
Family farms are the backbone of Pennsylvania’s agriculture industry, and for 70 years, Hollabaugh Bros has been family owned and operated as they provide the Adams County community with fresh produce!",en,Tweet,0,6,0,5,417,2025-08-07 18:10:08,"<a href=""https://mobile.twitter.com"" rel=""nofollow"">Twitter Web App</a>",,,photo,https://pbs.twimg.com/media/Gxw9XmJXgAA1emY.jpg
'1952408501583482997',"On Friday, I joined the Blair County Drug and Alcohol Partnership’s legislative breakfast to discuss our work at the federal level to end the fentanyl epidemic and further support treatment and recovery programs in Pennsylvania.

The devastating fentanyl epidemic has taken millions of lives throughout the country, and I remain committed to ending this scourge on our society.",en,Tweet,0,2,0,9,381,2025-08-04 17:37:15,"<a href=""https://mobile.twitter.com"" rel=""nofollow"">Twitter Web App</a>",,,photo,https://pbs.twimg.com/media/GxhYxU2W8AAW-Xo.jpg
'1950966143046279643',"Today, I had the pleasure of meeting with constituents at the Senior Expo in Reedsville. The event offered an opportunity for seniors and those who care about them to learn more about programs and services designed to meet their unique needs. Special thanks to @SenatorJWard for sponsoring such a great event!",en,Tweet,0,8,1,9,496,2025-07-31 18:05:50,"<a href=""https://mobile.twitter.com"" rel=""nofollow"">Twitter Web App</a>",,,photo,https://pbs.twimg.com/media/GxM5LKTWQAEjHV0.jpg
'1949863417310785560',"The trade deal secured by @POTUS with the EU will open new markets for American energy producers, farmers, and manufacturers and will result in billions of dollars in new investments.

The American people voted for President Trump’s America First agenda, and now it’s delivering historic results.
https://t.co/LhJzUL8mHr",en,Tweet,0,12,1,19,583,2025-07-28 17:04:00,"<a href=""https://mobile.twitter.com"" rel=""nofollow"">Twitter Web App</a>",,,,
'1948436521431789992',"Proud to lead my first @HouseCommerce Oversight and Investigations Subcommittee hearing this week to investigate the organ procurement and transplant system.

Rampant abuses throughout these programs have fractured the doctor-patient relationship, doing irreparable harm to the trust of the American people. 

The victims and their families deserve accountability.",en,Tweet,0,5,0,9,413,2025-07-24 18:34:01,"<a href=""https://mobile.twitter.com"" rel=""nofollow"">Twitter Web App</a>",,,video,https://video.twimg.com/amplify_video/1948431472655810560/vid/avc1/1280x720/Mio-h9KS7nYmNIQK.mp4?tag=21
'1947681404256412108',"Organ transplants help save thousands of lives throughout the country, but we must ensure the safety of the donors, as well as the recipients. 

Today, I chaired my first @Housecommerce Oversight and Investigations Subcommittee hearing to examine the organ procurement and transplant process. 

You can watch my line of questioning to our witness below.",en,Tweet,2,10,3,7,929,2025-07-22 16:33:27,"<a href=""https://mobile.twitter.com"" rel=""nofollow"">Twitter Web App</a>",,,video,https://video.twimg.com/amplify_video/1947680223182360576/vid/avc1/640x360/-iuYCOInReOz5zRk.mp4?tag=21
'1946203996475052511',"The era of reckless spending is finally ending under @POTUS’ leadership.  Proud to help codify DOGE’s cuts and claw back billions in wasteful spending through a historic rescissions package. 

It’s time we focus on policies that put America First, not pet projects for democrats.",en,Tweet,0,39,5,12,8484,2025-07-18 14:42:46,"<a href=""https://mobile.twitter.com"" rel=""nofollow"">Twitter Web App</a>",,,,
'1945571489819795805',"Incredibly proud to join @POTUS at the White House as he signs the HALT Fentanyl Act into law.

Fentanyl poisoning has taken the lives of millions of Americans throughout the country, and this critical legislation will help our law enforcement get this poison off our streets and out of our communities.

President Trump has taken historic action to secure our border and remove criminals from our communities. Now, he is ending the scourge of fentanyl on our society.",en,Tweet,0,12,2,11,1518,2025-07-16 20:49:24,"<a href=""https://mobile.twitter.com"" rel=""nofollow"">Twitter Web App</a>",,,photo,"https://pbs.twimg.com/media/GwAO6bSXsAA0u5G.jpg,https://pbs.twimg.com/media/GwAO7abXoAACnvs.jpg"
'1945151851612999693',"Today is a bigger day than the immaculate reception for Pittsburgh as President Donald J. Trump and members of his cabinet will be joining Senator Dave McCormick and industry leaders to discuss the future of AI innovation and energy production right here in Pennsylvania.

You can watch this historic summit live: https://t.co/FKfd2dfu0e",en,Tweet,0,9,1,9,884,2025-07-15 17:01:55,"<a href=""https://mobile.twitter.com"" rel=""nofollow"">Twitter Web App</a>",,,,
'1943715782091059487',"Proud to join state and local officials, as well as @UPMC Altoona’s leadership team, at the unveiling of their new EMPATH Unit. 

This was a cross government effort to secure funding at federal, state, and local levels to improve our community’s capacity to care for behavioral health patients. 

This unit will provide higher quality care for patients throughout the region, and I look forward to seeing its positive impact on the Blair County community.",en,Tweet,0,5,1,5,427,2025-07-11 17:55:29,"<a href=""http://twitter.com/download/iphone"" rel=""nofollow"">Twitter for iPhone</a>",,,photo,https://pbs.twimg.com/media/Gvl3M8JXwAA9HHR.jpg
'1943299554050285888',"It was great to meet with the Adams County Director of Veterans Affairs Stan Clark along with Veterans Service Officers Michael Meehan and Sonny Freeman to discuss issues impacting veterans in our community. 

We are incredibly lucky to have such a motivated team serving our veterans in Adams County - thank you for your dedication to our nations heroes!",en,Tweet,0,7,2,2,373,2025-07-10 14:21:33,"<a href=""https://mobile.twitter.com"" rel=""nofollow"">Twitter Web App</a>",,,photo,https://pbs.twimg.com/media/Gvf8RGPWMAAXLaZ.jpg
'1942588594952282568',"We cannot allow China to own American farmland and increase their influence within our borders. 

Thank you @SecRollins for fighting back against this attempt by China to infiltrate our homeland!",en,Tweet,0,6,2,6,591,2025-07-08 15:16:27,"<a href=""https://mobile.twitter.com"" rel=""nofollow"">Twitter Web App</a>",,,,
'1941105537057259523',"Happy Independence Day!

249 years ago, a courageous group of businessmen, lawyers, farmers, and even a physician joined together to stand against tyranny and for the freedoms God bestowed upon each of us. 

Today, the incredible bravery of our founders has allowed us to live in the greatest nation on earth, and for that, we remain forever grateful.",en,Tweet,0,10,2,5,436,2025-07-04 13:03:18,"<a href=""http://twitter.com/download/iphone"" rel=""nofollow"">Twitter for iPhone</a>",,,photo,https://pbs.twimg.com/media/GvAxMqDXYAABY8J.jpg
'1940844560072028568',"Incredibly proud to deliver on @POTUS’ America First agenda with the passage of the One Big Beautiful Bill.

✅ Delivers tax relief for Main Street businesses.
✅ Avoids the largest tax hike in American history.
✅ Increases funding for border security.
✅ Incentivizes treatments for millions of rare disease patients.

We promised to deliver for the American people, and today, that promise became a reality.",en,Tweet,0,13,2,13,2145,2025-07-03 19:46:16,"<a href=""https://mobile.twitter.com"" rel=""nofollow"">Twitter Web App</a>",,,,
'1940041587586974139',"Today, on the 162nd Anniversary of the Battle of Gettysburg, I am reminded of the words of President Lincoln, ""That this nation, under God, shall have a new birth of freedom -- and that government of the people, by the people, for the people, shall not perish from the earth."" https://t.co/4VudtgtLJt",en,Tweet,1,18,4,11,838,2025-07-01 14:35:33,"<a href=""https://mobile.twitter.com"" rel=""nofollow"">Twitter Web App</a>",,,photo,https://pbs.twimg.com/media/GuxpXqkXYAAguLD.jpg
'1938604299002540257',"It was an honor to welcome Pastor Gary Dull of the Faith Baptist Church of Altoona, and his wife, Nancy, to Washington as Pastor Dull opened the House floor in prayer.

Pastor Dull has committed his life to spreading the Gospel and serving those in need, whether here at home or across the globe.

You can watch Pastor Dull’s opening prayer and my introductory remarks below!",en,Tweet,0,7,4,5,555,2025-06-27 15:24:17,"<a href=""https://mobile.twitter.com"" rel=""nofollow"">Twitter Web App</a>",,,video,https://video.twimg.com/amplify_video/1938599955465187328/vid/avc1/1920x1080/hg7QoQrrHtlWsITu.mp4?tag=21
'1937861316334485931',"The One Big Beautiful Bill is critical legislation that will deliver relief for American families, workers, and farmers by:

- Increasing the Child Tax Credit for 40 million families.
- Ending taxes on overtime and tips.
- Ensuring 2 million family farms are safe from the Death Tax.

Now, it’s time we get this legislation across the finish line and signed into law.",en,Tweet,1,92,34,50,13917,2025-06-25 14:11:56,"<a href=""https://mobile.twitter.com"" rel=""nofollow"">Twitter Web App</a>",,,video,https://video.twimg.com/amplify_video/1937861083114438656/vid/avc1/640x360/hVo10Qd5hDNySvey.mp4?tag=21
'1937517524456767846',It was great to catch up with @SecKennedy before he testifies at @Housecommerce on his work to finally Make America Healthy Again! https://t.co/nAknrf2Nl9,en,Tweet,0,11,1,6,576,2025-06-24 15:25:49,"<a href=""https://mobile.twitter.com"" rel=""nofollow"">Twitter Web App</a>",,,photo,https://pbs.twimg.com/media/GuNxzKOXEAAuTGB.jpg
'1936776770147041308',"Strength, Courage, and Leadership. 
 
@POTUS and the US Military showed all of these in stopping Iran with a targeted response from building nuclear warheads. A nuclear armed Iran was an unacceptable reality for our soldiers and allies in the region. 

Thank you President Trump and our courageous military for your decisive action.",en,Tweet,0,83,14,29,4508,2025-06-22 14:22:20,"<a href=""http://twitter.com/download/iphone"" rel=""nofollow"">Twitter for iPhone</a>",,,photo,https://pbs.twimg.com/media/GuDQNYCWkAAEmAA.jpg
'1935711303995199489',"This Juneteenth, we celebrate the day our nation’s freedoms were finally extended to all Americans. 

On June 19, 1865, Union soldiers arrived in Galveston, Texas, to announce the freedom of all enslaved people in the United States, marking the end of slavery and the extension of rights to all Americans.",en,Tweet,0,6,1,6,657,2025-06-19 15:48:33,"<a href=""http://twitter.com/download/iphone"" rel=""nofollow"">Twitter for iPhone</a>",,,photo,https://pbs.twimg.com/media/Gt0HLAHWUAAz3Mh.jpg
'1935513313728672129',"NO tax on tips!

Thank you @POTUS! https://t.co/OlvpxYNQS1",en,Tweet,0,15,1,6,1600,2025-06-19 02:41:48,"<a href=""http://twitter.com/download/iphone"" rel=""nofollow"">Twitter for iPhone</a>",,,photo,https://pbs.twimg.com/media/GtxTGa8XUAAjOWx.jpg
'1935342599956557892',"Throughout @POTUS campaign, he promised to secure our borders and protect our communities from the millions of illegal immigrants that entered our country during the Biden administration, and thanks to President Trump's leadership, the results speak for themselves. 
 
Promises made, promises kept.",en,Tweet,0,5,1,3,1310,2025-06-18 15:23:27,"<a href=""http://twitter.com/download/iphone"" rel=""nofollow"">Twitter for iPhone</a>",,,photo,https://pbs.twimg.com/media/Gtu31paXUAAqz3c.jpg
'1934344867519349081',"It was great to sit down with Penn State wrestler Matthew Lee to discuss his experience as a student athlete and his internship with my colleague Jim Jordan and the House Judiciary Committee this summer. 

Matthew, along with his brothers Nick and Joe, are accomplished Penn State student athletes originally from Indiana. Matthew plans to attend law school at Penn State this coming year, and I wish him the best of luck in his future endeavors!",en,Tweet,0,6,1,4,567,2025-06-15 21:18:49,"<a href=""http://twitter.com/download/iphone"" rel=""nofollow"">Twitter for iPhone</a>",,,photo,https://pbs.twimg.com/media/GtgsZ7-WoAE1jMW.jpg
'1933984996567769501',"I  join with all Americans praying for the families of Minnesota State Representative Melissa Hortman and Minnesota State Senator John Hoffman after these outrageous acts of violence.

There is no place in public service for violence.",en,Tweet,0,6,1,5,928,2025-06-14 21:28:49,"<a href=""http://twitter.com/download/iphone"" rel=""nofollow"">Twitter for iPhone</a>",,,,
'1933939941769154767',"Join me in celebrating the 250th Birthday of the greatest fighting force on earth, the U.S. Army, which has stood strong for 250 years defending our nations freedoms! https://t.co/60duiOVFxZ",en,Tweet,0,2,1,5,314,2025-06-14 18:29:47,"<a href=""http://twitter.com/download/iphone"" rel=""nofollow"">Twitter for iPhone</a>",,,photo,https://pbs.twimg.com/media/Gta8IKVXIAAWdi3.jpg
'1933201647628431716',"Very proud to join @POTUS in the East Room of the White House as he signed my legislation to reverse California’s EV mandate and protect consumer choice. 

This was a promise we made to the American people in November and now, it is finally a reality. 

Promises made, promises kept.",en,Tweet,0,23,4,25,2866,2025-06-12 17:36:04,"<a href=""http://twitter.com/download/iphone"" rel=""nofollow"">Twitter for iPhone</a>",,,photo,https://pbs.twimg.com/media/GtQcpycWIAAq68w.jpg
'1932805349154685188',"Nearly 60,000 @VolvoCarUSA Construction Units were delivered worldwide last year, with Volvo's Shippensburg plant playing a vital role in their production. 
 
Now, Volvo is investing $40 million into their Shippensburg plant, meaning 50% of their North American machines will be built right here in Pennsylvania. This expansion will bring jobs and revenue to the Shippensburg community, and I look forward to seeing the benefits this investment will bring!
 
https://t.co/DyEOsPW8Q5",en,Tweet,0,6,0,5,355,2025-06-11 15:21:19,"<a href=""https://mobile.twitter.com"" rel=""nofollow"">Twitter Web App</a>",,,,
'1932128369988321414',"Pennsylvania produces more than 10 billion pounds of milk annually by family-owned dairy farms throughout the Commonwealth, supporting 47,000 jobs. 

This National Dairy Month, we celebrate the contributions of the hardworking dairymen and women who bring the high-quality, nutritional dairy products that we know and love to communities throughout the country.",en,Tweet,0,10,3,5,474,2025-06-09 18:31:15,"<a href=""https://mobile.twitter.com"" rel=""nofollow"">Twitter Web App</a>",,,video,https://video.twimg.com/amplify_video/1932127782831591424/vid/avc1/640x360/3czIG-6ZqNhOhBPg.mp4?tag=21
'1931013579244728804',"On the 81st anniversary of the D-Day landings, we remember and honor the American, British, Canadian, and French soldiers who answered the call to service and made the ultimate sacrifice on the shores of Normandy as they fought to liberate Europe. Their courage in the face of evil will never be forgotten.",en,Tweet,0,8,1,4,349,2025-06-06 16:41:28,"<a href=""https://mobile.twitter.com"" rel=""nofollow"">Twitter Web App</a>",,,photo,https://pbs.twimg.com/media/GsxWf9cXAAAsLWx.jpg
'1930372407149109340',"Millions of Americans throughout the country suffer from the deadly cycle of addiction. Today, I proudly voted in favor of the SUPPORT Act to continue providing critical resources for our fellow Americans who struggle with substance abuse.

The SUPPORT Act is an important bill to help the victims of addiction get back on their feet, re-enter the workforce, and become integral members of their communities once again.",en,Tweet,0,8,1,4,597,2025-06-04 22:13:41,"<a href=""https://mobile.twitter.com"" rel=""nofollow"">Twitter Web App</a>",,,,
'1929989046098444393',"Want to stay up-to-date on my work to represent you in Washington and across our district? Sign up for my weekly newsletter at the link below!

https://t.co/mFtb47mWWq",en,Tweet,0,7,0,3,277,2025-06-03 20:50:20,"<a href=""http://twitter.com/download/iphone"" rel=""nofollow"">Twitter for iPhone</a>",,https://johnjoyce.house.gov/contact/newsletter-subscribe,,
'1927765385433997340',Happy 101st Birthday to the U.S. Border Patrol! Proud to support our brave CBP officers who put their lives on the line day in and day out. Thank you for tirelessly protecting our homeland.,en,Tweet,0,12,0,5,631,2025-05-28 17:34:18,"<a href=""https://mobile.twitter.com"" rel=""nofollow"">Twitter Web App</a>",,,,
