tweet_id,text,language,type,bookmark_count,favorite_count,retweet_count,reply_count,view_count,created_at,client,hashtags,urls,media_type,media_urls
'1970284166106452435',"So…did he take $50,000 in a paper bag from an undercover FBI agent on camera(!) or didn’t he?",en,Tweet,5,199,41,15,38092,2025-09-23 01:28:45,"<a href=""http://twitter.com/download/iphone"" rel=""nofollow"">Twitter for iPhone</a>",,,,
'1968693949255602205',"For everyone in the comments claiming it was ""a business decision""- no, it was your government shutting down free speech.

Trump's Chair of the FCC told private companies to remove Kimmel, publicly saying ""we can do this the easy way or the hard way"" hours before they complied!",en,Tweet,1,19,5,12,2132,2025-09-18 16:09:48,"<a href=""https://mobile.twitter.com"" rel=""nofollow"">Twitter Web App</a>",,,,
'1968469092701974991',You can't celebrate Charlie Kirk as a champion of free speech while also trying to silence the people on the left for exercising their free speech.,en,Tweet,10,235,53,923,38642,2025-09-18 01:16:18,"<a href=""https://mobile.twitter.com"" rel=""nofollow"">Twitter Web App</a>",,,,
'1966307261242130798',"Big congrats to my friend @wutrain! 

A resounding re-election victory, earned while raising three kids including a nine month old (!) and running a city all at the same time. 

What a rock star! https://t.co/MHO92B55Is",en,Tweet,0,40,0,17,3262,2025-09-12 02:05:57,"<a href=""http://twitter.com/download/iphone"" rel=""nofollow"">Twitter for iPhone</a>",,,photo,https://pbs.twimg.com/media/G0m6Bo6XwAA9GF2.jpg
'1965954396497559913',"By listing examples of right wing individuals who have been target but not the many Democrats (Giffords, Pelosi, Minnesota, etc) Trump is making the problem worse.

Political violence is a plague on our country that can only be fixed by lowering the temperature, not raising it.",en,Tweet,2,41,8,48,7498,2025-09-11 02:43:48,"<a href=""http://twitter.com/download/iphone"" rel=""nofollow"">Twitter for iPhone</a>",,,,
'1964092633933918580',Team of rivals! 😂,en,Tweet,0,12,2,3,1181,2025-09-05 23:25:49,"<a href=""http://twitter.com/download/iphone"" rel=""nofollow"">Twitter for iPhone</a>",,,,
'1963406911673393278',Endorse.,es,Tweet,0,6,1,2,765,2025-09-04 02:01:00,"<a href=""http://twitter.com/download/iphone"" rel=""nofollow"">Twitter for iPhone</a>",,,,
'1961837948254421440',"I don’t usually pay attention to trolls, but everyone trying to justify this is hilarious.

“They should just raise the money from rich donors and celebrities!”

Yes, kids with cancer, prepare your pitch decks and go ask Ryan Reynolds to fund your vaccine trials. Problem solved!",en,Tweet,1,50,21,13,4474,2025-08-30 18:06:30,"<a href=""http://twitter.com/download/iphone"" rel=""nofollow"">Twitter for iPhone</a>",,,,
'1961553822997684305',"Is this what you voted for, MAGA? 

Cutting treatment for kids with cancer to pay for tax cuts for billionaires?",en,Tweet,0,78,25,59,13070,2025-08-29 23:17:29,"<a href=""http://twitter.com/download/iphone"" rel=""nofollow"">Twitter for iPhone</a>",,,,
'1961031771862061140',"Last night’s horrific attack on civilians in Ukraine proves once again that Putin has no interest in piece and continues to make Trump and Vance look like fools.

Surge aid to Ukraine now.",en,Tweet,0,20,6,12,1236,2025-08-28 12:43:03,"<a href=""http://twitter.com/download/iphone"" rel=""nofollow"">Twitter for iPhone</a>",,,,
'1960895920859500849',"Don’t forget: 

People have mental health issues all over the world. Gun violence is unique to America. It doesn’t have to be this way. https://t.co/leP36bFWcd",en,Tweet,0,8,3,8,692,2025-08-28 03:43:13,"<a href=""http://twitter.com/download/iphone"" rel=""nofollow"">Twitter for iPhone</a>",,,photo,https://pbs.twimg.com/media/GzaAcrEWUAAaHxu.jpg
'1960394154292203634',"Nope! You own this, House Republicans.

When you voted to massively expand ICE’s budget, Trump had been locking up &amp; deporting innocent hardworking people with no due process for months.

You knew exactly what was happening and voted for more. Now you’ll pay the political price.",en,Tweet,0,15,3,8,1459,2025-08-26 18:29:23,"<a href=""http://twitter.com/download/iphone"" rel=""nofollow"">Twitter for iPhone</a>",,,,
'1960375310131527814',"She has not been convicted of any crime. She has not even been CHARGED with any crime. 

You know who HAS been found liable of real estate fraud by a court of law? Donald Trump. Thank you for your attention to this matter.",en,Tweet,2,44,12,15,2380,2025-08-26 17:14:30,"<a href=""http://twitter.com/download/iphone"" rel=""nofollow"">Twitter for iPhone</a>",,,,
'1960135421947703387',"1. The President does not have the legal authority to fire a Fed Director except in extreme circumstances

2. She has not been convicted of
any crime

This is a wannabe dictator trying to do dictator things. Why? He is looking for someone else to blame for the slowing economy.",en,Tweet,270,9965,2614,647,615826,2025-08-26 01:21:16,"<a href=""http://twitter.com/download/iphone"" rel=""nofollow"">Twitter for iPhone</a>",,,,
'1960033117822996883',"Rhode Island is the Saudi Arabia of offshore wind.

Blocking clean energy from the grid kills American jobs, raises Americans’ electric bills, and is a great way to lose the AI race to China.",en,Tweet,17,504,156,120,53915,2025-08-25 18:34:45,"<a href=""http://twitter.com/download/iphone"" rel=""nofollow"">Twitter for iPhone</a>",,,,
'1960003454627414222',A lot of truth to this. Keep your eye on the ball people.,en,Tweet,1,5,2,4,1245,2025-08-25 16:36:53,"<a href=""http://twitter.com/download/iphone"" rel=""nofollow"">Twitter for iPhone</a>",,,,
'1959827587569447180',"👋 This is in my district. Let’s set the record straight:

This America-last action by the Trump Admin is blocking clean, American made energy from the grid.

The project is 80% complete, 45 turbines already built, enough to power 350k homes below current market price.",en,Tweet,149,3764,1280,126,156170,2025-08-25 04:58:03,"<a href=""http://twitter.com/download/iphone"" rel=""nofollow"">Twitter for iPhone</a>",,,,
'1954602310438433229',"Another hot, fun and festive Dominican Parade in South Providence! 🇩🇴 🇺🇸 ⚓️ https://t.co/inzviKXme2",en,Tweet,1,31,4,5,1552,2025-08-10 18:54:40,"<a href=""http://twitter.com/download/iphone"" rel=""nofollow"">Twitter for iPhone</a>",,,photo,"https://pbs.twimg.com/media/GyAkcLuWQAIscWk.jpg,https://pbs.twimg.com/media/GyAkcLuWkAA1ugq.jpg,https://pbs.twimg.com/media/GyAkcLqWQAIkXFF.jpg,https://pbs.twimg.com/media/GyAkcLlWQAI4YWV.jpg"
'1954343143375036573',Great catching up with the Richmond Democratic Committee at today’s event. This crew turned a rural Rhode Island town blue last year and they are just getting started! https://t.co/mtE6ga65fI,en,Tweet,0,7,1,1,833,2025-08-10 01:44:49,"<a href=""http://twitter.com/download/iphone"" rel=""nofollow"">Twitter for iPhone</a>",,,photo,"https://pbs.twimg.com/media/Gx84uuoXsAAoqev.jpg,https://pbs.twimg.com/media/Gx84uujXwAAFUMU.jpg,https://pbs.twimg.com/media/Gx84uujWAAELHwk.jpg"
'1952922546250133699',What she said.,en,Tweet,1,9,1,7,1543,2025-08-06 03:39:53,"<a href=""http://twitter.com/download/iphone"" rel=""nofollow"">Twitter for iPhone</a>",,,,
'1951683235991179588',"Had a blast with Max at the 3rd Annual Roll Back to School event hosted by the Gazmine Mason Foundation!

Families across the area came together for a morning of fun, food, and bowling while getting essential school supplies.

A perfect way to kick off the back to school season! 🎳",en,Tweet,0,8,0,1,647,2025-08-02 17:35:18,"<a href=""http://twitter.com/download/iphone"" rel=""nofollow"">Twitter for iPhone</a>",,,photo,"https://pbs.twimg.com/media/GxXFjnhW8AEVqIK.jpg,https://pbs.twimg.com/media/GxXFjngXMAATdbg.jpg,https://pbs.twimg.com/media/GxXFjnkWkAAv6-l.jpg"
'1947008057231253744',A beautiful day celebrating Cranston’s Italian-American community at the St. Mary’s Feast procession in Knightsville. Buona Festa! 🇮🇹 ⚓️ https://t.co/W1zD6s5Rhb,en,Tweet,1,16,0,17,2222,2025-07-20 19:57:49,"<a href=""http://twitter.com/download/iphone"" rel=""nofollow"">Twitter for iPhone</a>",,,photo,https://pbs.twimg.com/media/GwUpf0-XUAED3Cc.jpg
'1945964858463142157',Rhode Island: better tippers than Massachusetts. https://t.co/IrlHdAMi5R,en,Tweet,0,10,1,3,876,2025-07-17 22:52:31,"<a href=""http://twitter.com/download/iphone"" rel=""nofollow"">Twitter for iPhone</a>",,,photo,https://pbs.twimg.com/media/GwF0uWrXMAASinY.jpg
'1944082984291774472',"Feliz Día de la Independencia!

It was a joy to celebrate Rhode Island's Colombian community at the Colombia Festival Parade in Pawtucket and Central Falls.

🇨🇴 🇺🇸 https://t.co/QCWz7pOAW1",ro,Tweet,0,2,1,0,478,2025-07-12 18:14:37,"<a href=""http://twitter.com/download/iphone"" rel=""nofollow"">Twitter for iPhone</a>",,,photo,"https://pbs.twimg.com/media/GvrFJ5IWEAExpCR.jpg,https://pbs.twimg.com/media/GvrFJ5GWIAAiUTw.jpg,https://pbs.twimg.com/media/GvrFJ5PWEAAa5Zr.jpg,https://pbs.twimg.com/media/GvrFJ5IWEAAL7W5.jpg"
'1943058913185669331',"Nope, we’re not doing this.

I call out antisemitism, and I’m going to call out Islamophobia too, like this stupid clickbait from Rep. Fine.

Being Muslim &amp; critical of Israeli policy does not make someone a terrorist. 

We need to take down the temperature. https://t.co/c64rEtZC1m",en,Tweet,3,65,7,28,4121,2025-07-09 22:25:19,"<a href=""http://twitter.com/download/iphone"" rel=""nofollow"">Twitter for iPhone</a>",,,photo,https://pbs.twimg.com/media/GvcgbXzXwAAj8pt.jpg
'1942613705482727725',This is so cool!,en,Tweet,0,5,1,2,925,2025-07-08 16:56:14,"<a href=""https://mobile.twitter.com"" rel=""nofollow"">Twitter Web App</a>",,,,
'1941277920892538884',"And yes, the tradition is still alive… https://t.co/e8kGODKrJd",en,Tweet,2,37,0,18,3080,2025-07-05 00:28:18,"<a href=""http://twitter.com/download/iphone"" rel=""nofollow"">Twitter for iPhone</a>",,,video,https://video.twimg.com/amplify_video/1941277793024679936/vid/avc1/720x1280/DR76qKc8yr3_B2hp.mp4?tag=14
'1941276890158989620',Another spirited Ancients and Horribles Parade in Chepachet! 99 years running! 🇺🇸 https://t.co/xt7w11eJHz,en,Tweet,0,18,1,5,1153,2025-07-05 00:24:12,"<a href=""http://twitter.com/download/iphone"" rel=""nofollow"">Twitter for iPhone</a>",,,photo,"https://pbs.twimg.com/media/GvDNAUuWUAAocyo.jpg,https://pbs.twimg.com/media/GvDNAUzWUAADVwW.jpg,https://pbs.twimg.com/media/GvDNAUtWEAAKqkb.jpg,https://pbs.twimg.com/media/GvDNAUuXEAAwNEs.jpg"
'1941185846297989350',"Always wonderful to be back in Bristol celebrating the greatest country at the greatest 4th of July celebration! 

Happy 4th! 🇺🇸 ⚓️ https://t.co/EUgddX0y9M",en,Tweet,0,6,0,1,503,2025-07-04 18:22:25,"<a href=""http://twitter.com/download/iphone"" rel=""nofollow"">Twitter for iPhone</a>",,,photo,"https://pbs.twimg.com/media/GvB6MYdW8AAUm57.jpg,https://pbs.twimg.com/media/GvB6MYkWQAAXIDa.jpg,https://pbs.twimg.com/media/GvB6MYYWkAAMVpE.jpg,https://pbs.twimg.com/media/GvB6MYaXgAIUayf.jpg"
'1940746769543188864',"Good morning from the only place on earth where you can cut heath insurance for 17 million people, still somehow add $5 trillion to the debt, and call that a big accomplishment. 😒 https://t.co/HYrPnGa3Xn",en,Tweet,6,304,58,104,20414,2025-07-03 13:17:41,"<a href=""http://twitter.com/download/iphone"" rel=""nofollow"">Twitter for iPhone</a>",,,photo,https://pbs.twimg.com/media/Gu7q5QTXQAAPz66.jpg
'1940534658686767475',KIlL THE BILL!,en,Tweet,0,21,0,8,1140,2025-07-02 23:14:50,"<a href=""http://twitter.com/download/iphone"" rel=""nofollow"">Twitter for iPhone</a>",,,,
'1938767164489531879',"I’ll be honest - I’ve been so focused on fighting the Republican bill to gut Medicaid, and on Rhode Island issues that I am only now getting caught up on the NYC Mayor race.

But one thing is clear right off the bat: reactions like these are racist and Islamophobic and must be condemned.",en,Tweet,2,63,8,58,9472,2025-06-28 02:11:27,"<a href=""http://twitter.com/download/iphone"" rel=""nofollow"">Twitter for iPhone</a>",,,photo,"https://pbs.twimg.com/media/GufiZJBXIAEcjTq.jpg,https://pbs.twimg.com/media/GufiZJCWgAAIBn7.jpg"
'1936806098385752133',The Providence Pride parade always delivers! I had a great time last night marching with my @RIDemParty colleagues in celebration and solidarity with the LGBTQ+ community. 🏳️‍🌈 https://t.co/9Y30EXaHOl,en,Tweet,0,10,1,4,925,2025-06-22 16:18:52,"<a href=""http://twitter.com/download/iphone"" rel=""nofollow"">Twitter for iPhone</a>",,,photo,"https://pbs.twimg.com/media/GuDq4HwXoAAntTU.jpg,https://pbs.twimg.com/media/GuDq4HqXQAA_uZW.jpg,https://pbs.twimg.com/media/GuDq4HmXQAAjckV.jpg,https://pbs.twimg.com/media/GuDq4HnWgAAwkIj.jpg"
'1934356609741815918',"False. He’s a Republican who preached against abortion and gay rights. 

But the real problem isn’t conservatives or liberals. It’s cowards like Mike Lee, who make their living trying to divide Americans against each other by telling lies.",en,Tweet,2,89,21,35,7302,2025-06-15 22:05:29,"<a href=""http://twitter.com/download/iphone"" rel=""nofollow"">Twitter for iPhone</a>",,,,
'1934016363837747317',"Happy Gaspee Days from Pawtuxet Village, where the American revolution really began.

From 1772 through today, Rhode Island is a land of #NoKings 🇺🇸 ⚓️ https://t.co/cV39LwHynT",en,Tweet,2,60,11,27,3516,2025-06-14 23:33:28,"<a href=""http://twitter.com/download/iphone"" rel=""nofollow"">Twitter for iPhone</a>",#NoKings,,photo,"https://pbs.twimg.com/media/GtcA-jUXMAABZ21.jpg,https://pbs.twimg.com/media/GtcA-jdXgAArb_9.jpg,https://pbs.twimg.com/media/GtcA-jnXgAAIDlb.jpg,https://pbs.twimg.com/media/GtcA-jfWsAA2Yaa.jpg"
'1931893058481864827',"In Rhode Island we are proud to be the most Portuguese state in the country!

Wonderful celebration in Providence for the Day of Portugal today. 🇵🇹 🇺🇸 ⚓️ https://t.co/G3JfpRfEoV",en,Tweet,1,9,1,0,1005,2025-06-09 02:56:12,"<a href=""http://twitter.com/download/iphone"" rel=""nofollow"">Twitter for iPhone</a>",,,photo,"https://pbs.twimg.com/media/Gs92c8FWQAAjZCr.jpg,https://pbs.twimg.com/media/Gs92c8HXUAADxFv.jpg,https://pbs.twimg.com/media/Gs92c8GWkAIwhVg.jpg,https://pbs.twimg.com/media/Gs92c8pXoAAlAnv.jpg"
'1931538141837414824',"My heart goes out to those impacted by the building collapse at the Portsmouth Portuguese Club. 

At least one young life has been taken too soon. 

Out of this tragedy we are reminded that Rhode Island is a tight-knit state where we look out for one another in times of tragedy and sorrow.",en,Tweet,0,16,1,2,1614,2025-06-08 03:25:53,"<a href=""http://twitter.com/download/iphone"" rel=""nofollow"">Twitter for iPhone</a>",,,,
'1929275548502503912',Kicking off Pride Month in Wickford today at the 3rd Annual North Kingstown Pride Parade! https://t.co/oDdpgCFvTO,en,Tweet,0,38,3,38,9412,2025-06-01 21:35:09,"<a href=""http://twitter.com/download/iphone"" rel=""nofollow"">Twitter for iPhone</a>",,,photo,"https://pbs.twimg.com/media/GsYp4hrXUAAXVZN.jpg,https://pbs.twimg.com/media/GsYp4huWUAAzGSS.jpg,https://pbs.twimg.com/media/GsYp4hsWoAAq_7V.jpg,https://pbs.twimg.com/media/GsYp4huWQAEAsmP.jpg"
'1928600159270715527',"A full room with the Westerly, Charlestown, Hopkinton and Richmond Democratic committees tonight!

People are ready to work at all levels for our democracy and shared values. https://t.co/QwddHptdYn",en,Tweet,1,17,2,21,1895,2025-05-31 00:51:24,"<a href=""http://twitter.com/download/iphone"" rel=""nofollow"">Twitter for iPhone</a>",,,photo,https://pbs.twimg.com/media/GsPDntCW0AAQFKh.jpg
'1928260777162490022',"Hear me out. If you’re worried your insurance won’t cover your legal exposure if you bribe Trump, one answer could be…don’t bribe Trump.",en,Tweet,0,5,1,0,948,2025-05-30 02:22:49,"<a href=""http://twitter.com/download/iphone"" rel=""nofollow"">Twitter for iPhone</a>",,,,
'1928237431951663511',Great catching up with the Burrillville Democratic committee tonight! https://t.co/KGueP4CA1L,en,Tweet,0,1,0,2,487,2025-05-30 00:50:03,"<a href=""http://twitter.com/download/iphone"" rel=""nofollow"">Twitter for iPhone</a>",,,photo,"https://pbs.twimg.com/media/GsJ5sLCXsAA3zZv.jpg,https://pbs.twimg.com/media/GsJ5sLCXQAAaJ7p.jpg,https://pbs.twimg.com/media/GsJ5sLNWEAAzFqE.jpg,https://pbs.twimg.com/media/GsJ5sLEWMAAaL-O.jpg"
'1927034749022818435',A deeply moving Memorial Day parade and ceremony in South Kingstown this morning. This town has produced countless heroes for our country including three Medal of Honor recipients. https://t.co/RyvVAFZFo7,en,Tweet,0,2,1,1,424,2025-05-26 17:11:01,"<a href=""http://twitter.com/download/iphone"" rel=""nofollow"">Twitter for iPhone</a>",,,photo,"https://pbs.twimg.com/media/Gr4z2r2WkAAhQlt.jpg,https://pbs.twimg.com/media/Gr4z2sCXkAEl3Xn.jpg,https://pbs.twimg.com/media/Gr4z2sAW0AEl-vo.jpg,https://pbs.twimg.com/media/Gr4z2sFXIAApA3r.jpg"
'1926715614044864532',This year the town of Exeter is celebrating its 50th Memorial Day celebration today. A fitting tribute to America’s bravest in a patriotic town. 🇺🇸 ⚓️ https://t.co/cpBtHKwG09,en,Tweet,0,1,0,2,442,2025-05-25 20:02:53,"<a href=""http://twitter.com/download/iphone"" rel=""nofollow"">Twitter for iPhone</a>",,,photo,"https://pbs.twimg.com/media/Gr0RomLXsAAK70_.jpg,https://pbs.twimg.com/media/Gr0Rol8WkAAlGW2.jpg,https://pbs.twimg.com/media/Gr0RolrWwAA4_rC.jpg,https://pbs.twimg.com/media/Gr0Rol8XgAAGBC4.jpg"
'1924854098576179669',"Like so many Rhode Islanders, @MatunuckOyster has been where my family and I have celebrated many life events - including by 40th!

And when a group of my House colleagues visited RI, I knew right away where to take them for dinner.

Wishing Perry &amp; team the best as they rebuild. https://t.co/8oD1c5rFFP",en,Tweet,0,6,2,3,1191,2025-05-20 16:45:53,"<a href=""https://mobile.twitter.com"" rel=""nofollow"">Twitter Web App</a>",,,photo,"https://pbs.twimg.com/media/GrZ0SyDXEAAO1Rr.jpg,https://pbs.twimg.com/media/GrZ0TiAXwAAxCD8.jpg,https://pbs.twimg.com/media/GrZ0Ub2W8AAA80l.jpg,https://pbs.twimg.com/media/GrZ0VLfXMAAPYyl.jpg"
'1924830610188636331',"Does cutting 13 million people off their health insurance and putting countless nursing homes and rural health clinics out of business count as ‘fucking around’?

I’m asking for 220 of my House colleagues…",en,Tweet,1,21,5,5,1611,2025-05-20 15:12:33,"<a href=""http://twitter.com/download/iphone"" rel=""nofollow"">Twitter for iPhone</a>",,,,
'1924451263195824379',"At this rate, the vote for final passage will be a secret ballot in a submarine in the middle of the ocean.",en,Tweet,2,20,8,3,1616,2025-05-19 14:05:10,"<a href=""http://twitter.com/download/iphone"" rel=""nofollow"">Twitter for iPhone</a>",,,,
'1923795295348888030',"Absolutely, @AOC. We as Congressional Dems only have credibility to call out Trump’s corruption if we are willing to call our own as well.",en,Tweet,0,4,0,4,745,2025-05-17 18:38:35,"<a href=""http://twitter.com/download/iphone"" rel=""nofollow"">Twitter for iPhone</a>",,,,
'1922006403444593093',"Reality check:

China returning to pre-trade war policies and tariff levels for 90 days. No other concessions. 

Trump will still charge 30% on Chinese goods. So Americans will pay higher prices in return for...nothing. https://t.co/ZLkEt8aXpj",en,Tweet,0,1,1,4,346,2025-05-12 20:10:10,"<a href=""https://mobile.twitter.com"" rel=""nofollow"">Twitter Web App</a>",,,photo,https://pbs.twimg.com/media/GqxU81TWcAANYHl.jpg
'1921347615347601761',"Last year Metallica played an Elton John cover at a Library of Congress event I was at.  It was very well done (you can probably find it online).  Whether you like their music or not, they are real musicians.",en,Tweet,0,1,0,1,855,2025-05-11 00:32:23,"<a href=""http://twitter.com/download/iphone"" rel=""nofollow"">Twitter for iPhone</a>",,,,
'1920936676328620152',"Congratulations @cleanwater_ri on a wonderful event this morning and thank you for everything you do to build a cleaner, stronger and more sustainable state! https://t.co/rsgSJwkFVT",en,Tweet,0,10,2,2,725,2025-05-09 21:19:27,"<a href=""http://twitter.com/download/iphone"" rel=""nofollow"">Twitter for iPhone</a>",,,photo,"https://pbs.twimg.com/media/GqiJtcAWMAATqJ0.jpg,https://pbs.twimg.com/media/GqiJtcBXgAAsJDN.jpg,https://pbs.twimg.com/media/GqiJtcFXEAEBb8q.jpg,https://pbs.twimg.com/media/GqiJtcEXMAA4xb1.jpg"
'1920822317443117421',"The American people are demanding an end to Congressional stock trading, momentum is growing, and we are close to achieving a consensus bill.

Then it will be on Speaker Johnson to do the right thing and bring it to the floor.",en,Tweet,0,4,1,2,723,2025-05-09 13:45:02,"<a href=""https://mobile.twitter.com"" rel=""nofollow"">Twitter Web App</a>",,,,
'1920291362823405883',"Celtics in 6.

Yup. I said it.",en,Tweet,1,15,2,3,869,2025-05-08 02:35:12,"<a href=""http://twitter.com/download/iphone"" rel=""nofollow"">Twitter for iPhone</a>",,,,
'1920177645637009853',Rhode Island has opinions on this. IYKYK ⚓️,fr,Tweet,1,78,10,9,29863,2025-05-07 19:03:20,"<a href=""http://twitter.com/download/iphone"" rel=""nofollow"">Twitter for iPhone</a>",,,,
'1919173500213813339',"This morning I had the honor of introducing @SenJackReed at his annual spring breakfast. 

Jack is exactly the kind of devoted public servant we need more of in Washington, and we are lucky to have him in the Senate representing our state. https://t.co/dc9FCtWXy1",en,Tweet,1,20,3,0,1281,2025-05-05 00:33:13,"<a href=""http://twitter.com/download/iphone"" rel=""nofollow"">Twitter for iPhone</a>",,,photo,"https://pbs.twimg.com/media/GqJGB0CXsAAtPvk.jpg,https://pbs.twimg.com/media/GqJGBzHXcAA2RT5.jpg"
'1918794646278283375',It’s game time in Pawtucket! Let’s go @RhodeIslandFC! https://t.co/eNVfQXzT9V,en,Tweet,0,5,0,0,451,2025-05-03 23:27:47,"<a href=""http://twitter.com/download/iphone"" rel=""nofollow"">Twitter for iPhone</a>",,,video,https://video.twimg.com/amplify_video/1918794546055446528/vid/avc1/1280x720/mHyruN-2vxHyismp.mp4?tag=14
'1918302091015078287',The entire New England delegation: https://t.co/8wbBzOY6GY,en,Tweet,33,667,45,2,41514,2025-05-02 14:50:33,"<a href=""http://twitter.com/download/iphone"" rel=""nofollow"">Twitter for iPhone</a>",,,photo,https://pbs.twimg.com/media/Gp8tlRHXQAARUdM.jpg
'1917570616640602453',"Prices up, GDP down. Trump’s economy.",en,Tweet,0,3,1,1,770,2025-04-30 14:23:56,"<a href=""http://twitter.com/download/iphone"" rel=""nofollow"">Twitter for iPhone</a>",,,,
'1917204198690525254',What’s wrong with transparency?,en,Tweet,0,19,4,8,2565,2025-04-29 14:07:55,"<a href=""http://twitter.com/download/iphone"" rel=""nofollow"">Twitter for iPhone</a>",,,,
'1916233295605731622',The art of being the absolute last person in the world to realize that Putin can’t be trusted….,en,Tweet,2,84,26,16,9609,2025-04-26 21:49:54,"<a href=""http://twitter.com/download/iphone"" rel=""nofollow"">Twitter for iPhone</a>",,,,
'1914079142624239883',You have GOT to be kidding. Seriously dude? https://t.co/4ufYkLProA,en,Tweet,3,217,65,43,6369,2025-04-20 23:10:04,"<a href=""http://twitter.com/download/iphone"" rel=""nofollow"">Twitter for iPhone</a>",,,photo,https://pbs.twimg.com/media/GpAs1ZxXIAAsIUs.jpg
'1912460455882170818',Finding an angle in the house that the kids haven’t destroyed is always a victory. Thx 🙏,en,Tweet,4,123,10,11,13374,2025-04-16 11:57:59,"<a href=""http://twitter.com/download/iphone"" rel=""nofollow"">Twitter for iPhone</a>",,,,
'1911939354773102899',LFG!!!,qst,Tweet,0,14,0,4,1080,2025-04-15 01:27:18,"<a href=""http://twitter.com/download/iphone"" rel=""nofollow"">Twitter for iPhone</a>",,,,
'1911428285424152873',"This morning Vladimir Putin’s army fired missies at Ukrainian civilians walking into Palm Sunday services. Dozens were killed.

The two sides are not the same.
Putin started this war. He can end it.",en,Tweet,0,15,4,5,967,2025-04-13 15:36:30,"<a href=""http://twitter.com/download/iphone"" rel=""nofollow"">Twitter for iPhone</a>",,,,
'1910814824784609453',Corruption. Plain and simple.,en,Tweet,0,15,3,16,2084,2025-04-11 22:58:50,"<a href=""http://twitter.com/download/iphone"" rel=""nofollow"">Twitter for iPhone</a>",,,,
'1910493340560482586',"So great to be back home in Rhode Island, catching up with the @NK_Dems alongside @AGNeronha https://t.co/KrUNWFpKap",en,Tweet,0,0,0,0,390,2025-04-11 01:41:22,"<a href=""http://twitter.com/download/iphone"" rel=""nofollow"">Twitter for iPhone</a>",,,photo,"https://pbs.twimg.com/media/GoNvdQAWgAAptMm.jpg,https://pbs.twimg.com/media/GoNvdP4W8AATeLu.jpg,https://pbs.twimg.com/media/GoNvdP9XcAApeZ4.jpg"
'1910179830445785506',"What she said. 

We need to know who knew about today’s tariff announcement and who profited.

We also need to pass a ban on congressional stock trading now.",en,Tweet,2,49,11,31,33998,2025-04-10 04:55:35,"<a href=""http://twitter.com/download/iphone"" rel=""nofollow"">Twitter for iPhone</a>",,,,
'1909738314308919777',"🍿 🍿 🍿 Your move, Mike.",en,Tweet,1,20,2,17,1940,2025-04-08 23:41:10,"<a href=""http://twitter.com/download/iphone"" rel=""nofollow"">Twitter for iPhone</a>",,,,
'1909661755334160790',Accurate.,en,Tweet,0,5,0,1,669,2025-04-08 18:36:56,"<a href=""http://twitter.com/download/iphone"" rel=""nofollow"">Twitter for iPhone</a>",,,,
'1908964308454945272',"It’s cute that my Republican colleagues think the reason the market is tanking has to do with the nuances of the reconciliation process as opposed to, you know, Trump launching a global trade war with one of the largest tax increases on American consumers in history.",en,Tweet,1,5,0,1,812,2025-04-06 20:25:32,"<a href=""http://twitter.com/download/iphone"" rel=""nofollow"">Twitter for iPhone</a>",,,,
'1908164279905255434',"It's not March, but it will be madness...",en,Tweet,0,2,0,0,570,2025-04-04 15:26:30,"<a href=""https://mobile.twitter.com"" rel=""nofollow"">Twitter Web App</a>",,,,
