tweet_id,text,language,type,bookmark_count,favorite_count,retweet_count,reply_count,view_count,created_at,client,hashtags,urls,media_type,media_urls
'1900307269314609570',"Raul Grijalva was a giant in Congress. He was a legend of Mexican-American activism, known across the country for protecting our national parks and being a voice for all communities. He was a kind and brilliant man and he will be so missed.",en,Tweet,1,235,44,22,6508,2025-03-13 22:05:33,"<a href=""http://twitter.com/download/iphone"" rel=""nofollow"">Twitter for iPhone</a>",,,,
'1899974949739126902',House Dems are ready to pass a four-week funding extension in order to reach a true bipartisan agreement and keep the government open.,en,Tweet,2,78,23,9,4127,2025-03-13 00:05:02,"<a href=""http://twitter.com/download/iphone"" rel=""nofollow"">Twitter for iPhone</a>",,,,
'1899954715447665111',"I am holding DOGE and its employees accountable. People with ties to the real estate industry should NOT have access to public housing assistance data. 

We demand that the Office of Government Ethics (OGE) takes immediate action and enforces ethical and legal compliance.",en,Tweet,9,550,228,20,13856,2025-03-12 22:44:38,"<a href=""http://twitter.com/download/iphone"" rel=""nofollow"">Twitter for iPhone</a>",,,,
'1899930533481558401',"Shuttering the Department of Education will impact fundamental programs that help our students succeed. In Texas, this means betraying:

• Title I schools who support the most vulnerable students
• Progress we’ve made to support students with disabilities
• Students who depend on federal aid to afford college",en,Tweet,2,146,53,11,4310,2025-03-12 21:08:32,"<a href=""http://twitter.com/download/iphone"" rel=""nofollow"">Twitter for iPhone</a>",,,,
'1899852413839835172',"This is shameful. Arbitrarily cutting half of the Department of Education’s staff will have far reaching consequences. 

Trump is turning his back on our students, parents, and teachers. Education should level the playing field and build an infrastructure of opportunity for all our kids. 

Shuttering the Department would make America less competitive and take away those opportunities from our students. Our country was based on the premise that all of us can chase our dreams.",en,Tweet,2,65,16,10,3040,2025-03-12 15:58:07,"<a href=""http://twitter.com/download/iphone"" rel=""nofollow"">Twitter for iPhone</a>",,,,
'1899600958490837029',An update from me—I voted no on tonight’s continuing resolution (CR). https://t.co/gH4Duzl28o,en,Tweet,8,424,81,41,9787,2025-03-11 23:18:56,"<a href=""http://twitter.com/download/iphone"" rel=""nofollow"">Twitter for iPhone</a>",,,video,https://video.twimg.com/amplify_video/1899600881584074752/vid/avc1/480x854/zMsPblo8EsBJr5_K.mp4?tag=16
'1899515467234193646',"Trump's tariffs are hurting the American people. The House GOP and Speaker Johnson put language into the continuing resolution (CR) rule that stops Congress from forcing a floor vote to put an end to Trump's tariffs, even as the markets plummet.

Any member who votes YES on today's CR rule supports increasing the cost of living for hardworking American families. Trump's tariffs do not put America or Americans first.",en,Tweet,1,82,58,5,9333,2025-03-11 17:39:13,"<a href=""https://mobile.twitter.com"" rel=""nofollow"">Twitter Web App</a>",,,,
'1899485684735361447',"Trump is already behaving like a dictator. This case is designed to silence anyone who challenges this administration. If Mahmoud Khalil is deported, that precedent will take the United States down a very dark and dangerous road.

https://t.co/Y98j6QTYFc",en,Tweet,7,134,47,22,4321,2025-03-11 15:40:52,"<a href=""http://twitter.com/download/iphone"" rel=""nofollow"">Twitter for iPhone</a>",,https://apnews.com/article/columbia-university-mahmoud-khalil-ice-6964107d218dba43eb995d6dbbe528b1,,
'1898527511731912737',"There was a powerful sense of solidarity during today's Town Hall at Our Lady of the Lake as we heard from veterans, students, seniors, & others who are worried about the future but ready to stand up for San Antonio, Texas and America. 

Thank you to the 1,000+ people who joined us — it was great to hear from you.",en,Tweet,4,281,75,25,8467,2025-03-09 00:13:26,"<a href=""http://twitter.com/download/iphone"" rel=""nofollow"">Twitter for iPhone</a>",,,photo,"https://pbs.twimg.com/media/GljsrQBWkAEoGhT.jpg,https://pbs.twimg.com/media/GljsrQDXsAAUHGc.jpg,https://pbs.twimg.com/media/GljsrQWXIAAUqSt.jpg,https://pbs.twimg.com/media/GljsrQVXoAAYrUS.jpg"
'1897793122492727407',@VETERANUSA1 I’m working to get an exact number.,en,Reply,0,1,0,2,49,2025-03-06 23:35:14,"<a href=""http://twitter.com/download/iphone"" rel=""nofollow"">Twitter for iPhone</a>",,,,
'1897772029840957724',"Remember 2010/2011 when the corporate line against Obama was that his policies were creating “uncertainty”? 

Well this is total chaos. Yet much of the business community tries to appease Trump rather than fight back. 

To business leaders — if you don’t speak up strongly against what Trump’s doing now then don’t ever call me again to complain about the damage of tariffs, lack of free markets, higher taxes, etc., on your industry. 

His policies are hurting everyone — businesses AND workers.",en,Tweet,1,111,51,4,6380,2025-03-06 22:11:25,"<a href=""http://twitter.com/download/iphone"" rel=""nofollow"">Twitter for iPhone</a>",,,,
'1897769968357310502',Republicans are empowering DOGE to wreck the American economy.,en,Tweet,4,208,97,29,8903,2025-03-06 22:03:13,"<a href=""http://twitter.com/download/iphone"" rel=""nofollow"">Twitter for iPhone</a>",,,,
'1897419940056977420',"Three years ago, sick and dying veterans had to come to Washington to shame Republican senators into passing the PACT Act. 

If Trump’s plan moves forward, VA employees who were hired to help veterans with their PACT Act benefits will be thrown to the curb. People will suffer because Republican lawmakers are too scared to stand up to Trump’s attacks on our veterans.",en,Reply,1,27,6,3,2099,2025-03-05 22:52:20,"<a href=""https://mobile.twitter.com"" rel=""nofollow"">Twitter Web App</a>",,,,
'1897419938073338094',"San Antonio is home to more than 90,000 veterans who risked everything to serve our country. I challenge Trump and Elon Musk to come to our city and explain why tax cuts for billionaires matter more than their lives.

Trump’s plan to fire tens of thousands of VA employees is illegal, and I will not support a budget that makes harmful cuts to VA programs or services.",en,Tweet,8,526,167,49,19056,2025-03-05 22:52:20,"<a href=""https://mobile.twitter.com"" rel=""nofollow"">Twitter Web App</a>",,,,
'1897403806406635699',"Sylvester Turner, former Houston mayor and Congressman for Texas’ 18th district, leaves a void that will be deeply felt by all who knew him. 

Congressman Turner dedicated more than half his life to public service. After serving 27 years in the Texas House of Representatives, he was elected to be the mayor of Houston in 2016. Sylvester Turner uplifted many voices that had been silenced in the city. He made great strides to end chronic homelessness and bring new hope to Houston. 

His life calling in politics made a difference not only on paper but in people’s lives. Turner’s legacy will live on as one of humility, perseverance, and kindness.
https://t.co/3RAyt27zjn",en,Tweet,1,71,15,3,3314,2025-03-05 21:48:14,"<a href=""https://mobile.twitter.com"" rel=""nofollow"">Twitter Web App</a>",,,,
'1897109092264788067',"In just six weeks, Donald Trump has wrecked lives at home and abroad and battered our economy.

Tonight, you'll hear more slogans, more lies, and more justifications for the terrible policy many Americans are now saying they regret supporting. I'm here to hold him accountable. https://t.co/kst1iYl3Bk",en,Tweet,39,2321,414,907,110121,2025-03-05 02:17:08,"<a href=""https://mobile.twitter.com"" rel=""nofollow"">Twitter Web App</a>",,,photo,https://pbs.twimg.com/media/GlPglbPX0AAEnDt.jpg
'1896709259402088782',"San Antonio: I’m hosting a Town Hall for constituents at Our Lady of the Lake University this Saturday, March 8. I want to hear from you and share updates from my work in Congress.

Doors open at 1:30 pm. Registration is open to all TX-20 residents, but space may fill up quickly. Reserve your spot: https://t.co/e8n5DCTjPn",en,Tweet,3,125,49,6,6443,2025-03-03 23:48:21,"<a href=""https://mobile.twitter.com"" rel=""nofollow"">Twitter Web App</a>",,,photo,https://pbs.twimg.com/media/GlJ285IXwAAasMp.jpg
'1896657552949006525',"I’m proud to announce that my guest for the Joint Address to Congress will be Jason Massiatte, the president and CEO of Ma Hila’s Heart Children’s Cancer Foundation in San Antonio.
 
As the Trump administration pushes for major cuts to Medicaid and cancer research, our country needs to understand what’s at stake. As a cancer patient myself, this isn’t just politics – it’s personal.",en,Tweet,0,66,23,11,3940,2025-03-03 20:22:53,"<a href=""http://twitter.com/download/iphone"" rel=""nofollow"">Twitter for iPhone</a>",,,photo,https://pbs.twimg.com/media/GlJH_kHXIAABfim.jpg
'1895949913432768875',"Lots of smiles today at Earthwise Living Day in Leon Valley —the longest running environmental event in Bexar County!

I had a great time speaking to community members, local vendors (shoutout to T’s Thai Express and El Cevichero Waldito for their great food), and sponsors. Thank you to Leon Valley Mayor Chris Riley, Adam Castillo, and the Earthwise Living Committee for their work to raise awareness about environmental issues and build a healthier future for our kids.",en,Tweet,0,40,2,1,2733,2025-03-01 21:30:59,"<a href=""http://twitter.com/download/iphone"" rel=""nofollow"">Twitter for iPhone</a>",,,photo,"https://pbs.twimg.com/media/Gk_EY-fW8AAxqIu.jpg,https://pbs.twimg.com/media/Gk_EY-eWMAABAiG.jpg,https://pbs.twimg.com/media/Gk_EY-eW8AAmj1o.jpg,https://pbs.twimg.com/media/Gk_EY-eWsAAt6cY.jpg"
'1895620565714739623',"Today, Donald Trump and JD Vance disgraced the United States of America.

My full statement on the disastrous Oval Office meeting with Ukrainian President Volodymyr Zelenskyy: https://t.co/2W2uXGOjgC",en,Tweet,48,3369,991,242,59500,2025-02-28 23:42:16,"<a href=""http://twitter.com/download/iphone"" rel=""nofollow"">Twitter for iPhone</a>",,,photo,https://pbs.twimg.com/media/Gk6Y252XoAA3kiN.jpg
'1895121392225386693',"San Antonio students & families: My office is hosting a fair on Saturday, March 8 to help students learn about the application and congressional nomination process for U.S. military service academies. 

Join us on March 8 from 10 am-1 pm in the Buena Vista building at the UTSA Downtown Campus.",en,Tweet,0,13,4,1,1654,2025-02-27 14:38:44,"<a href=""http://twitter.com/download/iphone"" rel=""nofollow"">Twitter for iPhone</a>",,,photo,https://pbs.twimg.com/media/GkzS3L8WsAAX3Uh.jpg
'1894936535859872040',"Elon Musk's purges are leaving American veterans suddenly without a job, struggling to pay their bills.

Today, I was proud to stand with Army veteran @RepDerekTranCA to introduce a bill reinstating veterans illegally fired from federal jobs. We have a duty to fight for our veterans like they fought for us.",en,Tweet,4,307,106,42,10057,2025-02-27 02:24:11,"<a href=""https://mobile.twitter.com"" rel=""nofollow"">Twitter Web App</a>",,,video,https://video.twimg.com/ext_tw_video/1894936089657249792/pu/vid/avc1/1280x720/eN2MrDlDk9fF2yyU.mp4?tag=12
'1894589809869332800',"Bad news - Republicans just passed the first step of Trump's plan to cut Medicaid for millions of kids, seniors, and people with disabilities to pay for tax cuts for the wealthiest Americans.

But our fight isn't over yet - and there's still time to make your voice heard. https://t.co/wx889lH9jB",en,Tweet,62,1554,559,713,61698,2025-02-26 03:26:25,"<a href=""https://ads.twitter.com"" rel=""nofollow"">Twitter Ads</a>",,,video,https://video.twimg.com/amplify_video/1894588815198519296/vid/avc1/360x640/FvgoqItA0280qARc.mp4?tag=14
'1894521359914459186',"I’m voting NO on the Republican plan to cut hundreds of billions of dollars from Medicaid and nutrition assistance to fund tax cuts for billionaires.

Here’s what you need to know about today’s vote: https://t.co/yBvmPtkT61",en,Tweet,51,1930,450,407,93590,2025-02-25 22:54:25,"<a href=""https://studio.twitter.com"" rel=""nofollow"">Twitter Media Studio</a>",,,video,https://video.twimg.com/amplify_video/1894520093905657857/vid/avc1/1280x720/ZlWtxC3GfdbI6ghF.mp4?tag=14
'1894197867562050005',"Donald Trump is aligning the United States with the world's worst tyrants.
 
The U.S. just sided with Russia and North Korea and voted against condemning Russia's invasion of Ukraine.
 
Russia's investment in Trump is paying off for Moscow.",en,Tweet,6,244,77,26,9420,2025-02-25 01:28:58,"<a href=""https://mobile.twitter.com"" rel=""nofollow"">Twitter Web App</a>",,,,
'1893813312561053941',"My staff and I are closely tracking the potential measles exposure in San Antonio that originated with a visitor from West Texas. 

If you visited any of the locations listed below, please watch out for symptoms (including fever or unexplained rash) and contact a doctor right away if they occur. Measles is extremely contagious and can be especially dangerous for children. 

Many CVS, Walgreens, and H-E-B pharmacies offer safe and effective measles vaccines. To learn more about the MMR vaccine, visit this link: https://t.co/1ulppUzAx1",en,Tweet,69,1418,713,106,109466,2025-02-24 00:00:53,"<a href=""https://mobile.twitter.com"" rel=""nofollow"">Twitter Web App</a>",,,photo,https://pbs.twimg.com/media/Gkgs27tWQAA075D.png
'1893502493549621656',"Happy 130th Anniversary, @OLLUnivSATX !

It was an honor to join the OLLU community tonight to celebrate 130 years of educating minds and transforming lives.",en,Tweet,0,25,3,1,3210,2025-02-23 03:25:48,"<a href=""https://mobile.twitter.com"" rel=""nofollow"">Twitter Web App</a>",,,photo,"https://pbs.twimg.com/media/GkcSZ3ZXYAAeU5s.jpg,https://pbs.twimg.com/media/GkcSZ3ZXAAANsEb.jpg"
'1893130723831193615',"Let's be clear: CQ Brown was fired because Trump and Hegseth couldn't see past his skin color.

General Brown has 40 years of distinguished service. Trump and Hegseth just want yes men who look like them.

This is destabilizing for our nation.",en,Tweet,5,188,61,50,21299,2025-02-22 02:48:31,"<a href=""https://mobile.twitter.com"" rel=""nofollow"">Twitter Web App</a>",,,,
'1892596375533261004',"Greg Abbot’s voucher program will accelerate the death of rural Texas towns. 

More than 150 rural counties have absolutely zero private schools where parents can send their children. That’s not choice that’s an illusion. 

Although I’m sure Abbott will set up a few of his cronies to build private schools and scoop up billions in state $$ if the bill passes. Even that will take years.",en,Tweet,16,810,242,135,68181,2025-02-20 15:25:13,"<a href=""http://twitter.com/download/iphone"" rel=""nofollow"">Twitter for iPhone</a>",,,,
'1892396615555580044',"40 years ago, it would have been unthinkable for the president of the United States to repeat Russian propaganda about Ukraine.

It's remarkable how far we have fallen with Donald Trump. https://t.co/bDGIzn9Ghq",en,Tweet,5,562,174,55,10294,2025-02-20 02:11:26,"<a href=""https://mobile.twitter.com"" rel=""nofollow"">Twitter Web App</a>",,,photo,https://pbs.twimg.com/media/GkMkkoFWMAAoOrY.jpg
'1892381357017616649',"Eleven-year-old Jocelynn Rojo Carranza endured months of bullying about her family's immigration status at her Dallas-area school before she took her own life.

As I said to @Acosta - Trump has created a culture of cruelty and meanness that is infecting American society and our kids. My staff and I are reaching out to San Antonio schools to ask them how they’re protecting students against bullying in this hostile environment.",en,Tweet,74,2294,821,449,178218,2025-02-20 01:10:48,"<a href=""https://mobile.twitter.com"" rel=""nofollow"">Twitter Web App</a>",,,video,https://video.twimg.com/ext_tw_video/1892380513823870978/pu/vid/avc1/1280x720/4in6J889KI_i_-u9.mp4?tag=12
'1892364485693788293',"San Antonio is standing up and fighting back!

I was proud to rally with the National Association of Letter Carriers and the American Federation of Government Employees to oppose Elon Musk’s cuts and push for a fair contract with the U.S. Postal Service.

These folks work hard and deliver for us. They deserve a government that treats them with dignity and respect.",en,Tweet,0,70,25,10,3679,2025-02-20 00:03:46,"<a href=""https://mobile.twitter.com"" rel=""nofollow"">Twitter Web App</a>",,,photo,https://pbs.twimg.com/media/GkMHYjrWEAA2MkG.jpg
'1892315217259901353',Express-News: Rising egg prices hitting San Antonio restaurants where it hurts https://t.co/LQSVB02Dq0 via @expressnews,en,Tweet,0,14,5,5,2146,2025-02-19 20:47:59,"<a href=""http://twitter.com/download/iphone"" rel=""nofollow"">Twitter for iPhone</a>",,https://www.expressnews.com/food/restaurants/article/rising-egg-prices-san-antonio-restaurants-20173544.php?utm_campaign=CMS%20Sharing%20Tools%20(Premium)&utm_source=t.co&utm_medium=referral,,
'1891711921704849522',The Trump economy.,en,Tweet,22,1762,734,96,57078,2025-02-18 04:50:43,"<a href=""http://twitter.com/download/iphone"" rel=""nofollow"">Twitter for iPhone</a>",,,,
'1891551980511711312',"Donald Trump and Republicans are making flying more dangerous. 

This will increase the probability for plane accidents. 

Texas has two of the largest airports in the country (DFW + IAH) yet Governor Greg Abbott stays mute about this danger.",en,Tweet,3,259,98,22,13483,2025-02-17 18:15:10,"<a href=""http://twitter.com/download/iphone"" rel=""nofollow"">Twitter for iPhone</a>",,,,
'1890938128661139556',"This is catastrophically dangerous. 

We’re all paying a price because Republicans let Elon Musk recklessly fire even the people who help prevent nuclear disasters. https://t.co/S2llGykMId",en,Tweet,19,893,319,46,24354,2025-02-16 01:35:56,"<a href=""https://mobile.twitter.com"" rel=""nofollow"">Twitter Web App</a>",,,photo,https://pbs.twimg.com/media/Gj32FZKWkAAIHs5.jpg
'1890527905698181413',"Greg Abbott is losing it because his voucher scam has been exposed. Texas schools will lose billions they now use for academics, athletics, teacher training, student support. 

In dozens of Texas counties there’s not even a single private school that parents can “choose” to send their kids to.",en,Tweet,437,8828,2490,264,443585,2025-02-14 22:25:51,"<a href=""http://twitter.com/download/iphone"" rel=""nofollow"">Twitter for iPhone</a>",,,,
'1887668946158956626',"I’ve been getting calls from military &amp; national security spouses worried about losing the jobs they depend on when their families are stationed away from home.

@ChrisVanHollen, @SenBooker &amp; I led a letter asking OPM to clarify their exemption from the telework ban. No response. https://t.co/LZeGflX5XP",en,Tweet,3,50,29,7,9543,2025-02-07 01:05:22,"<a href=""https://mobile.twitter.com"" rel=""nofollow"">Twitter Web App</a>",,,photo,"https://pbs.twimg.com/media/GjJYihFXUAAmufW.jpg,https://pbs.twimg.com/media/GjJYihEXkAAvBvA.jpg,https://pbs.twimg.com/media/GjJYihFXMAAmRwZ.jpg"
'1885804105790108126',"Trump wants to close the Department of Education and defund public schools.

Shutting down USAID sets an illegal, dangerous precedent.

If Trump gets away with this, he'll come for American schools next.",en,Tweet,33,826,325,100,58798,2025-02-01 21:35:10,"<a href=""http://twitter.com/download/iphone"" rel=""nofollow"">Twitter for iPhone</a>",,,,
'1885771575040856210',"Today marks the start of Black History Month, a time to celebrate the extraordinary achievements &amp; contributions of Black Americans.
 
As the President and those in power make baseless, dangerous attacks on diversity, this celebration of excellence is more important than ever. https://t.co/AmgZMxzUki",en,Tweet,2,76,24,5,3149,2025-02-01 19:25:54,"<a href=""http://twitter.com/download/iphone"" rel=""nofollow"">Twitter for iPhone</a>",,,photo,https://pbs.twimg.com/media/GiubQKMXYAADQ1E.jpg
'1885507183539806231',"Trump’s attempt to destroy USAID undermines one of our most effective tools to build American influence, fight global poverty, and confront countries like China.

The last time Trump tried this, Republicans in Congress raised their voice to stop it.

Will they do so again today?",en,Tweet,58,1419,416,175,82912,2025-02-01 01:55:18,"<a href=""https://mobile.twitter.com"" rel=""nofollow"">Twitter Web App</a>",,,,
'1885503126263800013',"Two horrific plane crashes in less than 48 hours. My condolences are with the victims and the families of those affected by today’s plane crash in northeast Philadelphia and I’m praying for the community.

https://t.co/chlcZGlZeY",en,Tweet,2,235,47,7,8465,2025-02-01 01:39:10,"<a href=""https://mobile.twitter.com"" rel=""nofollow"">Twitter Web App</a>",,https://www.npr.org/2025/01/31/nx-s1-5282412/philadelphia-small-plane-crash,,
'1884675859698606091',"He was a trailblazer in education and public service and a longtime friend of my family. I’ll always be grateful for his work, and he will be missed. 2/",en,Reply,0,9,0,0,1444,2025-01-29 18:51:55,"<a href=""http://twitter.com/download/iphone"" rel=""nofollow"">Twitter for iPhone</a>",,,,
'1884675856779362584',"I’m saddened by the passing of San Antonio’s Dr. Joe Bernal, a former member of the Texas Legislature who was passionate about great public schools and opportunity for all. 1/ https://t.co/EZZogbGtP1",en,Tweet,0,22,1,1,2040,2025-01-29 18:51:54,"<a href=""http://twitter.com/download/iphone"" rel=""nofollow"">Twitter for iPhone</a>",,,photo,https://pbs.twimg.com/media/Gie2tDpXAAA526D.jpg
'1884395983758582039',"As a cancer patient, I’m glad a judge has blocked this illegal executive order. 2/",en,Reply,0,40,1,3,2181,2025-01-29 00:19:47,"<a href=""http://twitter.com/download/iphone"" rel=""nofollow"">Twitter for iPhone</a>",,,,
'1884395981212471645',"For cancer patients every day counts. If you or a loved one has cancer you know the importance of research into treatments and cures. 

President Trump’s federal funding freeze may have blocked funding for life-saving cancer research. 1/ https://t.co/2rKrMHUdaG",en,Tweet,2,102,35,18,7657,2025-01-29 00:19:46,"<a href=""http://twitter.com/download/iphone"" rel=""nofollow"">Twitter for iPhone</a>",,,video,https://video.twimg.com/amplify_video/1884395885448003584/vid/avc1/1280x720/oP3qfdlVD5kEot87.mp4?tag=14
'1883669587507716369',"Trump’s trade wars will raise grocery prices in Texas and across the country. 

But Trump and his cabinet of billionaires won’t feel it so they don’t care what happens to everyone else. #TrumpTradeWars",en,Tweet,14,595,189,99,31194,2025-01-27 00:13:21,"<a href=""http://twitter.com/download/iphone"" rel=""nofollow"">Twitter for iPhone</a>",#TrumpTradeWars,,,
'1882647505688777083',"If you’re born in America, you’re an American. Period.",en,Tweet,6,631,90,86,17412,2025-01-24 04:31:57,"<a href=""http://twitter.com/download/iphone"" rel=""nofollow"">Twitter for iPhone</a>",,,,
'1882598850990633112',"Trump’s immigration raids are already sweeping up U.S. citizens. 

This is dangerous, unconstitutional, and harmful to the American economy.",en,Tweet,5,196,71,35,12016,2025-01-24 01:18:37,"<a href=""http://twitter.com/download/iphone"" rel=""nofollow"">Twitter for iPhone</a>",,,,
'1882557526560137669',"President Trump nominated the most unqualified cabinet in American history.

His anti-DEI crusade is a smokescreen to turn Americans against each other while his billionaire backers take over the government and install their own political loyalists.",en,Tweet,11,501,153,49,11349,2025-01-23 22:34:25,"<a href=""http://twitter.com/download/iphone"" rel=""nofollow"">Twitter for iPhone</a>",,,,
'1881510450610983412',"The skies were dark today but our spirits were full of light as we celebrated the legacy of Dr. Martin Luther Ling Jr. this morning.

Dr. King faced hatred, but he never accepted it - and we cannot either. As we face troubled times, we cannot surrender as we carry on his dream. https://t.co/JILW3rOoRE",en,Tweet,1,65,10,3,5591,2025-01-21 01:13:42,"<a href=""http://twitter.com/download/iphone"" rel=""nofollow"">Twitter for iPhone</a>",,,video,https://video.twimg.com/amplify_video/1881510316154015744/vid/avc1/360x640/XqncA-fqd6ua5FhM.mp4?tag=14
'1881501420098338895',"Do it the right way, they said.",en,Tweet,49,2184,406,55,136295,2025-01-21 00:37:49,"<a href=""http://twitter.com/download/iphone"" rel=""nofollow"">Twitter for iPhone</a>",,,,
'1881447387916538197',"As this administration begins, I'm focused on great schools, affordable health care and a strong, fair economy that allows people to pursue their dreams.

I'll work with anyone to deliver for San Antonio — but I'll fight back hard against policies that hurt our city.",en,Reply,0,96,10,2,3402,2025-01-20 21:03:07,"<a href=""https://mobile.twitter.com"" rel=""nofollow"">Twitter Web App</a>",,,,
'1881447386264051825',"The Trump administration is gearing up to destroy birthright citizenship, gut the protections of the Affordable Care Act, and hand control of our government over to oligarchs who abuse and exploit American workers. 2/",en,Reply,2,75,11,1,3420,2025-01-20 21:03:07,"<a href=""https://mobile.twitter.com"" rel=""nofollow"">Twitter Web App</a>",,,,
'1881447384552780072',President Trump began his second term today. He and the Republican majority are executing policies that would drastically alter American society. 1/,en,Tweet,7,197,32,8,13485,2025-01-20 21:03:06,"<a href=""https://mobile.twitter.com"" rel=""nofollow"">Twitter Web App</a>",,,,
