tweet_id,text,language,type,bookmark_count,favorite_count,retweet_count,reply_count,view_count,created_at,client,hashtags,urls,media_type,media_urls
'1935477372033081835',I said what I said. https://t.co/Mwfjkx7Oo8,en,Tweet,111,8793,1968,2925,253842,2025-06-19 00:18:59,"<a href=""http://twitter.com/download/iphone"" rel=""nofollow"">Twitter for iPhone</a>",,,photo,https://pbs.twimg.com/media/Gtwyaa4WoAAojEU.jpg
'1935455330714140752',"SCOTUS's ruling today dangerously affirmed a state’s ability to make health care decisions for you and your family. It is the latest assault on trans kids and the LGBTQ+ community.

Private health care decisions should be just that — private.",en,Tweet,34,1158,307,2268,117252,2025-06-18 22:51:24,"<a href=""https://mobile.twitter.com"" rel=""nofollow"">Twitter Web App</a>",,,,
'1935418845075845528',"Republicans are attempting to ram through a provision to sell millions in acres in California, including land around Yosemite, Mt. Shasta, Lake Tahoe & Big Sur, as part of their big ugly bill.

Our federal public treasures shouldn't be sold off to the highest bidder.

I will fight this, tooth & nail.",en,Tweet,159,7357,3008,645,146659,2025-06-18 20:26:25,"<a href=""https://mobile.twitter.com"" rel=""nofollow"">Twitter Web App</a>",,,photo,https://pbs.twimg.com/media/Gtv9A00XMAAh2ou.jpg
'1935404059940241556',"Natural disasters don't spare voters from either party. And our response must be equally nonpartisan.

Someone needs to tell the president he is supposed to represent all Americans.

And to stop making life more difficult for thousands of Californians trying to recover.",en,Tweet,18,836,260,424,70520,2025-06-18 19:27:40,"<a href=""https://mobile.twitter.com"" rel=""nofollow"">Twitter Web App</a>",,,,
'1935380031737364551',"We must prevent Iran from ever having a nuclear weapon, and support Israel’s ability to defend itself.

But the President cannot declare war on Iran or launch strikes against it without Congressional approval. 

Congress must not cede that authority to this or any other president.",en,Tweet,32,1331,438,1364,113331,2025-06-18 17:52:11,"<a href=""https://mobile.twitter.com"" rel=""nofollow"">Twitter Web App</a>",,,video,https://video.twimg.com/amplify_video/1935378483452039168/vid/avc1/1280x720/_sSEjaX1jsLJ6Rgi.mp4?tag=21
'1935130519529787820',"Donald Trump has effectively already selected his next Supreme Court Justice.

And he's just about as bad as it gets. Let's talk about Emil Bove. https://t.co/QrQFMkBp6u",en,Tweet,279,3288,1431,1788,534284,2025-06-18 01:20:43,"<a href=""https://mobile.twitter.com"" rel=""nofollow"">Twitter Web App</a>",,,video,https://video.twimg.com/amplify_video/1935127284165251072/vid/avc1/1920x1080/eBczwwzitxMu7VcR.mp4?tag=21
'1935100899241710020',"This isn't just about California. It’s about how we treat our fellow human beings. It’s about how we treat families. It’s about who we are.

I stand with @SenAlexPadilla. https://t.co/KkddYduaHZ",en,Tweet,76,6718,1499,3122,145070,2025-06-17 23:23:01,"<a href=""https://mobile.twitter.com"" rel=""nofollow"">Twitter Web App</a>",,,video,https://video.twimg.com/amplify_video/1935100583498727424/vid/avc1/1920x1080/zLeFO0FXw5o7DrXi.mp4?tag=21
'1935002416555917381',"The billionaire tax cheat in the Oval Office just eliminated the office that goes after other billionaire tax cheats.

Same old story.

The get richer. And the little guy gets screwed. https://t.co/MKeCYdXPtz",en,Tweet,491,15492,6751,3661,423813,2025-06-17 16:51:41,"<a href=""https://mobile.twitter.com"" rel=""nofollow"">Twitter Web App</a>",,,photo,https://pbs.twimg.com/media/GtqCZNVacAAUZ4T.jpg
'1934790356018622543',"We must put an end to this horribly destructive path of political violence.

That requires all of us – including and especially this President. https://t.co/G8HQVa3GqH",en,Tweet,40,2066,566,2238,88292,2025-06-17 02:49:02,"<a href=""http://twitter.com/download/iphone"" rel=""nofollow"">Twitter for iPhone</a>",,,video,https://video.twimg.com/amplify_video/1934790188712017920/vid/avc1/360x640/lfIzdyfa5NX6qIb4.mp4?tag=21
'1934734559825784984',"The President has surrounded himself with stooges and sycophants who enable his worst, most lawless impulses. 

That makes all of us less safe. https://t.co/rqDYoO7rhM",en,Tweet,148,17799,3890,5382,364818,2025-06-16 23:07:19,"<a href=""https://mobile.twitter.com"" rel=""nofollow"">Twitter Web App</a>",,,video,https://video.twimg.com/amplify_video/1934734434768412672/vid/avc1/1280x720/8QjOxFtHV432-2mE.mp4?tag=21
'1934713005188764029',"Saudi Arabia has executed another journalist, Turki Al-Jasser, after seven years of his detention for reporting on corruption. 

The failure to hold Saudi Arabia accountable for the murder of Jamal Khashoggi only encourages further acts of deadly violence against journalists in the Persian Gulf and elsewhere.",en,Tweet,73,2733,1280,384,177719,2025-06-16 21:41:40,"<a href=""https://mobile.twitter.com"" rel=""nofollow"">Twitter Web App</a>",,,photo,https://pbs.twimg.com/media/Gtl7Jt1a0AIL7D8.jpg
'1934664119329722719',"Donald Trump just laid bare his real immigration plan:

1) Target blue cities
2) Inflame tensions, divide families and stir up more chaos
3) Placate the MAGA base at the expense of our economy. 

Trump’s extreme policies are tearing the country apart and bad for America. https://t.co/YGfRN6GCuz",en,Tweet,151,6564,2165,3380,288403,2025-06-16 18:27:25,"<a href=""https://mobile.twitter.com"" rel=""nofollow"">Twitter Web App</a>",,,photo,https://pbs.twimg.com/media/GtlOpMFXsAAzBoF.jpg
'1934608775278682436',"One of my favorite parts of my job – getting to welcome Californians to the Capitol and hear directly from them.

CA residents, if you're going to be in DC – let my office know! https://t.co/YSsMNs93gB",en,Tweet,7,639,125,280,33227,2025-06-16 14:47:29,"<a href=""https://mobile.twitter.com"" rel=""nofollow"">Twitter Web App</a>",,,photo,"https://pbs.twimg.com/media/GtkcTk0awAA89rk.jpg,https://pbs.twimg.com/media/GtkcVydXoAAhGoL.jpg"
'1934295051166773321',"The DACA program was created 13 years ago today. It's meant hope and opportunity for many people who came here as children.

Since then, that program has been under attack.

Congress must work together to find a path to citizenship for these young students. Now more than ever.",en,Tweet,15,1147,320,870,54047,2025-06-15 18:00:52,"<a href=""http://twitter.com/download/iphone"" rel=""nofollow"">Twitter for iPhone</a>",,,,
'1933969559830003822',"America is strong not because of our President, but because of our people.

Our flag flies for no dictator. Our nation bows to no king.

Today, of all days, we must remember that.",en,Tweet,84,12851,2384,3388,246812,2025-06-14 20:27:29,"<a href=""https://mobile.twitter.com"" rel=""nofollow"">Twitter Web App</a>",,,,
'1933916462609211867',"I’m praying for Rep. Melissa Hortman’s family, and for Sen. John Hoffman and his wife’s recovery this morning.

The rising tide of political violence in this country tears at all the values we hold dear. 

This is not who we are. This has to end.",en,Tweet,56,5376,797,4902,257638,2025-06-14 16:56:29,"<a href=""http://twitter.com/download/iphone"" rel=""nofollow"">Twitter for iPhone</a>",,,,
'1933653283542909021',"Donald Trump doesn't care about law enforcement.

He cares about power.

It's why he's deploying military personnel to Los Angeles. And it's why he pardoned the violent criminals who attacked Capitol Police on January 6th. https://t.co/VXwz01fShk",en,Tweet,27,2194,595,2071,276746,2025-06-13 23:30:42,"<a href=""http://twitter.com/download/iphone"" rel=""nofollow"">Twitter for iPhone</a>",,,video,https://video.twimg.com/amplify_video/1933653221588795392/vid/avc1/1280x720/pxWrraHSTrpa6u6a.mp4?tag=21
'1933577184553336899',Donald Trump wants you to forget that his first act in office was to pardon hundreds of violent thugs who beat cops. https://t.co/yhTUkAACSX,en,Tweet,56,6266,2029,2120,408051,2025-06-13 18:28:19,"<a href=""https://mobile.twitter.com"" rel=""nofollow"">Twitter Web App</a>",,,photo,https://pbs.twimg.com/media/GtVyGDaW8AAQEHk.jpg
'1933374010403803451',"I am closely watching the situation in the Middle East after Israel launched an attack on Iran’s nuclear and missile programs, and against top officials, including military leaders. 

The Trump administration has said it did not participate in the attack and has moved to protect American forces in the region. Iran would be making a serious mistake to retaliate against U.S. forces or interests. 

Iran is a malicious actor and a state sponsor of terrorism that must never be allowed to possess a nuclear weapon. 

Since the first Trump administration withdrew from the previous nuclear agreement with Iran, it has continued to enrich uranium to higher and higher levels, reducing its breakout time substantially. 

Recently, the Trump administration has attempted to negotiate a new agreement to curtail Iran’s nuclear program that looks a lot like the old agreement.

That possibility is now less probable in the wake of this attack. 

The most immediate risk at the present is that of retaliation, miscalculation, and escalation, which could spiral into a regional conflict or all out war.

After the terrible trauma of the Hamas attacks of October 7th and the war in Gaza that has followed, the last thing the world needs is a wider war. 

My heart goes out to the people of Israel, now facing dangers from every direction. I support Israel’s right to defend itself against any imminent threat, including that emanating from Iran.

It is vital that the Administration now focus on helping Israel defend itself, protect Americans who seek safety, and prevent a broader conflict so that diplomacy can resume.

It is impossible to bring about an end to conflict through endless conflict.",en,Tweet,42,975,161,596,110704,2025-06-13 05:00:59,"<a href=""http://twitter.com/download/iphone"" rel=""nofollow"">Twitter for iPhone</a>",,,,
'1933337101703229789',"The Trump administration has been ordered to return control of the National Guard back to California. 

The correct decision. And a win for the rule of law.",en,Tweet,75,9883,1242,3325,277368,2025-06-13 02:34:19,"<a href=""https://mobile.twitter.com"" rel=""nofollow"">Twitter Web App</a>",,,,
'1933308391306232264',"What we saw today is not America.

This is not who we are. 

We are better than this. https://t.co/58LeJiN9J2",en,Tweet,52,2457,565,2667,113289,2025-06-13 00:40:14,"<a href=""https://mobile.twitter.com"" rel=""nofollow"">Twitter Web App</a>",,,video,https://video.twimg.com/amplify_video/1933307947490127872/vid/avc1/1920x1080/MSd2882puK4brHKO.mp4?tag=21
'1933290692144476509',.@Sec_Noem should resign.,en,Tweet,129,33853,4575,9592,1184657,2025-06-12 23:29:54,"<a href=""https://mobile.twitter.com"" rel=""nofollow"">Twitter Web App</a>",,,,
'1933281323436941406',"Today I watched as my colleague, @SenAlexPadilla, was shoved and handcuffed by Trump officials.

I immediately went to the Senate floor to respond. This is what I said: https://t.co/JEu0hCWuBe",en,Tweet,101,4246,1173,3500,215726,2025-06-12 22:52:40,"<a href=""https://mobile.twitter.com"" rel=""nofollow"">Twitter Web App</a>",,,video,https://video.twimg.com/amplify_video/1933281144968986624/vid/avc1/1920x1080/bEwsbwbP1UsKQKVw.mp4?tag=21
'1933261338320777574',https://t.co/luZY89LOIp,zxx,Tweet,29,614,188,338,34139,2025-06-12 21:33:15,"<a href=""https://studio.twitter.com"" rel=""nofollow"">Twitter Media Studio</a>",,https://x.com/i/broadcasts/1OdKrDRzgdzJX,,
'1933234380572356641',".@SenAlexPadilla represents the best of the Senate. 

The disgraceful and disrespectful conduct of DHS agents, pushing and shoving him out of a briefing like that, demands our condemnation.

He will not be silenced or intimidated. His questions will be answered.

I’m with Alex.",en,Tweet,50,6058,1481,3170,314080,2025-06-12 19:46:08,"<a href=""https://mobile.twitter.com"" rel=""nofollow"">Twitter Web App</a>",,,,
'1933208390525649327',"Under both Republican and Democratic administrations, California was consistently granted waivers under the Clean Air Act to implement stronger standards to help ensure cleaner air for our families. By eliminating the filibuster and passing these polluter resolutions, President Donald Trump, EPA Administrator Zeldin and Republicans in Congress are undermining our state’s ability to protect the health of millions of Americans.  
  
From the party that once claimed the mantle of champion of state’s rights, the GOP is now only the party of polluter rights. This action will have devastating consequences not just on California, but on other states that have adopted the Golden State’s higher standards. This will ultimately result in dirtier air, and more asthma and lung cancer, and that will be their legacy.  
  
I will continue doing everything I can to fight back against the Trump administration’s ongoing attacks on California.",en,Tweet,7,562,162,376,36967,2025-06-12 18:02:52,"<a href=""http://twitter.com/download/iphone"" rel=""nofollow"">Twitter for iPhone</a>",,,,
'1933171312127557744',"The Trump Administration is trying to abolish the Chuckwalla and Sáttítla National Monuments, undermining decades of work by conversationists and tribal leaders, and ignoring a broad community consensus. 

The President cannot rewrite the law to placate special interests or because of petty vindictiveness against a state that did not support him. 

We won't let him.",en,Tweet,8,362,164,211,29056,2025-06-12 15:35:32,"<a href=""https://mobile.twitter.com"" rel=""nofollow"">Twitter Web App</a>",,,photo,https://pbs.twimg.com/media/GtQA8T7W4AAFMfg.jpg
'1932948952602567107',"Donald Trump and one of his closest allies are fighting.

No, it's not Elon Musk. It's someone who played an even more essential role in his efforts to influence the courts. 

Let's talk about Leonard Leo. https://t.co/hy5p37yLu9",en,Tweet,74,1571,585,589,67400,2025-06-12 00:51:57,"<a href=""https://mobile.twitter.com"" rel=""nofollow"">Twitter Web App</a>",,,video,https://video.twimg.com/amplify_video/1932945534915903488/vid/avc1/1920x1080/PjmfMgH1Kzb1tFYj.mp4?tag=21
'1932922410589638975',"The Justice Department has targeted a sitting member of Congress - LaMonica McIver - for doing her job. 

And it’s not a solitary incident.

Filing charges against a labor leader. Threatening to arrest Governor Newsom. 

Trump is using the law as a weapon to target people he disagrees with. We must not let him.",en,Tweet,24,931,324,2318,269431,2025-06-11 23:06:29,"<a href=""https://mobile.twitter.com"" rel=""nofollow"">Twitter Web App</a>",,,,
'1932803998324564093',"California’s farmworkers are the backbone of our economy.

They work through grueling conditions – rain and shine, heat and cold, even a pandemic – to feed the nation.

Targeting these workers is just wrong. And meant to stoke fear, not improve public safety.",en,Tweet,34,1728,545,2118,155747,2025-06-11 15:15:57,"<a href=""https://mobile.twitter.com"" rel=""nofollow"">Twitter Web App</a>",,,,
'1932788738712568241',"Donald, do your damn job.

Focus on violent offenders, and stop abusing the military. https://t.co/5359AVNwLF",en,Tweet,53,3891,728,3092,144775,2025-06-11 14:15:19,"<a href=""https://mobile.twitter.com"" rel=""nofollow"">Twitter Web App</a>",,,video,https://video.twimg.com/amplify_video/1932788526526939136/vid/avc1/1280x720/6b9zZOsfaOBaKYZr.mp4?tag=21
'1932633172443082967',"I just got back from Los Angeles.

Here's what's happening, how Trump is fanning the flames, and where we go from here: https://t.co/80S1JpEtNK",en,Tweet,68,1527,522,1753,78596,2025-06-11 03:57:09,"<a href=""https://mobile.twitter.com"" rel=""nofollow"">Twitter Web App</a>",,,video,https://video.twimg.com/amplify_video/1932631862502924288/vid/avc1/1920x1080/XANcVo2klT0OEA_3.mp4?tag=21
'1932615082019618969',"Donald Trump wants to be a strongman. 

So he’s abusing taxpayer resources to appear that way. And he’s abusing the military. 

Anything but what he was elected to do — make life more affordable for American families. https://t.co/IDWQTkyKb5",en,Tweet,36,2936,758,1620,102726,2025-06-11 02:45:16,"<a href=""https://mobile.twitter.com"" rel=""nofollow"">Twitter Web App</a>",,,video,https://video.twimg.com/amplify_video/1932614988805398528/vid/avc1/1280x720/GTiVvRb5jWB-NdyS.mp4?tag=21
'1932597521236570351',"Monitoring the situation in my hometown of Burbank as a brush fire has led to several evacuations.

As always, make sure to follow any and all evacuation notices from local officials.",en,Tweet,4,424,81,351,41540,2025-06-11 01:35:29,"<a href=""https://mobile.twitter.com"" rel=""nofollow"">Twitter Web App</a>",,,,
'1932545727751684460',"The deployment of Marines to Los Angeles was uncalled for, rushed, and potentially dangerous for everyone involved. We’re demanding answers from @SecHegseth. 

This isn't just a California problem. What Trump does in Los Angeles could become the authoritarian blueprint elsewhere in the country.",en,Tweet,24,1385,470,1241,71367,2025-06-10 22:09:41,"<a href=""http://twitter.com/download/iphone"" rel=""nofollow"">Twitter for iPhone</a>",,,photo,https://pbs.twimg.com/media/GtHIGMlXwAAVGdR.jpg
'1932266131500486713',"Deploying Marines to Los Angeles, when they are not responsible for law enforcement operations and are trained for a completely different mission, would be a gross mistake. And only inflame the situation.

These Marines put their lives on the line to defend our country.

Trump should show them - and the country - more respect than to use them this way.

This has to stop.",en,Tweet,45,4230,945,2543,144687,2025-06-10 03:38:40,"<a href=""http://twitter.com/download/iphone"" rel=""nofollow"">Twitter for iPhone</a>",,,,
'1932211902278451548',"Stop sowing chaos, Mr. President, and do your job. https://t.co/Ms3Lsc3zOe",en,Tweet,363,20102,4616,12349,703999,2025-06-10 00:03:10,"<a href=""https://mobile.twitter.com"" rel=""nofollow"">Twitter Web App</a>",,,video,https://video.twimg.com/amplify_video/1932211830165831680/vid/avc1/720x1280/-nM4czCfGIusTc32.mp4?tag=21
'1932136062173827426',"David Huerta, @seiucalifornia President and a leading voice for California workers and communities, was injured, arrested and detained by federal officials.

@SenSchumer, @SenAlexPadilla, and I are demanding answers from the Trump Administration.",en,Tweet,8,809,253,509,36339,2025-06-09 19:01:49,"<a href=""https://mobile.twitter.com"" rel=""nofollow"">Twitter Web App</a>",,,,
'1931882133573767669',"Los Angeles — violence is never the answer. Assaulting law enforcement is never ok.

Indeed, doing so plays directly into the hands of those who seek to antagonize and weaponize the situation for their own gain. 

Don’t let them succeed.",en,Tweet,80,3352,648,2665,662396,2025-06-09 02:12:47,"<a href=""http://twitter.com/download/iphone"" rel=""nofollow"">Twitter for iPhone</a>",,,,
'1931800074637791737',"Violence against law enforcement is never ok. That’s something we can agree on.

Is that why couldn't you even look Capitol Police officers in the eye and defend your support of the January 6th insurrectionists who beat cops? https://t.co/XU31kQPf5u",en,Tweet,308,11802,2851,1313,946445,2025-06-08 20:46:43,"<a href=""http://twitter.com/download/iphone"" rel=""nofollow"">Twitter for iPhone</a>",,,video,https://video.twimg.com/amplify_video/1931799026208555008/vid/avc1/1920x1080/-9AeGc5jY1Oz-1zR.mp4?tag=21
'1931536364065247309',"The Trump Administration’s calling on the California National Guard without the authorization of the Governor is unprecedented.

This action is designed to inflame tensions, sow chaos, and escalate the situation.

If the Guard is needed to restore peace, the Governor will ask for it. But continuing down this path will erode trust in the National Guard and set a dangerous precedent for unilateral misuse of the Guard across the country. 

Violence must stop, and we need to keep the focus on protecting fundamental rights.

There is nothing President Trump would like more than a violent confrontation with protestors to justify the unjustifiable — invocation of the Insurrection Act or some form of martial law.",en,Tweet,721,23188,6189,9660,1598368,2025-06-08 03:18:50,"<a href=""http://twitter.com/download/iphone"" rel=""nofollow"">Twitter for iPhone</a>",,,,
'1931442213940314416',"When Trump threatens Musk with consequences if he supports Democrats, he is threatening Musk’s government contracts and potentially more. 

There was never a more blatant pay-to-play scheme between a president and a contributor. https://t.co/xHMWeg9ZVm",en,Tweet,134,8351,2389,1139,217756,2025-06-07 21:04:42,"<a href=""https://mobile.twitter.com"" rel=""nofollow"">Twitter Web App</a>",,,photo,https://pbs.twimg.com/media/Gs3cc5tboAARVny.jpg
'1931176882906820609',"I can't believe I'm saying this – but @elonmusk is right.

The ""Big Beautiful Bill"" is filled with all sorts of hidden and dangerous far-right pork.

Today, I want to talk about just some of it. https://t.co/Yx7SNNPWyi",en,Tweet,335,3919,794,1810,694091,2025-06-07 03:30:23,"<a href=""http://twitter.com/download/iphone"" rel=""nofollow"">Twitter for iPhone</a>",,,video,https://video.twimg.com/amplify_video/1931172365897216000/vid/avc1/1920x1080/vF3g1dNX-MYWS_dr.mp4?tag=21
'1931150473530429457',"The Trump administration’s continued targeting of our immigrant communities, its illegal renderings and separation of families is unconscionable. 

Today’s detention of, and injury to, David Huerta, President of @seiuusww, and a U.S. citizen, while acting as a community observer during an immigration raid in LA is another terrible example. 

This is part of a larger campaign of intimidation by the White House. And it must end.",en,Tweet,12,786,200,751,72579,2025-06-07 01:45:26,"<a href=""http://twitter.com/download/iphone"" rel=""nofollow"">Twitter for iPhone</a>",,,,
'1931096135852314809',"Eid Mubarak!

Wishing every Californian observing Eid al-Adha to enjoy a time of faith, peace, and joy.",en,Tweet,2,158,28,127,73752,2025-06-06 22:09:31,"<a href=""https://mobile.twitter.com"" rel=""nofollow"">Twitter Web App</a>",,,,
'1931087446990839970',"California sends more money to the federal government than we get back.

Cutting off federal funding to the fourth largest economy in the world hurts us all — Republicans, Democrats, and Independents. In areas that are rural, urban and suburban. 

I urge this administration to reverse course. If not, we will fight this tooth and nail.",en,Tweet,29,1872,488,1012,143758,2025-06-06 21:34:59,"<a href=""http://twitter.com/download/iphone"" rel=""nofollow"">Twitter for iPhone</a>",,,,
'1931058130462589092',"I went to the Senate Floor to bring up my resolution urging the Pentagon not to rename ships in the John Lewis class, named after American civil rights legends like the USNS Harvey Milk.

Republicans blocked it. 

On the first week of Pride Month no less. https://t.co/MRyPtekFNv",en,Tweet,40,3668,835,3001,238806,2025-06-06 19:38:30,"<a href=""https://mobile.twitter.com"" rel=""nofollow"">Twitter Web App</a>",,,video,https://video.twimg.com/amplify_video/1931057641712660480/vid/avc1/1920x1080/yfk4gRlQH5cShx3z.mp4?tag=21
'1930687282245214353',Going to need a Big Beautiful Bucket of popcorn for this ugly brawl.,en,Tweet,80,6615,772,640,250414,2025-06-05 19:04:53,"<a href=""https://mobile.twitter.com"" rel=""nofollow"">Twitter Web App</a>",,,,
'1930450540854439944',"This is Trump’s reckless first term travel ban all over again. 

Just like before, Trump’s expanded ban on travelers from around the world will not improve our national security and will only further isolate the U.S. from the rest of world. 

Bigotry is not a national security strategy.",en,Tweet,44,3244,889,1819,132804,2025-06-05 03:24:09,"<a href=""http://twitter.com/download/iphone"" rel=""nofollow"">Twitter for iPhone</a>",,,,
'1930391720564302045',"Tulsi Gabbard has been doing an awful job as Director of National Intelligence. 

Her poor judgment and crass partisanship makes all of us less safe.

Today, I want to talk about that. https://t.co/WgFQlkvoda",en,Tweet,192,8764,2351,5076,318125,2025-06-04 23:30:25,"<a href=""https://mobile.twitter.com"" rel=""nofollow"">Twitter Web App</a>",,,video,https://video.twimg.com/amplify_video/1930390876519374849/vid/avc1/1920x1080/mIfX151zWcKxQH21.mp4?tag=21
'1930389552121676037',"In Donald Trump’s corrupt world, there’s no need for high-speed rail when you can accept a $400 million jet from a foreign government.

But for the millions of Californians left to pick up the tab for Trump’s reckless trade wars and rising costs of living, today’s announcement is devastating. 
  
High-speed rail is the future of transportation — with the potential to bring customers to new businesses, businesses to new employees, and to connect communities hundreds of miles away with affordable and faster transit. 

The fact is that the California High-Speed Rail Project is already the most audited public works project in the country.

Rather than advance the progress being made in the Central Valley, Secretary Duffy has used a review process to appease President Trump and punish Californians who didn’t vote for him. 

We’ll keep fighting every partisan, self-defeating policy of this Administration as we build infrastructure fit for the 21st century.",en,Tweet,35,1460,436,2137,102015,2025-06-04 23:21:48,"<a href=""http://twitter.com/download/iphone"" rel=""nofollow"">Twitter for iPhone</a>",,,,
