tweet_id,text,language,type,bookmark_count,favorite_count,retweet_count,reply_count,view_count,created_at,client,hashtags,urls,media_type,media_urls
'1906053689367810174',"Kenneth Chapman recently retired after serving as Woodstock’s town moderator for 50 years.
 
His commitment to safeguarding free and fair elections – the foundation of our democracy – is why I named him March’s Granite Stater of the Month.",en,Tweet,0,7,4,11,1431,2025-03-29 18:39:46,"<a href=""http://twitter.com/download/iphone"" rel=""nofollow"">Twitter for iPhone</a>",,,,
'1905739413533208998',"When unions can engage in collective bargaining, the middle class grows. 

The President could spend his time on efforts to lower costs for families. Instead, he keeps attacking the hard-working federal employees, many of whom are veterans, who provide critical services and keep Americans safe. 

It’s wrong, and it can’t stand.

https://t.co/A8nleQL2Yr",en,Tweet,0,28,8,39,2729,2025-03-28 21:50:57,"<a href=""https://mobile.twitter.com"" rel=""nofollow"">Twitter Web App</a>",,,,
'1905347400333402591',"11 years ago today, I signed a bipartisan expansion of Medicaid into law as Governor of New Hampshire. 

Now, President Trump wants to undo that progress with his plan to gut Medicaid to pay for tax giveaways for billionaires and corporate special interests.",en,Tweet,0,13,8,35,2385,2025-03-27 19:53:14,"<a href=""https://mobile.twitter.com"" rel=""nofollow"">Twitter Web App</a>",,,,
'1905050877360001294',"Without warning, President Trump is cutting off $80 million that NH is using to meet vital public health needs, including funding to combat addiction - a step backward in our fight against fentanyl. That's funding for mental health crisis workers, health workers & other resources for people with addiction. It's absolutely unacceptable.",en,Tweet,0,16,11,28,2169,2025-03-27 00:14:57,"<a href=""http://twitter.com/download/iphone"" rel=""nofollow"">Twitter for iPhone</a>",,,,
'1904896073992151456',"Due to the high volume of calls across Senate offices, our phone systems have been experiencing some technical difficulties. We're working to fix this as quickly as possible because I want to hear from you, especially at this crucial moment for our country. 

As we work with the platform to resolve these issues, please remember that you can also email me 24/7 through my website at https://t.co/C8C1cbuBDJ

I appreciate the thousands of Granite Staters who have been calling and writing in to provide their thoughts and perspectives.",en,Tweet,0,20,4,13,2109,2025-03-26 13:59:49,"<a href=""https://mobile.twitter.com"" rel=""nofollow"">Twitter Web App</a>",,,,
'1904655581748617711',"When extreme weather hit New Hampshire, including severe storms and flooding on the Seacoast last summer, FEMA helped our communities rebuild. 
 
Eliminating FEMA won’t stop natural disasters – it will just make it harder to recover from them. 
 https://t.co/OVp40HqXZQ",en,Tweet,2,22,10,48,2822,2025-03-25 22:04:12,"<a href=""https://mobile.twitter.com"" rel=""nofollow"">Twitter Web App</a>",,https://www.semafor.com/article/03/24/2025/dhs-sec-kristi-noem-says-administration-will-move-to-eliminate-fema,,
'1904585836613546122',"This was stupid, reckless, and jeopardized the lives of American service members – and it should be thoroughly investigated. President Trump's top advisors should not be making war plans on a commercial messaging chat, or on any device that our adversaries can monitor. And it’s one thing to inadvertently include a random contact when you are making dinner plans… quite another when you’re dealing with national security. Do these guys know the difference?",en,Tweet,0,9,3,12,1783,2025-03-25 17:27:03,"<a href=""https://mobile.twitter.com"" rel=""nofollow"">Twitter Web App</a>",,,,
'1904247095034540403',"For 70 years the Hubbard Brook Experimental Forest in Woodstock has collected data that helps foresters, maple producers, and farmers. Hiring freezes and layoffs by the administration are threatening their work and causing more chaos and uncertainty. https://t.co/s2cG4DrHng",en,Tweet,0,10,3,16,1684,2025-03-24 19:01:01,"<a href=""https://mobile.twitter.com"" rel=""nofollow"">Twitter Web App</a>",,,photo,https://pbs.twimg.com/media/Gm0-olxXEAEGnD2.jpg
'1904191567809618369',"President Trump & Elon Musk are threatening to shut down the Social Security office in Littleton, which serves Granite Staters in the North Country. Last week I met with seniors in Littleton who rely on this office to access the benefits they have paid into for their entire lives.",en,Tweet,5,24,10,19,1937,2025-03-24 15:20:22,"<a href=""https://mobile.twitter.com"" rel=""nofollow"">Twitter Web App</a>",,,photo,https://pbs.twimg.com/media/Gm0L_0lXcAAeGql.jpg
'1903557108575961169',Great to visit the Cold Regions Research and Engineering Lab in Hanover this week and get a first-hand look at their innovative cold weather research – work that is under threat because of the chaos and confusion from the Trump Administration. https://t.co/NgOi2cLX3G,en,Tweet,0,9,3,20,1633,2025-03-22 21:19:15,"<a href=""http://twitter.com/download/iphone"" rel=""nofollow"">Twitter for iPhone</a>",,,photo,https://pbs.twimg.com/media/GmrLGM8aMAAyv7Z.jpg
'1903106268551634990',President Trump’s reckless tariffs on Canada are threating innovative New Hampshire businesses like Hypertherm in Lebanon. I visited their facility yesterday and heard about the challenges they are facing as a result of the tariffs. https://t.co/I0LeyTPcyD,en,Tweet,0,9,5,23,1400,2025-03-21 15:27:47,"<a href=""https://mobile.twitter.com"" rel=""nofollow"">Twitter Web App</a>",,,photo,https://pbs.twimg.com/media/GmkxDWRWsAAAHDx.jpg
'1902869759332425740',"The President’s decision today to dismantle the Department of Education will hurt our children and leave them less prepared for the future, just at a time when America should be working across party lines to strengthen our schools, families, and teachers. 
 
All across the Granite State there are vibrant public schools that provide critical public education to students from all walks of life. They do so with the essential help of the federal Department of Education, which provides funding and technical expertise to schools so that they can support children who need extra support in the classroom — children whose families are struggling financially, children who are facing mental health challenges, and children with disabilities. The challenges that these children and their families face won’t go away because President Trump and Elon Musk turn their backs on them. Instead, the decision to shutter the Department of Education will leave some children in our country without the education that they deserve and shift costs to local communities, raising property taxes. 
 
Our education system is challenged, to be sure, but rather than focus on how to help our local school districts provide the best possible education for all of our children, the Administration has run away from the opportunity and obligation to ensure that all American children can receive a quality education to prepare them for adulthood. Once again, Trump and Musk shrink from the responsibilities and promise of our democracy.",en,Tweet,1,43,9,78,4918,2025-03-20 23:47:58,"<a href=""http://twitter.com/download/iphone"" rel=""nofollow"">Twitter for iPhone</a>",,,,
'1902830765924126961',"The Trump Administration has slashed funding that @DartmouthHealth relies on to run cutting-edge clinical trials to find cures for diseases like cancer. This morning I heard directly from doctors, scientists, and researchers about how these cuts threaten their life-saving work. https://t.co/XzvPOcFSbq",en,Tweet,0,16,6,22,1296,2025-03-20 21:13:02,"<a href=""https://mobile.twitter.com"" rel=""nofollow"">Twitter Web App</a>",,,photo,"https://pbs.twimg.com/media/Gmg2fcbaIAAYCjb.jpg,https://pbs.twimg.com/media/Gmg2fb0X0AAa4fa.jpg"
'1902431078666604831',"It was great to join @NECouncil to discuss my priorities in Congress, including my work to lower costs, protect jobs at the Portsmouth Naval Shipyard, and defend Granite Staters’ Social Security and Medicare. https://t.co/gxFrD3ab8G",en,Tweet,0,17,6,17,1514,2025-03-19 18:44:49,"<a href=""https://mobile.twitter.com"" rel=""nofollow"">Twitter Web App</a>",,,photo,https://pbs.twimg.com/media/GmbK9G2aUAAO6W4.jpg
'1902101526270898217',"The US, Australia &amp; the UK are partnering to safeguard our security with submarines, such as the ones that are modernized and repaired here in Portsmouth. Thank you to the representatives from Australia who visited the Portsmouth Naval Shipyard today. https://t.co/aCcAaws3dC",en,Tweet,0,12,5,7,1237,2025-03-18 20:55:17,"<a href=""https://mobile.twitter.com"" rel=""nofollow"">Twitter Web App</a>",,,photo,https://pbs.twimg.com/media/GmWfQSAXsAAltZZ.jpg
'1902082142458245506',"President Trump and Congressional Republicans have proposed a budget that could cut up to one-third of Medicaid’s federal funding to pay for tax cuts for billionaires and corporate special interests. 

That's wrong – and it could cost 60,000 Granite Staters their health care.",en,Tweet,0,16,8,19,1627,2025-03-18 19:38:16,"<a href=""https://mobile.twitter.com"" rel=""nofollow"">Twitter Web App</a>",,,,
'1902065729513648421',"In December, a massive cybersecurity breach put the personal information of thousands of Granite State students and school staff at risk. Families deserve answers about what the company is doing to ensure that a similar incident never occurs again.
https://t.co/iwajUXgUEx",en,Tweet,0,3,3,9,1732,2025-03-18 18:33:03,"<a href=""https://mobile.twitter.com"" rel=""nofollow"">Twitter Web App</a>",,https://www.wmur.com/article/hassan-nh-security-powerschool-breach-31725/64212179,,
'1901723980039356542',"Congratulations &amp; happy retirement to Ray Brewer, whose morning broadcasts have informed Granite State families for almost three decades.

Thank you, Ray. Now you can finally hit that snooze button—you've earned it!",en,Tweet,0,14,2,9,2399,2025-03-17 19:55:03,"<a href=""https://mobile.twitter.com"" rel=""nofollow"">Twitter Web App</a>",,,,
'1900985539739680959',"President Trump wants to fire nearly 1 in 5 VA employees. VA officials refused to guarantee that quality of care and benefits won’t be impacted.
 
Our veterans deserve better. https://t.co/JKJFySZQo6",en,Tweet,0,43,12,40,3524,2025-03-15 19:00:45,"<a href=""http://twitter.com/download/iphone"" rel=""nofollow"">Twitter for iPhone</a>",,,video,https://video.twimg.com/amplify_video/1900985462594195456/vid/avc1/720x900/5dMK9wymC5Let01n.mp4?tag=16
'1900693051988701452',https://t.co/el0hZax0AL,zxx,Tweet,8,68,9,225,34800,2025-03-14 23:38:31,"<a href=""https://mobile.twitter.com"" rel=""nofollow"">Twitter Web App</a>",,,photo,https://pbs.twimg.com/media/GmCX-wmbAAAzly9.jpg
'1899856934787744175',Thank you @SenatorShaheen https://t.co/eQA8KZd5Ym,en,Tweet,8,387,39,184,18856,2025-03-12 16:16:05,"<a href=""https://mobile.twitter.com"" rel=""nofollow"">Twitter Web App</a>",,,photo,https://pbs.twimg.com/media/Gl2ly_MXMAA0zup.jpg
'1899165453966323763',"I introduced a bipartisan bill to create a one-stop scheduling platform to help veterans access the VA care that they’ve earned and deserve.

WATCH ⬇️ https://t.co/FNvO4kJvXN",en,Tweet,0,29,3,50,14016,2025-03-10 18:28:23,"<a href=""https://mobile.twitter.com"" rel=""nofollow"">Twitter Web App</a>",,,video,https://video.twimg.com/ext_tw_video/1899165412522176512/pu/vid/avc1/720x720/A5T_OWxJa0OStxD9.mp4?tag=12
'1898853070362030144',"Firing nearly 1 in 5 VA employees will only make it harder for veterans to get the care and benefits they have earned and deserved. 

Our veterans deserve better.

https://t.co/7wQOFlkVZd",en,Tweet,1,22,8,33,2893,2025-03-09 21:47:05,"<a href=""http://twitter.com/download/iphone"" rel=""nofollow"">Twitter for iPhone</a>",,https://www.usatoday.com/story/news/politics/2025/03/05/va-layoff-federal-employees/81624579007/,,
'1898502054819004761',"As American families struggle with high costs, the budget put forth by Donald Trump and Congressional Republicans could take health care away from up to 25 million Americans.

https://t.co/n368qLuh4g",en,Tweet,2,31,18,56,6461,2025-03-08 22:32:16,"<a href=""http://twitter.com/download/iphone"" rel=""nofollow"">Twitter for iPhone</a>",,https://newhampshirebulletin.com/2025/03/06/repub/state-by-state-report-by-dems-projects-millions-of-people-could-lose-medicaid-coverage/,,
'1898095961756647455',Strengthening security at our Northern border is vital to keeping both NH and our country safe. I introduced bipartisan legislation that will require regular threat analyses and updated strategies from the Department of Homeland Security to help prevent criminal activity. https://t.co/k7KmdOeyqo,en,Tweet,1,14,3,28,2451,2025-03-07 19:38:36,"<a href=""https://mobile.twitter.com"" rel=""nofollow"">Twitter Web App</a>",,,video,https://video.twimg.com/ext_tw_video/1898095841329467392/pu/vid/avc1/720x720/JgSiLy_Luiwh78Rp.mp4?tag=12
'1897731974610981281',"Who will pay for President Trump's tariffs on Canadian energy? Granite Staters, at the gas pump:

Read more via @semafor: https://t.co/wMsIodp7vx https://t.co/P9Lwz6i2TH",en,Tweet,1,13,11,44,3575,2025-03-06 19:32:15,"<a href=""https://mobile.twitter.com"" rel=""nofollow"">Twitter Web App</a>",,https://www.semafor.com/newsletter/03/05/2025/semafor-principals-just-getting-started?utm_source=newslettershare&utm_medium=principals&utm_campaign=flagshipnumbered6#,photo,https://pbs.twimg.com/media/GlYZGtPXwAAutFr.png
'1897333893839405210',"Saddened to hear of the passing of Concord fire fighter CJ Girard, a hero who dedicated his life to keeping Granite Staters safe. 
 
Tom and I send our deepest condolences to his family and fellow first responders during this difficult time.",en,Tweet,1,22,3,20,2603,2025-03-05 17:10:25,"<a href=""https://mobile.twitter.com"" rel=""nofollow"">Twitter Web App</a>",,,,
'1897278111886262562',"Make no mistake: Trump’s tariffs on Canada will drive up energy prices, and those higher costs will be passed directly to YOU.

WATCH ⬇️ https://t.co/qhVtBFL1Nr",en,Tweet,1,19,6,62,6308,2025-03-05 13:28:46,"<a href=""https://mobile.twitter.com"" rel=""nofollow"">Twitter Web App</a>",,,video,https://video.twimg.com/ext_tw_video/1897277953152540672/pu/vid/avc1/720x720/TFzjlcCQHq5Q5rYc.mp4?tag=12
'1897093188281946151',"Medicaid helped Cheri Bryer get addiction treatment and go back to work. The Republican budget proposal would make major cuts to Medicaid, putting at risk the care that helped Cheri enter into recovery.
 
Cheri, thank you for joining me for tonight. https://t.co/PFM1uFtV5g",en,Tweet,0,81,24,61,8577,2025-03-05 01:13:57,"<a href=""https://mobile.twitter.com"" rel=""nofollow"">Twitter Web App</a>",,,photo,https://pbs.twimg.com/media/GlPUL5MXgAAv50j.jpg
'1896988639596568612',"Students can’t focus on learning when they are hungry.

I visited Hampstead Middle School yesterday to mark the start of National School Breakfast Week and stand against the proposed Republican budget that could severely cut school breakfast and lunch programs. https://t.co/XdzyJiOZln",en,Tweet,2,28,4,50,2435,2025-03-04 18:18:30,"<a href=""https://mobile.twitter.com"" rel=""nofollow"">Twitter Web App</a>",,,photo,https://pbs.twimg.com/media/GlN1GK_XgAApjUz.jpg
'1896704395158695972',"I’m a NO on Linda McMahon’s nomination to serve as Secretary of Education.
 
It's simple: a vote for McMahon is a vote to completely shut down the Department of Education and its work to support children.",en,Tweet,1,166,25,126,12739,2025-03-03 23:29:01,"<a href=""http://twitter.com/download/iphone"" rel=""nofollow"">Twitter for iPhone</a>",,,,
'1896697324975604100',"This latest gift to Putin makes America less secure, and allows Russian cyber criminals to continue to target Granite Staters with no repercussions. Appeasement never works.

https://t.co/W5lPDOEXDo",en,Tweet,0,9,6,27,1779,2025-03-03 23:00:55,"<a href=""http://twitter.com/download/iphone"" rel=""nofollow"">Twitter for iPhone</a>",,https://www.nytimes.com/2025/03/02/us/politics/hegseth-cyber-russia-trump-putin.html,,
'1896612454412767545',Every month I recognize a Granite Stater who is going above and beyond for their community. This weekend I was glad to have the chance to gather Granite Staters of the Month from 2024 to celebrate their achievements. https://t.co/sMf74iEO5E,en,Tweet,1,21,4,25,2585,2025-03-03 17:23:41,"<a href=""https://mobile.twitter.com"" rel=""nofollow"">Twitter Web App</a>",,,photo,https://pbs.twimg.com/media/GlIe9AYXoAABCjA.jpg
'1895930218847871134',"The President has betrayed America’s friends. He voted with Putin and Kim Jong Un at the UN. He called for surrender to Russia in the Oval Office.

In our history, we call such people appeasers and communist sympathizers. We don’t call them leader of the free world.",en,Tweet,3,110,33,159,9804,2025-03-01 20:12:43,"<a href=""http://twitter.com/download/iphone"" rel=""nofollow"">Twitter for iPhone</a>",,,,
'1895862730755854799',"A child dying of measles isn’t just unusual – it hasn’t happened in the U.S. for over two decades. Secretary Kennedy’s attempt to downplay this preventable death is reckless and dangerous.

https://t.co/osenb61Zro",en,Tweet,1,14,6,41,1529,2025-03-01 15:44:33,"<a href=""http://twitter.com/download/iphone"" rel=""nofollow"">Twitter for iPhone</a>",,https://www.nbcnews.com/health/health-news/person-dies-measles-west-texas-outbreak-rcna193812,,
'1895589886062968949',Russia is celebrating President Trump's comments to President Zelenskyy. That tells you all you need to know. https://t.co/J1ivgvmboo,en,Tweet,8,283,87,143,14919,2025-02-28 21:40:21,"<a href=""https://mobile.twitter.com"" rel=""nofollow"">Twitter Web App</a>",,,photo,https://pbs.twimg.com/media/Gk587rFXcAAPJEG.jpg
'1895582533641003436',"Today is Rare Disease Day, a day to recognize the millions living with rare diseases and the work that still needs to be done to ensure equitable access to treatment.",en,Tweet,0,13,2,18,1790,2025-02-28 21:11:08,"<a href=""https://mobile.twitter.com"" rel=""nofollow"">Twitter Web App</a>",,,,
'1895558353692344379',"After voting with Putin at the United Nations, President Trump and VP Vance are now speaking for Putin in the Oval Office. President Trump's refusal to stand with Ukraine and our allies over Russia puts U.S. national security at risk.",en,Tweet,2,104,34,125,7301,2025-02-28 19:35:03,"<a href=""http://twitter.com/download/iphone"" rel=""nofollow"">Twitter for iPhone</a>",,,,
'1894862178148036611',"Great to meet with NH @DAVHQ members yesterday and discuss our shared goal of supporting those who have kept our nation safe, secure, and free. https://t.co/cpWWXvnMuL",en,Tweet,1,12,1,14,1490,2025-02-26 21:28:42,"<a href=""https://mobile.twitter.com"" rel=""nofollow"">Twitter Web App</a>",,,photo,https://pbs.twimg.com/media/GkvnFlxWgAAnpAi.jpg
'1894836551462359533',"Good news: Granite State first responders, teachers, and others who are eligible for increased benefits through the Social Security Fairness Act will begin receiving benefits sooner than planned.",en,Tweet,1,18,4,9,2699,2025-02-26 19:46:52,"<a href=""https://mobile.twitter.com"" rel=""nofollow"">Twitter Web App</a>",,,,
'1894492282973258194',"Elon Musk is a textbook playground bully — pushing other people down just to feel important. 
https://t.co/DMIlJq9t0A",en,Tweet,0,9,2,30,1064,2025-02-25 20:58:52,"<a href=""https://mobile.twitter.com"" rel=""nofollow"">Twitter Web App</a>",,https://www.usatoday.com/story/life/health-wellness/2025/02/25/elon-musk-donald-trump-disabled-people/80112602007/,,
'1894432462677090761',"Freezing hiring at the Portsmouth Naval Shipyard puts our national security, Granite Staters, and Americans at risk. The Trump Administration should resume recruitment and hiring immediately. 
https://t.co/cAEucKfaGb",en,Tweet,1,25,17,20,4286,2025-02-25 17:01:10,"<a href=""https://mobile.twitter.com"" rel=""nofollow"">Twitter Web App</a>",,https://www.wmtw.com/article/portsmouth-naval-shipyard-hiring-freeze-kittery-maine/63904932,,
'1894143195644113281',"Over 180,000 Granite Staters, including nearly 90,000 kids, rely on Medicaid. Republicans want to end Medicaid as we know it to pay for more tax breaks for corporate special interests and billionaires. Today I heard about how these proposed changes would harm our communities. https://t.co/vjl243l8j1",en,Tweet,4,50,22,92,6866,2025-02-24 21:51:43,"<a href=""https://mobile.twitter.com"" rel=""nofollow"">Twitter Web App</a>",,,photo,https://pbs.twimg.com/media/GklZLtaXgAA9irk.jpg
'1894113619991724494',"President Trump’s decision to side with Russia – on the anniversary of Putin’s unconscionable invasion of Ukraine – weakens America, emboldens tyrants, and betrays our values.

New Hampshire's motto is Live Free or Die because we know that tyrants can't be appeased, they must be confronted and held accountable.",en,Tweet,1,30,18,24,6514,2025-02-24 19:54:12,"<a href=""https://mobile.twitter.com"" rel=""nofollow"">Twitter Web App</a>",,,,
'1893747889123258587',"February is Black History Month, an opportunity to celebrate the invaluable, and too-often unrecognized, contributions of Black Granite Staters and Americans to our history.",en,Tweet,0,28,7,16,2581,2025-02-23 19:40:55,"<a href=""http://twitter.com/download/iphone"" rel=""nofollow"">Twitter for iPhone</a>",,,,
'1893377742814458272',"At a time when American families are struggling to keep up with high costs, I can imagine few ideas more ill-advised, more counterproductive, more outrageous, and more devastating than to make lifesaving care unaffordable for millions of our fellow Americans. https://t.co/qlql3NmQ4G",en,Tweet,0,40,15,45,3186,2025-02-22 19:10:05,"<a href=""http://twitter.com/download/iphone"" rel=""nofollow"">Twitter for iPhone</a>",,,video,https://video.twimg.com/amplify_video/1893375985237553152/vid/avc1/720x1280/VpiViQegK5JC6iDw.mp4?tag=16
'1893043835480969652',"The Postal Service is a lifeline for the Granite Staters who rely on it for essential goods like medication and business supplies. 

The President should keep his hands off the Post Office.",en,Tweet,0,17,4,16,5785,2025-02-21 21:03:16,"<a href=""https://mobile.twitter.com"" rel=""nofollow"">Twitter Web App</a>",,,,
'1892811769946522027',I'm fighting against Republican efforts to rip away benefits from hardworking Americans to give more tax cuts to billionaires. https://t.co/FyA3YBn21F,en,Tweet,6,151,54,120,8053,2025-02-21 05:41:07,"<a href=""https://mobile.twitter.com"" rel=""nofollow"">Twitter Web App</a>",,,video,https://video.twimg.com/ext_tw_video/1892811703571640320/pu/vid/avc1/720x1280/lUBi6PEdrybcnupH.mp4?tag=12
'1892800658215936102',"I just voted in support of an amendment to ensure that funding for maternal health is included in the federal budget. Republicans voted it down. 

All women deserve to have access to the best health care possible, no matter their zip code.",en,Tweet,0,105,36,48,4875,2025-02-21 04:56:58,"<a href=""https://mobile.twitter.com"" rel=""nofollow"">Twitter Web App</a>",,,,
'1892771679639622083',"Republicans are dead-set on gutting Americans' health care so that they can give billionaires a tax cut.

 https://t.co/mJi3s74c7T",en,Tweet,8,151,62,76,10538,2025-02-21 03:01:49,"<a href=""http://twitter.com/download/iphone"" rel=""nofollow"">Twitter for iPhone</a>",,,video,https://video.twimg.com/ext_tw_video/1892765405078323200/pu/vid/avc1/720x1280/IzV8Cqz_F8i7S4nq.mp4?tag=12
'1892749832155967517',Republicans just blocked an amendment to stop billionaire tax breaks. How does this lower costs for working families?,en,Tweet,0,84,27,36,4885,2025-02-21 01:35:00,"<a href=""http://twitter.com/download/iphone"" rel=""nofollow"">Twitter for iPhone</a>",,,,
'1892698986563223671',"I voted NO on Kash Patel's nomination to lead the FBI.

He is focused on political revenge, not public safety. He is not qualified to lead one of America’s most important law enforcement agencies.",en,Tweet,2,102,13,81,4025,2025-02-20 22:12:57,"<a href=""https://mobile.twitter.com"" rel=""nofollow"">Twitter Web App</a>",,,,
'1892670651309183328',The American people deserve to know why Republicans in Congress want to cut Medicaid and sacrifice support for a child with asthma to pay for another tax break for multi-billionaires. https://t.co/tX7dJiNhm2,en,Tweet,6,264,104,74,12842,2025-02-20 20:20:22,"<a href=""https://mobile.twitter.com"" rel=""nofollow"">Twitter Web App</a>",,,video,https://video.twimg.com/ext_tw_video/1892670034155081729/pu/vid/avc1/1280x720/I-k92gbkBALA4nDm.mp4?tag=12
'1892638708983050397',"Cryptocurrency scams are on the rise in New Hampshire and it’s important to stay vigilant.

If you get a suspicious call or text, call your local police department before transferring funds or sharing any personal info. https://t.co/3SwblWhMFF",en,Tweet,0,5,6,9,1159,2025-02-20 18:13:26,"<a href=""https://mobile.twitter.com"" rel=""nofollow"">Twitter Web App</a>",,,video,https://video.twimg.com/ext_tw_video/1892638661092478976/pu/vid/avc1/1280x720/HDS-lSV6DIsHTFfG.mp4?tag=12
'1892338887587987527',"The President’s eagerness to surrender to Putin’s demands will embolden our enemies, threaten our allies, and put America's national security at risk.
https://t.co/GWfvuKewvD",en,Tweet,0,23,9,31,1148,2025-02-19 22:22:03,"<a href=""https://mobile.twitter.com"" rel=""nofollow"">Twitter Web App</a>",,https://www.nbcnews.com/news/amp/rcna192710,,
