tweet_id,text,language,type,bookmark_count,favorite_count,retweet_count,reply_count,view_count,created_at,client,hashtags,urls,media_type,media_urls
'1881381989338788251',Today begins a new era of American prosperity and security with President Trump in the White House.,en,Tweet,0,11,0,1,609,2025-01-20 16:43:15,"<a href=""http://twitter.com/download/iphone"" rel=""nofollow"">Twitter for iPhone</a>",,,,
'1880678904056381497',"@RepRWilliams I’m very sorry to hear this. Erika and I are praying for you. May God give you strength and comfort, my friend.",en,Reply,0,7,0,0,433,2025-01-18 18:09:26,"<a href=""http://twitter.com/download/iphone"" rel=""nofollow"">Twitter for iPhone</a>",,,,
'1879664187745661381',I'm honored to continue to serve as Chairman of the Military Construction and Veterans Affairs Subcommittee on Appropriations and sit on the Defense and CJS Subcommittees. I look forward to working with returning and new members to take care of America's heroes! https://t.co/itE2vdUyvh,en,Tweet,0,10,1,1,1152,2025-01-15 22:57:19,"<a href=""https://mobile.twitter.com"" rel=""nofollow"">Twitter Web App</a>",,,photo,https://pbs.twimg.com/media/GhXneJfWMAAOyqX.jpg
'1877768442477990390',"Congratulations to TX-31 Congressional App Challenge winner, Alisa Salikhov, from East View High School! Alisa’s GoodKarma App aims to combat food waste by connecting food donors with recipients in need.

To view Alisa’s app presentation: https://t.co/Jj9paPb8xG https://t.co/O8vysVlFMQ",en,Tweet,0,7,0,1,605,2025-01-10 17:24:18,"<a href=""http://twitter.com/download/iphone"" rel=""nofollow"">Twitter for iPhone</a>",,https://www.youtube.com/watch?v=8I4m21pcyNI,photo,https://pbs.twimg.com/media/Gg8sceXW8AE7Rki.jpg
'1876713692684816633',"Laken Riley's death should've never happened. Today, with my support, the House passed the Laken Riley Act to ensure that aliens who commit a crime are deported.
Sadly, 159 Democrats voted against protecting Americans.",en,Tweet,0,23,3,3,780,2025-01-07 19:33:06,"<a href=""https://mobile.twitter.com"" rel=""nofollow"">Twitter Web App</a>",,,,
'1875331614093537377',It was great to have some of my grandkids up to DC for the opening day of the 119th Congress. https://t.co/9umJXbWYqx,en,Tweet,0,13,0,2,800,2025-01-04 00:01:13,"<a href=""http://twitter.com/download/iphone"" rel=""nofollow"">Twitter for iPhone</a>",,,photo,https://pbs.twimg.com/media/GgaEKadW4AAUTGe.jpg
'1875270110908445079',Congratulations to @SpeakerJohnson. It's time to get to work on the America First Agenda!,en,Tweet,0,19,3,7,1706,2025-01-03 19:56:49,"<a href=""https://mobile.twitter.com"" rel=""nofollow"">Twitter Web App</a>",,,,
'1874532370361335969',"My heart goes out to the victims and their families of this despicable act. What a horrible attack at a time when people are joining together to celebrate the new year.

We need to know everything we possibly can about this terrorist.",en,Tweet,0,8,0,3,1144,2025-01-01 19:05:18,"<a href=""http://twitter.com/download/iphone"" rel=""nofollow"">Twitter for iPhone</a>",,,,
'1870250428257927274',Proud to support the Trump-backed American Relief Act to chart a fiscally responsible path forward and provide much-needed relief to hurricane victims. Looking forward to a united government to get President Trump’s America First agenda done for the people in 2025.,en,Tweet,0,28,8,11,3276,2024-12-20 23:30:24,"<a href=""http://twitter.com/download/iphone"" rel=""nofollow"">Twitter for iPhone</a>",,,,
'1866871311789924387',.@RepChipRoy will build the conservative coalition in the House needed to support President Trump’s priorities as Rule Committee chairman. His proven ability to stand firm for the American people's priorities will strengthen our conference &amp; advance a bold conservative agenda.,en,Tweet,9,561,124,67,376141,2024-12-11 15:43:00,"<a href=""https://mobile.twitter.com"" rel=""nofollow"">Twitter Web App</a>",,,,
'1866245793549807747',"I am sending my deepest condolences to @michaelcburgess and his family. Erika and I are praying for you, my friend.",en,Tweet,0,16,4,2,1930,2024-12-09 22:17:25,"<a href=""https://mobile.twitter.com"" rel=""nofollow"">Twitter Web App</a>",,,,
'1864745215254302762',"I had the privilege of calling over a dozen outstanding young men &amp; women to let them know that they have earned a nomination from me to a U.S. service academy.

I wish them the best of luck as they take the next step toward earning an appointment to the academy of their choice. https://t.co/Bc8Yb1JEu0",en,Tweet,0,8,1,1,691,2024-12-05 18:54:39,"<a href=""https://mobile.twitter.com"" rel=""nofollow"">Twitter Web App</a>",,,photo,https://pbs.twimg.com/media/GeDn2NrWEAAYIJQ.jpg
'1861832966449602905',"I stopped by @Firefly_Space to see the Blue Ghost lunar lander before it departs for launch out of Cape Canaveral to land on the moon. 

I’m so incredibly proud to have these brilliant innovators in #tx31 https://t.co/fA7JV9Fn64",en,Tweet,1,28,4,3,11783,2024-11-27 18:02:25,"<a href=""http://twitter.com/download/iphone"" rel=""nofollow"">Twitter for iPhone</a>",#tx31,,photo,https://pbs.twimg.com/media/GdaPNuuXEAAewE1.jpg
'1859358953626304668',"I pray that Laken Riley's family can find some sense of peace knowing that justice has been served. Their lives are forever changed, and it's devastating that it never should've happened.",en,Tweet,0,10,0,2,1040,2024-11-20 22:11:34,"<a href=""https://mobile.twitter.com"" rel=""nofollow"">Twitter Web App</a>",,,,
'1859255396168319023',"This morning, I'm holding a hearing to discuss the VA shortfall. VA's inability to accurately forecast is not acceptable. https://t.co/mW1wOOXKHE",en,Tweet,1,10,3,4,760,2024-11-20 15:20:04,"<a href=""https://mobile.twitter.com"" rel=""nofollow"">Twitter Web App</a>",,https://www.youtube.com/live/srBje4u7qFM?si=fxsWbQbOCgOsFpbx,,
'1857487728440442951',"Congratulations to these incredible patriots! 

U.S. Congressman John Carter hosts 2024 Congressional Veteran Commendation Ceremony at Temple College | Military | https://t.co/wEmKDkLdjQ",en,Reply,0,2,0,2,420,2024-11-15 18:15:59,"<a href=""https://mobile.twitter.com"" rel=""nofollow"">Twitter Web App</a>",,http://kdhnews.com,,
'1857487725563359401',"This year's honorees cont'd:
- Commander Jon Lux, US Navy (ret.)
- Lt. Col. Barbara MacMillan, US Army (ret.)
- Colonel Garry Patterson, US Army (ret.)
- Lt. Col. Spencer Smith, US Marine Corps (ret.)
- CSM Angela Wilson, US Army (retired)
- Colonel Terry Wilson, US Army (ret.)",en,Reply,0,1,0,2,490,2024-11-15 18:15:58,"<a href=""https://mobile.twitter.com"" rel=""nofollow"">Twitter Web App</a>",,,,
'1857487721486287169',"This year's honorees were:
- Master Sergeant Duane C. Bygum Jr., US Air Force
- Lieutenant Colonel Jeffrey Davison, US Air Force (ret.)
- CID Lieutenant Brian M. Frick, US Navy
- Captain Gary L. Gosney, US Army (ret.)
- Major General Patrick Hamilton, US Army (ret.)",en,Reply,0,0,0,1,51,2024-11-15 18:15:57,"<a href=""https://mobile.twitter.com"" rel=""nofollow"">Twitter Web App</a>",,,,
'1857487718789345600',I hosted my annual Congressional Veteran Commendation ceremony to honor the heroes who served our nation and continue to serve our communities.,en,Tweet,0,3,2,4,705,2024-11-15 18:15:57,"<a href=""https://mobile.twitter.com"" rel=""nofollow"">Twitter Web App</a>",,,,
'1857116712988184773',Congratulations to @TulsiGabbard!,en,Tweet,0,10,2,5,934,2024-11-14 17:41:42,"<a href=""https://mobile.twitter.com"" rel=""nofollow"">Twitter Web App</a>",,,,
'1857111064946827744',"The American people have spoken. Republicans are committed to securing our borders, strengthening our national defense, being energy independent, and restoring the rule of law.",en,Tweet,0,14,3,2,640,2024-11-14 17:19:15,"<a href=""https://mobile.twitter.com"" rel=""nofollow"">Twitter Web App</a>",,,,
'1855994096411652317',"Today, we celebrate our veterans' courage, sacrifice, and dedication. You’ve defended our nation and upheld the values we hold dear, and for that, we are deeply grateful. https://t.co/4IaW56bU68",en,Tweet,0,8,3,4,474,2024-11-11 15:20:49,"<a href=""https://mobile.twitter.com"" rel=""nofollow"">Twitter Web App</a>",,,photo,https://pbs.twimg.com/media/GcHQwxLWYAAyFgI.jpg
'1849109774996037837',I will continue to work hard to ensure that businesses in our community and across the country have the tools they need to thrive.,en,Reply,0,8,1,3,398,2024-10-23 16:24:59,"<a href=""https://mobile.twitter.com"" rel=""nofollow"">Twitter Web App</a>",,,,
'1849109771187626437',"I'm honored to receive the Advocate for Business award from the @USChamber for championing bipartisan, pro-growth, and pro-business policies. Supporting our local businesses means supporting American jobs, fostering innovation, and strengthening our economy. https://t.co/pHQAvDM6Kf",en,Tweet,0,10,2,6,593,2024-10-23 16:24:58,"<a href=""https://mobile.twitter.com"" rel=""nofollow"">Twitter Web App</a>",,,photo,https://pbs.twimg.com/media/GalbR_EWoAA2cfD.jpg
'1844765064856735901',"GAF Energy manufactures solar roof shingles right here in #TX31. 

I attended their groundbreaking in 2022, &amp; just 2 yrs later, this innovative company is off and running, creating jobs and supporting America’s all-of-the-above energy policy. I’m proud they’re calling TX-31 home! https://t.co/F9xtuXcd0P",en,Tweet,0,11,3,6,1262,2024-10-11 16:40:40,"<a href=""http://twitter.com/download/iphone"" rel=""nofollow"">Twitter for iPhone</a>",#TX31,,photo,"https://pbs.twimg.com/media/GZnsC4JWIAwgWby.jpg,https://pbs.twimg.com/media/GZnsC4KWUAgqKAP.jpg"
'1844433153827725636',A very basic requirement in election security is to ensure that only eligible American citizens are voting in America's elections. The Biden-Harris administration's refusal to provide this data to Texas is unacceptable.,en,Tweet,0,10,6,1,698,2024-10-10 18:41:46,"<a href=""https://mobile.twitter.com"" rel=""nofollow"">Twitter Web App</a>",,,,
'1843407360196329484',"(2/2) Today, we reflect on the innocent lives lost &amp; the hostages that remain in Gaza, including four Americans. We must stand firm in our resolve with our greatest ally in the Middle East to root out terrorist regimes while praying for security and peace in Israel.",en,Reply,0,7,1,1,399,2024-10-07 22:45:38,"<a href=""https://mobile.twitter.com"" rel=""nofollow"">Twitter Web App</a>",,,,
'1843407357201776922',"(1/2)On October 7, 2023, Hamas brutally attacked, raped, and murdered innocent Israelis. One year later, Israel continues to fight for their survival against violent terrorists hellbent on their destruction.",en,Tweet,0,15,2,4,887,2024-10-07 22:45:37,"<a href=""https://mobile.twitter.com"" rel=""nofollow"">Twitter Web App</a>",,,,
'1841234167352475969',Israel is America's greatest ally in the Middle East. America must stand strong with Israel.,en,Tweet,0,27,4,26,9370,2024-10-01 22:50:08,"<a href=""https://mobile.twitter.com"" rel=""nofollow"">Twitter Web App</a>",,,,
'1841185221326356847',Pray for Israel,en,Tweet,1,63,5,27,6637,2024-10-01 19:35:38,"<a href=""https://mobile.twitter.com"" rel=""nofollow"">Twitter Web App</a>",,,,
'1840529233245872376',"Today is Gold Star Mother’s and Family’s Day, a time to honor the families and loved ones of fallen military service members. We stand in solidarity with Gold Star mothers and families as we pay respect to those who gave their lives in selfless service to our country. https://t.co/WBQJtBmy5y",en,Tweet,0,8,3,3,758,2024-09-30 00:08:59,"<a href=""https://mobile.twitter.com"" rel=""nofollow"">Twitter Web App</a>",,,photo,https://pbs.twimg.com/media/GYrfYAfWkAA5X-6.jpg
'1839105928127287546',It was my pleasure to welcome former First Lady of Texas Anita Perry and Baylor Scott &amp; White leadership to Washington to discuss health care issues that impact Texans. https://t.co/heQGWTFTc8,en,Tweet,0,6,1,4,670,2024-09-26 01:53:16,"<a href=""http://twitter.com/download/iphone"" rel=""nofollow"">Twitter for iPhone</a>",,,photo,https://pbs.twimg.com/media/GYXRF7XXAAAgrDo.jpg
