tweet_id,text,language,type,bookmark_count,favorite_count,retweet_count,reply_count,view_count,created_at,client,hashtags,urls,media_type,media_urls
'1932557126825615576',"Proud to vote YES on H.R. 884! ✅ 

Only AMERICANS should be allowed to vote in AMERICAN elections. https://t.co/16hbtHfcnf",en,Tweet,3,203,24,15,11366,2025-06-10 22:54:58,"<a href=""http://twitter.com/download/iphone"" rel=""nofollow"">Twitter for iPhone</a>",,,photo,https://pbs.twimg.com/media/GtHSdwzWMAAJpKg.jpg
'1932514777148121557',"I just sent a letter to SEC Chair Atkins requesting documents on the SEC’s inconsistent treatment of ETH under Chair Gensler and the Biden administration. The American people—and the crypto community—deserve transparency as Congress moves forward with the CLARITY Act. 

🔗: https://t.co/N3sokr2Szk",en,Tweet,103,1841,356,179,139359,2025-06-10 20:06:41,"<a href=""http://twitter.com/download/iphone"" rel=""nofollow"">Twitter for iPhone</a>",,,photo,"https://pbs.twimg.com/media/GtGr8pZW4AA8bZJ.jpg,https://pbs.twimg.com/media/GtGr8pXWYAApZ1Q.jpg,https://pbs.twimg.com/media/GtGr8pZXYAEahr_.jpg"
'1932164707080970751',"⏰ REMINDER: The U.S. Small Business Administration is reminding eligible private nonprofit (PNP) organizations in South Carolina of the July 7 deadline to apply for low interest federal disaster loans to offset economic losses caused by Hurricane Helene.

https://t.co/YJPtrZvyD7",en,Tweet,0,3,0,3,627,2025-06-09 20:55:38,"<a href=""https://mobile.twitter.com"" rel=""nofollow"">Twitter Web App</a>",,http://sba.gov/disaster,,
'1932066391127118146',@TracySabolDC @NEWSMAX Anytime!,en,Reply,0,1,0,0,22,2025-06-09 14:24:58,"<a href=""https://mobile.twitter.com"" rel=""nofollow"">Twitter Web App</a>",,,,
'1931147513341649137',"It was great to join @TracySabolDC on @NEWSMAX today to discuss the One Big Beautiful Bill, Biden’s use of Autopen, and the May jobs report! 

Take a look! 🇺🇸 https://t.co/06dqEGbEVI",en,Tweet,0,22,3,8,1122,2025-06-07 01:33:40,"<a href=""http://twitter.com/download/iphone"" rel=""nofollow"">Twitter for iPhone</a>",,,video,https://video.twimg.com/amplify_video/1931147412271169536/vid/avc1/568x320/YJsXN157LIor29A3.mp4?tag=21
'1931142993492205638',"We had a productive week! 🇺🇸 

📍 1.) @dogecommittee Hearing: “Public Funds, Private Agendas: NGOs Gone Wild” 
📍 2.) As Chairman of Military and Foreign Affairs, I announced the subcommittee hearing on “Clearing the Path: Reforming Procurement to Accelerate Defense Innovation” on June 11th at 10 ET. @gopoversight 
📍 3.) @financialcmte Hearing: “Frameworks for the Future: Reviewing Data Privacy in Today’s Financial System”
📍 4.) @housegop continues to deliver for the American people.
📍 5.) Enjoyed meeting with South Carolina Realtors at their D.C. reception!",en,Tweet,1,17,3,5,957,2025-06-07 01:15:43,"<a href=""http://twitter.com/download/iphone"" rel=""nofollow"">Twitter for iPhone</a>",,,photo,"https://pbs.twimg.com/media/GszMUW7WEAAGZSo.jpg,https://pbs.twimg.com/media/GszMUW7XYAAxlza.jpg,https://pbs.twimg.com/media/GszMUW6WkAASZoY.jpg,https://pbs.twimg.com/media/GszMUW7W8AATQi_.jpg"
'1931097641653248383',"Today, we honor the heroes of D-Day. On June 6, 1944, American soldiers and our Allies stormed the beaches of Normandy to defend freedom and liberate Europe. We will never forget their courage and sacrifice. 🇺🇸 https://t.co/3l3LGPkARr",en,Tweet,1,20,1,6,834,2025-06-06 22:15:30,"<a href=""http://twitter.com/download/iphone"" rel=""nofollow"">Twitter for iPhone</a>",,,photo,https://pbs.twimg.com/media/GsyjEi8XcAAx0eu.jpg
'1930996328101785686',Full press release: https://t.co/jKvlmocLTL,en,Reply,0,3,0,0,429,2025-06-06 15:32:55,"<a href=""http://twitter.com/download/iphone"" rel=""nofollow"">Twitter for iPhone</a>",,https://timmons.house.gov/news/documentsingle.aspx?DocumentID=201,,
'1930996324356305203',"As chairman of Military and Foreign Affairs, I am proud to announce the subcommittee hearing on “Clearing the Path: Reforming Procurement to Accelerate Defense Innovation” on June 11th at 10 ET.

This hearing will explore ways Congress can modernize government procurement and acquisition processes to foster innovation, strengthen national security, and restore government transparency to the American people.",en,Tweet,0,10,0,5,633,2025-06-06 15:32:54,"<a href=""http://twitter.com/download/iphone"" rel=""nofollow"">Twitter for iPhone</a>",,,photo,https://pbs.twimg.com/media/GsxG7FgXQAAgUdq.jpg
'1930733248843264243',"📢 ICYMI: My remarks from today’s @GOPoversight hearing on AI in government.

Our government is sitting on a goldmine of AI potential to track and eliminate waste, fraud, and abuse. By confirming eligibility more efficiently, we can save up to $150 billion in Medicaid alone. https://t.co/tFwj2ePhLR",en,Tweet,0,11,3,4,865,2025-06-05 22:07:32,"<a href=""https://studio.twitter.com"" rel=""nofollow"">Twitter Media Studio</a>",,,video,https://video.twimg.com/amplify_video/1930732174598176768/vid/avc1/1280x720/wJn5xwBrYgTnAxeh.mp4?tag=16
'1930684956004544745',We MUST secure the border. This should not be a partisan issue.,en,Tweet,1,22,2,6,1291,2025-06-05 18:55:38,"<a href=""https://mobile.twitter.com"" rel=""nofollow"">Twitter Web App</a>",,,,
'1930390784152367543',"🗣️: The Biden administration's decision to hand $27 billion to undeserving NGOs is a monumental lack-of-oversight. 

Taxpayers should not be forced to bankroll these corrupt entities! https://t.co/l5my6wDtMu",en,Tweet,13,1366,335,40,7618,2025-06-04 23:26:42,"<a href=""https://mobile.twitter.com"" rel=""nofollow"">Twitter Web App</a>",,,video,https://video.twimg.com/amplify_video/1930389012864241664/vid/avc1/1280x720/Ta61WmlLWnRzV3KG.mp4?tag=16
'1930356094276362543',"Stacey Abrams lost Georgia, but she’s winning federal grants.

@DOGECommittee @GOPoversight",en,Tweet,7,271,74,28,22668,2025-06-04 21:08:51,"<a href=""https://mobile.twitter.com"" rel=""nofollow"">Twitter Web App</a>",,,,
'1930353221383373089',"The crypto industry is no exception to President Trump's promise to bring jobs back to the United States.

For too long, innovators have fled to countries with more clear regulatory regimes. It is vital that Congress passes the CLARITY Act and brings talent back to the U.S! https://t.co/os8Af3e3oR",en,Tweet,5,157,26,13,11837,2025-06-04 20:57:26,"<a href=""https://studio.twitter.com"" rel=""nofollow"">Twitter Media Studio</a>",,,video,https://video.twimg.com/amplify_video/1930343073214517248/vid/avc1/568x320/eUgAzd-1KlitwC2d.mp4?tag=16
'1930003362046718394',Good. Taxpayers should not be forced to foot the bill for one-sided echo chambers.,en,Tweet,2,160,33,32,9770,2025-06-03 21:47:13,"<a href=""http://twitter.com/download/iphone"" rel=""nofollow"">Twitter for iPhone</a>",,,,
'1929991786375852067',"📺: 60 seconds of @ICEgov and @DHSgov keeping South Carolina safe during Operation Last Stand.

Enjoy! https://t.co/VDYxup0jBQ",en,Tweet,7,233,70,30,17601,2025-06-03 21:01:14,"<a href=""http://twitter.com/download/iphone"" rel=""nofollow"">Twitter for iPhone</a>",,,video,https://video.twimg.com/amplify_video/1929991703009570816/vid/avc1/1280x720/d5ZU6QYUDwkXexFa.mp4?tag=21
'1929938063448269249',"🚨 SC's Operation Last Stand: 70+ illegal aliens arrested, including a murder suspect &amp; cartel-linked nightclub owner. Drugs, guns, &amp; human trafficking shut down in Charleston County.
Thank you, @POTUS, @SecNoem, @DHSgov, &amp; @ICEgov. 💥👊🇺🇸

https://t.co/5xUVFpPc2O",en,Tweet,0,21,5,5,730,2025-06-03 17:27:45,"<a href=""https://mobile.twitter.com"" rel=""nofollow"">Twitter Web App</a>",,https://scdailygazette.com/briefs/sc-police-ice-arrest-80-people-in-raid-of-unlicensed-charleston-county-nightclub/,,
'1929931151088517217',"During the raid, authorities also recovered a missing child, cocaine, possible sex trafficking victims, firearms, unknown substances, and large sums of money.

South Carolina is still paying the price for Joe Biden’s disastrous open border policies.",en,Tweet,2,313,143,26,5896,2025-06-03 17:00:17,"<a href=""http://twitter.com/download/iphone"" rel=""nofollow"">Twitter for iPhone</a>",,,,
'1929920974952034610',"EGGCELENT NEWS-- Egg prices are dropping! Since President Trump took office, wholesale egg prices have fallen ~61%, from $6.49 to $2.52/dozen (USDA). Retail prices are starting to ease too, saving $$ for Americans!

Thank you, @POTUS and @SecRollins!",en,Tweet,0,14,4,7,852,2025-06-03 16:19:51,"<a href=""https://mobile.twitter.com"" rel=""nofollow"">Twitter Web App</a>",,,photo,https://pbs.twimg.com/media/Gsh0v85XoAAW8Xm.jpg
'1929644325018714292',"Over half of these illegals had criminal charges, including child molestation, drug trafficking, and murder.

We must give ICE the resources they need to expand these operations until every one of these threats is off our streets.

PASS THE ONE BIG BEAUTIFUL BILL!",en,Tweet,1,146,30,21,3593,2025-06-02 22:00:32,"<a href=""http://twitter.com/download/iphone"" rel=""nofollow"">Twitter for iPhone</a>",,,,
'1929634243732533491',Great day in Greenville! I was honored to speak with First Monday Republican Business Forum about the work we are doing for SC-4 and the importance of passing President Trump's One Big Beautiful Bill. https://t.co/I7zrMrQjAM,en,Tweet,0,7,1,8,830,2025-06-02 21:20:29,"<a href=""http://twitter.com/download/iphone"" rel=""nofollow"">Twitter for iPhone</a>",,,photo,"https://pbs.twimg.com/media/GsdwCndWYAAnuQi.jpg,https://pbs.twimg.com/media/GsdwCneWgAAgdAX.jpg"
'1929615511891198456',"President Trump is correct. The attack in Boulder is a tragic reminder of the dangers we face when our borders are not secure and radical ideologies are allowed to fester. 

We MUST stand united against antisemitism and ensure our communities are safe. https://t.co/LmSWjv2aYh",en,Tweet,0,21,0,7,873,2025-06-02 20:06:03,"<a href=""http://twitter.com/download/iphone"" rel=""nofollow"">Twitter for iPhone</a>",,,photo,https://pbs.twimg.com/media/GsdfFOZW8AAHd4L.jpg
'1928515715826409568',"Thank you, @elonmusk! 

@DOGE has saved American taxpayers over $170 billion.

The House must codify these cuts before the swamp refills them. 

This is not partisan—it is common sense. 

 https://t.co/sbDV5gSDdV",en,Tweet,7,530,98,208,8720,2025-05-30 19:15:51,"<a href=""http://twitter.com/download/iphone"" rel=""nofollow"">Twitter for iPhone</a>",,,video,https://video.twimg.com/amplify_video/1928512505984196608/vid/avc1/1280x720/pdyhiUZHGXIAarU4.mp4?tag=14
'1927464787111182425',"Great discussion today at the tax reform roundtable hosted by the U.S. Chamber and Greater Greer Chamber. I am committed to fighting for pro-growth policies and making the Tax Cuts and Jobs Act permanent to protect South Carolina families, small businesses, and our economy. 🇺🇸 https://t.co/eLgsaqoxZ4",en,Tweet,0,19,6,4,1717,2025-05-27 21:39:50,"<a href=""http://twitter.com/download/iphone"" rel=""nofollow"">Twitter for iPhone</a>",,,photo,https://pbs.twimg.com/media/Gr-7AdjXgAAnkNc.jpg
'1926982735186305137',"On this Memorial Day, we pause to honor the courageous men and women who made the ultimate sacrifice for our nation’s freedom. Their bravery and selflessness will never be forgotten. 🇺🇸 https://t.co/QJfKxMTGuX",en,Tweet,0,26,2,2,864,2025-05-26 13:44:20,"<a href=""http://twitter.com/download/iphone"" rel=""nofollow"">Twitter for iPhone</a>",,,photo,https://pbs.twimg.com/media/Gr4ElaoX0AAnU9c.jpg
'1925943874708467742',"Happy 237th Birthday to the great state of South Carolina! On this day in 1788, we joined the Union as the 8th state. Proud to represent our Palmetto State’s rich history and bright future! 🎉",en,Tweet,0,14,0,1,670,2025-05-23 16:56:16,"<a href=""https://mobile.twitter.com"" rel=""nofollow"">Twitter Web App</a>",,,,
'1925740224069484843',"The same agencies that lecture us about ""trusting science"" redacted documents and slow-walked alerts to protect their narrative.

Real reform starts with holding every compromised official accountable!",en,Tweet,6,49,11,7,3522,2025-05-23 03:27:02,"<a href=""http://twitter.com/download/iphone"" rel=""nofollow"">Twitter for iPhone</a>",,,,
'1925736146836901942',🚨 The Biden Administration knew about myocarditis risks from the vaccine since Feb 2021 but hid it for MONTHS. They suppressed warnings and endangered countless lives! WHY? https://t.co/xY67YiDWwo,en,Tweet,5,48,14,7,2380,2025-05-23 03:10:50,"<a href=""http://twitter.com/download/iphone"" rel=""nofollow"">Twitter for iPhone</a>",,,photo,https://pbs.twimg.com/media/GrmW0dUWUAApKQo.jpg
'1925649985158127999',"🚨 MUST WATCH: @POTUS highlights the alarming findings of the MAHA Commission on childhood health. More than 40% of American children have chronic conditions, cancer rates have soared, and autism is now 1 in 31. 

 https://t.co/W6YEqJDxpP",en,Tweet,2,53,10,10,1968,2025-05-22 21:28:27,"<a href=""http://twitter.com/download/iphone"" rel=""nofollow"">Twitter for iPhone</a>",,,video,https://video.twimg.com/amplify_video/1925646594700877824/vid/avc1/1280x720/HEWgkgPnEAp1oUAW.mp4?tag=21
'1925626797653168614',"Heartbroken over the killing of Yaron Lischinsky and Sarah Milgrim, Israeli embassy staff who were murdered in a horrific attack here in DC last night. Let me make it clear, antisemitic violence has NO place in the United States.

Please join me in praying for their families during this incredibly difficult time.",en,Tweet,1,27,2,59,23870,2025-05-22 19:56:19,"<a href=""http://twitter.com/download/iphone"" rel=""nofollow"">Twitter for iPhone</a>",,,photo,https://pbs.twimg.com/media/GrkzXh7WgAA3Rnj.jpg
'1925587921647595915',"I proudly voted YES on the One Big Beautiful Bill Act, advancing President Trump's America First Agenda. This historic legislation permanently cuts taxes for South Carolina's hardworking families, strengthens border security, restores fiscal responsibility, enhances earned benefits, bolsters our military for peace through strength, and unleashes American energy dominance. 

South Carolinians and Americans nationwide demanded bold change, and this bill delivers. I thank President Trump and my colleagues for their efforts and urge the Senate to swiftly pass this bill to enact the America First Agenda our citizens overwhelmingly support.",en,Tweet,3,146,23,135,13301,2025-05-22 17:21:50,"<a href=""http://twitter.com/download/iphone"" rel=""nofollow"">Twitter for iPhone</a>",,,,
'1925536432849829905',"South Carolinians and Americans nationwide demanded bold change, and this bill delivers. I thank President Trump and my colleagues for their efforts and urge the Senate to swiftly pass this bill to enact the America First Agenda our citizens overwhelmingly support. 🇺🇸 https://t.co/ZRle9GEJaZ",en,Tweet,4,95,15,65,7216,2025-05-22 13:57:14,"<a href=""http://twitter.com/download/iphone"" rel=""nofollow"">Twitter for iPhone</a>",,,photo,https://pbs.twimg.com/media/GrjhLmYXcAAsyMG.jpg
'1925517991002681779',"Good morning to all my colleagues who voted to pass President Trump’s One Big, Beautiful Bill.

History was made today!",en,Tweet,4,1367,112,411,24404,2025-05-22 12:43:58,"<a href=""http://twitter.com/download/iphone"" rel=""nofollow"">Twitter for iPhone</a>",,,,
'1925517479364714948',"HISTORIC WIN! @HouseGOP just voted to pass President Trump’s One Big Beautiful Bill! Massive tax cuts, secure borders, energy independence, &amp; millions of jobs for ALL Americans. A golden age of prosperity begins now! 🇺🇸 https://t.co/we03CBQr4q",en,Tweet,3,327,48,197,11522,2025-05-22 12:41:56,"<a href=""http://twitter.com/download/iphone"" rel=""nofollow"">Twitter for iPhone</a>",,,photo,https://pbs.twimg.com/media/GrjPzrrXwAAZSiP.jpg
'1925311272263749818',Co-sponsors @RepStefanik @RepMTG @RepPatFallon @RepTimBurchett @RepBrandonGill 💪🏼 🇺🇸,pl,Reply,1,7,1,1,531,2025-05-21 23:02:32,"<a href=""http://twitter.com/download/iphone"" rel=""nofollow"">Twitter for iPhone</a>",,,,
'1925308784580178103',"In an effort to seek out waste, fraud, and abuse, I found a way to save taxpayers TRILLIONS OF DOLLARS!

Allow me to introduce the TABS Act 👇🏼 https://t.co/cw3pvXaoVt",en,Tweet,0,27,6,5,1293,2025-05-21 22:52:39,"<a href=""http://twitter.com/download/iphone"" rel=""nofollow"">Twitter for iPhone</a>",,,video,https://video.twimg.com/amplify_video/1925308657698304000/vid/avc1/1280x720/7ULkkwtkCxGvzxeJ.mp4?tag=21
'1925283285892030862',"🚨 TAX HIKE ALERT: If the Trump Tax Cuts expire, the average SC-04 taxpayer will see a 24% tax increase. 

A family of 4 earning $72k will pay $1,437 MORE in taxes. This is equivalent to 8 weeks of groceries.

Pass President Trump’s One Big, Beautiful Bill! https://t.co/ehdLL8nw3v",en,Tweet,1,88,39,138,12626,2025-05-21 21:11:20,"<a href=""http://twitter.com/download/iphone"" rel=""nofollow"">Twitter for iPhone</a>",,,photo,https://pbs.twimg.com/media/Grf66TEXsAA0ZTr.jpg
'1925231338824552654',"🚨 Bitcoin just hit an ALL-TIME HIGH! 

President Trump’s pro-crypto, pro-freedom policies are restoring American leadership in the digital economy. 🇺🇸 #BTC https://t.co/hE8r2G7s6T",en,Tweet,0,6,1,3,1589,2025-05-21 17:44:54,"<a href=""http://twitter.com/download/iphone"" rel=""nofollow"">Twitter for iPhone</a>",#BTC,,animated_gif,https://pbs.twimg.com/tweet_video_thumb/GrfLX4lWYAADhzC.jpg
'1925202884888522775',"I applaud Nebraska and @SecRollins for taking this bold step. I firmly believe the government should not be incentivizing unhealthy living.

I would love to see South Carolina do something similar to promote healthy choices and reduce healthcare costs.",en,Tweet,0,17,1,4,1031,2025-05-21 15:51:50,"<a href=""http://twitter.com/download/iphone"" rel=""nofollow"">Twitter for iPhone</a>",,,,
'1924928284116082831',"🔥BOOM! @POTUS &amp; @SecDef Hegseth just announced the Golden Dome plan— $175B cutting-edge missile defense shield to protect EVERY American! 🇺🇸 

 https://t.co/tkNL8zvK4D",en,Tweet,2,369,57,145,9373,2025-05-20 21:40:41,"<a href=""http://twitter.com/download/iphone"" rel=""nofollow"">Twitter for iPhone</a>",,,video,https://video.twimg.com/amplify_video/1924921107561209856/vid/avc1/1280x720/oLnHqLCOZphdh6wJ.mp4?tag=21
'1924839473952497852',It boosts American mineral development. This bill increases mining of domestic minerals and makes America less dependent on foreign adversaries for critical minerals.,en,Reply,0,10,2,2,573,2025-05-20 15:47:47,"<a href=""https://mobile.twitter.com"" rel=""nofollow"">Twitter Web App</a>",,,,
'1924839472220250192',"It unleashes American energy dominance. The legislation increases onshore and offshore oil and gas leases, which provides certainty for energy producers, spurs job growth, and makes energy more affordable for American consumers.",en,Reply,0,8,2,1,572,2025-05-20 15:47:46,"<a href=""https://mobile.twitter.com"" rel=""nofollow"">Twitter Web App</a>",,,,
'1924839470626418970',"It’s a once-in-a-generation chance to revolutionize our nation’s defense capabilities and protect the homeland against new threats. It funds President Trump’s Golden Dome, invests in American shipbuilding, and modernizes our military.",en,Reply,0,5,1,1,211,2025-05-20 15:47:46,"<a href=""https://mobile.twitter.com"" rel=""nofollow"">Twitter Web App</a>",,,,
'1924839469120622698',It protects family farmers. The bill prevents the greedy death tax from hitting two million family-owned farms who would otherwise see their exemptions cut in half and cuts taxes on farmers by over $10 billion.,en,Reply,0,5,1,1,169,2025-05-20 15:47:45,"<a href=""https://mobile.twitter.com"" rel=""nofollow"">Twitter Web App</a>",,,,
'1924839467531030958',"It repeals Democrats’ insane attack on the gig economy. It repeals the requirement that Venmo, PayPal, and other gig transactions over $600 be reported to the IRS.",en,Reply,0,6,1,1,190,2025-05-20 15:47:45,"<a href=""https://mobile.twitter.com"" rel=""nofollow"">Twitter Web App</a>",,,,
'1924839466004316482',"It is pro-family. The One, Big, Beautiful Bill increases the child tax credit, establishes MAGA Accounts for newborns to start saving, and strengthens paid family leave.",en,Reply,0,5,1,1,197,2025-05-20 15:47:45,"<a href=""https://mobile.twitter.com"" rel=""nofollow"">Twitter Web App</a>",,,,
'1924839464485953835',It incentivizes MADE IN AMERICA. It rewards companies that build their products in America with lower taxes — and allows Americans who buy an American-made vehicle to fully deduct their auto loan interest.,en,Reply,0,5,1,2,199,2025-05-20 15:47:44,"<a href=""https://mobile.twitter.com"" rel=""nofollow"">Twitter Web App</a>",,,,
'1924839462808264867',"It ends the taxpayer-funded Green New Scam. The legislation repeals or phases out every “green” corporate welfare subsidy in Democrats’ so-called “Inflation Reduction Act,” immediately stops credits from flowing to China and saves taxpayers $500+ billion every year, and reverses electric vehicle mandates that let radical climate activists set the standards for American energy.",en,Reply,0,7,1,7,214,2025-05-20 15:47:44,"<a href=""https://mobile.twitter.com"" rel=""nofollow"">Twitter Web App</a>",,,,
'1924839461264687441',"It finally modernizes air traffic control, fulfilling President Trump’s plan to completely overhaul the systems that keep Americans flying safely and efficiently. This will allow President Trump to update our air traffic control systems and act where the Biden Administration failed (despite repeated warnings).",en,Reply,0,5,1,1,193,2025-05-20 15:47:44,"<a href=""https://mobile.twitter.com"" rel=""nofollow"">Twitter Web App</a>",,,,
'1924839459654091167',"It will give Americans PERMANENT tax relief through the Trump Tax Cuts. If the bill doesn’t pass, Americans will see the largest tax increase in history.",en,Reply,0,5,1,1,190,2025-05-20 15:47:43,"<a href=""https://mobile.twitter.com"" rel=""nofollow"">Twitter Web App</a>",,,,
'1924839458119008670',It provides historic tax relief to Social Security recipients. It slashes taxes on seniors’ Social Security benefits.,en,Reply,0,5,1,13,200,2025-05-20 15:47:43,"<a href=""https://mobile.twitter.com"" rel=""nofollow"">Twitter Web App</a>",,,,
'1924839456592240692',It ends taxpayer-funded sex change for minors. It reverses the Biden-era mandate that Medicaid covered so-called “gender transition” procedures for minors — ending the taxpayer-funded chemical castration and mutilation of American children.,en,Reply,0,6,1,1,206,2025-05-20 15:47:42,"<a href=""https://mobile.twitter.com"" rel=""nofollow"">Twitter Web App</a>",,,,
'1924839455040381392',"It reverses the spending curse plaguing Washington, D.C. The legislation delivers the largest deficit reduction in nearly 30 years, with $1.6 trillionin mandatory savings.",en,Reply,0,6,1,5,208,2025-05-20 15:47:42,"<a href=""https://mobile.twitter.com"" rel=""nofollow"">Twitter Web App</a>",,,,
'1924839453488525640',"It requires able-bodied Americans to work if they receive benefits. With 4.8 million able-bodied adults choosing not to work, The One, Big, Beautiful Bill puts work requirements in place and supports them as they find dignity through employment.",en,Reply,0,6,1,3,217,2025-05-20 15:47:42,"<a href=""https://mobile.twitter.com"" rel=""nofollow"">Twitter Web App</a>",,,,
'1924839451915587661',"It protects Medicaid for Americans by kicking 1.4 million illegals off the benefits. This bill eliminates waste, fraud, and abuse by ending benefits for at least 1.4 million illegal immigrants who are gaming the system.",en,Reply,0,7,1,4,220,2025-05-20 15:47:41,"<a href=""https://mobile.twitter.com"" rel=""nofollow"">Twitter Web App</a>",,,,
'1924839450095370613',"It boosts Border Patrol and ICE agents on the frontlines. It empowers immigration authorities to carry out their mission by hiring 10,000 new ICE personnel, 5,000 new customs officers, and 3,000 new Border Patrol agents — and gives $10,000 bonuses in each of the next four years to agents on the frontlines.",en,Reply,0,5,1,1,230,2025-05-20 15:47:41,"<a href=""https://mobile.twitter.com"" rel=""nofollow"">Twitter Web App</a>",,,,
'1924839448472162500',"It finishes President Trump’s border wall. As a result, 701 miles of primary wall, 900 miles of river barriers, 629 miles of secondary barriers, and 141 miles of vehicle and pedestrian barriers will be constructed — stopping deadly fentanyl from flowing into our communities and securing the border from dangerous illegal immigrant murderers and rapists.",en,Reply,0,5,1,1,233,2025-05-20 15:47:40,"<a href=""https://mobile.twitter.com"" rel=""nofollow"">Twitter Web App</a>",,,,
'1924839446806974540',"It secures our border. The bill permanently secures our borders by making the largest border security investment in history, funding at least one million annual removals of illegal immigrants and ramping up “mass deportation operations to a level never before seen in American history.”",en,Reply,0,8,1,2,251,2025-05-20 15:47:40,"<a href=""https://mobile.twitter.com"" rel=""nofollow"">Twitter Web App</a>",,,,
'1924839445141864824',It includes NO TAX ON TIPS and NO TAX ON OVERTIME. This makes good on two of President Trump’s cornerstone campaign promises and will benefit hardworking Americans where they need it the most — their paychecks.,en,Reply,0,7,1,6,293,2025-05-20 15:47:40,"<a href=""https://mobile.twitter.com"" rel=""nofollow"">Twitter Web App</a>",,,,
'1924839443506098264',"It delivers the largest tax cut in American history. This means an extra $5,000 in Americans’ pockets with a DOUBLE-DIGIT percent DECREASE to their tax bills. Americans earning between $30,000 and $80,000 will pay around 15% less in taxes.",en,Reply,0,8,2,4,328,2025-05-20 15:47:39,"<a href=""https://mobile.twitter.com"" rel=""nofollow"">Twitter Web App</a>",,,,
