tweet_id,text,language,type,bookmark_count,favorite_count,retweet_count,reply_count,view_count,created_at,client,hashtags,urls,media_type,media_urls
'1908583294993580532',"Donald Trump does not care about you.

He wants you to feel powerless and hopeless. So he can keep consolidating power.

And enriching himself and his billionaire buddies. https://t.co/9gzCQJAHDB",en,Tweet,65,6349,1799,2882,187309,2025-04-05 19:11:31,"<a href=""http://twitter.com/download/iphone"" rel=""nofollow"">Twitter for iPhone</a>",,,video,https://video.twimg.com/amplify_video/1908582803207249920/vid/avc1/1920x1080/4-ReSUYoVRcZhAl0.mp4?tag=16
'1908410788575957176',"In the dead of night, the Senate advanced Trump’s budget. 

A great night for billionaires — a bad night for everyone else. https://t.co/IBGEwA8ZEU",en,Tweet,316,10232,4079,5480,321713,2025-04-05 07:46:03,"<a href=""http://twitter.com/download/iphone"" rel=""nofollow"">Twitter for iPhone</a>",,,video,https://video.twimg.com/amplify_video/1908410697882488832/vid/avc1/1080x1920/uKhxoEOo-ePScvSo.mp4?tag=16
'1908394179597684984',"- Block tax cuts for billionaires
- Stand with Ukraine
- Secure veterans' health care

They're stealing from the working class, giving to the rich, and destroying your benefits in the process.

And the night is still young.",en,Reply,61,3581,732,140,54682,2025-04-05 06:40:03,"<a href=""http://twitter.com/download/iphone"" rel=""nofollow"">Twitter for iPhone</a>",,,,
'1908394178301538430',"- Raise wages for working Americans
- Ensure caregivers aren't cut
- Rein in the national debt
- Protect Medicaid
- Keep Social Security offices open
- Support families on food assistance
- Secure the right to organize",en,Reply,48,2917,544,49,57205,2025-04-05 06:40:03,"<a href=""http://twitter.com/download/iphone"" rel=""nofollow"">Twitter for iPhone</a>",,,,
'1908394176804184183',"It's midnight in Washington, and in case you're catching up...

So far tonight, Republicans have blocked amendments that would:

– Remove tariffs hurting families
– Protect disaster response and recovery
- Secure Social Security benefits
- Preserve federal lands

(Thread 🧵)",en,Tweet,723,20579,5882,1214,488427,2025-04-05 06:40:02,"<a href=""http://twitter.com/download/iphone"" rel=""nofollow"">Twitter for iPhone</a>",,,,
'1908368226024648789',"When disaster strikes – FEMA responds.

All over the country, they save lives and help rebuild.

Republicans just voted down @SenAlexPadilla's amendment which would protect the agency from drastic cuts.

And victims of disaster everywhere will pay the price.",en,Tweet,21,1293,593,1486,88878,2025-04-05 04:56:55,"<a href=""https://mobile.twitter.com"" rel=""nofollow"">Twitter Web App</a>",,,,
'1908351471994761546',"The Trump Administration’s response to sending the wrong man to a prison in El Salvador can be summed up in three words:

Lawless. Arrogant. Incompetent. https://t.co/CF8D2kp7pD",en,Tweet,15,1077,381,376,47239,2025-04-05 03:50:21,"<a href=""https://mobile.twitter.com"" rel=""nofollow"">Twitter Web App</a>",,,photo,https://pbs.twimg.com/media/GnvTXOIXoAAOg7g.jpg
'1908348059102171391',"Tonight, Democrats forced a vote on a simple amendment. 

To remove new tariffs that are increasing the cost of groceries, gas and housing.

Republicans rejected it.",en,Tweet,1309,58364,10139,4600,1554177,2025-04-05 03:36:47,"<a href=""https://mobile.twitter.com"" rel=""nofollow"">Twitter Web App</a>",,,,
'1908312703799644496',"I'm about to be voting all night on Republicans' latest billionaire giveaway budget. 

Here's what you need to know: https://t.co/ks0cCElmxH",en,Tweet,26,1039,339,971,49677,2025-04-05 01:16:17,"<a href=""https://mobile.twitter.com"" rel=""nofollow"">Twitter Web App</a>",,,video,https://video.twimg.com/ext_tw_video/1908312164227506176/pu/vid/avc1/1920x1080/tIoRPEuIWmC6ma18.mp4?tag=14
'1908300631410130966',"BREAKING: California's ability to set its own vehicle emissions standards with the Clean Air Act has been upheld again today by the Senate Parliamentarian.

Thanks to Sen. Whitehouse for his remarkable leadership on this and on the environment. Was proud to join Sen. Padilla in strong support of his efforts. 

Not out of the woods yet, but we can all breathe a little easier.",en,Tweet,13,676,186,358,52480,2025-04-05 00:28:19,"<a href=""https://mobile.twitter.com"" rel=""nofollow"">Twitter Web App</a>",,,,
'1908292393268613472',"It's a miracle that no one has been killed as a result of this administration's recklessness with our national security.

We need accountability and responsibility.

Urgently. https://t.co/bj6a9nhQFc",en,Tweet,52,3410,827,4321,280988,2025-04-04 23:55:35,"<a href=""https://mobile.twitter.com"" rel=""nofollow"">Twitter Web App</a>",,,video,https://video.twimg.com/ext_tw_video/1908292248900415488/pu/vid/avc1/1280x720/cS2KXNzfFijTT6N0.mp4?tag=12
'1908238076091994126',I'm headed to the Senate floor to talk about how Donald Trump's disregard for our national security makes all of us less safe. Tune in: https://t.co/PM0jGbJR8x,en,Tweet,9,579,173,389,26800,2025-04-04 20:19:45,"<a href=""https://studio.twitter.com"" rel=""nofollow"">Twitter Media Studio</a>",,https://x.com/i/broadcasts/1yNGaLwMgpjKj,,
'1908142360753582327',"My heart breaks with you.

We won't forget these heroes – nor the values they were courageous enough to defend.

We owe them a debt which can never be repaid.",en,Tweet,8,1224,346,192,49227,2025-04-04 13:59:25,"<a href=""http://twitter.com/download/iphone"" rel=""nofollow"">Twitter for iPhone</a>",,,,
'1907964232680837255',"The Trump administration deported the wrong guy – and now they say they can't get him back.

They're lying. But let's talk about what this means for you. https://t.co/RBxv7Ud4CW",en,Tweet,83,4927,1556,2001,116037,2025-04-04 02:11:35,"<a href=""https://mobile.twitter.com"" rel=""nofollow"">Twitter Web App</a>",,,video,https://video.twimg.com/ext_tw_video/1907963722519261184/pu/vid/avc1/1920x1080/ooyUVlE8pUh03KNW.mp4?tag=14
'1907907757036155067',"Donald Trump's tariffs are a $3,800-a-year tax on your family.

Everything you buy – from coffee, to cars, to clothes – is about to get a lot more expensive.",en,Tweet,92,8799,2174,6748,305611,2025-04-03 22:27:11,"<a href=""http://twitter.com/download/iphone"" rel=""nofollow"">Twitter for iPhone</a>",,,,
'1907869113990443250',"Donald Trump just put tariffs on a penguin.

No — I’m not joking. https://t.co/bg5Xr0wHBB",en,Tweet,315,11431,2864,3248,400083,2025-04-03 19:53:37,"<a href=""http://twitter.com/download/iphone"" rel=""nofollow"">Twitter for iPhone</a>",,,video,https://video.twimg.com/amplify_video/1907868700880908288/vid/avc1/720x1280/EJN4uUd6GiDqOXwL.mp4?tag=16
'1907857593420103873',"On Monday, @RepRaskin and I will hold a hearing to expose the Trump Administration's attack on the rule of law and what it means for the American people: https://t.co/G9uepEq52m",en,Tweet,46,4299,1108,2769,137428,2025-04-03 19:07:51,"<a href=""https://mobile.twitter.com"" rel=""nofollow"">Twitter Web App</a>",,,video,https://video.twimg.com/ext_tw_video/1907857403573370880/pu/vid/avc1/1920x1080/kpA-PJwi7l-D9hMI.mp4?tag=14
'1907781874706939955',"The Trump Administration is destroying the rule of law.

Republicans in Congress won't hold them accountable.

So @RepRaskin and I will. 

We’re hosting a hearing on Monday to expose the truth. Stay tuned. https://t.co/h2FYsHawrU",en,Tweet,34,2689,1003,916,55741,2025-04-03 14:06:58,"<a href=""https://mobile.twitter.com"" rel=""nofollow"">Twitter Web App</a>",,,photo,https://pbs.twimg.com/media/GnnNam6W0AATFA7.png
'1907612383972860199',"Donald Trump is destroying the rule of law in America.

The news from New York today is just the latest example.

Let's talk about it. https://t.co/RnuMiyhf73",en,Tweet,62,2258,629,1365,73106,2025-04-03 02:53:28,"<a href=""http://twitter.com/download/iphone"" rel=""nofollow"">Twitter for iPhone</a>",,,video,https://video.twimg.com/amplify_video/1907611410147799040/vid/avc1/1280x720/PAITLNgxfKAEZISO.mp4?tag=16
'1907597100658946066',"Prices are already rising, families are already suffering.

And Trump’s ill-considered tariffs are only going to make matters worse.

This is ""liberation"" for who, exactly? https://t.co/xHjTppuj1q",en,Tweet,22,1762,444,1645,118155,2025-04-03 01:52:44,"<a href=""https://mobile.twitter.com"" rel=""nofollow"">Twitter Web App</a>",,,video,https://video.twimg.com/ext_tw_video/1907596949290733568/pu/vid/avc1/1920x1080/i8zDCivQvfXuyIpa.mp4?tag=14
'1907549996544831769',"Just watched the President's ""Liberation Day"" speech. 

Based on this, I can confirm many Americans will be liberated from:

- Being able to afford groceries 
- Much of their retirement savings
- Any hope of buying a home

As for lower prices? Just the opposite.",en,Tweet,180,14953,3385,2912,372451,2025-04-02 22:45:34,"<a href=""https://mobile.twitter.com"" rel=""nofollow"">Twitter Web App</a>",,,,
'1907522791038976371',"Donald Trump and Elon Musk think they can destroy our country for their own benefit. 

No they can’t. Not if we band together to stop them. https://t.co/uyEstLPTCr",en,Tweet,65,7952,1909,2253,123367,2025-04-02 20:57:28,"<a href=""https://mobile.twitter.com"" rel=""nofollow"">Twitter Web App</a>",,,video,https://video.twimg.com/ext_tw_video/1907522675972444160/pu/vid/avc1/1920x1080/MYwqID8TiJwEybjY.mp4?tag=14
'1907507904447426586',"The Trump Administration is clearly having trouble keeping national security and classified information off Signal and Gmail.

Even the nation’s top intelligence officials - like Gabbard and Ratcliffe - apparently don’t know the difference between war plans and plans for dinner.

That’s why I’ve joined @SenSchumer in introducing legislation to mandate training on classified information for these officials.",en,Tweet,24,1800,515,480,45168,2025-04-02 19:58:18,"<a href=""https://mobile.twitter.com"" rel=""nofollow"">Twitter Web App</a>",,,,
'1907477796701581420',"Today, at the Justice Department's urging, a judge dismissed a serious corruption case against the Mayor of New York. 

Not because there was any lack of evidence.

Not because of any misconduct by the prosecutors. 

But because of the flagrant misconduct and abuse of power of the Attorney General of the United States. 

This is how a country loses its rule of law.",en,Tweet,80,4533,1725,909,101094,2025-04-02 17:58:40,"<a href=""https://mobile.twitter.com"" rel=""nofollow"">Twitter Web App</a>",,,,
'1907438229906653259',"Cuts to Medicaid will make life worse for millions of Americans.

Don't just take my word for it, listen to theirs. https://t.co/F8Oxbdw4eb",en,Tweet,28,1519,537,1871,90910,2025-04-02 15:21:27,"<a href=""https://mobile.twitter.com"" rel=""nofollow"">Twitter Web App</a>",,,video,https://video.twimg.com/ext_tw_video/1907435117238247425/pu/vid/avc1/720x1280/t_PpmopESyapllmJ.mp4?tag=12
'1907198463353229630',"Signal for classified attack plans against Houthi rebels.

Now, Gmail for “sensitive military positions and powerful weapons systems relating to an ongoing conflict.”

Might as well shout it from the rooftops. 

The carelessness is staggering – and makes all of us less safe.",en,Tweet,40,3812,1230,910,119958,2025-04-01 23:28:42,"<a href=""https://mobile.twitter.com"" rel=""nofollow"">Twitter Web App</a>",,,,
'1907188956740854136',"Read my full statement:

https://t.co/7X6g6FoyxC",en,Reply,22,511,163,207,113334,2025-04-01 22:50:55,"<a href=""https://mobile.twitter.com"" rel=""nofollow"">Twitter Web App</a>",,https://www.schiff.senate.gov/news/press-releases/statement-sen-schiff-announces-hold-on-d-c-u-s-attorney-nominee-ed-martin/,,
'1907188941163266424',"BREAKING: I'm placing a hold on President Trump's nominee for U.S. Attorney in DC.

For the past few weeks, Ed Martin has been a one-man wrecking ball. Threatening opponents, firing public servants, and using his office to chill free speech.

His nomination must be blocked.",en,Tweet,418,34652,7359,6548,1200736,2025-04-01 22:50:52,"<a href=""https://mobile.twitter.com"" rel=""nofollow"">Twitter Web App</a>",,,,
'1907178960279982546',"My friend @SenBooker has been on the floor for quite awhile now.

So I went to go help. https://t.co/NVhmkBofJe",en,Tweet,233,18060,2064,2703,401800,2025-04-01 22:11:12,"<a href=""http://twitter.com/download/iphone"" rel=""nofollow"">Twitter for iPhone</a>",,,video,https://video.twimg.com/amplify_video/1907178834719387648/vid/avc1/1920x1080/XpR9lyVm03wd3yAP.mp4?tag=16
'1907140837932454359',"I'm in the Senate chamber with @SenBooker, ready to help him hold the floor. Tune in: https://t.co/i3KewuFsfh",en,Tweet,23,2138,384,487,50538,2025-04-01 19:39:43,"<a href=""https://studio.twitter.com"" rel=""nofollow"">Twitter Media Studio</a>",,https://x.com/i/broadcasts/1vAGRDmqaBPxl,,
'1907140464437793104',"""You can't lead the people if you can't love the people.""

We're all with you, @SenBooker. https://t.co/AHsIKvV5j9",en,Tweet,605,38232,5819,4307,726674,2025-04-01 19:38:14,"<a href=""https://mobile.twitter.com"" rel=""nofollow"">Twitter Web App</a>",,,video,https://video.twimg.com/ext_tw_video/1907140101114671105/pu/vid/avc1/1920x1080/clowYFhEZZvB0oyS.mp4?tag=14
'1906909371939831869',"Can Donald Trump run for a third term?

Let's talk about it – and just how dangerous this idea is. https://t.co/3BnbjWenqi",en,Tweet,45,964,304,1142,76652,2025-04-01 04:19:57,"<a href=""http://twitter.com/download/iphone"" rel=""nofollow"">Twitter for iPhone</a>",,,video,https://video.twimg.com/amplify_video/1906908593032445952/vid/avc1/1920x1080/YCqqYrirXZ7MrXto.mp4?tag=16
'1906824713508200842',"Closely monitoring the Silver Fire in Inyo and Mono counties.

Resources are surging to the scene to work on structure defense and containment efforts. 

If you’re in the area — stay vigilant and follow any evacuation instructions from local authorities.",en,Tweet,2,154,38,219,28175,2025-03-31 22:43:33,"<a href=""https://mobile.twitter.com"" rel=""nofollow"">Twitter Web App</a>",,,,
'1906805088523354417',"Another weak answer from a Trump nominee when asked whether he would stand up to the President's terrible abuses of power. 

I'm a strong ""no"" on his nomination. https://t.co/HJXaQIchCE",en,Tweet,51,4211,977,1800,137620,2025-03-31 21:25:34,"<a href=""https://mobile.twitter.com"" rel=""nofollow"">Twitter Web App</a>",,,video,https://video.twimg.com/ext_tw_video/1906804358043353088/pu/vid/avc1/1280x720/OZEg37E7O2BbTSri.mp4?tag=12
'1906779873894420766',"Civil rights activist César Chávez dedicated his life to fighting for farm workers and improving the lives of countless others. 

Today @SenAlexPadilla, @RepRaulRuizMD, and I commemorate his legacy with a new bill to establish a National Park and monument in his honor.",en,Tweet,5,457,95,247,32075,2025-03-31 19:45:22,"<a href=""https://mobile.twitter.com"" rel=""nofollow"">Twitter Web App</a>",,,,
'1906760471165755753',"Kseniia Petrova is a university medical researcher and Putin critic.

Upon returning to the US, CBP detained her. 

I'm urging @Sec_Noem and @ICEgov to release Kseniia while her asylum claim is pending and ensure she is not deported to Russia – where she risks persecution.",en,Tweet,11,926,372,221,39070,2025-03-31 18:28:16,"<a href=""https://mobile.twitter.com"" rel=""nofollow"">Twitter Web App</a>",,,,
'1906722786233422121',"To all those celebrating, Eid Mubarak!

As families and communities gather in prayer and gratitude, may this sacred day be a beacon of hope, renewal, and unity for Muslims across the nation and around the world.",en,Tweet,2,154,32,213,24766,2025-03-31 15:58:32,"<a href=""https://mobile.twitter.com"" rel=""nofollow"">Twitter Web App</a>",,,,
'1906498228280860821',"Incredible.

Alysa, you’ve made California and your country proud yet again.",en,Tweet,9,546,77,161,74852,2025-03-31 01:06:13,"<a href=""http://twitter.com/download/iphone"" rel=""nofollow"">Twitter for iPhone</a>",,,,
'1906451242152255671',"Watch the full video:
https://t.co/1pKWVCfFVv",en,Reply,12,134,52,99,56398,2025-03-30 21:59:30,"<a href=""https://mobile.twitter.com"" rel=""nofollow"">Twitter Web App</a>",,https://youtu.be/HKYdVSGDIhY,,
'1906451240281681955',"There's an important strategy behind Donald Trump's constant firehose of falsehoods. 

And it comes straight from the dictator's playbook.

Let's talk about truth and lies. https://t.co/hqaA24nLTh",en,Tweet,168,5208,2103,3869,210084,2025-03-30 21:59:30,"<a href=""https://mobile.twitter.com"" rel=""nofollow"">Twitter Web App</a>",,,video,https://video.twimg.com/ext_tw_video/1906447315285512192/pu/vid/avc1/1080x1920/njIqZI_ylQ97hoZP.mp4?tag=14
'1906398679910461584',"Prices are up. 
The market is down.
401k’s are in the tank.
Social Security and Medicare are under attack.

Donald Trump has broken every campaign promise he made – except one.

Tax cuts for billionaires. Arriving right on schedule.",en,Tweet,244,18774,5079,8482,1048086,2025-03-30 18:30:39,"<a href=""http://twitter.com/download/iphone"" rel=""nofollow"">Twitter for iPhone</a>",,,,
'1906082061653254184',.@SenAlexPadilla and I caught up with Californians in D.C. to hear more about the issues affecting all of us. https://t.co/ML28U5tY2A,en,Tweet,8,376,103,384,51183,2025-03-29 20:32:31,"<a href=""http://twitter.com/download/iphone"" rel=""nofollow"">Twitter for iPhone</a>",,,video,https://video.twimg.com/amplify_video/1906081793280806912/vid/avc1/1080x1920/9tnQmCJJII-h_l7p.mp4?tag=16
'1905753066596667641',"Prices are soaring, your 401k is in the tank, Social Security phone lines are hours long.

Instead of addressing any of that – this administration is picking a fight with Denmark.",en,Tweet,74,6136,1555,2099,224734,2025-03-28 22:45:12,"<a href=""https://mobile.twitter.com"" rel=""nofollow"">Twitter Web App</a>",,,,
'1905674858429595892',"Like any aspiring autocrat, Donald Trump is working to suppress any opposition. Central to that effort is quashing oversight and transparency. 

I'm joining @SenBlumenthal on a new bill that will expand whistleblower protections – especially for public servants in our intelligence community and the FBI.",en,Tweet,5,1047,320,670,37493,2025-03-28 17:34:26,"<a href=""https://mobile.twitter.com"" rel=""nofollow"">Twitter Web App</a>",,,,
'1905649372366287079',"A lot of people learned the name ""Steve Witkoff"" this week. But... who exactly is he?

Let's talk Trump's top foreign policy advisor, the Kremlin, and the ham &amp; cheese sandwich heard 'round the world. https://t.co/T1yCpJnxK7",en,Tweet,61,1059,386,821,90288,2025-03-28 15:53:10,"<a href=""https://mobile.twitter.com"" rel=""nofollow"">Twitter Web App</a>",,,video,https://video.twimg.com/amplify_video/1905645052795248640/vid/avc1/1920x1080/aXUbc5YMRZmHfrnc.mp4?tag=16
'1905636706771927072',"Thank you Jenner Block — for upholding the rule of law. 

https://t.co/pXk2ugF7wX",en,Tweet,1,789,152,205,30895,2025-03-28 15:02:50,"<a href=""http://twitter.com/download/iphone"" rel=""nofollow"">Twitter for iPhone</a>",,https://www.jennerfirm.com,,
'1905422003714023818',".@SenAlexPadilla and I hosted dozens of Californians for coffee in the Capitol today.

Hearing questions, addressing concerns, and talking about how we can work together. So proud to represent this big beautiful state. https://t.co/8cv5vZy6TD",en,Tweet,3,233,58,209,27625,2025-03-28 00:49:41,"<a href=""https://mobile.twitter.com"" rel=""nofollow"">Twitter Web App</a>",,,photo,"https://pbs.twimg.com/media/GnFrJPsXIAE12_g.jpg,https://pbs.twimg.com/media/GnFrKdCWIAIJA_l.jpg,https://pbs.twimg.com/media/GnFrLdNX0AAAWRD.jpg"
'1905402313256108287',Defend yourself. https://t.co/4ZSURU3SJe,en,Reply,8,364,60,59,27875,2025-03-27 23:31:26,"<a href=""http://twitter.com/download/iphone"" rel=""nofollow"">Twitter for iPhone</a>",,,photo,https://pbs.twimg.com/media/GnFZTmOWkAA74iU.jpg
'1905402307887448339',"For God’s sake, https://t.co/lFkjASaoXI",en,Tweet,14,823,138,183,142891,2025-03-27 23:31:25,"<a href=""http://twitter.com/download/iphone"" rel=""nofollow"">Twitter for iPhone</a>",,,photo,https://pbs.twimg.com/media/GnFZTPnXsAAb_Ip.jpg
'1905376092233380117',"Our farmers must be able to count on the federal government to live up to their word – and their contracts.

Amidst rising uncertainty, tariffs, and inflation, @SenBooker and I are working to ensure California farmers won't be left in the lurch. https://t.co/8tTJbkLhBs",en,Tweet,2,306,98,242,28618,2025-03-27 21:47:15,"<a href=""https://mobile.twitter.com"" rel=""nofollow"">Twitter Web App</a>",,,photo,https://pbs.twimg.com/media/GnFBJ2xXoAAzmjw.jpg
'1905279052602032347',"Signalgate is what happens when you put people who are unqualified, arrogant, and incompetent in the highest echelons of government. https://t.co/pP841waCIW",en,Tweet,249,24230,5683,9337,583205,2025-03-27 15:21:39,"<a href=""https://mobile.twitter.com"" rel=""nofollow"">Twitter Web App</a>",,,video,https://video.twimg.com/ext_tw_video/1905278995656052736/pu/vid/avc1/1920x1080/UjxOzJR0HmEotvzA.mp4?tag=14
'1905086893240258591',"The lesson from this whole Signalgate catastrophe? 

This administration will never, ever take responsibility for their mistakes, even when they endanger people. Especially when they endanger people. 

And it's the American people who will suffer. https://t.co/r6xn2sE7TD",en,Tweet,335,29157,6646,5902,579811,2025-03-27 02:38:04,"<a href=""https://mobile.twitter.com"" rel=""nofollow"">Twitter Web App</a>",,,video,https://video.twimg.com/ext_tw_video/1905086857085370368/pu/vid/avc1/1280x720/JPGo6VrC1szZZVdu.mp4?tag=12
'1905074267940585502',This hasn’t aged well. https://t.co/gXOzboO0IQ,en,Tweet,769,45554,9697,7221,1571253,2025-03-27 01:47:54,"<a href=""https://mobile.twitter.com"" rel=""nofollow"">Twitter Web App</a>",,,photo,https://pbs.twimg.com/media/GnAu8qIW4AAZQZf.jpg
'1905062360856854945',"Donald Trump just got handed more bad news in court, in what may be the single most important case.

Let's talk about it. https://t.co/gsP9HVHKRX",en,Tweet,62,1981,538,570,60086,2025-03-27 01:00:35,"<a href=""https://mobile.twitter.com"" rel=""nofollow"">Twitter Web App</a>",,,video,https://video.twimg.com/amplify_video/1905058381087256576/vid/avc1/1920x1080/ww226qEsq34oHllP.mp4?tag=16
'1904977620812386697',"Why were senior Trump administration officials using Signal in foreign countries to communicate about sensitive national security matters?
 
We need answers and accountability. Urgently. https://t.co/26iKmU45aQ",en,Tweet,39,3174,991,1304,93091,2025-03-26 19:23:52,"<a href=""https://mobile.twitter.com"" rel=""nofollow"">Twitter Web App</a>",,,photo,"https://pbs.twimg.com/media/Gm_W4bsWgAA2Ak_.jpg,https://pbs.twimg.com/media/Gm_W7PQXAAA8x5f.jpg,https://pbs.twimg.com/media/Gm_XCU3WcAAMy6U.png"
'1904939140652707973',"I pressed Donald Trump's nominee for Assistant Attorney General for National Security about Signalgate.

His responses were a disgraceful - and unsuccessful - effort to dodge. Watch for yourself: https://t.co/fyurEit4bp",en,Tweet,511,10721,3111,2887,544566,2025-03-26 16:50:57,"<a href=""https://mobile.twitter.com"" rel=""nofollow"">Twitter Web App</a>",,,video,https://video.twimg.com/ext_tw_video/1904936650926419968/pu/vid/avc1/1920x1080/Mh_lb7QgIf4LMOeH.mp4?tag=14
