tweet_id,text,language,type,bookmark_count,favorite_count,retweet_count,reply_count,view_count,created_at,client,hashtags,urls,media_type,media_urls
'1847098467413348796',Celebrating 30 years of Waterfire tonight in Providence at @WaterFireProv’s 8th Annual FireBall Gala. Thank you to all who have made Waterfire one of our state’s most special traditions over the last three decades. 🌊🔥 https://t.co/V5dcT2y8oq,en,Tweet,0,5,1,0,483,2024-10-18 03:12:46,"<a href=""http://twitter.com/download/iphone"" rel=""nofollow"">Twitter for iPhone</a>",,,photo,"https://pbs.twimg.com/media/GaI2QVlXAAAT2Ka.jpg,https://pbs.twimg.com/media/GaI2QVnXIAAV3cm.jpg,https://pbs.twimg.com/media/GaI2QVmWYAAEC55.jpg"
'1846715311879270417',"Spent the afternoon connecting with Cranston voters alongside City Councilwoman Jessica Marino and Alan Rudolph, candidate for City Council Ward 4.

Alan and Jessica’s commitment and dedication to this city and its residents runs deep. https://t.co/xfIv8WnsLq",en,Tweet,0,12,1,3,1319,2024-10-17 01:50:15,"<a href=""http://twitter.com/download/iphone"" rel=""nofollow"">Twitter for iPhone</a>",,,photo,https://pbs.twimg.com/media/GaDZx50W0AAgCgQ.jpg
'1846627809751408669',"We’re 20 days from the 2024 election and if we want a strong victory for @KamalaHarris, we need to take action.

Join us for a virtual phone bank tomorrow to help turn out the vote!

https://t.co/iFjwvgMPN0",en,Tweet,0,12,2,6,993,2024-10-16 20:02:33,"<a href=""http://twitter.com/download/iphone"" rel=""nofollow"">Twitter for iPhone</a>",,https://events.democrats.org/event/698919/,,
'1845876532230635950',"📅 Mark your calendars for October 17th!

Join me for a virtual phone bank party to help elect Kamala Harris and Democrats up and down the ballot. 

Let’s dial up some change together. 📞

https://t.co/iFjwvgMPN0",en,Tweet,0,5,1,3,516,2024-10-14 18:17:14,"<a href=""http://twitter.com/download/iphone"" rel=""nofollow"">Twitter for iPhone</a>",,https://events.democrats.org/event/698919/,,
'1845543870592905478',Now in Westerly for another one of Rhode Island’s great Columbus Day parades. Thank you and congratulations to all of the organizers.  🇮🇹 https://t.co/yo9lXJd4pE,en,Tweet,0,7,1,0,842,2024-10-13 20:15:21,"<a href=""http://twitter.com/download/iphone"" rel=""nofollow"">Twitter for iPhone</a>",,,photo,"https://pbs.twimg.com/media/GZywWpaXkAAXqjJ.jpg,https://pbs.twimg.com/media/GZywWpbW8AAOWv4.jpg,https://pbs.twimg.com/media/GZywWpdWQAABn-S.jpg,https://pbs.twimg.com/media/GZywWpZXYAA8FmF.jpg"
'1845488747028091156',"If you haven’t been to the Columbus Day festival on @FederalHillRI, I don’t know what you’re waiting for!

An amazing celebration of the Italian-American community, with great food and culture. Today’s parade was also great! 🇮🇹 https://t.co/QUwjY2ngoW",en,Tweet,0,12,1,1,794,2024-10-13 16:36:19,"<a href=""http://twitter.com/download/iphone"" rel=""nofollow"">Twitter for iPhone</a>",,,photo,https://pbs.twimg.com/media/GZx-O0UXUA0VA7E.jpg
'1844888776876884069',Perfect end to the week at @ProgresoLatino’s 47th Anniversary Gala celebrating the incredible work they do providing a range of social and educational services in Central Falls and beyond. https://t.co/0BgDRoMrAm,en,Tweet,0,4,0,1,606,2024-10-12 00:52:15,"<a href=""http://twitter.com/download/iphone"" rel=""nofollow"">Twitter for iPhone</a>",,,photo,"https://pbs.twimg.com/media/GZpcjySWoAEUIMd.jpg,https://pbs.twimg.com/media/GZpcjyaX0AIofqX.jpg,https://pbs.twimg.com/media/GZpcjybWYAUcnJX.jpg,https://pbs.twimg.com/media/GZpcjySXIAgdcdo.jpg"
'1844827206477885925',"Nurses deserve strong advocates in Congress, and I am fighting to ensure that all nurses receive fair pay and safe working conditions.

Grateful for the endorsement of @WeAreUNAP in my campaign for reelection, so we can continue the fight together. https://t.co/7qHuJ6urKH",en,Tweet,0,9,0,0,515,2024-10-11 20:47:35,"<a href=""http://twitter.com/download/iphone"" rel=""nofollow"">Twitter for iPhone</a>",,,photo,"https://pbs.twimg.com/media/GZokjO6XsAcgHK4.jpg,https://pbs.twimg.com/media/GZokjPBXoAETzfU.jpg"
'1844546419786445092',Had a blast calling the numbers at Drag Bingo at Rhodes-on-the Pawtuxet tonight to support @AIDSCAREOS – a vital organization that ensures people living with HIV/AIDS have the resources and treatment they need. https://t.co/oFacgRwAMb,en,Tweet,1,10,1,2,811,2024-10-11 02:11:51,"<a href=""http://twitter.com/download/iphone"" rel=""nofollow"">Twitter for iPhone</a>",,,photo,"https://pbs.twimg.com/media/GZklLqkXcAMUlss.jpg,https://pbs.twimg.com/media/GZklLqmXcAYr1Fa.jpg,https://pbs.twimg.com/media/GZklLqkXkAcdAbI.jpg"
'1844515268816416939',"All across Rhode Island, there are opportunities to get involved in helping to turn out the vote in battleground states to make sure @KamalaHarris is our next President.

Tonight it was great kicking off an organizing meeting in Cranston with @MovementVote! https://t.co/kqKs6akfwx",en,Tweet,0,30,5,28,2782,2024-10-11 00:08:04,"<a href=""http://twitter.com/download/iphone"" rel=""nofollow"">Twitter for iPhone</a>",,,photo,"https://pbs.twimg.com/media/GZkI1sUWQAUIkQC.jpg,https://pbs.twimg.com/media/GZkI1sJWQAY-jjM.jpg"
'1843670241408090144',"Our new ad goes on air today! 📺

In Congress, I’m fighting special interests to stand up for working people—cracking down on price gouging, protecting Social Security, Medicare, &amp; defending a woman’s right to choose.

Public officials should work for the people, not themselves. https://t.co/FFBhW4cW3r",en,Tweet,2,39,7,60,16960,2024-10-08 16:10:13,"<a href=""http://twitter.com/download/iphone"" rel=""nofollow"">Twitter for iPhone</a>",,,video,https://video.twimg.com/ext_tw_video/1843670152107241472/pu/vid/avc1/1280x720/nqiDia0TSuIGf8-k.mp4?tag=12
'1843326425677672749',"Though he couldn’t be here, @SenatorRuggerio has a big cheering section, including @gabeamo, @Sabina_Matos, @GreggAmore1 @JamesDiossa &amp; @PeterNeronha, as he is given the Brighter Futures Award by @FamilyServiceRI - a worthy honor for a great champion of working families. https://t.co/dP3OwaQuce",en,Tweet,1,54,7,7,3817,2024-10-07 17:24:01,"<a href=""http://twitter.com/download/iphone"" rel=""nofollow"">Twitter for iPhone</a>",,,photo,https://pbs.twimg.com/media/GZTPnL0XIAUlYs1.jpg
'1843070657418178665',Fun family time in Western Cranston today! https://t.co/VW7uZKDoaP,en,Tweet,0,26,1,0,1251,2024-10-07 00:27:41,"<a href=""http://twitter.com/download/iphone"" rel=""nofollow"">Twitter for iPhone</a>",,,photo,"https://pbs.twimg.com/media/GZPm-6aXMAAr9Q7.jpg,https://pbs.twimg.com/media/GZPm-6bWcAAB8Td.jpg,https://pbs.twimg.com/media/GZPm-6cWQAAZIF7.jpg"
'1842637070126219498',"Had a blast in North Kingstown’s 350th anniversary parade today, celebrating the proud history and friendly spirit of community that makes this town so special. 🎉 https://t.co/UkM7pboouF",en,Tweet,0,7,0,0,470,2024-10-05 19:44:46,"<a href=""http://twitter.com/download/iphone"" rel=""nofollow"">Twitter for iPhone</a>",,,photo,"https://pbs.twimg.com/media/GZJcpTrXAAAkB5z.jpg,https://pbs.twimg.com/media/GZJcpTvWQAMwzq3.jpg"
'1842603181047742851',"The competition was fierce this year at the @OSDRI_Vets 10th annual ‘Zero Kilometer road race’ at @McBridespub2 in Providence.

Silly event for a fantastic cause! https://t.co/OLDEBr9WTB",en,Tweet,1,8,0,0,1165,2024-10-05 17:30:06,"<a href=""http://twitter.com/download/iphone"" rel=""nofollow"">Twitter for iPhone</a>",,,video,https://video.twimg.com/ext_tw_video/1842603144364032001/pu/vid/avc1/720x1280/yCHK1FUaP8HeR13V.mp4?tag=12
'1842209786839834685',"It's like like Christmas Eve, but bettah!",en,Tweet,1,11,2,4,1459,2024-10-04 15:26:54,"<a href=""https://mobile.twitter.com"" rel=""nofollow"">Twitter Web App</a>",,,,
'1841629309162651997',"Productive evening meeting with people across #RI02! 

First with @Scituatedems supporting great local candidates

Then in Johnston with @SheldonforRI to discuss our work to lower costs and improve housing for seniors, 

Ending in Cranston with @RIPAINTERSUNION! Great night! https://t.co/ynshZRTw4X",en,Tweet,0,3,1,0,475,2024-10-03 01:00:17,"<a href=""http://twitter.com/download/iphone"" rel=""nofollow"">Twitter for iPhone</a>",#RI02,,photo,"https://pbs.twimg.com/media/GY7IF2OWwAAoDOn.jpg,https://pbs.twimg.com/media/GY7IF2MW4AAnmGw.jpg,https://pbs.twimg.com/media/GY7IF2NXEAEquDP.jpg,https://pbs.twimg.com/media/GY7IF2PXQAERAob.jpg"
'1841269326541619390',"Great to attend @CleanWaterRI’s Electoberfest this evening where we honored @RIAFLCIO President George Nee.

Inspired to see so many dedicated to protecting the environment. In Congress, I remain committed to building a greener, more sustainable future for Rhode Island. https://t.co/CobJSeJNWI",en,Tweet,0,10,0,3,753,2024-10-02 01:09:51,"<a href=""http://twitter.com/download/iphone"" rel=""nofollow"">Twitter for iPhone</a>",,,photo,"https://pbs.twimg.com/media/GY2Apz3XwAYJFTg.jpg,https://pbs.twimg.com/media/GY2Apz0XsAI2H-t.jpg"
'1841260303406731416',"Since the Supreme Court’s tragic decision to overturn Roe v. Wade, abortion rights have been under attack nationwide.

Today, I joined the Rhode Island Abortion Fund at tonight’s launch party, standing with advocates fighting to protect and expand access to abortion care. https://t.co/wFudzvZgL4",en,Tweet,0,6,0,4,644,2024-10-02 00:33:59,"<a href=""http://twitter.com/download/iphone"" rel=""nofollow"">Twitter for iPhone</a>",,,photo,https://pbs.twimg.com/media/GY14e_EWwAQYl9o.jpg
'1841245953585537240',"Honored to attend the 2024 Neighbors Helping Neighbors event to support  @CrossroadsRI’s life-changing impact.

Together, we can make sure every Rhode Islander has access to safe housing and the support they need. #NHN24 https://t.co/fTPsy2f91A",en,Tweet,0,6,1,1,550,2024-10-01 23:36:58,"<a href=""http://twitter.com/download/iphone"" rel=""nofollow"">Twitter for iPhone</a>",#NHN24,,photo,"https://pbs.twimg.com/media/GY1rbtZXsAUaL7k.jpg,https://pbs.twimg.com/media/GY1rbtbXwAEH5Y4.jpg,https://pbs.twimg.com/media/GY1rbtcWMAIjn3P.jpg"
'1841184317042528507',"Postal workers are unsung heroes who show up every day to keep our country connected.

I am proud to stand with Rhode Island @APWUnational postal workers as they advocate for better staffing and resources. Their work is essential and should be treated that way. https://t.co/oijHp8WuAp",en,Tweet,0,35,5,0,4325,2024-10-01 19:32:03,"<a href=""http://twitter.com/download/iphone"" rel=""nofollow"">Twitter for iPhone</a>",,,photo,"https://pbs.twimg.com/media/GY0zU2xXsAIZOpP.jpg,https://pbs.twimg.com/media/GY0zU2iXQAA2QDM.jpg,https://pbs.twimg.com/media/GY0zU2mW8AUYddc.jpg,https://pbs.twimg.com/media/GY0zU2pXIAAJM6J.jpg"
