tweet_id,text,language,type,bookmark_count,favorite_count,retweet_count,reply_count,view_count,created_at,client,hashtags,urls,media_type,media_urls
'1882822355849986250',"After just one week in office, @POTUS has already done more to secure our borders and make our communities safer than President Biden did in four years. 

President Trump and House Republicans will continue to keep our promises to the American people.

https://t.co/ZuCJC7BFgy",en,Tweet,0,8,3,8,331,2025-01-24 16:06:45,"<a href=""http://twitter.com/download/iphone"" rel=""nofollow"">Twitter for iPhone</a>",,https://www.nbcnews.com/news/amp/rcna188827,,
'1882483372448268688',"This week, I met with Pro-Life advocates to discuss the importance of protecting life throughout the Country. 

Life - at all stages - is worth fighting for and I thank them for their tireless work to protect life. https://t.co/Kgdcq8yBf7",en,Tweet,0,17,3,2,627,2025-01-23 17:39:45,"<a href=""http://twitter.com/download/iphone"" rel=""nofollow"">Twitter for iPhone</a>",,,photo,https://pbs.twimg.com/media/Gh_spmKX0AA6xYe.jpg
'1882083826119397423',"Proud of my A+ rating from @sbaprolife 

Life is a gift from God - and I will always work to protect it. https://t.co/x4VhYQhVcw",en,Tweet,0,17,3,3,917,2025-01-22 15:12:06,"<a href=""https://mobile.twitter.com"" rel=""nofollow"">Twitter Web App</a>",,,photo,https://pbs.twimg.com/media/Gh6AmDGWQAAQOXH.jpg
'1881791062018261203',“The ballot is stronger than the bullet.” - President Abraham Lincoln https://t.co/lLBb74yt3r,en,Tweet,0,19,3,6,877,2025-01-21 19:48:45,"<a href=""http://twitter.com/download/iphone"" rel=""nofollow"">Twitter for iPhone</a>",,,photo,https://pbs.twimg.com/media/Gh12_3JXcAAOdeB.jpg
'1881734955509923933',"Great to see the unity of the Trump family on full display at the Liberty Ball last night. 

It’s a new day in America and the Golden Age starts now! https://t.co/IuLfgZWRRa",en,Tweet,1,10,1,3,638,2025-01-21 16:05:48,"<a href=""http://twitter.com/download/iphone"" rel=""nofollow"">Twitter for iPhone</a>",,,video,https://video.twimg.com/amplify_video/1881734905601601536/vid/avc1/1280x720/xVapQHVe96cBDe-j.mp4?tag=14
'1881361088241176877',"Great to see constituents from #PA13 at Capitol One Arena ready to celebrate President Trump’s return to Washington. 

It’s a new day in America! https://t.co/UFu79clVQU",en,Tweet,0,9,1,6,779,2025-01-20 15:20:12,"<a href=""http://twitter.com/download/iphone"" rel=""nofollow"">Twitter for iPhone</a>",#PA13,,photo,https://pbs.twimg.com/media/Ghvv8FhWwAAdjcP.jpg
'1881342109422428667',"Today, we celebrate the incredible life and legacy of Dr. Martin Luther King, Jr. who dedicated his life to expanding freedom for every American. https://t.co/XM59WwYgMy",en,Tweet,0,9,1,2,526,2025-01-20 14:04:47,"<a href=""http://twitter.com/download/iphone"" rel=""nofollow"">Twitter for iPhone</a>",,,photo,https://pbs.twimg.com/media/GhverSaXgAAVEsV.jpg
'1881328969309700274',"In Washington with my wife, Alice, my colleague, Rep. Lloyd Smucker, and his wife, Cindy, as we celebrate the return to freedom and democracy under President Donald J. Trump. https://t.co/zauQ9ihM2y",en,Tweet,0,26,1,8,886,2025-01-20 13:12:34,"<a href=""http://twitter.com/download/iphone"" rel=""nofollow"">Twitter for iPhone</a>",,,photo,https://pbs.twimg.com/media/GhvSudiWcAAPoLB.jpg
'1880297074253787502',"Had the opportunity to check out the preparations for President Trump’s inauguration on Monday with Cullen Murphy in @SpeakerJohnson’s office!

Excited to be joined in Washington by some of my constituents as we witness history on January 20th! https://t.co/eB2CmN3mi2",en,Tweet,1,16,2,6,2545,2025-01-17 16:52:11,"<a href=""http://twitter.com/download/iphone"" rel=""nofollow"">Twitter for iPhone</a>",,,photo,"https://pbs.twimg.com/media/GhgoOLsWgAAbtdw.jpg,https://pbs.twimg.com/media/GhgoOLsXYAADH5-.jpg"
'1879568362873016377',Enjoyed my discussion with Senate Majority Whip @SenJohnBarrasso on how the House and Senate can work together to quickly enact President Trump's agenda and make our nation energy dominant again. https://t.co/2WQD8lz4w0,en,Tweet,0,7,1,2,440,2025-01-15 16:36:33,"<a href=""https://mobile.twitter.com"" rel=""nofollow"">Twitter Web App</a>",,,photo,https://pbs.twimg.com/media/GhWRBT3XgAIG0SN.jpg
'1879221551004053517',"Read the full text of the Preserving Choice in Vehicle Purchases Act 👇
https://t.co/kXaSScLmYt",en,Reply,0,2,0,1,283,2025-01-14 17:38:26,"<a href=""https://mobile.twitter.com"" rel=""nofollow"">Twitter Web App</a>",,https://www.congress.gov/bill/119th-congress/house-bill/346,,
'1879221548315480537',"The Biden Admin’s decision to provide a waiver for California’s EV mandate restricts consumer freedom and stifles innovation.

I’m proud to reintroduce legislation to remove this waiver and ensure one state can’t tell American families what kind of car they can drive. https://t.co/VYkMjZ8vmQ",en,Tweet,2,10,4,3,1544,2025-01-14 17:38:26,"<a href=""https://mobile.twitter.com"" rel=""nofollow"">Twitter Web App</a>",,,video,https://video.twimg.com/ext_tw_video/1879213336614645760/pu/vid/avc1/1280x720/yG0BfSJyWxwFSujR.mp4?tag=12
'1877417184437100736',"Join me in celebrating the brave men and women in blue who faithfully and courageously serve our #PA13 communities everyday. 

Thank you for your selfless service! https://t.co/V13wjTMLbS",en,Tweet,0,5,1,4,559,2025-01-09 18:08:32,"<a href=""http://twitter.com/download/iphone"" rel=""nofollow"">Twitter for iPhone</a>",#PA13,,photo,"https://pbs.twimg.com/media/Gg3s-cxWQAEUpjh.jpg,https://pbs.twimg.com/media/Gg3s-cwWIAAZa7H.jpg"
'1877036411557171240',"Enjoyed meeting with Pennsylvania's newest Senator, @SenMcCormickPA, to discuss ways we can best work together for the people of Pennsylvania. 

Together, with President Trump's leadership, we are looking forward to securing our border and becoming energy dominant once again. https://t.co/PDYZJbgLQB",en,Tweet,0,86,7,7,12637,2025-01-08 16:55:28,"<a href=""http://twitter.com/download/iphone"" rel=""nofollow"">Twitter for iPhone</a>",,,photo,https://pbs.twimg.com/media/GgySqxIXAAADJfe.jpg
'1875315370225234023',"I was proud to stand with President Trump and cast my vote for Speaker Mike Johnson on the House floor today. We must get to work immediately to secure our borders, end the Biden Administration’s reckless spending, and advance President Trump’s agenda.",en,Tweet,2,75,9,19,2683,2025-01-03 22:56:40,"<a href=""http://twitter.com/download/iphone"" rel=""nofollow"">Twitter for iPhone</a>",,,,
'1874537113724821653',Our prayers are with the victims and loved ones of those killed in today’s horrific attack in New Orleans. Thank you to the brave law enforcement officers who responded in the face of danger and are working to ensure those accountable are brought to justice.,en,Tweet,0,7,2,5,1169,2025-01-01 19:24:09,"<a href=""http://twitter.com/download/iphone"" rel=""nofollow"">Twitter for iPhone</a>",,,,
'1874224996488536527',We Are! Best of luck to Penn State Football tonight as they compete in the Fiesta Bowl!,en,Tweet,0,13,0,5,671,2024-12-31 22:43:55,"<a href=""http://twitter.com/download/iphone"" rel=""nofollow"">Twitter for iPhone</a>",,,,
'1872816707179556931',"Our PA13 airports do incredible work to keep our communities connected. This holiday season, the Johnstown-Cambria County airport has worked tirelessly to ensure that families are together. https://t.co/WHiZbRaXMG",en,Tweet,0,5,0,6,698,2024-12-28 01:27:52,"<a href=""http://twitter.com/download/iphone"" rel=""nofollow"">Twitter for iPhone</a>",,,photo,https://pbs.twimg.com/media/Gf2U3lAWMAAVrT7.jpg
'1871914147153334541',"From our family to yours, Merry Christmas! https://t.co/cQh9PCVaU3",en,Tweet,1,26,4,5,677,2024-12-25 13:41:25,"<a href=""https://mobile.twitter.com"" rel=""nofollow"">Twitter Web App</a>",,,video,https://video.twimg.com/ext_tw_video/1871902633109196800/pu/vid/avc1/1280x720/8aQv9XjZCVr0ZvHz.mp4?tag=12
'1871692772199272573',"Merry Christmas Eve! Tonight, we celebrate the birth of Christ, and the hope and promise of the manger. https://t.co/W3pAddTGDR",en,Tweet,0,14,2,6,540,2024-12-24 23:01:45,"<a href=""http://twitter.com/download/iphone"" rel=""nofollow"">Twitter for iPhone</a>",,,photo,https://pbs.twimg.com/media/GfmWp2GWsAAPPiR.jpg
'1871245301014815110',Communities across our district are celebrating this Christmas with beautiful trees! We are truly blessed to call central Pennsylvania home. https://t.co/fgr7LUJeg4,en,Tweet,0,16,2,4,665,2024-12-23 17:23:40,"<a href=""http://twitter.com/download/iphone"" rel=""nofollow"">Twitter for iPhone</a>",,,photo,"https://pbs.twimg.com/media/Gff_rmBXUAAd1fl.jpg,https://pbs.twimg.com/media/Gff_rmAWkAAyP0P.jpg,https://pbs.twimg.com/media/Gff_rl9XEAAuCyp.jpg,https://pbs.twimg.com/media/Gff_rmAW4AA18zm.jpg"
'1870571717447254056',"We Are! Recently, I was proud to recognize this incredible Penn State team on the floor of the House. https://t.co/PPYnHMCnjx",en,Tweet,0,6,0,10,974,2024-12-21 20:47:05,"<a href=""https://mobile.twitter.com"" rel=""nofollow"">Twitter Web App</a>",,,video,https://video.twimg.com/ext_tw_video/1870571624958758913/pu/vid/avc1/1280x720/pZzRkDPQfs93AGVM.mp4?tag=12
'1870255418980594095',"It’s time to turn the page on Joe Biden’s failed Presidency.

Tonight’s vote will allow us to begin President Trump’s second term in a stronger position to cut government spending and get our country back on track.",en,Tweet,0,15,3,12,1024,2024-12-20 23:50:14,"<a href=""https://mobile.twitter.com"" rel=""nofollow"">Twitter Web App</a>",,,,
'1867600703062933829',"This morning, I had the chance to thank veterans who fought in the Battle of the Bulge at a ceremony in Bastogne. This week marks the 80th anniversary of the battle, and it was an honor to join these American heroes to celebrate their heroic legacy that will last forever. https://t.co/4brY79dufM",en,Tweet,0,24,2,17,3178,2024-12-13 16:01:20,"<a href=""https://mobile.twitter.com"" rel=""nofollow"">Twitter Web App</a>",,,photo,https://pbs.twimg.com/media/GesM5b4WwAAazOw.png
'1867316274038202805',"Leader Scalise is right. Violence is never the solution and the Senator's attempt to justify such heinous actions is wrong.

In #PA13, we're proud of our local heroes who acted quickly to protect their neighbors and arrest the lead suspect in this murder.",en,Tweet,0,12,4,4,1384,2024-12-12 21:11:07,"<a href=""https://mobile.twitter.com"" rel=""nofollow"">Twitter Web App</a>",#PA13,,,
'1866975632040624629',"The National Defense Authorization Act funds a pay raise for our troops, confronts Chinese aggression, and puts an end to the far-left policies of the Biden Administration. This bill is a victory for the men and women who serve our nation in uniform. https://t.co/Y84za8CcOj",en,Tweet,1,11,1,4,706,2024-12-11 22:37:32,"<a href=""https://mobile.twitter.com"" rel=""nofollow"">Twitter Web App</a>",,https://youtu.be/OJeL6h4jaMY,,
'1866251134052282564',"Congratulations to my friend @RepGuthrie on being named the next Chairman of @HouseCommerce!  Looking forward to working together to lower healthcare costs, support American energy, and invest in high-speed internet access for rural communities.",en,Tweet,0,14,3,9,1736,2024-12-09 22:38:38,"<a href=""http://twitter.com/download/iphone"" rel=""nofollow"">Twitter for iPhone</a>",,,,
'1866181770816729303',"Today, please join me in praying for Dr. Burgess and his family as they mourn the passing of their daughter, Christine.",en,Tweet,0,14,0,1,1203,2024-12-09 18:03:00,"<a href=""http://twitter.com/download/iphone"" rel=""nofollow"">Twitter for iPhone</a>",,,,
'1865433110029942799',"On #PearlHarborRemembranceDay, we recognize the courage of the men and women who fought to defend our nation at the onset of the Second World War. Their service and sacrifice must never be forgotten. https://t.co/f592LfMYFD",en,Tweet,0,7,1,5,449,2024-12-07 16:28:06,"<a href=""http://twitter.com/download/iphone"" rel=""nofollow"">Twitter for iPhone</a>",#PearlHarborRemembranceDay,,photo,https://pbs.twimg.com/media/GeNZhvbXkAEnndy.jpg
'1862883039983923437',Small Businesses are the heart of communities across our district. This #SmallBusinessSaturday is a great chance to support them for all that they do! https://t.co/wOB0OLRcwg,en,Tweet,0,10,1,12,604,2024-11-30 15:35:02,"<a href=""http://twitter.com/download/iphone"" rel=""nofollow"">Twitter for iPhone</a>",#SmallBusinessSaturday,,photo,https://pbs.twimg.com/media/GdpKQBNXsAAiBIw.jpg
'1862126113973014895',"Happy Thanksgiving! 

This Thanksgiving, we have so much to be thankful for - and I want to especially thank all our service members at home and abroad, and all those who are working tirelessly to keep our families safe, from our police to our firefighters and first responders. https://t.co/tWylKxG989",en,Tweet,0,13,0,5,530,2024-11-28 13:27:16,"<a href=""http://twitter.com/download/iphone"" rel=""nofollow"">Twitter for iPhone</a>",,,photo,https://pbs.twimg.com/media/GdeZ0F-WcAAtQrS.jpg
'1861777558544470050',"This week, I visited Keystone Woodworx in Cambria County to see firsthand the custom woodworking and designs behind their new and growing business. As we prepare to celebrate Thanksgiving, I’m grateful for the businesses across our district that create family sustaining jobs. https://t.co/mJioIxtTkY",en,Tweet,0,18,1,5,574,2024-11-27 14:22:14,"<a href=""http://twitter.com/download/iphone"" rel=""nofollow"">Twitter for iPhone</a>",,,photo,https://pbs.twimg.com/media/GdZc0PIWwAAv5--.jpg
'1859707526897705007',"On National Rural Health Day, we recognize the doctors, nurses, and healthcare professionals who care for patients in #PA13. In Congress, I’m proud to have created the Homegrown Healthcare Initiative, which brings medical students to train at hospitals here in our district. https://t.co/dshO7FfJh1",en,Tweet,0,5,1,11,522,2024-11-21 21:16:40,"<a href=""https://mobile.twitter.com"" rel=""nofollow"">Twitter Web App</a>",#PA13,,photo,https://pbs.twimg.com/media/Gc8CDjkWwAA4rGp.jpg
'1859047814531019105',Today marks the 161st anniversary of President Lincoln’s Gettysburg Address. It’s an honor to represent Gettysburg in Congress and support the incredible work that @GettysburgNMP does to keep the battle’s history alive. https://t.co/utbcKdF0Ko,en,Tweet,0,23,7,8,1324,2024-11-20 01:35:13,"<a href=""https://mobile.twitter.com"" rel=""nofollow"">Twitter Web App</a>",,,video,https://video.twimg.com/ext_tw_video/1859047758985891840/pu/vid/avc1/960x720/Su9u-LsZcRJTzdCi.mp4?tag=12
'1858323621296665039',Congratulations to my friend @BrendanCarrFCC on being named the next Chairman of the Federal Communications Commission. I look forward to continuing our work together to connect #PA13! https://t.co/vpfmLWjbaq,en,Tweet,0,16,3,9,907,2024-11-18 01:37:31,"<a href=""http://twitter.com/download/iphone"" rel=""nofollow"">Twitter for iPhone</a>",#PA13,,photo,https://pbs.twimg.com/media/GcoXe8HWoAA2gpX.jpg
'1857140889455313371',"Since coming to Congress, I’ve been dedicated to expanding access to high-quality, affordable health care for all patients. As a co-chair of @GOPDoctors, I’ll continue working with my colleagues to lower costs, increase transparency, and strengthen access to patient care.",en,Tweet,0,11,1,11,753,2024-11-14 19:17:46,"<a href=""https://mobile.twitter.com"" rel=""nofollow"">Twitter Web App</a>",,,,
'1856752783472369787',"It’s time to once again return to an economy that supports Pennsylvania families. This morning, President-Elect Donald Trump joined House Republicans in Washington to discuss his agenda for the next four years. Together, we’ll work to lower the cost of gas and groceries in #PA13. https://t.co/D7tkT8detv",en,Tweet,0,34,4,4,1429,2024-11-13 17:35:35,"<a href=""https://mobile.twitter.com"" rel=""nofollow"">Twitter Web App</a>",#PA13,,photo,https://pbs.twimg.com/media/GcSCy0LXQAApBl4.png
'1856410834672726085',"The Penn State University Wrestling Team stepped into the ring and stood up for their values. Today, I was proud to recognize them on the floor of the U.S. House of Representatives. https://t.co/UFvpMpYjXz",en,Tweet,0,13,1,1,592,2024-11-12 18:56:48,"<a href=""https://mobile.twitter.com"" rel=""nofollow"">Twitter Web App</a>",,https://youtu.be/F2TkCbAqR2c,,
'1851369697825993071',"Retail crime continues to hurt small businesses and make communities less safe. To address this issue I’m proud to cosponsor the Combating Organized Retail Crime Act, which would establish a coordinated federal response to fight organized retail crime and protect our communities.",en,Tweet,1,7,1,28,943,2024-10-29 21:05:07,"<a href=""https://mobile.twitter.com"" rel=""nofollow"">Twitter Web App</a>",,,,
'1850977828566675749',"The first responders across #PA13 work around the clock to protect and serve our communities. On National First Responders Day, please join me in thanking these brave men and women for all that they do. https://t.co/PnxEvWOlEq",en,Tweet,0,11,3,12,846,2024-10-28 19:07:58,"<a href=""https://mobile.twitter.com"" rel=""nofollow"">Twitter Web App</a>",#PA13,,photo,https://pbs.twimg.com/media/Ga_-gAJXYAEo3ub.jpg
'1848384938258710644',"Because of the inflation caused by the Biden-Harris Administration, Americans are struggling to make ends meet. It’s time to stop the runaway spending and lower prices for Pennsylvania families. https://t.co/TxqvM0EIdt",en,Tweet,1,12,3,31,1265,2024-10-21 16:24:45,"<a href=""https://mobile.twitter.com"" rel=""nofollow"">Twitter Web App</a>",,,photo,https://pbs.twimg.com/media/GabISTWWsAADJwm.jpg
'1845826492644655228',"Happy Columbus Day, #PA13! https://t.co/kSPzNcC1Gp",en,Tweet,0,11,5,40,706,2024-10-14 14:58:24,"<a href=""http://twitter.com/download/iphone"" rel=""nofollow"">Twitter for iPhone</a>",#PA13,,photo,https://pbs.twimg.com/media/GZ2xaMpWAAsq_Qd.jpg
'1843778460705235287',"Our hospitals work tirelessly to heal patients and get them on the road to recovery. This afternoon, I visited WellSpan Gettysburg Hospital and met with Dr. Paul Dende to see firsthand the incredible work that he and his team are doing to care for the Adams County community. https://t.co/n35OSLVCK5",en,Tweet,0,8,3,22,875,2024-10-08 23:20:15,"<a href=""http://twitter.com/download/iphone"" rel=""nofollow"">Twitter for iPhone</a>",,,photo,https://pbs.twimg.com/media/GZZqpetWoAAcKqP.jpg
'1843319886485086404',"One year after the barbaric attacks on the Israeli people, we remember the innocent civilians who were murdered and pray for the hostages still being held by Hamas terrorists. We must continue to stand with our Israeli allies as they confront this evil.",en,Tweet,0,9,3,5,576,2024-10-07 16:58:02,"<a href=""https://mobile.twitter.com"" rel=""nofollow"">Twitter Web App</a>",,,,
'1841194360278233392',"Today, we stand with the people of Israel as they come under a brutal attack from the Iranian regime. Please join me in praying for their continued safety. 🇺🇸🇮🇱 https://t.co/jVwuIVoypo",en,Tweet,0,4,0,16,660,2024-10-01 20:11:57,"<a href=""https://mobile.twitter.com"" rel=""nofollow"">Twitter Web App</a>",,,photo,https://pbs.twimg.com/media/GY08YyxXsAYJdLq.jpg
