tweet_id,text,language,type,bookmark_count,favorite_count,retweet_count,reply_count,view_count,created_at,client,hashtags,urls,media_type,media_urls
'1892369432313549050',"It was perhaps fitting that Munich was the site of the Trump Administration’s dramatic appeasement of the Kremlin dictator, when the Vice President attacked our western allies, and the Defense Secretary weakened our NATO alliance.  

But now the President has gone further, leaving Ukraine out of the negotiations over its own future and sacrificing our democratic ally in order to appease the Russian dictator.

In going so far as to parrot Putin’s false talking points and to blame Ukraine for being invaded and brutalized by Russia, Trump has undermined Ukraine’s position in potential negotiations with Russia and compromised our own national security interests.  

In one week, President Trump’s glaring weakness has done more damage to 80 years of bipartisan U.S. global leadership than all our adversaries could do, combined. 

We must ensure Ukraine receives the support and assistance it needs to defend itself against Russia’s unprovoked war, not leave this country to fend for itself. 

What ally will trust the United States now that our president has so badly betrayed a fellow democracy?",en,Tweet,104,4743,1239,1273,132706,2025-02-20 00:23:25,"<a href=""https://mobile.twitter.com"" rel=""nofollow"">Twitter Web App</a>",,,,
'1892355871293792753',"Thanks to Donald Trump – it's a great day to be a billionaire in America.

For the rest of us? Not so much. https://t.co/rwa21UT8kl",en,Tweet,33,2685,614,1622,91485,2025-02-19 23:29:32,"<a href=""https://mobile.twitter.com"" rel=""nofollow"">Twitter Web App</a>",,,video,https://video.twimg.com/ext_tw_video/1892355812191789056/pu/vid/avc1/1920x1080/nZGNoU9wqonrKjX7.mp4?tag=14
'1892344098054414683',I'm headed to the Senate floor to speak out against Donald Trump's multi-trillion dollar billionaire tax cut. Tune in: https://t.co/fgXftv7d7l,en,Tweet,68,3705,1021,2209,126674,2025-02-19 22:42:45,"<a href=""https://studio.twitter.com"" rel=""nofollow"">Twitter Media Studio</a>",,https://x.com/i/broadcasts/1yoKMoNEaepJQ,,
'1892272460042518867',"Trump’s sordid appeasement of the Russian dictator will go down in infamy. 

Not since Czechoslovakia has a democratic state been so betrayed by a western power.",en,Tweet,169,13539,2107,3939,679426,2025-02-19 17:58:05,"<a href=""https://mobile.twitter.com"" rel=""nofollow"">Twitter Web App</a>",,,,
'1892243995264217487',"When CA or any state struggles to respond to devastating wildfires this year:

It won't be because ""the spigots"" are closed. 

There are no such spigots. 

But it just may be that when we needed help the most – firefighters' jobs got cut to pay for billionaire tax cuts.",en,Tweet,8,375,152,258,56535,2025-02-19 16:04:59,"<a href=""https://mobile.twitter.com"" rel=""nofollow"">Twitter Web App</a>",,,,
'1892015528308351046',"“You should have never started it.”

Such ignominious ignorance. 

Such betrayal of our ally. 

Such a cowardly surrender. https://t.co/0uAGkucWjq",en,Tweet,292,24877,3998,3929,603971,2025-02-19 00:57:08,"<a href=""https://mobile.twitter.com"" rel=""nofollow"">Twitter Web App</a>",,,photo,https://pbs.twimg.com/media/GkHKApMWUAAG9Vs.jpg
'1891978012536484251',"Why has Donald Trump been indicted more than any other president in history?

Well, here’s the answer: https://t.co/sYamcOfDH4",en,Tweet,328,9540,3063,7584,411796,2025-02-18 22:28:04,"<a href=""https://mobile.twitter.com"" rel=""nofollow"">Twitter Web App</a>",,,video,https://video.twimg.com/ext_tw_video/1891977955481473024/pu/vid/avc1/1920x1080/dG1YgNW8Z2Znpo8j.mp4?tag=14
'1891950750680379672',"Cutting funding at a time when California and other states remain so vulnerable makes no sense.

When disaster strikes again, we need to be prepared, not underfunded and understaffed. https://t.co/MJYg7igeYu",en,Tweet,10,377,152,817,39700,2025-02-18 20:39:44,"<a href=""https://mobile.twitter.com"" rel=""nofollow"">Twitter Web App</a>",,,photo,https://pbs.twimg.com/media/GkGPJvMXoAAAGvX.jpg
'1891929306265264346',"Another shoe drops.

The acting commissioner of the Social Security Administration resigned after DOGE sought access to highly sensitive recipient information.

Trump &amp; Musk’s effort to steal your data and gut your hard-earned benefits continues.

While the GOP remains silent.",en,Tweet,205,10516,3479,15349,1083849,2025-02-18 19:14:31,"<a href=""https://mobile.twitter.com"" rel=""nofollow"">Twitter Web App</a>",,,,
'1891860364049920108',"Guns are the number one killer of kids in this country. But right now, in many states, a teenager can buy an assault-style weapon.

I'm a cosponsor of the Age 21 Act to prohibit the sale or possession of assault-style weapons to those under 21. 

It's just common sense.",en,Tweet,44,3616,644,7455,388048,2025-02-18 14:40:34,"<a href=""https://mobile.twitter.com"" rel=""nofollow"">Twitter Web App</a>",,,,
'1891679868783366389',"Wherein Elon says the quiet, corrupt part out loud: 

He intends to steal the private IRS data of his political enemies. 

How soon before he does the same to his economic competitors?

Or you? https://t.co/3WMgM1dgOd",en,Tweet,173,6640,2154,7188,358648,2025-02-18 02:43:21,"<a href=""http://twitter.com/download/iphone"" rel=""nofollow"">Twitter for iPhone</a>",,,photo,https://pbs.twimg.com/media/GkCY0NMXoAAbGhf.jpg
'1891558441027531159',"""The benign influence of good laws under a free government... the happy reward, as I trust, of our mutual cares, labors and dangers.""

George Washington’s words 229 years ago, a reminder of how far we are falling short of his vision. 

And how vital it is that we defend the cherished work of our founders.",en,Tweet,14,636,182,1200,72679,2025-02-17 18:40:50,"<a href=""http://twitter.com/download/iphone"" rel=""nofollow"">Twitter for iPhone</a>",,,,
'1891530602257551815',"Housing costs. Up.
Food costs. Way up.
Cancer research. Down.

Californians are already feeling the impacts of the Trump Musk  “billionaire-first” agenda. https://t.co/H8HrVuIWJ1",en,Tweet,70,4653,1317,5304,242212,2025-02-17 16:50:13,"<a href=""https://mobile.twitter.com"" rel=""nofollow"">Twitter Web App</a>",,,video,https://video.twimg.com/ext_tw_video/1891530325240475648/pu/vid/avc1/1920x1080/kEcdRXjUpxMar8ML.mp4?tag=14
'1891508397511520375',"Elon Musk is trying to access your personal bank and tax data.

The world’s richest man should not and cannot be able to snoop around your personal finances.

Period. End of story.",en,Tweet,549,26206,6372,43106,3270907,2025-02-17 15:21:59,"<a href=""http://twitter.com/download/iphone"" rel=""nofollow"">Twitter for iPhone</a>",,,,
'1891292579230056774',"Donald Trump and Elon Musk need to come up with trillions for a tax break for the wealthiest Americans. 

And to pay for it, everything is on the chopping block. https://t.co/1Je1Qnrxlg",en,Tweet,39,2358,778,2034,146171,2025-02-17 01:04:24,"<a href=""http://twitter.com/download/iphone"" rel=""nofollow"">Twitter for iPhone</a>",,,video,https://video.twimg.com/amplify_video/1891292408224104449/vid/avc1/1920x1080/PSNY2eCeqauhgHtn.mp4?tag=16
'1891181346942325098',"Received this plaque from the Army to display in my Senate office.

A beautiful reminder of our service members and their patriotism – including my father, Ed, who served in the Army and whom we lost last year at age 96. https://t.co/6ZOdmPUTzf",en,Tweet,12,1730,198,1223,100286,2025-02-16 17:42:24,"<a href=""https://mobile.twitter.com"" rel=""nofollow"">Twitter Web App</a>",,,photo,"https://pbs.twimg.com/media/Gj7TYUWW0AAy5ph.jpg,https://pbs.twimg.com/media/Gj7TZYOW8AAtfJa.jpg"
'1891141484344144301',"JD Vance's remarks here at the Munich Security Conference were an attack on our allies and a gift to the Kremlin.

Exactly the wrong message right now. https://t.co/lBEFRHq5Ne",en,Tweet,91,6544,1509,3962,282452,2025-02-16 15:04:00,"<a href=""http://twitter.com/download/iphone"" rel=""nofollow"">Twitter for iPhone</a>",,,video,https://video.twimg.com/amplify_video/1891141390832193536/vid/avc1/1920x1080/yalwyWv2wDLevfGJ.mp4?tag=16
'1890900987633643707',"124+ journalists were killed last year. The deadliest year for reporters on record.

A free press is at the core of democracy. It is necessary to safeguard human rights.

We must keep up the work to protect journalists from coercion and murder, and safeguard their critical work.",en,Tweet,136,1963,418,2813,2649899,2025-02-15 23:08:21,"<a href=""https://mobile.twitter.com"" rel=""nofollow"">Twitter Web App</a>",,,,
'1890877518179094899',Spoken like a true dictator.,en,Tweet,471,66582,4676,9789,2780976,2025-02-15 21:35:05,"<a href=""http://twitter.com/download/iphone"" rel=""nofollow"">Twitter for iPhone</a>",,,,
'1890703490084663442',"Thank you for your leadership and your determination, @ZelenskyyUa.

We stand with you.",en,Tweet,145,15568,2399,7190,898807,2025-02-15 10:03:34,"<a href=""http://twitter.com/download/iphone"" rel=""nofollow"">Twitter for iPhone</a>",,,,
'1890508941039157737',So much for draining the swamp. Here's something really important you probably missed this week: https://t.co/R4bgOfKQsu,en,Tweet,77,1727,639,2310,118506,2025-02-14 21:10:30,"<a href=""https://studio.twitter.com"" rel=""nofollow"">Twitter Media Studio</a>",,,video,https://video.twimg.com/amplify_video/1890504877048053760/vid/avc1/1280x720/0q2TsnpPEKbYhKnU.mp4?tag=14
'1890476030407692567',"RESPECT

https://t.co/pX0qyauzfY",en,Tweet,3,498,71,349,31874,2025-02-14 18:59:43,"<a href=""http://twitter.com/download/iphone"" rel=""nofollow"">Twitter for iPhone</a>",,https://www.nbcnews.com/news/amp/rcna192030,,
'1890415007113822426',"Happy Valentine's Day to my amazing wife and forever valentine, Eve. https://t.co/qdGmv6EhNP",en,Tweet,34,7819,431,5215,277618,2025-02-14 14:57:14,"<a href=""http://twitter.com/download/iphone"" rel=""nofollow"">Twitter for iPhone</a>",,,photo,https://pbs.twimg.com/media/GjwabczXsAE5uJD.jpg
'1890188594935120104',"If we confirm Kash Patel, knowing what we are getting, we will only have ourselves to blame. https://t.co/PYhVaAUNZx",en,Tweet,133,3911,772,9884,1251754,2025-02-13 23:57:33,"<a href=""https://mobile.twitter.com"" rel=""nofollow"">Twitter Web App</a>",,,video,https://video.twimg.com/ext_tw_video/1890187419690889216/pu/vid/avc1/1920x1080/9yU7oMHCLybKVyPE.mp4?tag=14
'1890158041011523908',"Each of Trump’s nominees for AG, Deputy AG and FBI Director were asked if they would resign before taking action they thought illegal or improper and none would commit to doing so. 

Here SDNY prosecutors did exactly that — refusing to dismiss bribery charges against an elected official for blatantly political reasons.

Hats off to SDNY for showing integrity and guts.",en,Tweet,17,483,142,425,116883,2025-02-13 21:56:09,"<a href=""http://twitter.com/download/iphone"" rel=""nofollow"">Twitter for iPhone</a>",,,,
'1890144165276840097',"We shouldn't be surprised the American people have lost confidence in the Department of Justice and FBI.

Donald Trump and his loyalists have been trashing them – without cause –  for years.

And confirming Kash Patel will only add fuel to the fire. https://t.co/5MHsSmdAW6",en,Tweet,40,2811,713,5420,264770,2025-02-13 21:01:00,"<a href=""https://mobile.twitter.com"" rel=""nofollow"">Twitter Web App</a>",,,video,https://video.twimg.com/ext_tw_video/1890144111539150848/pu/vid/avc1/1920x1080/mXTxgUdmMMAXfJzb.mp4?tag=14
'1890124054788780172',"Thanks, Elon. My salary is public, as is my financial report. But since you ask, when will you be releasing yours?",en,Tweet,1272,98911,10108,16439,5496485,2025-02-13 19:41:06,"<a href=""http://twitter.com/download/iphone"" rel=""nofollow"">Twitter for iPhone</a>",,,,
'1890110724346970121',"Positive news for CA. @SenatorTimScott and my bipartisan SBA Disaster Transparency Act passed the Small Business Committee this week.

It's the next step in ensuring disaster survivors – in California and beyond – have access to the SBA funding they need to recover and rebuild. https://t.co/fgpTEJKbcv",en,Tweet,3,253,51,314,44800,2025-02-13 18:48:07,"<a href=""https://mobile.twitter.com"" rel=""nofollow"">Twitter Web App</a>",,,photo,https://pbs.twimg.com/media/GjsEIgAW0AAwojO.jpg
'1890088654003138833',"It is imperative that the Senate learn the full extent of Kash Patel's foreign business dealings and entanglements. With the CCP. With the Kremlin.

We need answers. https://t.co/ys9x2Qv8ly",en,Tweet,63,2576,848,4427,254085,2025-02-13 17:20:25,"<a href=""https://mobile.twitter.com"" rel=""nofollow"">Twitter Web App</a>",,,video,https://video.twimg.com/ext_tw_video/1890084377624707072/pu/vid/avc1/1920x1080/RZfjfov2aghArF8x.mp4?tag=14
'1890058573700608174',"When given the choice between protecting public health and indulging conspiracy theories, RFK Jr. has chosen conspiracy every single time. https://t.co/1SzY47jciY",en,Tweet,9,894,216,1456,76794,2025-02-13 15:20:54,"<a href=""https://mobile.twitter.com"" rel=""nofollow"">Twitter Web App</a>",,,video,https://video.twimg.com/ext_tw_video/1890058403398955008/pu/vid/avc1/1920x1080/fcuL6oGKVdRUUuWK.mp4?tag=14
'1890043662538858757',"RFK Jr. will not make America healthy again.

But his ignorance may make people sick again.
Deprive them of the treatment they need again.
Cause hospitals to close again.

We have to vote like our lives depend on it. Because for many Americans – it will. https://t.co/yuI5PwxNdy",en,Tweet,145,7377,1622,7524,537603,2025-02-13 14:21:39,"<a href=""http://twitter.com/download/iphone"" rel=""nofollow"">Twitter for iPhone</a>",,,video,https://video.twimg.com/amplify_video/1890043540832473088/vid/avc1/1920x1080/Di4w16BMEx9L-H3I.mp4?tag=16
'1890022315532173351',"The Senate’s role in confirmations according to JD Vance:

Advice and go f*** yourself. https://t.co/EmGUg4phec",en,Tweet,147,2692,893,1234,137711,2025-02-13 12:56:49,"<a href=""https://mobile.twitter.com"" rel=""nofollow"">Twitter Web App</a>",,,video,https://video.twimg.com/ext_tw_video/1890022121989980160/pu/vid/avc1/1080x1920/NJjhc__RXx9blTqZ.mp4?tag=14
'1889912369452818463',I'm headed to the Senate floor to speak out against RFK Jr.'s nomination. Tune in: https://t.co/2B9cpe9l7B,en,Tweet,50,2355,406,2503,137001,2025-02-13 05:39:56,"<a href=""https://studio.twitter.com"" rel=""nofollow"">Twitter Media Studio</a>",,https://x.com/i/broadcasts/1rmGPyanvvqJN,,
'1889887619376636244',"Tonight I'll be holding the Senate floor and doing everything I can to stop RFK Jr.'s nomination.

If you're awake, tune in at 1am ET here, or on YouTube.",en,Tweet,220,9912,1164,19159,46583417,2025-02-13 04:01:35,"<a href=""https://mobile.twitter.com"" rel=""nofollow"">Twitter Web App</a>",,,,
'1889832378836918532',"I asked Trump’s nominee for Deputy AG whether he would commit to releasing volume 2 of Special Counsel Smith’s investigation.

A criminal defense lawyer still representing Trump would say “no.”

A Deputy AG representing the American people would say “yes.”

Here was his answer: https://t.co/JzpTzmdvqg",en,Tweet,52,1327,436,1225,215517,2025-02-13 00:22:05,"<a href=""https://mobile.twitter.com"" rel=""nofollow"">Twitter Web App</a>",,,video,https://video.twimg.com/ext_tw_video/1889832206152916992/pu/vid/avc1/1920x1080/QEpsNTlyaki7krLF.mp4?tag=14
'1889803264700588376',"""You just gave a purely hypothetical"" 

No. It's right there in black and white, Mr. Blanche. https://t.co/YGs7Gw8ftT",en,Tweet,90,2058,520,758,156136,2025-02-12 22:26:23,"<a href=""https://mobile.twitter.com"" rel=""nofollow"">Twitter Web App</a>",,,video,https://video.twimg.com/ext_tw_video/1889803140880281600/pu/vid/avc1/1920x1080/WJ1PI2oCQJzCgqWE.mp4?tag=14
'1889783669017006223',"Donald Trump illegally fired 19 inspectors general.

The law requires notice to Congress and a case-by-case justification. It is not optional.

Congress must convene a bipartisan hearing to examine these unlawful acts and how they can be remedied. Immediately. https://t.co/IxNouRajoI",en,Tweet,222,10420,3083,3978,282882,2025-02-12 21:08:31,"<a href=""https://mobile.twitter.com"" rel=""nofollow"">Twitter Web App</a>",,,photo,"https://pbs.twimg.com/media/GjncKyYXIAA2WBJ.jpg,https://pbs.twimg.com/media/GjncLy3XEAAOSVu.jpg"
'1889771835115381035',"I asked Todd Blanche – Donald Trump's personal defense lawyer and nominee for Deputy Attorney General – whether he'd commit to preserving evidence in the January 6 and Mar-a-Lago investigations.

He could not say yes. https://t.co/WyVw7m3IaD",en,Tweet,67,2270,740,1336,138081,2025-02-12 20:21:30,"<a href=""https://mobile.twitter.com"" rel=""nofollow"">Twitter Web App</a>",,,video,https://video.twimg.com/ext_tw_video/1889771617045082112/pu/vid/avc1/1280x720/-NVPlITXPsN4cRCV.mp4?tag=12
'1889762940968141163',"Today, President Trump called our enemy, Russia, before calling our ally, Ukraine. 

Meanwhile, his Secretary of Defense, ruled out a future for Ukraine in NATO and a restoration of Ukrainian sovereignty over its own lands.

Let’s not mince words about what this represents: a surrender of Ukraine’s interests and our own, even before negotiations begin. 

Trump’s a great dealmaker all right — for the Kremlin.",en,Tweet,1294,51629,10372,16925,2898870,2025-02-12 19:46:09,"<a href=""http://twitter.com/download/iphone"" rel=""nofollow"">Twitter for iPhone</a>",,,,
'1889699244325417110',"Do we possess the basic common sense — for the sake of our country, our most classified materials, and our intelligence professionals — to vote down Tulsi Gabbard? We will soon find out. https://t.co/kcOBODObJm",en,Tweet,13,1308,309,2107,139094,2025-02-12 15:33:03,"<a href=""https://mobile.twitter.com"" rel=""nofollow"">Twitter Web App</a>",,,video,https://video.twimg.com/ext_tw_video/1889699146845577216/pu/vid/avc1/1920x1080/Mb2H0CAKiltTDaSh.mp4?tag=14
'1889680628578140348',Southern California – expect lots of rain over the next couple of days. Here's what you need to know: https://t.co/sREp8xbuOI,en,Tweet,4,243,73,641,36317,2025-02-12 14:19:05,"<a href=""https://mobile.twitter.com"" rel=""nofollow"">Twitter Web App</a>",,,video,https://video.twimg.com/ext_tw_video/1889680421492797440/pu/vid/avc1/1080x1920/yaBEe4aHN19f_-hN.mp4?tag=14
'1889521941779779651',"Under oath, Kash Patel said he was unaware of plans to dismiss FBI agents before he was confirmed.

Today, whistleblowers revealed Patel was reportedly directing those dismissals. Covertly. 

Yet another reason he must be rejected.",en,Tweet,632,45004,8525,13646,1432450,2025-02-12 03:48:31,"<a href=""https://mobile.twitter.com"" rel=""nofollow"">Twitter Web App</a>",,,,
'1889505666424844562',"At a time when our allies and adversaries are questioning America's leadership on the global stage, we cannot afford to confirm a Director of National Intelligence who lacks the judgment, qualifications, and credibility to lead. https://t.co/oskPPZ5qAl",en,Tweet,21,1750,453,1480,78661,2025-02-12 02:43:50,"<a href=""https://mobile.twitter.com"" rel=""nofollow"">Twitter Web App</a>",,,video,https://video.twimg.com/ext_tw_video/1889505520358211584/pu/vid/avc1/1920x1080/_9ut2N11U6gprRQT.mp4?tag=14
'1889492302395220017',"As a former community college adjunct professor, I have always believed that teaching the next generation is one of the most important things we can do.

California's community colleges open the doors of higher education to everyone. Glad to have the chance to speak with their representatives on Capitol Hill today.",en,Tweet,5,450,88,591,48182,2025-02-12 01:50:44,"<a href=""http://twitter.com/download/iphone"" rel=""nofollow"">Twitter for iPhone</a>",,,photo,"https://pbs.twimg.com/media/GjjTPCXXEAAXJnv.jpg,https://pbs.twimg.com/media/GjjTPCWWQAAcVyo.jpg"
'1889474607435882687',"Another day. Another watchdog fired. Another law broken.  

And still more silence from the GOP.",en,Tweet,109,9025,2120,4118,391376,2025-02-12 00:40:25,"<a href=""http://twitter.com/download/iphone"" rel=""nofollow"">Twitter for iPhone</a>",,,,
'1889461928759640504',California farmers and consumers will be the ones who have to pay the price of Trump's tariffs. https://t.co/9QN8oa1HQw,en,Tweet,6,569,177,577,43224,2025-02-11 23:50:02,"<a href=""https://mobile.twitter.com"" rel=""nofollow"">Twitter Web App</a>",,,video,https://video.twimg.com/ext_tw_video/1889461876364357632/pu/vid/avc1/1920x1080/muEU2Bf4do2wwI9I.mp4?tag=14
'1889423591738855771',"Senators that support the confirmation of Trump's most dangerous nominees are going to have to own that decision.

But at the end of the day, it's the American people who will suffer. https://t.co/V8Q44rGC8k",en,Tweet,28,2140,561,2296,102723,2025-02-11 21:17:42,"<a href=""https://mobile.twitter.com"" rel=""nofollow"">Twitter Web App</a>",,,video,https://video.twimg.com/ext_tw_video/1889423421341102080/pu/vid/avc1/1920x1080/MP3GM7Q0vJ59qP-8.mp4?tag=14
'1889406758344597965',As relevant as ever. https://t.co/DyDcQEBMLV,en,Tweet,28,2664,538,1168,92916,2025-02-11 20:10:49,"<a href=""http://twitter.com/download/iphone"" rel=""nofollow"">Twitter for iPhone</a>",,,photo,https://pbs.twimg.com/media/GjiFbrnWwAAnqGq.jpg
'1889368456564199441',The story of Tulsi Gabbard's visit with two Syrian children orphaned as a result of Assad's regime tells you everything you need to know about her. Here it is: https://t.co/dvKSC4IOos,en,Tweet,45,1220,460,956,61163,2025-02-11 17:38:37,"<a href=""https://mobile.twitter.com"" rel=""nofollow"">Twitter Web App</a>",,,video,https://video.twimg.com/ext_tw_video/1889365725829087232/pu/vid/avc1/1920x1080/UuCnQHxcsbXyKS8E.mp4?tag=14
'1889331745608130638',It is hard to imagine someone more disqualified to run our intelligence agencies than Tulsi Gabbard. https://t.co/jsqjqedod2,en,Tweet,93,4969,1152,5831,709801,2025-02-11 15:12:44,"<a href=""https://mobile.twitter.com"" rel=""nofollow"">Twitter Web App</a>",,,video,https://video.twimg.com/ext_tw_video/1889331610132049920/pu/vid/avc1/1920x1080/e4Aa1rjH5kfusiYZ.mp4?tag=14
'1889309101647147313',"Tulsi Gabbard's bizarre fondness for murderous foreign despots is not beside the point.

It is precisely the point. And her nomination is a walking five-alarm fire.

She must be rejected. https://t.co/7bxB4UsGgp",en,Tweet,163,12110,3054,5755,601596,2025-02-11 13:42:46,"<a href=""https://mobile.twitter.com"" rel=""nofollow"">Twitter Web App</a>",,,video,https://video.twimg.com/ext_tw_video/1889307928156340224/pu/vid/avc1/1920x1080/HZ74qHhKA0o694YD.mp4?tag=14
'1889163525639053558',We're using every lever we can to stand up to Donald Trump and protect the American people. https://t.co/q566MsHGN5,en,Tweet,38,1936,404,4122,157403,2025-02-11 04:04:18,"<a href=""https://mobile.twitter.com"" rel=""nofollow"">Twitter Web App</a>",,,video,https://video.twimg.com/ext_tw_video/1889163342633127936/pu/vid/avc1/1280x720/WqzOcm2RyXf-Wp6r.mp4?tag=12
'1889129755133276184',To my Republican colleagues – where do you draw the line with Donald Trump? https://t.co/US8rriz3QX,en,Tweet,198,10223,2547,5188,412979,2025-02-11 01:50:06,"<a href=""http://twitter.com/download/iphone"" rel=""nofollow"">Twitter for iPhone</a>",,,video,https://video.twimg.com/amplify_video/1889129511532281857/vid/avc1/1920x1080/bucVFAZ-YwmMyy1h.mp4?tag=16
'1889114425933660561',"This is the letter I sent.

If Elon Musk is now a government employee, he is subject to conflicts of interest law.

Requirements he seems to be completely ignoring. The American people deserve answers and accountability.

Instead... more Trump purges. https://t.co/lVGcrQFnHM",en,Reply,476,9308,1257,964,302869,2025-02-11 00:49:11,"<a href=""http://twitter.com/download/iphone"" rel=""nofollow"">Twitter for iPhone</a>",,,photo,"https://pbs.twimg.com/media/Gjd7juTXMAAC5iN.jpg,https://pbs.twimg.com/media/Gjd7juQXEAEp6Og.jpg,https://pbs.twimg.com/media/Gjd7juRWwAA2oZl.jpg"
'1889114419897983102',"This morning, I sent a letter to the Office of Government Ethics (OGE) regarding @elonmusk's potential conflicts of interest.

Within minutes, the White House confirmed receipt.

By noon, President Trump fired the Director of OGE.

I want to know: Was this to prevent his answer?",en,Tweet,3285,67447,12722,12100,3262094,2025-02-11 00:49:10,"<a href=""http://twitter.com/download/iphone"" rel=""nofollow"">Twitter for iPhone</a>",,,,
'1889098767850172860',I have some things to say about Tulsi Gabbard's nomination for Director of National Intelligence. I'm headed to the Senate floor. Tune in: https://t.co/21VAdwczTP,en,Tweet,84,2871,896,2356,128336,2025-02-10 23:46:58,"<a href=""https://studio.twitter.com"" rel=""nofollow"">Twitter Media Studio</a>",,https://x.com/i/broadcasts/1nAKEgmPdneJL,,
'1889066814153662490',"The swamp is back. 

With a vengeance.",en,Tweet,143,9179,1725,4291,609224,2025-02-10 21:40:00,"<a href=""https://mobile.twitter.com"" rel=""nofollow"">Twitter Web App</a>",,,,
'1889031349656314355',"Big rains headed for SoCal this week.

Expect multiple inches of rain — and stay vigilant for warnings about flooding and landslides.",en,Tweet,3,385,67,312,42413,2025-02-10 19:19:04,"<a href=""https://mobile.twitter.com"" rel=""nofollow"">Twitter Web App</a>",,,,
'1889015299925831764',"Need more $ for tax cuts for billionaires? Cut funding for cancer research. 

Need a few extra bucks for a corporate cash grab? Cut Special Education.

Donald Trump and Elon Musk's last few weeks aren't hard to understand. Just follow the money.",en,Tweet,56,3287,948,3306,167477,2025-02-10 18:15:18,"<a href=""https://mobile.twitter.com"" rel=""nofollow"">Twitter Web App</a>",,,,
'1888943175110209753',"Transnational repression is on the rise around the globe.

As a democracy – we must do everything we can to push back.

To secure our collective values of freedom and justice against those who would seek to tear them down. Thank you @freedomhouse for documenting this.",en,Tweet,6,329,101,693,134433,2025-02-10 13:28:42,"<a href=""https://mobile.twitter.com"" rel=""nofollow"">Twitter Web App</a>",,,,
