tweet_id,text,language,type,bookmark_count,favorite_count,retweet_count,reply_count,view_count,created_at,client,hashtags,urls,media_type,media_urls
'1886565671808405527',"CONFIRMED! Congratulations to Secretary of Energy, Chris Wright.

Under Secretary Wright's leadership, we will increase domestic energy production, achieve President Trump’s agenda, and MAKE AMERICA ENERGY INDEPENDENT again! 🇺🇸",en,Tweet,2,88,5,3,4953,2025-02-04 00:01:21,"<a href=""http://twitter.com/download/iphone"" rel=""nofollow"">Twitter for iPhone</a>",,,,
'1886480076256014828',https://t.co/Oysyem8Dlg,zxx,Reply,1,13,1,1,1751,2025-02-03 18:21:13,"<a href=""http://twitter.com/download/iphone"" rel=""nofollow"">Twitter for iPhone</a>",,,photo,https://pbs.twimg.com/media/Gi4fodWXwAAD2oR.jpg
'1886480070987923613',"On Friday, after business hours and hours before Director Chopra resigned, the CFPB furiously prepared electronic notices of CIDs for businesses across the country. 

These are basically subpoenas that require public disclosure and could have adversely impacted the value of any company that received the subpoena because of the inherent allegations that impropriety exists. 

It’s absurd to allege that new evidence was uncovered in the final hours of Director Chopra’s term warranting dozens or hundreds of new investigations. 

On Sunday, I sent this letter to the then-Acting Director Martinez asking to stop what I believe was an abuse of power. I also reached out to members of the FSC Committee and the White House. 

Less than 48 hours later, everything has been fixed, the CIDs will not be valid, and the further weaponization of Government has been halted.

So much winning… the world is healing. The U.S. will again be the best place in the world to start and grow a business.",en,Tweet,1,39,5,4,5078,2025-02-03 18:21:12,"<a href=""http://twitter.com/download/iphone"" rel=""nofollow"">Twitter for iPhone</a>",,,,
'1886471637920346274',"I fully support @RepMTG’s call for the CEO’s of NPR and PBS to testify before the @GOPoversight DOGE subcommittee. Taxpayer-funded media must answer for their bias and lack of accountability. The American people deserve transparency!

https://t.co/HfvzorZvYc",en,Tweet,19,2203,356,158,63553,2025-02-03 17:47:42,"<a href=""http://twitter.com/download/iphone"" rel=""nofollow"">Twitter for iPhone</a>",,https://www.foxnews.com/media/doge-subcommittee-invites-npr-pbs-chiefs-testify-federal-funding-systemically-biased-content,,
'1885725001820565900',"Keith Siegel was held hostage by Hamas terrorists for 484 days. 

Today, he returned home.

Thank you @POTUS for working diligently to secure his freedom. https://t.co/AHGUx5t0Q4",en,Tweet,0,40,2,4,1216,2025-02-01 16:20:50,"<a href=""http://twitter.com/download/iphone"" rel=""nofollow"">Twitter for iPhone</a>",,,photo,https://pbs.twimg.com/media/Gitw5OPXQAAMiG6.jpg
'1885401466375975024',"Every child deserves access to a quality education that fits their unique needs. In line with @POTUS’s unwavering commitment to expanding school choice, I will always fight for parents’ rights to choose the best school for their kids. 

#schoolchoiceweek https://t.co/Ww8oRwRgcZ",en,Tweet,0,24,5,8,1420,2025-01-31 18:55:13,"<a href=""http://twitter.com/download/iphone"" rel=""nofollow"">Twitter for iPhone</a>",#schoolchoiceweek,,photo,https://pbs.twimg.com/media/GipKpBEWMAE1x2D.jpg
'1885095372013412460',"Happy birthday to Speaker @MikeJohnson. With your leadership, Republican majorities, and President Trump in the White House, we will deliver many great wins for the American people! 🇺🇸 https://t.co/oKtMjxSW1d",en,Tweet,1,26,0,1,1104,2025-01-30 22:38:54,"<a href=""http://twitter.com/download/iphone"" rel=""nofollow"">Twitter for iPhone</a>",,,photo,https://pbs.twimg.com/media/Gik0QB9XoAADZt9.jpg
'1885005120695386300',"Last night, America suffered a terrible tragedy. Please join me in praying for those who lost their lives, their families, and loved ones. We are grateful to the first responders who worked tirelessly at the scene.",en,Tweet,0,21,1,5,940,2025-01-30 16:40:17,"<a href=""http://twitter.com/download/iphone"" rel=""nofollow"">Twitter for iPhone</a>",,,,
'1884802541617099060',"The White House has confirmed that a commercial airliner has collided with a military helicopter while heading towards Reagan National Airport.

While search and rescue efforts are underway, we are praying for the victims and their families. 

 https://t.co/NVXmtwKDcP",en,Tweet,1,16,3,2,2567,2025-01-30 03:15:18,"<a href=""http://twitter.com/download/iphone"" rel=""nofollow"">Twitter for iPhone</a>",,,video,https://video.twimg.com/ext_tw_video/1884796824944300032/pu/vid/avc1/1280x720/PNNC7aqucmDB5YeT.mp4?tag=12
'1884691418905797097',"President Trump just signed the Laken Riley Act, delivering on his promise to secure our communities.

This law ensures that illegal migrants charged with violent crimes are detained, preventing further tragedies like Laken’s.

Today, we honor Laken’s memory and celebrate a safer America for ALL its citizens.",en,Tweet,0,29,4,1,831,2025-01-29 19:53:44,"<a href=""http://twitter.com/download/iphone"" rel=""nofollow"">Twitter for iPhone</a>",,,photo,https://pbs.twimg.com/media/GifDhi_XoAArSbu.jpg
'1884683316135161979',"President Trump on his way to sign the first legislation of his second term, The Laken Riley Act.

God bless America! 🇺🇸 https://t.co/HKC6tRwpi0",en,Tweet,5,220,36,20,6323,2025-01-29 19:21:32,"<a href=""http://twitter.com/download/iphone"" rel=""nofollow"">Twitter for iPhone</a>",,,photo,https://pbs.twimg.com/media/Gie9fMZWsAARfa0.jpg
'1884634294183662047',"“The U.S. has worse health than any developed nation, and yet we spend more than anyone else. We can’t be a strong nation when our people are so sick” -@RobertKennedyJr.

Bobby’s sincere desire to work with Congress and @realDonaldTrump to make America a healthier place is clear. 

CONFIRM KENNEDY! 🇺🇸",en,Tweet,0,40,8,6,1507,2025-01-29 16:06:45,"<a href=""http://twitter.com/download/iphone"" rel=""nofollow"">Twitter for iPhone</a>",,,photo,https://pbs.twimg.com/media/GiePCKPaAAAWGXj.jpg
'1884035653048148003',"Congratulations to South Carolina’s own Scott Bessent, our new Treasury Secretary! 

With Secretary Bessent at the helm, we will lower inflation for hardworking American families, impose sanctions and make them count, and get our economy back on track. 🇺🇸",en,Tweet,2,68,10,12,2411,2025-01-28 00:27:58,"<a href=""http://twitter.com/download/iphone"" rel=""nofollow"">Twitter for iPhone</a>",,,,
'1884014554512023979',"President Trump is currently speaking to @HouseGOP in Miami, Florida. 

The Golden Age of America is offically underway. 🇺🇸 https://t.co/tda8b8N4aK",en,Tweet,9,744,93,18,39758,2025-01-27 23:04:07,"<a href=""http://twitter.com/download/iphone"" rel=""nofollow"">Twitter for iPhone</a>",,,photo,https://pbs.twimg.com/media/GiVdEvOWoAArH3T.jpg
'1883915724072390799',"On this day in 1945, Auschwitz was liberated.

Today, we honor the memory of six million Jewish victims and millions of others who perished in the Holocaust. May we never forget their stories, and may we remain committed to fighting antisemitism in all its forms. #NeverAgain",en,Tweet,0,31,6,3,1089,2025-01-27 16:31:24,"<a href=""http://twitter.com/download/iphone"" rel=""nofollow"">Twitter for iPhone</a>",#NeverAgain,,,
'1883655878597046568',"Democrats are the party of hypocrisy.
 https://t.co/NHS3PCCgcm",en,Tweet,5,80,40,14,3851,2025-01-26 23:18:52,"<a href=""http://twitter.com/download/iphone"" rel=""nofollow"">Twitter for iPhone</a>",,,video,https://video.twimg.com/amplify_video/1883491940378804224/vid/avc1/824x462/csnetck3ArRy_Geh.mp4?tag=16
'1883632821266522481',https://t.co/p7Gg92iDLE,zxx,Tweet,2,61,11,4,4011,2025-01-26 21:47:15,"<a href=""http://twitter.com/download/iphone"" rel=""nofollow"">Twitter for iPhone</a>",,,photo,https://pbs.twimg.com/media/GiQCEYtW8AALKfW.jpg
'1883604810857169127',"Let this serve as a warning to the rest of the world- the United States is back! 

Thank you President Trump for standing strong and not allowing other countries to continue taking advantage of us. 

This is just the beginning! 

Your move, Colombia. https://t.co/3jL0XCGyaE",en,Tweet,1,110,16,10,3089,2025-01-26 19:55:57,"<a href=""http://twitter.com/download/iphone"" rel=""nofollow"">Twitter for iPhone</a>",,,photo,https://pbs.twimg.com/media/GiPol3_WAAA6sEO.jpg
'1882991105035112533',"Confirmed! ✅

Congratulations to Pete Hegseth, our next Secretary of Defense! 🇺🇸 https://t.co/mSmtyzUwhh",en,Tweet,2,155,16,15,2833,2025-01-25 03:17:18,"<a href=""http://twitter.com/download/iphone"" rel=""nofollow"">Twitter for iPhone</a>",,,photo,https://pbs.twimg.com/media/GiG6bX0WMAA3F2F.jpg
'1882908543923400826',@barrycunningham Thank you for having me on!,en,Reply,0,1,0,1,36,2025-01-24 21:49:14,"<a href=""http://twitter.com/download/iphone"" rel=""nofollow"">Twitter for iPhone</a>",,,,
'1882871477415899480',"Politically motivated debanking is unacceptable. With Chairman Comer at the helm, @GOPoversight will uncover the exact number of Conservatives who were debanked.

Thank you to @DrJohnEastman for shedding light on a deeper issue within our Financial Sector. Nefarious actions are unacceptable in our free market. If any occurred, we must understand the exact extent of the impact and then guarantee it never happens again.",en,Tweet,7,230,68,9,15556,2025-01-24 19:21:56,"<a href=""http://twitter.com/download/iphone"" rel=""nofollow"">Twitter for iPhone</a>",,,,
'1882862542113955931',"Grateful to see President Trump on the ground in North Carolina today, offering support and leadership to those impacted by the disastrous floods. It’s in times like these that strong, decisive action makes all the difference.

America first, always! 🇺🇸",en,Tweet,0,60,7,5,1575,2025-01-24 18:46:26,"<a href=""http://twitter.com/download/iphone"" rel=""nofollow"">Twitter for iPhone</a>",,,,
'1882544538881053127',"Congress just voted on whether a living, breathing baby who survives abortion is entitled to basic medical care. This should not be a controversial issue. However, only ONE Democrat voted in favor of the Born-Alive Abortion Survivors Protection act.
I am proud to be one of the 216 House Republicans who stood for the sanctity of life today.",en,Tweet,3,77,11,12,1622,2025-01-23 21:42:48,"<a href=""http://twitter.com/download/iphone"" rel=""nofollow"">Twitter for iPhone</a>",,,photo,https://pbs.twimg.com/media/GiAkQYQW8AAkBHy.jpg
'1882529526879748470',"Speaker Johnson signs the Laken Riley Act.

Justice for Laken Riley is headed to President Trump’s desk. https://t.co/4sSZcbIr9h",en,Tweet,1,110,11,4,2139,2025-01-23 20:43:09,"<a href=""http://twitter.com/download/iphone"" rel=""nofollow"">Twitter for iPhone</a>",,,photo,https://pbs.twimg.com/media/GiAWc2QWoAAdbcR.jpg
'1882529412295565385',"The American people deserve transparency and truth.

Promises made, promises kept! 🇺🇸",en,Tweet,0,75,9,7,3690,2025-01-23 20:42:42,"<a href=""http://twitter.com/download/iphone"" rel=""nofollow"">Twitter for iPhone</a>",,,,
'1882493202835677489',"Democrats have voted against deporting violent illegal aliens and protecting women in sports, let’s see how they vote on saving babies.",en,Tweet,0,38,6,5,1637,2025-01-23 18:18:49,"<a href=""http://twitter.com/download/iphone"" rel=""nofollow"">Twitter for iPhone</a>",,,,
'1882460678801559681',"The American people gave Congress a mandate to secure the border. Under President Trump’s administration, the invasion of our Southern border ends NOW! 

 https://t.co/rJbM7hDanM",en,Tweet,0,62,10,6,1696,2025-01-23 16:09:34,"<a href=""http://twitter.com/download/iphone"" rel=""nofollow"">Twitter for iPhone</a>",,,video,https://video.twimg.com/ext_tw_video/1882410806362374144/pu/vid/avc1/1280x720/K-brFHSeExYm5hce.mp4?tag=12
'1882207668074696913',"President Trump has already dismantled DEI government-wide AND united Congress to protect Americans from criminal illegal aliens.

After a bipartisan vote before Congress, justice for Laken Riley finally heads to President Trump’s desk. 

This is how we make America safe again! https://t.co/v3t6GfKCIp",en,Tweet,0,36,6,0,875,2025-01-22 23:24:12,"<a href=""http://twitter.com/download/iphone"" rel=""nofollow"">Twitter for iPhone</a>",,,photo,https://pbs.twimg.com/media/Gh7x5gsX0AAZdsg.jpg
'1882110885738791064',President Trump has done more for the American people in 48 hours than Joe Biden did in four years.,en,Tweet,0,66,7,13,1394,2025-01-22 16:59:37,"<a href=""https://mobile.twitter.com"" rel=""nofollow"">Twitter Web App</a>",,,,
'1882094453785338109',"We must end the government policy of trying to socially engineer race and gender into every aspect of public and private life. As the President said Monday, “We will forge a society that is colorblind and merit-based.”

Another win for ALL Americans!",en,Tweet,1,70,15,3,3522,2025-01-22 15:54:20,"<a href=""http://twitter.com/download/iphone"" rel=""nofollow"">Twitter for iPhone</a>",,,,
'1881825466224677182',https://t.co/k1eswi905H,zxx,Reply,0,17,3,4,592,2025-01-21 22:05:28,"<a href=""http://twitter.com/download/iphone"" rel=""nofollow"">Twitter for iPhone</a>",,https://timmons.house.gov/news/documentsingle.aspx?DocumentID=184&fbclid=IwZXh0bgNhZW0CMTEAAR2jioBEJK9a6aVG4J6bumRSKcDptVGn2rx4soSvtOHT9_R9mvgwXveE6BU_aem_CW9tQPDhai_3lcXa6MJlSg,,
'1881749069682618832',"Honored to be nominated to the @DOGE Subcommittee. Thank you @RepMTG. There is nobody better suited to lead this change than you and @elonmusk. The people voted for major reform and together, we are going to give it to them!",en,Tweet,4,1308,132,84,95707,2025-01-21 17:01:54,"<a href=""http://twitter.com/download/iphone"" rel=""nofollow"">Twitter for iPhone</a>",,,,
'1881495449095598338',"Clean sweep! In a 99-0 vote, Marco Rubio has been confirmed as our Secretary of State.

Congratulations, Secretary Rubio!",en,Tweet,0,127,18,3,3408,2025-01-21 00:14:06,"<a href=""http://twitter.com/download/iphone"" rel=""nofollow"">Twitter for iPhone</a>",,,,
'1881429862675890185',"Oversight will investigate and lay any crimes before the American people. DOJ may not be able to charge but we will convict them in the court of public opinion. 

These abuses can never happen again!

@GOPoversight https://t.co/qOQ67NqN8B",en,Tweet,3,97,25,21,3196,2025-01-20 19:53:29,"<a href=""http://twitter.com/download/iphone"" rel=""nofollow"">Twitter for iPhone</a>",,,photo,https://pbs.twimg.com/media/GhwufVJWsAAVoyI.jpg
'1881387861456695807',"A triumphant return! 🇺🇸 

Donald Trump takes the oath as the 47th President, cementing his place in history. Time to reignite the American Dream and deliver for the people! https://t.co/JfMw8bABpN",en,Tweet,2,155,23,6,7538,2025-01-20 17:06:35,"<a href=""http://twitter.com/download/iphone"" rel=""nofollow"">Twitter for iPhone</a>",,,photo,https://pbs.twimg.com/media/GhwISbHWwAElk3M.jpg
'1881368850761134206',"Moments away from witnessing President-elect Donald Trump being sworn in as the 47th President of the United States. 

Today, we Make America Great Again!🇺🇸 https://t.co/jlIIl4YqPp",en,Tweet,10,185,26,4,24030,2025-01-20 15:51:02,"<a href=""http://twitter.com/download/iphone"" rel=""nofollow"">Twitter for iPhone</a>",,,photo,https://pbs.twimg.com/media/Ghv2_0hWQAA5zUR.jpg
'1881111276958732352',"471 days. Welcome home Emily, Doron, and Romi.",en,Tweet,2,98,16,2,4190,2025-01-19 22:47:32,"<a href=""http://twitter.com/download/iphone"" rel=""nofollow"">Twitter for iPhone</a>",,,,
'1881054861556691241',Everything changes tomorrow 🇺🇸 https://t.co/e2w3SkjE2v,en,Tweet,0,91,8,8,1385,2025-01-19 19:03:21,"<a href=""http://twitter.com/download/iphone"" rel=""nofollow"">Twitter for iPhone</a>",,,photo,https://pbs.twimg.com/media/GhrZbThWoAARmNN.jpg
'1880406280948314582',"The 60th Inaugural Ceremony has been moved inside the Rotunda of the U.S Capitol Building. Because of this, we have received guidance from the JCCIC that there will be no public viewing regardless of ticket holder status. 

See below for their official statement:

“The House Sergeant at Arms (SAA) has been informed by the Joint Congressional Committee on Inaugural Ceremonies (JCCIC) that the 60th Inaugural Ceremonies will be held inside the U.S. Capitol.

As a result, the majority of ticketed guests will not be able to attend the ceremonies in person, although offices are welcome to distribute tickets to constituents in the manner they think best, if they would like to do so. It is our understanding from the JCCIC that all Members of Congress will be invited to the indoor ceremony. House Members of JCCIC recommend that your offices relay to constituents that their tickets will be commemorative.”

We wish we did not have deliver this news, as we know so many South Carolinians made travel plans and sacrifices to join us in DC to celebrate President Trump. However, President Trump and the JCCIC believe this is the best course of action to ensure the safety of all guests and participants due to extreme weather in Washington DC.",en,Tweet,1,12,5,1,1066,2025-01-18 00:06:08,"<a href=""http://twitter.com/download/iphone"" rel=""nofollow"">Twitter for iPhone</a>",,,,
'1880368364440416402',"Read the press release here:

https://t.co/hkLhsrKiw4",en,Reply,0,4,0,2,362,2025-01-17 21:35:28,"<a href=""http://twitter.com/download/iphone"" rel=""nofollow"">Twitter for iPhone</a>",,https://timmons.house.gov/news/documentsingle.aspx?DocumentID=183,,
'1880368360548102449',"I look forward to serving as Chair of the Military and Foreign Affairs Subcommittee in the 119th Congress

@GOPoversight @RepJamesComer 🇺🇸 https://t.co/1zvS1ZJTdZ",en,Tweet,0,67,8,9,7133,2025-01-17 21:35:27,"<a href=""http://twitter.com/download/iphone"" rel=""nofollow"">Twitter for iPhone</a>",,,photo,https://pbs.twimg.com/media/GhhpDswXsAAY46k.jpg
'1880324951292412257',"Just a few moments ago, President Trump announced that the upcoming Inauguration ceremony would be taking place indoors due to extreme weather. We wanted to let those making travel arrangements from South Carolina know as soon as possible in case this impacts your decision to travel to DC this weekend.

We are still awaiting further updates and will share any additional information as soon as we receive it. 

In the meantime, please see President Trump’s announcement below.",en,Tweet,0,20,5,0,719,2025-01-17 18:42:57,"<a href=""http://twitter.com/download/iphone"" rel=""nofollow"">Twitter for iPhone</a>",,,photo,https://pbs.twimg.com/media/GhhBk1XXoAAfam2.jpg
'1879990134990598499',4 more days https://t.co/zgWElQpGRS,en,Tweet,0,39,5,1,1412,2025-01-16 20:32:31,"<a href=""http://twitter.com/download/iphone"" rel=""nofollow"">Twitter for iPhone</a>",,,photo,https://pbs.twimg.com/media/GhcREI1WcAA-qjd.jpg
'1879980681587208611',"Thank you to @RSBNetwork for coming by the office today.

I enjoyed discussing the inauguration, my committee work, and what the next 100 days in Congress will look like. 🇺🇸 https://t.co/kVmQi83clE",en,Tweet,2,99,25,5,11561,2025-01-16 19:54:57,"<a href=""http://twitter.com/download/iphone"" rel=""nofollow"">Twitter for iPhone</a>",,,photo,https://pbs.twimg.com/media/GhcId1_WYAE7WPf.jpg
'1879951240857088411',"Today, the House voted on the Violence Against Women by Illegal Aliens Act. Democrats had one more chance to show whose side they are on. Unfortunately, 145 House Democrats voted against protecting women.
American men, women, and children deserve better.
I proudly voted YES and will continue my work to make America safe again!",en,Tweet,0,16,0,1,834,2025-01-16 17:57:58,"<a href=""https://mobile.twitter.com"" rel=""nofollow"">Twitter Web App</a>",,,,
'1879614518307004475',I am proud to have earned an A+ on @sbaprolife’s scorecard. We must continue to defend the lives of children in the womb and fight to defeat Democratic abortion extremism. https://t.co/4LAiaYqbGX,en,Tweet,0,22,2,1,1787,2025-01-15 19:39:57,"<a href=""https://mobile.twitter.com"" rel=""nofollow"">Twitter Web App</a>",,,photo,https://pbs.twimg.com/media/GhW7cZpWIAAld2B.jpg
'1879585047726194985',"The Trump Effect

Israel and Hamas have reached an agreement on a ceasefire and hostage release deal https://t.co/T1WOSUoNEV",en,Tweet,0,68,11,8,12592,2025-01-15 17:42:51,"<a href=""http://twitter.com/download/iphone"" rel=""nofollow"">Twitter for iPhone</a>",,,photo,https://pbs.twimg.com/media/GhWgo_OXwAA_Wak.jpg
'1879570867111501861',5 more days https://t.co/qOAjwE7AFn,en,Tweet,0,153,27,10,5834,2025-01-15 16:46:30,"<a href=""http://twitter.com/download/iphone"" rel=""nofollow"">Twitter for iPhone</a>",,,photo,https://pbs.twimg.com/media/GhWTvjnWwAA3BL_.jpg
'1879282774626189449',6 more days https://t.co/bUxQc5rcuS,en,Tweet,1,64,6,2,2179,2025-01-14 21:41:43,"<a href=""http://twitter.com/download/iphone"" rel=""nofollow"">Twitter for iPhone</a>",,,photo,https://pbs.twimg.com/media/GhSNuV-XoAAn44q.jpg
'1879271565587816757',"I proudly voted YES on H.R. 28 to protect women’s sports. @HouseGOP will never stop fighting for our girls to fairly compete.

Thank you to the female athletes like @Riley_Gaines_ who boldly spoke out for women’s rights and common sense. https://t.co/tIB2Nyeuii",en,Tweet,1,172,19,15,2410,2025-01-14 20:57:11,"<a href=""http://twitter.com/download/iphone"" rel=""nofollow"">Twitter for iPhone</a>",,,photo,https://pbs.twimg.com/media/GhSB0bOXsAAKPPG.jpg
'1879197403242438786',Excited to continue serving on the Oversight Committee for the 119th Congress!,en,Tweet,1,31,2,9,5427,2025-01-14 16:02:29,"<a href=""https://mobile.twitter.com"" rel=""nofollow"">Twitter Web App</a>",,,,
'1879176404962509151',Confirm Pete Hegseth! 🇺🇸 https://t.co/gUpVzo116U,en,Tweet,1,87,13,7,1704,2025-01-14 14:39:03,"<a href=""http://twitter.com/download/iphone"" rel=""nofollow"">Twitter for iPhone</a>",,,photo,https://pbs.twimg.com/media/GhQs-w-XgAAT5lU.jpg
'1878830082732839123',One week until President @realDonaldTrump's inauguration! 🇺🇸,en,Tweet,0,42,3,5,1928,2025-01-13 15:42:53,"<a href=""https://mobile.twitter.com"" rel=""nofollow"">Twitter Web App</a>",,,,
'1877781518749401217',"Today’s conviction is an embarrassment to the state of New York, the Democrat machine, and all the participants of the weaponized system of justice against our next President. This conviction should be overturned on appeal. 

President @realDonaldTrump took a bullet for this country. The Democrats did everything they could to try and stop him. The American people rejected their nonsense on Election Day. 

January 20th cannot come fast enough.",en,Tweet,0,40,8,3,1636,2025-01-10 18:16:16,"<a href=""http://twitter.com/download/iphone"" rel=""nofollow"">Twitter for iPhone</a>",,,,
'1877093469392339167',"As the first major winter storm of 2025 heads toward the Upstate, the @BloodConnection is planning ahead to prevent what could be a critical shortage of blood supplies. TBC is asking all eligible individuals to help secure the region’s blood supply and donate as soon as possible. 

Donors can make an appointment at one of TBC’s 20 donation centers or find a bloodmobile near them by visiting https://t.co/05XN9VdsDb.",en,Tweet,0,4,1,1,533,2025-01-08 20:42:12,"<a href=""https://mobile.twitter.com"" rel=""nofollow"">Twitter Web App</a>",,,,
'1876791316031434938',"Big news! Meta is ending its fact-checking program and lifting restrictions on political speech across Facebook, Instagram and Meta platforms.

This is all because of President Trump’s historic victory. Our country is healing. 

It’s amazing the changes that are happening before he’s even been sworn in. Huge things ahead!

Thanks to President Trump and Elon Musk’s leadership, free speech wins!",en,Tweet,1,26,2,5,1202,2025-01-08 00:41:33,"<a href=""http://twitter.com/download/iphone"" rel=""nofollow"">Twitter for iPhone</a>",,,,
'1876733200829120627',"But for the Biden-Harris open border, Laken Riley would still be with us today. 

I proudly supported the Laken Riley Act today and will continue to fight for justice for all Americans who tragically lost their lives at the hands of illegal aliens. 

I urge my Senate colleagues to pass this bill and get it to President Trump's desk as soon as he takes the oath of office.",en,Tweet,0,42,5,6,10149,2025-01-07 20:50:37,"<a href=""https://mobile.twitter.com"" rel=""nofollow"">Twitter Web App</a>",,,,
'1876285292279435711',"A little snow in DC won’t stop me! I am here in Washington ready to certify the historic election of President @realDonaldTrump and @JDVance.

Looking forward to getting to work with President Trump and Vice President Vance on the America First Agenda 🇺🇸 https://t.co/h4neTLxQ5s",en,Tweet,0,96,13,9,1881,2025-01-06 15:10:48,"<a href=""http://twitter.com/download/iphone"" rel=""nofollow"">Twitter for iPhone</a>",,,photo,"https://pbs.twimg.com/media/Ggnnh1UWsAAViwS.jpg,https://pbs.twimg.com/media/Ggnnh1VXsAA_6k2.jpg"
'1875317548176326732',"The sun sets on the first day of the 119th Congress. 

It is truly honor to represent the people of Greenville and Spartanburg for another term. Our team is always here for you and your family, so please do not hesitate to reach out. 

I am eager to get to work with President @realDonaldTrump, @SpeakerJohnson, and my Republican colleagues to enact the America First agenda and get results for the American people. 

Onward! 🇺🇸",en,Tweet,1,40,6,7,1464,2025-01-03 23:05:19,"<a href=""http://twitter.com/download/iphone"" rel=""nofollow"">Twitter for iPhone</a>",,,photo,https://pbs.twimg.com/media/GgZ3XlJWQAAbt77.jpg
'1875266484903284764',"Congratulations to @SpeakerJohnson!

Now it is time to roll up our sleeves and get to work for the American people and to enact President @realDonaldTrump's America First agenda! 🇺🇸",en,Tweet,0,28,3,9,1287,2025-01-03 19:42:25,"<a href=""https://mobile.twitter.com"" rel=""nofollow"">Twitter Web App</a>",,,,
