tweet_id,text,language,type,bookmark_count,favorite_count,retweet_count,reply_count,view_count,created_at,client,hashtags,urls,media_type,media_urls
'1907990982311752071',Are you tired of winning yet? https://t.co/WMs45Wmz2n,en,Tweet,2,9,2,5,770,2025-04-04 03:57:53,"<a href=""http://twitter.com/download/iphone"" rel=""nofollow"">Twitter for iPhone</a>",,,photo,"https://pbs.twimg.com/media/GnqLr7UXsAMwFbz.jpg,https://pbs.twimg.com/media/GnqLr7WXkAA3WD_.jpg,https://pbs.twimg.com/media/GnqLr7TXIAAHqR5.jpg"
'1907603121578090693',Donald Trump has just given us one of the largest Middle Class tax increases in American history. Good job everyone.,en,Tweet,1,47,21,9,3382,2025-04-03 02:16:40,"<a href=""http://twitter.com/download/iphone"" rel=""nofollow"">Twitter for iPhone</a>",,,,
'1907538482421014663',"In 1890, most Americans lived in poverty.

In 1860, 13% of Americans were enslaved.

What is he talking about?!",en,Tweet,137,3231,797,152,125787,2025-04-02 21:59:49,"<a href=""http://twitter.com/download/iphone"" rel=""nofollow"">Twitter for iPhone</a>",,,,
'1907533199384707091',"Income tax is paid mostly by the rich.

Tariffs are paid mostly by the middle class.

That is why we moved to the income tax in 1913. And also why Trump is shifting back to tariffs.",en,Tweet,321,6170,1202,347,268282,2025-04-02 21:38:49,"<a href=""http://twitter.com/download/iphone"" rel=""nofollow"">Twitter for iPhone</a>",,,,
'1906726438180384892',Thanks Elon. 🤬,en,Tweet,0,7,0,1,651,2025-03-31 16:13:02,"<a href=""https://mobile.twitter.com"" rel=""nofollow"">Twitter Web App</a>",,,,
'1906147709355970842',"Congress should take military force off the table by passing my No Invading Allies Act, which will prohibit Trump from invading Greenland, Canada or Panama without a vote of Congress.",en,Tweet,1,23,4,21,3025,2025-03-30 00:53:23,"<a href=""http://twitter.com/download/iphone"" rel=""nofollow"">Twitter for iPhone</a>",,,,
'1905723871808143497',"A huge win for the American people, and a loss for finance scam artists and the Trump Administration that wants to enable them.",en,Tweet,0,36,10,20,3675,2025-03-28 20:49:12,"<a href=""http://twitter.com/download/iphone"" rel=""nofollow"">Twitter for iPhone</a>",,,,
'1905400753805553853',"FFS. The government has highly sophisticated secure communications systems for senior leaders to use.

Signal can absolutely be hacked and is not appropriate for classified comms.

Are they going to keep endangering US troops because theyre too petty to admit they made a mistake?",en,Tweet,19,699,258,91,46175,2025-03-27 23:25:14,"<a href=""http://twitter.com/download/iphone"" rel=""nofollow"">Twitter for iPhone</a>",,,,
'1904956891039490112',Elon Musk needs to get out of the Social Security Administration and stay out.,en,Tweet,1,19,3,9,1083,2025-03-26 18:01:29,"<a href=""http://twitter.com/download/iphone"" rel=""nofollow"">Twitter for iPhone</a>",,,,
'1904900769314222182',"Pete Hegseth yesterday: ""Nobody was texting war plans, that's all I have to say about that."" 

Today: https://t.co/yKYaNONrXT",en,Tweet,6,105,28,16,3555,2025-03-26 14:18:29,"<a href=""https://mobile.twitter.com"" rel=""nofollow"">Twitter Web App</a>",,,photo,https://pbs.twimg.com/media/Gm-QwkAXcAANk4t.jpg
'1904345819236454646',Inexcusable.,en,Tweet,0,24,2,4,1446,2025-03-25 01:33:18,"<a href=""http://twitter.com/download/iphone"" rel=""nofollow"">Twitter for iPhone</a>",,,,
'1904240567862657499',"This is incredibly reckless.

Sensitive conversations like planning military action should be conducted through secure gvmt comms channels ONLY. 

Otherwise American soldiers’ lives could be put at risk. 

Also, they violated records law by setting their texts to auto-delete. https://t.co/JNGyg8Ttpe",en,Tweet,0,4,0,1,445,2025-03-24 18:35:05,"<a href=""http://twitter.com/download/iphone"" rel=""nofollow"">Twitter for iPhone</a>",,,photo,https://pbs.twimg.com/media/Gm04s9KWsAAxkng.jpg
'1903850728797487532',"If Nancy Pelosi decides to run again, challenging her in a primary, from either the left or center, would be a profoundly stupid use of time and resources.

We save democracy by defeating *Republicans* in the midterms. That’s the assignment.

https://t.co/BRv9vYSkX9",en,Tweet,0,0,0,2,290,2025-03-23 16:46:00,"<a href=""http://twitter.com/download/iphone"" rel=""nofollow"">Twitter for iPhone</a>",,https://www.nytimes.com/2025/03/23/us/politics/pelosi-retirement-san-francisco.html,,
'1902829484983849319',Damn right!,en,Tweet,1,24,3,5,1852,2025-03-20 21:07:56,"<a href=""https://mobile.twitter.com"" rel=""nofollow"">Twitter Web App</a>",,,,
'1902779676222726443',"Friend’s brother just received this. He’s been a US citizen since the 1990s. 

Elon’s interns messing around in the social security database have no idea what they are doing. Trump doesn’t care. It’s going to get ugly fast. https://t.co/vMxkEm1U4H",en,Tweet,0,7,4,1,606,2025-03-20 17:50:01,"<a href=""http://twitter.com/download/iphone"" rel=""nofollow"">Twitter for iPhone</a>",,,photo,https://pbs.twimg.com/media/GmgIBt0aAAAaHOE.jpg
'1902553186440806724',"Pay attention. Trump is not just deporting criminals. Thousands of innocent people are enduring horrendous conditions in detention for no good reason. This is not what America is about.

https://t.co/yJo5ona64b",en,Tweet,1,58,29,34,7992,2025-03-20 02:50:02,"<a href=""http://twitter.com/download/iphone"" rel=""nofollow"">Twitter for iPhone</a>",,https://www.theguardian.com/us-news/2025/mar/19/canadian-detained-us-immigration-jasmine-mooney,,
'1902013184187195625',So Elon’s policy on “free speech” is to amplify neo-Nazis and silence the Dropkick Murphys. What a loser.,en,Tweet,1,79,17,39,6502,2025-03-18 15:04:15,"<a href=""http://twitter.com/download/iphone"" rel=""nofollow"">Twitter for iPhone</a>",,,,
'1901641602617012512',"If you read one thing today, this should be it.

Unimaginable cruelty from Trump, Musk and their enablers:

https://t.co/dcN53WW7tW",en,Tweet,0,2,1,0,233,2025-03-17 14:27:43,"<a href=""https://mobile.twitter.com"" rel=""nofollow"">Twitter Web App</a>",,http://www.nytimes.com/interactive/2025/03/15/opinion/foreign-aid-cuts-impact.html,,
'1901341180958269461',"Strong turnout at the St. Patrick’s Day parade in West Warwick! 🍀

Proud to celebrate Rhode Island’s deep Irish roots with friends, families, and plenty of green along the route.

Sláinte to the Friendly Sons of St. Patrick for keeping this tradition going strong! ☘️ https://t.co/fsJxhVrBUP",en,Tweet,1,31,2,16,2436,2025-03-16 18:33:57,"<a href=""http://twitter.com/download/iphone"" rel=""nofollow"">Twitter for iPhone</a>",,,photo,"https://pbs.twimg.com/media/GmLrtjsboAAM_JM.jpg,https://pbs.twimg.com/media/GmLrtjEWwAA8AKi.jpg,https://pbs.twimg.com/media/GmLrtjnaEAAwHJk.jpg,https://pbs.twimg.com/media/GmLrtjFWAAA6dEy.jpg"
'1900643237942935955',This is what a dictator sounds like.,en,Tweet,62,2477,450,75,60542,2025-03-14 20:20:34,"<a href=""http://twitter.com/download/iphone"" rel=""nofollow"">Twitter for iPhone</a>",,,,
'1899970660140519678',"I will not vote for a budget bill while Musk and Trump illegally ignore the budgets Congress passes. We need assurances the administration will follow the law.

I AM prepared to vote for a 30 day funding bill to keep the government open while giving both sides time to negotiate.",en,Tweet,1,48,9,19,3279,2025-03-12 23:47:59,"<a href=""http://twitter.com/download/iphone"" rel=""nofollow"">Twitter for iPhone</a>",,,,
'1898536262711074834',"Yet another way Trump and Elon’s slash and burn management style is hurting Rhode Island. 

They could be taking a more deliberate approach to cost cutting, but they like the chaos.",en,Tweet,1,33,7,18,3574,2025-03-09 00:48:12,"<a href=""http://twitter.com/download/iphone"" rel=""nofollow"">Twitter for iPhone</a>",,,,
'1897680387901415530',Congratulations to RI02's @regentcraft on this exciting milestone!,en,Tweet,0,4,0,1,486,2025-03-06 16:07:16,"<a href=""https://mobile.twitter.com"" rel=""nofollow"">Twitter Web App</a>",,,,
'1896768635965972852',"And of course the clinics, health care workers, etc, in many places where the children are treated also had their USAID funding cut off. 

There is a whole supply chain that needs to be restored. And the clock is ticking. The lives of thousands of children hang in the balance.",en,Reply,0,5,0,4,261,2025-03-04 03:44:17,"<a href=""http://twitter.com/download/iphone"" rel=""nofollow"">Twitter for iPhone</a>",,,,
'1896768633428488485',"The shipping companies that deliver this lifesaving food aid around the world also had their USAID contracts canceled. If those don’t come back online, the product will still be stuck in warehouses, and not get to the kids who need it. 2/3",en,Reply,0,5,0,2,268,2025-03-04 03:44:17,"<a href=""http://twitter.com/download/iphone"" rel=""nofollow"">Twitter for iPhone</a>",,,,
'1896768629196419465',"As the Member of Congress who represents the area where the Rhode Island factory is, I’m hopeful Elon will follow through on his promise to restore funding to produce this lifesaving nutrition for thousands of starving kids.

But funding the factories is just the first step. 1/3",en,Tweet,3,19,2,6,1773,2025-03-04 03:44:16,"<a href=""http://twitter.com/download/iphone"" rel=""nofollow"">Twitter for iPhone</a>",,,,
'1896375067556102461',"So excited to announce the lineup for our 3rd Annual Women's Lunch, featuring some incredible leaders from both Congress and the Ocean State!

Register here: https://t.co/h3c4xBaaMV",en,Tweet,1,17,4,31,3707,2025-03-03 01:40:23,"<a href=""https://mobile.twitter.com"" rel=""nofollow"">Twitter Web App</a>",,http://secure.actblue.com/donate/womenlunch25,photo,https://pbs.twimg.com/media/GlFF1eqWIAAru21.jpg
'1895553803963035890',"Trump and Vance did Putin’s dirty work today, and now the world is less safe.",en,Tweet,2,95,19,90,11007,2025-02-28 19:16:59,"<a href=""http://twitter.com/download/iphone"" rel=""nofollow"">Twitter for iPhone</a>",,,,
'1894054113777791236',Horrific.,es,Tweet,0,4,2,0,394,2025-02-24 15:57:45,"<a href=""http://twitter.com/download/iphone"" rel=""nofollow"">Twitter for iPhone</a>",,,,
'1892949753438089693',"A short message for you all today:

Presidents Trump and Musk are flooding the zone with a barrage of reckless actions, but their goal is simple. 

It’s all just a money grab. https://t.co/LU6hqm3haJ",en,Tweet,0,12,3,7,924,2025-02-21 14:49:25,"<a href=""http://twitter.com/download/iphone"" rel=""nofollow"">Twitter for iPhone</a>",,,video,https://video.twimg.com/amplify_video/1892949533077688320/vid/avc1/720x1280/8TioUNQqAYcI7C83.mp4?tag=14
'1892317854629790184',Never before in American history has a President dared to call himself a King. This is not what people voted for.,en,Tweet,4,157,24,87,10590,2025-02-19 20:58:28,"<a href=""https://mobile.twitter.com"" rel=""nofollow"">Twitter Web App</a>",,,,
'1891997490905256054',The number of “accidents” by President Musk and his minions continues to grow…,en,Tweet,0,5,4,4,569,2025-02-18 23:45:28,"<a href=""http://twitter.com/download/iphone"" rel=""nofollow"">Twitter for iPhone</a>",,,,
'1891872493331206312',"Conservatives in my feed saying Trump's plan to eliminate the Dept of Education is no big deal because only *12%* of RI education funding comes from federal gvmt:

Please name the 12% of RI teachers you think should be laid off.

Or the 12% of career tech programs canceled.

Or the local taxes you would raise to maintain the current level of services?

Anyone? Bueller?",en,Tweet,5,69,14,125,7948,2025-02-18 15:28:46,"<a href=""https://mobile.twitter.com"" rel=""nofollow"">Twitter Web App</a>",,,photo,https://pbs.twimg.com/media/GkFHerQXIAAw9iN.png
'1891656084147896722',"Without federal funding, public education in Rhode Island would be crippled.

Donald Trump and Elon Musk don’t have to worry about what cuts to education would mean for their kids.

So they are trying to take money from yours in other to pay for another billionaires’ tax cut.",en,Tweet,2,53,20,96,10048,2025-02-18 01:08:50,"<a href=""http://twitter.com/download/iphone"" rel=""nofollow"">Twitter for iPhone</a>",,,,
'1891291031624196177',We must pass my bill to ban Members of Congress from trading stocks!,en,Tweet,15,520,155,48,27377,2025-02-17 00:58:15,"<a href=""http://twitter.com/download/iphone"" rel=""nofollow"">Twitter for iPhone</a>",,,,
'1890548725786837278',"-AP banned from Oval Office for first time in a century

-Administration officials threatening to arrest AOC for stating what the law is

-Trump exempts Elon and DOGE from all public transparency laws for federal agencies 

Trump/Musk/Vance are afraid of free speech.",en,Tweet,9,265,114,86,10406,2025-02-14 23:48:35,"<a href=""http://twitter.com/download/iphone"" rel=""nofollow"">Twitter for iPhone</a>",,,,
'1890380549618876769',"Who could have thought that putting an inexperienced TV personality in charge of the nation’s military would lead to big mistakes?!

I’m sure it will be different at FBI, DNI &amp; HHS…",en,Tweet,3,108,26,52,8779,2025-02-14 12:40:19,"<a href=""http://twitter.com/download/iphone"" rel=""nofollow"">Twitter for iPhone</a>",,,,
'1888688893727592884',"Three weeks into the Trump / Musk administration and I am feeling more optimistic than ever that we can beat back some of the worst parts of their agenda.

Here’s why: https://t.co/z0sggoZeSg",en,Tweet,9,69,13,67,9318,2025-02-09 20:38:17,"<a href=""http://twitter.com/download/iphone"" rel=""nofollow"">Twitter for iPhone</a>",,,video,https://video.twimg.com/amplify_video/1888688592441995264/vid/avc1/720x1280/QgVquyQzTuXMV7cr.mp4?tag=14
'1888672965526802578',"This is an insane argument.

The judiciary’s core function is to protect the rights of the people from overreach by the Executive. 

The Executive does not get to decide on his own whether his actions are constitutionally legitimate. That’s why the Founders created an independent judiciary.",en,Tweet,3,72,15,51,15290,2025-02-09 19:34:59,"<a href=""http://twitter.com/download/iphone"" rel=""nofollow"">Twitter for iPhone</a>",,,,
'1887955277950992520',I know there is a lot going on right now. But hold on a second - why isn’t @paytonpritch3 on this list? 😡,en,Tweet,0,1,0,0,680,2025-02-07 20:03:09,"<a href=""http://twitter.com/download/iphone"" rel=""nofollow"">Twitter for iPhone</a>",,,,
'1887663426849161466',"US Representative Seth Magaziner, a Rhode Island Democrat, called the impact on Maternova “yet another example of how Trump and Musk’s reckless actions are hurting people both abroad and here at home.”",en,Tweet,2,31,8,25,4871,2025-02-07 00:43:26,"<a href=""https://mobile.twitter.com"" rel=""nofollow"">Twitter Web App</a>",,,,
'1887660160966938838',Never should have been given a stop-work order to begin with. We will continue to be vigilant on this.,en,Tweet,0,18,1,12,2017,2025-02-07 00:30:28,"<a href=""https://mobile.twitter.com"" rel=""nofollow"">Twitter Web App</a>",,,,
'1887509540901429712',Donald Trump is letting the richest man in the world rip away food and medicine from the poorest kids in the world.,en,Tweet,1,84,19,79,7100,2025-02-06 14:31:57,"<a href=""https://mobile.twitter.com"" rel=""nofollow"">Twitter Web App</a>",,,,
'1886924251401478374',"Update: I and dozens of other Members of Congress were denied a meeting at the US Treasury today.

But while we were trying to get in something awesome happened. 

Thousands of people began filling the streets. Americans are not going to let Elon steal their money and data. https://t.co/vf0E3v3x3r",en,Tweet,9,216,55,173,12216,2025-02-04 23:46:13,"<a href=""http://twitter.com/download/iphone"" rel=""nofollow"">Twitter for iPhone</a>",,,video,https://video.twimg.com/ext_tw_video/1886924196044816384/pu/vid/avc1/320x568/56AE__m-fBqWdmzf.mp4?tag=12
'1886884876521234638',"Heading to the US Treasury with @JasmineForUS to ask for a meeting with the unelected, unvetted Elon lackeys who have taken control of the Treasury payments system. We need answers. https://t.co/Igx38dXfDF",en,Tweet,91,6168,1220,5541,346331,2025-02-04 21:09:45,"<a href=""http://twitter.com/download/iphone"" rel=""nofollow"">Twitter for iPhone</a>",,,photo,https://pbs.twimg.com/media/Gi-PytvXUAEHWJF.jpg
'1886451141292007722',"Despite Marjorie’s best efforts, 80% of Congress voted to fund USAID.

President Musk has no legal ground to shut down an agency Congress overwhelmingly voted to fund. https://t.co/i1ELtQ1yFR",en,Tweet,1,37,4,42,3464,2025-02-03 16:26:15,"<a href=""http://twitter.com/download/iphone"" rel=""nofollow"">Twitter for iPhone</a>",,,photo,https://pbs.twimg.com/media/Gi4FT56XIAczQNX.jpg
'1886395064668016711',"Children around the world will die from disease and starvation because an unelected billionaire wants to play God.

The cruelty of it all.",en,Tweet,3,141,27,136,30896,2025-02-03 12:43:25,"<a href=""http://twitter.com/download/iphone"" rel=""nofollow"">Twitter for iPhone</a>",,,,
'1886220056196989068',"FBI agents being purged just for doing their jobs and investigating the Jan 6 attack on the Capitol.

Elon Musk’s lackeys with no vetting demanding access to classified info.

The Senate needs to bring Kash Patel &amp; Pam Bondi in for additional public questioning before any votes.",en,Tweet,2,54,18,27,3014,2025-02-03 01:08:00,"<a href=""http://twitter.com/download/iphone"" rel=""nofollow"">Twitter for iPhone</a>",,,,
'1885858665325838790',"Such a pleasure to participate once again in the @wpri12 Meeting Street School telethon. 

The outpouring of support for the incredible young people at Meeting Street is so inspiring. https://t.co/4j3nMccjgV",en,Tweet,0,4,0,0,599,2025-02-02 01:11:58,"<a href=""http://twitter.com/download/iphone"" rel=""nofollow"">Twitter for iPhone</a>",,,photo,https://pbs.twimg.com/media/GivqdJNWoAE84DM.jpg
'1885734850210025635',"Someone tell President Musk that the federal government is not Twitter.

His childish games will get people killed.",en,Tweet,9,193,44,21,13343,2025-02-01 16:59:58,"<a href=""http://twitter.com/download/iphone"" rel=""nofollow"">Twitter for iPhone</a>",,,,
'1885701319555510274',"Trump and the Billionaire Bros said their
Funding freeze wouldn’t include lifesaving aid. They lied.

If the freeze is not reversed immediately, thousands of people including children will die for no good reason. Trump needs to end this madness now.

https://t.co/sGUM6Aex6N",en,Tweet,1,13,4,6,1035,2025-02-01 14:46:43,"<a href=""http://twitter.com/download/iphone"" rel=""nofollow"">Twitter for iPhone</a>",,https://www.propublica.org/article/trump-state-department-usaid-humanitarian-aid-freeze-ukraine-gaza-sudan,,
'1884438014727733684',"They are back-tracking because we spoke up. Good.

But make no mistake: their OMB memo ordered a freeze of *all* grants. The Medicaid and SNAP portals went dark. Head Start providers couldn't draw funds.

This was not a coincidence. It was their plan. And they screwed up bigly. https://t.co/iB0seIjmcG",en,Tweet,64,1856,692,64,31021,2025-01-29 03:06:48,"<a href=""https://mobile.twitter.com"" rel=""nofollow"">Twitter Web App</a>",,,photo,https://pbs.twimg.com/media/GibdFUeWkAAF_Ic.jpg
'1884243320953790814',"President Trump just released an extreme and illegal order to freeze all federal funding for transportation, education, disaster relief &amp; more.

Where are House Republicans? Waking up after having a big party at the Trump’s Doral Resort in Florida.

Talk about being out of touch.",en,Tweet,1,64,19,18,3601,2025-01-28 14:13:09,"<a href=""http://twitter.com/download/iphone"" rel=""nofollow"">Twitter for iPhone</a>",,,,
'1884086070448644611',"Again, if the Trump Administration keeps all of this up, many innocent people will die for no good reason.",en,Tweet,1,27,4,14,2983,2025-01-28 03:48:18,"<a href=""http://twitter.com/download/iphone"" rel=""nofollow"">Twitter for iPhone</a>",,,,
'1884028657708196055',They get mad when you call it a cult.,en,Tweet,2,125,10,35,9778,2025-01-28 00:00:10,"<a href=""http://twitter.com/download/iphone"" rel=""nofollow"">Twitter for iPhone</a>",,,,
'1884009307483873775',Even the Russians think Tulsi Gabbard is too pro-Russia...,en,Tweet,0,21,3,13,3187,2025-01-27 22:43:16,"<a href=""https://mobile.twitter.com"" rel=""nofollow"">Twitter Web App</a>",,,,
'1883985750909411776',"People will die. For no good reason.
https://t.co/dQgqqE7j5L",en,Tweet,2,74,33,30,5099,2025-01-27 21:09:40,"<a href=""https://mobile.twitter.com"" rel=""nofollow"">Twitter Web App</a>",,https://apnews.com/article/cdc-who-trump-548cf18b1c409c7d22e17311ccdfe1f6?utm_source=twitter&utm_medium=share,,
'1883692559236784295',"The story of the Tuskegee Airman is one of patriotism, courage and service.

Erasing their story from the curriculum is an outrage. It also does nothing to lower the price of groceries. https://t.co/waXDnZNjYO",en,Tweet,0,22,8,27,3654,2025-01-27 01:44:38,"<a href=""http://twitter.com/download/iphone"" rel=""nofollow"">Twitter for iPhone</a>",,,photo,https://pbs.twimg.com/media/GiQ4ZlsXgAASOh7.jpg
'1883277829183598601',Unfit to be our country’s top law enforcement officer.,en,Tweet,0,33,1,31,4029,2025-01-25 22:16:38,"<a href=""http://twitter.com/download/iphone"" rel=""nofollow"">Twitter for iPhone</a>",,,,
'1882597941778735128',100% true.,en,Tweet,0,28,7,20,3288,2025-01-24 01:15:00,"<a href=""http://twitter.com/download/iphone"" rel=""nofollow"">Twitter for iPhone</a>",,,,
'1881780365444215181',Amen.,en,Tweet,2,53,6,16,3155,2025-01-21 19:06:15,"<a href=""https://mobile.twitter.com"" rel=""nofollow"">Twitter Web App</a>",,,,
'1881543259291631905',"By pardoning these violent criminals, Donald Trump sends a message that you can attack police officers and try to overturn an election, and as long as you wave a MAGA banner you will be given a get out of jail free card. A dark day for our country.",en,Tweet,1,53,12,40,4784,2025-01-21 03:24:05,"<a href=""https://mobile.twitter.com"" rel=""nofollow"">Twitter Web App</a>",,,,
'1881375435357110684',"Sitting in the rotunda waiting for the inauguration to start…I have a good neighbor who is watching over us today, #MLKDay https://t.co/Gi8wsuf5cs",en,Tweet,0,13,0,2,768,2025-01-20 16:17:12,"<a href=""http://twitter.com/download/iphone"" rel=""nofollow"">Twitter for iPhone</a>",#MLKDay,,photo,"https://pbs.twimg.com/media/Ghv8-ZlWoAMWkL6.jpg,https://pbs.twimg.com/media/Ghv8-ZkW4AApl8j.jpg"
'1880685970686976312',"Last year I had to leave my wife and 1-day old daughter in the hospital to go back to DC to vote on Ukraine and Israel funding. 

I’m proud to co-sponsor @realannapaulina and @pettersen4co’s proxy voting bill and look forward to signing the discharge petition.",en,Tweet,0,30,11,28,7245,2025-01-18 18:37:31,"<a href=""http://twitter.com/download/iphone"" rel=""nofollow"">Twitter for iPhone</a>",,,,
'1880332112441848218',Won’t be the last time he leaves his supporters out in the cold.,en,Tweet,1,64,9,53,9129,2025-01-17 19:11:25,"<a href=""http://twitter.com/download/iphone"" rel=""nofollow"">Twitter for iPhone</a>",,,,
'1879704265922666953',He’s right.,en,Tweet,1,83,18,39,6602,2025-01-16 01:36:34,"<a href=""http://twitter.com/download/iphone"" rel=""nofollow"">Twitter for iPhone</a>",,,,
'1879345887610318943',"Ugh ok I'll bite. Guess who didn't attend the inauguration 4 years ago?
 
The same sore loser who didn't invite his successor to the White House, or concede the election he clearly lost. 

Fox News really thinks their viewers are idiots. And Michelle can do whatever she wants.",en,Tweet,37,2229,476,233,85686,2025-01-15 01:52:30,"<a href=""https://mobile.twitter.com"" rel=""nofollow"">Twitter Web App</a>",,,,
'1877188001903542649',"Love this. And I learned something new from @MarkHellendrung  -  Jimmy Carter signed the law that legalized home brewing. 

Well done @Gansettbeer. Cheers!",en,Tweet,0,20,3,5,1345,2025-01-09 02:57:50,"<a href=""https://mobile.twitter.com"" rel=""nofollow"">Twitter Web App</a>",,,,
'1875379666057584932',She’s not wrong. https://t.co/xhhSurU5wS,en,Tweet,6,299,89,34,7191,2025-01-04 03:12:09,"<a href=""http://twitter.com/download/iphone"" rel=""nofollow"">Twitter for iPhone</a>",,,photo,https://pbs.twimg.com/media/Ggav3KSXUAADQp4.jpg
'1874855237036748990',"Welcome back, Speaker!",en,Tweet,0,40,4,13,6346,2025-01-02 16:28:16,"<a href=""http://twitter.com/download/iphone"" rel=""nofollow"">Twitter for iPhone</a>",,,,
'1870124201689976852',"As usual, thinking only about himself.

Not about the troops who won’t get paid, or the chaos at the airports, or the impact on the economy. Just his own ego. https://t.co/SoS91MyjbF",en,Tweet,0,83,13,37,5129,2024-12-20 15:08:49,"<a href=""http://twitter.com/download/iphone"" rel=""nofollow"">Twitter for iPhone</a>",,,photo,https://pbs.twimg.com/media/GfQEDIVXUAA9GVL.jpg
'1870093365523456074',Why is America’s President-elect endorsing a German neo-Nazi party?,en,Tweet,2,43,11,6,3332,2024-12-20 13:06:17,"<a href=""http://twitter.com/download/iphone"" rel=""nofollow"">Twitter for iPhone</a>",,,,
'1869939296012034358',Same. Same.,en,Tweet,2,67,3,5,8361,2024-12-20 02:54:04,"<a href=""http://twitter.com/download/iphone"" rel=""nofollow"">Twitter for iPhone</a>",,,,
'1869879050354803164',"Billionaire Elon Musk is demanding cuts to funding for:

-Job training
-Clean water
-Housing, transportation &amp; food for seniors
-Cancer research for kids
-Health centers

or else he will order Republicans to shut down the government.

Trump may take orders from Musk,but we won’t.",en,Tweet,12,709,402,80,13329,2024-12-19 22:54:40,"<a href=""http://twitter.com/download/iphone"" rel=""nofollow"">Twitter for iPhone</a>",,,,
