tweet_id,text,language,type,bookmark_count,favorite_count,retweet_count,reply_count,view_count,created_at,client,hashtags,urls,media_type,media_urls
'1915059678725222900',"🧵The Trump Administration’s proposed State Department cuts do not make us safer, stronger, or more prosperous. This plan undermines our values and diminishes our role as a leader among nations. They have also been proposed without any consultation with the Congress, as required by law. I will demand answers from Secretary Rubio and oppose efforts to undermine the State Department’s important work.",en,Tweet,2,177,57,10,2950,2025-04-23 16:06:22,"<a href=""http://twitter.com/download/iphone"" rel=""nofollow"">Twitter for iPhone</a>",,,,
'1914752235969634434',"It was great to join @RepSylviaGarcia in East Aldine for a town hall to discuss the journey ahead to protect Social Security, Medicare, Medicaid, SNAP, and other benefits for our seniors.

Thank you for joining us and sharing your stories. https://t.co/bmfzoOj1vH",en,Tweet,0,25,9,6,3056,2025-04-22 19:44:42,"<a href=""http://twitter.com/download/iphone"" rel=""nofollow"">Twitter for iPhone</a>",,,photo,"https://pbs.twimg.com/media/GpKQ_VjWgAAa3M6.jpg,https://pbs.twimg.com/media/GpKQ_U9WQAAUifm.jpg,https://pbs.twimg.com/media/GpKQ_VeW4AAV4JT.jpg,https://pbs.twimg.com/media/GpKQ_U-XYAAaTnW.jpg"
'1914376146327609833',Pete Hegseth continues to put our national security and service members at risk. He’s demonstrated that he’s not up for the job. He should either resign or be fired by the President.,en,Tweet,4,436,90,290,15634,2025-04-21 18:50:15,"<a href=""http://twitter.com/download/iphone"" rel=""nofollow"">Twitter for iPhone</a>",,,,
'1914325486924112297',"Pope Francis was extraordinary, a leader who showed us love and light in a world full of darkness. He was a true advocate for the powerless and the marginalized. He never hesitated to speak out on injustice and didn’t mince words when others would. He lived and spoke with moral clarity, and he lifted the world with tremendous humility and grace. He inspired so many beyond the Church. A devastating loss for the world on this Easter Monday. Rest in peace.",en,Tweet,2,264,39,15,6957,2025-04-21 15:28:57,"<a href=""http://twitter.com/download/iphone"" rel=""nofollow"">Twitter for iPhone</a>",,,,
'1913954381193527400',Happy Easter!,en,Tweet,0,62,7,8,2839,2025-04-20 14:54:18,"<a href=""http://twitter.com/download/iphone"" rel=""nofollow"">Twitter for iPhone</a>",,,,
'1913239408125374848',"San Antonio: My office is hosting a Travel Fair on Saturday, April 26th. During the fair, you can apply for or renew your passport, enroll in TSA Pre-Check, or interview for Global Entry.

Appointments are required. To reserve your spot, please call my district office at (210) 348-8216. Please note that residents of the 20th District of Texas will be prioritized.",en,Tweet,0,15,1,2,1911,2025-04-18 15:33:15,"<a href=""http://twitter.com/download/iphone"" rel=""nofollow"">Twitter for iPhone</a>",,,photo,https://pbs.twimg.com/media/Go0xGeaXcAAOqW2.jpg
'1912979976049000646',.@RepGregoryMeeks and I demand to know the details of this deal. The Administration has twisted the law and already made a grave error sending Kilmar Abrego Garcia to a gulag in El Salvador.,en,Tweet,11,549,233,64,24741,2025-04-17 22:22:22,"<a href=""http://twitter.com/download/iphone"" rel=""nofollow"">Twitter for iPhone</a>",,,,
'1912672272441127263',"Happy Birthday to Selena Quintanilla! Though her life was tragically cut short, she inspired many with her powerful voice and talent. I was proud to honor her in Congress by helping to get, “Selena,” inducted into the prestigious National Film Registry in 2021. May her legacy in music and beyond live on.",en,Tweet,0,124,17,6,3935,2025-04-17 01:59:40,"<a href=""http://twitter.com/download/iphone"" rel=""nofollow"">Twitter for iPhone</a>",,,,
'1912603478993654071',"I hope the folks at the Texas House look at the facts, see how harmful it would be to their students, and vote this down.",en,Reply,0,16,2,1,1475,2025-04-16 21:26:18,"<a href=""http://twitter.com/download/iphone"" rel=""nofollow"">Twitter for iPhone</a>",,,,
'1912603476820963476',"Abbott's voucher scam will harm academics and athletics in public schools yet it does NOT:

• cover the cost of tuition at many private schools,
• require private schools to accept your child even if you can pay the tuition,
• or account for the fact that many private schools are not equipped to provide special education or other services.",en,Tweet,6,193,64,24,14495,2025-04-16 21:26:17,"<a href=""http://twitter.com/download/iphone"" rel=""nofollow"">Twitter for iPhone</a>",,,,
'1912569932602306826',"Every government official who serves our country makes a commitment to uphold the rule of law and our Constitution. But this Administration is doing the opposite—slashing due process and every constitutional tenet that holds our democracy together. 

Any official involved in this disaster is breaking the law. It’s time for the Administration to be held accountable for its crimes.",en,Tweet,1,88,21,15,7472,2025-04-16 19:13:00,"<a href=""http://twitter.com/download/iphone"" rel=""nofollow"">Twitter for iPhone</a>",,,,
'1912199415378362630',They absolutely should. The people of Texas deserve to vote on vouchers. @TexasHDC,en,Tweet,6,597,95,27,26691,2025-04-15 18:40:42,"<a href=""http://twitter.com/download/iphone"" rel=""nofollow"">Twitter for iPhone</a>",,,,
'1912166544911507803',"San Antonio: My office is hosting a Travel Fair on Saturday, April 26th. During the fair, you can apply for a passport, enroll in TSA Pre-Check, or interview for Global Entry.

The Travel Fair is open to the public but appointments are required. To reserve your spot, please call my district office at (210) 348-8216.",en,Tweet,2,19,4,2,2047,2025-04-15 16:30:05,"<a href=""http://twitter.com/download/iphone"" rel=""nofollow"">Twitter for iPhone</a>",,,photo,https://pbs.twimg.com/media/GolhVIhW8AAFR2Q.jpg
'1911800539722944955',"President Bukele is in Washington this week. Every reporter should not let him—or Donald Trump—off the hook and demand the details of these secret agreements being used to disappear U.S. residents, without due process, into gulags.",en,Reply,1,115,19,10,2789,2025-04-14 16:15:42,"<a href=""https://mobile.twitter.com"" rel=""nofollow"">Twitter Web App</a>",,,,
'1911800538028532163',My colleagues and I have made multiple inquiries demanding the details of these agreements and information on how the U.S. is paying the government of El Salvador to detain people on our behalf.,en,Reply,1,103,18,2,3219,2025-04-14 16:15:42,"<a href=""https://mobile.twitter.com"" rel=""nofollow"">Twitter Web App</a>",,,,
'1911800536657015118',"The State Department is obligated, by law, to report such agreements to the Congress. They have not yet done so.",en,Reply,1,101,21,1,1853,2025-04-14 16:15:42,"<a href=""https://mobile.twitter.com"" rel=""nofollow"">Twitter Web App</a>",,,,
'1911800534400446709',The Administration has admitted that they are doing this due to agreements reached with the government of El Salvador.,en,Reply,1,83,14,2,1623,2025-04-14 16:15:41,"<a href=""https://mobile.twitter.com"" rel=""nofollow"">Twitter Web App</a>",,,,
'1911800532898897931',"🧵The Administration is indiscriminately sending people — like Kilmar Abrego Garcia — to El Salvador’s brutal prison system. Donald Trump has openly said he wants to, and will, send U.S. citizens to El Salvador next.",en,Tweet,34,1262,473,168,46730,2025-04-14 16:15:41,"<a href=""https://mobile.twitter.com"" rel=""nofollow"">Twitter Web App</a>",,,,
'1910476598882492665',SCOTUS is doing the right thing. This is about the rule of law and due process. Kilmar Abrego Garcia should be reunited with his family.,en,Tweet,1,37,9,10,3837,2025-04-11 00:34:50,"<a href=""http://twitter.com/download/iphone"" rel=""nofollow"">Twitter for iPhone</a>",,,,
'1910451536150344183',"Despite a second child death in Texas, Governor Abbott has not said a word. Vaccine clinics in San Antonio have to close because of Republican funding cuts while we are experiencing the worst measles outbreak in decades. Lives are at stake—vaccines are needed to combat this outbreak.",en,Tweet,4,227,98,21,10192,2025-04-10 22:55:15,"<a href=""http://twitter.com/download/iphone"" rel=""nofollow"">Twitter for iPhone</a>",,,,
'1910393705539809739',Here is an update from me after today’s vote on the Republican budget resolution. https://t.co/HdMxzlpoew,en,Tweet,4,77,30,19,5431,2025-04-10 19:05:27,"<a href=""http://twitter.com/download/iphone"" rel=""nofollow"">Twitter for iPhone</a>",,,video,https://video.twimg.com/amplify_video/1910393645414391808/vid/avc1/720x1280/ygPBff4DJkKJpdTH.mp4?tag=16
'1910088938913722811',"Kilmar Abrego Garcia had a legal right to be in America. He’s a husband, father and working man. Not a criminal. Yet he was deported to a gulag in El Salvador with no due process and Presidents Trump and Bukele refuse to return him to his family in the U.S. We stood with his family today to demand Kilmar’s return.",en,Tweet,67,3745,1290,798,88897,2025-04-09 22:54:25,"<a href=""http://twitter.com/download/iphone"" rel=""nofollow"">Twitter for iPhone</a>",,,video,https://video.twimg.com/amplify_video/1910088870269509632/vid/avc1/720x1280/n8oEER6BFWdHic1u.mp4?tag=16
'1909959197955064143',"I am thrilled to share that three of the songs you helped me nominate were selected by the Library of Congress to be inducted into the prestigious National Recording Registry this year. Let’s celebrate the three iconic Latino music giants—Vicente Fernández, Freddy Fender, and Lin Manuel-Miranda—who were honored! 

Thank you for all your help curating this list.",en,Tweet,1,38,11,2,2507,2025-04-09 14:18:52,"<a href=""http://twitter.com/download/iphone"" rel=""nofollow"">Twitter for iPhone</a>",,,video,https://video.twimg.com/amplify_video/1909959075846123520/vid/avc1/636x1130/07Ucyq5zvJGOeE_a.mp4?tag=16
'1909706904345215051',"First things first: the impact of folks not filing their taxes because they are afraid of deportation would be detrimental to our economy.
 
Two: immigrants pay taxes but do not benefit from the social programs that most taxpayers do.
 
Three: everyone should be concerned about the privacy implications here. This sets the precedent that the federal government can arbitrarily share your personal information with law enforcement. And it's just wrong.",en,Tweet,293,7347,2232,2799,548441,2025-04-08 21:36:21,"<a href=""http://twitter.com/download/iphone"" rel=""nofollow"">Twitter for iPhone</a>",,,,
'1909328772328829204',The Administration cannot continue to abuse its power and ignore direct orders from federal judges. Kilmar Abrego Garcia must be brought back home tonight. The world is watching.,en,Tweet,13,492,89,131,34978,2025-04-07 20:33:47,"<a href=""http://twitter.com/download/iphone"" rel=""nofollow"">Twitter for iPhone</a>",,,,
'1908624370609561789',The Trump tariffs are already hurting Americans. Prices are going up. Companies are announcing layoffs. The stock market is tanking—making it harder for many seniors to retire when they want. This is hurting everyone and Republicans are helping it happen.,en,Tweet,0,162,44,105,9220,2025-04-05 21:54:45,"<a href=""http://twitter.com/download/iphone"" rel=""nofollow"">Twitter for iPhone</a>",,,,
'1907826721627242645',"Calling all high school artists of #TX20! My office is accepting submissions for the 2025 Congressional Art Competition until April 18th.  

The winner will have their art displayed in the U.S. Capitol for one year. I look forward to seeing all the talent San Antonio has to offer! 

To apply and learn more visit [https://t.co/2EG87r3NZW].",en,Tweet,0,9,4,0,1846,2025-04-03 17:05:10,"<a href=""http://twitter.com/download/iphone"" rel=""nofollow"">Twitter for iPhone</a>",#TX20,,photo,https://pbs.twimg.com/media/Gnn2Sh4XUAAsllM.jpg
'1907598108621525354',https://t.co/gtROGYt8aR,zxx,Tweet,2,99,21,21,5738,2025-04-03 01:56:45,"<a href=""http://twitter.com/download/iphone"" rel=""nofollow"">Twitter for iPhone</a>",,,photo,https://pbs.twimg.com/media/GnkmXlkXIAAEXYX.jpg
'1907234498451738807',"An incredible example of what grit looks like. In the past 24+ hours, @SenBooker spoke to the experiences of countless Americans in a voice so clear and so true. Thank you for your courage and your leadership during these times.",en,Tweet,4,267,51,15,9285,2025-04-02 01:51:53,"<a href=""http://twitter.com/download/iphone"" rel=""nofollow"">Twitter for iPhone</a>",,,,
'1907129927729627226',"The Trump Administration admitted it made a mistake deporting Kilmar Abrego Garcia to El Salvador, even though he had protected status in the United States and had no criminal record.
 
But they are refusing to take responsibility for this grave error and bring Mr. Garcia back home to the United States, where his wife and child are. They must do so now.",en,Tweet,3,144,39,37,10823,2025-04-01 18:56:22,"<a href=""http://twitter.com/download/iphone"" rel=""nofollow"">Twitter for iPhone</a>",,,,
'1906915308754849895',San Antonio is U.S. city to be most hurt by Trump's new Canadian tariffs  https://t.co/bWfb0OsJqP via @expressnews,en,Tweet,1,18,9,4,3068,2025-04-01 04:43:33,"<a href=""http://twitter.com/download/iphone"" rel=""nofollow"">Twitter for iPhone</a>",,https://www.expressnews.com/business/article/san-antonio-canada-tariffs-exports-toyota-20244064.php?utm_campaign=CMS%20Sharing%20Tools%20(Premium)&utm_source=t.co&utm_medium=referral,,
'1906895855971434940',I strongly agree with @SenTedCruz. A third term for Donald Trump would be unconstitutional.,en,Tweet,2,110,13,9,12573,2025-04-01 03:26:15,"<a href=""http://twitter.com/download/iphone"" rel=""nofollow"">Twitter for iPhone</a>",,,,
'1906713727216292317',"I had a great time hearing from you all at Saturday’s town hall with Rep. Fischer and Mayor Nirenberg.

Every time we gather, I am reminded of  the power of unity and how much we can achieve when we work together. 

Thank you all for coming out. https://t.co/LZUsJaU5lM",en,Tweet,1,162,35,19,14542,2025-03-31 15:22:32,"<a href=""http://twitter.com/download/iphone"" rel=""nofollow"">Twitter for iPhone</a>",,,photo,https://pbs.twimg.com/media/GnYCBxVXkAAfuk_.jpg
'1905767601923674308',"Who the hell thinks it’s a good idea to stop trying to prevent HIV and infectious diseases? 

I have never heard a single constituent - Democrat or Republican - ask for this level of crazy shit.

These guys are going to get many Americans killed. 

I will support lawsuits, vote to block his funding, and support his removal.",en,Tweet,61,3783,1310,232,85774,2025-03-28 23:42:58,"<a href=""http://twitter.com/download/iphone"" rel=""nofollow"">Twitter for iPhone</a>",,,,
'1905691684782178336',"President Trump is trying to destroy unions, who have been the driving force for protecting workers’ rights for over a century. 

We need to continue to fight back and fight for hardworking folks who serve the American public. They should not be under attack and this order cannot stand.",en,Tweet,8,190,65,38,20101,2025-03-28 18:41:18,"<a href=""http://twitter.com/download/iphone"" rel=""nofollow"">Twitter for iPhone</a>",,,,
'1905355238229639289',Republicans in Congress need to decide if they care more about Elon Musk's money and staying in good standing with Donald Trump than our national security. https://t.co/uOAUubIUop,en,Tweet,5,210,81,32,13796,2025-03-27 20:24:23,"<a href=""http://twitter.com/download/iphone"" rel=""nofollow"">Twitter for iPhone</a>",,,video,https://video.twimg.com/amplify_video/1905355179605524480/vid/avc1/1280x720/VXMaCecT5VqRZteA.mp4?tag=16
'1905315642330226822',"Donald Trump nominated and put into place the most unqualified cabinet in American history. They are threatening our national security, putting servicemembers at risk, and insulting the American people. https://t.co/Ymr5TNvz9a",en,Tweet,2,75,20,15,2408,2025-03-27 17:47:02,"<a href=""http://twitter.com/download/iphone"" rel=""nofollow"">Twitter for iPhone</a>",,,video,https://video.twimg.com/amplify_video/1905315577071063040/vid/avc1/1080x600/slMBqcQnqKeaCNo6.mp4?tag=16
'1904952238230974507',"I just questioned our nation’s top national security officials in the House Intelligence Committee hearing. They could not admit that the messages in their signal chat were classified. This is ridiculous, they know better, and they are lying to the American people. Pete Hegseth must resign.",en,Tweet,61,3295,887,272,92712,2025-03-26 17:43:00,"<a href=""http://twitter.com/download/iphone"" rel=""nofollow"">Twitter for iPhone</a>",,,video,https://video.twimg.com/amplify_video/1904952010476023808/vid/avc1/1078x606/YPK5iS0Fm0ujcAZ_.mp4?tag=16
'1904608980858515697',Thank you to the Center for Effective Lawmaking for this honor. So much of the legislative process is a grind and requires incredible patience and persistence. I want to recognize my staff for their hard work throughout the years on behalf of Texans and all Americans. https://t.co/CTd9Bd8VAb,en,Tweet,1,71,14,19,4877,2025-03-25 18:59:01,"<a href=""http://twitter.com/download/iphone"" rel=""nofollow"">Twitter for iPhone</a>",,,photo,https://pbs.twimg.com/media/Gm6HxjpWgAAgnKO.jpg
'1904548293637455970',San Antonio: This Saturday at 10 AM I’ll be joining State Rep. @TMFtx and SA Mayor @Ron_Nirenberg for a townhall. We want to hear from you.  RSVP now! https://t.co/VgX1pKdCEo https://t.co/LErGVhFiHS,en,Tweet,1,8,3,1,1653,2025-03-25 14:57:52,"<a href=""http://twitter.com/download/iphone"" rel=""nofollow"">Twitter for iPhone</a>",,https://tinyurl.com/TMFTOWNHALL,photo,https://pbs.twimg.com/media/Gm5LetzXAAA2jIH.jpg
'1904233566562918485',"Senior Trump administration officials, including the Vice President, Secretary of State, Secretary of Defense, and CIA Director, discussed military strikes on an unclassified group chat. They even accidentally invited a journalist to that chat. 

This is reckless behavior that directly jeopardizes U.S. national security and the safety of our servicemembers in the Middle East. This should stun all Americans regardless of political party. 

Every single government official on this group chat needs to be held accountable.",en,Tweet,15,738,211,54,31661,2025-03-24 18:07:15,"<a href=""http://twitter.com/download/iphone"" rel=""nofollow"">Twitter for iPhone</a>",,,,
'1903860717683425500',"It was great to be on the west side of SA yesterday where I grew up and on a very special day. César Chávez helped change American society. He stood up for people in the fields that were being abused and exploited, and gave them a voice. 

Just like César Chávez stood up, we must continue to fight and speak up. The future of our country depends on it.",en,Tweet,0,40,7,1,2443,2025-03-23 17:25:41,"<a href=""http://twitter.com/download/iphone"" rel=""nofollow"">Twitter for iPhone</a>",,,photo,"https://pbs.twimg.com/media/GmvfN_EWUAA9rjN.jpg,https://pbs.twimg.com/media/GmvfN_MWAAAdo3q.jpg,https://pbs.twimg.com/media/GmvfN_GWIAAB1j7.jpg,https://pbs.twimg.com/media/GmvfN_GWgAECmg1.jpg"
'1903236698831487273',"If this video doesn’t prove to folks how out of touch these billionaires are, then I don’t know what will. 

My grandmother, after working for many years as a cook, a maid, and a babysitter, depended on her Social Security check to live. The Commerce Secretary clearly doesn’t care about the challenges our seniors face. Trump’s entire Administration needs a reality check.",en,Tweet,4,278,110,15,11299,2025-03-22 00:06:04,"<a href=""http://twitter.com/download/iphone"" rel=""nofollow"">Twitter for iPhone</a>",,,,
'1902841612847431908',"The Department of Education was created to give all students — no matter their income, geographical region or disability status — a quality education and a fair shot at getting ahead. 
 
Our teachers, students, and parents at underfunded schools are already struggling. The repercussions of Trump’s selfish decision will affect more than students. Hard-working teachers and parents will be left without guidance and programs that help their students succeed.
 
These cuts could lead to larger class sizes, loss of critical school programs and access to affordable college tuition. Trump’s dog and pony show is not only weakening the Department but our future workforce across the board. Education is the backbone of our country and getting an education is a critical part of the American dream. An attack on the Department of Education is an attack on all of us and we will not go down without a fight.",en,Tweet,8,218,70,25,6174,2025-03-20 21:56:08,"<a href=""http://twitter.com/download/iphone"" rel=""nofollow"">Twitter for iPhone</a>",,,,
'1902121740253253961',"I am extremely disturbed that hundreds of Palestinian civilians have been killed in just the last day. Reigniting this war does not make Israel safer or free the hostages. The ceasefire agreement that was reached in January is the best way to achieve lasting security for Palestinians and Israelis. 

Prime Minister Netanyahu is prioritizing his own political survival while making long term peace much harder to achieve.",en,Tweet,120,6978,1281,439,149503,2025-03-18 22:15:37,"<a href=""http://twitter.com/download/iphone"" rel=""nofollow"">Twitter for iPhone</a>",,,,
'1902045657138905433',"To be clear, slashing Medicaid will affect more than low-income families. Medicaid is a lifeline for disabled Americans, senior citizens, children, and pregnant women. ALL will be affected.",en,Reply,0,27,6,2,1736,2025-03-18 17:13:17,"<a href=""http://twitter.com/download/iphone"" rel=""nofollow"">Twitter for iPhone</a>",,,,
'1902045648041775554',"Out of touch billionaires should not dictate the future of healthcare in America. Today, on Medicaid Day of Action, Democrats stand united against any action that threatens funding for Medicaid.

I will continue to fight against Musk’s plan to slash Medicaid.",en,Tweet,0,75,17,14,2658,2025-03-18 17:13:15,"<a href=""http://twitter.com/download/iphone"" rel=""nofollow"">Twitter for iPhone</a>",,,,
'1901767936458862780',"Trump has abused the Alien Enemies Act, allowing him to indiscriminately deport people with no oversight or recourse. It is a wartime measure that previously ushered us into a dark era of bigotry and cruelty in WW2—throwing Japanese, German, and Italian Americans into internment camps. 

Trump’s use of this law to deport more than 200 people without due process is taking us back to that dark era. 

The White House is scrambling to justify and spin going against the judge’s clear order. There’s no justification for this. Trump is lawless, hoping the American people just won’t notice. He may try to parade his immigration operation as a success with a highly produced video. But it’s the opposite: his actions are reckless and ineffective, and don’t actually solve the root causes of migration. It’s shameful. For Trump cruelty really is the point.",en,Tweet,12,331,118,112,12009,2025-03-17 22:49:43,"<a href=""http://twitter.com/download/iphone"" rel=""nofollow"">Twitter for iPhone</a>",,,,
'1901368320487460968',"Nita Lowey was a force. She devoted more than three decades of her life serving in Congress, fighting for women’s rights, education, and medical research.  She showed tenacity not only as the first female chair of the House Appropriations Committee but as a friend to and fighter for all. She will be missed.",en,Tweet,0,43,9,2,3810,2025-03-16 20:21:47,"<a href=""http://twitter.com/download/iphone"" rel=""nofollow"">Twitter for iPhone</a>",,,,
'1901063215414411624',We must continue to fight back. The Alien Enemies Act is a wartime measure that has left a very dark stain on our nation’s history. This takes us down a dangerous road and the courts must continue to hold this Administration accountable.,en,Tweet,10,671,193,41,34516,2025-03-16 00:09:25,"<a href=""http://twitter.com/download/iphone"" rel=""nofollow"">Twitter for iPhone</a>",,,,
'1900939433698082905',I hope that Trump allows this 10-year-old’s family to be on humanitarian parole so that they can come back to the U.S. and get their daughter—a U.S. citizen— the care she needs. She will die because of what this Administration did. Trump needs to undo this damage now and save her life.,en,Tweet,6,189,88,24,15663,2025-03-15 15:57:33,"<a href=""http://twitter.com/download/iphone"" rel=""nofollow"">Twitter for iPhone</a>",,,video,https://video.twimg.com/amplify_video/1900939345084686336/vid/avc1/720x1280/LH0fSfID_n0ADQsx.mp4?tag=16
'1900669662808990158',"Trump has offered a “gold card” for citizenship to anyone who can pay $5 million dollars. And yet, he won’t let a 10-year-old girl with brain cancer—a U.S. citizen—remain in Texas with her family to receive her treatment. It’s despicable. https://t.co/xZoEd1nX8w",en,Tweet,46,2502,1155,94,42633,2025-03-14 22:05:35,"<a href=""http://twitter.com/download/iphone"" rel=""nofollow"">Twitter for iPhone</a>",,,video,https://video.twimg.com/amplify_video/1900669599026475011/vid/avc1/1280x720/Hu12r7V2NT3kDX9d.mp4?tag=16
'1900650263876092410',"If President Trump invokes the Alien Enemies Act to start mass deportations, it would be an abuse of power. It is a wartime measure, most recently used in WW2 to intern many Japanese, Italian, and German Americans—and it has remained a dark stain on the nation’s history. https://t.co/PJzDfM2ZsI",en,Tweet,52,470,164,58,40726,2025-03-14 20:48:29,"<a href=""http://twitter.com/download/iphone"" rel=""nofollow"">Twitter for iPhone</a>",,,video,https://video.twimg.com/amplify_video/1900650198440779778/vid/avc1/1280x720/tTHicSNd04MQ4Aem.mp4?tag=16
