tweet_id,text,language,type,bookmark_count,favorite_count,retweet_count,reply_count,view_count,created_at,client,hashtags,urls,media_type,media_urls
'1970164250502115588',Great to welcome Killeen ISD leaders to Washington. We had productive conversations on impact aid and other key issues facing our military families. Always proud to advocate for Central Texas students and service members. https://t.co/rZ8vrfwDeg,en,Tweet,0,3,1,2,328,2025-09-22 17:32:15,"<a href=""https://mobile.twitter.com"" rel=""nofollow"">Twitter Web App</a>",,,photo,https://pbs.twimg.com/media/G1dt7PdWABwjLXh.jpg
'1968390218823664045',"Always great to see Jason Kim, CEO of @Firefly_Space and constituent. Firefly has done amazing things, including landing on the moon this year. I can’t wait to see what they do next right here in Texas’ 31st district. https://t.co/nL8ZHvxMuj",en,Tweet,2,96,8,2,11290,2025-09-17 20:02:53,"<a href=""http://twitter.com/download/iphone"" rel=""nofollow"">Twitter for iPhone</a>",,,photo,https://pbs.twimg.com/media/G1EgeLKXUAAWwS6.jpg
'1968348902593319269',Today we celebrate #NationalAppChallengeDay!  I encourage all young coders in #TX31 to submit their innovative apps by October 30th. The Congressional App Challenge is your chance to shine and contribute to the future of technology! #Congress4CS https://t.co/cmLF2gqUif,en,Tweet,0,3,0,0,343,2025-09-17 17:18:43,"<a href=""https://mobile.twitter.com"" rel=""nofollow"">Twitter Web App</a>","#NationalAppChallengeDay,#TX31,#Congress4CS",,photo,https://pbs.twimg.com/media/G1D6hNhWMAA1e3q.jpg
'1968055701307265263',The deadline to apply for a nomination through my office is October 3rd at 5:00 pm. To learn more: https://t.co/UoT594wLrT,en,Reply,0,2,0,0,245,2025-09-16 21:53:38,"<a href=""http://twitter.com/download/iphone"" rel=""nofollow"">Twitter for iPhone</a>",,http://Carter.house.gov/academy-nominations,,
'1968055697389859107',"We had a great turn out the 2025 Service Academy Forum this weekend. Over one hundred students who are interested in serving in the U.S. military, came out to learn about the service academy nomination and appointment process. https://t.co/JiT098UKJ1",en,Tweet,0,7,1,4,348,2025-09-16 21:53:37,"<a href=""http://twitter.com/download/iphone"" rel=""nofollow"">Twitter for iPhone</a>",,,photo,"https://pbs.twimg.com/media/G0_wOP8WcAASl3X.jpg,https://pbs.twimg.com/media/G0_wOP6WwAAcny-.jpg,https://pbs.twimg.com/media/G0_wOP_WUAAtT1i.jpg,https://pbs.twimg.com/media/G0_wOP9XEAATaa_.jpg"
'1966163265484156990',"Twenty-four years ago, our nation was attacked by evil, and 2,977 innocent souls perished. May we never forget the pain of that day, and the bravery of the first responders who ran toward danger. https://t.co/4jpuOul5Va",en,Tweet,0,5,1,0,479,2025-09-11 16:33:46,"<a href=""https://mobile.twitter.com"" rel=""nofollow"">Twitter Web App</a>",,,photo,https://pbs.twimg.com/media/G0k2I2SXAAA0ECE.png
'1965888011771765058',"Charlie was devoted to civil political discourse and respectful debate- a core principle of our country. His death is an immense tragedy that never should've happened. 

We lift Charlie's wife and two children in prayer.",en,Tweet,0,12,1,0,768,2025-09-10 22:20:01,"<a href=""https://mobile.twitter.com"" rel=""nofollow"">Twitter Web App</a>",,,,
'1965853443094175792',Please join me in praying for Charlie Kirk.,en,Tweet,0,12,0,1,1185,2025-09-10 20:02:39,"<a href=""https://mobile.twitter.com"" rel=""nofollow"">Twitter Web App</a>",,,,
'1965488044846317639',"In August, my office helped over 200 constituents with issues like delayed IRS refunds and Social Security payments, slow veterans benefits, and passport emergencies. Through those efforts, we returned $736,650 to TX-31 constituents last month.
Learn more about the constituent services my office offers here: https://t.co/UbqFriqW5J",en,Tweet,0,1,0,2,348,2025-09-09 19:50:41,"<a href=""https://mobile.twitter.com"" rel=""nofollow"">Twitter Web App</a>",,,photo,https://pbs.twimg.com/media/G0bQ5BJWEAAisFh.jpg
'1965129341269885269',"If your son or daughter is interested in attending a United States service academy, I encourage them to attend the 2025 Service Academy Forum this Saturday at Cedar Ridge High School.
Representatives from the service academies, as well as several congressional offices, will be on hand to answer questions about the process and each academy. This a free event with no RSVP necessary.
To learn more about the nomination process: https://t.co/i2UhitEE80",en,Tweet,0,3,0,0,258,2025-09-08 20:05:19,"<a href=""https://mobile.twitter.com"" rel=""nofollow"">Twitter Web App</a>",,,photo,https://pbs.twimg.com/media/G0WKtfeXUAAtDAw.jpg
'1962608252169969934',"Today we celebrate the grit, determination and spirit of the American worker that makes our country great 🇺🇸 https://t.co/LCZYKlHTuV",en,Tweet,0,5,0,3,464,2025-09-01 21:07:25,"<a href=""http://twitter.com/download/iphone"" rel=""nofollow"">Twitter for iPhone</a>",,,photo,https://pbs.twimg.com/media/GzyVybbWgAAesCA.jpg
'1961108723914735911',"REMINDER: Congressional Veteran Commendation (CVC) nominations are due tomorrow. If you know an outstanding veteran that served our nation and is now serving our community, please take a second to nominate them for a CVC.
Learn more &gt;&gt;&gt; https://t.co/Kgn0evcLdH https://t.co/WDsMY7oDoI",en,Tweet,0,3,0,3,321,2025-08-28 17:48:50,"<a href=""https://mobile.twitter.com"" rel=""nofollow"">Twitter Web App</a>",,http://carter.house.gov/cvc_program,photo,https://pbs.twimg.com/media/GzdB_LvWEAADShH.jpg
'1960757999544184945',Please join me in praying for the victims and families of the Annunciation Catholic School.,en,Tweet,0,10,0,4,517,2025-08-27 18:35:10,"<a href=""https://mobile.twitter.com"" rel=""nofollow"">Twitter Web App</a>",,,,
'1955661581750350318',Great to meet with TX31 farmers and ranchers to discuss several agriculture issues like solar power and dangerous insects threatening livestock. These hardworking men and women put food on the tables of Americans across the country. God bless America’s farmers and ranchers! https://t.co/57TcWWSM6e,en,Tweet,1,6,1,7,638,2025-08-13 17:03:50,"<a href=""http://twitter.com/download/iphone"" rel=""nofollow"">Twitter for iPhone</a>",,,photo,https://pbs.twimg.com/media/GyPnv41XEAEcSAV.jpg
'1953166204706701746',Erika and I are heartbroken by the news out of Fort Stewart. We’re praying for the five soldiers injured in today’s shooting and for their families. Please join us in lifting up all the brave men and women who serve our nation.,en,Tweet,0,5,0,0,708,2025-08-06 19:48:05,"<a href=""https://mobile.twitter.com"" rel=""nofollow"">Twitter Web App</a>",,,,
'1952391544314458266',"Since 1790, the @USCG has answered the call to protect our nation's maritime security. Happy Birthday, U.S. Coast Guard! https://t.co/eDexKJNOKn",en,Tweet,0,6,1,3,506,2025-08-04 16:29:52,"<a href=""https://mobile.twitter.com"" rel=""nofollow"">Twitter Web App</a>",,,photo,https://pbs.twimg.com/media/GxhJc_YWYAAZw5X.jpg
'1949894946003021939',"𝗗𝗼 𝘆𝗼𝘂 𝗸𝗻𝗼𝘄 𝗮𝗻 𝗼𝘂𝘁𝘀𝘁𝗮𝗻𝗱𝗶𝗻𝗴 𝘃𝗲𝘁𝗲𝗿𝗮𝗻?
The Congressional Veteran Commendation is designed to honor both the military service and community service of Veterans living in the 31st Congressional District of Texas. Nominations are due August 29, 2025.
To nominate a deserving veteran and learn more, visit: https://t.co/ywa8go6SDR",en,Tweet,0,9,0,5,550,2025-07-28 19:09:17,"<a href=""https://mobile.twitter.com"" rel=""nofollow"">Twitter Web App</a>",,,photo,https://pbs.twimg.com/media/Gw9rGj0XQAADuTU.jpg
'1946283027799347564',"Williamson County Residents: Beginning Friday, July 18th, a Disaster Recovery Center will provide face-to-face help to flood survivors with damage. No appointment is needed. The center is located at:

Williamson County EMS North Campus
Classroom A & B
3189 SE Inner Loop, Suite A
Georgetown, TX 78626
Hours: 8 a.m. to 7 p.m. daily",en,Tweet,0,5,0,8,560,2025-07-18 19:56:48,"<a href=""https://mobile.twitter.com"" rel=""nofollow"">Twitter Web App</a>",,,,
'1942282012603133972',It is crucial for Central Texans who suffered property damage from the July 4th weekend floods to report that damage to the Texas Division of Emergency Management's damage survey. Damage assessments help secure appropriate funding to rebuild. Fill out that survey here: https://t.co/XDlIba34j0,en,Tweet,0,4,4,0,529,2025-07-07 18:58:12,"<a href=""https://mobile.twitter.com"" rel=""nofollow"">Twitter Web App</a>",,,,
'1941926338778239224',"Erika and I are grieving along with our fellow Texans for the tragic loss of life that has occurred over the last 3 days. No parent should have to feel the pain of losing their precious child and countless families are forever changed. We are praying for God to lay his hands on the Hill Country, Central Texas and the first responders tirelessly working throughout the devastation.",en,Tweet,0,10,0,3,728,2025-07-06 19:24:53,"<a href=""http://twitter.com/download/iphone"" rel=""nofollow"">Twitter for iPhone</a>",,,,
'1941491051983929467',A message from Williamson County emergency services: https://t.co/zdNcJCgObo,en,Tweet,0,3,1,2,488,2025-07-05 14:35:12,"<a href=""http://twitter.com/download/iphone"" rel=""nofollow"">Twitter for iPhone</a>",,,photo,https://pbs.twimg.com/media/GvGP0dIXkAAjr12.jpg
'1941488356317331883',"Several areas of #TX31 are experiencing flooding. Follow first responder instructions and stay up-to-date on local conditions. Turn around, don't drive through high water!",en,Tweet,0,4,3,4,794,2025-07-05 14:24:29,"<a href=""http://twitter.com/download/iphone"" rel=""nofollow"">Twitter for iPhone</a>",#TX31,,,
'1940843821484720473',"I just voted YES to send the One Big Beautiful Bill to @POTUS desk. This bill delivers the largest tax cut in history for middle- and working-class families, with no tax on overtime and tips, and a permanent increase in the Child Tax Credit. This bill means more money in Americans' pockets.",en,Tweet,0,18,3,15,1158,2025-07-03 19:43:20,"<a href=""https://mobile.twitter.com"" rel=""nofollow"">Twitter Web App</a>",,,,
'1937988439275934078',.@HouseGOP is committed to taking care of America's heroes and their families 🇺🇸 My Military Construction and Veterans Affairs Appropriations Act has officially passed the House. This bill reflects our fight to ensure those who serve our nation have the support they deserve. https://t.co/Y6BGIYSqTv,en,Tweet,0,19,5,4,5868,2025-06-25 22:37:04,"<a href=""https://mobile.twitter.com"" rel=""nofollow"">Twitter Web App</a>",,,photo,https://pbs.twimg.com/media/GuUdKC0XkAAhMUx.jpg
'1937886822555644169',"Today, the House will consider my Military Construction and Veterans Affairs Appropriations Act. This bill:
➡️Fully funds veterans' health care
➡️ Invests in military housing & child development centers 
➡️ Focuses on ending veteran homelessness 
➡️ Invests in infrastructure in the Pacific to deter China's aggression",en,Tweet,0,12,3,4,2597,2025-06-25 15:53:17,"<a href=""https://mobile.twitter.com"" rel=""nofollow"">Twitter Web App</a>",,,photo,https://pbs.twimg.com/media/GuTBs3LXwAEqjsy.jpg
'1936611491928473862',I have long believed that Iran cannot obtain a nuclear weapon. The President took appropriate action to ensure that doesn’t happen. I’m thankful for the brave warriors that successfully carried out their mission. God bless the USA!,en,Tweet,0,61,10,12,5307,2025-06-22 03:25:34,"<a href=""http://twitter.com/download/iphone"" rel=""nofollow"">Twitter for iPhone</a>",,,,
'1933659229820174367',"Israel is one of America’s most trusted and vital allies in the Middle East. By taking decisive action to disrupt Iran’s nuclear ambitions, Israel is helping make the world safer. I’m proud to stand shoulder-to-shoulder with our great ally, Israel. #PrayForIsrael",en,Tweet,0,24,4,17,8176,2025-06-13 23:54:20,"<a href=""http://twitter.com/download/iphone"" rel=""nofollow"">Twitter for iPhone</a>",#PrayForIsrael,,,
'1930630757011071142',"This weekend, we proudly celebrated our Class of 2029 Academy Appointees. In just a few weeks, these exceptional young men and women will begin their journey at a U.S. military service academy, preparing to become officers in our Armed Forces. These are the best and the brightest, and I know they will represent Texas' 31st district well.  Please join me in wishing them well!",en,Tweet,0,2,0,5,450,2025-06-05 15:20:16,"<a href=""https://mobile.twitter.com"" rel=""nofollow"">Twitter Web App</a>",,,photo,https://pbs.twimg.com/media/Gsr6YIEW8AAn9vJ.jpg
'1928467974874096125',"This month, my office resolved 236 cases with federal agencies and helped folks get back what’s rightfully theirs: $475,330 in owed IRS refunds, back Social Security payments, and earned veterans’ benefits. That’s money back in the pockets of constituents!
If you’re having trouble navigating federal agencies, my office is here to help. We fight for you!
Learn more >>> https://t.co/UbqFriqW5J",en,Tweet,0,4,0,5,453,2025-05-30 16:06:09,"<a href=""https://mobile.twitter.com"" rel=""nofollow"">Twitter Web App</a>",,,photo,https://pbs.twimg.com/media/GsNLVWhWoAAaJ72.jpg
'1926994003494425064',"Let us never forget the cost of liberty and the heroes who paid the ultimate price to preserve it.

May God bless our fallen warriors, their families, and the country they so selflessly served. https://t.co/paEK9hbJXK",en,Tweet,0,5,0,6,393,2025-05-26 14:29:06,"<a href=""http://twitter.com/download/iphone"" rel=""nofollow"">Twitter for iPhone</a>",,,photo,https://pbs.twimg.com/media/Gr4O1SdXoAAXcxP.jpg
'1924243441774404082',"As a prostate cancer survivor, I’m saddened to hear this news. Putting politics aside, I wish for a speedy recovery for former President Biden.",en,Tweet,0,11,0,4,1072,2025-05-19 00:19:21,"<a href=""http://twitter.com/download/iphone"" rel=""nofollow"">Twitter for iPhone</a>",,,,
'1920928696921116697',"Great to welcome @FBIDirectorKash for his testimony in front of the Commerce, Justice and Science Appropriations subcommittee this week. Under his leadership, I’m confident the FBI is focused on its mission to uphold the rule of law. https://t.co/e6LHHjSUvQ",en,Tweet,0,13,1,15,1212,2025-05-09 20:47:45,"<a href=""https://mobile.twitter.com"" rel=""nofollow"">Twitter Web App</a>",,,photo,https://pbs.twimg.com/media/GqiCXMpW8AA6QHJ.jpg
'1917998642658767315',"I appreciate @SecArmy and Gen. George taking the time to discuss the Army’s modernization directive with me this week, including the merger of AFC and TRADOC into a single four-star command based in Austin. I look forward to working together to modernize the Army and support our warfighters.",en,Tweet,2,7,0,10,2492,2025-05-01 18:44:45,"<a href=""http://twitter.com/download/iphone"" rel=""nofollow"">Twitter for iPhone</a>",,,,
'1917258083018907667',"Join me in congratulating Emerson Black, a senior at Salado High School, for winning the 2025 Congressional Art Competition with her piece ""Leave your Past Behind.""

Emerson's artwork will hang in the United States Capitol for millions of visitors to enjoy for the next year. She has also earned a trip to Washington, DC to attend the winners' reception. Congratulations, Emerson!",en,Tweet,0,13,5,6,644,2025-04-29 17:42:02,"<a href=""https://mobile.twitter.com"" rel=""nofollow"">Twitter Web App</a>",,,photo,https://pbs.twimg.com/media/Gpt3v75XEAAKgBY.jpg
'1914049850179768653',"This Easter, Erika and I join you in celebrating the resurrection of our Lord and Savior, Jesus Christ.

It’s a day of hope, renewal, and joy—a time to gather with loved ones and reflect on the blessings we’ve been given. May your heart be filled with peace and your home with happiness.

From our family to yours, Happy Easter!",en,Tweet,0,8,1,13,580,2025-04-20 21:13:40,"<a href=""http://twitter.com/download/iphone"" rel=""nofollow"">Twitter for iPhone</a>",,,photo,https://pbs.twimg.com/media/GpASMbnXoAAhbBM.jpg
'1912560613924249647',Great meeting with Legal Services Corporation to discuss protecting free legal services to vulnerable veterans. https://t.co/nfBThC9ayV,en,Tweet,0,9,3,8,647,2025-04-16 18:35:58,"<a href=""http://twitter.com/download/iphone"" rel=""nofollow"">Twitter for iPhone</a>",,,photo,https://pbs.twimg.com/media/GorHvX0XIAA_izn.jpg
'1912240291035164810',"Last week, House Republicans passed the budget resolution to set in motion the delivery of one big, beautiful bill to fulfill President Trump's America First agenda. Up next is the Reconciliation Bill, which will provide critical resources to support our Border Patrol agents, accelerate the removal of criminal illegal aliens, invest in technology to strengthen border enforcement, and build the wall.",en,Tweet,0,3,0,6,430,2025-04-15 21:23:07,"<a href=""https://mobile.twitter.com"" rel=""nofollow"">Twitter Web App</a>",,,photo,https://pbs.twimg.com/media/GomkVwMXEAAqxF8.jpg
'1911837136254615830',Many folks don’t know that I worked my way through law school as a school bus driver. So when I heard about the bus driver shortages keeping kids from getting to school—and learned that a bureaucratic under-the-hood testing requirement was stopping qualified drivers from getting behind the wheel—I introduced the Driving Forward Act. This bill will permanently eliminate the mechanic test so qualified drivers can fill vacancies and help get students to school.,en,Tweet,1,8,2,5,727,2025-04-14 18:41:08,"<a href=""https://mobile.twitter.com"" rel=""nofollow"">Twitter Web App</a>",,,photo,https://pbs.twimg.com/media/Gog1rtNW8AAey4Q.jpg
'1909607164752101407',"This morning, I’m holding an oversight hearing on quality of life in the Army, Navy, Marine Corps, Air Force, and Space Force. As Chairman of the MilCon-VA Subcommittee, ensuring our service members and their families have quality housing, facilities, and support is a top priority. Tune in: https://t.co/3Cw7s1s6Ah",en,Tweet,0,9,1,5,514,2025-04-08 15:00:01,"<a href=""http://twitter.com"" rel=""nofollow"">Twitter Web Client</a>",,,,
'1907514855587983827',"My office is here to serve YOU. Whether it’s a delayed Social Security check, owed veterans benefits, or an IRS refund stuck behind red tape, we’re proud to fight on your behalf.
In March, we helped 213 Central Texans and returned over $63,000 back to constituents.
Learn more: https://t.co/IxhmHUA2GG",en,Tweet,0,6,2,7,649,2025-04-02 20:25:56,"<a href=""https://mobile.twitter.com"" rel=""nofollow"">Twitter Web App</a>",,,photo,https://pbs.twimg.com/media/GnjamILXoAApuL5.jpg
'1906797736407580797',"Great to meet with constituents that are a part of the Foodservice Equipment Distributors Association. We discussed lowering taxes, reducing burdensome regulations, labor shortages and trade policy. https://t.co/zLUREkIQyY",en,Tweet,0,3,0,4,605,2025-03-31 20:56:21,"<a href=""http://twitter.com/download/iphone"" rel=""nofollow"">Twitter for iPhone</a>",,,photo,https://pbs.twimg.com/media/GnZObq1WwAA1UI1.jpg
'1905331354939936915',"2/2 Whether it was malice or incompetence, the reality is that the Biden VA lied to Congress and as chairman of the Veterans Affairs Appropriations Subcommittee, I will ensure those responsible are held accountable.",en,Reply,0,9,0,3,497,2025-03-27 18:49:29,"<a href=""http://twitter.com/download/iphone"" rel=""nofollow"">Twitter for iPhone</a>",,,,
'1905331150744420705',"1/2- Just as I suspected, the Biden administration manufactured a funding crisis that didn’t exist, putting undue stress on America’s veterans that receive benefits. https://t.co/dbnQUbVDhM",en,Tweet,2,16,6,10,935,2025-03-27 18:48:40,"<a href=""http://twitter.com/download/iphone"" rel=""nofollow"">Twitter for iPhone</a>",,https://www.militarytimes.com/veterans/2025/03/27/watchdog-blasts-va-leaders-for-exaggerating-budget-shortfall-last-year/,,
'1904587975901446362',"Today, on Medal of Honor Day, we pause to honor the extraordinary bravery of America’s Medal of Honor recipients. These men and women have gone above and beyond the call of duty—risking everything to protect our nation. Their courage, sacrifice, and selflessness inspire us all. https://t.co/8zPvFLr7Co",en,Tweet,0,14,5,9,2802,2025-03-25 17:35:33,"<a href=""https://mobile.twitter.com"" rel=""nofollow"">Twitter Web App</a>",,,photo,https://pbs.twimg.com/media/Gm50nDXXIAACGJg.jpg
'1899188446452761084',"We also find ourselves with a CR because Democrats' demands have been unreasonable throughout the negotiation process. We saw their tantrum at last week's address, and that same behavior has spilled over into the appropriations process.",en,Reply,0,6,0,3,942,2025-03-10 19:59:45,"<a href=""https://mobile.twitter.com"" rel=""nofollow"">Twitter Web App</a>",,,,
'1899188437627867529',"It's very sad that our colleagues on the left have resorted to fearmongering, especially when it comes to veterans. Unfortunately, it's nothing new. The Toxic Exposures Fund receives a $6 billion increase in the CR. Republicans, myself included, are wholly committed to taking care of our heroes.",en,Tweet,0,19,6,4,2012,2025-03-10 19:59:43,"<a href=""https://mobile.twitter.com"" rel=""nofollow"">Twitter Web App</a>",,,,
'1897135858786168866',Carter Statement on President Trump's Joint Address to Congress https://t.co/iyqG42JUCT,en,Tweet,0,21,3,10,1099,2025-03-05 04:03:30,"<a href=""https://mobile.twitter.com"" rel=""nofollow"">Twitter Web App</a>",,,photo,https://pbs.twimg.com/media/GlP657eX0AACbMM.jpg
'1896209077132472373',The Blue Ghost lunar lander has officially landed on the moon. Congratulations to @Firefly_Space for this incredible accomplishment! https://t.co/gEtuFN1olh,en,Tweet,6,104,9,14,21149,2025-03-02 14:40:48,"<a href=""http://twitter.com/download/iphone"" rel=""nofollow"">Twitter for iPhone</a>",,https://www.space.com/space-exploration/missions/earth-shines-over-moon-in-amazing-1st-photos-from-private-blue-ghost-lander-were-all-in-that-picture,,
'1894454894393790574',"Great to visit with @TexasTech student government leaders during their Big XII on the Hill conference. We discussed college affordability and workforce preparedness, and I shared a few stories from my time as a Red Raider. Wreck 'em!",en,Tweet,0,7,1,6,1278,2025-02-25 18:30:18,"<a href=""https://mobile.twitter.com"" rel=""nofollow"">Twitter Web App</a>",,,,
'1892613173280182393',One month in and illegal border crossings are hitting record lows. Amazing what can happen when an administration enforces the rule of law.,en,Tweet,0,12,0,11,1454,2025-02-20 16:31:58,"<a href=""https://mobile.twitter.com"" rel=""nofollow"">Twitter Web App</a>",,,,
'1891578646537597271',"Today, we honor the leaders who have shaped our great nation—from George Washington’s steadfast leadership to the countless sacrifices made by those who have held the highest office in the land. https://t.co/pfKvqLioO6",en,Tweet,0,5,1,5,1236,2025-02-17 20:01:07,"<a href=""https://mobile.twitter.com"" rel=""nofollow"">Twitter Web App</a>",,,photo,https://pbs.twimg.com/media/GkA8tQiXkAAicpV.jpg
'1889727934136524907',Congratulations to TX-31 constituent and friend @TulsiGabbard on her confirmation as the new Director of National Intelligence! Wishing her great success in this vital role.,en,Tweet,0,21,1,5,1020,2025-02-12 17:27:03,"<a href=""https://mobile.twitter.com"" rel=""nofollow"">Twitter Web App</a>",,,,
'1889355200328077452',"Over the weekend, I hosted my annual Career and Technical Education (CTE) Awards Ceremony at Temple College. This program celebrates high school students excelling in trade education.
Join me in congratulating the 2025 CTE Award Winners:
Overall Winner: Ana Baez, Temple High School
Temple Independent School District Winner: Isabella Waugh, Temple High School
Salado ISD Winner: Kaci Atchinson, Salado High School
Morgan Isd Winner: Veronica Perez, Morgan High School
Liberty Hill ISD Winner: Sean Tascon, Liberty Hill High School
Killeen Independent School District Winner: Grant Schoel, Harker Heights High School
Jarrell Independent School District  Winner: Lindsey Salinas, Jarrell High School
Hutto ISD Winner: Paola De Lira, Hutto High School
Belton ISD Winner: Julia Broderick, Lake Belton High School",en,Tweet,0,7,0,4,775,2025-02-11 16:45:56,"<a href=""https://mobile.twitter.com"" rel=""nofollow"">Twitter Web App</a>",,,photo,https://pbs.twimg.com/media/GjhWdJqWAAA0bnV.jpg
'1887157636178546928',"Today is National Girls and Women in Sports Day, a reminder that we must protect opportunities for female athletes against the left's radical ideology.
I proudly supported H.R. 28, the Protection of Women and Girls in Sports Act, to safeguard women's sports. https://t.co/hUD4lUVAwY",en,Tweet,0,2,0,4,655,2025-02-05 15:13:36,"<a href=""https://mobile.twitter.com"" rel=""nofollow"">Twitter Web App</a>",,,photo,https://pbs.twimg.com/media/GjCHv3WWEAAiDgc.jpg
'1886887808100446287',"In January, my office assisted 185 constituents with issues involving a federal agency and returned over $4 MILLION to constituents in IRS refunds, VA benefits, and back Social Security.
If you need assistance with a federal agency, follow the link: https://t.co/GjlwwwaCcr https://t.co/aA87LScUaS",en,Tweet,1,9,1,2,678,2025-02-04 21:21:24,"<a href=""https://mobile.twitter.com"" rel=""nofollow"">Twitter Web App</a>",,http://carter.house.gov/services/help-federal-agency.htm,photo,https://pbs.twimg.com/media/Gi-SadLWwAAMQVq.jpg
'1885526442085429253',Russia and China continue to push the boundaries. It’s crucial that Congress support investments in America’s military to deter aggression.  https://t.co/v4tgy5lnh1,en,Tweet,1,16,4,13,1460,2025-02-01 03:11:49,"<a href=""http://twitter.com/download/iphone"" rel=""nofollow"">Twitter for iPhone</a>",,https://www.cbsnews.com/amp/news/us-fighter-jets-scrambled-russia-warplanes-arctic-norad/,,
'1881775054960353503',Amen,en,Tweet,0,12,1,6,1195,2025-01-21 18:45:09,"<a href=""https://mobile.twitter.com"" rel=""nofollow"">Twitter Web App</a>",,,,
