tweet_id,text,language,type,bookmark_count,favorite_count,retweet_count,reply_count,view_count,created_at,client,hashtags,urls,media_type,media_urls
'1926993171084435491',"This Memorial Day, join me in honoring the brave men and women who lost their lives defending our nation. 

As we honor their sacrifice, I’m reminded of the words of General George Patton, “It is foolish and wrong to mourn the men who died. Rather, we should thank God that such men lived.”",en,Tweet,0,12,0,10,412,2025-05-26 14:25:48,"<a href=""http://twitter.com/download/iphone"" rel=""nofollow"">Twitter for iPhone</a>",,,photo,https://pbs.twimg.com/media/Gr4OE10WIAAfawN.jpg
'1926002500336853017',"Today, @fema opened applications for federal grants to support firefighters throughout the country. 

This program is intended to help communities maintain or increase the number of trained professional or volunteer firefighters in their communities. 

Learn more here: https://t.co/V89s6FNQhr",en,Tweet,0,5,1,10,400,2025-05-23 20:49:14,"<a href=""https://mobile.twitter.com"" rel=""nofollow"">Twitter Web App</a>",,,,
'1925576050706202647',"It was great to join @SenCapito on the Senate floor to watch as my legislation to reverse California’s EV mandate and protect consumer choice throughout the country passed the Senate.

Next stop: @POTUS's Desk! https://t.co/VCLlmK3GfV",en,Tweet,0,10,5,5,569,2025-05-22 16:34:40,"<a href=""https://mobile.twitter.com"" rel=""nofollow"">Twitter Web App</a>",,,photo,https://pbs.twimg.com/media/GrkFI7NXcAI4N0r.jpg
'1924929294792331720',"President Trump promised during his campaign that he would secure our southern border and strengthen our national security. 

Nearly 40 years ago, President Reagan outlined his vision for a Golden Dome, and now, the technology is available, with more than 100 companies willing to develop this system. 

This is what peace through strength truly looks like, and it’s all thanks to @POTUS leadership.
https://t.co/mkx6AQL1Qz",en,Tweet,0,2,1,9,467,2025-05-20 21:44:41,"<a href=""https://mobile.twitter.com"" rel=""nofollow"">Twitter Web App</a>",,,,
'1924227827362050240',"As a physician and legislator, my thoughts are with former President Biden and his family as he faces this diagnosis and I hope that he can address this in a speedy fashion and have a successful recovery.",en,Tweet,0,11,1,7,1434,2025-05-18 23:17:19,"<a href=""http://twitter.com/download/iphone"" rel=""nofollow"">Twitter for iPhone</a>",,,,
'1923061820249493733',"One in every ten Americans suffers from a rare disease. Yet, hope for new innovative treatments is slipping away due to President Biden’s drug price negotiations. 

My legislation, the ORPHAN Cures Act, which is included in the @HouseCommerce reconciliation package, will alleviate this and give hope to millions of patients. 

Read more: https://t.co/wAnjS1CeHY",en,Tweet,0,7,5,10,1009,2025-05-15 18:04:01,"<a href=""https://mobile.twitter.com"" rel=""nofollow"">Twitter Web App</a>",,,,
'1921565208817901820',"Wishing a Happy Mother's Day to all the mothers and grandmothers throughout Pennsylvania's 13th Congressional District who guide us, pray for us, and love us. https://t.co/z6fVchRert",en,Tweet,0,5,0,6,612,2025-05-11 14:57:01,"<a href=""http://twitter.com/download/iphone"" rel=""nofollow"">Twitter for iPhone</a>",,,photo,https://pbs.twimg.com/media/GqrFX4_XQAAQ_BY.jpg
'1920505418511421440',"We cannot allow the Chinese Military to continue using our universities to spy on American citizens and peddle propaganda. 

Proud to have supported legislation on the Floor to end this Chinese influence in our universities and protect American Higher Education.",en,Tweet,0,8,2,11,1129,2025-05-08 16:45:47,"<a href=""https://mobile.twitter.com"" rel=""nofollow"">Twitter Web App</a>",,,,
'1920476760547766361',"Today marks 80 years since the end of World War II in Europe. Join me in celebrating the incredible courage, sacrifice, and strength that our nation’s ‘Greatest Generation’ showed to protect freedom for generations to come.",en,Tweet,0,7,0,3,584,2025-05-08 14:51:55,"<a href=""https://mobile.twitter.com"" rel=""nofollow"">Twitter Web App</a>",,,,
'1917982962697597219',"Proud to move this critical legislation through the House to protect your right to the open road.

Now, it's time for the Senate to send this legislation to @POTUS's desk. https://t.co/ajBUherF7x",en,Tweet,2,14,4,14,2471,2025-05-01 17:42:27,"<a href=""https://mobile.twitter.com"" rel=""nofollow"">Twitter Web App</a>",,,video,https://video.twimg.com/amplify_video/1917981939341946880/vid/avc1/1920x1080/WAls_BTYgizr8U0-.mp4?tag=16
'1917954048080203791',"Proud to see my bill to protect consumer choice in the automobile market pass the House in a bipartisan fashion.

Congress cannot allow California to set national policy. I urge my Senate colleagues to pass this legislation so @POTUS can protect the freedom of the open road for the American people.",en,Tweet,0,24,8,4,1878,2025-05-01 15:47:33,"<a href=""http://twitter.com/download/iphone"" rel=""nofollow"">Twitter for iPhone</a>",,,photo,https://pbs.twimg.com/media/Gp3xCrEX0AA9K6y.jpg
'1917614848692596992',"Proud to have had @DrOzCMS join us at the @GOPDoctors Caucus, and I look forward to working collaboratively with my friend, fellow physician, and ally to make health care better in America. https://t.co/STyjIf0c6o",en,Tweet,0,4,0,9,398,2025-04-30 17:19:42,"<a href=""https://mobile.twitter.com"" rel=""nofollow"">Twitter Web App</a>",,,photo,https://pbs.twimg.com/media/Gpy7Of9WMAQ8PXS.jpg
'1917234834067407182',"Thank you, @POTUS, for supporting these critical bills to rein in California’s ridiculous policies, and I look forward to you signing them into law very soon! https://t.co/gGXFzdG0Bz",en,Tweet,0,5,1,7,459,2025-04-29 16:09:39,"<a href=""https://mobile.twitter.com"" rel=""nofollow"">Twitter Web App</a>",,,photo,https://pbs.twimg.com/media/GpthhnLXEAAMW3_.jpg
'1917205157101670502',"Congratulations to Mifflin County High School Teacher Ashlie Crosson on being named the 2025 National Teacher of the Year!

Your dedication to forming the future leaders of our community is second to none, and I thank you for all you do for the students of Mifflin County! https://t.co/3NPQrEPlbg",en,Tweet,0,5,1,3,340,2025-04-29 14:11:44,"<a href=""https://mobile.twitter.com"" rel=""nofollow"">Twitter Web App</a>",,,photo,https://pbs.twimg.com/media/GptHv4FXsAAx2X2.jpg
'1916918895966912904',"This afternoon, I’ll be hosting a virtual townhall on veterans' issues with VA Deputy Secretary Dr. Paul Lawrence starting at 3:00. 

You can listen live here: https://t.co/kBONNO7ZNm",en,Tweet,0,2,1,3,280,2025-04-28 19:14:14,"<a href=""https://mobile.twitter.com"" rel=""nofollow"">Twitter Web App</a>",,http://johnjoyce.house.gov/live,,
'1915776511795245418',"My office is monitoring the forest fires in the Michaux State Forest in Cumberland County. I encourage everyone to stay alert and follow directives from local law enforcement.

https://t.co/FOYOcxLVjA",en,Tweet,0,8,1,4,862,2025-04-25 15:34:48,"<a href=""http://twitter.com/download/iphone"" rel=""nofollow"">Twitter for iPhone</a>",,https://www.wgal.com/article/pennsylvania-smoke-sky-cumberland-county-wildfires-michaux-state-forest/64586978,,
'1914324916758884639',Praying for the repose of Pope Francis and for wisdom in selecting a new Pope in the upcoming weeks. May Pope Francis rest in peace.,en,Tweet,0,10,1,4,461,2025-04-21 15:26:41,"<a href=""http://twitter.com/download/iphone"" rel=""nofollow"">Twitter for iPhone</a>",,,,
'1913960032837787714',He is Risen! Wishing everyone a blessed Easter as we celebrate the hope of eternal salvation. https://t.co/uefEYYk9KG,en,Tweet,0,11,0,2,498,2025-04-20 15:16:46,"<a href=""http://twitter.com/download/iphone"" rel=""nofollow"">Twitter for iPhone</a>",,,photo,https://pbs.twimg.com/media/Go_AgaaWQAAXPEC.jpg
'1913317960854520026',"As a member of the @COVIDSelect Subcommittee last Congress, I saw first hand the massive cover up done by our public health administrators to hide the true origins of Covid-19. 

Thank you, @POTUS, for sharing the truth with the American people.

https://t.co/jNHpcb8XuW",en,Tweet,1,14,5,8,636,2025-04-18 20:45:24,"<a href=""http://twitter.com/download/iphone"" rel=""nofollow"">Twitter for iPhone</a>",,https://www.whitehouse.gov/lab-leak-true-origins-of-covid-19/,,
'1912160848019071172',"Wishing my fellow Christians a blessed Holy Week as we celebrate the resurrection of our Lord and Savior, Jesus Christ, who saved us from our sins so that we may find eternal peace in Heaven.",en,Tweet,0,6,1,11,821,2025-04-15 16:07:27,"<a href=""https://mobile.twitter.com"" rel=""nofollow"">Twitter Web App</a>",,,,
'1911798261679075791',Violence has no place in our society. My thoughts and prayers are with Governor Shapiro and his family after the disgraceful arson attack on the Governor’s residence.,en,Tweet,0,8,1,6,577,2025-04-14 16:06:39,"<a href=""http://twitter.com/download/iphone"" rel=""nofollow"">Twitter for iPhone</a>",,,,
'1910717736063295915',"I always enjoy welcoming constituents to Washington for a tour of the U.S. Capitol! 

This week, a group of constituents from Blair County stopped by my office and even had the opportunity to attend an Energy and Commerce Committee hearing! https://t.co/Up9TS9vJBj",en,Tweet,0,7,1,9,454,2025-04-11 16:33:02,"<a href=""https://mobile.twitter.com"" rel=""nofollow"">Twitter Web App</a>",,,photo,https://pbs.twimg.com/media/GoQ7hGsWQAEARh9.jpg
'1909334389453930987',"Today, I spoke on the House floor to honor World War II “Ace” Pilot, and Johnstown Native, Lt. Col. Boyd ‘Buzz’ Wagner. 

From defending the skies over the Philippines to training future aviators, Buzz’s legacy serves as an inspiration to us all! https://t.co/tTPVZDAC3h",en,Tweet,0,8,0,8,600,2025-04-07 20:56:06,"<a href=""https://mobile.twitter.com"" rel=""nofollow"">Twitter Web App</a>",,,video,https://video.twimg.com/ext_tw_video/1909334238576402432/pu/vid/avc1/640x360/LjF8-0OuHD76cqnS.mp4?tag=12
'1908685686816800972',"Congratulations to New Oxford native Thomas Haugh for his double digit performance helping the Florida Gators reach the NCAA Championship game on Monday night. 

I am so proud of the performance from our Adams County athlete! https://t.co/qbGWeung2F",en,Tweet,0,10,2,11,830,2025-04-06 01:58:24,"<a href=""http://twitter.com/download/iphone"" rel=""nofollow"">Twitter for iPhone</a>",,,photo,https://pbs.twimg.com/media/Gn0DhIiXAAA_EpQ.jpg
'1908119446943613207',Congratulations to Dr. Mehmet Oz who was confirmed to oversee health insurance for millions of Americans.,en,Tweet,1,10,1,10,677,2025-04-04 12:28:21,"<a href=""http://twitter.com/download/iphone"" rel=""nofollow"">Twitter for iPhone</a>",,,,
'1907818550548468207',"California's ban on gas-powered vehicles threatens consumer choice for 40% of the auto market.

Proud to introduce legislation to reverse this ban, so that American families can decide which vehicle best fits their needs, not government bureaucrats.
https://t.co/6PqXtAi7M8",en,Tweet,0,15,6,8,4772,2025-04-03 16:32:42,"<a href=""https://mobile.twitter.com"" rel=""nofollow"">Twitter Web App</a>",,https://www.foxnews.com/politics/scoop-congress-barrels-toward-showdown-over-biden-era-rule-letting-california-ban-gas-cars,,
'1906778560385183774',"Congratulations to @PennStateMHKY  on their historic win last night to clinch the program’s first-ever ‘Frozen Four’!

Proud to honor their win on the House floor today: https://t.co/zodRn2aR9s",en,Tweet,0,2,0,7,415,2025-03-31 19:40:09,"<a href=""https://mobile.twitter.com"" rel=""nofollow"">Twitter Web App</a>",,,video,https://video.twimg.com/ext_tw_video/1906778215298854912/pu/vid/avc1/640x360/KS4BC0YLvOkXl2kP.mp4?tag=12
'1905641198628274482',Thank you to @POTUS and @SenMullin for joining @SenMcCormickPA and me in Pennsylvania to witness the dominance of our Penn State wrestlers! https://t.co/rkJJPIPhIv,en,Tweet,0,9,1,10,694,2025-03-28 15:20:41,"<a href=""http://twitter.com/download/iphone"" rel=""nofollow"">Twitter for iPhone</a>",,,photo,https://pbs.twimg.com/media/GnIykgJWsAAfsfk.jpg
'1904906644149961119',Great to be with President Trump in Pennsylvania to witness the Penn State Wrestling team retain their top spot in the NCAA rankings! https://t.co/tCmVe5LzVw,en,Tweet,0,5,0,6,764,2025-03-26 14:41:50,"<a href=""http://twitter.com/download/iphone"" rel=""nofollow"">Twitter for iPhone</a>",,,video,https://video.twimg.com/amplify_video/1904906517259726848/vid/avc1/1296x720/teOu4uhJhl6UCqVm.mp4?tag=16
'1904228199233372442',"It was a privilege to be with President Trump in Philadelphia this weekend to witness this historic moment. 

Congratulations to Air Force 2d Lt. Wyatt Hendrickson on his National Championship!",en,Tweet,0,7,0,9,1244,2025-03-24 17:45:56,"<a href=""http://twitter.com/download/iphone"" rel=""nofollow"">Twitter for iPhone</a>",,,,
'1902729805860143218',"Although it was not the outcome we wanted, we are all so proud of the Red Flash Basketball program for their historic season!",en,Tweet,0,2,0,4,895,2025-03-20 14:31:51,"<a href=""http://twitter.com/download/iphone"" rel=""nofollow"">Twitter for iPhone</a>",,,,
'1902379275463852414',"Proud to present Chambersburg Chief of Police Meredith Dominick and Lt. Matthew Bietsch with a flag flown over the U.S. Capitol. 

Thank you to the entire Chambersburg Police Force for keeping our community safe! https://t.co/5cO5TNYsNd",en,Tweet,0,5,0,5,666,2025-03-19 15:18:58,"<a href=""http://twitter.com/download/iphone"" rel=""nofollow"">Twitter for iPhone</a>",,,photo,https://pbs.twimg.com/media/Gmab3WVXcAA-1uk.jpg
'1901327290123874762',"Congratulations to former PA GOP Chairman Rob Gleason for being appointed to the Amtrak Board of Directors by President Trump!

https://t.co/5bxI7sbv8r",en,Tweet,1,6,1,6,580,2025-03-16 17:38:45,"<a href=""http://twitter.com/download/iphone"" rel=""nofollow"">Twitter for iPhone</a>",,https://www.newsfromthestates.com/article/trump-taps-former-pa-gop-chair-serve-amtrak-board-directors,,
'1899959163125735684',"President Trump promised to free us from the Biden era regulations that have stifled our nation’s growth for years, and today he delivered.

Thank you, @epaleezeldin for finally taking the shackles off in a historic day of deregulation: https://t.co/k6EAD4ux2X",en,Tweet,0,7,2,12,884,2025-03-12 23:02:18,"<a href=""http://twitter.com/download/iphone"" rel=""nofollow"">Twitter for iPhone</a>",,https://www.epa.gov/newsreleases/epa-launches-biggest-deregulatory-action-us-history,,
'1899880700771209475',Proud to join my colleague @RepSmucker on this important legislation to remove barriers for Medicare beneficiaries so that they can effectively recover from the comfort of their own homes.,en,Tweet,0,10,6,9,1996,2025-03-12 17:50:31,"<a href=""https://mobile.twitter.com"" rel=""nofollow"">Twitter Web App</a>",,,,
'1899638424056856687',The Red Flash are going dancing! Congratulations to @redflashmbb on punching their ticket to the NCAA Tournament! #BELIEVE🔴⚡️🏀,en,Tweet,0,8,2,4,1198,2025-03-12 01:47:48,"<a href=""http://twitter.com/download/iphone"" rel=""nofollow"">Twitter for iPhone</a>",#BELIEVE,,,
'1898029369165283475',"For years, China has been infiltrating our nation by buying American farmland and property around federal installations.

I am proud to be an original co-sponsor of two critical pieces of legislation to thwart their influence and secure the homeland so that our national security, and food security, are protected.

Watch my floor remarks supporting these bills:",en,Tweet,0,10,3,7,563,2025-03-07 15:13:59,"<a href=""https://mobile.twitter.com"" rel=""nofollow"">Twitter Web App</a>",,,video,https://video.twimg.com/ext_tw_video/1898029206337978368/pu/vid/avc1/640x360/8O44Y3iMBXAMV8y1.mp4?tag=12
'1896927780002320627',"Starting the day with Secretary Pete Hegseth in preparation for President Trump's address this evening. 

Under President Trump, recruiting numbers are up, morale is up, and America is back on the right path. https://t.co/kyeNKxsWkh",en,Tweet,0,13,3,15,1433,2025-03-04 14:16:40,"<a href=""https://mobile.twitter.com"" rel=""nofollow"">Twitter Web App</a>",,,photo,"https://pbs.twimg.com/media/GlM9nc4W8AAyiB2.jpg,https://pbs.twimg.com/media/GlM9owDXoAAxARX.jpg"
'1896631774471696566',"Tomorrow, President Trump will share his vision during a Joint Address to Congress on how he will continue the successes we have already seen during his second term in office.

The Golden Age of America will continue to open doors for all Americans. https://t.co/J4OUEvCUkP",en,Tweet,0,7,2,10,840,2025-03-03 18:40:27,"<a href=""https://mobile.twitter.com"" rel=""nofollow"">Twitter Web App</a>",,,video,https://video.twimg.com/ext_tw_video/1896631245859164160/pu/vid/avc1/640x360/dBSKHrmIn0-VTeoz.mp4?tag=12
'1895556206028026086',"Proud to join my @GOPDoctors colleagues and endorse this critical legislation that supports physicians and protects access to care for Medicare beneficiaries. 

It’s time we fix the failing reimbursement schedule so physicians can continue to keep their doors open and treat patients in need.",en,Tweet,0,6,2,7,1177,2025-02-28 19:26:31,"<a href=""https://mobile.twitter.com"" rel=""nofollow"">Twitter Web App</a>",,,,
'1894793358796595676',It is time our nation returns to fiscal sanity. Read my statement on the passage of the Budget Resolution below. https://t.co/2HpsP7Boy3,en,Tweet,1,11,2,18,789,2025-02-26 16:55:14,"<a href=""https://mobile.twitter.com"" rel=""nofollow"">Twitter Web App</a>",,,photo,https://pbs.twimg.com/media/GkuoV_6XAAAVXky.jpg
'1894144198938394995',You can sign up to receive this week's newsletter here: https://t.co/mFtb47mWWq,en,Reply,0,2,0,2,386,2025-02-24 21:55:43,"<a href=""https://mobile.twitter.com"" rel=""nofollow"">Twitter Web App</a>",,https://johnjoyce.house.gov/contact/newsletter-subscribe,,
'1894144197516460423',Curious about my week in Pennsylvania's 13th District? Then check out my weekly newsletter highlighting my visits throughout the district! https://t.co/Pq0h3GDQkG,en,Tweet,0,6,0,9,545,2025-02-24 21:55:42,"<a href=""https://mobile.twitter.com"" rel=""nofollow"">Twitter Web App</a>",,https://iqconnect.house.gov/iqextranet/view_newsletter.aspx?id=104734&c=PA13JJ,,
'1893459164732477488',"My concern and prayers are with the healthcare workers and law enforcement at UPMC Memorial Hospital in York, PA.

The injured and the loss of West York Borough Police Officer Andrew Duarte weighs heavy on all of Pennsylvania.",en,Tweet,1,63,13,10,3033,2025-02-23 00:33:38,"<a href=""http://twitter.com/download/iphone"" rel=""nofollow"">Twitter for iPhone</a>",,,,
'1892639613786771460',"Enjoyed my visit to the Colonial Career and Technology Center in New Oxford to tour their incredible facilities and meet with some of the bright young minds that are part of their programs.

By building real-world skills through hands-on learning, CCTC prepares students for a successful future in a variety of occupations, from welding to accounting.",en,Tweet,0,11,1,3,575,2025-02-20 18:17:02,"<a href=""https://mobile.twitter.com"" rel=""nofollow"">Twitter Web App</a>",,,photo,https://pbs.twimg.com/media/GkQBm9nXIAAf0tb.jpg
'1892600994984247592',"Renewing the TCJA is critical for Main Street businesses to thrive and our economy to boom. 

Thank you to the many local businesses that joined us yesterday in Gettysburg to discuss the benefits of these pro-business and pro-American policies.",en,Tweet,0,8,5,6,1184,2025-02-20 15:43:34,"<a href=""https://mobile.twitter.com"" rel=""nofollow"">Twitter Web App</a>",,,,
'1891876234969182284',"Miller’s Plumbing &amp; Heating in Mifflin County has served the local community for 120 years. 

I was proud to honor their success in the Congressional Record and to present the official remarks to one of its owners, Susan Miller Knepp! https://t.co/DisQAgVSgg",en,Tweet,0,10,0,5,496,2025-02-18 15:43:38,"<a href=""https://mobile.twitter.com"" rel=""nofollow"">Twitter Web App</a>",,,photo,https://pbs.twimg.com/media/GkFLSNfWYAA4YDF.jpg
'1890152045446856809',"It's about time we work to fix the health of our nation so that future generations can live long, healthy lives.

As co-chair of the Make America Healthy Again Caucus, I'm excited to work with @RobertKennedyJr and the MAHA Commission to improve the life spans of the American public, address the chronic illness crisis, and rebuild trust in our nation's health system. https://t.co/J8WmF6udLK",en,Tweet,1,9,1,12,919,2025-02-13 21:32:19,"<a href=""https://mobile.twitter.com"" rel=""nofollow"">Twitter Web App</a>",,,,
'1890083033904021676',"I was proud to support H.R. 77 the Midnight Rules and Relief Act, on the House floor this week. 

This legislation will allow Congress to quickly strip back the thousands of regulations implemented under President Biden, fostering an environment of growth for American businesses.",en,Tweet,1,11,4,12,585,2025-02-13 16:58:05,"<a href=""https://mobile.twitter.com"" rel=""nofollow"">Twitter Web App</a>",,,video,https://video.twimg.com/ext_tw_video/1890082614150668288/pu/vid/avc1/640x360/E85EpTBWsmYRQ0c1.mp4?tag=12
'1889374852802298349',"Met with @ScottJenningsKY today, who daily defends President Trump and our common sense conservative values that America embraces. https://t.co/U4nADZjSTB",en,Tweet,1,57,5,13,2823,2025-02-11 18:04:02,"<a href=""http://twitter.com/download/iphone"" rel=""nofollow"">Twitter for iPhone</a>",,,photo,"https://pbs.twimg.com/media/GjhoaX3W0AAEkUb.jpg,https://pbs.twimg.com/media/GjhoaX4WIAASnP4.jpg"
'1889087280654229627',"It was a pleasure to meet five week old Mark Tucker, son of my Deputy Chief of Staff, Matt Tucker, and his wife Sarah. 

Thank you, Matt, for your commitment to serving Pennsylvania’s 13th district. https://t.co/FdsO7ULZKs",en,Tweet,0,39,2,5,1824,2025-02-10 23:01:19,"<a href=""http://twitter.com/download/iphone"" rel=""nofollow"">Twitter for iPhone</a>",,,photo,https://pbs.twimg.com/media/Gjdi3ozW8AAY9Xy.jpg
'1888994971593707815',"Enjoyed visiting with Rick and Katie Grove, owners of Everlasting Love Florist! 

Opening in 2006 - Everlasting Love Florist has remained a staple in Franklin County. I’m excited to see their continued success! https://t.co/eo1pD8oiT2",en,Tweet,0,7,0,5,482,2025-02-10 16:54:31,"<a href=""http://twitter.com/download/iphone"" rel=""nofollow"">Twitter for iPhone</a>",,,photo,https://pbs.twimg.com/media/GjcO6jKXkAApQPk.jpg
'1887635427940868554',"Millions of Americans suffer from rare diseases - many of which have no treatment. 

My bipartisan legislation, the ORPHAN Cures Act, preserves R&D incentives for the development of these treatments so American patients have hope for the future.",en,Tweet,1,14,3,12,738,2025-02-06 22:52:11,"<a href=""https://mobile.twitter.com"" rel=""nofollow"">Twitter Web App</a>",,,video,https://video.twimg.com/ext_tw_video/1887635305085251584/pu/vid/avc1/640x360/yiXUD-8mOJVKna6y.mp4?tag=12
'1887567874656706959',"On day one, @POTUS quickly acted to secure our borders and fight the fentanyl crisis. 

Now, it’s time for Congress to follow suit and pass the HALT Fentanyl Act.",en,Tweet,0,15,4,6,1289,2025-02-06 18:23:45,"<a href=""http://twitter.com/download/iphone"" rel=""nofollow"">Twitter for iPhone</a>",,,,
'1885362498586489036',"Get assistance reporting and recovering from fraud or identity theft at the link below:
 
https://t.co/koR3bl0eAd",en,Reply,0,3,1,3,302,2025-01-31 16:20:22,"<a href=""http://twitter.com/download/iphone"" rel=""nofollow"">Twitter for iPhone</a>",,http://IdentityTheft.gov,,
'1885362495423943008',"For Identity Theft and Fraud Awareness Week, I spoke at the Greencastle Senior Center to discuss the @FTC's policy to prevent fraud and identity theft.
 
Remember, if you didn’t initiate the contact and someone is asking for money or your personal information, treat it as a scam. https://t.co/NtrSEwaRSM",en,Tweet,0,6,1,7,491,2025-01-31 16:20:21,"<a href=""http://twitter.com/download/iphone"" rel=""nofollow"">Twitter for iPhone</a>",,,photo,"https://pbs.twimg.com/media/GionMojWkAkQE2l.jpg,https://pbs.twimg.com/media/GionMogWkAA7eDd.jpg"
'1884692812983046411',"Read the full bill text 👇
https://t.co/V7iBYkGiQt",en,Reply,0,0,0,0,267,2025-01-29 19:59:17,"<a href=""https://mobile.twitter.com"" rel=""nofollow"">Twitter Web App</a>",,http://Congress.gov,,
'1884692811615748434',"Small Businesses are the backbone of our nation's economy - and deserve our support.

Thrilled to support local businesses by joining @RepSmucker on the Main Street Tax Certainty Act to permanently extend the 199A tax deduction that was part of @POTUS's Tax Cuts and Jobs Act.",en,Tweet,1,5,3,5,643,2025-01-29 19:59:16,"<a href=""https://mobile.twitter.com"" rel=""nofollow"">Twitter Web App</a>",,,,
'1884008134051783011',Proud to be with our 45th &amp; 47th President! https://t.co/9DAgnuXHOO,en,Tweet,0,16,1,8,580,2025-01-27 22:38:36,"<a href=""http://twitter.com/download/iphone"" rel=""nofollow"">Twitter for iPhone</a>",,,photo,https://pbs.twimg.com/media/GiVXaa3XEAAlGVj.jpg
'1883891132842856643',"Today is a day of grief and remembrance, as we memorialize the millions of victims of the Holocaust. 

As our Jewish brothers and sisters face more hatred and bigotry today, we must never forget the dangerous path this rhetoric leads to. https://t.co/skRAqejU8w",en,Tweet,0,13,2,8,646,2025-01-27 14:53:41,"<a href=""http://twitter.com/download/iphone"" rel=""nofollow"">Twitter for iPhone</a>",,,photo,https://pbs.twimg.com/media/GiTtACkXAAAWumO.jpg
