tweet_id,text,language,type,bookmark_count,favorite_count,retweet_count,reply_count,view_count,created_at,client,hashtags,urls,media_type,media_urls
'1970601471327559685',"Yesterday, my office joined V.O.I.C.E.S of our Veterans for their honorary flag ceremony on Texas Veteran Suicide Awareness Day. 

Veterans face a higher risk of suicide—and it’s incumbent on all of us to honor the heroes who have sacrificed so much for our country, especially those who are struggling. That starts by recognizing the signs, expanding access to resources, and standing with loved ones every step of the way. You are not alone.",en,Tweet,0,8,3,0,1976,2025-09-23 22:29:37,"<a href=""https://mobile.twitter.com"" rel=""nofollow"">Twitter Web App</a>",,,photo,"https://pbs.twimg.com/media/G1j7ALhXEAALVXK.jpg,https://pbs.twimg.com/media/G1j7KtiXwAAP6cQ.jpg,https://pbs.twimg.com/media/G1j7KtpWIAAgNA0.jpg,https://pbs.twimg.com/media/G1j7KuAWQAAYpJt.jpg"
'1970581560823869835',"President Trump blew off his meeting with Dems to stop a government shutdown.

All because he thinks keeping healthcare more affordable for families is “ridiculous.”

3 million Texans benefit from healthcare tax credits. Congress must extend the tax credits and keep people insured.",en,Tweet,4,190,82,143,14498,2025-09-23 21:10:30,"<a href=""https://mobile.twitter.com"" rel=""nofollow"">Twitter Web App</a>",,,,
'1970560199514824885',Wishing those who celebrate a sweet and peaceful Rosh Hashanah. Shanah Tovah! https://t.co/8ASTJ2b46H,en,Tweet,0,7,2,0,1838,2025-09-23 19:45:37,"<a href=""https://mobile.twitter.com"" rel=""nofollow"">Twitter Web App</a>",,,photo,https://pbs.twimg.com/media/G1jWAnrWQAAoEGW.jpg
'1970483929661522190',"SAVE THE DAY: My office is hosting a Passport Fair on Saturday, October 11th from 7AM to 3PM at the San Antonio Food Bank.
 
To reserve your spot, please call my district office at (210) 348-8216. https://t.co/xSppV1uIr3",en,Tweet,1,18,7,0,1719,2025-09-23 14:42:33,"<a href=""https://mobile.twitter.com"" rel=""nofollow"">Twitter Web App</a>",,,photo,"https://pbs.twimg.com/media/G1iQZDIWkAAjROl.jpg,https://pbs.twimg.com/media/G1iQdrWWwAEAtf4.jpg"
'1970206030677057553',"It turns out Tom Homan may be a much bigger criminal than the immigrants he’s targeting. He was caught on tape accepting a $50,000 bribe in exchange for securing government contracts.
 
Now, Trump’s DOJ is dropping the investigation.
 
This is total corruption. The DOJ and FBI must release the tapes.",en,Tweet,64,4078,1274,605,105309,2025-09-22 20:18:17,"<a href=""https://mobile.twitter.com"" rel=""nofollow"">Twitter Web App</a>",,,,
'1969074146215645568',"The Republican funding bill does not include ACA tax credits that make healthcare affordable. Texans have the highest rate of uninsured folks. We need to extend tax credits to keep Texans covered.

I’m pushing to make these healthcare tax credits permanent. https://t.co/CWtvgLgSSM",en,Tweet,0,31,14,4,1772,2025-09-19 17:20:34,"<a href=""https://mobile.twitter.com"" rel=""nofollow"">Twitter Web App</a>",,,photo,https://pbs.twimg.com/media/G1OOXJxWEAAlxNF.jpg
'1968740564733464891',The U.S. needs to use its leverage to stop the slaughter in Gaza. I spoke in support of @RepJayapal's amendment to withhold funding for Israel when they fail to follow international humanitarian law. https://t.co/qVE2ffrrkv,en,Reply,0,36,11,9,2874,2025-09-18 19:15:02,"<a href=""https://mobile.twitter.com"" rel=""nofollow"">Twitter Web App</a>",,,video,https://video.twimg.com/amplify_video/1968740346197643264/vid/avc1/1280x720/iYgw20jpbAchgYeB.mp4?tag=21
'1968506094231151046',"This an unprecedented abuse of power by an FCC chair. 

Nexstar is bowing to Donald Trump’s fragile ego because it wants the Trump Administration to approve its multi-billion dollar merger. 

They’re enabling authoritarianism to make their money.",en,Tweet,37,2262,633,323,60855,2025-09-18 03:43:20,"<a href=""http://twitter.com/download/iphone"" rel=""nofollow"">Twitter for iPhone</a>",,,,
'1968463385948745993',"I spoke against legislation that would give the Secretary of State the power to revoke passports from U.S. citizens for exercising their First Amendment rights. 

That’s not keeping us safe—that’s punishing dissent. https://t.co/YJxZ91XWHC",en,Reply,1,28,10,6,3076,2025-09-18 00:53:38,"<a href=""http://twitter.com/download/iphone"" rel=""nofollow"">Twitter for iPhone</a>",,,video,https://video.twimg.com/amplify_video/1968463308207366145/vid/avc1/1280x720/yk0D8EsqK-fv3dbL.mp4?tag=21
'1968406872458723826',"Americans of all background should have the same opportunity to pursue careers in diplomacy.

Republicans would rather stop efforts to diversify our diplomatic workforce, jeopardizing American peace and prosperity.

This double standard holds our nation back. https://t.co/91jcFkpNdi",en,Reply,0,12,2,1,3117,2025-09-17 21:09:04,"<a href=""https://mobile.twitter.com"" rel=""nofollow"">Twitter Web App</a>",,,video,https://video.twimg.com/amplify_video/1968406591431958528/vid/avc1/1280x720/1u_pcJrofinLBaqz.mp4?tag=21
'1968341566201725354',"The Trump admin carried out a 2nd deadly strike against a Venezuelan boat, killing three people.

They claimed those onboard were drug traffickers. Instead of providing evidence, they are asking the world to take their word for it.

Ignoring the rule of law and refusing to provide evidence or due process makes this an execution. That's not the American way.",en,Tweet,11,460,165,95,7434,2025-09-17 16:49:34,"<a href=""https://mobile.twitter.com"" rel=""nofollow"">Twitter Web App</a>",,,video,https://video.twimg.com/amplify_video/1968341292997394432/vid/avc1/1280x720/Pth1dKXTA0TVmSKB.mp4?tag=21
'1968322718694011227',"U.S. diplomacy makes a difference in our daily lives—it prevents conflicts, saves lives through public health efforts, and protects U.S. jobs while creating opportunities abroad.

It’s needed now more than ever.

🧵Today, I join @HouseForeign to advance State Department funding. Follow for updates.",en,Tweet,0,25,9,3,10516,2025-09-17 15:34:40,"<a href=""https://mobile.twitter.com"" rel=""nofollow"">Twitter Web App</a>",,,,
'1968305794514055437',"Every year, I hold a Congressional App Challenge for students interested in STEM to put their skills to the test. 

If you’re a San Antonio high school student interested in coding, take on the challenge! https://t.co/vXrGYyEVWQ",en,Tweet,0,10,3,0,1619,2025-09-17 14:27:25,"<a href=""https://mobile.twitter.com"" rel=""nofollow"">Twitter Web App</a>",,,photo,"https://pbs.twimg.com/media/G1DTrn2WsAAkjm4.jpg,https://pbs.twimg.com/media/G1DTrn0XAAACel-.jpg"
'1968054840569016549',"The conservative Supreme Court gave the green light for ICE to racially profile.

I join Justice Sotomayer, Kagan, and Brown Jackson in saying “I dissent.”

This brazen attack on the Latino community impacts every American and we must demand clear limits on law enforcement. https://t.co/U3vpaG0q5t",en,Tweet,11,560,135,78,9607,2025-09-16 21:50:13,"<a href=""https://mobile.twitter.com"" rel=""nofollow"">Twitter Web App</a>",,,video,https://video.twimg.com/amplify_video/1968054635844739072/vid/avc1/720x1280/025dk-cs4K49zGc2.mp4?tag=21
'1967712118368878870',"Which songs and albums by Latino artists do you think should be honored by the prestigious National Recording Registry at the @LibraryCongress? I want your thoughts! 

Submissions must be at least 10 years old and are due by 9/22 at https://t.co/5aaVRmsPtX. https://t.co/fSflemixZx",en,Tweet,1,11,1,1,1934,2025-09-15 23:08:21,"<a href=""http://twitter.com/download/iphone"" rel=""nofollow"">Twitter for iPhone</a>",,http://castro.house.gov/music,photo,https://pbs.twimg.com/media/G063vcqXkAAW9pe.jpg
'1967690036490772754',"Hispanic Heritage Month begins today!

This month is an opportunity to honor the significant contributions Latinos have made to San Antonio and our nation in the arts, science, business, and in every facet of American life. https://t.co/Bqktbne96T",en,Tweet,2,31,14,2,3707,2025-09-15 21:40:37,"<a href=""https://mobile.twitter.com"" rel=""nofollow"">Twitter Web App</a>",,,photo,https://pbs.twimg.com/media/G06jmsYWsAAKoW7.jpg
'1966517602735255932',"What are your favorite songs and albums by Texas artists? Help me nominate songs and albums by Texas artists to the prestigious National Recording Registry at the @librarycongress.

Submissions must be at least 10 years old and are due by Sep. 21. at https://t.co/p5tR5ps2We. https://t.co/kCZtY0Ca2H",en,Tweet,0,12,6,4,2395,2025-09-12 16:01:47,"<a href=""https://mobile.twitter.com"" rel=""nofollow"">Twitter Web App</a>",,http://castro.house.gov/texasmusic,video,https://video.twimg.com/amplify_video/1966517543566200835/vid/avc1/720x1280/FbqXbu1OqzURMfD-.mp4?tag=21
'1966258725167181920',"Today, my staff gathered at the San Antonio 9/11 Memorial in solemn remembrance of 9/11, the 343 heroic firefighters who sacrificed their lives to save others, and our brave first responders who answered the call to serve. Our nation is forever grateful. https://t.co/EM1Mau4AqP",en,Tweet,0,27,3,1,3204,2025-09-11 22:53:06,"<a href=""http://twitter.com/download/iphone"" rel=""nofollow"">Twitter for iPhone</a>",,,photo,"https://pbs.twimg.com/media/G0mFENeXEAAss1v.jpg,https://pbs.twimg.com/media/G0mFENmW4AAtxv3.jpg,https://pbs.twimg.com/media/G0mFENcXkAAy-iC.jpg,https://pbs.twimg.com/media/G0mFENeW4AA7eWt.jpg"
'1966150272469860554',"Today, we remember those who lost their lives in the deadliest terrorist attack in our nation’s history and honor the brave first responders who sacrificed their lives on September 11, 2001. We will never forget. https://t.co/rXKkiYNET8",en,Tweet,0,31,9,2,3060,2025-09-11 15:42:08,"<a href=""https://mobile.twitter.com"" rel=""nofollow"">Twitter Web App</a>",,,photo,https://pbs.twimg.com/media/G0krOLsWEAA_pQ7.jpg
'1965876692783923540',"Political violence has no place in our society. 

My prayers are with Charlie Kirk and his family.",en,Tweet,4,313,49,312,28371,2025-09-10 21:35:02,"<a href=""https://mobile.twitter.com"" rel=""nofollow"">Twitter Web App</a>",,,,
'1965438668262257003',"I'll be nominating songs and albums by Texas artists to the prestigious National Recording Registry at the @librarycongress—and I need your help!

Which songs and albums by Texas artists (10+ years old) should be recognized as culturally significant? Submit your nominations by September 21st at https://t.co/DPO5EwfMWr!",en,Tweet,1,11,7,1,2234,2025-09-09 16:34:29,"<a href=""https://mobile.twitter.com"" rel=""nofollow"">Twitter Web App</a>",,,photo,https://pbs.twimg.com/media/G0akBuPXsAA3uOp.jpg
'1965159048363524354',"September is National Suicide Prevention Month. Congress created the #988Lifeline to help people in mental health crisis. If you or a loved one need help, call or text 988. You are not alone. https://t.co/EgHrIAtvIM",en,Tweet,0,23,10,0,2115,2025-09-08 22:03:22,"<a href=""https://mobile.twitter.com"" rel=""nofollow"">Twitter Web App</a>",#988Lifeline,,photo,https://pbs.twimg.com/media/G0Wls5HW8AAA1I9.jpg
'1965134287658729808',"The Supreme Court just gave ICE the green light to racially profile until this case is resolved.

This means ICE can target you without cause based on your skin color, occupation, neighborhood, and even for speaking English with an accent. It’s a direct attack on our rights.

This lawsuit isn't over—the courts must uphold the constitution, not allow Trump to undo it. https://t.co/DrREkEjcrE",en,Tweet,232,4679,1366,526,101635,2025-09-08 20:24:59,"<a href=""https://mobile.twitter.com"" rel=""nofollow"">Twitter Web App</a>",,,,
'1965084247624241207',"The healthcare sector has fueled the economy in Texas and the U.S. for decades. Now, Trump’s huge Medicaid cuts threaten growth.
 
With a stalling economy and aging population, our communities cannot afford this attack on healthcare.",en,Tweet,0,25,11,3,3645,2025-09-08 17:06:08,"<a href=""https://mobile.twitter.com"" rel=""nofollow"">Twitter Web App</a>",,,,
'1964083634656227716',"Where does this leave Americans and our servicemembers? Less safe.
 
As Trump authorizes more military operations in the Caribbean, the risk of another deadly and costly conflict grows.",en,Reply,4,179,38,8,3098,2025-09-05 22:50:04,"<a href=""http://twitter.com/download/iphone"" rel=""nofollow"">Twitter for iPhone</a>",,,,
'1964083514078302253',"Not only has the Trump admin failed to present sufficient evidence, but their story keeps changing. The Trump admin recklessly escalated military tensions with Venezuela, and they can’t even keep their story straight.",en,Reply,3,175,38,4,3343,2025-09-05 22:49:35,"<a href=""http://twitter.com/download/iphone"" rel=""nofollow"">Twitter for iPhone</a>",,,,
'1964083311782887664',The strike was carried out without evidence. These individuals could have easily been arrested and tried — consistent with the rule of law and American values. We all agree on stopping the flow of drugs coming into the U.S. but this amounts to an execution.,en,Reply,4,174,39,5,2390,2025-09-05 22:48:47,"<a href=""http://twitter.com/download/iphone"" rel=""nofollow"">Twitter for iPhone</a>",,,,
'1964083169348767841',"The Trump administration’s strike against a Venezuelan boat allegedly operated by Tren de Aragua was conducted outside of the rule of law.
 
THREAD: Here’s how actions like this make the world more lawless and dangerous for Americans everywhere — including our servicemembers. (1/4)",en,Tweet,49,1621,624,310,33382,2025-09-05 22:48:13,"<a href=""http://twitter.com/download/iphone"" rel=""nofollow"">Twitter for iPhone</a>",,,,
'1964044716195926209',"The latest jobs report is a bad sign for our economy.
 
For Texas families, too many Republican policies are working against them. I’m working in Congress to lower costs for things like groceries, childcare, and housing.",en,Tweet,0,33,8,3,3394,2025-09-05 20:15:25,"<a href=""https://mobile.twitter.com"" rel=""nofollow"">Twitter Web App</a>",,,,
'1963715658577039460',"ICE officials arrested Yadira Córdoba at a routine immigration appointment in San Antonio. Yadira is seeking asylum in the U.S. after facing political persecution from Nicaragua’s Ortega-Murillo regime. If we fail to protect Yadira Córdoba, America’s beacon of light will dim. My full statement:",en,Tweet,6,107,49,13,9888,2025-09-04 22:27:51,"<a href=""http://twitter.com/download/iphone"" rel=""nofollow"">Twitter for iPhone</a>",,,photo,https://pbs.twimg.com/media/G0CE-iVXAAAWm-h.jpg
'1963328541183049995',A discharge petition allows members of the House of Representatives to force a vote on a bill. I just signed one to force a vote to release all of the Epstein files and stop the coverup.,en,Tweet,4,818,175,51,13277,2025-09-03 20:49:35,"<a href=""https://mobile.twitter.com"" rel=""nofollow"">Twitter Web App</a>",,,,
'1963318191913861457',"White House officials are on Capitol Hill to instruct Republicans on how to “sell” the Big Ugly Bill to their constituents. What's to sell? It raises the cost of living, guts healthcare, and it gives tax cuts to billionaires.
 
The reality is Republicans are selling out Americans.",en,Tweet,0,58,23,1,2952,2025-09-03 20:08:28,"<a href=""https://mobile.twitter.com"" rel=""nofollow"">Twitter Web App</a>",,,,
'1963295307740877056',"President Trump is breaking his promise to release the Epstein files. The American people deserve transparency, not a coverup. 

Release the files.",en,Tweet,5,776,180,41,24370,2025-09-03 18:37:32,"<a href=""https://mobile.twitter.com"" rel=""nofollow"">Twitter Web App</a>",,,,
'1962923180550390156',Healthcare costs are skyrocketing in Texas. Health insurance companies in the state are raising premiums by 24% on average. The cause? Trump’s massive cuts to healthcare funding. Congress needs to make healthcare more affordable for hard working families. https://t.co/Ls52oi0bVy,en,Tweet,2,26,12,5,2402,2025-09-02 17:58:50,"<a href=""https://mobile.twitter.com"" rel=""nofollow"">Twitter Web App</a>",,https://www.expressnews.com/business/article/health-insurance-premium-increases-aca-21019265.php/,,
'1962552192239288338',"On Labor Day and every day, I stand with the workers who make our community strong. As workers face greater challenges, I stand with the men and women fighting for the protections, pay, and dignity they deserve. https://t.co/eowz8o3rAV",en,Tweet,1,156,47,24,3380,2025-09-01 17:24:39,"<a href=""http://twitter.com/download/iphone"" rel=""nofollow"">Twitter for iPhone</a>",,,photo,https://pbs.twimg.com/media/Gzxi0T8XoAANnvN.jpg
'1962308627340960203',It was an honor to celebrate World War II veteran Colonel Bill Barnes on his 105th birthday at VFW Post 8541. Thank you for your lifetime of service to our country and to the San Antonio community. https://t.co/52nDeTP7Xc,en,Tweet,1,58,13,5,3679,2025-09-01 01:16:49,"<a href=""http://twitter.com/download/iphone"" rel=""nofollow"">Twitter for iPhone</a>",,,photo,"https://pbs.twimg.com/media/GzuFSvGX0AA-e3j.jpg,https://pbs.twimg.com/media/GzuFSvLWgAAzRHw.jpg,https://pbs.twimg.com/media/GzuFSvFWgAADFWZ.jpg,https://pbs.twimg.com/media/GzuFSvBWcAApQ19.jpg"
'1961478040107536663',"Abbott just signed the illegal redistricting map into law—to serve Trump, not Texans. Republicans have rigged the system to steal power, not earn it. This isn’t democracy at work, it’s voter suppression—and all Texans will suffer. I’ll do everything in my power to protect our voting rights. My full statement:",en,Tweet,0,168,62,51,4110,2025-08-29 18:16:21,"<a href=""https://mobile.twitter.com"" rel=""nofollow"">Twitter Web App</a>",,,photo,https://pbs.twimg.com/media/GziR0LUWMAAroxl.jpg
'1961456636570075527',"This is wrong—and illegal. Not only is Trump gutting $5 billion in foreign aid that saves lives and advances America’s interests, but he’s doing so using an unlawful “pocket recission” method that undermines Congress’ power of the purse. I urge my Republican colleagues to say hell no.",en,Tweet,6,467,172,216,20476,2025-08-29 16:51:18,"<a href=""https://mobile.twitter.com"" rel=""nofollow"">Twitter Web App</a>",,,,
'1961436835416313912',"We all want our families and communities to be healthy, but the MAHA agenda pushes junk science, like ending vaccine guidance that has saved millions of lives. Now, RFK Jr. fired the @CDCgov director for following evidence-backed science.
 
It’s dangerous and it puts our public health at risk. https://t.co/fSa9SBiVfj",en,Tweet,4,113,37,41,3650,2025-08-29 15:32:37,"<a href=""https://mobile.twitter.com"" rel=""nofollow"">Twitter Web App</a>",,,,
'1960761375606890869',"I am praying for the students, teachers and families that have endured this horrific tragedy. As a father, my heart breaks for the parents who sent their beautiful children to their first week of school and will never be able to see and hug them again. This is every parent’s worst nightmare. Our children deserve so much more. Enough is enough.",en,Tweet,0,44,10,16,4645,2025-08-27 18:48:35,"<a href=""https://mobile.twitter.com"" rel=""nofollow"">Twitter Web App</a>",,,,
'1960407929049506187',"Trump is abusing his power to punish his political enemies. He’s appointed the most unqualified cabinet in US history while firing career military and intelligence professionals, like the NSA and DIA directors.

Because he doesn't want experts. He wants enablers. https://t.co/j52exGeAza",en,Tweet,34,2946,1005,231,49874,2025-08-26 19:24:07,"<a href=""https://mobile.twitter.com"" rel=""nofollow"">Twitter Web App</a>",,,video,https://video.twimg.com/amplify_video/1960407575746285568/vid/avc1/1280x720/l2sZCJdHrvOrg8GO.mp4?tag=21
'1960098386696372500',"The Trump Admin refuses to defend $350 million in funding for Hispanic-Serving Institutions, including 121 in Texas. It’s unjust and will hurt Latino students and millions more who attend these colleges and universities. We will keep fighting to ensure HSIs have the support they need to uplift all students.",en,Tweet,7,160,68,55,9837,2025-08-25 22:54:06,"<a href=""https://mobile.twitter.com"" rel=""nofollow"">Twitter Web App</a>",,,photo,"https://pbs.twimg.com/media/GzOqTJuWgAATSNc.jpg,https://pbs.twimg.com/media/GzOqZUcXYAAMIf_.jpg,https://pbs.twimg.com/media/GzOq4C6WcAAw78-.jpg"
'1960064605885014057',"The National Guard’s presence in our capital is another sign of creeping fascism. It's not about safety, it's about control. Now, Trump wants to take over more of America’s cities. We must stand against this abuse of power meant to intimidate our communities. https://t.co/X2W7cx3dzr",en,Tweet,3,157,57,92,5113,2025-08-25 20:39:52,"<a href=""https://mobile.twitter.com"" rel=""nofollow"">Twitter Web App</a>",,,video,https://video.twimg.com/amplify_video/1960064458807447552/vid/avc1/1280x720/FJqLTki_d5JRrcqE.mp4?tag=21
'1960048465582456936',"Paxton’s job is to uphold the constitution, which guarantees the separation of church and state—not the Ten Commandments. Our public schools should focus on educating Texas students, not stoking culture wars. https://t.co/LNI7voKUpf",en,Tweet,5,471,146,46,7494,2025-08-25 19:35:44,"<a href=""https://mobile.twitter.com"" rel=""nofollow"">Twitter Web App</a>",,https://www.houstonchronicle.com/news/houston-texas/religion/article/paxton-ten-commandments-texas-21014419.php,,
'1958305943608791499',"At Trump's direction, the Texas House has now passed racist and illegal congressional maps that rob all Texans of their voice. Make no mistake, this fight is not over. We will keep giving everything we've got to protect our democracy. My full statement: https://t.co/WhE6o5NyjW",en,Tweet,5,254,81,66,9707,2025-08-21 00:11:35,"<a href=""https://mobile.twitter.com"" rel=""nofollow"">Twitter Web App</a>",,,photo,https://pbs.twimg.com/media/Gy1MngJWcAA9H4f.jpg
'1958275483755561075',"Unconstitutional redistricting hurts every Texan. If Trump and Greg Abbott think we’re backing down from protecting voting rights, they have another thing coming. Texans are fighting for their voices to be heard and for our democracy. https://t.co/oFvxMS9hF7",en,Tweet,17,1504,462,174,18130,2025-08-20 22:10:32,"<a href=""https://mobile.twitter.com"" rel=""nofollow"">Twitter Web App</a>",,,video,https://video.twimg.com/amplify_video/1958275140900335618/vid/avc1/720x1280/5X8FtrZaznwmDYUK.mp4?tag=21
'1958220117126390214',"Texas has always been fiercely independent. So when Trump messes with Texas, we stand up and fight back. The fight against illegal redistricting is not over—Texans deserve to have their voices heard. https://t.co/4qupBvnIeH",en,Tweet,0,145,47,66,8610,2025-08-20 18:30:32,"<a href=""https://mobile.twitter.com"" rel=""nofollow"">Twitter Web App</a>",,,photo,"https://pbs.twimg.com/media/Gyz-SlhWQAA00YY.jpg,https://pbs.twimg.com/media/Gyz-j3cWkAAUV3-.jpg,https://pbs.twimg.com/media/Gyz-qH4XEAAbXLH.jpg,https://pbs.twimg.com/media/Gyz-wATWMAAdLZe.jpg"
'1957889259773268299',"After receiving hundreds of submissions from the public, I’m excited to announce the 30 films I’ve nominated to the @libraryofcongress’ National Film Registry this year. These films are centered around Latino life or driven by Latino talent such as producers, directors, and actors.
 
Latino contributions to American culture deserve to be celebrated! Check out my selections on @letterboxd: https://t.co/vMxljjMyWC",en,Tweet,2,28,5,3,2453,2025-08-19 20:35:50,"<a href=""https://mobile.twitter.com"" rel=""nofollow"">Twitter Web App</a>",,,photo,"https://pbs.twimg.com/media/GyvRsoVXMAAwJUb.jpg,https://pbs.twimg.com/media/GyvRwDqX0AAX6g5.jpg"
'1957862418748416163',Republicans locked @NicoleCollier95 in the House chamber for doing her job and fighting to protect democracy. Thank you for standing up for Texans! We won’t let authoritarianism win.,en,Tweet,8,523,167,181,19851,2025-08-19 18:49:10,"<a href=""https://mobile.twitter.com"" rel=""nofollow"">Twitter Web App</a>",,,,
'1957493376372326601',Thank you @TexasHDC for fighting against illegal redistricting. You've showed Texans that their voices matter. https://t.co/8zsyQcP5YJ,en,Tweet,3,219,58,61,7090,2025-08-18 18:22:44,"<a href=""https://mobile.twitter.com"" rel=""nofollow"">Twitter Web App</a>",,,video,https://video.twimg.com/amplify_video/1957493256398221312/vid/avc1/1280x720/qKR3525eCDreiaPj.mp4?tag=21
'1957478376995778957',I'm very proud of Texas House Democrats @TexasHDC for fighting Trump and Abbott’s illegal power grab. They have galvanized people across the country to stand up for our democracy and push back against illegal redistricting. This isn’t over—we will keep fighting.,en,Tweet,2,591,119,96,11845,2025-08-18 17:23:07,"<a href=""https://mobile.twitter.com"" rel=""nofollow"">Twitter Web App</a>",,,,
'1956420329393234277',"Today, Trump will engage in a high stakes summit with Putin. If he cuts a bad deal, it could incentivize future invasions. 

Ukraine needs to be at the table. https://t.co/zxKGkJVytF",en,Tweet,1,150,33,121,7125,2025-08-15 19:18:49,"<a href=""https://mobile.twitter.com"" rel=""nofollow"">Twitter Web App</a>",,,video,https://video.twimg.com/amplify_video/1956420134039359488/vid/avc1/1280x720/jKhQcJc3L31GSG1Z.mp4?tag=21
'1956102388449992875',I met with representatives from @VetsAboutFace’s South Texas Chapter to discuss U.S. foreign policies that support U.S. veterans and promote peace throughout the world. Thank you for your advocacy! https://t.co/zpbmjq6rXm,en,Tweet,0,29,7,2,2163,2025-08-14 22:15:26,"<a href=""https://mobile.twitter.com"" rel=""nofollow"">Twitter Web App</a>",,,photo,https://pbs.twimg.com/media/GyV4pAFXYAATgfr.jpg
