tweet_id,text,language,type,bookmark_count,favorite_count,retweet_count,reply_count,view_count,created_at,client,hashtags,urls,media_type,media_urls
'1969075980326285462',"Busy week in Washington! Check out some highlights 👇🏽

✅@GOPoversight held a hearing titled “Oversight of the District of Columbia.” 
✅I met with incredible constituents and advocacy groups during fly-in visits. 
✅I spoke at the South Carolina Prayer Breakfast, Bon Secours forum, and the ETA Fintech Policy Forum– highlighting faith, health care, and innovation in our economy
✅ We advanced the CAMPS Act (H.R. 5163) through the @GOPoversight Committee. 🇺🇸",en,Tweet,0,14,1,2,599,2025-09-19 17:27:52,"<a href=""http://twitter.com/download/iphone"" rel=""nofollow"">Twitter for iPhone</a>",,,video,"https://video.twimg.com/amplify_video/1969075912038617088/vid/avc1/1080x1350/khLGualCMwgRpT3N.mp4?tag=21,,,"
'1968774943400694177',"Do YOU think 4 years is enough for MURDER?

DC’s top prosecutor does. 

@GOPoversight https://t.co/8m7yuDXZBX",en,Tweet,7,157,58,32,7749,2025-09-18 21:31:39,"<a href=""http://twitter.com/download/iphone"" rel=""nofollow"">Twitter for iPhone</a>",,,video,https://video.twimg.com/amplify_video/1968774854800252928/vid/avc1/1280x720/Z27s90mcnnum0-6L.mp4?tag=21
'1968392162099282297',"After years of Biden-Harris inflation, this rate cut was long overdue. President Trump &amp; @HouseGOP are delivering relief—making homeownership, small business growth, and jobs attainable again! 🇺🇸",en,Tweet,0,105,29,25,16654,2025-09-17 20:10:37,"<a href=""https://mobile.twitter.com"" rel=""nofollow"">Twitter Web App</a>",,,,
'1968352587390095446',"Big win for the Upstate! 💥

Woodward, Inc. is investing $200 million and creating 275 new jobs right here in Spartanburg County with a brand new aerospace manufacturing facility in Greer.

Welcome to the Upstate, Woodward — we are glad you’re here! 🇺🇸✈️ https://t.co/KTi4AO8Ag1",en,Tweet,0,23,7,5,959,2025-09-17 17:33:21,"<a href=""http://twitter.com/download/iphone"" rel=""nofollow"">Twitter for iPhone</a>",,,photo,"https://pbs.twimg.com/media/G1D-PyIWwAkD7R9.jpg,https://pbs.twimg.com/media/G1D-PyPWwAYwGIw.jpg"
'1967999053087773174',"This morning’s prayer breakfast could not have come at a more critical time. 

Thank you, @SenatorTimScott, for leading the annual South Carolina Prayer Breakfast. https://t.co/Kc7MI8Mow8",en,Tweet,2,84,6,4,7501,2025-09-16 18:08:32,"<a href=""http://twitter.com/download/iphone"" rel=""nofollow"">Twitter for iPhone</a>",,,photo,https://pbs.twimg.com/media/G0-8tRgXUAARMpO.jpg
'1967963751157756394',"This is far from over. 

Celebrating an assassination is pure evil, and anyone in a taxpayer-funded classroom who engages in this filth must be held accountable. 

We will not tolerate political violence being normalized in our schools.",en,Tweet,2,36,7,3,2223,2025-09-16 15:48:15,"<a href=""http://twitter.com/download/iphone"" rel=""nofollow"">Twitter for iPhone</a>",,,,
'1967716009667858860',We are not the same. https://t.co/fgE1UGeYFb,en,Tweet,41,1257,274,47,23335,2025-09-15 23:23:49,"<a href=""http://twitter.com/download/iphone"" rel=""nofollow"">Twitter for iPhone</a>",,,photo,"https://pbs.twimg.com/media/G067R9MXoAAPPlA.jpg,https://pbs.twimg.com/media/G067R9EWkAAGGuE.jpg"
'1966604440191787137',"Absolutely disgusting that Clemson professors would celebrate the assassination of Charlie Kirk. 

Anything short of firing them is unacceptable.",en,Tweet,129,17405,3380,596,275669,2025-09-12 21:46:50,"<a href=""http://twitter.com/download/iphone"" rel=""nofollow"">Twitter for iPhone</a>",,,,
'1966575404593938728',"Pleased to announce that the CAMPS Act (H.R. 5163) successfully passed @GOPoversight Committee. ✔️ 

This bill restores safety and dignity to Washington, D.C. Under President Trump’s leadership, we are advancing an America First agenda to make our nation’s capital clean, safe, and welcoming again. 🇺🇸 

🔗: https://t.co/xaNN8y1fVt",en,Tweet,2,38,3,11,2038,2025-09-12 19:51:28,"<a href=""http://twitter.com/download/iphone"" rel=""nofollow"">Twitter for iPhone</a>",,,,
'1966238363142471844',"🚨 FIRED! Radical politics in the classroom ends here. Teacher fired. Students protected. Accountability delivered.

@foxcarolinanews 
https://t.co/3NDE7RnGyM",en,Tweet,13,517,91,35,43880,2025-09-11 21:32:11,"<a href=""http://twitter.com/download/iphone"" rel=""nofollow"">Twitter for iPhone</a>",,https://www.foxcarolina.com/2025/09/11/upstate-teacher-leave-lawmaker-demands-answers-about-charlie-kirk-post/,,
'1966233497837908168',GOOD RIDDANCE,en,Tweet,0,217,27,15,4937,2025-09-11 21:12:51,"<a href=""http://twitter.com/download/iphone"" rel=""nofollow"">Twitter for iPhone</a>",,,,
'1966213175604367692',"If their goal was to silence us, they failed. 

Our movement will not be intimidated. 

Stronger than ever before, we will fight for free speech, secure borders, and the America First values that Charlie Kirk inspired millions to defend.",en,Tweet,2,369,62,132,15972,2025-09-11 19:52:06,"<a href=""http://twitter.com/download/iphone"" rel=""nofollow"">Twitter for iPhone</a>",,,,
'1966201787620438510',"Let this serve as a warning: if you are a public school teacher in my district and you use your platform to spew vile, inappropriate content, you will be held accountable. 

Being placed on leave is just the first step.",en,Tweet,3,422,93,56,22668,2025-09-11 19:06:51,"<a href=""http://twitter.com/download/iphone"" rel=""nofollow"">Twitter for iPhone</a>",,,,
'1966191979362136515',"A public school teacher in my district is openly celebrating the horrific murder of Charlie Kirk. 

This is vile, hateful, and dangerous. 

No one who glorifies political violence should be allowed near students. He should be fired immediately.",en,Tweet,9,300,124,42,20291,2025-09-11 18:27:52,"<a href=""http://twitter.com/download/iphone"" rel=""nofollow"">Twitter for iPhone</a>",,,,
'1966155166492840057',"I proudly voted YES on H.R. 3486- Stop Illegal Entry Act. ✅ 

We MUST have strong and secure borders! 🇺🇸 https://t.co/AV1mVwfpwi",en,Tweet,0,26,4,3,1051,2025-09-11 16:01:35,"<a href=""http://twitter.com/download/iphone"" rel=""nofollow"">Twitter for iPhone</a>",,,photo,https://pbs.twimg.com/media/G0kvs7SWcAAr4Dl.jpg
'1966124984037945468',"Today we remember September 11, 2001. A day of unimaginable loss, but also a day that revealed the strength and resilience of the American spirit.

We honor the nearly 3,000 innocent lives taken, the bravery of the first responders who ran toward danger, and the families whose loved ones never came home.

Evil struck us that morning, but America did not falter. We came together—united as one nation under God—proving to the world that freedom will always outlast fear.

May we never forget. 🇺🇸",en,Tweet,0,62,8,9,5457,2025-09-11 14:01:39,"<a href=""http://twitter.com/download/iphone"" rel=""nofollow"">Twitter for iPhone</a>",,,photo,https://pbs.twimg.com/media/G0kUQLmWQAAIaoH.jpg
'1965886882157564323',"We are devastated that Charlie Kirk was taken from us today. 

Charlie devoted his life to public dialogue and open conversation and ultimately sacrificed it for the same. 

He was a loving husband, father, a friend to many, and inspired a movement of young conservatives. His beautiful family, colleagues, and many supporters are in my thoughts and prayers. 

This is the United States of America—we should be safe to debate differing ideas in the public square.",en,Tweet,0,153,24,24,7833,2025-09-10 22:15:31,"<a href=""http://twitter.com/download/iphone"" rel=""nofollow"">Twitter for iPhone</a>",,,,
'1965848754835321122',Please join me in praying for Charlie Kirk.,en,Tweet,3,372,46,14,9379,2025-09-10 19:44:01,"<a href=""https://mobile.twitter.com"" rel=""nofollow"">Twitter Web App</a>",,,,
'1965844216648466702',"Allowing individuals to sleep in tents on the streets is not compassion — it is neglect.

That is why I introduced the CAMPS Act (H.R. 5163) to restore safety and order in Washington, D.C. This bill will ban camping on public property — no tents, tarps, or makeshift shelters. 

Passing this bill sends a clear message: America’s capital will be clean, managed, and worthy of the nation it represents! 🇺🇸",en,Tweet,8,258,56,64,19202,2025-09-10 19:25:59,"<a href=""http://twitter.com/download/iphone"" rel=""nofollow"">Twitter for iPhone</a>",,,video,https://video.twimg.com/amplify_video/1965844153490710528/vid/avc1/1280x720/0J1QJTk_ttsF2OGm.mp4?tag=21
'1965809516953645120',Proud to be recognized as a “Champion of Limited Government” by the Institute for Legislative Analysis! 🏆 https://t.co/Os9roKkzXY,en,Tweet,0,18,4,1,906,2025-09-10 17:08:06,"<a href=""http://twitter.com/download/iphone"" rel=""nofollow"">Twitter for iPhone</a>",,,photo,https://pbs.twimg.com/media/G0f1VbXXIAAOceC.jpg
'1965476712013271125',LIVE on @NEWSMAX at 3 PM ET — see you there! 📺 🚨 https://t.co/2cromdnBaq,en,Tweet,0,3,0,0,535,2025-09-09 19:05:39,"<a href=""http://twitter.com/download/iphone"" rel=""nofollow"">Twitter for iPhone</a>",,,photo,https://pbs.twimg.com/media/G0bGpukW4AABU64.jpg
'1965437254694003167',"Under President Trump, the USA is hosting:

✅ America250, our nation’s 250th birthday
✅ G20 Summit
✅ Summer Olympics (LA28)
✅ FIFA World Cup

The world’s eyes are on the United States again because we are leading with strength! 🇺🇸",en,Tweet,0,9,0,1,970,2025-09-09 16:28:52,"<a href=""http://twitter.com/download/iphone"" rel=""nofollow"">Twitter for iPhone</a>",,,,
'1965429794587521151',"A young woman is DEAD in Charlotte because Democrats let a career criminal out on CASHLESS BAIL 14 TIMES. Her blood is on their hands. How many more innocent Americans have to die before Democrats wake up? 

Republicans will bring back LAW &amp; ORDER! https://t.co/v0JCVTdcJL",en,Tweet,0,28,5,2,3749,2025-09-09 15:59:13,"<a href=""http://twitter.com/download/iphone"" rel=""nofollow"">Twitter for iPhone</a>",,,photo,https://pbs.twimg.com/media/G0ab-3pW0AAL5Wt.jpg
'1965421537642906023',"Democrats said D.C. was safe. Now they’re minimizing a horrific murder. 

These people will lie about anything to protect their narrative.",en,Tweet,1,38,12,4,3034,2025-09-09 15:26:24,"<a href=""https://mobile.twitter.com"" rel=""nofollow"">Twitter Web App</a>",,,,
'1964023492644323361',"Great visit at Reeves Construction’s Duncan asphalt plant! 🦺🚧

Thank you to Reeves Construction, SCAPA, SCAA, and CAGC for the invitation and for everything you do to keep South Carolina strong and connected. https://t.co/z0fY8nZ5je",en,Tweet,0,4,0,4,587,2025-09-05 18:51:05,"<a href=""http://twitter.com/download/iphone"" rel=""nofollow"">Twitter for iPhone</a>",,,photo,https://pbs.twimg.com/media/G0Gc9HOW0AAW_jq.jpg
'1963627802038571136',"76.4% of Americans now have a chronic disease. 

Eight out of ten kids can’t even qualify for the military. 

This is a national security crisis. Fire the failures. Fix the system. Put America First!",en,Tweet,1,42,13,11,2342,2025-09-04 16:38:45,"<a href=""http://twitter.com/download/iphone"" rel=""nofollow"">Twitter for iPhone</a>",,,,
'1963596189267263674',"Proud to meet with members of the South Carolina National Guard serving in Washington, D.C. 

Thank you for your dedication to keeping our capital safe! 🇺🇸 https://t.co/pEnE5Zum0u",en,Tweet,0,19,5,2,755,2025-09-04 14:33:08,"<a href=""http://twitter.com/download/iphone"" rel=""nofollow"">Twitter for iPhone</a>",,,photo,"https://pbs.twimg.com/media/G0AYUcEWYAAy5AI.jpg,https://pbs.twimg.com/media/G0AYUcEXcAADpQA.jpg,https://pbs.twimg.com/media/G0AYUcCXUAIlq-T.jpg,https://pbs.twimg.com/media/G0AYUcEXUAAcXSg.jpg"
'1963044023398007075',@pizzaguyjeff @GOPoversight 🫡,qme,Reply,0,0,0,3,320,2025-09-03 01:59:01,"<a href=""http://twitter.com/download/iphone"" rel=""nofollow"">Twitter for iPhone</a>",,,,
'1963001778330370439',"🚨 BREAKING: @GOPoversight just released 33,295 pages of Epstein-related records provided by DOJ. DOJ will continue producing documents while protecting victim identities. 

Read them here: https://t.co/TOIN3Y4CWB",en,Tweet,54,235,105,101,64002,2025-09-02 23:11:09,"<a href=""https://mobile.twitter.com"" rel=""nofollow"">Twitter Web App</a>",,https://www.dropbox.com/scl/fo/98fthv8otekjk28lcrnc5/AIn3egnE58MYe4Bn4fliVBw?rlkey=m7p8e9omml96fgxl13kr2nuyt&e=1&st=0xvm0p08&dl=0,,
'1962998930784059804',"The goal of law enforcement isn’t action, it’s prevention.

President Trump’s D.C. crime crackdown is proving that in real time.",en,Tweet,0,10,0,10,1385,2025-09-02 22:59:50,"<a href=""https://mobile.twitter.com"" rel=""nofollow"">Twitter Web App</a>",,,,
'1962956342198407462',"I just met with @GOPoversight and survivors of Jeffrey Epstein. 

House Republicans are committed to providing transparency for the American people and we will follow the facts wherever they lead.",en,Tweet,0,14,2,8,928,2025-09-02 20:10:36,"<a href=""http://twitter.com/download/iphone"" rel=""nofollow"">Twitter for iPhone</a>",,,,
'1962947018424287437',"HAPPENING NOW 🚨 

Watch the livestream 👇🏽",en,Tweet,0,6,2,5,1350,2025-09-02 19:33:33,"<a href=""http://twitter.com/download/iphone"" rel=""nofollow"">Twitter for iPhone</a>",,,,
'1962502473295204851',"Happy Labor Day! 🇺🇸

Today we honor the hardworking men and women who keep our communities strong and our country thriving. Your dedication moves America forward and keeps the American dream alive.

Wishing everyone a safe and restful day with family and friends.",en,Tweet,0,8,2,3,638,2025-09-01 14:07:05,"<a href=""http://twitter.com/download/iphone"" rel=""nofollow"">Twitter for iPhone</a>",,,,
'1961475346466803805',"Had a great time at yesterday’s Congressional Briefing with the Municipal Association of South Carolina in Greer.

Great conversations about how we can keep the Upstate moving forward! https://t.co/0epMbAtymv",en,Tweet,0,6,0,3,559,2025-08-29 18:05:39,"<a href=""http://twitter.com/download/iphone"" rel=""nofollow"">Twitter for iPhone</a>",,,photo,https://pbs.twimg.com/media/GziPTugXkAE2YwM.jpg
'1961131546301043057',Grateful for the opportunity to sit down with the SBA and a room full of manufacturers to discuss how we can unleash the full potential of America’s manufacturing sector! 🇺🇸 https://t.co/54XHSDdoJx,en,Tweet,0,4,1,4,591,2025-08-28 19:19:31,"<a href=""http://twitter.com/download/iphone"" rel=""nofollow"">Twitter for iPhone</a>",,,photo,https://pbs.twimg.com/media/GzdWqRSWQAARhcT.jpg
'1960756968789889303',Great discussion this morning with the Carolinas Credit Union League and Greenville FCU on how Congress can support credit unions in serving families and small businesses across South Carolina. 🏦 🇺🇸 https://t.co/3nfERznt5i,en,Tweet,0,8,1,4,846,2025-08-27 18:31:05,"<a href=""http://twitter.com/download/iphone"" rel=""nofollow"">Twitter for iPhone</a>",,,photo,https://pbs.twimg.com/media/GzYCEfZW4AArPE4.jpg
'1956863967084609694',"Thank you, Governor @henrymcmaster!",en,Tweet,0,21,1,5,2036,2025-08-17 00:41:41,"<a href=""http://twitter.com/download/iphone"" rel=""nofollow"">Twitter for iPhone</a>",,,,
'1956437645770248535',"Strength at home, respect abroad.

President Trump delivered both. https://t.co/E7YR3HoV2o",en,Tweet,13,621,79,384,27571,2025-08-15 20:27:38,"<a href=""http://twitter.com/download/iphone"" rel=""nofollow"">Twitter for iPhone</a>",,,photo,https://pbs.twimg.com/media/Gyapi3DXIAEhgYt.jpg
'1956140192676634736',"America’s capital should be a shining example of safety, cleanliness, and pride. Instead, Mayor Bowser and the radical left D.C. Council have turned it into a disgrace. If they won’t do their jobs, the federal government must.  

I am proud to stand with President Trump to clean up Washington, restore law and order, and make our capital great again.",en,Tweet,1,115,18,41,6952,2025-08-15 00:45:39,"<a href=""http://twitter.com/download/iphone"" rel=""nofollow"">Twitter for iPhone</a>",,,photo,"https://pbs.twimg.com/media/GyWbD7kXcAUnufJ.jpg,https://pbs.twimg.com/media/GyWbEFpWsAIrwxM.jpg,https://pbs.twimg.com/media/GyWbD7oWAAMS7yi.jpg,https://pbs.twimg.com/media/GyWbEFoXoAE7BHD.jpg"
'1956070135867031855',"I am proud to welcome @AGPamBondi to South Carolina alongside @AGAlanWilson, @BryanStirling, @RepJoeWilson, @RepSheriBiggs & @RepRussellFry for a law enforcement summit. From restoring the rule of law in DC, to securing our border, to helping the homeless—we are carrying out President Trump’s mission to keep America safe.

 🇺🇸",en,Tweet,2,47,7,5,2049,2025-08-14 20:07:17,"<a href=""http://twitter.com/download/iphone"" rel=""nofollow"">Twitter for iPhone</a>",,,photo,https://pbs.twimg.com/media/GyVbaUwWoAAweSd.jpg
'1955714886249468356',"EPIC! The @AF_Football just dropped the 2025 edition of the Air Power Legacy Series uniform — honoring the F-16! ✈️

Even cooler? These legendary jets are built right here in Greenville, SC—proud to see SC‑04’s aerospace legacy on full display. https://t.co/lTPO4v0hkc",en,Tweet,0,15,5,2,1054,2025-08-13 20:35:38,"<a href=""http://twitter.com/download/iphone"" rel=""nofollow"">Twitter for iPhone</a>",,,photo,"https://pbs.twimg.com/media/GyQTSYBWIAENdbv.jpg,https://pbs.twimg.com/media/GyQTSYZXUAAeM_Y.jpg,https://pbs.twimg.com/media/GyQTSXcXIAA06Us.jpg,https://pbs.twimg.com/media/GyQTSXgW0AM2wp7.jpg"
'1955651273359016148',"I joined @Kagan_M_Dunlap on his podcast to talk about why I ran for Congress, my service in the Air National Guard, national defense, and the critical role of social media and cybersecurity in today’s world. 🎙️🇺🇸 

🔗 : https://t.co/a237CeLIxs https://t.co/Z8Uv776bYX",en,Tweet,0,8,1,4,2412,2025-08-13 16:22:52,"<a href=""http://twitter.com/download/iphone"" rel=""nofollow"">Twitter for iPhone</a>",,https://youtu.be/-cTGpWrYj0g?si=ExsPP4N_xrdUOL2m,photo,https://pbs.twimg.com/media/GyPeYpCWwAAccmj.jpg
'1955290826612801828',"100th homicide. Embassy attack. Carjackings. Congressional staffers killed. 

But don’t worry… crime is ‘down 30%.’ https://t.co/35vPVYjNEy",en,Tweet,0,28,8,6,1765,2025-08-12 16:30:35,"<a href=""http://twitter.com/download/iphone"" rel=""nofollow"">Twitter for iPhone</a>",,,photo,"https://pbs.twimg.com/media/GyKWpQBXwAA7w_I.jpg,https://pbs.twimg.com/media/GyKWpQCWYAA5U08.jpg,https://pbs.twimg.com/media/GyKWpQEW4AAoTT8.jpg,https://pbs.twimg.com/media/GyKWpQBXEAAUAN4.jpg"
'1954989843164860620',"I am deeply saddened to hear of Senator Roger Nutt’s resignation and recent diagnosis. His dedicated service to the Upstate and the state of South Carolina has been marked by integrity, commitment, and genuine care for his community. https://t.co/UDdtcVQNab",en,Tweet,0,11,7,3,1037,2025-08-11 20:34:35,"<a href=""http://twitter.com/download/iphone"" rel=""nofollow"">Twitter for iPhone</a>",,,photo,https://pbs.twimg.com/media/GyGE5uQWkAAy3pR.jpg
'1954928311127388386',Democrats like Jeffries would rather preserve dangerous cities than admit their policies fail.,en,Tweet,5,553,141,136,21542,2025-08-11 16:30:04,"<a href=""http://twitter.com/download/iphone"" rel=""nofollow"">Twitter for iPhone</a>",,,,
'1954919336717533393',"🚨 President Trump announced he is invoking the D.C. Home Rule Act to place the D.C. Metropolitan Police Department under direct federal control and deploy the National Guard!

President Trump is taking back our capital for the American people. 🇺🇸 

 https://t.co/tAFLGIrKSn",en,Tweet,3,159,33,42,5670,2025-08-11 15:54:25,"<a href=""http://twitter.com/download/iphone"" rel=""nofollow"">Twitter for iPhone</a>",,,video,https://video.twimg.com/amplify_video/1954916297872932864/vid/avc1/1280x720/1xR3Yup8fCJh9Ilm.mp4?tag=21
'1954917974487494743',"Under Democrat control, our nation’s capital has become more dangerous than Bogotá and Mexico City. President Trump is bringing law and order back to Washington. https://t.co/9ReryyuvwB",en,Tweet,2,39,8,10,5889,2025-08-11 15:49:00,"<a href=""http://twitter.com/download/iphone"" rel=""nofollow"">Twitter for iPhone</a>",,,photo,https://pbs.twimg.com/media/GyFDicyWwAA3pJE.jpg
'1954916810710520004',"A nation’s capital in decline is a nation in decline.  

MAKE D.C. SAFE AND BEAUTIFUL AGAIN! 🇺🇸",en,Tweet,5,1174,126,237,12860,2025-08-11 15:44:22,"<a href=""https://mobile.twitter.com"" rel=""nofollow"">Twitter Web App</a>",,,,
'1953539253738107179',"Today on Purple Heart Day, we honor the heroes who were wounded or gave their lives in defense of our country.

Their sacrifice is a lasting reminder that freedom is not free. We are forever grateful. 🇺🇸 https://t.co/E7FDAn12Ie",en,Tweet,0,20,6,4,3719,2025-08-07 20:30:27,"<a href=""http://twitter.com/download/iphone"" rel=""nofollow"">Twitter for iPhone</a>",,,photo,https://pbs.twimg.com/media/GxxdmRCXUAAOHMC.jpg
'1953205094767575088',I fully applaud Governor McMaster’s executive action to restore common sense to the SNAP program. South Carolina is taking the lead to ensure taxpayer dollars support nutrition—not addiction to processed junk. This is what real leadership looks like.,en,Tweet,0,32,9,3,1930,2025-08-06 22:22:38,"<a href=""http://twitter.com/download/iphone"" rel=""nofollow"">Twitter for iPhone</a>",,,,
'1952813620511031487',"Great meeting with the National Apartment Association to talk innovative property use—like transforming old hotels into quality, market-rate housing. 

Creative solutions like these are helping meet demand and revitalize communities. 🏡 🇺🇸 https://t.co/tFUf5n466Y",en,Tweet,0,7,3,9,724,2025-08-05 20:27:03,"<a href=""http://twitter.com/download/iphone"" rel=""nofollow"">Twitter for iPhone</a>",,,photo,https://pbs.twimg.com/media/GxnJodiXsAA7UtB.jpg
'1952484760623956174',"Buying a home should not mean giving up your privacy. I am proud to cosponsor H.R. 2808—a commonsense, bipartisan bill to stop the flood of spam calls tied to mortgage applications. 

Looking forward to President Trump signing it into law! 🖊️",en,Tweet,0,21,2,5,1407,2025-08-04 22:40:17,"<a href=""http://twitter.com/download/iphone"" rel=""nofollow"">Twitter for iPhone</a>",,,,
'1952459497269518846',"First President Trump brought back fitness tests in schools. Now @SecRollins is banning junk food from SNAP. This is what putting America’s health first looks like.

Strong kids. Strong families. Strong nation. 🇺🇸 
 https://t.co/KSUuliOn43",en,Tweet,1,139,36,56,4862,2025-08-04 20:59:53,"<a href=""http://twitter.com/download/iphone"" rel=""nofollow"">Twitter for iPhone</a>",,,video,https://video.twimg.com/amplify_video/1952447975013130240/vid/avc1/1280x720/azhxCpgQDbUfO_hy.mp4?tag=21
'1951058635758641291',"Glad to see President Trump bringing back the Presidential Fitness Test. Setting high standards and encouraging discipline, effort, and personal growth is a GREAT thing. 🇺🇸",en,Tweet,0,26,2,4,2305,2025-08-01 00:13:22,"<a href=""http://twitter.com/download/iphone"" rel=""nofollow"">Twitter for iPhone</a>",,,,
'1950581497192223101',"The so-called “experts” were wrong (again). The U.S. economy grew at a 3.0% pace in Q2, shattering economists’ expectations — with nearly three-fourths of the economists surveyed by Bloomberg getting it wrong!",en,Tweet,0,25,2,7,1022,2025-07-30 16:37:23,"<a href=""https://mobile.twitter.com"" rel=""nofollow"">Twitter Web App</a>",,,,
'1950578408863207604',I voted for this!,en,Tweet,2,26,4,2,959,2025-07-30 16:25:07,"<a href=""http://twitter.com/download/iphone"" rel=""nofollow"">Twitter for iPhone</a>",,,,
'1950569064184598755',"TOWNHALL: Join me TODAY at 5:30 PM for a LIVE telephone townhall!  ☎️ 

PLEASE REGISTER BY NOON TO JOIN OUR CALL LIST! 👇🏼 

https://t.co/FZjcw9eC1a",en,Tweet,0,8,6,8,751,2025-07-30 15:47:59,"<a href=""http://twitter.com/download/iphone"" rel=""nofollow"">Twitter for iPhone</a>",,https://timmons.house.gov/forms/form/?ID=24,,
'1950223382143787434',"TOWNHALL: Join me tomorrow at 5:30 PM for a live telephone townhall!  ☎️ 

I will be answering your questions and giving updates on the work we are doing in the 119th Congress. 

Sign up to participate via the link below👇🏼 

🔗: https://t.co/FZjcw9eC1a https://t.co/fNFTadstN8",en,Tweet,1,5,0,0,595,2025-07-29 16:54:22,"<a href=""http://twitter.com/download/iphone"" rel=""nofollow"">Twitter for iPhone</a>",,https://timmons.house.gov/forms/form/?ID=24,photo,https://pbs.twimg.com/media/GxCV1GfWMAAnyD5.jpg
'1949917590551236693',"🚨 Heat Advisory for #SC04 today — heat index could hit 110° in parts of the district. 

Stay safe:
💧 Drink water (do NOT wait until you're thirsty)
☀️ Limit outdoor activity mid-day
🐾 Never leave pets in cars",en,Tweet,0,9,1,3,1194,2025-07-28 20:39:15,"<a href=""http://twitter.com/download/iphone"" rel=""nofollow"">Twitter for iPhone</a>",#SC04,,,
'1949907925666791892',"Join me this Wednesday at 5:30 PM for a live telephone town hall!  

I will be answering your questions and giving updates on the work we are doing in Congress.

Sign up to participate at the link below.⬇️ 

https://t.co/FZjcw9eC1a",en,Tweet,1,6,2,5,820,2025-07-28 20:00:51,"<a href=""http://twitter.com/download/iphone"" rel=""nofollow"">Twitter for iPhone</a>",,https://timmons.house.gov/forms/form/?ID=24,,
'1948408769638969526',Last week’s historic “Coffee Showcase” with @RepPabloJose. ☕️ 🇺🇸 https://t.co/FbVTqF2A9b,en,Tweet,0,5,0,2,644,2025-07-24 16:43:45,"<a href=""http://twitter.com/download/iphone"" rel=""nofollow"">Twitter for iPhone</a>",,,photo,"https://pbs.twimg.com/media/GwojcrTWIAEVdsd.jpg,https://pbs.twimg.com/media/GwojcrTXYAAy6l3.jpg,https://pbs.twimg.com/media/GwojcrgXsAACGFL.jpg,https://pbs.twimg.com/media/GwojcrZXQAAAIGS.jpg"
