tweet_id,text,language,type,bookmark_count,favorite_count,retweet_count,reply_count,view_count,created_at,client,hashtags,urls,media_type,media_urls
'1942265486625960107',"As rescue missions continue, San Antonians continue to grieve the tragic loss of life from the catastrophic flooding in Kerr County and Central Texas. Just last month, a devastating flash flood event in San Antonio caused 13 deaths. Leaders at all levels of government—local, state, and federal—must work together to identify real solutions that prevent future flooding tragedies.",en,Tweet,1,24,9,25,3298,2025-07-07 17:52:32,"<a href=""http://twitter.com/download/iphone"" rel=""nofollow"">Twitter for iPhone</a>",,,video,https://video.twimg.com/amplify_video/1942265423535181824/vid/avc1/1080x1350/YeoiVecAmUci3DgL.mp4?tag=21
'1941218877071032834',"I am heartbroken to learn that several people have tragically lost their lives in the flash floods that struck Kerr County. I urge everyone to use caution, get to higher ground, and stay safe. https://t.co/YOLZVRSzdp",en,Tweet,2,71,10,16,3727,2025-07-04 20:33:41,"<a href=""http://twitter.com/download/iphone"" rel=""nofollow"">Twitter for iPhone</a>",,https://www.tpr.org/2025-07-04/kerr-county-residents-urged-not-to-travel-unless-seeking-higher-ground-along-guadalupe-as-severe-flooding-leads-to-fatalities,,
'1941144078697325018',"Happy Fourth of July, San Antonio! Today we celebrate our country’s independence and freedom. https://t.co/7YAKHxdlsx",en,Tweet,0,17,4,11,2502,2025-07-04 15:36:27,"<a href=""http://twitter.com/download/iphone"" rel=""nofollow"">Twitter for iPhone</a>",,,photo,https://pbs.twimg.com/media/GvBUQHUXEAEtBbx.jpg
'1940924511836352585',"The Big Ugly Bill will hurt Texas families at every stage of life. It will eliminate SNAP benefits for children, cut financial aid for students, slash support for long-term nursing home care, and so much more. Now the fight begins to undo the damage. https://t.co/HhsscdkRYq",en,Tweet,1,76,31,16,3407,2025-07-04 01:03:58,"<a href=""http://twitter.com/download/iphone"" rel=""nofollow"">Twitter for iPhone</a>",,,video,https://video.twimg.com/amplify_video/1940923868748623872/vid/avc1/1080x1350/3gx4ZFFaMcIbfwh-.mp4?tag=21
'1940888475307544741',Republicans had the choice to protect their jobs or do the right thing for their constituents. They chose their jobs. All because they’re scared of Donald Trump. It’s shameful. https://t.co/ukD5divHpW,en,Tweet,1,96,37,33,4895,2025-07-03 22:40:47,"<a href=""http://twitter.com/download/iphone"" rel=""nofollow"">Twitter for iPhone</a>",,,video,https://video.twimg.com/amplify_video/1940887668822294528/vid/avc1/1080x1350/mG85DoRTEh868g9o.mp4?tag=21
'1940842518998143406',"This is a big, ugly bill that will devastate hard working families in Texas and across the country. 

My full statement: https://t.co/bOiupjyM4W",en,Tweet,4,219,73,38,8840,2025-07-03 19:38:10,"<a href=""http://twitter.com/download/iphone"" rel=""nofollow"">Twitter for iPhone</a>",,,photo,https://pbs.twimg.com/media/Gu9B_AsW0AAGfei.jpg
'1940592906240512268',"Someone didn’t tell the guys who run this account at the White House that Trump intends to strip people of their US citizenship - “denaturalize” people. 

That’s what this Big Ugly Bill will help do.",en,Tweet,4,219,74,31,10943,2025-07-03 03:06:17,"<a href=""http://twitter.com/download/iphone"" rel=""nofollow"">Twitter for iPhone</a>",,,,
'1940573698228113774',Everyone matters. Everyone deserves healthcare.,en,Tweet,8,497,116,37,16682,2025-07-03 01:49:58,"<a href=""http://twitter.com/download/iphone"" rel=""nofollow"">Twitter for iPhone</a>",,,,
'1940451903055552861',"Many Republicans know the Big Ugly Bill will cost people their lives. Some want to vote NO but they’re scared of crossing Donald Trump. 

So I let them know exactly what’s at stake and the choice they have to make. 

Save your career or save your constituents’ lives. https://t.co/2tMgeF9haT",en,Tweet,19,765,352,83,48299,2025-07-02 17:46:00,"<a href=""http://twitter.com/download/iphone"" rel=""nofollow"">Twitter for iPhone</a>",,,video,https://video.twimg.com/amplify_video/1940451838270013440/vid/avc1/1080x1920/15dQMl3I8KpUr2rF.mp4?tag=21
'1940436156967268401',"Only four Republican NO-votes would tank the spending bill. For the sake of 17 million Americans in jeopardy of losing their healthcare, I hope they find the courage.",en,Tweet,2,359,85,30,15028,2025-07-02 16:43:26,"<a href=""https://mobile.twitter.com"" rel=""nofollow"">Twitter Web App</a>",,,,
'1940421063302910338',"The GOP spending bill will make Texans sicker, ripping away healthcare from 1.6 million people. https://t.co/UeSKKfpTGY",en,Tweet,1,50,23,6,2389,2025-07-02 15:43:27,"<a href=""http://twitter.com/download/iphone"" rel=""nofollow"">Twitter for iPhone</a>",,,photo,https://pbs.twimg.com/media/Gu3CrCrXQAAK8iP.jpg
'1940404782218592515',"The GOP spending bill includes $1 trillion in cuts to Medicaid, leaving 1.6 million Texans without healthcare. This will hurt so many folks, including our kids. https://t.co/Hk0pPIVOgh",en,Tweet,1,45,17,26,2509,2025-07-02 14:38:45,"<a href=""http://twitter.com/download/iphone"" rel=""nofollow"">Twitter for iPhone</a>",,,photo,https://pbs.twimg.com/media/Gu2z3VfWQAAOVVm.jpg
'1940389115989504140',The name “Alligator Alcatraz” fails to convey how extreme and barbaric Trump’s latest attack on immigrants really is. It was constructed using disaster funding. It will plunge people into inhumane conditions. It makes a mockery of our civil liberties. And it weaponizes people’s worst nightmares to strike fear in our communities. We all need to speak out against this. https://t.co/GyCcIA0vy1,en,Tweet,9,337,110,65,10087,2025-07-02 13:36:30,"<a href=""https://mobile.twitter.com"" rel=""nofollow"">Twitter Web App</a>",,,,
'1940085010033410083',This bill is a betrayal to Texas families. I’ll be voting no.,en,Tweet,4,876,130,84,39007,2025-07-01 17:28:06,"<a href=""http://twitter.com/download/iphone"" rel=""nofollow"">Twitter for iPhone</a>",,,,
'1940072585343246824',"The GOP spending bill will add $3.3 trillion to the national debt while ripping away Medicaid, SNAP benefits, college grant programs, and funding to invest in green energy. This is a bad bill that will harm Texas families and slash investments in our infrastructure of opportunity. https://t.co/parZbRFJcb",en,Tweet,1,45,19,3,3279,2025-07-01 16:38:43,"<a href=""https://mobile.twitter.com"" rel=""nofollow"">Twitter Web App</a>",,,,
'1939809318511288361',"Texas has the highest rate of uninsured people in the nation. The GOP spending bill would decimate Medicaid funding, making it even harder for Texas families to get the healthcare they need. https://t.co/ev7vEJcaNS",en,Tweet,0,27,9,4,2730,2025-06-30 23:12:36,"<a href=""http://twitter.com/download/iphone"" rel=""nofollow"">Twitter for iPhone</a>",,https://www.expressnews.com/lifestyle/article/texas-uninsured-adults-health-care-coverage-20399709.php,,
'1939686349046714606',I am praying for the firefighters who lost their lives by a horrific act of violence while in the line of duty—and for the entire Idaho community they served.,en,Tweet,0,118,17,7,4942,2025-06-30 15:03:57,"<a href=""https://mobile.twitter.com"" rel=""nofollow"">Twitter Web App</a>",,,,
'1939354269955608896',"Thank you to @SEIU members for making this Justice Journey to stand up for the Forero family and the many good, hardworking immigrants who are being ripped away from their families and put into inhumane detention conditions. SEIU is fighting not only for living wages and good working conditions but also the very freedom of its members. That’s true representation.",en,Tweet,0,19,9,2,3138,2025-06-29 17:04:24,"<a href=""http://twitter.com/download/iphone"" rel=""nofollow"">Twitter for iPhone</a>",,,photo,"https://pbs.twimg.com/media/Gun4LzFW0AAZ_nb.jpg,https://pbs.twimg.com/amplify_video_thumb/1939353996176556032/img/uaH48biTUMPNEGnL.jpg,https://pbs.twimg.com/media/Gun4LzxWUAAJZrl.jpg"
'1939041012287967603',"My Grandmother came to Texas as an orphan from Mexico. She worked 2-3 jobs at a time to support herself and my Mom. She never owned a house, car or retirement account. @TexasAFLCIO is making sure today’s workers don’t face the same struggles my grandmother did. That means good wages and a dignified retirement. #UnionStrong",en,Tweet,1,77,19,4,4304,2025-06-28 20:19:37,"<a href=""http://twitter.com/download/iphone"" rel=""nofollow"">Twitter for iPhone</a>",,,video,https://video.twimg.com/amplify_video/1939040487387652096/vid/avc1/720x1280/AkprjUjWQ1_-tKeq.mp4?tag=21
'1938642498751971811',My statement on today’s Supreme Court decision on birthright citizenship: https://t.co/myy7dx4XGB,en,Tweet,2,72,36,13,6758,2025-06-27 17:56:04,"<a href=""http://twitter.com/download/iphone"" rel=""nofollow"">Twitter for iPhone</a>",,,photo,https://pbs.twimg.com/media/GudxEw6XEAAELe7.jpg
'1938381431081677174',Breakfast for dinner! https://t.co/brRe9ID5G1,en,Tweet,0,203,11,11,6381,2025-06-27 00:38:41,"<a href=""http://twitter.com/download/iphone"" rel=""nofollow"">Twitter for iPhone</a>",,,photo,https://pbs.twimg.com/media/GuaDo2LWsAAWc60.jpg
'1938284315114185166',"Today we celebrate the 10th anniversary of Obergefell v. Hodges. Without this landmark decision, marriage equality would not be the law of the land in Texas. I’ll keep defending Texans’ freedom to love who they want to love. https://t.co/0ul1yLq8ST",en,Tweet,0,106,28,15,4774,2025-06-26 18:12:46,"<a href=""http://twitter.com/download/iphone"" rel=""nofollow"">Twitter for iPhone</a>",,,photo,https://pbs.twimg.com/media/GuYrT8IXoAA4pnt.jpg
'1937982234671386966',"My office is currently hiring fall interns. We are looking for passionate young people who are eager to be a part of the democratic process.

Visit the link below to learn how to apply. And of course, San Antonio ties are a plus 😎 https://t.co/6tMhS2c4II https://t.co/RHIz3RP7T8",en,Tweet,2,22,10,3,2586,2025-06-25 22:12:25,"<a href=""http://twitter.com/download/iphone"" rel=""nofollow"">Twitter for iPhone</a>",,https://castro.house.gov/how-can-i-help/internships,photo,https://pbs.twimg.com/media/GuUYkijWgAAEnST.jpg
'1937920864676159595',"Congress is a co-equal branch of government. Republicans must join Democrats in asserting Congressional authority, especially when it comes to entering a war Americans do not want. https://t.co/88Cbh5xUxr",en,Tweet,2,73,25,76,4173,2025-06-25 18:08:33,"<a href=""http://twitter.com/download/iphone"" rel=""nofollow"">Twitter for iPhone</a>",,,video,https://video.twimg.com/amplify_video/1937920795579150336/vid/avc1/1280x720/vyWSxU8H-2ho8J6b.mp4?tag=21
'1937896529609585056',Trump is claiming victory despite a strike that fell short of eliminating Iran’s nuclear capabilities and opens the U.S. up to an endless cycle of war. More of my thoughts below:  https://t.co/FgARRyidKr,en,Tweet,2,38,8,7,2412,2025-06-25 16:31:51,"<a href=""http://twitter.com/download/iphone"" rel=""nofollow"">Twitter for iPhone</a>",,https://www.washingtonpost.com/national-security/2025/06/24/trump-bombing-ceasefire-pivot/?_pml=1,,
'1937663195415523469',My son Roman joined me at work today! https://t.co/JQYmj4vws7,en,Tweet,2,517,33,10,17792,2025-06-25 01:04:40,"<a href=""http://twitter.com/download/iphone"" rel=""nofollow"">Twitter for iPhone</a>",,,photo,"https://pbs.twimg.com/media/GuP2aA_XsAAxeud.jpg,https://pbs.twimg.com/media/GuP2aA3WsAA-2p4.jpg,https://pbs.twimg.com/media/GuP2aA3XgAAaOWo.jpg,https://pbs.twimg.com/media/GuP2aA4W4AA7PpV.jpg"
'1937654181579444462',"The governor is rejecting $450 million meaning that 3.8 million Texas children will go hungry. He’s not acting alone. In Congress, Republicans are jeopardizing food assistance programs that help hard working Texas families put food on the table. It’s shameful. https://t.co/ulLvORVpZj",en,Tweet,6,475,210,47,11786,2025-06-25 00:28:51,"<a href=""https://mobile.twitter.com"" rel=""nofollow"">Twitter Web App</a>",,,,
'1937600119718756400',"The President took the United States to war with Iran without the authorization of Congress.
 
He claims the military operations were a success but is now refusing to brief the Congress or explain his actions in a timely manner.
 
Why is there a delay?",en,Tweet,0,144,19,35,3721,2025-06-24 20:54:02,"<a href=""http://twitter.com/download/iphone"" rel=""nofollow"">Twitter for iPhone</a>",,,,
'1937569144565600745',"It was an honor to nominate eight students to attend our military academies. After demonstrating their academic ability and moral character, they will now join the many San Antonians who have served our nation.

Y’all are making us proud! https://t.co/GHTu5wb1rZ https://t.co/tdcNXEEZFF",en,Tweet,0,10,3,1,1636,2025-06-24 18:50:57,"<a href=""https://mobile.twitter.com"" rel=""nofollow"">Twitter Web App</a>",,https://www.ksat.com/news/local/2025/06/21/im-very-grateful-san-antonio-students-recognized-awarded-admission-to-us-service-academies/,photo,https://pbs.twimg.com/media/GuOgxQIXEAEDhaV.jpg
'1937539425774219684',"The Supreme Court’s Dobbs decision has harmed women across the country. Women deserve the right to make choices about their own health, future, and families. I’ll keep fighting to protect a women’s right to choose. https://t.co/biIpP8c36f",en,Tweet,0,28,6,2,2779,2025-06-24 16:52:51,"<a href=""http://twitter.com/download/iphone"" rel=""nofollow"">Twitter for iPhone</a>",,,photo,https://pbs.twimg.com/media/GuOF1uGXwAA20XD.jpg
'1936873627288207593',"Americans don’t want another long, messy and expensive war. Instead of spending trillions on another war in the Middle East, we should invest in Americans and build out the infrastructure of opportunity here at home. https://t.co/jdexmtafpK",en,Tweet,12,668,191,309,21135,2025-06-22 20:47:12,"<a href=""http://twitter.com/download/iphone"" rel=""nofollow"">Twitter for iPhone</a>",,,video,https://video.twimg.com/amplify_video/1936873545587470336/vid/avc1/1280x720/e6fs707D6ktKDbgp.mp4?tag=21
'1936625247827984825',"Too often Presidents mistake the initial acts of war as the conclusion to the conflict rather than the opening of a Pandora’s box.

That appears to be the case with President Trump today. https://t.co/n41FPk2mlT",en,Tweet,25,788,261,460,43302,2025-06-22 04:20:14,"<a href=""http://twitter.com/download/iphone"" rel=""nofollow"">Twitter for iPhone</a>",,,photo,https://pbs.twimg.com/media/GuBGZfzWAAAuy4r.jpg
'1935687827074736471',"Today, on Juneteenth, we celebrate 160 years of freedom. I am proud that my home state of Texas was the first to recognize Juneteenth as a state holiday in 1980. We’ve made progress as a nation, but the fight to achieve true racial equality—and build an infrastructure of opportunity for every single American—is not over. It requires all of us standing together and staying united. 

Juneteenth is a reminder of the dark stains on our nation’s history, but also what’s possible when we come together to do what is right—a day that honors not just the end of slavery, but our commitment to fight for freedom and justice for all.",en,Tweet,2,92,21,7,2665,2025-06-19 14:15:15,"<a href=""http://twitter.com/download/iphone"" rel=""nofollow"">Twitter for iPhone</a>",,,photo,https://pbs.twimg.com/media/Gtzx0cfWYAA1lr5.jpg
'1935496879271252250',"No place, no city or community in our country has a monopoly when it comes to military sacrifice. Our service members serve because they believe in the values of our country.  

But that trust and goodwill has sometimes been abused by political leaders who sent our service members to fight in wars under false pretenses based on bad or biased intelligence. 

And as we witness the first days of the war between Israel and Iran, I feel we’re on the verge of making the same old mistake in a new war in the Middle East. Read my full statement on the Israel-Iran conflict here.",en,Tweet,10,188,45,9,21417,2025-06-19 01:36:30,"<a href=""http://twitter.com/download/iphone"" rel=""nofollow"">Twitter for iPhone</a>",,,photo,https://pbs.twimg.com/media/GtxEJz2XcAA3HRw.jpg
'1935392252257341454',"The Texas Dream Act has invested in Texas Dreamers and given them a fighting chance at achieving their dreams. Their participation in sectors like healthcare, energy, tech and more has enabled the Texas economy to boom. To gut the law is a mistake. Read my oped in the @dallasnews here: https://t.co/49mUMs3xu5",en,Tweet,0,54,17,9,4004,2025-06-18 18:40:45,"<a href=""http://twitter.com/download/iphone"" rel=""nofollow"">Twitter for iPhone</a>",,,photo,https://pbs.twimg.com/media/Gtvk_vXXAAACCki.jpg
'1934648623611990429',"This is a good sign and could provide a path back towards a negotiated agreement—the only proven way to address Iran's nuclear program.

We must push for both Israel and Iran to de-escalate and for Iran to reenter negotiations that were disrupted by Israel's military strikes.",en,Tweet,2,91,16,15,14383,2025-06-16 17:25:50,"<a href=""http://twitter.com/download/iphone"" rel=""nofollow"">Twitter for iPhone</a>",,,,
'1934399285216329901',Happy Father’s Day to all the Dads out there! Fatherhood has been one of the greatest joys of my life. https://t.co/Nx7vxfXjO5,en,Tweet,0,159,9,6,5194,2025-06-16 00:55:03,"<a href=""http://twitter.com/download/iphone"" rel=""nofollow"">Twitter for iPhone</a>",,,photo,"https://pbs.twimg.com/media/Gthd5daWYAAWXTb.jpg,https://pbs.twimg.com/media/Gthd5dVWQAAoEOF.jpg,https://pbs.twimg.com/media/Gthd5dwbsAA6C_I.jpg"
'1934377661075194342',"If President Trump intends to get the U.S. more involved in the war between Israel and Iran by attacking Iran, he must come to the Congress, make his case, and secure an authorization before he pulls our country into yet another war in the Middle East.",en,Tweet,24,756,215,60,57952,2025-06-15 23:29:08,"<a href=""http://twitter.com/download/iphone"" rel=""nofollow"">Twitter for iPhone</a>",,,,
'1933914446734233788',"I am praying for the family and loved ones of Rep. Melissa Hortman after she and her husband were killed. A heartbreaking loss. 

I am also praying for Sen. John Hoffman and his wife Yvette, who were each shot multiple times. I pray for their healing and a full recovery. 

This violence should be condemned by every American.",en,Tweet,1,254,46,95,13271,2025-06-14 16:48:29,"<a href=""http://twitter.com/download/iphone"" rel=""nofollow"">Twitter for iPhone</a>",,,,
'1933640075922768365',"This is a tragedy. My prayers are with the families and loved ones of the victims of this week’s flash floods. I also want to thank the first responders for their commitment to the ongoing recovery efforts. 

San Antonio always stands together when tragedy strikes and we will continue to do so as our community grieves this loss.",en,Tweet,1,87,24,8,6099,2025-06-13 22:38:14,"<a href=""http://twitter.com/download/iphone"" rel=""nofollow"">Twitter for iPhone</a>",,,,
'1933324723729133883',"The administration - and Steve Witkoff - were about to start the next round of negotiations to reach a deal with Iran.

This attack by Netanyahu is pure sabotage.

What does “America First” even mean if Trump allows Netanyahu to drag the country into a war Americans don’t want?",en,Tweet,168,5283,1219,440,306085,2025-06-13 01:45:08,"<a href=""http://twitter.com/download/iphone"" rel=""nofollow"">Twitter for iPhone</a>",,,,
'1933277943670653043',My colleagues and I went to Speaker Johnson’s and Leader Thune’s offices just now to demand an investigation into the assault of @SenAlexPadilla. Let’s be clear: Republican leadership is complicit in enabling the growing authoritarianism in this country. https://t.co/4oL2uhcM5w,en,Tweet,58,4417,1549,1157,98114,2025-06-12 22:39:14,"<a href=""http://twitter.com/download/iphone"" rel=""nofollow"">Twitter for iPhone</a>",,,video,"https://video.twimg.com/amplify_video/1933277890440818688/vid/avc1/720x1280/ENo3FxqBF0Ny6Cpr.mp4?tag=21,"
'1933277135957061644',"These are the same guys that are cool with masked ICE agents with no badge, no ID and no warrant ripping moms away from their kids.",en,Tweet,11,642,142,51,26040,2025-06-12 22:36:02,"<a href=""http://twitter.com/download/iphone"" rel=""nofollow"">Twitter for iPhone</a>",,,,
'1933237323736526876',"This is another alarming sign that Donald Trump is taking this country towards authoritarianism. The administration is trying to stomp out anyone who disagrees with them, including public officials doing their jobs like @SenAlexPadilla. These shocking actions are a danger to the rights of all Americans.",en,Tweet,7,413,119,185,11591,2025-06-12 19:57:50,"<a href=""http://twitter.com/download/iphone"" rel=""nofollow"">Twitter for iPhone</a>",,,,
'1932872995569062352',"(4/4) We are grateful that Mayor Nirenberg and Chief McManus are directing local law enforcement to protect the First Amendment rights and safety of everyone. By needlessly deploying the National Guard, Governor Abbott is escalating tensions rather than promoting safety and calm. Abbott’s reckless actions will make protesters and officers alike less safe.",en,Reply,1,40,8,4,2067,2025-06-11 19:50:07,"<a href=""http://twitter.com/download/iphone"" rel=""nofollow"">Twitter for iPhone</a>",,,,
'1932872993186750505',"(3/4) Our community will not be intimidated, and we encourage everyone to gather peacefully against President Trump's unlawful, undemocratic actions: ignoring court orders, weaponizing federal agencies against his perceived enemies, and tearing apart immigrant families.",en,Reply,1,35,5,2,2018,2025-06-11 19:50:07,"<a href=""http://twitter.com/download/iphone"" rel=""nofollow"">Twitter for iPhone</a>",,,,
'1932872990791794702',"(2/4) By deploying the National Guard, Governor Abbott is trying to intimidate our community for rallying against President Trump's authoritarian policies. And if he were serious about working with our local authorities, he would have alerted them before making this inflammatory decision.",en,Reply,1,33,5,1,668,2025-06-11 19:50:06,"<a href=""http://twitter.com/download/iphone"" rel=""nofollow"">Twitter for iPhone</a>",,,,
'1932872988594221318',"(1/4) San Antonio takes great pride in its history of peaceful demonstrations in support of civil rights, social justice, and economic equality.",en,Reply,1,30,4,1,702,2025-06-11 19:50:06,"<a href=""http://twitter.com/download/iphone"" rel=""nofollow"">Twitter for iPhone</a>",,,,
'1932872986354405571',🧵My statement with @RepCasar on @GregAbbott_TX deploying the National Guard to San Antonio:,en,Tweet,11,129,47,19,8081,2025-06-11 19:50:05,"<a href=""http://twitter.com/download/iphone"" rel=""nofollow"">Twitter for iPhone</a>",,,,
'1932560534596919362',General Richard E. Cavazos was a military hero — the first Hispanic four-star general who represents the best of Texas. President Trump should do the right thing and continue to honor General Cavazos’ extraordinary service to our country and keep the base named after him.,en,Tweet,3,191,60,9,9819,2025-06-10 23:08:31,"<a href=""http://twitter.com/download/iphone"" rel=""nofollow"">Twitter for iPhone</a>",,,,
'1932551140610064473',These ongoing arrests are an ugly bait and switch that punish folks for following the rules. This is discouraging other people from following the law and showing up for their court hearings. It’s so wrong and we need to hold the authorities accountable.,en,Tweet,1,95,26,29,7365,2025-06-10 22:31:11,"<a href=""http://twitter.com/download/iphone"" rel=""nofollow"">Twitter for iPhone</a>",,,,
'1931850211707818119',"This action is escalatory and authoritarian. The Trump administration continues to take any opportunity to sow chaos, diminish the rule of law, and undermine our constitutional rights.",en,Tweet,7,331,99,131,13696,2025-06-09 00:05:57,"<a href=""http://twitter.com/download/iphone"" rel=""nofollow"">Twitter for iPhone</a>",,,,
'1931002402137653535',"Today we honor the courage of those who fought in Normandy 81 years ago. On D-Day, thousands stormed the beaches of Normandy and fought for our freedom and the freedom of our allies. Today we honor their legacy and sacrifice.",en,Tweet,0,98,22,8,3669,2025-06-06 15:57:03,"<a href=""http://twitter.com/download/iphone"" rel=""nofollow"">Twitter for iPhone</a>",,,,
'1930653888975192297',"San Antonio! The 2025 Congressional App Challenge has launched!

Middle and high school students are invited to submit original apps for a chance to win the annual challenge. The first-place winner will be flown out to D.C. for a special reception. I look forward to seeing the STEM talent our students have to offer! Register at https://t.co/QuwdBnDoqk.",en,Tweet,0,9,1,1,1456,2025-06-05 16:52:11,"<a href=""http://twitter.com/download/iphone"" rel=""nofollow"">Twitter for iPhone</a>",,,photo,https://pbs.twimg.com/media/GssPeu4WQAAKuIx.jpg
'1930441009126687123',"This is a choreographed surrender. Legislation to gut the in-state tuition program just got shut down in the Texas legislature. Now Trump’s DOJ steps in and goes against what the legislature did, and Abbott and Paxton are refusing to defend the law enacted in 2001 and signed by Rick Perry. It’s backdoor legislating by cowards. And it will hurt Texans.",en,Tweet,23,395,166,42,28420,2025-06-05 02:46:17,"<a href=""http://twitter.com/download/iphone"" rel=""nofollow"">Twitter for iPhone</a>",,,,
'1930371416223809716',"This CBO score shows how grim the impacts of the Republican budget bill will be: $2.4 trillion will be added to the debt, 16 million Americans will lose access to healthcare, and costs for hardworking families will only continue to skyrocket.",en,Tweet,1,14,5,5,2998,2025-06-04 22:09:44,"<a href=""http://twitter.com/download/iphone"" rel=""nofollow"">Twitter for iPhone</a>",,,,
