tweet_id,text,language,type,bookmark_count,favorite_count,retweet_count,reply_count,view_count,created_at,client,hashtags,urls,media_type,media_urls
'1902833606038352053',"Needs 60 Senate votes to completely dismantle it and you can count me as a hell no.

See you in court.",en,Tweet,2695,176811,10341,5205,7376514,2025-03-20 21:24:19,"<a href=""http://twitter.com/download/iphone"" rel=""nofollow"">Twitter for iPhone</a>",,,,
'1902811579063865480',"Access to childcare has always been one of my priorities in the Senate. It’s a kitchen table issue that lets parents go to work. The Brainerd Family YMCA provides high-quality childcare for the community, and thanks to federal dollars, they built a new center.
 
Last week, Republicans stopped projects like this from going forward. They want tax cuts for billionaires instead of childcare for working families.",en,Tweet,4,57,10,40,26307,2025-03-20 19:56:47,"<a href=""http://twitter.com/download/iphone"" rel=""nofollow"">Twitter for iPhone</a>",,,photo,https://pbs.twimg.com/media/Gmgjv6OagAAPy5b.jpg
'1902771282900623599',"Minnesotans who rely on food shelves is at a record high – it’s a godsend for families who just need a little extra help feeding themselves and their kids.
 
Musk has never had to rely on a food shelf in his life – and Trump hasn’t either. Yet they think it’s fine to cut the funding that helps these pantries make ends meet– pantries like the Lakes Area Food Shelf in Pequot Lakes, Minnesota.",en,Tweet,3,169,45,105,19389,2025-03-20 17:16:40,"<a href=""http://twitter.com/download/iphone"" rel=""nofollow"">Twitter for iPhone</a>",,,photo,https://pbs.twimg.com/media/GmgAUC2asAAcegt.jpg
'1902522583402066303',"More bullshit.

@realDonaldTrump, you can’t shut down the Department of Education — and you know it. Fox News even knows it. So stop it.

We know you’re just trying to wear us out. But for the record, I am not overwhelmed. My zone isn’t flooded.

I will fight your illegal behavior until the cows come home, and I’m pretty sure the hundreds of thousands of people who’ve contacted my office since you started this nonsense are on the same page.",en,Tweet,100,4142,1241,624,158301,2025-03-20 00:48:25,"<a href=""http://twitter.com/download/iphone"" rel=""nofollow"">Twitter for iPhone</a>",,,photo,https://pbs.twimg.com/media/GmceNKGXwAAoSgz.jpg
'1902461089876512970',"One thing that I think gets lost in all of this talk about Medicaid cuts: Medicaid goes by different names in different states.
 
Minnesota calls it Medical Assistance/MinnesotaCare.

Wisconsin calls it BadgerCare.

Alaska calls it DenaliCare.

California calls it Medi-Cal.

New Jersey calls it NJ FamilyCare.
 
Different states use different names, but the pain will be felt everywhere, regardless of what you call it.",en,Tweet,23,676,238,150,29169,2025-03-19 20:44:04,"<a href=""http://twitter.com/download/iphone"" rel=""nofollow"">Twitter for iPhone</a>",,,,
'1902437782359798108',"We can’t stand aside while Musk and his cronies gut medical research — including research into mental health. 

We teamed up with NAMI to make sure Minnesotans know to speak up — we should be moving forward in this fight, not backwards. https://t.co/yarV4EQXf1",en,Tweet,2,149,48,74,8572,2025-03-19 19:11:27,"<a href=""http://twitter.com/download/iphone"" rel=""nofollow"">Twitter for iPhone</a>",,,photo,https://pbs.twimg.com/media/GmbRFBQXYAAkxhR.jpg
'1902135259040215161',"Grocery prices are still too high, and Minnesota farmers are struggling as the bird flu devastates their flocks.
 
The Trump administration’s response has left too many questions unanswered. Farmers need help now and working families need to see prices come down. https://t.co/Af7SBAFCVJ",en,Tweet,3,111,28,101,13515,2025-03-18 23:09:20,"<a href=""http://twitter.com/download/iphone"" rel=""nofollow"">Twitter for iPhone</a>",,,photo,"https://pbs.twimg.com/media/GmW977XWQAAHnfP.jpg,https://pbs.twimg.com/media/GmW977XXcAAtIem.jpg,https://pbs.twimg.com/media/GmW977aWIAAvbxF.jpg"
'1902088567129563224',"Trump, Musk and Republicans are gutting the VA—firing thousands, many of them veterans—to pay for tax cuts for billionaires.

Fewer doctors, longer wait times, and worse care.

This is reckless and a betrayal of the veterans who served our country. They deserve better. https://t.co/AGlWZgm4TA",en,Tweet,2,124,45,65,5258,2025-03-18 20:03:48,"<a href=""http://twitter.com/download/iphone"" rel=""nofollow"">Twitter for iPhone</a>",,,photo,https://pbs.twimg.com/media/GmWTd9vbkAACrMu.jpg
'1901784458854068514',"Trump lets Musk run completely unchecked through our government, firing workers managing things like housing support and veterans care just so they can give themselves and their billionaire friends big tax breaks. 
 
I’m standing with our government workers — on St. Paddy’s Day and every day. Elon Musk is not their boss.",en,Tweet,0,141,37,87,5558,2025-03-17 23:55:23,"<a href=""http://twitter.com/download/iphone"" rel=""nofollow"">Twitter for iPhone</a>",,,photo,"https://pbs.twimg.com/media/GmR-3YfXcAAd6MA.jpg,https://pbs.twimg.com/media/GmR-3YfWkAAfWTf.jpg,https://pbs.twimg.com/media/GmR-3ZKbQAAleMB.jpg,https://pbs.twimg.com/media/GmR-3YkWIAA2KIc.jpg"
'1901766090083975181',"Tribal sovereignty is inherent—it predates the United States and is enshrined in treaties, federal law, and the U.S. Constitution. We won't stop reminding the Trump administration of these facts.
 
Thank you to the Minnesota Indian Affairs Council for having me today. https://t.co/FtEgt1qpTo",en,Tweet,1,223,73,34,7098,2025-03-17 22:42:23,"<a href=""http://twitter.com/download/iphone"" rel=""nofollow"">Twitter for iPhone</a>",,,photo,https://pbs.twimg.com/media/GmRuLNcbcAAwL33.jpg
'1900596302393872844',"Every time I talk to Postal Service workers, they say they don’t have enough workers to deliver all the mail on time. Make this make sense.

Elon and his minions need to stay the hell away from USPS.",en,Tweet,52,2319,743,266,102255,2025-03-14 17:14:04,"<a href=""https://mobile.twitter.com"" rel=""nofollow"">Twitter Web App</a>",,,,
'1900563654996525448',"Not to ruin everyone’s day, but don’t forget in the midst of this ‘CR’ chaos that they’re also trying to install a snake oil salesman (Dr. Oz) as head of Medicare and Medicaid.

Finance Committee questions him today.",en,Tweet,92,9705,2416,470,137873,2025-03-14 15:04:20,"<a href=""https://mobile.twitter.com"" rel=""nofollow"">Twitter Web App</a>",,,,
'1900303863162314804',"Read my full statement here ⬇️

https://t.co/AkuSb9bV6p",en,Reply,1,85,23,29,8629,2025-03-13 21:52:01,"<a href=""http://twitter.com/download/iphone"" rel=""nofollow"">Twitter for iPhone</a>",,https://www.smith.senate.gov/u-s-senator-tina-smith-voting-no-on-dangerous-republican-spending-bill/,,
'1900299584296943967',"Trump and Republicans set this up as an unprecedented power grab so they can slash and burn government services on their terms.

I’m a firm NO — on cloture and final passage — on this ‘CR’",en,Tweet,35,8712,1316,1445,185712,2025-03-13 21:35:01,"<a href=""http://twitter.com/download/iphone"" rel=""nofollow"">Twitter for iPhone</a>",,,,
'1899989490221146298',"Project 2025 says fire federal workers, so they are.

Project 2025 says abolish the Dept. of Ed, so they are.

Project 2025 says kick moms + babies off Medicaid, so they are.
 
Project 2025 calls for a national abortion ban using the Comstock Act… see where I’m going with this?",en,Tweet,362,11641,3726,1256,204685,2025-03-13 01:02:49,"<a href=""http://twitter.com/download/iphone"" rel=""nofollow"">Twitter for iPhone</a>",,,,
'1899972930752409975',"SENIORS: I need help with my Social Security who can I call?

REPUBLICANS: ¯\_(ツ)_/¯ https://t.co/cVQ7f2VoN4",en,Tweet,12,534,103,113,58683,2025-03-12 23:57:01,"<a href=""http://twitter.com/download/iphone"" rel=""nofollow"">Twitter for iPhone</a>",,,photo,https://pbs.twimg.com/media/Gl4PT2tWsAAr9Iv.jpg
'1899915446226477338',"Really doesn’t take a detective to uncover that Republicans are enacting Project 2025 – just last night they began the process of dismantling the Department of Education.

Everything points to them trying to misuse the Comstock Act to ban abortion nationwide, even in states where it’s legal.

Today, I’m re-introducing a bill to stop them.",en,Tweet,3,295,104,45,9591,2025-03-12 20:08:35,"<a href=""https://mobile.twitter.com"" rel=""nofollow"">Twitter Web App</a>",,,,
'1899874958672605612',Nothing to see here this is totally normal and happens all the time and isn’t weird at all and doesn’t signal any sort of corruption https://t.co/m6QcLDjyaZ,en,Tweet,4,443,123,141,18848,2025-03-12 17:27:42,"<a href=""https://mobile.twitter.com"" rel=""nofollow"">Twitter Web App</a>",,,photo,"https://pbs.twimg.com/media/Gl22LmxXYAAZSIE.jpg,https://pbs.twimg.com/media/Gl22MhZXgAA8DOg.jpg"
'1899849874016776427',He might as well grab a microphone and just shout “I CAN BE BOUGHT!” https://t.co/CxY3WPAlov,en,Tweet,16,1524,335,209,27977,2025-03-12 15:48:02,"<a href=""https://mobile.twitter.com"" rel=""nofollow"">Twitter Web App</a>",,,photo,https://pbs.twimg.com/media/Gl2fSoDXoAAPO-8.jpg
'1899837074607345744',https://t.co/2tJ3F87YKM,zxx,Tweet,1,75,14,33,14022,2025-03-12 14:57:10,"<a href=""http://twitter.com/download/iphone"" rel=""nofollow"">Twitter for iPhone</a>",,,photo,https://pbs.twimg.com/media/Gl2TwB4WwAAfX7r.jpg
'1899623239623590222',"Taking health care from moms and babies just doesn’t produce quite enough money to shell out to corporations and billionaires, so he simply MUST dip his paws into grandma and grandpa’s Social Security too.
 
The rich can never be too rich right?

https://t.co/OAdZXrn5xb",en,Tweet,152,8118,2708,1376,286927,2025-03-12 00:47:28,"<a href=""http://twitter.com/download/iphone"" rel=""nofollow"">Twitter for iPhone</a>",,,video,https://video.twimg.com/ext_tw_video/1899202144433053696/pu/vid/avc1/1280x720/MAv1PynBJUlxe4-U.mp4?tag=12
'1899585185294807391',“Golden Age” seems to be full of red… tell me again how this is supposed to make America great? https://t.co/P1d78707WW,en,Tweet,2,163,33,68,8166,2025-03-11 22:16:15,"<a href=""http://twitter.com/download/iphone"" rel=""nofollow"">Twitter for iPhone</a>",,,video,https://video.twimg.com/amplify_video/1899585126486392833/vid/avc1/720x944/Ffx1q1WOJ3DtIbcw.mp4?tag=16
'1899513086685430013',"Park Rangers often uproot their lives and move their families to some of the most remote areas in our country, and this is how we repay them?

If you’ve ever met a Ranger (which I’m guessing Elon never has) you know they aren’t doing it because that’s where the money’s at.

They’re doing their job because they love our public lands and want all of us to enjoy them.

Not waste.
Not fraud.
But this is definitely abuse to our NPS workers.",en,Tweet,3,214,65,19,7878,2025-03-11 17:29:45,"<a href=""https://mobile.twitter.com"" rel=""nofollow"">Twitter Web App</a>",,,,
'1899502737814897054',https://t.co/YuphGKky05,zxx,Tweet,865,31831,1684,53,885261,2025-03-11 16:48:38,"<a href=""http://twitter.com/download/iphone"" rel=""nofollow"">Twitter for iPhone</a>",,,photo,https://pbs.twimg.com/media/GlxjrG3XgAAvwYk.jpg
'1899177383120257144',"Your platform suffers a massive cyberattack but sure, definitely take the time to “own the libs” instead of getting your own house in order.

Makes sense. Very *efficient* use of your time, Elon.",en,Tweet,6,638,126,226,28458,2025-03-10 19:15:47,"<a href=""http://twitter.com/download/iphone"" rel=""nofollow"">Twitter for iPhone</a>",,,,
'1899164645098709339',"VA workers fired then rehired.
Bird flu researchers fired then rehired.
Nuclear safety workers fired then rehired.

Twitter’s down, back up, then down again, maybe back up again (?)

Not seeing much efficiency…",en,Tweet,5,432,109,97,10660,2025-03-10 18:25:10,"<a href=""http://twitter.com/download/iphone"" rel=""nofollow"">Twitter for iPhone</a>",,,,
'1899148116416180307',Can’t even keep his hellscape of a social platform online… yet Republicans trust him with the keys to all of our data?,en,Tweet,70,6943,998,2697,506477,2025-03-10 17:19:30,"<a href=""http://twitter.com/download/iphone"" rel=""nofollow"">Twitter for iPhone</a>",,,,
'1897675244812267978',https://t.co/q3aBYsEwv4,zxx,Tweet,5,235,73,78,10018,2025-03-06 15:46:50,"<a href=""http://twitter.com/download/iphone"" rel=""nofollow"">Twitter for iPhone</a>",,,photo,https://pbs.twimg.com/media/GlXlk_eXUAA-sSf.jpg
'1897663371471925342',"Trump During SOTU: We are going to build the healthiest and most vital communities anywhere in the world.

Trump Earlier That Day: Doctors only have to save a pregnant woman’s life in *some* states.",en,Tweet,1,161,40,79,10678,2025-03-06 14:59:39,"<a href=""https://mobile.twitter.com"" rel=""nofollow"">Twitter Web App</a>",,,,
'1897433075862114368',"Taking health care away from veterans with an already understaffed VA… starting to make a lot of sense why he didn’t mention his health care plan last night.

@SenateGOP you good with this?",en,Tweet,3,237,95,73,11400,2025-03-05 23:44:32,"<a href=""http://twitter.com/download/iphone"" rel=""nofollow"">Twitter for iPhone</a>",,,,
'1897399691765338530',YOU SHOULD NOT HAVE TO BE AIRLIFTED TO OTHER STATES TO OBTAIN HEALTH CARE THAT WILL SAVE YOUR LIFE!,en,Tweet,20,1201,288,60,57452,2025-03-05 21:31:53,"<a href=""https://mobile.twitter.com"" rel=""nofollow"">Twitter Web App</a>",,,,
'1897359430108504446',"Musk is shamelessly enriching his minions with the salaries of hard-working Americans.

He claims to be fighting government waste? Nope. Disgraceful but unsurprising.",en,Tweet,6,268,92,133,13889,2025-03-05 18:51:54,"<a href=""https://mobile.twitter.com"" rel=""nofollow"">Twitter Web App</a>",,,,
'1897142259474424027',I think that’s the best SOTU response I’ve ever seen.,en,Tweet,9,1502,96,337,65871,2025-03-05 04:28:56,"<a href=""http://twitter.com/download/iphone"" rel=""nofollow"">Twitter for iPhone</a>",,,,
'1897137589251162236',And that concludes the worst birthday evening of my life.,en,Tweet,64,6753,231,1487,236080,2025-03-05 04:10:23,"<a href=""http://twitter.com/download/iphone"" rel=""nofollow"">Twitter for iPhone</a>",,,,
'1897132311642300526',"Russian state TV literally can't get enough of Trump.
 
Direct quote: ""With respect to Ukraine, he is ready to give Russia everything it wants to take.""",en,Tweet,14,380,135,63,14100,2025-03-05 03:49:24,"<a href=""http://twitter.com/download/iphone"" rel=""nofollow"">Twitter for iPhone</a>",,,,
'1897121016423624794',This trade war is the LAST thing this economy needs right now.,en,Tweet,0,343,39,82,9566,2025-03-05 03:04:31,"<a href=""http://twitter.com/download/iphone"" rel=""nofollow"">Twitter for iPhone</a>",,,,
'1897120219191296197',It takes a man with an incredibly small and fragile ego to screw over families just trying to pay their bills because he wants to get the last word in a trade war that never needed to happen in the first place.,en,Tweet,1,704,167,97,13791,2025-03-05 03:01:21,"<a href=""http://twitter.com/download/iphone"" rel=""nofollow"">Twitter for iPhone</a>",,,,
'1897119263816868059',"Republicans: When you’re the party that bends over backwards to give tax cuts to the richest of the rich, you’re not fixing the economy.
 
You’re rigging it.",en,Tweet,3,826,250,150,20167,2025-03-05 02:57:33,"<a href=""http://twitter.com/download/iphone"" rel=""nofollow"">Twitter for iPhone</a>",,,,
'1897117317575930126',"Is someone keeping track of all the lies, I can’t type fast enough.",en,Tweet,11,1945,253,223,31400,2025-03-05 02:49:49,"<a href=""http://twitter.com/download/iphone"" rel=""nofollow"">Twitter for iPhone</a>",,,,
'1897111056734101660',Rumors of a surprise guest — where do you think they’ll seat Putin?,en,Tweet,6,773,78,174,25430,2025-03-05 02:24:57,"<a href=""http://twitter.com/download/iphone"" rel=""nofollow"">Twitter for iPhone</a>",,,,
'1896989950673088641',"Trump doesn’t give a damn about us, he only cares about billing us for his tax breaks for the richest of the rich.

Screwing Minnesotans by putting us in the middle of a trade war with our *ally* is beyond insanity.",en,Tweet,18,1039,341,284,39445,2025-03-04 18:23:43,"<a href=""http://twitter.com/download/iphone"" rel=""nofollow"">Twitter for iPhone</a>",,,,
'1896985570288837070',"My State of the Union guest, Park Ranger Kate, was sweet enough to get me a birthday gift that doubles as an emotional support/stress Loon for tonight’s speech.

Definitely going to need it. Little piece of home to get me through.

(and yes, it does make noise!) https://t.co/AjgADYa0s2",en,Tweet,4,746,48,486,83279,2025-03-04 18:06:18,"<a href=""http://twitter.com/download/iphone"" rel=""nofollow"">Twitter for iPhone</a>",,,photo,https://pbs.twimg.com/media/GlNyUoWW0AETOvS.jpg
'1896618212508525005',By “you” she means these guys. https://t.co/FirPVtF4n0,en,Tweet,503,69181,3314,419,1360712,2025-03-03 17:46:33,"<a href=""http://twitter.com/download/iphone"" rel=""nofollow"">Twitter for iPhone</a>",,,photo,"https://pbs.twimg.com/media/GlIkNqZXEAAwYWe.jpg,https://pbs.twimg.com/media/GlIkNqaXwAA5w4r.jpg"
'1896580113057370432',"Musk and Trump should have to face the hardworking Park Rangers they sacked.

I’m bringing Kate, who was unjustly fired from northern Minnesota’s Voyageurs National Park, to the State of the Union. https://t.co/RWiaiH7ncx",en,Tweet,263,17329,1994,4744,722419,2025-03-03 15:15:10,"<a href=""https://mobile.twitter.com"" rel=""nofollow"">Twitter Web App</a>",,,photo,"https://pbs.twimg.com/media/GlIBj4jXIAAFFCF.jpg,https://pbs.twimg.com/media/GlIBW4rWoAAJwB4.jpg"
'1895958655247561078',"Ramadan Mubarak to all who observe in Minnesota and beyond! I hope this month brings peace, reflection and blessings.",en,Tweet,1,99,10,68,12871,2025-03-01 22:05:43,"<a href=""http://twitter.com/download/iphone"" rel=""nofollow"">Twitter for iPhone</a>",,,,
'1895648597150179758',"By siding with Putin against Europe, Ukraine and our allies, they have made every American less safe and secure.",en,Reply,4,171,46,48,8264,2025-03-01 01:33:39,"<a href=""http://twitter.com/download/iphone"" rel=""nofollow"">Twitter for iPhone</a>",,,,
'1895648595287957665',"Trump and Vance demonstrated today that Putin owns them.

Putin. A brutal dictator whose biggest global ally sits in the Oval Office.",en,Tweet,10,1186,257,261,21531,2025-03-01 01:33:39,"<a href=""http://twitter.com/download/iphone"" rel=""nofollow"">Twitter for iPhone</a>",,,,
'1895607545248825378',The more I watch the more shocked I am to see an American President fall so far.,en,Tweet,18,2030,184,386,39378,2025-02-28 22:50:32,"<a href=""http://twitter.com/download/iphone"" rel=""nofollow"">Twitter for iPhone</a>",,,,
'1895551231353147768',"That press conference was choreographed for an audience of one and he sits in Moscow.

Once, we fought tyrants. Today Trump and Vance are bending America’s knee. And that weakens us.",en,Tweet,43,3554,858,236,49247,2025-02-28 19:06:45,"<a href=""http://twitter.com/download/iphone"" rel=""nofollow"">Twitter for iPhone</a>",,,,
'1895548086384279646',"Call out to all the Republicans who have posed for photo ops with Zelensky: Is today the day to finally speak out?

Patriotism demands it.",en,Tweet,16,2178,411,168,27375,2025-02-28 18:54:16,"<a href=""http://twitter.com/download/iphone"" rel=""nofollow"">Twitter for iPhone</a>",,,,
'1895266797076783312',Musk and DOGE are putting people’s lives and safety at risk  — where are the Republicans ready to stand up and protect your constituents?,en,Tweet,5,420,144,124,17407,2025-02-28 00:16:31,"<a href=""http://twitter.com/download/iphone"" rel=""nofollow"">Twitter for iPhone</a>",,,,
'1895178440019714097',"The next time you hear Republicans mention tax cuts, ask yourself: For who? 

Because unless you’re in the top 5%, it’s probably not you. https://t.co/XJN2G3I7aw",en,Tweet,10,355,145,155,14991,2025-02-27 18:25:25,"<a href=""https://mobile.twitter.com"" rel=""nofollow"">Twitter Web App</a>",,,photo,https://pbs.twimg.com/media/Gk0Gtb5WwAAyliq.jpg
'1895114000876126703',"This is corruption in plain sight.

Musk is getting sweetheart deals for his companies, DOGE is helping him do it, and the President is cheering him on.

This isn’t about government efficiency, but making him richer.",en,Tweet,298,12510,3426,2232,505158,2025-02-27 14:09:21,"<a href=""http://twitter.com/download/iphone"" rel=""nofollow"">Twitter for iPhone</a>",,,,
'1894934107626385727',"Musk: Cut spending on everything!***
 
***unless you’re talking about the $38 billion in taxpayer dollars I get as the world’s richest man",en,Tweet,3,73,21,33,6073,2025-02-27 02:14:32,"<a href=""http://twitter.com/download/iphone"" rel=""nofollow"">Twitter for iPhone</a>",,,,
'1894778087344107699',One giant grift. https://t.co/nWBa4MMKZw,en,Tweet,12,417,133,122,25652,2025-02-26 15:54:33,"<a href=""http://twitter.com/download/iphone"" rel=""nofollow"">Twitter for iPhone</a>",,,photo,https://pbs.twimg.com/media/GkuaoIUW4AErejL.jpg
'1894775651258753414',"Some more Minnesotans that have been screwed by Musk/Trump:

* Forest Service worker who helps loggers sell timber
* Veteran at the VA (who rooted out waste!)
* Another veteran at the Small Business Administration who helped startups",en,Tweet,5,278,73,146,11239,2025-02-26 15:44:53,"<a href=""https://mobile.twitter.com"" rel=""nofollow"">Twitter Web App</a>",,,,
'1894521572448190566',"The Consumer Financial Protection Bureau is on the side of consumers. There’s a reason Wall Street hates them.

But one of the first things that Donald Trump and Secretary Bessent did was get rid of it. https://t.co/3iA1fSJ8ZQ",en,Tweet,5,315,98,102,10432,2025-02-25 22:55:16,"<a href=""http://twitter.com/download/iphone"" rel=""nofollow"">Twitter for iPhone</a>",,,video,https://video.twimg.com/amplify_video/1894521475253596161/vid/avc1/1080x1080/l5O_iKj915y4hr7Y.mp4?tag=16
'1894470023558971514',"Let’s call this what it is: A closed-door meeting where Republicans huddle up and find out how they can give boatloads of our money to the very richest among us and leave pennies for everyone else.

They’ll pay for it by defunding Medicaid, which ~40% of kids rely on. They’d be the villains in any story book.",en,Tweet,12,708,219,271,38389,2025-02-25 19:30:25,"<a href=""https://mobile.twitter.com"" rel=""nofollow"">Twitter Web App</a>",,,,
'1894456172591124889',"How can you tell that Trump and Musk don’t actually care about going after waste and fraud?

They fired someone at the Minnesota VA whose job was to find waste/inefficiencies to save taxpayer money.

It’s all a façade to shell out more money for billionaires and big corporations.",en,Tweet,52,3508,1125,719,54033,2025-02-25 18:35:23,"<a href=""http://twitter.com/download/iphone"" rel=""nofollow"">Twitter for iPhone</a>",,,,
'1894196241585541616',"That’s Tammy Baldwin — not me. You can keep track of all the hundreds of white men but it’s the 28 women in the Senate that trips you up, @FoxNews? https://t.co/swMtV8MjYb",en,Tweet,430,40111,4462,2108,1133546,2025-02-25 01:22:31,"<a href=""http://twitter.com/download/iphone"" rel=""nofollow"">Twitter for iPhone</a>",,,photo,https://pbs.twimg.com/media/GkmJcXvXsAAE7OJ.jpg
'1894174649308545508',How far have we fallen as a country that we are siding with Russia and North Korea to vote against condemning Russia's actions in Ukraine?,en,Tweet,21,2067,534,271,70658,2025-02-24 23:56:43,"<a href=""http://twitter.com/download/iphone"" rel=""nofollow"">Twitter for iPhone</a>",,,,
'1894141130528154057',Seems like there’s some trouble in paradise.,en,Tweet,2,176,32,66,17466,2025-02-24 21:43:31,"<a href=""http://twitter.com/download/iphone"" rel=""nofollow"">Twitter for iPhone</a>",,,,
'1894129231812333804',"People are mad, and we should be. We know when we’re being scammed. 

In the name of “efficiency” Musk is firing park rangers and cancer researchers, and defunding Medicare and Medicaid, all to find money for tax breaks for himself and big corporations.

Of course people get upset when you take their health care to help rich people who don’t even need it.",en,Tweet,15,1102,297,357,60605,2025-02-24 20:56:14,"<a href=""https://mobile.twitter.com"" rel=""nofollow"">Twitter Web App</a>",,,,
'1894104536932917724',"They’re letting a megalomaniac billionaire desperate for validation play President – if you’re surprised people are pissed, you need to get out of your DC bubble.

Nothing more American than hating a bad boss, especially an illegitimate one like Musk.

Republicans just don’t like being called on it.",en,Tweet,48,3346,750,619,86152,2025-02-24 19:18:07,"<a href=""https://mobile.twitter.com"" rel=""nofollow"">Twitter Web App</a>",,,,
'1893744944210223123',"Maybe hating on dick bosses is the great unifier, the thing that brings all Americans together.",en,Tweet,97,5108,823,1057,225876,2025-02-23 19:29:13,"<a href=""http://twitter.com/download/iphone"" rel=""nofollow"">Twitter for iPhone</a>",,,,
'1893683042650083375',".@ElonMusk I hate to break it to you but you aren’t my boss. I answer to the people of Minnesota.

But since you bring it up, I spent last week fighting to stop tax breaks for billionaires like you, paid for by defunding health care for moms and babies.",en,Tweet,2057,131640,13597,21138,12198204,2025-02-23 15:23:14,"<a href=""http://twitter.com/download/iphone"" rel=""nofollow"">Twitter for iPhone</a>",,,,
'1893460945130639632',"I bet a lot of people have had an experience like this with a bad boss - there’s an email in your inbox on Saturday night saying, “Prove to me your worthiness by Monday or else.” 

I’m on the side of the workers, not the billionaire asshole bosses.",en,Reply,146,8293,912,4465,427571,2025-02-23 00:40:42,"<a href=""http://twitter.com/download/iphone"" rel=""nofollow"">Twitter for iPhone</a>",,,,
