tweet_id,text,language,type,bookmark_count,favorite_count,retweet_count,reply_count,view_count,created_at,client,hashtags,urls,media_type,media_urls
'1875229974166433939',"Americans didn't vote for more tax breaks for billionaires. They voted because their lives cost too much.

We see time and time again that the 2017 Trump tax law benefitted those at the very top while leaving working families with little benefit.",en,Tweet,0,93,28,94,6267,2025-01-03 17:17:20,"<a href=""https://mobile.twitter.com"" rel=""nofollow"">Twitter Web App</a>",,,,
'1874964411317989635',"I'm grateful for the opportunity and I look forward to using my voice on this Committee to continue fighting for all of Minnesota – families, small businesses, farmers, rural parts – so that everyone can build the life they want.",en,Reply,0,24,2,4,1896,2025-01-02 23:42:05,"<a href=""http://twitter.com/download/iphone"" rel=""nofollow"">Twitter for iPhone</a>",,,,
'1874964409631858729',"Parts of the 2017 tax law are set to expire. Re-writing them will be one of the biggest fights, and it starts in the Finance Committee.

We need a better tax code for American workers (who were forced to foot the bill for big corporate giveaways for the ultra-wealthy last time).",en,Reply,0,31,12,6,2381,2025-01-02 23:42:05,"<a href=""http://twitter.com/download/iphone"" rel=""nofollow"">Twitter for iPhone</a>",,,,
'1874964407857619410',"I’m joining the Senate Finance Committee.

I’m excited to continue standing up for Minnesotans and the issues we care about. This new post presents a unique opportunity to protect Medicare + Social Security, expand mental health access and write a fairer tax code.",en,Tweet,2,203,36,59,45898,2025-01-02 23:42:04,"<a href=""http://twitter.com/download/iphone"" rel=""nofollow"">Twitter for iPhone</a>",,,,
'1874565451654799585',"Tragic news out of New Orleans about this terrible act of terrorism against innocent people simply out to celebrate New Year’s Eve.

We are all thinking about New Orleans today.",en,Tweet,2,39,6,17,4137,2025-01-01 21:16:46,"<a href=""http://twitter.com/download/iphone"" rel=""nofollow"">Twitter for iPhone</a>",,,,
'1874517725357502880',"Happy New Year, Minnesota!

We have a big year ahead of us, but Archie and I hope you can take some time to reflect and celebrate the New Year with your loved ones 🎉",en,Tweet,0,70,6,27,4084,2025-01-01 18:07:07,"<a href=""http://twitter.com/download/iphone"" rel=""nofollow"">Twitter for iPhone</a>",,,,
'1873487289122525190',"Jimmy Carter personified moral leadership for our country &amp; the world. I was blessed to meet him several times. My favorite moment (when this pic was taken), he had just finished an energetic conversation w/ Archie about the virtues of fly fishing.

May his memory be a blessing. https://t.co/YriPM8z8Du",en,Tweet,3,351,40,45,5875,2024-12-29 21:52:32,"<a href=""http://twitter.com/download/iphone"" rel=""nofollow"">Twitter for iPhone</a>",,,photo,https://pbs.twimg.com/media/Gf_2wlnWQAABlhs.jpg
'1873423512599138491',#SKOL https://t.co/kUaREMfyKR,qme,Tweet,1,107,10,7,6704,2024-12-29 17:39:06,"<a href=""http://twitter.com/download/iphone"" rel=""nofollow"">Twitter for iPhone</a>",#SKOL,,animated_gif,https://pbs.twimg.com/tweet_video_thumb/Gf-8wNrXIAAGNrA.jpg
'1873098258236752108',"She was smart and funny and dedicated to public service. 

Everything was better when Kari was involved.",en,Reply,0,29,3,2,1741,2024-12-28 20:06:39,"<a href=""http://twitter.com/download/iphone"" rel=""nofollow"">Twitter for iPhone</a>",,,,
'1873098203496890523',"I’m so sad to hear we have lost MN State Senator Kari Dziedzic to cancer, gone too soon at 62.

Kari was a friend and ally for 20 years, dating back to our staff days when I worked for Mayor Rybak at City Hall and she worked for the County Board.",en,Tweet,2,165,26,13,5495,2024-12-28 20:06:26,"<a href=""http://twitter.com/download/iphone"" rel=""nofollow"">Twitter for iPhone</a>",,,,
'1872343048476414208',"Habari Gani, Minnesota! Archie and I wish you all a joyous Kwanzaa.",en,Tweet,0,20,2,6,2420,2024-12-26 18:05:43,"<a href=""http://twitter.com/download/iphone"" rel=""nofollow"">Twitter for iPhone</a>",,,,
'1872321884517540271',"I counted her a friend and advisor for many years, with her strong opinions, curly white hair and tomato red coat.

We will miss her.",en,Reply,0,17,1,3,1451,2024-12-26 16:41:37,"<a href=""http://twitter.com/download/iphone"" rel=""nofollow"">Twitter for iPhone</a>",,,,
'1872321882005143978',"Minnesota lost a fierce fighter for the North Country with the passing of Mary Murphy.

Mary was the longest serving woman in the MN legislature, serving for 46 years. https://t.co/QFmaI1qoGZ",en,Tweet,0,81,12,17,4102,2024-12-26 16:41:37,"<a href=""http://twitter.com/download/iphone"" rel=""nofollow"">Twitter for iPhone</a>",,,photo,https://pbs.twimg.com/media/GfvS1DJXIAAX6kZ.jpg
'1872078897841619159',"Happy Hanukkah, Minnesota! Wishing everyone celebrating the festival of lights a wonderful eight days filled with loved ones, latkes and joy.",en,Tweet,0,36,6,4,3327,2024-12-26 00:36:05,"<a href=""http://twitter.com/download/iphone"" rel=""nofollow"">Twitter for iPhone</a>",,,,
'1871943969468551316',Archie and I are wishing everyone in Minnesota and across the country a Merry Christmas! Hope everyone can have a wonderful and peaceful day with your loved ones 🎄,en,Tweet,0,115,13,21,4538,2024-12-25 15:39:56,"<a href=""http://twitter.com/download/iphone"" rel=""nofollow"">Twitter for iPhone</a>",,,,
'1871247037049786746',"Trump figured out that taking away people’s abortion rights is DEEPLY unpopular, so he said a whole bunch of things to walk back his stances, including on Comstock.

Do I trust him? No.

Am I going to do everything I can to hold him and Republicans accountable? Absolutely.",en,Tweet,0,127,34,73,8639,2024-12-23 17:30:34,"<a href=""http://twitter.com/download/iphone"" rel=""nofollow"">Twitter for iPhone</a>",,,,
'1870522985981038864',"Everyone should be able to retire with dignity. For years, 21,000 Minnesota firefighters, teachers, postal workers + police officers have faced Social Security cuts because of outdated laws.

Last night, we fixed that.

Proud to support the Social Security Fairness Act.",en,Tweet,4,578,74,233,19858,2024-12-21 17:33:27,"<a href=""http://twitter.com/download/iphone"" rel=""nofollow"">Twitter for iPhone</a>",,,,
'1870172746740838812',"I don’t think American voters sent everybody to Congress for this kind of nonsense. I think they expected us to get our damn jobs done.

This is not what the election was about.",en,Tweet,0,177,33,80,5953,2024-12-20 18:21:43,"<a href=""http://twitter.com/download/iphone"" rel=""nofollow"">Twitter for iPhone</a>",,,,
'1869877279788077383',"Today I called the Bureau of Prisons to get some answers about closing the Federal Prison Camp in Duluth.

I’m not sold on their rationale for closing, nor their decision making process. I’m going to keep pushing for answers, especially for the workers who could lose their jobs.",en,Tweet,0,26,4,9,6768,2024-12-19 22:47:38,"<a href=""http://twitter.com/download/iphone"" rel=""nofollow"">Twitter for iPhone</a>",,,,
'1869524952787144980',"This bill would ensure that payments to these three counties are maintained at current levels so they can best serve their local communities.
 
Without action, this vital source of revenue, which supports services like emergency management and road maintenance, will decrease.",en,Reply,0,5,0,1,1387,2024-12-18 23:27:37,"<a href=""http://twitter.com/download/iphone"" rel=""nofollow"">Twitter for iPhone</a>",,,,
'1869524950895444110',"Since 2018, I’ve worked on a commonsense fix to this technical problem, first with the Trump Administration and now with the Biden Administration.
 
One thing is clear: Legislation is necessary to fix this unforeseen issue with the 1948 law.",en,Reply,0,7,0,1,1419,2024-12-18 23:27:37,"<a href=""http://twitter.com/download/iphone"" rel=""nofollow"">Twitter for iPhone</a>",,,,
'1869524949066723811',"Without action, communities in Northern Minnesota will face a serious budget crunch. That could mean allowing roads to crumble and essential public safety services to be cut. It could even result in property tax increases that could force long-time residents to sell their homes.",en,Reply,0,3,0,2,175,2024-12-18 23:27:36,"<a href=""http://twitter.com/download/iphone"" rel=""nofollow"">Twitter for iPhone</a>",,,,
'1869524946889977866',"The bipartisan Thye-Blatnik Act of 1948 is unique in that payments to these counties depend upon appraisals conducted every 10 years.
 
But in 2018, that appraisal led to a big decrease, which just doesn’t make sense for this one-of-a-kind wilderness area.",en,Reply,0,5,0,2,151,2024-12-18 23:27:36,"<a href=""http://twitter.com/download/iphone"" rel=""nofollow"">Twitter for iPhone</a>",,,,
'1869524943798686014',"Northern Minnesota is home to some of the most beautiful and valuable forest lands in the nation. My bill to ensure Lake, Cook, and St. Louis Counties continue to receive a source of revenue for hosting federal wilderness lands just passed the Senate.
 
Here’s some background⬇️ https://t.co/NWhF0UQAPb",en,Tweet,0,67,13,22,3784,2024-12-18 23:27:35,"<a href=""http://twitter.com/download/iphone"" rel=""nofollow"">Twitter for iPhone</a>",,,photo,https://pbs.twimg.com/media/GfHjBvyXAAAVMmV.jpg
'1869512026902729168',"Two Minnesotans in Ag Committee Leadership across both chambers of Congress. Incredible.

Farmers and ranchers are in good hands with @SenAmyKlobuchar and @RepAngieCraig! https://t.co/3m4Cluzi1Q",en,Tweet,1,99,18,21,4585,2024-12-18 22:36:15,"<a href=""http://twitter.com/download/iphone"" rel=""nofollow"">Twitter for iPhone</a>",,,photo,"https://pbs.twimg.com/media/GfHXR8rXgAA5c3x.jpg,https://pbs.twimg.com/media/GfHXR8pWQAAduqu.jpg"
'1869489263337001035',"I’m going to keep pushing until everyone – no matter where they live – has access to reliable, high-speed internet.",en,Reply,0,10,2,6,1284,2024-12-18 21:05:48,"<a href=""https://mobile.twitter.com"" rel=""nofollow"">Twitter Web App</a>",,,,
'1869489259323015393',"Internet access isn’t a luxury—it’s a necessity. But people in rural areas struggle to access high speed broadband.

Today, we’re announcing 5,000 more Minnesotans, including farmers and small business owners, will get connected. https://t.co/YDQdppklC8",en,Tweet,1,65,20,65,4750,2024-12-18 21:05:47,"<a href=""https://mobile.twitter.com"" rel=""nofollow"">Twitter Web App</a>",,,photo,https://pbs.twimg.com/media/GfHCfXeXsAAT8nx.jpg
'1869407338739937644',"Remember: today is the last day to enroll in Affordable Care Act benefits through MNsure to make sure you have health coverage starting Jan. 1!
 
But don't worry - open enrollment doesn't end until January 15th. https://t.co/D4Cx0Apw6g",en,Tweet,0,13,3,11,1635,2024-12-18 15:40:16,"<a href=""https://mobile.twitter.com"" rel=""nofollow"">Twitter Web App</a>",,https://www.mnsure.org/,,
'1869162285866119179',"Hope is an act of will, not an article of faith.

@SenSherrodBrown inspired me and other Senators to have hope and to fight for working people like the woman I met in Duluth all those years ago.

Thank you, my friend with the gravelly voice. Can’t wait to see what you do next. https://t.co/1X6Pi1T4KT",en,Tweet,10,522,83,45,19863,2024-12-17 23:26:30,"<a href=""https://mobile.twitter.com"" rel=""nofollow"">Twitter Web App</a>",,,video,https://video.twimg.com/ext_tw_video/1869161608469000192/pu/vid/avc1/1280x720/9U6WfHEVnb7bTS1O.mp4?tag=12
'1868840969506111816',"Big companies like Amazon hold a lot of power. Their productivity metrics and quotas are exploitative and can cause serious injuries to workers. 
 
We need to heed the calls of this report and pass my bipartisan Warehouse Worker Protection Act.",en,Tweet,0,20,9,7,10111,2024-12-17 02:09:43,"<a href=""http://twitter.com/download/iphone"" rel=""nofollow"">Twitter for iPhone</a>",,,,
'1868778749724180893',"These are not Minnesota’s values. This is a blatant act of antisemitism and only serves to foster hate and division.

My hope is that whoever is responsible is apprehended swiftly and held accountable.

https://t.co/mi95P21XFB",en,Tweet,5,120,18,107,22552,2024-12-16 22:02:28,"<a href=""https://mobile.twitter.com"" rel=""nofollow"">Twitter Web App</a>",,https://www.startribune.com/swastikas-spray-painted-outside-entrance-to-temple-israel-in-minneapolis/601195502,,
'1868743103831851115',"Horrified by the shooting at Abundant Life Christian School in Madison. Thankful for the first responders who came quickly to the scene. I’m thinking of the families who will spend the holidays without their child, their sibling or their grandchild. It has to stop.",en,Tweet,0,20,3,16,5766,2024-12-16 19:40:50,"<a href=""https://mobile.twitter.com"" rel=""nofollow"">Twitter Web App</a>",,,,
'1868729867153608906',"The Postal Service is literally in the Constitution.  It’s an essential PUBLIC service, and it should never be privatized. This would hurt millions of Americans, especially those in the most rural places.",en,Tweet,977,49817,8149,4985,3056579,2024-12-16 18:48:14,"<a href=""https://mobile.twitter.com"" rel=""nofollow"">Twitter Web App</a>",,,,
'1868679666623775210',"“I got injured [...] and couldn’t believe that a huge company that preaches how they’re there for workers really treats people.” – Amazon worker.

Amazon shouldn’t treat workers like this.

The first solution listed is @SenMarkey and my Warehouse Worker Protection Act. Pass it.",en,Tweet,0,24,10,8,4141,2024-12-16 15:28:45,"<a href=""https://mobile.twitter.com"" rel=""nofollow"">Twitter Web App</a>",,,,
'1867961324975849516',"It’s been 12 years. The children we lost at Sandy Hook would be teenagers today.
 
The bipartisan gun safety bill was a start. But just that. We need to keep dangerous guns out of the hands of dangerous people to keep our kids safe. We owe it to the lives lost and their families.",en,Tweet,0,73,22,67,5599,2024-12-14 15:54:19,"<a href=""http://twitter.com/download/iphone"" rel=""nofollow"">Twitter for iPhone</a>",,,,
'1867369349297868877',"When billion-dollar corporations like ELP hike rents and make it hard for residents to leave, it’s not right. They’re squeezing Minnesotans and hanging them out to dry.

I’m calling on their CEO to engage with residents, listen and respond to their reasonable concerns.",en,Tweet,0,39,8,7,4754,2024-12-13 00:42:01,"<a href=""http://twitter.com/download/iphone"" rel=""nofollow"">Twitter for iPhone</a>",,,,
'1867300420873597174',"Capping overdraft fees at $5 will save families hundreds of dollars each year. It’s just another example of how the @CFPB is on the side of American consumers - not big banks.

No wonder Trump’s cronies are trying to dismantle it.",en,Tweet,1,20,7,9,3334,2024-12-12 20:08:07,"<a href=""https://mobile.twitter.com"" rel=""nofollow"">Twitter Web App</a>",,,,
'1867284670003786121',I’m hopeful the President will continue on this path and grant more clemency for non-violent offenders who have put in the work and want to serve their communities.,en,Reply,0,17,1,9,1649,2024-12-12 19:05:32,"<a href=""https://mobile.twitter.com"" rel=""nofollow"">Twitter Web App</a>",,,,
'1867284668850299358',"Three Minnesotans were granted clemency from the President today.

Since they’ve left incarceration after serving time for non-violent offenses, each of them has rededicated themselves to working towards a better Minnesota for everyone.",en,Tweet,0,100,14,29,6204,2024-12-12 19:05:32,"<a href=""https://mobile.twitter.com"" rel=""nofollow"">Twitter Web App</a>",,,,
'1867262137908826179',"Each of the last few years, the Postal Service has assured us that they're prepared for peak mail season. Each time, Minnesotans have experienced mail delays.

With reports in Rochester of going 4+ days w/o mail, it’s happening again. @SenAmyKlobuchar and I are demanding answers. https://t.co/gnoGdtrwPS",en,Tweet,0,34,6,19,6361,2024-12-12 17:36:00,"<a href=""https://mobile.twitter.com"" rel=""nofollow"">Twitter Web App</a>",,,photo,"https://pbs.twimg.com/media/GenXtWwW0AAQ0kK.jpg,https://pbs.twimg.com/media/GenYKTNWQAAax4y.jpg"
'1867229465027436609',"Congratulations to Dawn and Grant Breitkreutz from Redwood Falls on receiving Minnesota’s first Leopold Conservation Award! 

I’m always excited to see Minnesotans recognized. Especially Minnesotans who understand the importance of farming and healthy soil.",en,Tweet,0,10,1,3,2976,2024-12-12 15:26:10,"<a href=""https://mobile.twitter.com"" rel=""nofollow"">Twitter Web App</a>",,,,
'1866904058948362389',"The voters in Missouri spoke. They want abortion rights — but Republican legislators are already working to deny women the reproductive care they voted for. 

Funny way of “leaving it to the states” — which we always knew was a farce. https://t.co/kJMUx7y16m",en,Tweet,3,117,37,35,8583,2024-12-11 17:53:07,"<a href=""http://twitter.com/download/iphone"" rel=""nofollow"">Twitter for iPhone</a>",,,video,https://video.twimg.com/ext_tw_video/1866904007077212160/pu/vid/avc1/1280x720/r617l28nIPXz9mf_.mp4?tag=12
'1866865849992118560',"This is how the Postmaster General reacts when Members of Congress demand accountability.  He’s the reason your prescriptions, paychecks, and bills are late.  Embarrassing. https://t.co/ZBeAZ5AZRD",en,Tweet,778,35079,10732,1503,758003,2024-12-11 15:21:17,"<a href=""http://twitter.com/download/iphone"" rel=""nofollow"">Twitter for iPhone</a>",,,photo,https://pbs.twimg.com/media/GehwmJxWgAAyG5b.jpg
'1866564731940864095',"Make that 380 – Minnesota just secured 130 more clean energy projects that are projected to save $18M every year for small towns and rural communities.

The energy produced/saved is enough to power over 15,000 homes.",en,Tweet,2,94,39,47,9337,2024-12-10 19:24:45,"<a href=""https://mobile.twitter.com"" rel=""nofollow"">Twitter Web App</a>",,,,
'1866270880248025179',"For too long, the federal government’s policies about Tribal Nations and Native communities were aimed at erasing Native families, languages and cultures – their very identities.
 
Thanks to the Biden-Harris Administration, especially Secretary Haaland, we've turned a corner. https://t.co/L1qiZQoQ0n",en,Reply,0,21,4,1,1704,2024-12-09 23:57:06,"<a href=""http://twitter.com/download/iphone"" rel=""nofollow"">Twitter for iPhone</a>",,,photo,https://pbs.twimg.com/media/GeZTeZ5XEAAxrdD.jpg
'1866270875521056929',"Under @SecDebHaaland’s leadership, the federal government has started to make amends for the wrongs done to Native families, particularly through the Federal Indian Boarding School Policy. https://t.co/gNkI0wASP6",en,Reply,0,26,6,2,1824,2024-12-09 23:57:05,"<a href=""http://twitter.com/download/iphone"" rel=""nofollow"">Twitter for iPhone</a>",,,photo,https://pbs.twimg.com/media/GeZTeKuXMAAXiIp.jpg
'1866270871456755804',"Today, President Biden announced the creation of a National Monument at the Carlisle Indian School to acknowledge the harm done to Native children and families at these schools.
 
This is an important step toward healing for generations of Native peoples. https://t.co/rwPoQdorEq",en,Tweet,1,203,52,21,5143,2024-12-09 23:57:04,"<a href=""http://twitter.com/download/iphone"" rel=""nofollow"">Twitter for iPhone</a>",,,photo,https://pbs.twimg.com/media/GeZTd3rW8AA20B-.jpg
'1866181458978816322',"Happy National Lutefisk Day! 
Everyone should try it. Once. https://t.co/pfZ1PIPGO2",en,Tweet,2,102,16,12,5531,2024-12-09 18:01:46,"<a href=""http://twitter.com/download/iphone"" rel=""nofollow"">Twitter for iPhone</a>",,,photo,https://pbs.twimg.com/media/GeYCJWqXcAA_c6w.jpg
'1866154783561691140',"This proposal is common sense, and it respects Tribes’ inherent sovereignty and right to protect their Nations.

The reforms are essential to stop drug traffickers from exploiting Tribal lands and communities.",en,Reply,0,16,0,1,1309,2024-12-09 16:15:46,"<a href=""https://mobile.twitter.com"" rel=""nofollow"">Twitter Web App</a>",,,,
'1866154782429483298',"Minnesota Tribal leaders have raised the alarm that drug traffickers are exploiting complex legal jurisdiction on Tribal land, making Native communities some of the most harmed by the opioid/fentanyl epidemic.

I introduced the bipartisan PROTECT Act to help Tribes fight back.",en,Tweet,5,147,40,45,5617,2024-12-09 16:15:46,"<a href=""https://mobile.twitter.com"" rel=""nofollow"">Twitter Web App</a>",,,,
'1865091453652730240',"We love you Glen - go have fun in retirement, and take some pictures while you’re at it. 

We’ll be looking for you.",en,Reply,0,6,0,0,1407,2024-12-06 17:50:28,"<a href=""http://twitter.com/download/iphone"" rel=""nofollow"">Twitter for iPhone</a>",,,,
'1865091451895402556',"For all the years I’ve worked in and around Minnesota politics, @gspphoto has been a constant in the best possible way, capturing images of people with humor, compassion, understanding and sometimes a little mischief.",en,Tweet,0,12,2,3,2232,2024-12-06 17:50:28,"<a href=""http://twitter.com/download/iphone"" rel=""nofollow"">Twitter for iPhone</a>",,,,
'1864779945672647165',"The Senate is filled with former Members of Congress, Governors, Lt. Governors… all fine and honorable professions.

But there aren’t many who came here as organizers like @SenLaphonza did.

Laphonza, it’s been an honor to serve with you. I'm excited to see what you do next. https://t.co/38J4HsZpkB",en,Tweet,19,298,35,20,21753,2024-12-05 21:12:39,"<a href=""https://mobile.twitter.com"" rel=""nofollow"">Twitter Web App</a>",,,video,https://video.twimg.com/ext_tw_video/1864779197228429312/pu/vid/avc1/720x720/bNwBa4HwODJDH-BN.mp4?tag=12
'1864734647684313429',"I swear this isn’t staged, Minnesotans are just like this.

Anyways, anybody want 1/3 of a cookie? https://t.co/wL95PUkTKD",en,Tweet,4,199,10,39,13399,2024-12-05 18:12:39,"<a href=""http://twitter.com/download/iphone"" rel=""nofollow"">Twitter for iPhone</a>",,,photo,https://pbs.twimg.com/media/GeDeR1xXwAAbk55.jpg
'1864703159479783634',"Leonard Peltier has been imprisoned since 1976. Allow him the dignity to live his remaining years with his family.

Even the U.S. Attorney who put him there agrees.

President Biden should grant him clemency.",en,Tweet,8,437,133,52,26576,2024-12-05 16:07:32,"<a href=""https://mobile.twitter.com"" rel=""nofollow"">Twitter Web App</a>",,,,
'1864326389333217682',What a horrifying tragedy.,en,Tweet,0,44,7,25,8057,2024-12-04 15:10:23,"<a href=""http://twitter.com/download/iphone"" rel=""nofollow"">Twitter for iPhone</a>",,,,
'1864106276390568154',"This is essential health care – and we need to organize to protect it, especially at places like Planned Parenthood, where they serve predominantly low income and working Americans.
 
Watch this space.",en,Reply,0,49,3,11,2090,2024-12-04 00:35:44,"<a href=""http://twitter.com/download/iphone"" rel=""nofollow"">Twitter for iPhone</a>",,,,
'1864106275073654870',"Cancer screenings.
Birth control. 
Vaccines.
STD Testing. 
Prenatal and postpartum care. 
 
And, yes, abortions (though current law doesn’t even allow federal dollars to go towards abortion care!)",en,Reply,0,48,5,14,2363,2024-12-04 00:35:44,"<a href=""http://twitter.com/download/iphone"" rel=""nofollow"">Twitter for iPhone</a>",,,,
'1864106273433616845',"They said, “DOGE will help end federal overspending by taking aim at […] nearly $300 million to progressive groups like Planned Parenthood.”
 
Let’s talk about what Planned Parenthood does for millions of people across this country.",en,Reply,0,18,3,5,664,2024-12-04 00:35:43,"<a href=""http://twitter.com/download/iphone"" rel=""nofollow"">Twitter for iPhone</a>",,,,
'1864106271676190859',"I worked at Planned Parenthood. Every day I saw people walk through our doors fully prepared to make decisions about their own bodies and their own lives, including around abortion.
 
In a WSJ op-ed, Musk and Ramaswamy made their intentions clear: Defund Planned Parenthood.",en,Tweet,7,359,75,114,15567,2024-12-04 00:35:43,"<a href=""http://twitter.com/download/iphone"" rel=""nofollow"">Twitter for iPhone</a>",,,,
'1864093114878587161',"I knew we should’ve coordinated… oh well, great minds think alike! https://t.co/K8mnPTYOtZ",en,Tweet,14,591,18,75,30909,2024-12-03 23:43:26,"<a href=""http://twitter.com/download/iphone"" rel=""nofollow"">Twitter for iPhone</a>",,,photo,https://pbs.twimg.com/media/Gd6WzrhW0AAY5_1.jpg
'1864072354969575841',"Peak season for USPS is underway. It’s Postmaster General Louis DeJoy’s responsibility to make sure postal workers have the resources to get mail and packages to everyone on time.

I’ll be watching mail delivery in Minnesota closely to make sure this is the case.",en,Tweet,3,138,23,30,5934,2024-12-03 22:20:56,"<a href=""https://mobile.twitter.com"" rel=""nofollow"">Twitter Web App</a>",,,,
'1863961424034443700',"So proud of the great work happening in Minneapolis, which shows that boosting housing supply helps make homes more affordable. https://t.co/znQ0SX4dyj",en,Tweet,152,2151,342,98,420643,2024-12-03 15:00:08,"<a href=""https://mobile.twitter.com"" rel=""nofollow"">Twitter Web App</a>",,,photo,https://pbs.twimg.com/media/Gd4fBFoW8AE58je.jpg
'1863737143706653103',"I had a restful Thanksgiving with my family, and now back to work.
 
We have three weeks to confirm strong, qualified federal judges to safeguard our rights and the rule of law. Let’s do this.",en,Tweet,0,98,8,23,4759,2024-12-03 00:08:56,"<a href=""http://twitter.com/download/iphone"" rel=""nofollow"">Twitter for iPhone</a>",,,,
'1863697612588691465',This is a disgrace.,en,Tweet,6,323,67,74,15714,2024-12-02 21:31:51,"<a href=""http://twitter.com/download/iphone"" rel=""nofollow"">Twitter for iPhone</a>",,,,
