tweet_id,text,language,type,bookmark_count,favorite_count,retweet_count,reply_count,view_count,created_at,client,hashtags,urls,media_type,media_urls
'1882584844720656483',"Today, I spoke on President Lyndon B. Johnson’s 1965 executive order and the need to protect diversity and inclusion. https://t.co/UVZgQd5LH6",en,Tweet,3,38,10,6,4122,2025-01-24 00:22:58,"<a href=""http://twitter.com/download/iphone"" rel=""nofollow"">Twitter for iPhone</a>",,,video,https://video.twimg.com/amplify_video/1882584766110724096/vid/avc1/1920x1080/Ccr_tggelxoKEytH.mp4?tag=16
'1882228780892352853',My Statement on President Trump's Executive Order Rescinding Equal Employment Opportunity. https://t.co/Vby4we4z9B,en,Tweet,1,11,5,3,872,2025-01-23 00:48:06,"<a href=""http://twitter.com/download/iphone"" rel=""nofollow"">Twitter for iPhone</a>",,,photo,https://pbs.twimg.com/media/Gh8FGRZWcAEAazp.jpg
'1881793735635374316',"Please stay home and avoid travel during this dangerous winter storm. Warming centers are open for those in need. Together, we’ll get through this!
 #TX18Together #WeAreTX18 https://t.co/NSDBqPnkC3",en,Tweet,0,2,0,0,573,2025-01-21 19:59:23,"<a href=""http://twitter.com/download/iphone"" rel=""nofollow"">Twitter for iPhone</a>","#TX18Together,#WeAreTX18",,photo,https://pbs.twimg.com/media/Gh14ZFBWQAAeLos.jpg
'1881475350141587516',"During my time as a public official, I have yet to miss the Black Heritage Society’s Dr. Martin Luther King Day Parade in Downtown Houston.

Although it was cold, I was welcomed to see Houstonians lined up along the streets and staying warm while each of us took a moment to remember the life and legacy of Dr. Martin Luther King.",en,Tweet,0,7,2,0,470,2025-01-20 22:54:14,"<a href=""http://twitter.com/download/iphone"" rel=""nofollow"">Twitter for iPhone</a>",,,photo,"https://pbs.twimg.com/media/GhxX2nsXQAA-XVW.jpg,https://pbs.twimg.com/media/GhxX2nsWMAA2nZE.jpg,https://pbs.twimg.com/media/GhxX2nxXgAEaKLt.jpg,https://pbs.twimg.com/media/GhxX2nwWAAA1I5D.jpg"
'1881419055112114359',"Cecile Richards dedicated her life to ensuring the voices of women everywhere were heard. From leading Planned Parenthood to empowering grassroots movements, her legacy of courage and justice is woven into the fabric of Texas and beyond.  Rest in power, Cecile. Your light will continue to inspire us all.",en,Tweet,0,6,1,3,357,2025-01-20 19:10:32,"<a href=""https://mobile.twitter.com"" rel=""nofollow"">Twitter Web App</a>",,,photo,https://pbs.twimg.com/media/GhwkllPWoAAhHdH.jpg
'1881354665012437020',"Dr. Martin Luther King Jr. reminded us, ""Injustice anywhere is a threat to justice everywhere."" Today, we reflect on his unwavering dedication to civil rights and his dream of equality and justice for all. As we celebrate his legacy, let’s recommit to serving our communities and standing up against injustice. Together, we can make his dream a reality.",en,Tweet,1,7,2,0,273,2025-01-20 14:54:40,"<a href=""https://mobile.twitter.com"" rel=""nofollow"">Twitter Web App</a>",,,video,https://video.twimg.com/ext_tw_video/1881352678673981440/pu/vid/avc1/720x720/Wgr8t_112ss9S23a.mp4?tag=12
'1880397013847769411',"We are deeply saddened by the tragic loss of Deputy Jesus ""Jesse"" Vargas, who dedicated 17 years to serving the Brazoria County Sheriff's Office. Our thoughts and prayers are with his wife, children, and loved ones during this difficult time. Deputy Vargas’ commitment to his community will not be forgotten.",en,Tweet,0,7,0,0,418,2025-01-17 23:29:18,"<a href=""https://mobile.twitter.com"" rel=""nofollow"">Twitter Web App</a>",,,,
'1880313969505628268',"Weekly Recap: Honored to be assigned to the @HomelandDems  & @sciencedems!
On Homeland Security: Houston faced 9 disasters in 9 years. I’ll fight for faster FEMA response, stronger infrastructure, & cybersecurity to protect our energy grid.

On SST: I'll fight to support @NASA's missions & renewable energy research to keep Houston leading in innovation.

Plus, a $60k @NEHgov grant to @UHouston to preserve Houston’s cultural history!

As we approach #MLKDay, let’s honor Dr. King: ""The time is always right to do what is right.""

Proud to fight for #TX18 every day.",en,Tweet,1,6,0,1,877,2025-01-17 17:59:19,"<a href=""http://twitter.com/download/iphone"" rel=""nofollow"">Twitter for iPhone</a>",,,video,https://video.twimg.com/amplify_video/1880313229655568384/vid/avc1/1920x1080/FD2vOpFlPmEl52ZU.mp4?tag=16
'1879895029277143110',"Happy Founders’ Day to the women of @ZetaGrandBoule! Your legacy of scholarship, service, sisterhood, and finer womanhood continues to inspire communities across the globe. Thank you for being a beacon of excellence and empowerment. https://t.co/G9i7NDFAbU",en,Tweet,0,5,1,0,1384,2025-01-16 14:14:36,"<a href=""http://twitter.com/download/iphone"" rel=""nofollow"">Twitter for iPhone</a>",,,photo,https://pbs.twimg.com/media/Gha6kI5XUAA_Z2e.jpg
'1879517400573370790',"Happy Founders’ Day to the phenomenal women of @akasorority1908!

Today, we celebrate their 117 years of scholarship, sisterhood, and service. From their founding in 1908 at Howard University to their transformative impact on communities worldwide, AKA continues to lead with grace and purpose. 

To all the ladies of AKA, thank you for your dedication to empowering others and making the world a better place. Wishing you a beautiful Founders’ Day filled with pride and joy!",en,Tweet,0,19,1,2,1788,2025-01-15 13:14:02,"<a href=""http://twitter.com/download/iphone"" rel=""nofollow"">Twitter for iPhone</a>",,,photo,https://pbs.twimg.com/media/GhVjHV9WEAA3g0B.jpg
'1879201014143688896',"I am proud to announce my appointment to the Homeland Security and Science, Space, & Technology Committees.

On Homeland Security, I will focus on disaster recovery, emergency preparedness, border security, and cybersecurity. 

On Science, Space & Technology, I will advocate for NASA, Spaceport Houston, and Houston’s leadership in innovation and space exploration.

I look forward to serving #TX18 and ensuring Houston’s priorities are represented.",en,Tweet,1,37,2,4,10279,2025-01-14 16:16:50,"<a href=""http://twitter.com/download/iphone"" rel=""nofollow"">Twitter for iPhone</a>",,,photo,https://pbs.twimg.com/media/GhRDVHuWoAM1Gt4.jpg
'1878819353812156827',"122 years ago, the first Korean immigrants arrived in the United States. Today, we celebrate their legacy and honor the countless contributions Korean Americans have made to enrich our nation. https://t.co/ajAI8xwEuP",en,Tweet,0,1,0,0,257,2025-01-13 15:00:15,"<a href=""http://twitter.com/download/iphone"" rel=""nofollow"">Twitter for iPhone</a>",,,photo,https://pbs.twimg.com/media/GhLoPriWQAAw0c0.jpg
'1878777582960963792',"Today, we celebrate 112 years of excellence in sisterhood, service, and social action. To the dynamic ladies of @dstinc1913, thank you for your leadership and impact. Happy Founders' Day! https://t.co/mTn2OXbsxX",en,Tweet,0,6,1,0,307,2025-01-13 12:14:16,"<a href=""https://mobile.twitter.com"" rel=""nofollow"">Twitter Web App</a>",,,photo,https://pbs.twimg.com/media/GhLCNFYWMAASZ26.png
'1878570998246818283',"Yesterday, I hosted my official swearing-in ceremony, joined by over 500 Houstonians, dignitaries, community leaders, and elected officials. Together, we immortalized this moment and committed to advancing as a united team. The journey ahead is promising, and our collective efforts will drive meaningful change.
View more photos on my @Flickr:
https://t.co/a95AoBEzhG",en,Tweet,0,22,2,2,801,2025-01-12 22:33:22,"<a href=""http://twitter.com/download/iphone"" rel=""nofollow"">Twitter for iPhone</a>",,,photo,"https://pbs.twimg.com/media/GhIGWl4XAAAOdYP.jpg,https://pbs.twimg.com/media/GhIGWl5WcAAYbuK.jpg,https://pbs.twimg.com/media/GhIGWl5XUAEkQUH.jpg,https://pbs.twimg.com/media/GhIGWl5XMAA9p1Y.jpg"
'1878487370514809253',"Today, we honor and celebrate the heavenly birthday of the late Congresswoman Sheila Jackson Lee. Your unwavering dedication to service, fierce advocacy, and boundless love for the 18th District left an indelible mark on us all. We miss you, Sheila. https://t.co/ZOnBhDPAvl",en,Tweet,0,25,6,2,708,2025-01-12 17:01:04,"<a href=""https://mobile.twitter.com"" rel=""nofollow"">Twitter Web App</a>",,,photo,https://pbs.twimg.com/media/GhG6LRLXkAEJQTs.jpg
'1877750607236222994',"This week, I stood for democracy, honored a giant for justice, and shared big news for Houston and Harris County. Watch my first Weekly Recap from D.C. as I bring the 18th District to Congress with me! https://t.co/7LVweYXaCG",en,Tweet,2,23,6,1,2322,2025-01-10 16:13:26,"<a href=""http://twitter.com/download/iphone"" rel=""nofollow"">Twitter for iPhone</a>",,,video,https://video.twimg.com/amplify_video/1877747320655077376/vid/avc1/1920x1080/41EAlXtOJdzmj7dk.mp4?tag=16
'1876779650569138349',"Breaking: The Biden-Harris administration announced today Houston and Harris County will receive a combined $382M via @HUDgov to assist in recovery from May’s Kingwood flooding and Hurricane Beryl in July.

Houston: $315M
Harris County: $67M
Texas as a whole will receive $555.6M
https://t.co/kAFZ5HW2CV",en,Tweet,2,22,10,0,3001,2025-01-07 23:55:12,"<a href=""https://mobile.twitter.com"" rel=""nofollow"">Twitter Web App</a>",,,,
'1876075061515587673',"Joined my colleagues at the White House this evening. Thank you, @POTUS, for your leadership and commitment to progress for all Americans. 

I’m proud to represent the 18th Congressional District as we move forward into 2025.

Together, we’ll meet the moment. Let’s get it done! https://t.co/lieFVLV7Nf",en,Tweet,1,40,6,5,3281,2025-01-06 01:15:25,"<a href=""http://twitter.com/download/iphone"" rel=""nofollow"">Twitter for iPhone</a>",,,photo,"https://pbs.twimg.com/media/GgkoT-yWQAAQHZx.jpg,https://pbs.twimg.com/media/GgkoT-yXoAAomNW.jpg,https://pbs.twimg.com/media/GgkoT-yWoAALPkw.jpg,https://pbs.twimg.com/media/GgkoT-zXoAAVNfG.jpg"
