tweet_id,text,language,type,bookmark_count,favorite_count,retweet_count,reply_count,view_count,created_at,client,hashtags,urls,media_type,media_urls
'1922355385547051225',"This week, as family members of fallen heroes gather in our nation’s capital, we are reminded of the sacrifices made to keep our communities safe. Their courage and dedication are etched into the fabric of our nation, and we owe them a debt that can never truly be repaid.

To those who have left us, thank you for your sacrifice. To those who carry their memory forward, thank you for keeping their legacy alive.",en,Tweet,0,2,0,2,297,2025-05-13 19:16:54,"<a href=""http://twitter.com/download/iphone"" rel=""nofollow"">Twitter for iPhone</a>",,,photo,https://pbs.twimg.com/media/Gq2UB0lXgAA6Pzj.jpg
'1922090131902591212',It’s always a good day when the Farm Bureau comes to visit! https://t.co/WBNhKl9Ncc,en,Tweet,0,3,0,1,366,2025-05-13 01:42:52,"<a href=""http://twitter.com/download/iphone"" rel=""nofollow"">Twitter for iPhone</a>",,,photo,"https://pbs.twimg.com/media/GqyiyadWwAAsUGQ.jpg,https://pbs.twimg.com/media/GqyiyaQWEAAnQzF.jpg"
'1920929557231923221',"It was a busy week in Congress. At the Army Budget Hearing, I voiced my strong support for the Future Long Range Assault Aircraft (FLRAA)—vital for dominance in the Indo-Pacific. We also heard from Army, Air Force, and Space Force leaders on the urgent need to invest in readiness and equip our forces to win.",en,Tweet,0,7,1,9,816,2025-05-09 20:51:10,"<a href=""http://twitter.com/download/iphone"" rel=""nofollow"">Twitter for iPhone</a>",,,photo,https://pbs.twimg.com/media/GqiDQBxWUAEiV1q.jpg
'1917683407313854977',"In the coming days, I will be introducing the ""Apprenticeship Infrastructure Tax Credit Act of 2025."" This bill is about rebuilding the American workforce. It will propose a $3,000 annual tax credit to employers for hiring and retaining registered apprentices in key occupations critical to our nation's infrastructure, with an enhanced credit of $6,000 for members of our armed services.",en,Tweet,0,11,2,9,509,2025-04-30 21:52:07,"<a href=""https://mobile.twitter.com"" rel=""nofollow"">Twitter Web App</a>",,,photo,https://pbs.twimg.com/media/Gpz62unWYAAYGrz.png
'1915819943028805946',"Had a great visit with Sheriff Brad Norman at the Ellis County children’s advocate center. When I tour places like this, it breaks my heart that we need them, but I’m grateful we have them. https://t.co/gBJjYOrAeG",en,Tweet,0,2,0,7,438,2025-04-25 18:27:23,"<a href=""http://twitter.com/download/iphone"" rel=""nofollow"">Twitter for iPhone</a>",,,photo,https://pbs.twimg.com/media/GpZcFV3XgAAQCwD.jpg
'1915094993821106576',"Spent my morning in Ennis today, and I couldn’t be more thankful to the Lions Club for having me for lunch. Great food, even better company. 

It’s always a good time spending the day with people who care so deeply about their community. https://t.co/gdXUBAF8SY",en,Tweet,0,3,1,5,402,2025-04-23 18:26:41,"<a href=""http://twitter.com/download/iphone"" rel=""nofollow"">Twitter for iPhone</a>",,,photo,"https://pbs.twimg.com/media/GpPIuoSXcAAR-Wk.jpg,https://pbs.twimg.com/media/GpPIuoUWEAELbtP.jpg,https://pbs.twimg.com/media/GpPIuoSWQAApRBe.jpg"
'1914872661978632307',"Nothing like a good baseball game to close out the day. Waxahachie may not have gotten the win, but it was still a great game and an even better night.

I was honored to throw out the first pitch in recognition of Military and First Responder Night—thank you to all who serve and protect our communities.",en,Tweet,0,6,1,3,442,2025-04-23 03:43:13,"<a href=""http://twitter.com/download/iphone"" rel=""nofollow"">Twitter for iPhone</a>",,,photo,"https://pbs.twimg.com/media/GpL-iM3WcAAQRRb.jpg,https://pbs.twimg.com/media/GpL-iNfXgAAWpY4.jpg,https://pbs.twimg.com/media/GpL-iNiWwAApAV4.jpg,https://pbs.twimg.com/media/GpL-iNhWsAAGs35.jpg"
'1914753852701573402',Started my morning in Hillsboro with great conversations and with the Hillsboro Chamber of Commerce. It’s a blessing to spend time with folks who are passionate about building a strong local business community. https://t.co/6IiNq4yTlE,en,Tweet,0,6,0,2,409,2025-04-22 19:51:07,"<a href=""http://twitter.com/download/iphone"" rel=""nofollow"">Twitter for iPhone</a>",,,photo,https://pbs.twimg.com/media/GpKSeEJWIAA-diN.jpg
'1914091667243647413',"Today is a day that we remember that whoever believes in him shall not perish but have everlasting life.

Happy Easter Everyone! https://t.co/qpasb4RUYL",en,Tweet,0,4,0,3,391,2025-04-20 23:59:50,"<a href=""http://twitter.com/download/iphone"" rel=""nofollow"">Twitter for iPhone</a>",,,photo,https://pbs.twimg.com/media/GpA4Oj7XAAAMPnL.jpg
'1912895313423085659',Had a great morning with @JasonWhitely discussing the end of Texas Central’s High-Speed Rail boondoggle. https://t.co/Dob3fX1ibl,en,Tweet,0,8,0,4,423,2025-04-17 16:45:57,"<a href=""http://twitter.com/download/iphone"" rel=""nofollow"">Twitter for iPhone</a>",,,photo,https://pbs.twimg.com/media/Gov4A0IWwAANMXC.jpg
'1911962962413158473',Thank you @SecDuffy. 🤝🤝🤝,en,Tweet,0,6,0,2,919,2025-04-15 03:01:07,"<a href=""http://twitter.com/download/iphone"" rel=""nofollow"">Twitter for iPhone</a>",,,,
'1911904533564768671',"It's over! Today, Secretary Duffy and the U.S. Department of Transportation rescinded the grant funding for Texas Central's High-Speed Rail Boondoggle. Through numerous conversations and collaboration with the Secretary, it became clear that we share a commitment to ensuring that projects like this do not misuse federal resources, and today is a result of those conversations.",en,Tweet,11,297,50,49,53957,2025-04-14 23:08:56,"<a href=""https://mobile.twitter.com"" rel=""nofollow"">Twitter Web App</a>",,,photo,https://pbs.twimg.com/media/GohzB42XYAAcbxm.jpg
'1911882257536524525',"I was honored to preside over the House when the SAVE Act passed. This legislation demonstrates the kind of leadership Americans expect from us. With strong bipartisan support, we’ve moved one step closer to ensuring that our borders remain secure and our immigration system is enforced effectively. I will continue working alongside my colleagues to make sure this bill gets across the finish line in the Senate.",en,Tweet,0,10,1,11,497,2025-04-14 21:40:25,"<a href=""https://mobile.twitter.com"" rel=""nofollow"">Twitter Web App</a>",,,photo,"https://pbs.twimg.com/media/Goheu68WoAEDUHR.jpg,https://pbs.twimg.com/media/GohexvGWoAAEQ9i.png"
'1910364273722994830',"Government spending has been out of control for too long, and the American people sent us to Washington to rein it in—not make it worse. House Republicans just delivered on another promise. 

It was a privilege to be in the chair as we passed the Trump-backed budget that unlocks his full agenda: extending tax cuts for hardworking families and small businesses, increasing funding for border security, and delivering historic savings for taxpayers.",en,Tweet,0,13,1,10,975,2025-04-10 17:08:30,"<a href=""http://twitter.com/download/iphone"" rel=""nofollow"">Twitter for iPhone</a>",,,,
'1908267728181538954',"While I've been working in Washington to dismantle Texas Centrals' High-Speed Rail project at the federal level, my friends in Austin have been taking action on the state level. This week, after learning just how much of a boondoggle this project really is, the Texas House Committee on Transportation voted to subpoena Texas Central, compelling them to produce crucial documents—documents they clearly don't want the public to see.

I'm grateful for the leadership of Chairman @CodyforTexas, Chairman Craddick, Representative Little, Representative Patterson, and all the members of the Transportation Committee for taking this important step.",en,Tweet,4,64,15,15,6265,2025-04-04 22:17:34,"<a href=""http://twitter.com/download/iphone"" rel=""nofollow"">Twitter for iPhone</a>",,,video,https://video.twimg.com/amplify_video/1908267657045893120/vid/avc1/888x498/vXKEwCYIzs_thP7b.mp4?tag=16
'1904939767609123023',"Thank you to the over 9,600 constituents who tuned in last night for my telephone town hall. I’m sorry I could not get to all the questions, but if you asked a question you will get a call from my office! I know there are a lot of different ways to spend your evenings, so I appreciate you spending some time with me.",en,Tweet,0,4,0,9,651,2025-03-26 16:53:27,"<a href=""http://twitter.com/download/iphone"" rel=""nofollow"">Twitter for iPhone</a>",,,photo,https://pbs.twimg.com/media/Gm-0n08XoAATxsR.jpg
'1904219836428796116',"Last week, my team attended a Veterans luncheon in Rusk, where they shared information about our office's services and how we can help. It was a great event, and I want to thank Arbors Nursing Home for inviting us. We were able to open several new cases and assist veterans with the challenges they’re facing. I’m proud of my staff’s work and grateful for the opportunity to support those who’ve served our country.",en,Tweet,0,9,1,3,587,2025-03-24 17:12:42,"<a href=""http://twitter.com/download/iphone"" rel=""nofollow"">Twitter for iPhone</a>",,,photo,"https://pbs.twimg.com/media/Gm0l2LCXYAA1NJs.jpg,https://pbs.twimg.com/media/Gm0l2K-WwAEJP2R.jpg"
'1902740890881245533',"Yesterday, I stopped by the Dr. Pepper facility in Irving. One of my favorite things about my office in DC is that our fridge is always fully stocked with Dr. Pepper, and I always offer one to all my guests before my meetings. So, if you're ever in DC and can't find a DP, the Longworth House Office building is open!",en,Tweet,0,6,0,9,523,2025-03-20 15:15:54,"<a href=""https://mobile.twitter.com"" rel=""nofollow"">Twitter Web App</a>",,,photo,"https://pbs.twimg.com/media/GmfktiGWYAAU43e.jpg,https://pbs.twimg.com/media/GmfkuCLWcAAJ5bS.jpg,https://pbs.twimg.com/media/Gmfkub-aUAAsze4.jpg"
'1902086782272864299',It’s a great day to be in North Texas with my friends Governor @GregAbbott_TX and @RepCraigGoldman. Welcome to Dallas @Nasdaq. https://t.co/kJx2A7xkqZ,en,Tweet,0,37,4,10,3309,2025-03-18 19:56:42,"<a href=""http://twitter.com/download/iphone"" rel=""nofollow"">Twitter for iPhone</a>",,,photo,"https://pbs.twimg.com/media/GmWR1wDa8AE3FO2.jpg,https://pbs.twimg.com/media/GmWR1veWEAAVeJY.jpg"
'1901767554143592574',Had a great conversation with some of the leaders in Corsicana this afternoon when they stopped by my office. I always appreciate the opportunity to hear directly from folks about the issues impacting their community. https://t.co/JgOO2H02iB,en,Tweet,0,10,0,3,562,2025-03-17 22:48:12,"<a href=""http://twitter.com/download/iphone"" rel=""nofollow"">Twitter for iPhone</a>",,,photo,https://pbs.twimg.com/media/GmRvgi6bsAAhq6Z.jpg
'1901669144375755030',"Before my meetings with constituents, I sat down with my district team to get an update on casework and how federal agencies are cooperating with our office. I’m incredibly grateful for all of the work these ladies do for the folks of our district. I cannot do my job without them.",en,Tweet,1,8,0,2,508,2025-03-17 16:17:09,"<a href=""http://twitter.com/download/iphone"" rel=""nofollow"">Twitter for iPhone</a>",,,photo,"https://pbs.twimg.com/media/GmQWAUZXYAQU5Mz.jpg,https://pbs.twimg.com/media/GmQWAUiWwAA9FQ4.jpg"
'1901653931228377093',"It was great to spend my morning with folks in Midlothian. Thank you, Midlothian Chamber of Commerce, for hosting. https://t.co/B3p4iCNIKf",en,Tweet,0,4,0,3,505,2025-03-17 15:16:42,"<a href=""http://twitter.com/download/iphone"" rel=""nofollow"">Twitter for iPhone</a>",,,photo,"https://pbs.twimg.com/media/GmQIK6bWgAA1OPY.jpg,https://pbs.twimg.com/media/GmQIK6ZXcAEmtL4.jpg"
'1899936070927868205',"Hey everyone, it’s great to be back home in Texas. Unfortunately, I seem to have brought some bad weather with me. Stay safe. https://t.co/wCmIaoG32j",en,Tweet,0,8,0,10,549,2025-03-12 21:30:33,"<a href=""http://twitter.com/download/iphone"" rel=""nofollow"">Twitter for iPhone</a>",,,video,https://video.twimg.com/amplify_video/1899935987582570496/vid/avc1/720x1280/NB1MeEWxX6mbwovt.mp4?tag=16
'1899587719816200324',"With the support of the President, House Republicans cut spending by $13 billion and increased our defense spending while maintaining vital government programs the American people count on. 

See full release: https://t.co/9Bx2DRmj3e https://t.co/SBV1h29NqN",en,Tweet,0,7,3,8,856,2025-03-11 22:26:19,"<a href=""https://mobile.twitter.com"" rel=""nofollow"">Twitter Web App</a>",,https://ellzey.house.gov/2025/3/house-passes-government-funding-the-continuing-appropriations-and-extensions-act,photo,https://pbs.twimg.com/media/GlywsBMXkAAaujB.png
'1897824484293267655',It’s the end of another legislative week. Let’s take a walk. https://t.co/WO2yitHmrM,en,Tweet,0,8,1,10,641,2025-03-07 01:39:51,"<a href=""http://twitter.com/download/iphone"" rel=""nofollow"">Twitter for iPhone</a>",,,video,https://video.twimg.com/amplify_video/1897824303057403904/vid/avc1/540x960/XwGy4SLpgfKIPxmk.mp4?tag=16
'1897420561732489699',"You know you’re in trouble when your Tax Assessor/Collector tracks you down all the way in Washington. 

Don’t worry. I checked with Shelby, and we’re all paid up! https://t.co/6bkFqZ9UFz",en,Tweet,0,5,0,2,511,2025-03-05 22:54:48,"<a href=""http://twitter.com/download/iphone"" rel=""nofollow"">Twitter for iPhone</a>",,,photo,https://pbs.twimg.com/media/GlT98ZLXUAAXLSf.jpg
'1897338297539813626',"I’m saddened to hear of the passing of Sylvester Turner, a fellow Texan, a friend, and a colleague.

Losing a loved one is never easy, and my heart goes out to his family during this difficult time. I ask all Texans to join Shelby and me in keeping them in our prayers.",en,Tweet,1,2,0,0,424,2025-03-05 17:27:55,"<a href=""http://twitter.com/download/iphone"" rel=""nofollow"">Twitter for iPhone</a>",,,,
'1897121967293288720',"It is a privilege to be on the House Floor today, listening to President Trump address our nation. I'm proud to stand with my colleagues as we work toward a stronger, more prosperous future for all Americans. https://t.co/f8CxczSSqT",en,Tweet,2,257,17,33,34827,2025-03-05 03:08:18,"<a href=""http://twitter.com/download/iphone"" rel=""nofollow"">Twitter for iPhone</a>",,,photo,"https://pbs.twimg.com/media/GlPuXwtXkAAKTaw.jpg,https://pbs.twimg.com/media/GlPuXwtWQAAOkJ4.jpg,https://pbs.twimg.com/media/GlPuXwsWAAAM8lC.jpg"
'1895619021720187112',"I had a great time today touring the brand-new, state-of-the-art Mansfield Police Department today with Chief Aaron and Captain Sherwin. Got to meet the outstanding officers, detectives, dispatchers, and staff who work hard every day to keep our community safe. Y’all’s dedication to serving your neighbors is truly commendable—thank you for what you do!",en,Tweet,0,3,0,6,599,2025-02-28 23:36:08,"<a href=""http://twitter.com/download/iphone"" rel=""nofollow"">Twitter for iPhone</a>",,,photo,"https://pbs.twimg.com/media/Gk6XbTHXAAAa1_f.jpg,https://pbs.twimg.com/media/Gk6XbTJW0AE0nyX.jpg,https://pbs.twimg.com/media/Gk6XbTGXYAAf2jA.jpg,https://pbs.twimg.com/media/Gk6XbTKXEA0wj59.jpg"
'1895533829114511858',I can’t think of a better place to spend my afternoon than at the Mansfield Chamber answering questions and visiting with our business leaders. https://t.co/Ln3ORMSEi2,en,Tweet,0,4,0,3,515,2025-02-28 17:57:36,"<a href=""http://twitter.com/download/iphone"" rel=""nofollow"">Twitter for iPhone</a>",,,photo,https://pbs.twimg.com/media/Gk5JDu4WAAAHYXW.jpg
'1894888091506352610',"Had a great meeting with the United Aerial Firefighters, discussing the critical role they play in protecting our communities from devastating wildfires. These pilots and crews put their lives on the line to keep us safe, and I was proud to support them with the Aerial Firefighting Enhancement Act of 2025.",en,Tweet,0,9,0,7,2938,2025-02-26 23:11:40,"<a href=""http://twitter.com/download/iphone"" rel=""nofollow"">Twitter for iPhone</a>",,,photo,https://pbs.twimg.com/media/Gkv-rM7WMAAxBKh.jpg
'1894505710152532439',"My team had a great time serving the incredible teachers at New Summerfield ISD today for a teacher appreciation event. After that, they stopped by the Jacksonville Police & Fire Department to drop off some goodies as a small thank-you for all they do. We’re grateful for the hardworking educators and first responders who serve our communities every day!",en,Tweet,1,3,0,4,522,2025-02-25 21:52:14,"<a href=""http://twitter.com/download/iphone"" rel=""nofollow"">Twitter for iPhone</a>",,,photo,"https://pbs.twimg.com/media/Gkqi5pDXMAALJJE.jpg,https://pbs.twimg.com/media/Gkqi5pFWwAAPI98.jpg"
'1894088644329091549',"Last week, I had the chance to catch up with Sheriff Barnes, Shane Brassell, and some of our hardworking DPS troopers in Hill County. I also stopped by the Waco Family Medicine Clinic in Hillsboro to see the great work they’re doing for the community. https://t.co/4TmeVVALJz",en,Tweet,0,6,1,3,541,2025-02-24 18:14:57,"<a href=""http://twitter.com/download/iphone"" rel=""nofollow"">Twitter for iPhone</a>",,,photo,"https://pbs.twimg.com/media/GkknitLXsAAI41N.jpg,https://pbs.twimg.com/media/GkknitgWwAECWBN.jpg"
'1890528565831082151',"Today, my team visited the Dallas VA to spread some Valentine’s Day cheer! We partnered with Midlothian ISD for Valentines for Vets, delivering over 200 heartfelt Valentine’s cards made by the students—along with plenty of candy. https://t.co/9fcxzMGBQW",en,Tweet,0,10,0,11,658,2025-02-14 22:28:29,"<a href=""http://twitter.com/download/iphone"" rel=""nofollow"">Twitter for iPhone</a>",,,photo,"https://pbs.twimg.com/media/GjyAGOLXwAAqA01.jpg,https://pbs.twimg.com/media/GjyAGOWXcAA07PM.jpg,https://pbs.twimg.com/media/GjyAGOJWYAA1ndW.jpg,https://pbs.twimg.com/media/GjyAGOOWAAAOwEj.jpg"
'1890186397174108590',"Thank you to the over 7,000 constituents who tuned in last night for my first telephone town hall in the 119th Congress. We had over 70 questions and, unfortunately, only an hour to answer them. If you call in and ask a question, you will get an answer from my office. That is my promise to you.",en,Tweet,0,8,0,6,680,2025-02-13 23:48:49,"<a href=""http://twitter.com/download/iphone"" rel=""nofollow"">Twitter for iPhone</a>",,,photo,https://pbs.twimg.com/media/GjtKgoTXQAA8QX-.jpg
'1889785425092366668',"It was great talking with @cbs11jack about the Lone Star Reimbursement Act. Texans have taken on the responsibility of the federal government, and it is time to make it right. https://t.co/KvxR32UQYh",en,Tweet,1,4,0,2,466,2025-02-12 21:15:30,"<a href=""http://twitter.com/download/iphone"" rel=""nofollow"">Twitter for iPhone</a>",,,photo,https://pbs.twimg.com/media/GjndQB7WkAErhCs.jpg
'1889711410143236347',"America is the Shining City on the Hill. Sometimes, God hits you with reminders. Today, on my way to work, was one of those times. https://t.co/9KeOSqq4z5",en,Tweet,0,10,0,4,510,2025-02-12 16:21:23,"<a href=""http://twitter.com/download/iphone"" rel=""nofollow"">Twitter for iPhone</a>",,,photo,https://pbs.twimg.com/media/GjmagzNXEAAoIFz.jpg
'1889686964464464028',"Hey everyone! Tonight, I will be hosting my first live telephone town hall of the 119th Congress. I’m excited to get the opportunity to talk to everyone. Come with questions! https://t.co/4D3mpqGruc",en,Tweet,0,4,0,3,432,2025-02-12 14:44:15,"<a href=""http://twitter.com/download/iphone"" rel=""nofollow"">Twitter for iPhone</a>",,,photo,https://pbs.twimg.com/media/GjmER7sXEAEXtmr.jpg
'1887941898142196195',"Before heading home to Texas, I met with the IDF alongside my colleagues @RepPfluger and @RepJimmyPanetta for an update on the ongoing situation in Israel. As our strongest ally in the Middle East, America must always stand with Israel. https://t.co/h7vXKALzRY",en,Tweet,0,9,0,9,578,2025-02-07 19:09:59,"<a href=""http://twitter.com/download/iphone"" rel=""nofollow"">Twitter for iPhone</a>",,,photo,https://pbs.twimg.com/media/GjNRIpuWQAA84mf.jpg
'1887623208050041150',"In the last four years, we’ve lost as many Americans to fentanyl in our bedrooms and backyards as we did service members in combat during World War II. Today, Congress took action and passed the HALT Fentanyl Act because keeping deadly drugs off our streets shouldn’t be up for debate. The number one job of any government is the protection of her citizens. This bill does that.",en,Tweet,0,4,0,1,491,2025-02-06 22:03:37,"<a href=""http://twitter.com/download/iphone"" rel=""nofollow"">Twitter for iPhone</a>",,,,
'1887590104019210751',It’s always great to talk about the positive things @BipartisanVets are doing in Congress. https://t.co/EaocfvjueM,en,Tweet,0,3,0,0,778,2025-02-06 19:52:05,"<a href=""http://twitter.com/download/iphone"" rel=""nofollow"">Twitter for iPhone</a>",,,video,https://video.twimg.com/amplify_video/1887589998993575936/vid/avc1/886x512/g0xsCNA-CXyJlDcE.mp4?tag=16
'1886566991466561692',"When asked if I want Congress to reimburse Texas for the billions they have spent securing the border, the answer is, “You dang right.” https://t.co/mPOnplXkiL",en,Tweet,1,68,8,16,6116,2025-02-04 00:06:36,"<a href=""http://twitter.com/download/iphone"" rel=""nofollow"">Twitter for iPhone</a>",,,video,https://video.twimg.com/amplify_video/1886566833362493445/vid/avc1/864x484/5jwAXY9qgCRot4_C.mp4?tag=16
'1886532131960061954',"I’m proud to be Co-Chair of the @BipartisanVets for the 119th Congress. Over the next two years, we do what is needed to make our nation safer and more secure. https://t.co/ukHZluEKw9",en,Tweet,1,10,2,0,987,2025-02-03 21:48:04,"<a href=""http://twitter.com/download/iphone"" rel=""nofollow"">Twitter for iPhone</a>",,,video,https://video.twimg.com/amplify_video/1886530325787860992/vid/avc1/886x504/JppfKYbOg3JHvo-e.mp4?tag=16
'1885399017527312573',While I was in Dallas I stopped by the local @Bloomberg offices to visit with @JulieFineTX. We had a great conversation about what’s going in Washington and here in Texas. https://t.co/eWGdYt2pGQ,en,Tweet,0,4,2,4,655,2025-01-31 18:45:29,"<a href=""http://twitter.com/download/iphone"" rel=""nofollow"">Twitter for iPhone</a>",,,photo,https://pbs.twimg.com/media/GipIZ7qXAAAg2ok.jpg
'1885375512647782906',Spending my morning with @JasonWhitely at @wfaa. https://t.co/f5Jy6wUpZk,en,Tweet,0,3,1,0,449,2025-01-31 17:12:05,"<a href=""http://twitter.com/download/iphone"" rel=""nofollow"">Twitter for iPhone</a>",,,photo,https://pbs.twimg.com/media/GiozCMPWIAAYuI8.jpg
'1884956625720496314',"Shelby and I are heartbroken regarding the loss of life following the mid-air collision at DCA. As rescue and recovery efforts continue, we ask all Americans to keep everyone involved in your prayers.",en,Tweet,0,7,0,2,558,2025-01-30 13:27:35,"<a href=""http://twitter.com/download/iphone"" rel=""nofollow"">Twitter for iPhone</a>",,,,
'1884742020729590010',"Last week, I had the opportunity to attend a special event at the Luxembourg Embassy in Washington, where we paid tribute to the survivors of the Battle of the Bulge. This pivotal battle, fought from December 1944 to January 1945, was the last major German offensive on the Western Front during WWII. It resulted in approximately 19,000 American deaths, with countless others wounded or missing. Their courage and sacrifice during one of WWII's toughest battles are a testament to the strength of the human spirit. We must always remember and honor their service.",en,Tweet,0,12,1,1,724,2025-01-29 23:14:49,"<a href=""http://twitter.com/download/iphone"" rel=""nofollow"">Twitter for iPhone</a>",,,photo,"https://pbs.twimg.com/media/Gify4MUXYAAH2SV.jpg,https://pbs.twimg.com/media/Gify4MTWcAAImIs.jpg,https://pbs.twimg.com/media/Gify4MTWIAANQDG.jpg"
'1884731745695650048',"With the passing of the Laken Riley Act, Congress is sending a clear message: We will not allow criminal illegal aliens to threaten our safety. We are taking action to protect our families and communities. This legislation is an important step in securing America’s future and protecting our people. I am proud to see it now become law.",en,Tweet,0,8,0,2,412,2025-01-29 22:33:59,"<a href=""https://mobile.twitter.com"" rel=""nofollow"">Twitter Web App</a>",,,photo,https://pbs.twimg.com/media/GifpeebXkAAkaCW.png
'1882985255310627000',"Texas Republicans in Congress have your back @GregAbbott_TX. 

The Constitution is clear, Article IV, Section 4 explicitly states that the federal government shall protect each state from invasion. Unfortunately, Washington’s failure to uphold this responsibility has forced states like Texas to shoulder the burden of securing our southern border. And over the past decade, hardworking Texans have paid billions to protect their families from the threats posed by human trafficking, drug cartels, and illegal crossings.",en,Tweet,0,9,2,5,1075,2025-01-25 02:54:03,"<a href=""http://twitter.com/download/iphone"" rel=""nofollow"">Twitter for iPhone</a>",,,,
'1882562365322903684',"Today, I proudly voted YES on the Fix Our Forests Act, led by my colleague, @RepWesterman. Wildfires have caused devastating impacts on countless communities across our nation. This legislation is a critical step toward better forest management to help prevent future fires and protect lives, property, and natural resources.",en,Tweet,0,4,0,1,442,2025-01-23 22:53:38,"<a href=""http://twitter.com/download/iphone"" rel=""nofollow"">Twitter for iPhone</a>",,,,
'1882532233392906569',"The United States is home to the most caring and united people. Heroes save lives daily—police, firefighters, teachers, medical professionals, and so many others. Quiet acts of service often go unnoticed, but they make our nation strong, resilient, and a beacon of hope. https://t.co/eAxfpp8neG",en,Tweet,0,6,1,1,460,2025-01-23 20:53:54,"<a href=""http://twitter.com/download/iphone"" rel=""nofollow"">Twitter for iPhone</a>",,,video,https://video.twimg.com/amplify_video/1882532136378327040/vid/avc1/886x480/B4Czl1tgLjoGnxU7.mp4?tag=16
