tweet_id,text,language,type,bookmark_count,favorite_count,retweet_count,reply_count,view_count,created_at,client,hashtags,urls,media_type,media_urls
'1843390070465646921',"The Department of Homeland Security, under Secretary Mayorkas, has taken actions that make illegal immigration more attractive by reallocating funds that should be prioritized for disaster relief efforts. At a time when FEMA is warning that they do not have enough funding to cover the rest of the hurricane season, money has been funneled into programs that provide aid to noncitizen migrants.",en,Tweet,1,9,3,10,1299,2024-10-07 21:36:55,"<a href=""https://mobile.twitter.com"" rel=""nofollow"">Twitter Web App</a>",,,photo,https://pbs.twimg.com/media/GZUJXo6XgAA64f_.png
'1843364523316785519',"Hey everyone, I will be putting out a statement later today dispelling some of the rumors regarding North Carolina. As you know, I always look for the facts before I tell y’all what I believe. I ask that you keep all the folks impacted by the hurricane in your prayers. https://t.co/ANAzHcTyGI",en,Tweet,0,7,2,8,839,2024-10-07 19:55:25,"<a href=""http://twitter.com/download/iphone"" rel=""nofollow"">Twitter for iPhone</a>",,,video,https://video.twimg.com/amplify_video/1843364394064822272/vid/avc1/1280x720/fKNpV4H-EqyuVAs_.mp4?tag=16
'1843335717897871831',"One year ago today, Israel faced a horrific and unprovoked assault by Hamas that claimed the lives of 1,200 innocent civilians, including women and children, and saw hundreds taken hostage. Among those still held captive are 97 individuals, including Americans.

As Israel continues to defend itself, the United States must remain steadfast in our support. I ask you to join me in praying for the people of Israel, for the safe return of those still held, and for peace and healing as they honor their lost loved ones and stand strong in the face of these threats.",en,Tweet,0,21,2,2,3242,2024-10-07 18:00:57,"<a href=""https://mobile.twitter.com"" rel=""nofollow"">Twitter Web App</a>",,,,
'1841558903915434217',"Last night, I had the honor of speaking at the Dallas-Fort Worth Navy League. As a 20-year Navy veteran, it’s always a privilege to be among those who share a deep commitment to our nation’s maritime strength and support for our Sea Services. Our sailors, Marines, and Coast Guard play a vital role in keeping America secure, and I’m grateful for organizations like this that stand behind them. Thank you for the warm welcome and for all you do!",en,Tweet,0,10,4,2,625,2024-10-02 20:20:31,"<a href=""http://twitter.com/download/iphone"" rel=""nofollow"">Twitter for iPhone</a>",,,photo,"https://pbs.twimg.com/media/GY6IDgZXEAAuxVu.jpg,https://pbs.twimg.com/media/GY6IDgdXcAAQXjR.jpg,https://pbs.twimg.com/media/GY6IDgbXkAAFM17.jpg"
'1841179218941821218',Please join Shelby and I in praying for Israel. 🇮🇱,en,Tweet,0,196,9,46,20193,2024-10-01 19:11:47,"<a href=""http://twitter.com/download/iphone"" rel=""nofollow"">Twitter for iPhone</a>",,,,
'1840858143699747327',Our office had a great time attending the Senior Olympics in Midlothian today! It was an amazing event filled with fun activities like volleyball and a cake walk. Thanks to everyone who helped make this such a special day! https://t.co/0NoQ8uvimU,en,Tweet,0,4,1,0,335,2024-09-30 21:55:57,"<a href=""http://twitter.com/download/iphone"" rel=""nofollow"">Twitter for iPhone</a>",,,photo,"https://pbs.twimg.com/media/GYwKuDgXEAEUHYq.jpg,https://pbs.twimg.com/media/GYwKuDdWQAADFTs.jpg"
'1839738250858246205',"The number one job of any government—whether city, county, state, or federal—is the protection of its citizens. This administration and our federal government are failing, and it’s unacceptable. https://t.co/gkUDwl7sw2",en,Tweet,0,15,7,9,950,2024-09-27 19:45:54,"<a href=""http://twitter.com/download/iphone"" rel=""nofollow"">Twitter for iPhone</a>",,,photo,https://pbs.twimg.com/media/GYgQMDxX0AA1c44.jpg
