tweet_id,text,language,type,bookmark_count,favorite_count,retweet_count,reply_count,view_count,created_at,client,hashtags,urls,media_type,media_urls
'1887175139147514201',"Today, I introduced a bill to rename the United States Postal Service facility at 2600 Wesley Street in Greenville, Texas, to the “Cooper Dawson Post Office Building” in honor of fallen Greenville Police Department Officer Cooper Dawson. 🇺🇸
 
Officer Dawson was killed in the line of duty on November 25, 2024, during a traffic stop of a driver with multiple felony warrants, which escalated into a foot chase. During the pursuit, Officer Dawson was ambushed and shot multiple times by the subject. Despite his injuries, Officer Dawson valiantly returned fire, incapacitating the assailant.
 
Officer Dawson made the ultimate sacrifice for our community. It is a debt that can never be repaid, and we will forever carry his memory in our hearts. It is a great honor to introduce this bill to commemorate Officer Dawson’s legacy and his remarkable, unwavering bravery in the face of danger.",en,Tweet,0,61,3,10,1134,2025-02-05 16:23:09,"<a href=""http://twitter.com/download/iphone"" rel=""nofollow"">Twitter for iPhone</a>",,,photo,https://pbs.twimg.com/media/GjCXyayXUAAIx1m.jpg
'1887149452621676697',"Democrats and the fake news have lost their minds so much over @DOGE that they’ve stopped crying over the criminal illegal aliens being arrested now.

Try to keep up! 🇺🇸👇",en,Tweet,0,32,6,2,1010,2025-02-05 14:41:05,"<a href=""http://twitter.com/download/iphone"" rel=""nofollow"">Twitter for iPhone</a>",,,,
'1887149192768016814',"Why are Democrats so angry that President Trump created @DOGE to justify that every tax dollar is being spent well?

Really makes you think…",en,Tweet,0,44,7,5,1230,2025-02-05 14:40:03,"<a href=""http://twitter.com/download/iphone"" rel=""nofollow"">Twitter for iPhone</a>",,,,
'1887148726914801882',"Democrats know that Americans do not want to send their tax dollars abroad for a “transgender opera” in Colombia.

They can’t defend it.

Their only move is to scream @ElonMusk in front of a building and hope you’re distracted. Sad!",en,Tweet,0,51,13,10,718,2025-02-05 14:38:12,"<a href=""http://twitter.com/download/iphone"" rel=""nofollow"">Twitter for iPhone</a>",,,,
'1886946910465876255',"Congratulations Attorney General @PamBondi! 🇺🇸

She will be outstanding!",en,Tweet,0,133,8,4,2025,2025-02-05 01:16:15,"<a href=""http://twitter.com/download/iphone"" rel=""nofollow"">Twitter for iPhone</a>",,,,
'1886920448425775126',"🚨Mainstream media, are you paying attention to this?

Democrat @RepLaMonica declares “war” against a President elected by over 77 million Americans.

Insurrection?? https://t.co/eQWAHQqONS",en,Tweet,9,293,107,78,8504,2025-02-04 23:31:06,"<a href=""http://twitter.com/download/iphone"" rel=""nofollow"">Twitter for iPhone</a>",,,video,https://video.twimg.com/amplify_video/1886920374283059200/vid/avc1/886x504/dyq_guRIzbywBjFU.mp4?tag=16
'1886912251271242129',"In other words…

The Trump administration is returning power back to the PEOPLE. 🇺🇸",en,Tweet,0,113,16,7,1955,2025-02-04 22:58:32,"<a href=""http://twitter.com/download/iphone"" rel=""nofollow"">Twitter for iPhone</a>",,,,
'1886882347468915194',".@SenatorDurbin has nothing to fear but fear itself, Kash Patel’s confirmation, and maybe Epstein’s flight logs going public.",en,Tweet,3,137,41,19,2631,2025-02-04 20:59:42,"<a href=""http://twitter.com/download/iphone"" rel=""nofollow"">Twitter for iPhone</a>",,,,
'1886881466165936441',"Tulsi Gabbard is a force to be reckoned with and is on the road to a Senate Floor vote — the final step toward confirmation as our next Director of National Intelligence. 🇺🇸

This America-First patriot poses a threat to political elites. Fantastic pick by President Trump! https://t.co/2Za3V91ZMt",en,Tweet,0,20,2,5,725,2025-02-04 20:56:12,"<a href=""http://twitter.com/download/iphone"" rel=""nofollow"">Twitter for iPhone</a>",,,photo,https://pbs.twimg.com/media/Gi-MsaHWsAA1R-J.jpg
'1886850581257454068',"Today, President Trump is hosting Prime Minister Benjamin Netanyahu for his first White House meeting with a foreign leader.
 
Hamas must be defeated.

America continues to stand with Israel.🇮🇱",en,Tweet,1,66,10,47,24954,2025-02-04 18:53:29,"<a href=""http://twitter.com/download/iphone"" rel=""nofollow"">Twitter for iPhone</a>",,,,
'1886828628563890223',"WASTE and ABUSE are rampant in our government. 

USAID is a prime example of why @DOGE policies need to be codified in the 119th Congress. 🇺🇸",en,Tweet,0,46,7,7,1155,2025-02-04 17:26:15,"<a href=""http://twitter.com/download/iphone"" rel=""nofollow"">Twitter for iPhone</a>",,,,
'1886825065104449926',"🚨USAID is a complete scam against the American taxpayer! 

👉$1.5 million for DEI policies in SERBIA
👉$47k for a “transgender opera” in COLOMBIA
👉$2 million for sex changes and ""LGBT activism"" in GUATEMALA",en,Tweet,4,83,17,12,1520,2025-02-04 17:12:05,"<a href=""http://twitter.com/download/iphone"" rel=""nofollow"">Twitter for iPhone</a>",,,,
'1886815766068256932',"The lies from the Left are getting more desperate…
 
@RepSwalwell click here to file your taxes FOR FREE ⬇️

https://t.co/J4ZADKWcKF",en,Tweet,0,16,0,3,719,2025-02-04 16:35:08,"<a href=""http://twitter.com/download/iphone"" rel=""nofollow"">Twitter for iPhone</a>",,https://directfile.irs.gov/,,
'1886771597853249874',Texas leads the way again as Attorney General @KenPaxtonTX signed an agreement with the Trump administration to carry out mass deportation efforts. 🇺🇸,en,Tweet,0,105,17,10,1156,2025-02-04 13:39:38,"<a href=""http://twitter.com/download/iphone"" rel=""nofollow"">Twitter for iPhone</a>",,,,
'1886582286377718102',"Trudeau yields to common sense policies.

AMERICA FIRST! 🇺🇸",en,Tweet,1,67,6,8,1407,2025-02-04 01:07:22,"<a href=""http://twitter.com/download/iphone"" rel=""nofollow"">Twitter for iPhone</a>",,,,
'1886447725874455016',"🚨ART OF THE DEAL:

In response to the Trump Tariffs, President Claudia Sheinbaum agreed to immediately supply 10,000 Mexican soldiers to the border to stop the flow of fentanyl and illegal aliens.

This is what over 77 million Americans voted for. 

Promises Made Promises Kept! 💪🇺🇸",en,Tweet,3,72,9,16,3383,2025-02-03 16:12:41,"<a href=""http://twitter.com/download/iphone"" rel=""nofollow"">Twitter for iPhone</a>",,,photo,https://pbs.twimg.com/media/Gi4CNXyXIAMneVp.jpg
'1886435677757157496',"President Trump is correct.

Bureaucrats have turned USAID into an ATM for radical leftwing projects.

We’d be insane to continue this scam!",en,Tweet,2,216,66,31,2900,2025-02-03 15:24:48,"<a href=""http://twitter.com/download/iphone"" rel=""nofollow"">Twitter for iPhone</a>",,,,
'1885470348398805258',"America finally feels LIFE and ENERGY coming from the White House again.

What a change from the last 4 years!",en,Tweet,0,119,14,17,1803,2025-01-31 23:28:56,"<a href=""http://twitter.com/download/iphone"" rel=""nofollow"">Twitter for iPhone</a>",,,,
'1885448911151566991',So glad to see Texas is leading the way on transforming education in America.🇺🇸,en,Tweet,0,47,4,6,2056,2025-01-31 22:03:45,"<a href=""http://twitter.com/download/iphone"" rel=""nofollow"">Twitter for iPhone</a>",,,,
'1885447938236694731',"🚨REP. KEITH SELF—“You never target your intentions.”

Individuals who are leaking details of ICE operations should be treated as accomplices. https://t.co/dZay2xeBuf",en,Tweet,3,198,56,5,7026,2025-01-31 21:59:53,"<a href=""http://twitter.com/download/iphone"" rel=""nofollow"">Twitter for iPhone</a>",,,video,https://video.twimg.com/amplify_video/1885447842140950528/vid/avc1/888x496/GYCmfCJaNyUzzBrC.mp4?tag=16
'1885439818231869926',"DEI must DIE.

America is returning to common sense policies — merit, hard work, and excellence.

President Trump is committed to renewing the pillars of American civilization and ending the harmful practices of DEI. 💪",en,Tweet,1,50,7,5,1528,2025-01-31 21:27:37,"<a href=""http://twitter.com/download/iphone"" rel=""nofollow"">Twitter for iPhone</a>",,,,
'1885389437577703769',"@RepJeffries publicly inciting violence by calling to “fight it in the streets” is outrageous.

Where are the cries against his call for “insurrection” by the fake news media.",en,Tweet,0,1,1,1,254,2025-01-31 18:07:25,"<a href=""http://twitter.com/download/iphone"" rel=""nofollow"">Twitter for iPhone</a>",,,,
'1885388698352505105',Incredible. God bless you Paula! And never stop singing!,en,Tweet,1,25,4,2,912,2025-01-31 18:04:29,"<a href=""http://twitter.com/download/iphone"" rel=""nofollow"">Twitter for iPhone</a>",,,,
'1885386619093479877',"“Fight it in the streets” ??

As President Trump is working round the clock to Make America Safe Again, @RepJeffries is publicly turning up the temperature...

Americans want Peace, Safety, and Prosperity—not the garbage @RepJeffries is spewing! https://t.co/hJ166IrGEZ",en,Tweet,2,127,51,27,1807,2025-01-31 17:56:13,"<a href=""http://twitter.com/download/iphone"" rel=""nofollow"">Twitter for iPhone</a>",,,video,https://video.twimg.com/amplify_video/1885386563078483968/vid/avc1/888x500/rtFPkJScXufztN4S.mp4?tag=16
'1885382932900057363',"DRILL BABY DRILL! 💪🇺🇸

Congrats @DougBurgum on getting confirmed to lead the Department of the Interior.

Now, the U.S. will establish energy dominance again and will roll back the radical policies of the Biden Administration!",en,Tweet,0,25,0,2,644,2025-01-31 17:41:34,"<a href=""http://twitter.com/download/iphone"" rel=""nofollow"">Twitter for iPhone</a>",,,,
'1885381346777841831',"🚨EXCLUSIVE: Republican Reps Unveil Legislation To Combat Biden’s ‘Failed’ Enforcement Of Partial Birth Abortion Ban

Read more about my bill that will support President Trump’s pro-life agenda HERE ⬇️

https://t.co/jHffsGN4tF",en,Tweet,1,8,2,1,419,2025-01-31 17:35:16,"<a href=""http://twitter.com/download/iphone"" rel=""nofollow"">Twitter for iPhone</a>",,https://dailycaller.com/2025/01/31/exclusive-republican-reps-unveil-legislation-to-combat-bidens-failed-enforcement-of-partial-birth-abortion-ban/,,
'1885368686287913400',"Thank you @Robert_Aderholt, @RepMaryMiller, @RepLaMalfa, @RepWebster, @TXRandy14, @RepAndyHarrisMD, @RepRileyMoore, @RepEricBurlison, @RepMichaelGuest, @RepOgles, @RepBrianBabin, &amp; @RepMarkHarrisNC for supporting this effort.",en,Reply,0,24,2,2,922,2025-01-31 16:44:57,"<a href=""http://twitter.com/download/iphone"" rel=""nofollow"">Twitter for iPhone</a>",,,,
'1885368684253732994',"DC authorities can no longer turn a blind eye to the DC Five babies who were brutally murdered - one possibly by an illegal partial birth abortion - and discovered in a cardboard box next to the Washington Surgi-Clinic.
 
Today, I am introducing with @RepAndyBiggsAZ, the Ensuring Justice for Victims of Partial Birth Abortion Act which will require an investigation of the DC Five & ensure enforcement of the partial birth ban so that no babies are killed while being partially delivered.

Between this bill and the pro-life Trump administration, I am hopeful that justice for the DC-Five will finally be served.",en,Tweet,5,362,76,9,16571,2025-01-31 16:44:57,"<a href=""http://twitter.com/download/iphone"" rel=""nofollow"">Twitter for iPhone</a>",,,,
'1885367735602778364',This is fantastic news.,en,Tweet,0,52,6,6,1116,2025-01-31 16:41:11,"<a href=""http://twitter.com/download/iphone"" rel=""nofollow"">Twitter for iPhone</a>",,,,
'1885367679797633530',This is a great explanation of the reason the federal government needs to reduce spending.,en,Tweet,0,45,7,5,1124,2025-01-31 16:40:57,"<a href=""http://twitter.com/download/iphone"" rel=""nofollow"">Twitter for iPhone</a>",,,,
'1885367577242714604',"Republican Senators Collins and Murkowski voted for this, but they won’t support RFK Jr. Shocking!

https://t.co/tRGuwLmBKC",en,Tweet,1,52,20,18,1210,2025-01-31 16:40:33,"<a href=""http://twitter.com/download/iphone"" rel=""nofollow"">Twitter for iPhone</a>",,https://youtu.be/XX2alG-kbBo?si=zPqtoVnMMfjAelNe,,
'1885083633699991933',"Despite what Hollywood might think, the American people are NOT crying over these criminals! Get them out of here.",en,Tweet,1,77,21,5,1570,2025-01-30 21:52:16,"<a href=""http://twitter.com/download/iphone"" rel=""nofollow"">Twitter for iPhone</a>",,,,
'1885082028283928673',"Individuals who “leak” and place our officers at great risk should be exposed and publicly shamed.

Leaking details of an an ICE operation is a recipe for ambush against our brave men and women. 

Unconscionable.",en,Tweet,1,65,15,10,1424,2025-01-30 21:45:53,"<a href=""http://twitter.com/download/iphone"" rel=""nofollow"">Twitter for iPhone</a>",,,,
'1885079694216712523',💪🇺🇸,art,Tweet,1,33,3,2,1113,2025-01-30 21:36:36,"<a href=""http://twitter.com/download/iphone"" rel=""nofollow"">Twitter for iPhone</a>",,,,
'1885040900385972405',"American trust in the FBI has reached an all-time low.

For four years, this agency was used as a weapon of the Deep State to target the political opponents of the Biden administration.

To restore faith and to root out the rot in America’s justice system, we need @Kash_Patel at the helm.

Confirm Kash! 🇺🇸",en,Tweet,0,41,2,9,763,2025-01-30 19:02:27,"<a href=""http://twitter.com/download/iphone"" rel=""nofollow"">Twitter for iPhone</a>",,,,
'1885012888139477502',"Spot on, Chairman @RepArrington.

The 119th Congress MUST tackle Washington’s out-of-control spending problem.

Republicans have an extraordinary opportunity to address the American people’s demands to restore fiscal sanity.",en,Tweet,0,7,0,2,877,2025-01-30 17:11:09,"<a href=""http://twitter.com/download/iphone"" rel=""nofollow"">Twitter for iPhone</a>",,,,
'1884816558024696306',Praying for the families and loved ones of those who perished in the tragic collision at Reagan National Airport. May they find strength and comfort in this difficult time.,en,Tweet,1,31,2,1,1566,2025-01-30 04:11:00,"<a href=""http://twitter.com/download/iphone"" rel=""nofollow"">Twitter for iPhone</a>",,,,
'1884736851027665224',"Read more about my bill to reduce the Consumer Financial Protection Bureau (CFPB) statutory funding cap to $0 HERE ⬇️ @TexasScorecard 

https://t.co/Gkz1HsMCkj",en,Tweet,1,18,2,4,1306,2025-01-29 22:54:16,"<a href=""http://twitter.com/download/iphone"" rel=""nofollow"">Twitter for iPhone</a>",,https://texasscorecard.com/federal/keith-self-sets-cfpb-funding-to-0/,,
'1884734702260494597',"This is a strong message of deterrence…

Come here illegally? Commit crimes on U.S. soil? You’re going to Guantanamo!",en,Tweet,0,62,2,7,1517,2025-01-29 22:45:44,"<a href=""http://twitter.com/download/iphone"" rel=""nofollow"">Twitter for iPhone</a>",,,,
'1884734535696347452',"Today, I introduced a bill to reduce the CFPB statutory cap to $0. Another win for @DOGE.

The CFPB has long been an unaccountable and burdensome agency that has stifled economic growth.

Proud to work on this effort with @SenTedCruz.",en,Tweet,0,67,10,6,1172,2025-01-29 22:45:04,"<a href=""http://twitter.com/download/iphone"" rel=""nofollow"">Twitter for iPhone</a>",,,,
'1884731443332390947',"The Laken Riley Act is the first bill President Trump has signed into law.

Her legacy will live on, bringing safety to thousands of Americans.

God bless Laken and her family.",en,Tweet,1,40,8,3,1216,2025-01-29 22:32:47,"<a href=""http://twitter.com/download/iphone"" rel=""nofollow"">Twitter for iPhone</a>",,,,
'1884731304421278076',"And Democrats wonder why they lost the House, Senate, and White House… https://t.co/Lg3RqIMUG8",en,Tweet,4,251,32,26,2531,2025-01-29 22:32:14,"<a href=""http://twitter.com/download/iphone"" rel=""nofollow"">Twitter for iPhone</a>",,,photo,https://pbs.twimg.com/media/GifpIgvX0AAs5t0.jpg
'1884731147550134461',"The Fauci sycophants were out in full force today…they are terrified of anyone who challenges the status quo.

America has your back, Bobby! MAHA! 🇺🇸💪",en,Tweet,2,76,7,8,1429,2025-01-29 22:31:36,"<a href=""http://twitter.com/download/iphone"" rel=""nofollow"">Twitter for iPhone</a>",,,,
'1884671888162517449',"🚨Rep. Keith Self on budget reconciliation:

“The American people elected Donald Trump to include spending cuts to the federal government. That is part of the Trump agenda.”",en,Tweet,2,50,9,4,3266,2025-01-29 18:36:08,"<a href=""http://twitter.com/download/iphone"" rel=""nofollow"">Twitter for iPhone</a>",,,,
'1884662604968214594',"Finally, a leader who puts children FIRST! 🇺🇸

President Trump’s executive order to STOP the chemical castration and surgical mutilation of minors will save countless lives.

No more radical agendas destroying our kids’ futures! Time to protect innocence! https://t.co/fIxyinarlq",en,Tweet,1,60,12,0,1028,2025-01-29 17:59:15,"<a href=""http://twitter.com/download/iphone"" rel=""nofollow"">Twitter for iPhone</a>",,,photo,https://pbs.twimg.com/media/GieqposXAAABIJz.jpg
'1884391358485467253',This is expected. The establishment is fighting tooth and nail against the mandate that the American people gave President Trump.,en,Tweet,4,179,31,36,3453,2025-01-29 00:01:24,"<a href=""http://twitter.com/download/iphone"" rel=""nofollow"">Twitter for iPhone</a>",,,,
'1884389222578077859',"Letitia,

Stop playing the blame game and start leading.  

If NYC and the New York Assembly would stop taxing its citizens from the cradle to the grave, stop funding ridiculous DEI projects and stop giving taxpayer dollars to illegal immigrants, they might not need federal bailouts.",en,Tweet,0,51,9,11,1689,2025-01-28 23:52:55,"<a href=""http://twitter.com/download/iphone"" rel=""nofollow"">Twitter for iPhone</a>",,,,
'1884306145277534386',"Minor league Democrat officials in blue cities are popping their heads out of the sand for the first time to drum up hysteria…I feel sorry for his constituents, who clearly take a back seat to criminal illegal aliens!

https://t.co/u86RzWWUH7",en,Tweet,1,28,5,5,727,2025-01-28 18:22:48,"<a href=""http://twitter.com/download/iphone"" rel=""nofollow"">Twitter for iPhone</a>",,https://www.foxnews.com/media/pittsburgh-mayor-declares-he-not-cooperate-ice-raids-people-feel-scared,,
'1884276478323609870',Right on @Sec_Noem! 💪,en,Tweet,0,64,6,5,1184,2025-01-28 16:24:55,"<a href=""http://twitter.com/download/iphone"" rel=""nofollow"">Twitter for iPhone</a>",,,,
'1884271309754183890',"MAHA on the move! ☀️
 
Today, I introduced the FIZZ-NO Act, to eliminate funding for sugary carbonated beverages from SNAP. 

@RobertKennedyJr, I know this is something MAHA can really get behind!

https://t.co/trIa2rA8Yx",en,Tweet,3,138,16,33,5260,2025-01-28 16:04:22,"<a href=""http://twitter.com/download/iphone"" rel=""nofollow"">Twitter for iPhone</a>",,https://www.washingtonexaminer.com/news/3302507/republican-congressman-to-introduce-fizz-no-act-to-make-america-healthy-again/?utm_source=gazette.com&utm_medium=referral&utm_campaign=csg_news_feed,,
'1883930973751963653',"President Trump is operating at a pace that is nearly impossible for the fake news to keep up with.

They were just getting into a frenzy about Colombian coffee, when President Gustavo Petro quickly caved. 

They started to go back to slamming Trump’s cabinet nominees, then @PeteHegseth announced the end of DEI at DoD.

It will be like this for them every day.

They can’t keep up. They won’t keep up. MAGA 2.0 is just getting started! 🇺🇸🦅",en,Tweet,1,106,13,16,1314,2025-01-27 17:32:00,"<a href=""http://twitter.com/download/iphone"" rel=""nofollow"">Twitter for iPhone</a>",,,,
'1883926143033827675',"Over the weekend, ICE conducted the arrests of 84 individuals in the DFW area.💪

President Trump’s immigration crackdown promises have made their way to Collin County. 🇺🇸 

Promises Made Promises Kept!

https://t.co/DKPoJyppEc",en,Tweet,1,102,16,13,1644,2025-01-27 17:12:48,"<a href=""http://twitter.com/download/iphone"" rel=""nofollow"">Twitter for iPhone</a>",,https://www.cbsnews.com/texas/news/arrests-north-texas-ice-raids/,,
'1883909825731629214',"80 years ago today, the Auschwitz concentration camp was liberated just months before Nazi Germany surrendered. Today we remember the millions who were murdered in one of the darkest chapters in human history—the Holocaust. Never forget. Never again. https://t.co/1h7qrN5v9x",en,Tweet,2,54,15,4,1289,2025-01-27 16:07:58,"<a href=""http://twitter.com/download/iphone"" rel=""nofollow"">Twitter for iPhone</a>",,,photo,https://pbs.twimg.com/media/GiT9__iXoAAXPTS.jpg
'1883646481779024235',"During my 25 years in the Army, I rode in many of these. It was not that bad, but Colombian President Gustavo Petro objected when illegal immigrants were deported on military jets instead of passenger planes. Oh well🇺🇸 https://t.co/4cB2h2UKgU",en,Tweet,4,116,15,14,1951,2025-01-26 22:41:32,"<a href=""http://twitter.com/download/iphone"" rel=""nofollow"">Twitter for iPhone</a>",,,photo,https://pbs.twimg.com/media/GiQOe1LWYAAmz90.jpg
'1883624697595928821',President Trump sent a reminder to the world—you don’t mess with THE UNITED STATES! 🇺🇸,en,Tweet,3,107,12,6,2295,2025-01-26 21:14:58,"<a href=""http://twitter.com/download/iphone"" rel=""nofollow"">Twitter for iPhone</a>",,,,
'1883622792551366661',"President Trump is moving at breakneck speed and America cannot afford any delays.

@HouseGOP must immediately deliver on border security and spending cuts. The HFC Budget Reconciliation plan helps advance President Trump’s agenda.

Let’s get to work!

https://t.co/FZS7WS8o8Q",en,Tweet,1,56,6,4,1054,2025-01-26 21:07:24,"<a href=""http://twitter.com/download/iphone"" rel=""nofollow"">Twitter for iPhone</a>",,https://conservativeactionproject.com/conservatives-urge-congress-to-implement-president-trumps-agenda-without-delay/,,
'1883239017267052765',Congratulations Secretary Hegseth!,en,Tweet,1,77,10,3,2026,2025-01-25 19:42:25,"<a href=""http://twitter.com/download/iphone"" rel=""nofollow"">Twitter for iPhone</a>",,,,
'1882538827790856535',"Babies that survive abortions are miracles. 

I was proud to vote in favor of the Born Alive Abortion Survivors Protection Act today. 

Thank you @RepAnnWagner for sponsoring this important bill. 

We must never stop fighting for the rights of the unborn.",en,Tweet,0,97,19,10,1444,2025-01-23 21:20:07,"<a href=""http://twitter.com/download/iphone"" rel=""nofollow"">Twitter for iPhone</a>",,,,
'1882513985742025140',Congratulations to my friend John Ratcliffe on being confirmed as the new Director of the CIA.,en,Tweet,2,147,17,6,2532,2025-01-23 19:41:24,"<a href=""http://twitter.com/download/iphone"" rel=""nofollow"">Twitter for iPhone</a>",,,,
'1882491199082398115',"As a member of the West Point class of 1975, I am proud to introduce the MACARTHUR ACT today with @SenTedCruz. 

This important bill will enshrine DUTY HONOR COUNTRY into the West Point Mission Statement. 🇺🇸",en,Tweet,2,76,14,9,1474,2025-01-23 18:10:51,"<a href=""http://twitter.com/download/iphone"" rel=""nofollow"">Twitter for iPhone</a>",,,,
'1882490571878809898',Sign me up! Thank you for leading this important effort @RepBrianBabin,en,Tweet,3,104,25,8,1878,2025-01-23 18:08:21,"<a href=""http://twitter.com/download/iphone"" rel=""nofollow"">Twitter for iPhone</a>",,,,
'1882454739386003772',"Early dismissal for all of the “Peace Agents of Iran” infiltrating our universities &amp; schools. 

Make America SAFE again!

https://t.co/izbpPKd2YB",en,Tweet,3,84,17,11,1290,2025-01-23 15:45:58,"<a href=""http://twitter.com/download/iphone"" rel=""nofollow"">Twitter for iPhone</a>",,https://www.whitehouse.gov/presidential-actions/2025/01/protecting-the-united-states-from-foreign-terrorists-and-othernational-security-and-public-safety-threats/,,
'1882251197215895953',President Trump has tasked Pete Hegseth with restoring the warrior ethos to America’s military. Pete deserves unanimous consent from U.S. Senators!,en,Tweet,2,129,26,13,2448,2025-01-23 02:17:10,"<a href=""http://twitter.com/download/iphone"" rel=""nofollow"">Twitter for iPhone</a>",,,,
'1882195570778890688',"The passage of the Laken Riley Act is truly MONUMENTAL and vital for the safety of Americans.

The Biden administration allowed illegal aliens who committed crimes in the U.S. to stay in the U.S. to commit MORE crimes against innocent Americans like Laken Riley.

This despicable policy will end immediately under @HouseGOP and @realDonaldTrump.",en,Tweet,1,87,15,4,1629,2025-01-22 22:36:08,"<a href=""http://twitter.com/download/iphone"" rel=""nofollow"">Twitter for iPhone</a>",,,,
'1882195217128058967',"Justice will be swift for criminal illegal aliens as the passage of the Laken Riley Act moves through the House and onto President Trump’s desk.

This bill will go on to save thousands of lives from violent criminals who shouldn’t even be on American soil.",en,Tweet,2,139,25,14,1570,2025-01-22 22:34:43,"<a href=""http://twitter.com/download/iphone"" rel=""nofollow"">Twitter for iPhone</a>",,,,
'1882194907512934877',"Yep, Floridians are strongly opposed to Congress drastically expanding the SALT deduction as well.",en,Tweet,0,53,2,6,1714,2025-01-22 22:33:30,"<a href=""http://twitter.com/download/iphone"" rel=""nofollow"">Twitter for iPhone</a>",,,,
'1882164550704972138',"Texans are NOT willing to dramatically expand the SALT deduction, subsidizing wealthy taxpayers in California, New York, and New Jersey.

My constituents refuse to give more of their hard-earned dollars to fund Gavin Newsom’s woke programs and radical policies. https://t.co/iHbHJA8j5H",en,Tweet,5,403,96,23,4473,2025-01-22 20:32:52,"<a href=""http://twitter.com/download/iphone"" rel=""nofollow"">Twitter for iPhone</a>",,,video,https://video.twimg.com/amplify_video/1882164471797280768/vid/avc1/1280x720/2XmocCprx7myosYi.mp4?tag=16
