tweet_id,text,language,type,bookmark_count,favorite_count,retweet_count,reply_count,view_count,created_at,client,hashtags,urls,media_type,media_urls
'1970612663353835676',"Happy 76th birthday to the one and only Bruce @Springsteen!

The Boss is a Jersey and American hero.

Thank you for continuing to share your talent with Jersey — and Jersey with the world. https://t.co/i7DIsoVUl1",en,Tweet,0,8,0,2,999,2025-09-23 23:14:05,"<a href=""http://www.oneupapp.io"" rel=""nofollow"">OneUp App</a>",,,photo,https://pbs.twimg.com/media/G1kFxhYWoAAccON.jpg
'1970572906297012240',"Networks shouldn’t be bowing to political pressure, and politicians shouldn’t be abusing their power to silence dissent. 

This is America, and we have free speech for a reason.
https://t.co/G4EHF2yOn6",en,Tweet,0,2,2,7,941,2025-09-23 20:36:06,"<a href=""http://www.oneupapp.io"" rel=""nofollow"">OneUp App</a>",,https://www.nytimes.com/2025/09/22/business/media/jimmy-kimmel-returns-abc.html,,
'1970544115419861297',"Trump and his allies in Congress are refusing to negotiate to keep the government open.

Government funding runs out in just 7 days and millions of Americans are facing skyrocketing health care premiums because of tax credits expiring at the end of this year.

This is an avoidable crisis. We must put politics aside and work across the aisle to get this done.",en,Tweet,0,3,2,5,1379,2025-09-23 18:41:42,"<a href=""https://mobile.twitter.com"" rel=""nofollow"">Twitter Web App</a>",,,,
'1970465555967525140',"Honored to join Temple Sinai of Bergen County last night.

In light of last week’s antisemitic vandalism, where the synagogue’s Israeli flag was burned, it’s more important now than ever before that we stand together as a community and reject hate in all its forms. https://t.co/4skN8aP8uB",en,Tweet,1,59,7,12,7589,2025-09-23 13:29:32,"<a href=""http://www.oneupapp.io"" rel=""nofollow"">OneUp App</a>",,,photo,"https://pbs.twimg.com/media/G1h_98dW8AAzWxE.jpg,https://pbs.twimg.com/media/G1h_-ODWsAArn1s.jpg,https://pbs.twimg.com/media/G1h_-fJWoAAdK8G.jpg,https://pbs.twimg.com/media/G1h_-tuWYAEfEkO.jpg"
'1970237196595564822',"L’shana Tovah from my family to yours!

Wishing all who celebrate a sweet New Year! https://t.co/5WpMvD670Y",en,Tweet,0,17,2,5,1014,2025-09-22 22:22:07,"<a href=""http://www.oneupapp.io"" rel=""nofollow"">OneUp App</a>",,,photo,https://pbs.twimg.com/media/G1ewSfQX0AAiyRi.jpg
'1970220714788528585',"My full statement after the United Kingdom, Canada, Australia, France, and others formally recognized a Palestinian state: https://t.co/LfjHT9Ve6F",en,Tweet,2,132,12,50,11681,2025-09-22 21:16:37,"<a href=""http://www.oneupapp.io"" rel=""nofollow"">OneUp App</a>",,,photo,https://pbs.twimg.com/media/G1ehTJqXoAAVQ2B.jpg
'1970209407528038834',"I’m calling on House and Senate leadership to come together in a bipartisan way, fund the government, and extend the ACA premium tax credits.

We have just days before the government shuts down.

These aren’t red or blue issues — they’re pocketbook issues. Families deserve affordable health care.",en,Reply,0,0,0,1,546,2025-09-22 20:31:42,"<a href=""https://mobile.twitter.com"" rel=""nofollow"">Twitter Web App</a>",,,,
'1970209405963550983',"Across the country, 22 million families will face higher premiums, and more than 4 million Americans will lose their coverage altogether. In New Jersey, more than 180,000 residents could lose health care.

Despite all this, the far-right jammed through a reckless budget that ignored the ACA tax credits — pulling the rug out from under our hard-working families.",en,Reply,0,2,0,2,565,2025-09-22 20:31:41,"<a href=""https://mobile.twitter.com"" rel=""nofollow"">Twitter Web App</a>",,,,
'1970209404005064928',"In New Jersey, more than 454,000 residents — including 38,000 in my District — will see their @GetCoveredNJ health insurance premiums skyrocket.

The average family of four in Bergen County will see a 114% increase in their health care — more than $1,700 a month.",en,Reply,0,1,0,1,55,2025-09-22 20:31:41,"<a href=""https://mobile.twitter.com"" rel=""nofollow"">Twitter Web App</a>",,,,
'1970209400615731507',"Today, I stood with health care workers at Bergen @NewBridgeMedCtr to sound the alarm. 🚨

If Congress doesn’t act, critical Affordable Care Act premium tax credits will expire at the end of this year — and families will get crushed. 🧵 https://t.co/0zaSyC0LKE",en,Tweet,0,2,1,2,909,2025-09-22 20:31:40,"<a href=""https://mobile.twitter.com"" rel=""nofollow"">Twitter Web App</a>",,,photo,https://pbs.twimg.com/media/G1eW4cdX0AAqNQB.jpg
'1970162851558850703',"Nearly 90% of aid trucks in Gaza are diverted or looted by Hamas before reaching families in need. That’s unacceptable.

I led my colleagues in urging the UN to take action to protect its trucks by deploying peacekeepers so humanitarian aid gets to innocent Palestinians — not Hamas terrorists.",en,Tweet,3,24,6,25,2713,2025-09-22 17:26:42,"<a href=""https://mobile.twitter.com"" rel=""nofollow"">Twitter Web App</a>",,,photo,"https://pbs.twimg.com/media/G1dspCDWIAA-e66.jpg,https://pbs.twimg.com/media/G1dspCFWAAMsKQn.jpg"
'1970096286566060428',"Always great to spend time with families at St. Nicholas Church’s annual Greek Festival in Wyckoff! 🇺🇲 🇬🇷

Thanks for letting me help out in the food tent — can’t wait for next year! https://t.co/8eARUfwjx8",en,Tweet,1,8,2,6,1204,2025-09-22 13:02:11,"<a href=""http://www.oneupapp.io"" rel=""nofollow"">OneUp App</a>",,,photo,"https://pbs.twimg.com/media/G1cwHyAW8AAzW4a.jpg,https://pbs.twimg.com/media/G1cwIAuWMAAPFYM.jpg,https://pbs.twimg.com/media/G1cwISbXgAAhm2a.jpg,https://pbs.twimg.com/media/G1cwIf5WQAABPqB.jpg"
'1969870248380903777',"The #TeamGottheimer Constituent Service Team will be holding mobile office hours in Mahwah on Monday, September 22, and in Ho-Ho-Kus on Tuesday, September 23.

If you’re experiencing an issue with a federal agency, we’re here to listen & help with VA benefits, Social Security, Medicare, & much more.",en,Tweet,0,0,1,0,836,2025-09-21 22:04:00,"<a href=""http://twitter.com"" rel=""nofollow"">Twitter Web Client</a>",#TeamGottheimer,,photo,"https://pbs.twimg.com/media/G1Yru11WUAIxlYj.jpg,https://pbs.twimg.com/media/G1YrvjXX0AAWJXo.jpg"
'1969840580210381203',"NJ has the third most cases of antisemitic incidents in the country — and violence nationwide is only surging.

Our state cannot back away from the ADL’s critical work to fight hate, foster inclusivity, and protect Jewish communities through education.
https://t.co/TNeHCO4z4K",en,Tweet,0,10,1,10,868,2025-09-21 20:06:06,"<a href=""http://www.oneupapp.io"" rel=""nofollow"">OneUp App</a>",,https://jewishinsider.com/2025/09/josh-gottheimer-new-jersey-state-board-of-education-cair-adl/,,
'1969809075983564944',"It was great spending time with families this weekend at Mahwah’s 30th Annual Town Day!

Thanks to Mayor Jim Wysocki for showing me around and our first responders for keeping us safe. https://t.co/ZgbjW3NDSg",en,Tweet,0,2,1,0,677,2025-09-21 18:00:55,"<a href=""http://www.oneupapp.io"" rel=""nofollow"">OneUp App</a>",,,photo,"https://pbs.twimg.com/media/G1Yq5HsXEAA2wQm.jpg,https://pbs.twimg.com/media/G1Yq5oLWwAEaVIn.jpg,https://pbs.twimg.com/media/G1Yq6GjXQAAeB3K.jpg,https://pbs.twimg.com/media/G1Yq6nhXcAAQYrn.jpg"
'1969742433991721185',"Iran’s reign of terror threatens Israel, our allies, and the world. We must all stand together to ensure Iran does not gain access to a nuclear weapon.

I’ve long called for the UN to reinstate snapback sanctions, and I’m glad to see them follow through.
https://t.co/iTlfmhmmu7",en,Tweet,0,19,2,13,5872,2025-09-21 13:36:06,"<a href=""http://www.oneupapp.io"" rel=""nofollow"">OneUp App</a>",,https://www.washingtonpost.com/world/2025/09/19/iran-snapback-sanctions-nuclear-united-nations/a71278c4-950e-11f0-8336-4757e168ec2a_story.html,,
'1969512641782825090',"Hamas terrorists looting food meant for malnourished children proves what we’ve long known: they steal aid and starve civilians, including kids and babies.

The UN says nearly 90% of aid never arrives.

Hamas doesn’t care about children — only terror.",en,Tweet,0,28,13,9,1896,2025-09-20 22:23:00,"<a href=""https://mobile.twitter.com"" rel=""nofollow"">Twitter Web App</a>",,,,
'1969477206234562825',"If your flight gets canceled or significantly delayed because of the airline, you should be compensated.

I’m fighting to put money back in your pocket when airlines are at fault for delays and cancellations.
https://t.co/0wyjWYE49q",en,Tweet,0,4,0,0,630,2025-09-20 20:02:11,"<a href=""http://www.oneupapp.io"" rel=""nofollow"">OneUp App</a>",,https://newyork.news12.com/airlines-may-have-to-pay-cash-to-air-travelers-for-delays-and-cancellations,,
'1969431975053217943',"This week, I was proud to help pass a House resolution honoring the memory of Charlie Kirk.

There is no place for political violence in America. We must come together as a country, lower the temperature, and find ways to work together. https://t.co/OMo8lDzra5",en,Tweet,0,9,0,4,1513,2025-09-20 17:02:27,"<a href=""http://www.oneupapp.io"" rel=""nofollow"">OneUp App</a>",,,video,https://video.twimg.com/ext_tw_video/1969431878298923008/pu/vid/avc1/720x1280/AAHAvnsoker4eLrU.mp4?tag=12
'1969379530318983647',"E-bike accidents have surged 293% between 2019 and 2022 alone, and too many tragedies are happening right here in North Jersey.

My E-Bike Safety Plan ensures our children are riding safely and that bikeshare companies enforce their safety rules.
https://t.co/Db1Bod0cSe",en,Tweet,0,1,2,1,640,2025-09-20 13:34:03,"<a href=""http://www.oneupapp.io"" rel=""nofollow"">OneUp App</a>",,https://www.northjersey.com/story/news/2025/09/16/nj-congressman-s-a-f-e-ride-act-josh-gottheimer/86164491007/,,
'1969198756315758630',"Today marks two years since Azerbaijan launched an ethnic cleansing of the indigenous Christian Armenian population — forcing more than 150,000 Armenians from their ancestral homeland.

As a member of the bipartisan Congressional Armenian Caucus, I will continue to speak out about this humanitarian disaster, fight back against violence and the abuse of Armenian prisoners in Artsakh (Nagorno-Karabakh), and stand strong with the Armenian people.",en,Tweet,0,15,6,6,1143,2025-09-20 01:35:44,"<a href=""http://twitter.com/download/iphone"" rel=""nofollow"">Twitter for iPhone</a>",,,,
'1969179950533263551',"After the tragic killing of Charlie Kirk, we must do everything we can to lower the temperature and reject political violence in all forms.

FCC Chairman Carr’s actions to censor voices do just the opposite: they violate the law and undermine the very values — like freedom of speech — on which our nation was built.",en,Tweet,0,3,1,3,969,2025-09-20 00:21:00,"<a href=""http://twitter.com"" rel=""nofollow"">Twitter Web Client</a>",,,video,https://video.twimg.com/amplify_video/1969149366871961600/vid/avc1/640x360/OOCa6V64Hdfejwuh.mp4?tag=21
'1969148124519121314',"The President promised to lower costs — but today’s funding bill fails to protect hardworking families from skyrocketing health care costs.
 
If we don’t act now, critical Affordable Care Act tax credits will expire. Premiums will soar and more than 4 million families nationwide will lose health care.
 
In Jersey, more than 454,000 people — including 38,000 in the Fifth District — will see their GetCoveredNJ premiums spike.
 
Our ask is simple: extend the credits and lower health care costs for families.",en,Tweet,0,1,1,3,1012,2025-09-19 22:14:32,"<a href=""http://twitter.com/download/iphone"" rel=""nofollow"">Twitter for iPhone</a>",,,video,https://video.twimg.com/amplify_video/1969148041765552128/vid/avc1/478x854/wZ2f7DJpcE8jN8L9.mp4?tag=21
'1969035064240398540',"I was proud to meet with the @MichaelJFoxOrg to discuss how we can get more resources to support treatments and research to #EndParkinsons.

I will always fight to ensure those with Parkinson’s and their families get the support they deserve. https://t.co/ERWuWZdD5p",en,Tweet,0,10,1,3,644,2025-09-19 14:45:16,"<a href=""http://www.oneupapp.io"" rel=""nofollow"">OneUp App</a>",#EndParkinsons,,photo,https://pbs.twimg.com/media/G1Nq9MIWUAAPB9l.jpg
'1968791893011009738',"It’s horrific that three brave law enforcement officers were shot and killed in the line of duty yesterday in Pennsylvania, with two others wounded. My heart goes out to them, their families, and the entire community.

I’m praying for the families of those tragically killed and for the swift recovery of the officers injured.",en,Tweet,0,3,0,1,936,2025-09-18 22:39:00,"<a href=""http://twitter.com"" rel=""nofollow"">Twitter Web Client</a>",,,,
'1968765994735685982',"Tariffs on India — our close ally — are crushing Jersey’s small businesses and sending prices soaring.

When it comes to tariffs, we need a targeted approach that doesn’t put the bullseye on our own economy.
https://t.co/rOHUcUCHyI",en,Tweet,0,2,1,1,654,2025-09-18 20:56:05,"<a href=""http://www.oneupapp.io"" rel=""nofollow"">OneUp App</a>",,https://www.wsj.com/economy/trade/global-trade-war-comes-to-new-jerseys-little-india-182d8cbe?gaa_at=eafs&gaa_n=ASWzDAgLoVaF8Ff6CttbqOxmJ6nUZk42xnxMnfzRH8Dam-sUNgybmbi031cbJ74FFEM%3D&gaa_ts=68cad1c3&gaa_sig=w-5Rcq0V144SuLIkhC5haKb92wpdEj-lT5u4EbSYMtMgpalPRkUeiLunI8LuIC6VAl67FWSSyCbxuRLwOPSIHg%3D%3D,,
'1968703391091085425',"As someone who has had the privilege of working at the FCC, I know how vital freedom of speech and a free press are to the foundation of our democracy.

My statement after threats from @FCC Chair @BrendanCarrFCC forced the indefinite suspension of Jimmy Kimmel’s late-night show: https://t.co/YtZI8S3UDx",en,Tweet,0,7,3,8,1406,2025-09-18 16:47:19,"<a href=""http://www.oneupapp.io"" rel=""nofollow"">OneUp App</a>",,,photo,https://pbs.twimg.com/media/G1I9TRdXcAAUK0-.jpg
'1968675347597066292',"Happy 78th Birthday to the U.S. Air Force! 🇺🇸

We salute the generations of brave airmen and airwomen who have defended our country and kept our skies safe.

Here’s to many more years of service! https://t.co/k2Lif3s2Eu",en,Tweet,0,4,0,4,568,2025-09-18 14:55:53,"<a href=""http://www.oneupapp.io"" rel=""nofollow"">OneUp App</a>",,,photo,https://pbs.twimg.com/media/G1Ijy-IW4AA67rn.jpg
'1968457132942004575',My full statement after Temple Sinai’s Israeli flag was burned outside their synagogue in Tenafly: https://t.co/Heg0P6KADx,en,Tweet,0,14,4,7,1542,2025-09-18 00:28:47,"<a href=""http://www.oneupapp.io"" rel=""nofollow"">OneUp App</a>",,,photo,https://pbs.twimg.com/media/G1FdVNSWYAAsNIi.jpg
'1968427297339244771',"On this day in 1787, the United States Constitution was signed — the foundation for the greatest country in the world. 🇺🇸

We must always defend our democracy, protect our freedoms, and continue building a more perfect union. https://t.co/NH8ZnmirGU",en,Tweet,0,2,2,1,651,2025-09-17 22:30:13,"<a href=""http://www.oneupapp.io"" rel=""nofollow"">OneUp App</a>",,,photo,https://pbs.twimg.com/media/G1FCMcVXUAAjOw2.jpg
'1968380973428404320',"Today is National App Challenge Day!

The Congressional App Challenge is a great way for young innovators from across North Jersey to showcase their talent.

Do you have the next great app idea? Submit your app to the Congressional App Challenge — info here! https://t.co/ukhvB0zPCn",en,Tweet,0,0,0,1,755,2025-09-17 19:26:09,"<a href=""http://www.oneupapp.io"" rel=""nofollow"">OneUp App</a>",,,photo,https://pbs.twimg.com/media/G1EYEGZW8AAyTp3.jpg
'1968345237576687944',"Flight delays are expensive and stressful — keeping families from loved ones and causing missed work and milestones.

Families shouldn’t be left holding the bag when airlines screw up.
https://t.co/3Rm2bvtJJR",en,Tweet,0,1,0,2,459,2025-09-17 17:04:09,"<a href=""http://www.oneupapp.io"" rel=""nofollow"">OneUp App</a>",,https://pix11.com/news/local-news/new-bill-would-require-cash-payment-for-delayed-flights/?nxsparam=5,,
'1968284320780456154',"It was great to meet with @United CEO Scott Kirby last week.

With Newark as a critical hub, United plays a key part in Jersey’s economy — supporting many jobs and businesses.

I’ll keep working to ensure safe, reliable service for our families. https://t.co/hln5grsDGf",en,Tweet,0,0,0,1,735,2025-09-17 13:02:05,"<a href=""http://www.oneupapp.io"" rel=""nofollow"">OneUp App</a>",,,photo,https://pbs.twimg.com/media/G1DAKBaXkAAVOg5.jpg
'1968075567086882992',"If your flight is canceled or significantly delayed because of the airline, you deserve compensation — not a voucher you may never use.

I’m fighting to guarantee cash compensation for your time and to protect Jersey families from costly travel delays. https://t.co/0zEuNIGlS4",en,Tweet,0,6,1,2,674,2025-09-16 23:12:34,"<a href=""http://www.oneupapp.io"" rel=""nofollow"">OneUp App</a>",,,video,https://video.twimg.com/ext_tw_video/1968075462720036864/pu/vid/avc1/1280x720/DWnlZF4EfOmAlPtc.mp4?tag=12
'1968034697088258542',"Happy #NationalVoterRegistrationDay!

Registering to vote and updating your voter registration information are the first steps to making your voice heard in critical upcoming elections in NJ.

Register to vote at https://t.co/hBs5kzQUKM https://t.co/qx6SfeKyP0",en,Tweet,0,0,0,2,647,2025-09-16 20:30:10,"<a href=""http://www.oneupapp.io"" rel=""nofollow"">OneUp App</a>",#NationalVoterRegistrationDay,https://vote.gov,photo,https://pbs.twimg.com/media/G0_dIMUXYAAJuQW.png
'1967999271191400840',"Families are starting to see the effects of Trump’s reckless, cost-increasing tariffs.

It’s simple: tariffs are a TAX on hardworking Jersey families.
https://t.co/cCEYdM33wy",en,Tweet,0,1,1,1,541,2025-09-16 18:09:24,"<a href=""http://www.oneupapp.io"" rel=""nofollow"">OneUp App</a>",,https://www.cnbc.com/2025/09/11/trumps-tariffs-are-slowly-finding-their-way-into-consumer-prices.html,,
'1967945624072106145',"Second, I’m urging the U.S. Department of Transportation to stand by passengers and ensure they receive compensation for delayed flights.

Finally, I’m calling on the major airlines to sit down with me and other Members of Congress to strengthen consumer protections.",en,Reply,0,0,0,0,389,2025-09-16 14:36:14,"<a href=""https://mobile.twitter.com"" rel=""nofollow"">Twitter Web App</a>",,,,
'1967945622155301300',"The ETA Act will require automatic cash compensation — not vouchers —  for delays caused solely by the airline of more than 3 hours.

This means cash back in your wallets for the costs and headaches caused by airline mistakes.",en,Reply,0,0,0,2,389,2025-09-16 14:36:13,"<a href=""https://mobile.twitter.com"" rel=""nofollow"">Twitter Web App</a>",,,,
'1967945620716654796',"First, families and business travelers deserve real compensation when they face massive delays caused by an airline.

My Enhancing Transparency from Airlines — or ETA Act — will set new rules of the sky so that no Administration can just roll them back.",en,Reply,0,0,0,1,31,2025-09-16 14:36:13,"<a href=""https://mobile.twitter.com"" rel=""nofollow"">Twitter Web App</a>",,,,
'1967945618136903812',"Flight delays cost families and businesses billions of dollars each year — not including time away from loved ones or missed work.

Travelers shouldn’t be left holding the bag when airlines screw up.

That’s why I’m announcing new action to protect families from costly airline-caused delays ⬇️",en,Tweet,0,0,0,4,566,2025-09-16 14:36:12,"<a href=""https://mobile.twitter.com"" rel=""nofollow"">Twitter Web App</a>",,,photo,"https://pbs.twimg.com/media/G0-L35FWgAAUGFO.jpg,https://pbs.twimg.com/media/G0-L6C_W0AAqg6V.jpg,https://pbs.twimg.com/media/G0-L6C5W0AAecMJ.jpg,https://pbs.twimg.com/media/G0-L6C2XkAERZZS.jpg"
'1967719106406121540',"Happy Hispanic Heritage Month!

This month, we celebrate the many contributions of the Hispanic community — especially here in North Jersey.

Our nation is strongest when we come together to celebrate the diversity and rich culture of all of our neighbors! https://t.co/iozO9uutmg",en,Tweet,0,3,1,6,951,2025-09-15 23:36:08,"<a href=""http://www.oneupapp.io"" rel=""nofollow"">OneUp App</a>",,,photo,https://pbs.twimg.com/media/G06-GXeWkAAiboB.jpg
'1967697400203714614',"Any TikTok deal must comply with the bipartisan law that Congress passed last year: no Chinese ownership, no influence by the Chinese Communist Party.

President Trump must follow the law to protect Americans and safeguard our national security.",en,Tweet,0,3,0,5,1424,2025-09-15 22:09:52,"<a href=""https://mobile.twitter.com"" rel=""nofollow"">Twitter Web App</a>",,,,
'1967662201264623655',"Senator @ChrisVanHollen and @SenJeffMerkley's report on Gaza is outright wrong.

Israel is fighting Hamas, a terror group that steals aid and hides behind civilians.

Calling this “collective punishment” distorts reality — Israel is at war with an enemy that hides among 2 million people without regard for their lives. Civilians are suffering, which is why we must surge protected aid.

The UN admits up to 90% of its aid never reaches civilians — I saw it firsthand at the Gaza border, where food piles up without a plan to ensure delivery. That’s why I called on the UN in a recent op-ed to work alongside GHF to protect its aid and get food directly to families faster, not Hamas fighters.

Senators Van Hollen and Merkley should use their roles to advance a better future for Israelis and Palestinians. Claims of “ethnic cleansing” are false and do nothing to change the situation on the ground.",en,Tweet,21,381,108,109,40573,2025-09-15 19:50:00,"<a href=""https://mobile.twitter.com"" rel=""nofollow"">Twitter Web App</a>",,,,
'1967621457598415347',"I stood with our incredible coaches and nonprofits in New Milford and announced the bipartisan PLAY Act to provide tax credits for families to lower the cost of rec sports.

Parents shouldn’t have to pay more than $1000/year on just one child’s sports.
https://t.co/jZImXtucde",en,Tweet,0,0,1,4,692,2025-09-15 17:08:06,"<a href=""http://www.oneupapp.io"" rel=""nofollow"">OneUp App</a>",,https://pix11.com/news/local-news/nj-congressman-pushing-for-more-affordable-youth-sports/,,
'1967560781408489754',"Our commitment to the remaining American and Israeli hostages and their families must be clear: we never leave anyone behind.

I was honored to host a roundtable last week with released hostage, Raz Ben Ami, and families of hostages still held by Hamas terrorists.

I will keep fighting until every hostage is brought home.",en,Tweet,1,112,21,27,18058,2025-09-15 13:07:00,"<a href=""http://twitter.com"" rel=""nofollow"">Twitter Web Client</a>",,,photo,"https://pbs.twimg.com/media/G02ltvcW0AATZ8o.jpg,https://pbs.twimg.com/media/G02ltu2WQAEvTM7.jpg,https://pbs.twimg.com/media/G02ltvOWUAA1EmP.jpg,https://pbs.twimg.com/media/G02ltvhWoAAiufL.jpg"
'1967318778217107563',"Every child in Jersey deserves the chance to play rec sports — not forced to watch from the sidelines because of rising costs.

I’m proud to lead the bipartisan PLAY Act to provide tax credits to families to lower the cost of rec sports. https://t.co/gRVGwLmaiE",en,Tweet,0,2,1,9,716,2025-09-14 21:05:22,"<a href=""http://www.oneupapp.io"" rel=""nofollow"">OneUp App</a>",,,video,https://video.twimg.com/ext_tw_video/1967318483206610944/pu/vid/avc1/1280x720/PqZQ4Ds81Pe2TMx_.mp4?tag=12
'1967266089370284104',"Following the September 11th attacks, many New Jersey first responders have died from exposure to undetected toxins from assisting in emergency response efforts at Ground Zero.

@RepMenendez and I are calling for all their names to be honored on Liberty State Park's Empty Sky 9/11 Memorial, alongside the nearly 750 brave souls from New Jersey tragically killed that day.

We must always get the backs of our brave first responders.",en,Tweet,0,4,0,2,996,2025-09-14 17:36:00,"<a href=""http://twitter.com"" rel=""nofollow"">Twitter Web Client</a>",,,photo,https://pbs.twimg.com/media/G0vYotuWMAAxFsl.jpg
'1967201195061072351',"It was great to meet @Yankees owner Hal Steinbrenner in the Capitol this week to talk about the best baseball team in the nation and their many fans in New Jersey!

Let’s go, Yankees! https://t.co/zZQutKNfe4",en,Tweet,1,8,0,7,950,2025-09-14 13:18:08,"<a href=""http://www.oneupapp.io"" rel=""nofollow"">OneUp App</a>",,,photo,https://pbs.twimg.com/media/G0znD_IW8AAokab.jpg
'1966993384293249156',"The average family now spends more than $1000/year on just one sport for one child — a 46% jump since 2019.

Too many parents are priced out, and too many kids are missing out.

My bipartisan PLAY Act will help families afford rec sports and keep our children active and healthy. https://t.co/P7EO9x8psB",en,Tweet,0,5,0,8,785,2025-09-13 23:32:22,"<a href=""http://www.oneupapp.io"" rel=""nofollow"">OneUp App</a>",,,video,https://video.twimg.com/ext_tw_video/1966993315091390464/pu/vid/avc1/1280x720/9tUZgkhjjR2LPuvS.mp4?tag=12
'1966957691487527266',"I announced my new E-Bike Safety Plan to help keep our children safe as e-bike use surges.

We can’t ignore the alarming rise in accidents. It’s time for us to put safeguards in place to protect kids and families. https://t.co/O06AFnzdxq",en,Tweet,0,6,0,2,1032,2025-09-13 21:10:32,"<a href=""http://www.oneupapp.io"" rel=""nofollow"">OneUp App</a>",,,video,https://video.twimg.com/ext_tw_video/1966957576681074688/pu/vid/avc1/1280x720/8SEZcQE6ZzFEhO-A.mp4?tag=12
'1966936417365618717',"I successfully fought to claw back $625 million in federal investments to help our local law enforcement keep fans, players, and families safe during the 2026 FIFA World Cup.

Six games — including the final — are being played in Jersey next year.

Our security is not a ball we can just kick down the field.",en,Tweet,0,5,0,5,1533,2025-09-13 19:46:00,"<a href=""http://twitter.com"" rel=""nofollow"">Twitter Web Client</a>",,,,
