tweet_id,text,language,type,bookmark_count,favorite_count,retweet_count,reply_count,view_count,created_at,client,hashtags,urls,media_type,media_urls
'1889730599687999844',"This budget brought by House Republicans is nothing short of madness. It guts Medicaid, education, and healthcare to hand out $4.5 trillion in tax breaks for billionaires. It is a cruel and reckless attack on the very people Congress is supposed to serve. The plan slashes $1.5 trillion in spending over the next decade, with deep cuts to Medicaid that could strip patients of their benefits and force states to shoulder higher costs.

When it comes to addressing the everyday challenges Americans face, such as paying for rent, groceries, and gas, this budget proposal does nothing to prioritixe their needs. Instead, it places extreme policies above what truly matters.",en,Tweet,1,17,8,4,2052,2025-02-12 17:37:39,"<a href=""http://twitter.com/download/iphone"" rel=""nofollow"">Twitter for iPhone</a>",,,photo,https://pbs.twimg.com/media/Gjmr9zOWYAArlK0.jpg
'1889672462079586589',"Check out last week’s recap video. Also, thank you to everyone who joined our telephone town hall last night to share your thoughts, questions, and concerns. 

Remember, you are not alone—we are in this together. https://t.co/7N4tkdYPWu",en,Tweet,0,4,1,0,394,2025-02-12 13:46:38,"<a href=""http://twitter.com/download/iphone"" rel=""nofollow"">Twitter for iPhone</a>",,,video,https://video.twimg.com/amplify_video/1889672382886944768/vid/avc1/960x540/nyjrZfPiiFLpqg4f.mp4?tag=16
'1889485089802711187',"Tune in to my first tele-townhall event. 

Please note this streaming will have audio only. 

To participate, please dial 833-922-3153. 

#WeAreTX18
https://t.co/m4YzsMgZEI",en,Tweet,0,6,3,0,590,2025-02-12 01:22:05,"<a href=""https://mobile.twitter.com"" rel=""nofollow"">Twitter Web App</a>",#WeAreTX18,https://x.com/i/broadcasts/1RDGlzeODDMxL,,
'1889334560371954078',"🚨Happening now🚨

I am currently attending the Homeland Security Committee’s Subcommittee Meeting on Transportation and Maritime Security hearing. 

You can watch today’s hearing on the Homeland Security’s YouTube page: https://t.co/rtIoKVhMRp https://t.co/xX55ygkCED",en,Tweet,0,5,1,0,393,2025-02-11 15:23:55,"<a href=""http://twitter.com/download/iphone"" rel=""nofollow"">Twitter for iPhone</a>",,https://www.youtube.com/live/-0mGRoa2u-U?si=CGdZJPxC1wuFMhId,photo,"https://pbs.twimg.com/media/GjhDxSaW4AEO1oA.jpg,https://pbs.twimg.com/media/GjhDxSaWMAAEn8l.jpg"
'1889134150684496202',"Please join me for a Telephone Town Hall tomorrow night.

📅 Date: Tuesday, February 11th 
⏰ Time: 6:45 PM Central 

There’s a lot happening so quickly, and I want to hear directly from YOU.

Click the link below to sign up. 
https://t.co/QIMFrFHuwz https://t.co/Galb02DTQU",en,Tweet,2,6,0,1,5026,2025-02-11 02:07:34,"<a href=""http://twitter.com/download/iphone"" rel=""nofollow"">Twitter for iPhone</a>",,http://sylvesterturner.house.gov/live,video,https://video.twimg.com/amplify_video/1889133964889067520/vid/avc1/720x1280/iIYRYu9mVG7VFpiK.mp4?tag=16
'1889064284111659453',"Have you signed up for my Telephone Townhall taking place on Tuesday, February 11th, at 6:45 PM Central Time?  

If you haven’t, click the link below! 

I want to hear directly from the constituents of the 18th Congressional District about the issues that matter most to you.

https://t.co/oKNTQx9XDN",en,Tweet,0,4,0,0,259,2025-02-10 21:29:57,"<a href=""http://twitter.com/download/iphone"" rel=""nofollow"">Twitter for iPhone</a>",,,photo,"https://pbs.twimg.com/media/GjdN9EoXYAAQ__O.jpg,https://pbs.twimg.com/media/GjdN9EpWsAAg9C5.jpg"
'1888977289066545612',"I am currently joining Harris County Precinct One Commissioner Rodney Ellis, Harris County Attorney Christian Menefee, Fifth Ward Community leaders and others on a news conference highlighting EPA Testing results at Julia C. Hester House.",en,Tweet,0,5,1,0,469,2025-02-10 15:44:15,"<a href=""http://twitter.com/download/iphone"" rel=""nofollow"">Twitter for iPhone</a>",,,,
'1888816102387441913',"During my Science, Space, and Technology Committee, I emphasized addressing inequities in K-12 STEM education by expanding access, securing funding for HBCUs and other underrepresented institutions, and creating pathways into STEM careers to keep America globally competitive. https://t.co/eHr5fGDKsL",en,Tweet,0,10,2,1,594,2025-02-10 05:03:45,"<a href=""http://twitter.com/download/iphone"" rel=""nofollow"">Twitter for iPhone</a>",,,video,https://video.twimg.com/amplify_video/1888815540191277056/vid/avc1/1920x1080/GHD6A2x-o46vOVFm.mp4?tag=16
'1888686310199906751',"Last week, during my Homeland Security Committee hearing, I addressed the growing cybersecurity crisis. 

With 500,000 jobs unfilled, we must act now to train our workforce and recruit talent from all backgrounds, including HBCUs and technical schools, to protect sensitive information and strengthen our defenses.

@HomelandDems",en,Tweet,0,7,4,3,1049,2025-02-09 20:28:01,"<a href=""http://twitter.com/download/iphone"" rel=""nofollow"">Twitter for iPhone</a>",,,video,https://video.twimg.com/amplify_video/1888685574036320257/vid/avc1/1920x1080/JFILUyI9dyA-IG_N.mp4?tag=16
'1888311186359251437',"Join me for a Telephone Town Hall on Tuesday, February 11th at 6:45 PM CT to ensure your voice is heard. 

We’ll discuss President Trump’s recent executive orders and their impact on immigration, opportunity, and the economy.  

Dial-in: (833) 922-3153  
Stream live: https://t.co/oKNTQx9pOf  

Streaming also available on Facebook, X (formerly Twitter), YouTube, and Instagram: @repsturner",en,Tweet,0,3,1,0,342,2025-02-08 19:37:24,"<a href=""http://twitter.com/download/iphone"" rel=""nofollow"">Twitter for iPhone</a>",,,photo,https://pbs.twimg.com/media/GjShBAAWgAA1Lm9.jpg
'1888041115179434148',"This week, I introduced my first bill, the DHS Cybersecurity On-the-Job Training Program Act, with bipartisan support from @RepLuttrell. 

This legislation strengthens our nation’s defenses by equipping DHS employees with the skills to address critical cybersecurity needs and growing threats to our national security.",en,Tweet,0,15,5,3,2772,2025-02-08 01:44:14,"<a href=""http://twitter.com/download/iphone"" rel=""nofollow"">Twitter for iPhone</a>",,,video,https://video.twimg.com/amplify_video/1888040937747582977/vid/avc1/1280x720/Vvz47oSPkZAhcAAY.mp4?tag=16
'1887922975758000194',"No surprise that President Trump and Co-President Musk want to shut down the Department of Education. Their plan would cut funding for low-income families, students with disabilities, and public schools while dividing us by targeting diversity. How does this help families struggling with groceries or rent? It doesn’t. 

This isn’t about helping Americans, it’s about stripping protections and opportunities. We won’t put the future of our children in the hands of Trump and Elon Musk.",en,Tweet,0,11,2,3,1904,2025-02-07 17:54:47,"<a href=""http://twitter.com/download/iphone"" rel=""nofollow"">Twitter for iPhone</a>",,,photo,https://pbs.twimg.com/media/GjM_8NaXIAA41IM.jpg
'1887844418952069143',"My heart is with the 10 souls onboard the missing flight in Alaska and their families. 

Thinking of the brave rescue teams working tirelessly.",en,Tweet,0,6,0,0,706,2025-02-07 12:42:38,"<a href=""http://twitter.com/download/iphone"" rel=""nofollow"">Twitter for iPhone</a>",,,,
'1887739575189078151',"I stood with my colleagues as we condemned President Trump for pardoning the rioters involved in the January 6th attack. 

We stand united to uphold justice and safeguard the foundation of our democracy. https://t.co/6pY9nscns4",en,Tweet,0,16,4,1,1721,2025-02-07 05:46:01,"<a href=""http://twitter.com/download/iphone"" rel=""nofollow"">Twitter for iPhone</a>",,,photo,"https://pbs.twimg.com/media/GjKZI4FWwAA1c45.jpg,https://pbs.twimg.com/media/GjKZI4EWIAA53up.jpg,https://pbs.twimg.com/media/GjKZI4FWgAIJk-1.jpg"
'1887620781733188081',"Joining my Democratic colleagues to back the Taxpayer Data Protection Act. We're fighting to protect your privacy and stop reckless efforts to let billionaire tech guy Elon Musk access your confidential records, threatening Social Security & Medicare. Not now, not ever.

@WhipKClark 
@HouseDemocrats",en,Tweet,0,7,3,7,1941,2025-02-06 21:53:59,"<a href=""http://twitter.com/download/iphone"" rel=""nofollow"">Twitter for iPhone</a>",,,photo,"https://pbs.twimg.com/media/GjIrGXEX0AAhNr4.jpg,https://pbs.twimg.com/media/GjIrGXHX0AAK35e.jpg"
'1887285765048009043',"Today, I rose to speak in unwavering support of our nation’s federal employees, including the thousands in Texas’ 18th Congressional District. 

America needs its federal workforce, and we will continue to stand firm in protecting their rights, jobs, and dedication to public service.

@Labor_Caucus",en,Tweet,1,15,6,5,2123,2025-02-05 23:42:45,"<a href=""http://twitter.com/download/iphone"" rel=""nofollow"">Twitter for iPhone</a>",,,video,https://video.twimg.com/amplify_video/1887283746967101440/vid/avc1/1280x720/2mY72AsoVKEErP8w.mp4?tag=16
'1887228107716989048',"Today, along with Ranking Member on Homeland Security, Congressman Bennie Thompson, and my other colleagues, we sent a letter to the Office of Management and Budget (OMB) demanding that the administration adhere to all Federal data protection laws. 

This recent overreach by Elon Musk and (DOGE) is potential violation of Federal law and raises serious national security concerns that must be addressed immediately.

@HomelandDems",en,Tweet,1,10,3,5,800,2025-02-05 19:53:38,"<a href=""http://twitter.com/download/iphone"" rel=""nofollow"">Twitter for iPhone</a>",,,photo,"https://pbs.twimg.com/media/GjC-QwNXUAA_S5v.jpg,https://pbs.twimg.com/media/GjC-QwNWoAAJpQ-.jpg"
'1887192867573043638',"Homeland Security Committee Hearing: Preparing the Pipeline: Examining the State of America’s Cyber Workforce. 

Watch now on YouTube:

https://t.co/CktMLZ7n0Z https://t.co/HnRhVHlS2E",en,Tweet,0,5,0,0,434,2025-02-05 17:33:36,"<a href=""http://twitter.com/download/iphone"" rel=""nofollow"">Twitter for iPhone</a>",,https://www.youtube.com/live/pbR8tNXTytE?si=1unywFgJZ9J2lVqa,photo,https://pbs.twimg.com/media/GjCmEzaWMAALLrO.jpg
'1887166026598453425',"Join me live for the Committee on Science, Space, and Technology hearing: The State of U.S. Science and Technology: Ensuring America’s Global Leadership. 

Tune in now on YouTube: 

https://t.co/Gz33JFgdnO https://t.co/GxIBlYSTS8 https://t.co/XFsOlRsZbc",en,Tweet,0,6,1,0,612,2025-02-05 15:46:57,"<a href=""https://buffer.com"" rel=""nofollow"">Buffer</a>",,"https://buff.ly/42I2EBm,https://buff.ly/3EmKJWO",photo,https://pbs.twimg.com/media/GjCPf_4WUAAAuxK.jpg
'1886982174840095126',"Who elected this tech billionaire Elon Musk, and why is he so focused on dismantling agencies and gaining access to millions of Americans' private and financial information? https://t.co/2RPRVkIOM6",en,Tweet,8,63,25,236,68367,2025-02-05 03:36:23,"<a href=""http://twitter.com/download/iphone"" rel=""nofollow"">Twitter for iPhone</a>",,,video,https://video.twimg.com/amplify_video/1886981901270818816/vid/avc1/1080x1920/mNsfsd54jYrxydsr.mp4?tag=16
'1886980977466958121',"I join countless others across our nation and the world in extending my heartfelt condolences to the family and the @TheIsmaili community on the passing of His Highness Prince Mawlana Shah Karim Al-Hussaini, the Aga Khan IV.

I had the honor of meeting His Highness in 2018, a meaningful encounter that led to the decision to establish the 8th Ismaili Center in the heart of Houston.",en,Tweet,13,618,68,11,23153,2025-02-05 03:31:38,"<a href=""http://twitter.com/download/iphone"" rel=""nofollow"">Twitter for iPhone</a>",,,photo,"https://pbs.twimg.com/media/Gi_nMrJWIAAw0pG.jpg,https://pbs.twimg.com/media/Gi_nMrJXsAAgtMp.jpg"
'1886872738402386368',"Rosa Parks, on your birthday, we honor your courage and unshakable stand for justice. By refusing to give up your seat, you showed the world that change begins with one bold act.  

Thank you for inspiring us to fight for equality and justice. https://t.co/zrTVlMuHJK",en,Tweet,0,6,2,0,526,2025-02-04 20:21:31,"<a href=""https://buffer.com"" rel=""nofollow"">Buffer</a>",,,photo,https://pbs.twimg.com/media/Gi-EwMPWkAEK2Q8.jpg
'1886791731510640968',"Elon Musk, Trump’s top donor, now wields unchecked power with access to $6 trillion in Treasury funds, no hearings, no oversight. This is a blatant power grab, and Democrats won’t stay silent as Americans are robbed of their security.",en,Tweet,0,4,1,5,460,2025-02-04 14:59:38,"<a href=""http://twitter.com/download/iphone"" rel=""nofollow"">Twitter for iPhone</a>",,,,
'1886571098780643777',"President Trump’s tariffs are nothing more than a hidden tax on hardworking families who are already struggling to make ends meet. These tariffs, essentially a Trump Tax, will raise the cost of food, housing, gas, and cars, all of which are essentials that families depend on every single day. 

For example, the price of groceries like avocados and maple syrup will go up. Building a home or buying a car will become more expensive. Even gas prices could rise because these tariffs disrupt supply chains. Families trying to get by will feel the squeeze, and for what? These tariffs do not protect American workers; they punish American consumers. What happened to helping the American people? These tariffs do the opposite. 

They make it harder for families to put food on the table, keep a roof over their heads, and afford basic transportation. This Trump Tax is not what voters expected or deserved. President Trump and his Republican allies need to stop ripping off hardworking taxpayers. Families need relief, not higher prices on everything they rely on just to live.",en,Tweet,1,5,1,0,407,2025-02-04 00:22:55,"<a href=""http://twitter.com/download/iphone"" rel=""nofollow"">Twitter for iPhone</a>",,,photo,https://pbs.twimg.com/media/Gi5s6JrXIAI7V6v.jpg
'1886231356323123415',"Earlier this week, I was honored to join the Shandong Fellowship Association of Southern USA’s Annual Gala. The Chinese community plays a vital role in shaping Houston’s diverse culture. https://t.co/m2IP3dyAQF",en,Tweet,0,5,0,0,375,2025-02-03 01:52:54,"<a href=""http://twitter.com/download/iphone"" rel=""nofollow"">Twitter for iPhone</a>",,,photo,"https://pbs.twimg.com/media/Gi08d16X0AE9Zvq.jpg,https://pbs.twimg.com/media/Gi08d13XMAABvyc.jpg,https://pbs.twimg.com/media/Gi08d12WoAAfW9-.jpg"
'1886089663825297918',"The revelation that Elon Musk’s Department of Government Efficiency (DOGE) has been granted access to sensitive Treasury systems is alarming and unacceptable. How was an unelected billionaire allowed to gain control of critical taxpayer data?

Social Security and Medicare systems are lifelines for millions of Americans, not tools for private interests or political agendas. This reckless decision jeopardizes the privacy and security of our citizens and undermines trust in our government.  

The American people deserve answers, accountability, and a government that prioritizes their interests, not the ambitions of the wealthy and powerful.",en,Tweet,2,20,6,8,1008,2025-02-02 16:29:52,"<a href=""https://buffer.com"" rel=""nofollow"">Buffer</a>",,,photo,https://pbs.twimg.com/media/Giy8jbpXoAAeXj5.jpg
'1885855330736750707',"Thank you to everyone who joined us at yesterday’s press conference. Now more than ever, we must remain united as our communities are being unjustly targeted by President Trump and his administration. https://t.co/VtIKKdfy2I",en,Tweet,3,26,15,160,6643,2025-02-02 00:58:43,"<a href=""http://twitter.com/download/iphone"" rel=""nofollow"">Twitter for iPhone</a>",,,photo,"https://pbs.twimg.com/media/GivnaZoWgAAuvDi.jpg,https://pbs.twimg.com/media/GivnaZmWYAA37GY.jpg,https://pbs.twimg.com/media/GivnaZqXMAAx0tB.jpg,https://pbs.twimg.com/media/GivnaZoXwAAnsgU.jpg"
'1885721855895404710',"February is #BlackHistoryMonth, a time to honor and celebrate African Americans. These individuals are the heroes and leaders of our communities who have paved the way for all of us. 

Their sacrifices and breakthroughs are an integral part of American history, and we recognize their contributions and achievements with gratitude and pride.",en,Tweet,0,7,2,0,363,2025-02-01 16:08:20,"<a href=""https://buffer.com"" rel=""nofollow"">Buffer</a>",#BlackHistoryMonth,,photo,https://pbs.twimg.com/media/GituCLdX0AEO-hg.jpg
'1885457488809517548',"During today’s press conference, I pushed back against President Trump’s recent executive orders on DEI and Immigration because they are dangerous and divisive to our communities. 

Let me be clear: we will not back down or abandon the communities we are here to protect. https://t.co/6w6AGr4TCA",en,Tweet,2,34,11,101,5021,2025-01-31 22:37:50,"<a href=""http://twitter.com/download/iphone"" rel=""nofollow"">Twitter for iPhone</a>",,,video,https://video.twimg.com/amplify_video/1885456496810479616/vid/avc1/1280x720/3eEWZT1dDkH5RukE.mp4?tag=16
'1885358098971603147',Press Conference on President Trump's Recent Executive Orders https://t.co/oW0RVq7un6,en,Tweet,3,6,2,3,1928,2025-01-31 16:02:53,"<a href=""https://periscope.tv"" rel=""nofollow"">Periscope</a>",,https://x.com/i/broadcasts/1BRKjwglRXWGw,,
'1885136834226778611',"Proud to have attended @RepSylviaGarcia “Know Your Rights” Town Hall last night. 

It’s so important that we stay informed with accurate information regarding President Trump’s immigration policy. https://t.co/HZzbCspTpr",en,Tweet,1,16,3,1,2226,2025-01-31 01:23:40,"<a href=""http://twitter.com/download/iphone"" rel=""nofollow"">Twitter for iPhone</a>",,,photo,"https://pbs.twimg.com/media/GilZ9ajXIAES9gU.jpg,https://pbs.twimg.com/media/GilZ9ajXwAAAmd2.jpg,https://pbs.twimg.com/media/GilZ9ajWIAAyLAW.jpg"
'1884806692254154970',"The midair collision over the Potomac River is truly devastating. My heart and prayers are with everyone involved and their families. 

Thank you to the first responders who are on the scene during this tragic time.",en,Tweet,0,3,1,0,573,2025-01-30 03:31:48,"<a href=""http://twitter.com/download/iphone"" rel=""nofollow"">Twitter for iPhone</a>",,,,
'1884791939452596294',"This Friday at 10 AM Central, I’m holding a Press Conference at the Mickey Leland Federal Building. 

I’ll address President Trump’s recent executive orders and their impact on Houston, including immigration, equity, and other key issues. https://t.co/zMaoDXL6dr",en,Tweet,0,2,0,0,316,2025-01-30 02:33:10,"<a href=""http://twitter.com/download/iphone"" rel=""nofollow"">Twitter for iPhone</a>",,,photo,https://pbs.twimg.com/media/GiggR1AXYAAStOq.jpg
'1884675486556537265',"The Trump administration backed down from its reckless federal funding freeze, but not before throwing the country into unnecessary turmoil. 

We will continue fighting for the American people! https://t.co/Q7nuwolabE",en,Tweet,0,3,1,0,288,2025-01-29 18:50:26,"<a href=""https://buffer.com"" rel=""nofollow"">Buffer</a>",,,photo,https://pbs.twimg.com/media/Gie2Xc_WAAAEXpy.jpg
'1884634117184045462',"🔊 We are not going to stand down! 🔊

We won’t sacrifice the values of hardworking Americans or leave anyone behind!  

Thank you, @JulieMasonShow1 and @siriusxm, for having me on to discuss the challenges we face and the path forward. https://t.co/ozmCL1Fwa1",en,Tweet,0,6,2,1,1379,2025-01-29 16:06:03,"<a href=""http://twitter.com/download/iphone"" rel=""nofollow"">Twitter for iPhone</a>",,,video,https://video.twimg.com/amplify_video/1884633888854835200/vid/avc1/1080x1920/zxkfH7wgQrPgGfvQ.mp4?tag=16
'1884612680989765947',"Happy Lunar New Year!

Wishing you and your loved ones a bright and hopeful year ahead. https://t.co/r2b91BOG9N",en,Tweet,0,6,3,0,1116,2025-01-29 14:40:52,"<a href=""https://buffer.com"" rel=""nofollow"">Buffer</a>",,,photo,https://pbs.twimg.com/media/Gid9PkRXgAAsp84.jpg
'1884387114151706709',"Statement from Congressman Sylvester Turner on the Federal Funding Freeze

The Trump administration’s federal funding freeze threatens critical resources for Texas’ 18th Congressional District, putting Houston families, students, small businesses, and veterans at risk. This reckless action jeopardizes funding for education, healthcare, disaster relief, and public safety—programs that are essential to our community.

In Houston, this freeze could leave families struggling to feed their children and pay for housing. Programs like Head Start and Title I grants, which provide vital support to local schools, would face devastating disruptions. Universities across Houston, especially our historically Black colleges and universities (HBCUs), could lose critical funding for education and job training.

Small businesses, many still recovering from past disasters, would lose access to loans and grants, while public safety funding for law enforcement and firefighters could be halted. Disaster relief from FEMA and healthcare funding for community health centers, life-saving medical research, and mental health services like the 988 Suicide Lifeline would also be at risk.

This unconstitutional freeze undermines Congress’ authority and creates unnecessary chaos for Houstonians who depend on these resources.",en,Tweet,1,13,5,3,1843,2025-01-28 23:44:32,"<a href=""https://buffer.com"" rel=""nofollow"">Buffer</a>",,,photo,https://pbs.twimg.com/media/GiawF9kWwAAYOq-.jpg
'1883955891596099932',"Today, I joined @CNN Newsroom's Jim Acosta to discuss the implementation of President Trump’s Immigration Executive Orders in Texas. I believe there is bipartisan support to secure the border and deport persons who have committed serious or violent crimes. 

At the same time, it is critical to protect law-abiding individuals who contribute so much to our society from being unjustly targeted in raids and deported. We have to give Dreamers the opportunity to stay and thrive in this country, which they call home.",en,Tweet,1,18,7,3,2502,2025-01-27 19:11:01,"<a href=""http://twitter.com/download/iphone"" rel=""nofollow"">Twitter for iPhone</a>",,,video,https://video.twimg.com/amplify_video/1883955776361820160/vid/avc1/960x540/FtIPcdRC6JHD-lbb.mp4?tag=16
'1883922531448500427',"On International Holocaust Remembrance Day 
We commemorate the six million Jews and millions of others who were murdered during the Holocaust.  

By remembering, we commit to standing against prejudice and building a future of tolerance and peace. https://t.co/oGSbX2Gh8J",en,Tweet,0,5,1,0,266,2025-01-27 16:58:27,"<a href=""https://buffer.com"" rel=""nofollow"">Buffer</a>",,,photo,https://pbs.twimg.com/media/GiUJjr9XQAAGqWp.jpg
'1883355445265363126',The Tuskegee Airmen and Women Airforce Service Pilots broke barriers and made invaluable contributions to our military and our nation. Removing these videos diminishes their legacy and deprives service members of critical lessons in courage and perseverance. I urge President Trump to restore these materials to ensure their sacrifices are honored.,en,Tweet,0,13,4,1,3240,2025-01-26 03:25:03,"<a href=""http://twitter.com/download/iphone"" rel=""nofollow"">Twitter for iPhone</a>",,,,
'1883343938049982770',"My Statement on President Trump’s First Week in Office:

“President Trump’s first week in office has set a dangerous course for our nation. From rolling back diversity, equity, and inclusion initiatives to pardoning January 6th insurrectionists and enacting divisive immigration policies, these actions undermine core American values and threaten our democracy. 

The elimination of diversity programs in federal agencies and the return to outdated hiring practices jeopardize decades of progress toward fairness and equal opportunity. Diversity is not a threat—it is a cornerstone of America’s strength and unity. 

The pardons granted to January 6th insurrectionists send a deeply troubling message about accountability and justice. Similarly, President Trump’s challenge to the Constitution regarding the citizenship of American-born children of immigrants undermines the principles of equality and inclusion that define our nation. These actions threaten millions of families and weaken the foundation of what made this country great. 

The administration’s environmental actions, including withdrawing from the Paris Climate Agreement and dismantling critical protections, prioritize short-term profits over the long-term health of our planet and economy. These policies will harm working families and leave future generations to face the consequences. 

The American people deserve leaders who bring us together, uphold the rule of law, and work toward a future that benefits everyone.”",en,Tweet,0,17,2,6,1924,2025-01-26 02:39:20,"<a href=""http://twitter.com/download/iphone"" rel=""nofollow"">Twitter for iPhone</a>",,,photo,https://pbs.twimg.com/media/GiL7VEDW0AA4Yj0.jpg
'1882965340847489085',"Weekly Recap 

This week, I attended my first Homeland Security Committee meeting on global cyber threats and spoke out against harmful diversity rollbacks. I also urged Congress to deliver wildfire aid to California without political strings. 

In Houston, we overcame a tough winter storm and honored Dr. King’s legacy—a reminder to keep fighting for justice. 

Proud to represent TX-18 every day! 

#WeAreTX18",en,Tweet,2,22,6,3,2507,2025-01-25 01:34:55,"<a href=""http://twitter.com/download/iphone"" rel=""nofollow"">Twitter for iPhone</a>",,,video,https://video.twimg.com/amplify_video/1882965165064265728/vid/avc1/1280x720/hOlpM_BGZ29mf_P4.mp4?tag=16
'1882625726312333736',"I’ll always fight for the people of the 18th Congressional District. We will stay the course! 
#WeAreTX18 https://t.co/ORTUkw7xal",en,Tweet,0,3,0,2,416,2025-01-24 03:05:25,"<a href=""http://twitter.com/download/iphone"" rel=""nofollow"">Twitter for iPhone</a>",#WeAreTX18,,video,https://video.twimg.com/amplify_video/1882621190222524416/vid/avc1/1080x1920/zgqyndsH5phTgXWY.mp4?tag=16
