tweet_id,text,language,type,bookmark_count,favorite_count,retweet_count,reply_count,view_count,created_at,client,hashtags,urls,media_type,media_urls
'1898763266634985658',https://t.co/WkVx858xh0,zxx,Tweet,0,13,1,2,1331,2025-03-09 15:50:14,"<a href=""http://twitter.com/download/iphone"" rel=""nofollow"">Twitter for iPhone</a>",,,photo,https://pbs.twimg.com/media/GlnDIF3WQAA4Isi.jpg
'1898502762918473757',"Public Events This Upcoming Week to Celebrate the Life and Legacy of the Late Congressman, Former Houston Mayor, and Former Texas State Representative Sylvester Turner

-To attend the funeral service:
  https://t.co/I5mGoEa3b4

-To watch the service online:
  https://t.co/nSt17wIQHf",en,Tweet,0,11,6,2,2001,2025-03-08 22:35:05,"<a href=""http://twitter.com/download/iphone"" rel=""nofollow"">Twitter for iPhone</a>",,https://forms.gle/jY17KEaLRyCeqXrL7,photo,https://pbs.twimg.com/media/GljUPlpXAAAeAep.jpg
'1897351516421546333',Statement from the Office of Congressman Sylvester Turner on His Passing https://t.co/rWnkDeMbZq,en,Tweet,67,1410,330,101,99107,2025-03-05 18:20:27,"<a href=""http://twitter.com/download/iphone"" rel=""nofollow"">Twitter for iPhone</a>",,,photo,https://pbs.twimg.com/media/GlS_Jb9WkAA-Ya2.jpg
'1897097115819487434',"My message to the current administration for tonight’s State of the Union: “Don’t mess with Medicaid.”

I am proud to have Angela Hernandez here from our Congressional district as my guest. She is representing and advocating for her daughter Baislee Garcia who has a rare genetic disorder Chromosome 8p: Inversion/Duplication/Deletion. 

Let me be clear: any cuts to Medicaid are a direct attack on families like Angela’s. President Trump and Elon Musk’s push to gut Medicaid is nothing short of a betrayal of the most vulnerable among us. They are playing politics with children’s lives, and I will not stand for it.",en,Tweet,193,2311,372,392,546550,2025-03-05 01:29:33,"<a href=""http://twitter.com/download/iphone"" rel=""nofollow"">Twitter for iPhone</a>",,,video,https://video.twimg.com/amplify_video/1897097038812106752/vid/avc1/1080x1920/ClX4vhZTsYG5xX6h.mp4?tag=16
'1897068978704457940',"I’m Angela Hernandez, and I’m honored to be Congressman Sylvester Turner’s guest for President Trump’s Joint Address to Congress.

I am here to advocate for essential Medicaid services for my two-year-old daughter, Baislee, who is bravely facing a rare genetic disorder. Her future depends on the support we can secure for families like ours.",en,Tweet,6,115,37,12,14362,2025-03-04 23:37:45,"<a href=""http://twitter.com/download/iphone"" rel=""nofollow"">Twitter for iPhone</a>",,,video,https://video.twimg.com/amplify_video/1897067778827329536/vid/avc1/1080x1920/7BJLh3zkl8ikuu17.mp4?tag=16
'1897038905381097569',"Meet Angela Hernandez, my guest tonight at the Joint Address to Congress. She’s from the 18th district in Houston, Texas, and came to advocate for Medicaid services that are vital for her two-year-old daughter, Baislee, who has a rare genetic disorder. Medicaid covered the $23,000 medical bed that the family could not afford.

Medicaid provides over $16,000 per month in essential services and support to help Baislee develop and receive the care she needs. President Trump is already working to take these services away, directly attacking the health and well-being of children like Baislee. We will not stand by while he jeopardizes their lives. I will continue the fight for the Medicaid support that is crucial for families like Angela’s.",en,Tweet,6,63,17,6,12394,2025-03-04 21:38:14,"<a href=""http://twitter.com/download/iphone"" rel=""nofollow"">Twitter for iPhone</a>",,,photo,https://pbs.twimg.com/media/GlOi1HWWwAASMn8.jpg
'1896900251203854492',"Pausing military aid to Ukraine is pure insanity. This move only empowers Putin, hurts our ally, and undermines our national security. Ukraine is literally fighting for its survival, and cutting off support now is a betrayal of their trust and a gift to Russia. https://t.co/APeGvMvqsN",en,Tweet,3,27,7,10,13184,2025-03-04 12:27:17,"<a href=""http://twitter.com/download/iphone"" rel=""nofollow"">Twitter for iPhone</a>",,,photo,https://pbs.twimg.com/media/GlMkuaIXEAAWwk3.jpg
'1896358712178295153',"Tonight, I spoke with @TheRevAl about how President Trump has failed hardworking Americans by ignoring inflation and rising grocery prices. His administration has been hostile to federal workers, rolled back DEI initiatives, and prioritized tax breaks for the wealthy. 

We deserve better from our President and the Republicans. #PoliticsNation",en,Tweet,14,51,16,25,20876,2025-03-03 00:35:24,"<a href=""http://twitter.com/download/iphone"" rel=""nofollow"">Twitter for iPhone</a>",,,video,https://video.twimg.com/amplify_video/1896358390567235584/vid/avc1/880x484/zVLADgjDb3KNIMMr.mp4?tag=16
'1896319821899571352',I am live on @MSNBC’s @TheRevAl Sharpton show now. Tune in. https://t.co/Jdt9kyZdeG,en,Tweet,1,13,2,1,3274,2025-03-02 22:00:52,"<a href=""http://twitter.com/download/iphone"" rel=""nofollow"">Twitter for iPhone</a>",,,photo,https://pbs.twimg.com/media/GlEU0zZW8AAoPhP.jpg
'1895926341306106313',"We could not have asked for better weather for this year’s @RODEOHOUSTON parade in @DowntownHouston. 

I was honored once again to ride along with my fellow Congressional colleagues @RepSylviaGarcia and @RepAlGreen. 

It’s rodeo season y’all. 🐎🤠 https://t.co/ZZjbozd81c",en,Tweet,6,49,3,3,13929,2025-03-01 19:57:19,"<a href=""http://twitter.com/download/iphone"" rel=""nofollow"">Twitter for iPhone</a>",,,photo,"https://pbs.twimg.com/media/Gk-u9MAWMAAxQR3.jpg,https://pbs.twimg.com/media/Gk-u9MEXUAALZE1.jpg,https://pbs.twimg.com/media/Gk-u9MCXgAA-WO7.jpg"
'1895884973237776648',"The sacrifices our veterans make in service to our country clearly do not matter to President Trump or billionaire Elon Musk. Firing nearly 6,000 veterans is unjustifiable.  

Houston has the second-largest veteran population in the country, with over 300,000 veterans. In TX-18, there are 25,148 veterans. These men and women have given everything to defend our freedoms, and now they are being cast aside.",en,Tweet,1,8,2,1,2162,2025-03-01 17:12:56,"<a href=""http://twitter.com/download/iphone"" rel=""nofollow"">Twitter for iPhone</a>",,,photo,https://pbs.twimg.com/media/Gk-JVbnWUAATIKD.jpg
'1895613517866430628',"The meeting today between President Trump and President Zelenskyy in the Oval Office was unprecedented and embarrassing. America is the most powerful nation in the world. The world looks to us as a leader.

The President and Vice President’s actions were not a good reflection of who we are as a country. What was said, and the tone in which it was delivered, did not advance America’s interests on the global stage. Today was not good diplomacy. It was shameful. President Trump is trying to force Ukraine to bow to Russia and Putin. Who would have thought we would be in this place?",en,Tweet,1,16,7,3,3307,2025-02-28 23:14:16,"<a href=""http://twitter.com/download/iphone"" rel=""nofollow"">Twitter for iPhone</a>",,,photo,https://pbs.twimg.com/media/Gk6ScnFXIAAJCtX.jpg
'1895500582775091288',"Last week, I reintroduced the Due Process Continuity of Care Act, a bipartisan bill ensuring individuals in pretrial detention retain Medicaid access, addressing unjust gaps in healthcare coverage and reducing burdens on local governments. https://t.co/f2FmpyCYIc",en,Tweet,1,15,5,0,3679,2025-02-28 15:45:30,"<a href=""http://twitter.com/download/iphone"" rel=""nofollow"">Twitter for iPhone</a>",,,video,https://video.twimg.com/amplify_video/1895500473773268992/vid/avc1/960x540/V0gGMbPsxX1qsrpy.mp4?tag=16
'1895217780221182241',"I appreciate the EPA’s commitment to protecting the health and safety of our residents in Fifth Ward and Kashmere Gardens. 

The community meeting being held today, February 27, 2025, is an important opportunity to provide updates on the progress of the site cleanup, upcoming activities, and the results of soil sampling in schools, parks, and recreational areas.",en,Tweet,0,6,1,0,2826,2025-02-27 21:01:44,"<a href=""http://twitter.com/download/iphone"" rel=""nofollow"">Twitter for iPhone</a>",,,photo,https://pbs.twimg.com/media/Gk0qhw9WYAA4nv7.jpg
'1895163388566605923',"On the floor this week, I spoke about a federal scientist fired by President Trump and Elon Musk. He said, “I have a PhD in biomedical engineering... Please protect these agencies.” 

In my district, the University of Houston faces frozen grants, creating uncertainty in cancer research. Firing cancer scientists is short-sighted and irresponsible.",en,Tweet,1,19,11,2,3970,2025-02-27 17:25:36,"<a href=""http://twitter.com/download/iphone"" rel=""nofollow"">Twitter for iPhone</a>",,,video,https://video.twimg.com/amplify_video/1895163314637770752/vid/avc1/1920x1080/E66y4cIUvQRl3nnA.mp4?tag=16
'1894888382955728906',I had a great meeting today with the University of Houston’s Student Government Association. It was inspiring to connect with these young leaders. https://t.co/Rb0hDaHlim,en,Tweet,0,8,2,0,1900,2025-02-26 23:12:50,"<a href=""http://twitter.com/download/iphone"" rel=""nofollow"">Twitter for iPhone</a>",,,photo,https://pbs.twimg.com/media/Gkv-zbSW8AACMth.jpg
'1894761652416807171',"🎨 Congressional Art Competition 🎨

*For High School Students in the 18th District*

•Your artwork could be displayed in the U.S. Capitol for 1 year and featured on https://t.co/Y1VRnckBma.

•Submit your original artwork by April 4, 2025, at 5 PM. 

•Drop off at Congressman Sylvester Turner’s (TX-18) office: 
1919 Smith St, Suite 1180, Houston, TX 77002 

Questions? Call (713) 655-0050.

Show us your talent!",en,Tweet,0,4,1,1,1820,2025-02-26 14:49:15,"<a href=""http://twitter.com/download/iphone"" rel=""nofollow"">Twitter for iPhone</a>",,http://house.gov,photo,"https://pbs.twimg.com/media/GkuKy_0XYAALPrw.jpg,https://pbs.twimg.com/media/GkuKzAAWQAAesr4.jpg"
'1894578908143497710',"House Republicans have just passed a budget that cuts nearly $1 trillion from Medicaid, leaving millions without access to healthcare. At the same time, it gives huge tax breaks to billionaires and large corporations. 

This is a clear choice to put the wealthiest Americans ahead of working families.",en,Tweet,1,19,9,4,2810,2025-02-26 02:43:05,"<a href=""http://twitter.com/download/iphone"" rel=""nofollow"">Twitter for iPhone</a>",,,photo,https://pbs.twimg.com/media/Gkrleb-XoAAULte.jpg
'1894535835564806212',"My Democratic colleagues and I oppose the Republican budget proposal endorsed by Donald Trump. This plan cuts Medicaid, undermines veterans’ benefits, and takes food from children and seniors, all to give tax breaks to billionaires and corporations. https://t.co/KpYmobdkFQ",en,Tweet,1,17,5,1,2354,2025-02-25 23:51:56,"<a href=""http://twitter.com/download/iphone"" rel=""nofollow"">Twitter for iPhone</a>",,,photo,https://pbs.twimg.com/media/Gkq-SHgXAAAXaoD.jpg
'1894488028585816281',"I was proud to stand with my Democratic colleagues today to say NO to any Republican attempts to pass a budget that slashes Medicaid.

Protecting Americans and their healthcare shouldn’t be a political game. https://t.co/8omJly28K7",en,Tweet,0,5,2,1,776,2025-02-25 20:41:58,"<a href=""http://twitter.com/download/iphone"" rel=""nofollow"">Twitter for iPhone</a>",,,photo,https://pbs.twimg.com/media/GkqS0myXIAA6NZy.jpg
'1894171640608821531',"Today, I joined my Democratic colleagues in sending a letter to agency heads about the OPM email sent on February 22, 2025, linked to Elon Musk’s claim that federal workers must respond to his question, “What did you do last week?” or face resignation.

Musk’s threat caused unnecessary confusion. After backlash, OPM clarified that responses are voluntary and nonresponse does not equal resignation.

Federal employees must know that their jobs are secure and that we stand with them against any intimidation.",en,Tweet,0,6,1,3,1932,2025-02-24 23:44:45,"<a href=""http://twitter.com/download/iphone"" rel=""nofollow"">Twitter for iPhone</a>",,,photo,"https://pbs.twimg.com/media/GklyfdTXEAAkr_E.jpg,https://pbs.twimg.com/media/GklyfeRXQAIKsKO.jpg"
'1894081596409745559',"FYI: I’m voting NO on any budget that seeks to gut Medicaid this week, alongside my Democratic colleagues. The House Republicans’ plan would slash healthcare for millions, raise costs for families, and provide massive tax breaks to Trump’s billionaire allies.

I’m standing up for the people of TX-18 and fighting to protect your healthcare.",en,Tweet,1,13,4,3,1783,2025-02-24 17:46:57,"<a href=""http://twitter.com/download/iphone"" rel=""nofollow"">Twitter for iPhone</a>",,,photo,"https://pbs.twimg.com/media/GkkhLFHWEAAWpZG.jpg,https://pbs.twimg.com/media/GkkhLFHXAAAgniS.jpg"
'1893868376994218466',"This week, I had the incredible honor of recognizing 14 exceptional students nominated to the U.S. Military Service Academies.

 It was a privilege to celebrate this achievement alongside their proud families! https://t.co/VjHPbBMci4",en,Tweet,0,15,1,0,1703,2025-02-24 03:39:42,"<a href=""http://twitter.com/download/iphone"" rel=""nofollow"">Twitter for iPhone</a>",,,photo,"https://pbs.twimg.com/media/GkhfPSCWUAEla2t.jpg,https://pbs.twimg.com/media/GkhfPSEWMAE6gFd.jpg,https://pbs.twimg.com/media/GkhfPSCW8AAT_7O.jpg,https://pbs.twimg.com/media/GkhfPSAWAAAd8Bx.jpg"
'1893858586935079135',"As this district week period comes to a close, I have worked to ensure the 18th Congressional District constituent's voices are heard. We held a town hall to listen to our resident's concerns.

I want them to know that as we begin our budget discussion, Republicans are doing everything they can to slash and cut essential services that we rely on every day including Medicaid and SNAP.

As I travel back to DC, I will continue to raise my voice, fight for our services, stand up to Elon Musk and the President, and address the concerns of our children, seniors, veterans, and all residents within the 18th Congressional District.",en,Tweet,4,13,4,2,2994,2025-02-24 03:00:47,"<a href=""https://mobile.twitter.com"" rel=""nofollow"">Twitter Web App</a>",,,video,https://video.twimg.com/ext_tw_video/1893856754728935424/pu/vid/avc1/1280x720/Ge2_BHr_Zpv-74D8.mp4?tag=12
'1893710422689055232',"The fourth annual Diaspora Africa Conference took place at The Ion. 

This year’s event marked the second time it was held in Houston. 

Houston is home to a vibrant African community. The Nigerian community in our city is the largest in the country. 

Throughout my public service career, I have visited Africa many times and have truly enjoyed the relationships created through my many visits. 

I look forward to further building a stronger relationship as Congressman of the 18th Congressional District.",en,Tweet,0,10,2,0,1624,2025-02-23 17:12:02,"<a href=""http://twitter.com/download/iphone"" rel=""nofollow"">Twitter for iPhone</a>",,,photo,"https://pbs.twimg.com/media/GkfPlzYXkAAR06o.jpg,https://pbs.twimg.com/media/GkfPlzYX0AAAbAG.jpg,https://pbs.twimg.com/media/GkfPlzYXEAAcrpe.jpg,https://pbs.twimg.com/media/GkfPlzZXUAA-kLY.jpg"
'1893710111438168265',"🎨 Congressional Art Competition 🎨

Submit your original two-dimensional artwork by April 4, 2025, at 5 PM. 

•Max size: 26”x26”x4” 
•Max weight: 15 lbs 

•Drop off at Congressman Sylvester Turner’s (TX-18) office: 
1919 Smith St, Suite 1180, Houston, TX 77002 

Questions? Call (713) 655-0050.

Show us your talent!",en,Tweet,0,7,2,0,1727,2025-02-23 17:10:48,"<a href=""http://twitter.com/download/iphone"" rel=""nofollow"">Twitter for iPhone</a>",,,photo,"https://pbs.twimg.com/media/GkfLOqwXcAEIEht.jpg,https://pbs.twimg.com/media/GkfLOqxXMAAi1Zs.jpg"
'1892723675528323128',"Thank you to everyone who joined us for yesterday’s “Know Your Rights” Town hall, and a special thanks to @Cesar_Espinosa and others for providing valuable information and resources.

The full stream is available on our YouTube.
https://t.co/HSRDwzHhys https://t.co/BpGK2slIN4",en,Tweet,1,8,3,0,1465,2025-02-20 23:51:04,"<a href=""http://twitter.com/download/iphone"" rel=""nofollow"">Twitter for iPhone</a>",,https://www.youtube.com/live/KGmUaCgRw7o?si=1TR_hQgeDwX_7PM4,photo,"https://pbs.twimg.com/media/GkRNI-5WcAAxqcq.jpg,https://pbs.twimg.com/media/GkRNI-1W8AEAjnl.jpg,https://pbs.twimg.com/media/GkRNI-4XIAA0rim.jpg,https://pbs.twimg.com/media/GkRNI-6XIAAJ6V2.jpg"
'1892676851065131270',"Trump and Elon are on a firing spree, citing fraud and claiming it’s about boosting efficiency. But how does it make sense to fire thousands, only to admit it was a mistake and ask them to return?  

This isn’t just inefficient, it’s chaotic and highlights the dysfunction in leadership. It creates instability, erodes public trust, and puts the country’s security at risk.",en,Tweet,0,11,6,5,1620,2025-02-20 20:45:00,"<a href=""http://twitter.com/download/iphone"" rel=""nofollow"">Twitter for iPhone</a>",,,photo,https://pbs.twimg.com/media/GkQjkBuW4AAQIeU.jpg
'1892376187474694208',"I would like to thank @FIELHouston for joining us in our “Know Your Rights” town hall. 

@Cesar_Espinosa is currently addressing our town hall now.",en,Tweet,0,7,3,0,2407,2025-02-20 00:50:16,"<a href=""http://twitter.com/download/iphone"" rel=""nofollow"">Twitter for iPhone</a>",,,,
'1892363532966252690',Congressman Sylvester Turner's Know Your Rights Town Hall https://t.co/01gog9C56g,en,Tweet,0,4,1,1,3005,2025-02-19 23:59:59,"<a href=""https://periscope.tv"" rel=""nofollow"">Periscope</a>",,https://x.com/i/broadcasts/1mrGmPprpDBKy,,
'1892282314362667434',"REMINDER! TONIGHT! 

I’m hosting a Know Your Rights Town Hall later today Wednesday, February 19, 2025, at 6:00 PM CT. 

Details: 
When: Wednesday, February 19, 2025 
Time: 6:00 PM - 7:30 PM  CT
Where: Spring District Office 
15651 North Freeway 
Houston, Texas 77090 

This is a great opportunity to stay informed and ask any questions you might have.

Our Guest Speaker will be:
Cesar Espinosa, Executive Director of FIEL Houston.",en,Tweet,0,4,1,0,581,2025-02-19 18:37:15,"<a href=""http://twitter.com/download/iphone"" rel=""nofollow"">Twitter for iPhone</a>",,,photo,https://pbs.twimg.com/media/GkK8u-sXkAE3aZL.jpg
'1892029935138541583',"This weekend, I attended the DMars Top 50 Black Professionals and Entrepreneurs Gala, an incredible celebration of excellence, leadership, and achievement. https://t.co/66GDoKVaxR",en,Tweet,0,5,2,0,471,2025-02-19 01:54:23,"<a href=""http://twitter.com/download/iphone"" rel=""nofollow"">Twitter for iPhone</a>",,,photo,"https://pbs.twimg.com/media/GkHXMgKXoAAF7Fw.jpg,https://pbs.twimg.com/media/GkHXMgKXcAAbk_0.jpg,https://pbs.twimg.com/media/GkHXMgTWEAARgvJ.jpg,https://pbs.twimg.com/media/GkHXMgVWcAAn4lW.jpg"
'1892010512902390129',2025 Congressional District 18 Military Academy Nomination Event https://t.co/LmP7SRTJvS,en,Tweet,0,2,0,0,331,2025-02-19 00:37:12,"<a href=""https://periscope.tv"" rel=""nofollow"">Periscope</a>",,https://x.com/i/broadcasts/1rmxPyZqjRyKN,,
'1891323894734217316',"Addressing the cancer cluster and UPRR site contamination concerns in the 18th District is one of my top priorities. I met this week with EPA Region 6 Administrator Scott Mason to demand swift action to protect our families, children, and businesses.  

Thank you to @RodneyEllis for hosting this important press conference to keep the community informed.",en,Tweet,1,4,0,1,481,2025-02-17 03:08:50,"<a href=""http://twitter.com/download/iphone"" rel=""nofollow"">Twitter for iPhone</a>",,,video,https://video.twimg.com/amplify_video/1891314466010116096/vid/avc1/1920x1080/PxvAu-Xkv-JKK_9_.mp4?tag=16
'1891257874351005832',"Don’t forget! I’m hosting a Know Your Rights Town Hall next week on Wednesday, February 19, 2025, at 6:00 PM CT. 

Details: 
When: Wednesday, February 19, 2025 
Time: 6:00 PM - 7:30 PM  CT
Where: Spring District Office 
15651 North Freeway 
Houston, Texas 77090 

This is a great opportunity to stay informed and ask any questions you might have.

Our Guest Speaker will be:
Cesar Espinosa, Executive Director of FIEL Houston.",en,Tweet,0,2,1,0,467,2025-02-16 22:46:29,"<a href=""http://twitter.com/download/iphone"" rel=""nofollow"">Twitter for iPhone</a>",,,photo,https://pbs.twimg.com/media/Gj8ZA0oX0AEBVEz.jpg
'1890907076274049050',"I joined my colleagues in the @DadsCaucus in writing a letter to President Trump, urging immediate action to address skyrocketing egg prices.

Families rely on eggs as a basic necessity, and these rising costs are unacceptable. It’s time to fulfill the “Day 1” promise to lower grocery prices and support farmers and families.",en,Tweet,1,6,4,2,569,2025-02-15 23:32:32,"<a href=""http://twitter.com/download/iphone"" rel=""nofollow"">Twitter for iPhone</a>",,,photo,"https://pbs.twimg.com/media/Gj3Z9s9XgAA-Cak.jpg,https://pbs.twimg.com/media/Gj3Z9tGXAAAwsYg.jpg"
'1890564618814156847',"Team Turner visited 23 Veterans and Senior Centers across the district, spreading Valentine’s Day cheer and sharing agency updates with over 1,500 seniors and veterans.

#TX18Together https://t.co/5HQGZ4LMdN",en,Tweet,0,7,0,1,364,2025-02-15 00:51:44,"<a href=""http://twitter.com/download/iphone"" rel=""nofollow"">Twitter for iPhone</a>",#TX18Together,,photo,"https://pbs.twimg.com/media/GjyieVOXYAAxGl4.jpg,https://pbs.twimg.com/media/GjyieVMXwAABl2r.jpg,https://pbs.twimg.com/media/GjyieVMW4AA_fC5.jpg,https://pbs.twimg.com/media/GjyieVMXUAAXejN.jpg"
'1890490561817096195',Know Your Rights! https://t.co/cHuivtVQUn,en,Tweet,0,3,1,0,329,2025-02-14 19:57:28,"<a href=""http://twitter.com/download/iphone"" rel=""nofollow"">Twitter for iPhone</a>",,,photo,https://pbs.twimg.com/media/Gjxes1uXoAAIRtw.jpg
'1890393493459091872',"Happy Valentine’s Day! Team Turner in #TX18 visited seniors and veterans yesterday to celebrate the occasion, share updates on services, and provide valuable resources. https://t.co/6zMtwp3rmu",en,Tweet,0,9,1,1,1398,2025-02-14 13:31:45,"<a href=""http://twitter.com/download/iphone"" rel=""nofollow"">Twitter for iPhone</a>",#TX18,,photo,"https://pbs.twimg.com/media/GjwG3OKXEAA2ZM6.jpg,https://pbs.twimg.com/media/GjwG3ONXkAAkdoM.jpg,https://pbs.twimg.com/media/GjwG3OOWgAA-YSo.jpg,https://pbs.twimg.com/media/GjwG3OOW8AAwALW.jpg"
'1890305545854235122',"Did you hear? I’m hosting a Know Your Rights Town Hall next week on Wednesday, February 19, 2025, at 6:00 PM CT. 

Details: 
When: Wednesday, February 19, 2025 
Time: 6:00 PM - 7:30 PM  CT
Where: Spring District Office 
15651 North Freeway 
Houston, Texas 77090 

This is a great opportunity to stay informed and ask any questions you might have.

Our Guest Speaker will be:
Cesar Espinosa, Executive Director of FIEL Houston.",en,Tweet,0,2,0,0,312,2025-02-14 07:42:16,"<a href=""http://twitter.com/download/iphone"" rel=""nofollow"">Twitter for iPhone</a>",,,photo,https://pbs.twimg.com/media/Gju24CbWIAAX7w3.jpg
'1890199847623700700',"The Trump administration’s number one priority is giving tax breaks and putting more money in the hands of billionaires who have already accumulated a great deal on the backs of working men and women.

Thank you @ZerlinaMornings and @SiriusXMProg for having me on the show today! https://t.co/KIFxUx3S32",en,Tweet,0,5,2,0,399,2025-02-14 00:42:16,"<a href=""http://twitter.com/download/iphone"" rel=""nofollow"">Twitter for iPhone</a>",,,video,https://video.twimg.com/amplify_video/1890199782783594496/vid/avc1/720x720/65-fvLCSBvoWg9IX.mp4?tag=16
'1890091651827184004',"Seriously? We have to do better. Confirming Robert F. Kennedy Jr. as Health Secretary is a slap in the face to public health and safety. The guy has no experience and has spent years spreading dangerous misinformation about vaccines.  

This isn’t leadership, it’s a huge step backward for this country  and puts our children and families at risk.",en,Tweet,1,5,0,1,494,2025-02-13 17:32:20,"<a href=""http://twitter.com/download/iphone"" rel=""nofollow"">Twitter for iPhone</a>",,,,
'1890061939109159410',"This week in my Homeland Security Committee hearing, I talked about the Port of Houston, a major driver of jobs and economic growth, and how we’re using too many cranes made in China. 

I pushed for investing in making them here at home and raised concerns about cutting aid to Latin America, which only helps China expand its influence. We should be looking out for hard working Americans and their jobs.

@HomelandDems",en,Tweet,0,3,0,0,375,2025-02-13 15:34:16,"<a href=""http://twitter.com/download/iphone"" rel=""nofollow"">Twitter for iPhone</a>",,,video,https://video.twimg.com/amplify_video/1890061211997237249/vid/avc1/1920x1080/W4lVLLvOFb4hsfkQ.mp4?tag=16
'1890018442541240658',"Make sure to tune in this morning!  

8:30AM ET / 7:30AM CST

@ZerlinaMornings  
@SiriusXMProg 

https://t.co/ysFWGpk2Cj",en,Tweet,0,3,0,0,425,2025-02-13 12:41:26,"<a href=""http://twitter.com/download/iphone"" rel=""nofollow"">Twitter for iPhone</a>",,https://www.siriusxm.com/channels/siriusxm-progress,,
'1889853770164556029',"Protecting taxpayer data shouldn’t be a partisan issue. It is the people’s right to security over their medical bills, Social Security, and taxpayer information. Congress must pass the Taxpayer Data Protection Act. 

This is our duty, not something to hand over to Elon Musk and his team.",en,Tweet,1,23,4,2,2136,2025-02-13 01:47:05,"<a href=""http://twitter.com/download/iphone"" rel=""nofollow"">Twitter for iPhone</a>",,,video,https://video.twimg.com/amplify_video/1889853710873894913/vid/avc1/1280x720/S26TB1XjUrgr3YiK.mp4?tag=16
