tweet_id,text,language,type,bookmark_count,favorite_count,retweet_count,reply_count,view_count,created_at,client,hashtags,urls,media_type,media_urls
'1879937207689179476',"With less than a week left in office, Biden is really twisting the knife for seniors who rely on Medicare Advantage. 

This isn't leadership - it's cronyism and capitulation to the radical left who aim to kill the popular, affordable, and effective Medicare Advantage program!
https://t.co/xzvJKDji3N",en,Tweet,0,1,5,5,827,2025-01-16 17:02:12,"<a href=""https://mobile.twitter.com"" rel=""nofollow"">Twitter Web App</a>",,,,
'1879936330156953622',"Biden's trying to do as much damage as possible on his way out of the White House. It's irresponsible, shameful, and just downright immoral. 

https://t.co/fKErBRrNKV",en,Tweet,1,13,5,5,1569,2025-01-16 16:58:43,"<a href=""https://mobile.twitter.com"" rel=""nofollow"">Twitter Web App</a>",,https://washingtonreporter.news/p/scoop-rep-kevin-hern-blasts-bidens,,
'1879705440101204042',"Joe Biden’s presidency will be defined by weakness, failure and dangerously liberal policies. 

A new dawn in America awaits on January 20th!",en,Tweet,1,34,3,10,1150,2025-01-16 01:41:14,"<a href=""http://twitter.com/download/iphone"" rel=""nofollow"">Twitter for iPhone</a>",,,,
'1879653035888312499',"The CCP’s influence demands action. Taiwan, a beacon of freedom, invests in U.S. semiconductors but faces double taxation that hinders economic growth. 

H.R. 33 will fix this, strengthen our supply chain, and deepen U.S.-Taiwan ties. https://t.co/DvBIkr8yLj",en,Tweet,2,13,2,6,1707,2025-01-15 22:13:00,"<a href=""https://mobile.twitter.com"" rel=""nofollow"">Twitter Web App</a>",,,video,https://video.twimg.com/ext_tw_video/1879652882074517504/pu/vid/avc1/1280x720/2cqL3VYOQf4SkV6D.mp4?tag=12
'1879613375950590292',"For 466 days, innocent hostages—including Americans—were held by Hamas terrorists. Four days before his term ends, Joe Biden tries to claim credit for a deal President Trump secured.

Our adversaries are on notice: there’s a new sheriff in town, and we won’t stop until every hostage is brought home.",en,Tweet,0,16,6,3,802,2025-01-15 19:35:25,"<a href=""https://mobile.twitter.com"" rel=""nofollow"">Twitter Web App</a>",,,,
'1879260143197864166',203 Democrats voted to allow biological men in women’s sports instead of protecting women and girls. https://t.co/wpff6XhB7m,en,Tweet,0,13,7,8,750,2025-01-14 20:11:47,"<a href=""https://mobile.twitter.com"" rel=""nofollow"">Twitter Web App</a>",,,photo,https://pbs.twimg.com/media/GhR5GipXQAAa60m.jpg
'1879245733133799781',"From growing up in poverty to creating thousands of jobs, I’ve seen how opportunity in America changes lives. 

Tax cuts fuel growth and incentivize job creation - things that help American families and workers thrive. That’s what drives U.S. competitiveness. https://t.co/v80vqlHEDU",en,Tweet,0,7,2,3,1208,2025-01-14 19:14:32,"<a href=""https://mobile.twitter.com"" rel=""nofollow"">Twitter Web App</a>",,,video,https://video.twimg.com/ext_tw_video/1879240540387983361/pu/vid/avc1/1280x720/fJnrXFwYBGtBjpel.mp4?tag=12
'1879184680165290427',"The U.S. military exists for one purpose: to fight and win. With President Trump’s America First leadership, our nation will be stronger, and the world will be safer. 

@PeteHegseth will keep the Department of Defense laser-focused on this mission.",en,Tweet,0,7,2,2,998,2025-01-14 15:11:55,"<a href=""https://mobile.twitter.com"" rel=""nofollow"">Twitter Web App</a>",,,,
'1878890119186596020',"The American people know better—you appeased Iran, emboldened Putin, and folded to China. Good riddance! https://t.co/V7Ko82Fr6h",en,Tweet,0,16,3,13,833,2025-01-13 19:41:27,"<a href=""https://mobile.twitter.com"" rel=""nofollow"">Twitter Web App</a>",,,video,https://video.twimg.com/ext_tw_video/1878887926576168960/pu/vid/avc1/1280x720/cA4hf4jxQUgcFiUx.mp4?tag=12
'1878834076968526024',"Even as Californians face the devastation of one of the worst natural disasters in U.S. history, their immigration laws are tying the hands of law enforcement, making it nearly impossible to swiftly deport a criminal illegal alien caught setting fires in Southern California.",en,Tweet,0,5,7,4,1012,2025-01-13 15:58:45,"<a href=""https://mobile.twitter.com"" rel=""nofollow"">Twitter Web App</a>",,,,
'1878125467019931979',"1.3 million seniors have lost their coverage due to Joe Biden's cuts to Medicare Advantage.

January 20th can't get here fast enough! 

https://t.co/KiIoDzXLuH",en,Tweet,0,9,4,6,699,2025-01-11 17:02:59,"<a href=""https://mobile.twitter.com"" rel=""nofollow"">Twitter Web App</a>",,https://www.ahip.org/news/articles/two-years-of-cuts-to-medicare-advantage-are-negatively-impacting-seniors,,
'1877733545721913478',"Another setback for the American people’s trust in our justice system. Despite relentless efforts by the left to discredit him, President Trump will become the 47th President of the United States. 

The American people have spoken—they see through the smear campaigns and the lawfare!",en,Tweet,0,12,3,9,1052,2025-01-10 15:05:38,"<a href=""https://mobile.twitter.com"" rel=""nofollow"">Twitter Web App</a>",,,,
'1877434990130053546',"Today is National Law Enforcement Appreciation Day. Thank you to the brave men and women who dedicate their lives to protecting our communities and upholding the rule of law. 

Your service and sacrifice deserve our gratitude today and every day.",en,Tweet,1,6,3,1,561,2025-01-09 19:19:17,"<a href=""https://mobile.twitter.com"" rel=""nofollow"">Twitter Web App</a>",,,photo,https://pbs.twimg.com/media/Gg39InnW4AAFC9W.jpg
'1877408169254596995',"The Illegitimate Court Counteraction Act, sends a clear message: the ICC must end its attacks on the U.S. and our allies. 

Standing up for Israel today protects America tomorrow.",en,Tweet,4,310,43,140,28497,2025-01-09 17:32:42,"<a href=""http://twitter.com/download/iphone"" rel=""nofollow"">Twitter for iPhone</a>",,,,
'1876976267745964236',"Americans can’t afford higher taxes, weaker borders, or rising energy costs. 

We need a single, powerful bill to get the job done. The American people elected President Trump—now let’s act fast and protect America’s future. https://t.co/WxiMnHFhAB",en,Tweet,2,28,8,9,1703,2025-01-08 12:56:29,"<a href=""https://mobile.twitter.com"" rel=""nofollow"">Twitter Web App</a>",,,video,https://video.twimg.com/ext_tw_video/1876975957329752065/pu/vid/avc1/1280x720/n0AzpTYfOTJklNM5.mp4?tag=12
'1876966306546651383',I’ll be live on @SquawkCNBC in a few minutes - tune in!,en,Tweet,0,7,0,2,724,2025-01-08 12:16:54,"<a href=""http://twitter.com/download/iphone"" rel=""nofollow"">Twitter for iPhone</a>",,,,
'1876702364113015192',159 Democrats voted against legislation to detain and deport illegal immigrants who commit crimes in this nation.,en,Tweet,1,29,9,9,1926,2025-01-07 18:48:05,"<a href=""https://mobile.twitter.com"" rel=""nofollow"">Twitter Web App</a>",,,,
'1876678781567713632',"Just over a year ago, the crisis you created hit its worst point—good job, you “fought to fix” the very problem you created. https://t.co/DMPUjYoMQm",en,Tweet,0,7,0,6,753,2025-01-07 17:14:23,"<a href=""https://mobile.twitter.com"" rel=""nofollow"">Twitter Web App</a>",,,photo,https://pbs.twimg.com/media/GgtNNCjWUAAOIKX.jpg
'1876352954435015090',"It’s a snowy day here in DC - but a little snow didn’t stop us from certifying President Trump and VP Vance’s election! 

2 weeks from today, they will take the oath of office 🇺🇸 https://t.co/UJ2unrzLcP",en,Tweet,0,25,2,3,651,2025-01-06 19:39:39,"<a href=""http://twitter.com/download/iphone"" rel=""nofollow"">Twitter for iPhone</a>",,,photo,https://pbs.twimg.com/media/GgolEJrWsAAAp_Z.jpg
'1876339438134890805',"I just got off the House floor after certifying President Trump’s historic election victory. 

Donald J. Trump will become the 47th President of the United States — next stop: January 20th! 

Let’s Make America Great Again!",en,Tweet,0,83,11,18,1956,2025-01-06 18:45:57,"<a href=""https://mobile.twitter.com"" rel=""nofollow"">Twitter Web App</a>",,,,
'1876310871586033690',"I look forward to certifying President Trump’s historic election victory today! 

Together we will MAKE AMERICA GREAT AGAIN!",en,Tweet,0,29,6,3,822,2025-01-06 16:52:26,"<a href=""https://mobile.twitter.com"" rel=""nofollow"">Twitter Web App</a>",,,photo,https://pbs.twimg.com/media/Ggn-wHHXEAA26t2.jpg
'1875295147237503451',"House Republicans are united behind President Trump’s America First agenda.

We’ve got to tackle skyrocketing inflation, secure the wide-open southern border, and restore law and order for all Americans! https://t.co/HuxFnfFFNP",en,Tweet,0,22,7,5,1126,2025-01-03 21:36:19,"<a href=""https://mobile.twitter.com"" rel=""nofollow"">Twitter Web App</a>",,,video,https://video.twimg.com/ext_tw_video/1875294762984505344/pu/vid/avc1/1280x720/NTGziXdoWPRdO4HJ.mp4?tag=12
'1875171333887418398',"The Senate must act quickly to confirm President Trump’s national security team—especially after the devastating terror attack.

As Policy Chair, my top priority in the first 100 days is delivering on President Trump’s America First agenda. https://t.co/65bJrNBL7O",en,Tweet,0,25,11,3,987,2025-01-03 13:24:19,"<a href=""https://mobile.twitter.com"" rel=""nofollow"">Twitter Web App</a>",,,video,https://video.twimg.com/ext_tw_video/1875170981230022656/pu/vid/avc1/1280x720/hNEAESoqFhq_oPeE.mp4?tag=12
'1875138855533523018',🚨Joining @MorningsMaria on @FoxBusiness live - tune in!,en,Tweet,0,5,0,0,589,2025-01-03 11:15:16,"<a href=""http://twitter.com/download/iphone"" rel=""nofollow"">Twitter for iPhone</a>",,,,
'1874855731515539674',"In 18 days, President Trump will return to the Oval Office and restore LAW and ORDER in America.",en,Tweet,0,23,0,6,955,2025-01-02 16:30:14,"<a href=""https://mobile.twitter.com"" rel=""nofollow"">Twitter Web App</a>",,,,
'1874495618544206159',"Early this morning, a horrific and senseless act of violence struck New Orleans and shook our nation. 

Join me in praying for the victims and their families. I’m grateful for the swift action of law enforcement.",en,Tweet,0,15,1,2,1124,2025-01-01 16:39:16,"<a href=""http://twitter.com/download/iphone"" rel=""nofollow"">Twitter for iPhone</a>",,,,
'1872677719110242352',"@RepJoeWilson @RepublicanStudy Thankful for your leadership on this, Joe!",en,Reply,0,136,5,5,3286,2024-12-27 16:15:35,"<a href=""https://mobile.twitter.com"" rel=""nofollow"">Twitter Web App</a>",,,,
'1872661175252766810',"The Israeli hostages are spending their SECOND Hanukkah in captivity - my heart goes out to the families waiting for their loved ones to come home this holiday season. 

There is always hope. Strength returns to the White House in less than a month!",en,Tweet,1,14,6,2,1860,2024-12-27 15:09:51,"<a href=""https://mobile.twitter.com"" rel=""nofollow"">Twitter Web App</a>",,,,
'1872386515424411992',#StandWithGeorgianPeople,qht,Tweet,10,820,147,40,34739,2024-12-26 20:58:27,"<a href=""http://twitter.com/download/iphone"" rel=""nofollow"">Twitter for iPhone</a>",#StandWithGeorgianPeople,,,
'1872053792100979176',"To the people of Oklahoma’s First District and all across the nation celebrating Hanukkah: Tammy and I wish you a season filled with light, joy, and cherished moments with loved ones! https://t.co/a4ccMwEe3a",en,Tweet,0,12,5,1,1462,2024-12-25 22:56:19,"<a href=""http://twitter.com/download/iphone"" rel=""nofollow"">Twitter for iPhone</a>",,,photo,https://pbs.twimg.com/media/GfrfAEfXIAAiaOm.jpg
'1871903725305909447',"Merry Christmas! May this season bring joy, peace, and blessings to you and your family.  

""For unto us a child is born, unto us a son is given; and the government shall be upon his shoulder: and his name shall be called Wonderful, Counselor, The Mighty God, The Everlasting Father, The Prince of Peace."" 
– Isaiah 9:6",en,Tweet,0,31,5,5,745,2024-12-25 13:00:01,"<a href=""http://twitter.com"" rel=""nofollow"">Twitter Web Client</a>",,,photo,https://pbs.twimg.com/media/GfQU4o3XEAAf2aM.jpg
'1870929796231803192',"Today’s anniversary of the incredible &amp; effective Tax Cuts and Jobs Act is an important reminder of the critical work before us in the 119th Congress. The American people have given us a clear mandate - making TCJA permanent is a part of that. 

We will restore the Trump economy!",en,Tweet,1,19,6,11,3244,2024-12-22 20:29:58,"<a href=""http://twitter.com/download/iphone"" rel=""nofollow"">Twitter for iPhone</a>",,,,
'1869857162878693737',"I am proud to stand with President @realDonaldTrump, VP @JDVance, and @SpeakerJohnson in support of the American Relief Act of 2024. 

It is time to set the table for Trump/Vance to Make America Great Again! https://t.co/xV0DXunBHz",en,Tweet,7,508,101,54,26910,2024-12-19 21:27:42,"<a href=""https://mobile.twitter.com"" rel=""nofollow"">Twitter Web App</a>",,,photo,https://pbs.twimg.com/media/GfMQEZNWsAAcsvJ.jpg
'1869770565269270752',"Fani Willis was just another player in the lawfare—and now, even the courts have had enough.",en,Tweet,0,32,4,8,1778,2024-12-19 15:43:36,"<a href=""http://twitter.com/download/iphone"" rel=""nofollow"">Twitter for iPhone</a>",,,,
'1869501930197975352',I was talking about the bill I support Mike Johnson for Speaker.,en,Tweet,12,248,31,121,136720,2024-12-18 21:56:08,"<a href=""http://twitter.com/download/iphone"" rel=""nofollow"">Twitter for iPhone</a>",,,,
'1869475210770198672',"The @RepublicanStudy Committee is the conservative conscience of House Republicans.

I was honored to serve the largest caucus in Congress and grateful for the trust my colleagues placed in me. 

America’s best days are ahead! https://t.co/IOf8x7mSIW",en,Tweet,1,24,9,32,3031,2024-12-18 20:09:58,"<a href=""https://mobile.twitter.com"" rel=""nofollow"">Twitter Web App</a>",,,photo,https://pbs.twimg.com/media/GfGy61qXcAAIHVZ.jpg
'1869413424050147823',"The American people are fed up. They outright rejected Joe Biden’s failed America Last agenda. But instead of listening, Biden doubled down.

He’s not just ignoring the crisis—he’s selling off pieces of the border wall. When President Trump returns, that border wall will be back. https://t.co/l7xeuvYEtL",en,Tweet,3,182,41,142,12801,2024-12-18 16:04:26,"<a href=""https://mobile.twitter.com"" rel=""nofollow"">Twitter Web App</a>",,,video,https://video.twimg.com/ext_tw_video/1869397165061091328/pu/vid/avc1/1280x720/JDlp9Np53dfVPD2G.mp4?tag=12
'1869396914476920964',"I had really great conversations this weekend with both Elon &amp; Vivek - there's a lot to get done through @DOGE next year, which is why I am thrilled to join the DOGE Caucus in the House, led by my colleague @RepAaronBean. 

Government waste is about to be a relic of history!",en,Tweet,1,31,3,48,1787,2024-12-18 14:58:50,"<a href=""https://mobile.twitter.com"" rel=""nofollow"">Twitter Web App</a>",,,,
'1868787453718659579',"Today, the House passed the bill to name Tulsa’s new VA hospital after Senator James Mountain Inhofe.

I spoke on the floor to honor my friend's legacy of service to our military, veterans, and families. Thank you to @SenatorLankford for leading this effort in the Senate! https://t.co/9C6DhRnzzh",en,Tweet,1,18,0,4,1280,2024-12-16 22:37:04,"<a href=""https://mobile.twitter.com"" rel=""nofollow"">Twitter Web App</a>",,,video,https://video.twimg.com/ext_tw_video/1868787230572990465/pu/vid/avc1/1280x720/C9W9EK5v6687Y8_d.mp4?tag=12
'1868714845014835568',"Alejandro Mayorkas' failure to address Americans' concerns about unidentified drones is yet another disaster in his failed leadership. 

35 days until President Trump restores safety and transparency. https://t.co/WCHgzq42UF",en,Tweet,0,5,1,6,1076,2024-12-16 17:48:32,"<a href=""https://mobile.twitter.com"" rel=""nofollow"">Twitter Web App</a>",,,video,https://video.twimg.com/ext_tw_video/1868305799153348609/pu/vid/avc1/1280x720/u8Lt0j95P97rn9rN.mp4?tag=12
'1867701678218293437',"Congratulations to these new Members of the Financial Services Committee! @FinancialCmte 

➡️ @RepLisaMcClain 
➡️ @RepMariaSalazar 
➡️ @MikeHaridopolos 
➡️ @RepStutzman 
➡️ @timmoorenc",en,Tweet,3,17,7,10,857,2024-12-13 22:42:34,"<a href=""https://mobile.twitter.com"" rel=""nofollow"">Twitter Web App</a>",,,,
'1867700852539924524',"Congratulations to these new Members of the House Ways and Means Committee. I'm looking forward to working with you! @WaysandMeansGOP 

➡️ @RepRudyYakym 
➡️ @RepMaxMiller 
➡️ @RepNateMoran 
➡️ @RepAaronBean",en,Tweet,0,7,3,10,621,2024-12-13 22:39:18,"<a href=""https://mobile.twitter.com"" rel=""nofollow"">Twitter Web App</a>",,,,
'1867700226158727589',"Congratulations to these new Members of the House Appropriations Committee! @HouseAppropsGOP 

➡️ @RepMarkAlford 
➡️ @RileyMooreWV 
➡️ @RepDaleStrong 
➡️ @RepLaLota 
➡️ @RepMaloyUtah",en,Tweet,0,32,8,11,1612,2024-12-13 22:36:48,"<a href=""https://mobile.twitter.com"" rel=""nofollow"">Twitter Web App</a>",,,,
'1867699481405534470',"Congratulations to these new Members of the House Committee on Energy and Commerce!  @HouseCommerce 

➡️@RepBentz 
➡️@GabeforColorado 
➡️@fedorchak4ND 
➡️@RepRussellFry 
➡️@GoldmanCraig 
➡️@RepHouchin 
➡️@CongressmanKean 
➡️@RepLangworthy 
➡️@RepLaurelLee 
➡️@RepMichaelRulli",en,Tweet,0,15,6,10,989,2024-12-13 22:33:51,"<a href=""https://mobile.twitter.com"" rel=""nofollow"">Twitter Web App</a>",,,,
'1867269552784245039',"There is no justification for point-blank murder. 

This kind of rhetoric only empowers those who think violence is the solution for a difference of opinion.",en,Tweet,0,9,2,2,817,2024-12-12 18:05:28,"<a href=""http://twitter.com/download/iphone"" rel=""nofollow"">Twitter for iPhone</a>",,,,
'1867223429092344002',"Congratulations to our President @realDonaldTrump on this honor of being named @TIME person of the year. 

The new renaissance of America begins on January 20th! 🇺🇸 https://t.co/4eIOQ1x3Hb",en,Tweet,0,19,1,4,865,2024-12-12 15:02:11,"<a href=""http://twitter.com/download/iphone"" rel=""nofollow"">Twitter for iPhone</a>",,,photo,https://pbs.twimg.com/media/Gem10D-XYAEGI_S.jpg
'1866968779520897325',"Christopher Wray shattered Americans' trust by turning the FBI into a tool for lawfare. 

Now, the nation is ready for a new chapter—a fresh start for the FBI and the justice system. 

President Trump is leading the way.",en,Tweet,0,15,4,3,1054,2024-12-11 22:10:18,"<a href=""https://mobile.twitter.com"" rel=""nofollow"">Twitter Web App</a>",,,,
'1866577723067601185',"The American people rejected Biden-Harris’ failed leadership, yet their lame-duck administration keeps appeasing Iran. 

President Trump was elected to lead with peace through strength—and it’s on the way.",en,Tweet,2,18,5,2,2613,2024-12-10 20:16:23,"<a href=""https://mobile.twitter.com"" rel=""nofollow"">Twitter Web App</a>",,,,
'1865560124963639510',"83 years ago, America was attacked at Pearl Harbor, and over 2,000 brave Americans made the ultimate sacrifice.

Today and everyday we remember our brave soldiers who answered the call when our nation was attacked on this date that will live in infamy. https://t.co/aJvuJ4oUig",en,Tweet,2,17,4,0,661,2024-12-08 00:52:48,"<a href=""http://twitter.com/download/iphone"" rel=""nofollow"">Twitter for iPhone</a>",,,photo,https://pbs.twimg.com/media/GePNCz6WIAAxKAG.jpg
'1864991394764308585',🚨Joining @MorningsMaria on @FoxBusiness live - tune in!,en,Tweet,0,9,1,2,524,2024-12-06 11:12:53,"<a href=""http://twitter.com/download/iphone"" rel=""nofollow"">Twitter for iPhone</a>",,,,
'1864780483868963313',"This is our moment to slash wasteful spending and eliminate useless government programs through President Trump’s @DOGE initiative.

The American people are behind us—let’s get it done. 

Thank you, @elonmusk and @VivekGRamaswamy for your leadership and commitment to America!",en,Tweet,0,23,3,14,2412,2024-12-05 21:14:47,"<a href=""https://mobile.twitter.com"" rel=""nofollow"">Twitter Web App</a>",,,,
'1864411178702614627',"America deserves a military that’s unmatched, unstoppable, and the most lethal fighting force the world has ever known.

Thank you, @PeteHegseth, for your service and commitment to America’s safety and security!",en,Tweet,0,14,4,0,1405,2024-12-04 20:47:18,"<a href=""https://mobile.twitter.com"" rel=""nofollow"">Twitter Web App</a>",,,,
'1863949932735991895',"When the government spends more, the American people have less.

The national debt is one of the greatest threats to our national security.",en,Tweet,0,20,4,10,1271,2024-12-03 14:14:29,"<a href=""https://mobile.twitter.com"" rel=""nofollow"">Twitter Web App</a>",,,,
'1863625902652822008',"Seven Americans are being held hostage by Hamas terrorists in Gaza, alongside hundreds of others. 

The Neutra family's unimaginable pain demands a renewed, urgent effort to bring them home. Now.",en,Tweet,0,18,2,12,11941,2024-12-02 16:46:54,"<a href=""https://mobile.twitter.com"" rel=""nofollow"">Twitter Web App</a>",,,,
'1863410618130219230',"I see Biden is ending his presidency with the same disregard for our justice system that he started it with, putting the interests of his family ahead of the needs of our country.",en,Tweet,0,122,22,30,4261,2024-12-02 02:31:26,"<a href=""http://twitter.com/download/iphone"" rel=""nofollow"">Twitter for iPhone</a>",,,,
'1863028148369047916',"America is built on small businesses. While Small Business Saturday comes to end, today and every day, I’m thankful for the local entrepreneurs who keep Oklahoma and our country strong.  

This holiday season, let’s continue to shop local and support them! https://t.co/dTUCQ65Xsi",en,Tweet,0,13,0,1,646,2024-12-01 01:11:38,"<a href=""http://twitter.com/download/iphone"" rel=""nofollow"">Twitter for iPhone</a>",,,photo,"https://pbs.twimg.com/media/GdrONWgXwAA4M3Z.jpg,https://pbs.twimg.com/media/GdrONWeW4AAkezu.jpg,https://pbs.twimg.com/media/GdrONWkWkAA9ZPq.jpg,https://pbs.twimg.com/media/GdrONWbXoAAJhTT.jpg"
'1862160393306538315',"From my family to yours, we wish you a blessed Thanksgiving! https://t.co/nAfTpFqASS",en,Tweet,0,9,1,0,424,2024-11-28 15:43:29,"<a href=""http://twitter.com/download/iphone"" rel=""nofollow"">Twitter for iPhone</a>",,,video,https://video.twimg.com/ext_tw_video/1862160377611505664/pu/vid/avc1/1280x720/VMw-lIz5jm6Iuoam.mp4?tag=12
'1861957650168123481',LEADERSHIP is returning to the White House in less than 2 months. 🇺🇸,en,Tweet,1,22,4,7,1467,2024-11-28 02:17:51,"<a href=""http://twitter.com/download/iphone"" rel=""nofollow"">Twitter for iPhone</a>",,,,
'1861839407885525387',Despicable threats like this are un-American and must be universally condemned.,en,Tweet,2,22,3,3,1002,2024-11-27 18:28:00,"<a href=""http://twitter.com/download/iphone"" rel=""nofollow"">Twitter for iPhone</a>",,,,
'1861515825968009284',"We must ensure this never happens in America again. 

Political lawfare against President Trump has undermined trust in our judicial system and shaken the foundation of our republic.",en,Tweet,0,20,4,3,1583,2024-11-26 21:02:12,"<a href=""http://twitter.com/download/iphone"" rel=""nofollow"">Twitter for iPhone</a>",,,,
'1861066675535163584',https://t.co/GOWtPtJDuU,zxx,Reply,0,1,1,0,286,2024-11-25 15:17:27,"<a href=""http://twitter.com/download/iphone"" rel=""nofollow"">Twitter for iPhone</a>",,,photo,https://pbs.twimg.com/media/GdPWQriXwAA7g4H.jpg
'1861066644891607312',https://t.co/dCZ3OdSPyF,zxx,Reply,0,2,1,1,321,2024-11-25 15:17:19,"<a href=""http://twitter.com/download/iphone"" rel=""nofollow"">Twitter for iPhone</a>",,,photo,https://pbs.twimg.com/media/GdPWPVlW4AAgyLe.jpg
'1861066621848092846',https://t.co/FyemIadfRA,zxx,Reply,0,0,1,1,91,2024-11-25 15:17:14,"<a href=""http://twitter.com/download/iphone"" rel=""nofollow"">Twitter for iPhone</a>",,,photo,https://pbs.twimg.com/media/GdPWN-2W4AAoGkc.jpg
'1861066598527779042',"The 119th @GOPpolicy committee is ready to deliver policy wins for the American people and support President Trump in legislating his America First agenda.   

Let’s get to work! 🇺🇸 https://t.co/7P66tfm6YH",en,Tweet,0,14,3,3,684,2024-11-25 15:17:08,"<a href=""http://twitter.com/download/iphone"" rel=""nofollow"">Twitter for iPhone</a>",,,photo,https://pbs.twimg.com/media/GdPWM7uWkAAjbSg.jpg
'1860092546975957091',"A safe America is a secure America. 

I’m ready to work with President Trump to reverse the Biden-Harris open border disaster.",en,Tweet,1,38,7,6,1468,2024-11-22 22:46:36,"<a href=""http://twitter.com/download/iphone"" rel=""nofollow"">Twitter for iPhone</a>",,,,
'1859614630911381768',I was proud to co sponsor this bill. The Senate should take the bill up immediately!,en,Tweet,0,36,11,14,4220,2024-11-21 15:07:32,"<a href=""https://mobile.twitter.com"" rel=""nofollow"">Twitter Web App</a>",,,,
'1859604073042866261',"The ICC has no credibility—just like the UN and WHO. These reckless arrest warrants for Israeli officials are outrageous.

Israel is fighting for its survival, and we won’t stand by as their lawful defense against Iran and its proxies is undermined.",en,Tweet,20,944,129,306,43623,2024-11-21 14:25:35,"<a href=""https://mobile.twitter.com"" rel=""nofollow"">Twitter Web App</a>",,,,
'1859431198369423410',The United States stands with Israel - today and always.,en,Tweet,34,1751,153,533,79633,2024-11-21 02:58:38,"<a href=""http://twitter.com/download/iphone"" rel=""nofollow"">Twitter for iPhone</a>",,,,
'1859325238674382984',Justice for Laken Riley,en,Tweet,1,45,5,7,1471,2024-11-20 19:57:36,"<a href=""https://mobile.twitter.com"" rel=""nofollow"">Twitter Web App</a>",,,,
