tweet_id,text,language,type,bookmark_count,favorite_count,retweet_count,reply_count,view_count,created_at,client,hashtags,urls,media_type,media_urls
'1888614677078225174',"Ensuring the SALT deduction returns, with no cap, is my top priority. Donald Trump promised this at his Nassau Colosseum rally, and I will work with him, and my bipartisan Congressional colleagues to get it done.
https://t.co/KsPQmF2UJN https://t.co/Ju2YdSooTA",en,Tweet,1,57,11,23,6177,2025-02-09 15:43:22,"<a href=""http://twitter.com/download/iphone"" rel=""nofollow"">Twitter for iPhone</a>",,https://www.newsday.com/long-island/politics/gillibrand-suozzi-lalota-gayy5sk9,photo,https://pbs.twimg.com/media/GjW1CdkXkAAqXsw.jpg
'1888317054765158872',https://t.co/1HrbxqFTNY,zxx,Reply,0,5,0,14,1302,2025-02-08 20:00:43,"<a href=""http://twitter.com/download/iphone"" rel=""nofollow"">Twitter for iPhone</a>",,https://www.realclearpolitics.com/video/2025/02/06/dem_rep_suozzi_to_elon_musk_give_us_a_list_of_cuts_you_think_would_make_sense_bring_it_before_the_congress.html,,
'1888316979267952788',https://t.co/HRyZPlWyR3,zxx,Tweet,2,57,16,35,3424,2025-02-08 20:00:25,"<a href=""http://twitter.com/download/iphone"" rel=""nofollow"">Twitter for iPhone</a>",,,photo,https://pbs.twimg.com/media/GjSmSQOWMAAexhW.jpg
'1888249081996156969',"Everyone wants to make government more efficient, but if we’re going to do this right, let’s follow the Constitution and bring a list of cuts directly to Congress. The Republicans control everything so they should be able to follow the law. Let’s get it done. https://t.co/1kOCgiFilH",en,Tweet,32,620,175,77,28993,2025-02-08 15:30:37,"<a href=""http://twitter.com/download/iphone"" rel=""nofollow"">Twitter for iPhone</a>",,,video,https://video.twimg.com/amplify_video/1888249002799337472/vid/avc1/720x720/IuXNNOuWasB1Ah_T.mp4?tag=16
'1888240546927329595',"Working For My Constituents

“‘Congressman [Tom] Suozzi spoke to everyone and anybody on our behalf to get this resolved and we are so grateful,’ Chenault said Friday. ‘The program will be open Monday; we’re not closing.’”
 https://t.co/PC89WNNBx5",en,Tweet,1,69,18,12,11824,2025-02-08 14:56:42,"<a href=""http://twitter.com/download/iphone"" rel=""nofollow"">Twitter for iPhone</a>",,https://www.newsday.com/long-island/education/manhasset-great-neck-head-start-mf5s10a4,,
'1887971555231068670',"UPDATE: I spoke with HHS Administration officials this morning and they have guaranteed me that funding will be in Great Neck/Manhasset Head Start’s accounts by Monday. Head start will therefore be OPEN on Monday. 
I will continue to fight to protect critical programs that work for our vulnerable children and families. 

Stephanie Chenault has been a tireless champion for her Head Start children and families. She is the embodiment of why these programs are important: with a fighter in their corner, there is nothing these young kids cannot do. Thank you, Stephanie.",en,Tweet,6,99,42,20,12337,2025-02-07 21:07:50,"<a href=""http://twitter.com/download/iphone"" rel=""nofollow"">Twitter for iPhone</a>",,,,
'1887926966210142578',"The people are tired of the finger-pointing and blame games for political advantage. I’m focused on real solutions—immigration and border security, the budget and deficit, and driving down costs. Let’s get it done. https://t.co/P1X19uWta1",en,Tweet,4,46,13,26,10298,2025-02-07 18:10:39,"<a href=""http://twitter.com/download/iphone"" rel=""nofollow"">Twitter for iPhone</a>",,,video,https://video.twimg.com/amplify_video/1887926885654364160/vid/avc1/720x720/ywRmcGjydRWCuVgv.mp4?tag=16
'1887871811875987863',"I am all for government efficiency, but I am not for hurting vulnerable children and families by cutting funding for Head Start. It’s unacceptable, and I will continue hounding the administration for answers until they unlock the funds Congress voted for in an overwhelmingly bipartisan fashion.

https://t.co/OpoiTQatmg",en,Tweet,0,36,13,20,13826,2025-02-07 14:31:29,"<a href=""http://twitter.com/download/iphone"" rel=""nofollow"">Twitter for iPhone</a>",,,photo,https://pbs.twimg.com/media/GjMRaEZWoAAJ4BJ.jpg
'1887848789962351102',"The Patriot Day Act recognizes that September 11, 2001, is a sacred day of remembrance and a date that changed our nation forever.

This week, @RepBrianFitz , my Republican Co-Chair of the Problem Solvers Caucus, and I introduced the Patriot Day Act. This bipartisan legislation aims to formally establish September 11th as a federal holiday.
https://t.co/xaCjnLAuYw",en,Tweet,1,33,4,37,21408,2025-02-07 13:00:00,"<a href=""http://twitter.com"" rel=""nofollow"">Twitter Web Client</a>",,,photo,https://pbs.twimg.com/media/GjJtAd9XEAArEWO.jpg
'1887669221724721510',"Today, the Problem Solvers Caucus signed our bylaws. With my friend, Republican @RepBrianFitz, we’re committed to solving America’s toughest problems. https://t.co/h0EVlo1cQc",en,Tweet,5,93,21,39,6025,2025-02-07 01:06:28,"<a href=""http://twitter.com/download/iphone"" rel=""nofollow"">Twitter for iPhone</a>",,,photo,https://pbs.twimg.com/media/GjJZJwoXQAA_NF4.jpg
'1887637398239989910',"“Defund the Police” was one of the dumbest slogans of all time. Any policy derived from it was even worse. 
Today I met with the @MjrCitiesChiefs, America’s Police Chiefs. I’m proud of my long-standing support of law enforcement. https://t.co/NkSiVvuJ0f",en,Tweet,0,25,5,30,1721,2025-02-06 23:00:01,"<a href=""https://mobile.twitter.com"" rel=""nofollow"">Twitter Web App</a>",,,photo,"https://pbs.twimg.com/media/GjIz6D1XMAASaO9.jpg,https://pbs.twimg.com/media/GjIz6D4XoAA1tBO.jpg"
'1887624448792273118',"Privacy is one of the most important principles in this country. Who really knows what they are doing with America’s enormous vault of your personal information? All we know is they have access. 

I will never stop fighting the abuse of your private information. https://t.co/pz7UoXjix9",en,Tweet,40,1151,410,231,65456,2025-02-06 22:08:33,"<a href=""http://twitter.com/download/iphone"" rel=""nofollow"">Twitter for iPhone</a>",,,video,https://video.twimg.com/amplify_video/1887624309604012032/vid/avc1/960x540/0gV2Fj13wDD1Ic15.mp4?tag=16
'1887203227705221365',"Today, I met with the Levittown Community Action Coalition. I found out the CDC has taken down pages on vaping and alcohol due to Trump's Executive Orders. I am deeply concerned this Administration is taking resources away from constituents. https://t.co/flXX9yLnRn",en,Tweet,3,96,37,32,7951,2025-02-05 18:14:46,"<a href=""http://twitter.com/download/iphone"" rel=""nofollow"">Twitter for iPhone</a>",,,video,https://video.twimg.com/amplify_video/1887203149791801344/vid/avc1/720x1280/M7hCSINJAV6C462W.mp4?tag=16
'1886905071289451002',"I’ve said it before, and I’ll say it again: New York’s 3rd Congressional District truly stands out as the smartest in America!

Last night, at @CSHL, I had the privilege of celebrating the remarkable achievements of 25 semi-finalists from our district in the prestigious Regeneron Science Talent Search, including two outstanding finalists. Additionally, we recognized the winner and runner-up of the Congressional App Challenge.

Remarkably, while our district represents only 0.2% of the U.S. population, it boasts an impressive 8.3% of the Regeneron semi-finalists. This is a testament to the extraordinary talent and dedication of our students and the exceptional high schools they attend. They are among the brightest minds in the nation. Congratulations to all of these exceptional individuals!",en,Tweet,0,12,0,9,1380,2025-02-04 22:30:00,"<a href=""http://twitter.com"" rel=""nofollow"">Twitter Web Client</a>",,,photo,https://pbs.twimg.com/media/Gi-bPriXkAA6kDW.jpg
'1886896262194348148',"An American Treasure.

“Knowing about Künstler’s obsession with accuracy and that Emanuel Leutze’s iconic 1851 painting of George Washington crossing the Delaware River during the American Revolution was rife with historical errors, then-Nassau County Executive Thomas Suozzi in 2011 commissioned a new accurate interpretation that garnered widespread press coverage.

‘Mort Künstler was an American treasure,’ Suozzi, now a congressman, said on Monday. ‘His paintings were beautiful, inspiring and historically accurate.’""
https://t.co/bj13jgiEMV",en,Tweet,1,7,1,0,1030,2025-02-04 21:55:00,"<a href=""https://mobile.twitter.com"" rel=""nofollow"">Twitter Web App</a>",,,photo,https://pbs.twimg.com/media/Gi-aIohX0AABc86.jpg
'1886440306310029483',"We need to get outside of our bubbles and talk to the people we represent. We don’t face Democratic issues or Republican issues. We face American issues and we need to work together, Democrats and Republicans, to solve them. https://t.co/gA9aENlQCK",en,Tweet,2,105,35,28,9004,2025-02-03 15:43:12,"<a href=""http://twitter.com/download/iphone"" rel=""nofollow"">Twitter for iPhone</a>",,,video,https://video.twimg.com/amplify_video/1886440232876220416/vid/avc1/1280x720/0ptg2P874z4OSIu3.mp4?tag=16
'1886067050092867588',"Democrats have a lot to offer working-class Americans. We support raising the minimum wage, strengthening unions, and focusing on kitchen table issues that directly impact people’s lives. It’s time to cut through the distractions and prioritize what really matters. https://t.co/NQ19Z0Hf5D",en,Tweet,16,314,82,184,46801,2025-02-02 15:00:00,"<a href=""https://mobile.twitter.com"" rel=""nofollow"">Twitter Web App</a>",,,video,https://video.twimg.com/ext_tw_video/1885769349018890240/pu/vid/avc1/960x540/EqeBr4xTYw8EJjSB.mp4?tag=12
'1885704665704387049',I’m proposing something new and bold. Asylum rules haven’t been updated in decades. Cartels and coyotes are gaming our asylum system and making billions in profit. Democrats and Republicans need to put our differences aside and fix this now. https://t.co/fN4LAsOxlT,en,Tweet,8,127,28,20,18695,2025-02-01 15:00:01,"<a href=""https://mobile.twitter.com"" rel=""nofollow"">Twitter Web App</a>",,,video,https://video.twimg.com/ext_tw_video/1885470464572633088/pu/vid/avc1/960x540/Y8cRP4l9_hgU6SGi.mp4?tag=12
'1885443982852788477',"President Trump is a master of distraction. While he’s saying one thing, he’s doing another. We need to hold President Trump accountable to his campaign promises to lower costs and end the war in Ukraine while not getting lost in all of his distractions. https://t.co/fNy6NJhfiP",en,Tweet,13,423,115,91,33381,2025-01-31 21:44:10,"<a href=""http://twitter.com/download/iphone"" rel=""nofollow"">Twitter for iPhone</a>",,,video,https://video.twimg.com/amplify_video/1885443906369708032/vid/avc1/1280x720/W33J08JV8OUImVXD.mp4?tag=16
'1885330908015976497',"It was great to join Jessica on the Raging Moderates podcast. I loved talking about my district and the need for bipartisanship when it comes to solving the most challenging issues our nation faces, including the border.",en,Tweet,4,47,11,9,9318,2025-01-31 14:14:50,"<a href=""http://twitter.com/download/iphone"" rel=""nofollow"">Twitter for iPhone</a>",,,,
'1884633509832134716',Read my full column here: https://t.co/Ad3IJhmJgz,en,Reply,0,1,0,0,636,2025-01-29 16:03:38,"<a href=""http://twitter.com/download/iphone"" rel=""nofollow"">Twitter for iPhone</a>",,https://www.longislandpress.com/2025/01/27/problem-solving-over-party-politics-common-sense-common-ground-common-good/,,
'1884633346589769744',"Since I was elected as the Mayor of Glen Cove and County Executive, and certainly in Congress, I have always tried to work across party lines to get things done.  As the newly elected Chair of the @ProbSolveCaucus, I will continue to prioritizing getting things done over party politics.",en,Tweet,1,24,8,10,4891,2025-01-29 16:02:59,"<a href=""http://twitter.com/download/iphone"" rel=""nofollow"">Twitter for iPhone</a>",,,photo,https://pbs.twimg.com/media/GieQCcrbUAAdSkY.jpg
'1884616613309067314',"Gōng Xǐ Fā Cái 

This year marks the transition from the Year of the Dragon to the Year of the Snake, symbolizing introspection, transformation, and growth.

May the Year of the Snake usher in prosperity, good health, and joy for everyone celebrating the Lunar New Year. Let's celebrate with hope and positivity!",en,Tweet,1,11,3,1,1062,2025-01-29 14:56:29,"<a href=""http://twitter.com/download/iphone"" rel=""nofollow"">Twitter for iPhone</a>",,,video,https://video.twimg.com/amplify_video/1884616543868219393/vid/avc1/720x962/RryyF6LM9vMjo65S.mp4?tag=16
'1884245592605589606',"Donald Trump’s been in office for just over a week now. It’s more important than ever that he follows the mandate the people have given us. Lower costs, border security and immigration reform. Let’s get it done. https://t.co/aJK5wYU1Hd",en,Tweet,4,63,13,41,7577,2025-01-28 14:22:11,"<a href=""http://twitter.com/download/iphone"" rel=""nofollow"">Twitter for iPhone</a>",,,photo,https://pbs.twimg.com/media/GiYvYUWXAAETsNc.jpg
'1884003152514670953',"Bun venit! 🇷🇴
Powitanie! 🇵🇱

Last week, I had the privilege of welcoming Andrei Muraru, the Romanian Ambassador to the United States, and Bogdan Klich, the chargé d'affaires at the Polish Embassy in Washington, to my DC office. Our meetings revolved around enhancing collaboration and solidarity between the US and Romania and the US and Poland, and reinforcing the importance of our alliances in addressing global challenges.",en,Tweet,0,5,0,5,1014,2025-01-27 22:18:49,"<a href=""http://twitter.com/download/iphone"" rel=""nofollow"">Twitter for iPhone</a>",,,photo,"https://pbs.twimg.com/media/GiVS4IYXYAEQ41X.jpg,https://pbs.twimg.com/media/GiVS4IaXEAEtFPD.jpg"
'1883877627234230729',"Today marks International Holocaust Remembrance Day, when we join with people around the world to commemorate the victims of the Holocaust on the 80th anniversary of the 1945 liberation of Auschwitz-Birkenau. #WeRemember https://t.co/8vEvTEoXfd",en,Tweet,0,14,2,1,946,2025-01-27 14:00:01,"<a href=""https://mobile.twitter.com"" rel=""nofollow"">Twitter Web App</a>",#WeRemember,,photo,https://pbs.twimg.com/media/GiRH3GkXoAAjR4X.jpg
'1883530338011398400',"On January 26, 1950, India embraced its constitution and proudly declared itself a sovereign republic. To all my friends in the Indian American community here on Long Island, in Queens, and across the world, let’s come together to celebrate this significant occasion. Wishing you all a joyous 76th Republic Day! Jai Hind!",en,Tweet,0,17,2,2,1471,2025-01-26 15:00:01,"<a href=""http://twitter.com"" rel=""nofollow"">Twitter Web Client</a>",,,photo,https://pbs.twimg.com/media/GiMBPWiXMAAkvRV.jpg
'1883167949911118205',It’s not worth doing this job just to win. You have to do something to make people’s lives better. https://t.co/CKLEprHKwu,en,Tweet,9,230,79,25,26885,2025-01-25 15:00:01,"<a href=""https://mobile.twitter.com"" rel=""nofollow"">Twitter Web App</a>",,,video,https://video.twimg.com/ext_tw_video/1882911404425949184/pu/vid/avc1/1280x720/TOAPxUnQP-6aoDko.mp4?tag=12
'1882804360477818982',"The Bipartisan infrastructure Law, which I helped negotiate, continues to pay dividends to NY-03’s constituents. The investments in Port Washington and Westbury in my district will safeguard and enhance our water infrastructure for future generations. As important, it takes the burden off local taxpayers.

https://t.co/Jh0ZT9JIzP",en,Tweet,0,12,1,66,1233,2025-01-24 14:55:15,"<a href=""http://twitter.com/download/iphone"" rel=""nofollow"">Twitter for iPhone</a>",,,photo,https://pbs.twimg.com/media/GiEQliYWsAAAsqT.jpg
'1882567134657548428',"Although I have not trained in Taekwondo, I am interested in learning, and I am deeply humbled to receive this honorary black belt. This award reflects my longstanding support for the Korean-American community, and was given in recognition of the House resolution I introduced today to commemorate the alliance between the Republic of Korea and the United States. 

My strong ties to the Korean communities on Long Island and in Queens reflect the deep friendship we share, making this recognition truly meaningful.",en,Tweet,0,21,1,6,1997,2025-01-23 23:12:35,"<a href=""http://twitter.com/download/iphone"" rel=""nofollow"">Twitter for iPhone</a>",,,photo,"https://pbs.twimg.com/media/GiA41EKXkAAT79G.jpg,https://pbs.twimg.com/media/GiA41ELXUAAIn5z.jpg"
'1882506019701768478',"Every week we are sitting down with 50 members of the House, both Republicans and Democrats, to solve the Congress’s biggest problems. Time to get to work!",en,Tweet,0,22,7,14,4048,2025-01-23 19:09:45,"<a href=""http://twitter.com/download/iphone"" rel=""nofollow"">Twitter for iPhone</a>",,,,
'1882138166616055924',I agree with the Fraternal Order of Police. President Trump’s pardon of cop beaters “sends a dangerous message.”,en,Tweet,11,664,237,104,47377,2025-01-22 18:48:02,"<a href=""http://twitter.com/download/iphone"" rel=""nofollow"">Twitter for iPhone</a>",,,,
'1882083949893263806',"The Fraternal Order of Police and this NY Post article just said what I have been thinking.

https://t.co/HLBXpxWfNx",en,Tweet,8,150,48,26,7842,2025-01-22 15:12:35,"<a href=""http://twitter.com/download/iphone"" rel=""nofollow"">Twitter for iPhone</a>",,https://nypost.com/2025/01/22/us-news/pro-trump-police-union-blasts-presidents-jan-6-pardons/,,
'1881688201712242849',"See my story in today’s New York Post:

“While it is easy to dwell on our disagreements, I am committed to working hard to find common ground to address the challenges we face.”

“I will stand firm and oppose the president and his party where our views differ, but I will also strive to identify solutions that serve the American people.”

https://t.co/FBOq17e0M9",en,Tweet,0,23,4,8,2010,2025-01-21 13:00:02,"<a href=""http://twitter.com"" rel=""nofollow"">Twitter Web Client</a>",,,,
'1881432779445113158',"It was my great honor to attend the inauguration of the President of the United States of America. I have deep respect for the office of the President.

While there were many parts of President Trump’s speech that I disagreed with or found to be inappropriate, I am focused on where we can work together and find common ground.

I agree with the President’s emphasis on stopping illegal immigration, deporting criminals and targeting the cartels and organized crime profiting from human exploitation at the southern border. These should be shared priorities for our nation.

Although the speech lacked specific details, I welcome the President’s commitment to “rapidly bring down costs and prices,” and make America “a manufacturing nation once again.”

I share the President’s lofty and important goal to “end the chronic disease epidemic and keep our children, safe, healthy, and disease free.”

While it is easy to dwell on our disagreements, I am committed to working hard to find common ground to address the challenges we face.

I will stand firm and oppose the President and his party where our views differ, but I will also strive to identify solutions that serve the American people.",en,Tweet,0,43,6,19,5498,2025-01-20 20:05:04,"<a href=""http://twitter.com/download/iphone"" rel=""nofollow"">Twitter for iPhone</a>",,,photo,https://pbs.twimg.com/media/GhwxJA6WcAEQqyn.jpg
'1881366738115444736',"There are reports that the Thai government may deport the Uyghur refugees during President Trump’s inauguration. If they did so, they would knowingly subject them to torture and ethnic cleansing. We need to pay attention.",en,Tweet,3,64,23,7,10290,2025-01-20 15:42:39,"<a href=""http://twitter.com/download/iphone"" rel=""nofollow"">Twitter for iPhone</a>",,,,
'1881365089414217989',I am in the Capitol Rotunda today to celebrate the peaceful transfer of power from President Biden to President-elect Trump. God bless the USA. https://t.co/QuspD3DVyZ,en,Tweet,1,40,3,8,3452,2025-01-20 15:36:06,"<a href=""http://twitter.com/download/iphone"" rel=""nofollow"">Twitter for iPhone</a>",,,video,https://video.twimg.com/amplify_video/1881365020950327296/vid/avc1/1280x720/Qjh1xIKEVMqluUY_.mp4?tag=16
'1881325807131660289',"Today, as we inaugurate a new president, we also honor the legacy of Dr. Martin Luther King, Jr., a true American hero.

In my office hangs a photo of Dr. King with a small group in a church basement. I show it to visitors, especially young ones, to remind them that he didn't begin with millions listening to his ""I Have a Dream"" speech on the steps of the Lincoln Memorial.

Dr. King faced immense challenges. He tirelessly organized, fought, and inspired countless individuals to rise above their fears and anger, to work together to build a world grounded in love, truth, and justice.

As we face the dawn of a new administration in a time of deep division, let us be inspired by MLK’s unwavering hope and determination. Working together, let us heal our divisions and aspire to make America “a more perfect union” that is truly a light to all the world.",en,Tweet,0,21,3,4,1291,2025-01-20 13:00:00,"<a href=""http://twitter.com"" rel=""nofollow"">Twitter Web Client</a>",,,photo,https://pbs.twimg.com/media/GhrmaRKX0AAH4sk.jpg
'1881070283689525664',"I am heartened to see 3 hostages reunited with their families this morning. This is a bittersweet moment knowing not all families will share in this joy. I remain committed to fighting for the return of my constituent, Omer Neutra, whose body has been unjustly kept for more than 16 months.",en,Tweet,1,34,5,5,4189,2025-01-19 20:04:38,"<a href=""http://twitter.com/download/iphone"" rel=""nofollow"">Twitter for iPhone</a>",,,,
'1880667875230498978',"Watch my interview from @TheDailyShow with @jordanklepper! I will resist Donald Trump when necessary, but let’s work together where we can. https://t.co/EY2N0dZc6Y",en,Tweet,10,72,21,14,12270,2025-01-18 17:25:37,"<a href=""http://twitter.com/download/iphone"" rel=""nofollow"">Twitter for iPhone</a>",,,video,https://video.twimg.com/amplify_video/1880667517607198720/vid/avc1/1280x720/CDY_8np4bimVSbTP.mp4?tag=16
'1880616133382083008',"Aditya Varma, a senior at Syosset High School, just won my Congressional App Challenge with his “Rent Your Driveway,” app!

Aditya’s app is a game-changer for drivers and homeowners alike. It makes it easier to find private driveway parking near essential locations like schools, hospitals, and train stations. It's a practical solution that efficiently addresses a common problem.

Congratulations to Aditya and thank you to all the students who participated this year. You are our future!",en,Tweet,0,14,3,1,2607,2025-01-18 14:00:01,"<a href=""http://twitter.com"" rel=""nofollow"">Twitter Web Client</a>",,,video,https://video.twimg.com/ext_tw_video/1880444410074214400/pu/vid/avc1/1280x720/MjMcZqHqlGYRG76F.mp4?tag=12
'1880389645982126130',"If you would like to watch my whole interview with @jordanklepper from @TheDailyShow,  you can watch it here. It’s fun! Let me know what you think.
https://t.co/PkvLU3NSwt",en,Tweet,0,10,2,5,2770,2025-01-17 23:00:02,"<a href=""https://mobile.twitter.com"" rel=""nofollow"">Twitter Web App</a>",,https://youtu.be/djlGnrHY-38?si=R6ICrbPo9O9Vz5Gx,,
'1880367141167472799',"I’ve laid out my promises clearly. I will resist Donald Trump if he tries to cut healthcare or climate-related subsidies. I will resist Donald Trump if he attempts to weaponize the DOJ. But for the sake of the American people, let’s work together where we can. https://t.co/lB43ML3Ndl",en,Tweet,28,648,140,82,70797,2025-01-17 21:30:36,"<a href=""http://twitter.com/download/iphone"" rel=""nofollow"">Twitter for iPhone</a>",,,video,https://video.twimg.com/amplify_video/1880364485052870656/vid/avc1/1280x720/nXlYw5AjGWKQz4Mx.mp4?tag=16
'1880305144593805742',"Donald Trump and the Republicans are master distractors. While they talk about Greenland, the Panama Canal, and the Gulf of America, they distract the American people from the issues that matter… lower prices, better paying jobs, and a safer nation. We need to stay focused. https://t.co/Vf8y6mFAA6",en,Tweet,11,246,66,19,11454,2025-01-17 17:24:15,"<a href=""http://twitter.com/download/iphone"" rel=""nofollow"">Twitter for iPhone</a>",,,video,https://video.twimg.com/amplify_video/1880303124700663808/vid/avc1/568x320/BsfVjfjm-YoJdaMl.mp4?tag=16
'1880261521563131928',"Last night I made a bold promise. I promised to work with both Democrats and Republicans to get an agenda done that works for the American people. I’ll never compromise my values, but I’ll work with anyone who genuinely wants to solve problems. https://t.co/mrRdDCDjwI",en,Tweet,34,403,86,38,83532,2025-01-17 14:30:54,"<a href=""http://twitter.com/download/iphone"" rel=""nofollow"">Twitter for iPhone</a>",,,video,https://video.twimg.com/amplify_video/1880261191651450880/vid/avc1/1280x720/UzVuviRF_NDb33m-.mp4?tag=16
'1880080098327736524',"Coming up at 11pm, I will be joining @jordanklepper on @thedailyshow on @comedycentral. C’mon, stay up a bit later and tune in!

Photo credit: The Daily Show/Matthew Wilson https://t.co/53CphMZFNv",en,Tweet,0,75,9,3,63483,2025-01-17 02:30:00,"<a href=""https://mobile.twitter.com"" rel=""nofollow"">Twitter Web App</a>",,,photo,"https://pbs.twimg.com/media/GhdfXUZXAAAMtsf.jpg,https://pbs.twimg.com/media/GhdfXUYWkAAuN38.jpg"
'1880024129191178289',I’m excited to be making my @ComedyCentral debut tonight with @jordanklepper at 11pm. I hope you’ll tune in. https://t.co/QFNWRQxhwH,en,Tweet,2,80,6,8,5530,2025-01-16 22:47:36,"<a href=""http://twitter.com/download/iphone"" rel=""nofollow"">Twitter for iPhone</a>",,,photo,https://pbs.twimg.com/media/Ghcv-wLWYAAWnCX.jpg
