tweet_id,text,language,type,bookmark_count,favorite_count,retweet_count,reply_count,view_count,created_at,client,hashtags,urls,media_type,media_urls
'1943779932049396065',"Thank you to @POTUS and his team for coming to the Lone Star State to comfort those impacted by the tragic floods. 

I was grateful to be there standing alongside such strong leaders in support of the Kerrville community.

Texas Strong. 🇺🇸 https://t.co/nZvoF4N3CF",en,Tweet,0,43,7,13,1485,2025-07-11 22:10:24,"<a href=""http://twitter.com/download/iphone"" rel=""nofollow"">Twitter for iPhone</a>",,,photo,https://pbs.twimg.com/media/GvmxjCpXgAA-gdN.jpg
'1943702905388663258',"Rep. Self on strengthening Medicaid: “[Americans] should be in the economy, knowing the dignity and the value of work. And yet, some able-bodied adults are on Medicaid, simply cashing their government check when they could be working.” That ends now. https://t.co/ONnxaWQPH2",en,Tweet,1,27,4,8,2020,2025-07-11 17:04:19,"<a href=""http://twitter.com/download/iphone"" rel=""nofollow"">Twitter for iPhone</a>",,https://www.cbsnews.com/texas/news/texas-representatives-react-president-trump-one-big-beautiful-bill-becoming-law-when-effect/,,
'1943690336691187723',"Well said, @RepChipRoy. 

We are Texas tough, and we’ll get through this together. Grateful for all the community leaders across Texas who have stepped up in this challenging time. https://t.co/hz5zvVqmko",en,Tweet,0,22,6,4,917,2025-07-11 16:14:22,"<a href=""http://twitter.com/download/iphone"" rel=""nofollow"">Twitter for iPhone</a>",,,video,https://video.twimg.com/amplify_video/1943690266977656832/vid/avc1/1280x720/ZmIKw0ViRHM50BCs.mp4?tag=14
'1943671532607115576',"Unlike Democrats and the liberal media, I stand with those who are making America safe again! https://t.co/C5FyC0uNRy",en,Tweet,0,60,9,15,1579,2025-07-11 14:59:39,"<a href=""http://twitter.com/download/iphone"" rel=""nofollow"">Twitter for iPhone</a>",,,photo,https://pbs.twimg.com/media/GvlO9UwWkAEwH3Q.jpg
'1943473562318262359',"I have been trying to get @RepMikeCollins to join me for my morning workout since freshman orientation. 😎

Let’s pass those 12 appropriations bills!",en,Tweet,1,21,5,3,2904,2025-07-11 01:52:59,"<a href=""http://twitter.com/download/iphone"" rel=""nofollow"">Twitter for iPhone</a>",,,,
'1943455412503876041',"Couldn’t agree more, @POTUS! 

The Senate should take note. 

Defend the taxpayer. Pass the rescissions. https://t.co/uFsB8170pj",en,Tweet,4,1350,422,128,12192,2025-07-11 00:40:52,"<a href=""http://twitter.com/download/iphone"" rel=""nofollow"">Twitter for iPhone</a>",,,photo,https://pbs.twimg.com/media/GviKZXRWQAAHpb2.jpg
'1943438165596885424',"“As part of negotiations over Trump’s ‘one big, beautiful bill,’ which was signed into law earlier this month, the White House promised members of the House Freedom Caucus that the president would issue several executive actions targeting illegal immigration.”",en,Reply,0,11,2,7,1880,2025-07-10 23:32:20,"<a href=""http://twitter.com/download/iphone"" rel=""nofollow"">Twitter for iPhone</a>",,,,
'1943438163055382602',Another win for the American people secured by the House Freedom Caucus. 🇺🇸 https://t.co/btnfB9VAoY,en,Tweet,0,14,4,3,959,2025-07-10 23:32:20,"<a href=""http://twitter.com/download/iphone"" rel=""nofollow"">Twitter for iPhone</a>",,https://www.wsj.com/politics/policy/trump-administration-says-immigrants-in-country-illegally-cant-access-head-start-other-programs-653709cd?st=cQPRwV&reflink=article_imessage_share,,
'1943414909896716311',"American taxpayer-funded benefits are for Americans — not illegal aliens.

This isn’t controversial. It’s common sense.

Thanks, @POTUS! https://t.co/f1VrJ239Ba",en,Tweet,0,50,8,9,1221,2025-07-10 21:59:56,"<a href=""https://mobile.twitter.com"" rel=""nofollow"">Twitter Web App</a>",,,video,https://video.twimg.com/amplify_video/1943414715671007232/vid/avc1/1280x720/lAY51GWG7217bHdC.mp4?tag=14
'1943371744841994362',"“If you talk the game and say ‘let’s reduce spending’ and you vote against this bill, you ought to hide your head in a bag.”

Spot on, @SenJohnKennedy. 🎯🔥",en,Tweet,23,3772,1388,80,27360,2025-07-10 19:08:24,"<a href=""https://mobile.twitter.com"" rel=""nofollow"">Twitter Web App</a>",,,,
'1943346629492289897',"Another day, another rogue activist judge sabotaging President Trump’s America First agenda that 77 million people voted for. https://t.co/crouZzikA9",en,Tweet,1,18,3,17,1031,2025-07-10 17:28:36,"<a href=""http://twitter.com/download/iphone"" rel=""nofollow"">Twitter for iPhone</a>",,https://link.theepochtimes.com/mkt_app/us/federal-judge-issues-new-nationwide-block-targeting-trumps-birthright-citizenship-order-5885598?utm_medium=app&c=share_pos1&pid=iOS_app_share&utm_source=iOS_app_share,,
'1943334989371740631',"The American people voted for mass deportations, not mass amnesty.",en,Tweet,40,9982,1209,591,136450,2025-07-10 16:42:21,"<a href=""http://twitter.com/download/iphone"" rel=""nofollow"">Twitter for iPhone</a>",,,,
'1943038826164724121',https://t.co/OX63k5EtIg,zxx,Reply,0,11,3,2,810,2025-07-09 21:05:30,"<a href=""https://mobile.twitter.com"" rel=""nofollow"">Twitter Web App</a>",,https://dailycitizen.focusonthefamily.com/federal-judge-rules-trump-administration-must-keep-funding-planned-parenthood/,,
'1943038824722108869',"An Obama-appointed district judge is attempting to exercise authority over Congress, the President, and SCOTUS, which upheld blocking funding for Planned Parenthood. 

Congress controls spending, not activist judges posing as kings. Their abuse of power must be checked.",en,Tweet,3,484,111,53,5007,2025-07-09 21:05:30,"<a href=""https://mobile.twitter.com"" rel=""nofollow"">Twitter Web App</a>",,,,
'1942997491500118411',"Thank you to President Trump and his Cabinet for praying for Texas in our time of need. 

Grateful to have an administration that believes in the power of prayer. 🙏🏼",en,Tweet,1,52,9,25,2155,2025-07-09 18:21:15,"<a href=""http://twitter.com/download/iphone"" rel=""nofollow"">Twitter for iPhone</a>",,,,
'1942976106292039873',American jobs are for American workers. 🇺🇸 https://t.co/sAKfnYxxK2,en,Tweet,0,63,11,12,1802,2025-07-09 16:56:17,"<a href=""http://twitter.com/download/iphone"" rel=""nofollow"">Twitter for iPhone</a>",,,video,https://video.twimg.com/amplify_video/1942976050960465921/vid/avc1/1280x720/Bnj-8I4msUhnRd4E.mp4?tag=21
'1942946868608045101',"“The choice before our citizens and voters is increasingly stark: burying ourselves deeper in debt and dependence or recapturing freedom and personal responsibility.”

Great read on the @freedomcaucus’ fight for fiscal discipline. https://t.co/vzNfhAzWLX",en,Tweet,0,61,14,18,6874,2025-07-09 15:00:06,"<a href=""http://twitter.com/download/iphone"" rel=""nofollow"">Twitter for iPhone</a>",,https://www.creators.com/read/star-parker/07/25/give-the-house-freedom-caucus-the-credit-it-deserves#increaseFont,,
'1942716195871904056',"The Senate has every right to be embarrassed if they can’t muster the courage to save taxpayers $9.4 billion in wasteful spending when the U.S. is $37 TRILLION in debt. 

Let’s get some cuts to federal spending fat!",en,Tweet,5,1283,447,90,12956,2025-07-08 23:43:29,"<a href=""http://twitter.com/download/iphone"" rel=""nofollow"">Twitter for iPhone</a>",,,,
'1942673827445760331',"Thank you, SCOTUS, for overruling a California-based activist judge.

Shrinking the federal government and making it more efficient is exactly what the American people demanded when they gave Republicans a trifecta. https://t.co/hf3DR2c53C",en,Tweet,1,181,38,8,3687,2025-07-08 20:55:08,"<a href=""https://mobile.twitter.com"" rel=""nofollow"">Twitter Web App</a>",,https://www.reuters.com/legal/litigation/us-supreme-court-lifts-order-that-blocked-trumps-mass-federal-layoffs-2025-07-08/,,
'1942671090083410415',Just a reminder. 👇 https://t.co/s4QEdyk09p,en,Tweet,0,22,3,3,883,2025-07-08 20:44:15,"<a href=""https://mobile.twitter.com"" rel=""nofollow"">Twitter Web App</a>",,,photo,https://pbs.twimg.com/media/GvXBD3nWsAAgC5b.png
'1942615935153492232',https://t.co/QldIfcyucj,zxx,Reply,0,11,2,3,590,2025-07-08 17:05:05,"<a href=""http://twitter.com/download/iphone"" rel=""nofollow"">Twitter for iPhone</a>",,https://www.whitehouse.gov/fact-sheets/2025/07/fact-sheet-president-donald-j-trump-ends-market-distorting-subsidies-for-unreliable-foreign-controlled-energy-sources/,,
'1942615932242743770',"Thank you, @POTUS, for fulfilling your promise to repeal the Green New Scam, stepping in where Congress fell short. 

This decisive action reflects the will of the American people. 🇺🇸 https://t.co/PtynMEl3c8",en,Tweet,0,101,24,19,3983,2025-07-08 17:05:04,"<a href=""http://twitter.com/download/iphone"" rel=""nofollow"">Twitter for iPhone</a>",,,photo,https://pbs.twimg.com/media/GvWO5P4WoAARCDE.jpg
'1942609431377649993',"The American people were heard. 

Absolutely no amnesty!",en,Tweet,6,2173,410,221,21830,2025-07-08 16:39:15,"<a href=""http://twitter.com/download/iphone"" rel=""nofollow"">Twitter for iPhone</a>",,,,
'1942593511968366833',Excellent article by @BrianHDarling!,en,Reply,0,5,0,1,551,2025-07-08 15:35:59,"<a href=""http://twitter.com/download/iphone"" rel=""nofollow"">Twitter for iPhone</a>",,,,
'1942593182161854650',"🚨 “But for the pressure put on House and Senate leadership by conservatives, the legislation would have been molded by centrist senators and House members in a way that both busts the budget and violates President Donald Trump‘s promise to cut taxes.”
https://t.co/XR7FDSTUmL",en,Tweet,0,21,4,10,923,2025-07-08 15:34:40,"<a href=""http://twitter.com/download/iphone"" rel=""nofollow"">Twitter for iPhone</a>",,https://www.washingtonexaminer.com/opinion/3464424/house-freedom-caucus-thomas-massie-rand-paul-big-beautiful-bill-improvements/,,
'1942587319397040269',"Democrats are lying about the Medicaid provisions in the OBBB, so let’s set the record straight. ⬇️

Medicaid is for:
✅ pregnant women
✅ the elderly
✅ the disabled
✅ children

Medicaid is not for:
❌ illegal aliens
❌ working age able-bodied adults https://t.co/RRzZeV1WDU",en,Tweet,3,143,36,24,9445,2025-07-08 15:11:23,"<a href=""http://twitter.com/download/iphone"" rel=""nofollow"">Twitter for iPhone</a>",,,video,https://video.twimg.com/amplify_video/1942587257778565120/vid/avc1/886x490/aj1bVy_z9e_ljm4u.mp4?tag=21
'1942333256419971498',"The U.S. just passed $37 trillion in national debt and is already well on its way to $38 trillion. 

Yet, the Senate is having issues passing a measly $9.4 billion in rescissions?

No wonder we are where we are today. 

Washington is ADDICTED to spending YOUR hard-earned money.",en,Tweet,30,4812,980,599,156582,2025-07-07 22:21:49,"<a href=""http://twitter.com/download/iphone"" rel=""nofollow"">Twitter for iPhone</a>",,,,
'1942288965194694962',"Scott Ruskan is an American Hero. 🇺🇸

All of Texas thanks the U.S. military, first responders, and volunteers who are doing everything in their power and working around the clock to save as many lives as possible.",en,Tweet,0,39,9,2,2581,2025-07-07 19:25:49,"<a href=""http://twitter.com/download/iphone"" rel=""nofollow"">Twitter for iPhone</a>",,,,
'1942246124192227721',"Thankful no Border Patrol agents were killed in this despicable attack.

The brave men and women who put their lives on the line to protect our borders and safeguard our communities are heroes.

The Left’s anti-law enforcement rhetoric that radicalizes their base must stop.",en,Tweet,1,43,10,6,2242,2025-07-07 16:35:35,"<a href=""http://twitter.com/download/iphone"" rel=""nofollow"">Twitter for iPhone</a>",,,,
'1942231112798933464',".@freedomcaucus fought relentlessly to strengthen the Big Beautiful Bill. We secured major wins, including significant commitments on offsets. 

In DC, being a yes man is easy—holding firm under pressure is tough. We stood strong to deliver real results for the American people. https://t.co/lHkO6UvgLG",en,Tweet,0,45,11,17,2822,2025-07-07 15:35:56,"<a href=""http://twitter.com/download/iphone"" rel=""nofollow"">Twitter for iPhone</a>",,,video,https://video.twimg.com/amplify_video/1942231048189808640/vid/avc1/886x490/Z-kC2NBtxlEaWCQ9.mp4?tag=21
'1941528503742234766',"Tracy and I are praying for all impacted by the catastrophic flooding in the Texas Hill Country. Our hearts ache for those who are grieving the loss of precious loved ones.

Our deepest gratitude goes out to the heroic first responders for their tireless efforts, Governor Abbott for his leadership, and to the Trump Administration for offering support during this tragic time. 

Pray for Texas.",en,Tweet,0,48,3,13,1814,2025-07-05 17:04:01,"<a href=""http://twitter.com/download/iphone"" rel=""nofollow"">Twitter for iPhone</a>",,,,
'1941306915532963955',"It was great seeing @RepArrington at the White House today.  

Jodey was a tremendous warrior who helped make the Big Beautiful Bill better. https://t.co/SAVRnBb9hQ",en,Tweet,0,87,8,11,3187,2025-07-05 02:23:31,"<a href=""http://twitter.com/download/iphone"" rel=""nofollow"">Twitter for iPhone</a>",,,photo,https://pbs.twimg.com/media/GvDoSvbWYAAaEox.jpg
'1941275418184777929',It was a privilege to be at the White House today for the signing of the Big Beautiful Bill and see Old Glory flying thanks to U.S. Flag &amp; Flagpole Supply in CD3. https://t.co/TqQQ0xz4qM,en,Tweet,2,306,25,43,5050,2025-07-05 00:18:21,"<a href=""http://twitter.com/download/iphone"" rel=""nofollow"">Twitter for iPhone</a>",,,photo,https://pbs.twimg.com/media/GvDLf1XWQAAtbZY.jpg
'1941157140674347168',"Today, we celebrate the courage, wisdom, and enduring vision of our Founding Fathers. 

We also express heartfelt gratitude to all who have served, and those currently serving, to protect our nation and the freedoms we cherish.

Tracy and I wish everyone in TX-03 a safe, joyful, and deeply meaningful Independence Day!",en,Tweet,1,78,5,20,2018,2025-07-04 16:28:21,"<a href=""http://twitter.com/download/iphone"" rel=""nofollow"">Twitter for iPhone</a>",,,video,https://video.twimg.com/amplify_video/1941157082104786944/vid/avc1/960x960/dENeErFCZbDoi9f6.mp4?tag=21
'1940922069455405373',"Sec. Bessent: “These Freedom Caucus Congressmen have reset the center of gravity in terms of the spending. They’re holding people’s feet to the fire.” 🔥 

Thank you, @SecScottBessent.  

At your service, it is a privilege to lead the way. https://t.co/CqXHCfvMTF",en,Tweet,1,107,21,38,4971,2025-07-04 00:54:16,"<a href=""http://twitter.com/download/iphone"" rel=""nofollow"">Twitter for iPhone</a>",,,video,https://video.twimg.com/amplify_video/1940921920578375680/vid/avc1/1280x720/RtSzryyOyuVcDjDP.mp4?tag=21
'1940905188715565110',"For the 4th month in a row, job growth shattered expectations. 📈🔥

June: 147K (vs. 110K predicted)

May: 139K (vs. 130K predicted)

April: 175K (vs. 133K predicted) 

March: 228K (vs. 214K predicted) 

President Trump’s economy is roaring. 🇺🇸",en,Tweet,2,200,42,53,4762,2025-07-03 23:47:11,"<a href=""http://twitter.com/download/iphone"" rel=""nofollow"">Twitter for iPhone</a>",,,,
'1940836340171493568',"President Trump has shown true leadership by listening to all voices involved with making the Big Beautiful Bill a success for the American people.

Multiple spending issues have now been addressed, and with that, I am confident that we can move forward to ensure that this historic piece of legislation will have a lasting impact for future generations. 

While the bill is not perfect, there are significant conservative wins the House Freedom Caucus has achieved, including, among other things, securing nearly $1 trillion in Medicaid savings. 

HFC moved the bill dramatically to the right on almost every front and at every stage of the process, including overnight, as a small group of us continued working with the White House to address critical policy and spending issues. 

President John F. Kennedy said, “We do these things, not because they are easy, but because they are hard.” In this case, “these things” were hard-fought with a man whom I voted for and for whom I have tremendous respect—President Donald J. Trump.

For these reasons, I voted YES on the rule AND final passage of the Big Beautiful Bill.",en,Tweet,15,552,81,247,25042,2025-07-03 19:13:37,"<a href=""http://twitter.com/download/iphone"" rel=""nofollow"">Twitter for iPhone</a>",,,,
'1940587251475652832',"I came to Washington to help rein in our national debt.

In negotiations with House leadership, commitments were made to ensure the One Big Beautiful Bill would include key provisions, such as:

 - Matching every $1 of tax cuts with $1 of spending cuts.

- Terminating Biden's Green New Scam.

- Prohibiting taxpayer-funded experimental gender transition procedures.

The Senate broke the House framework, and then they stomped all over it. Now, House leadership wants to cram this broken bill down our throats by rushing it to the floor while in the middle of discussions, completely disregarding their promises.

The only way of making this right is by leadership adhering to their commitments and restoring, at a minimum, these three important issues from the House version.

While honoring one's commitment may be a rare commodity in Washington, each member of Congress is obligated to return home and explain their actions to the constituents they serve.

Ultimately, this is an issue of morality. Abiding by our word is the only thing we have; therefore, as the bill currently stands, I voted against the rule.

We have an incredibly rare opportunity to extend President Trump's tax cuts, begin restoring fiscal sanity by reducing spending to pre-COVID numbers and truly leave our country better than we found it.",en,Tweet,105,2756,489,5365,705723,2025-07-03 02:43:49,"<a href=""http://twitter.com/download/iphone"" rel=""nofollow"">Twitter for iPhone</a>",,,,
'1940543756207640678',"The Senate’s version of the BBB is morally and fiscally bankrupt. 

We must get back closer to the House-passed version. https://t.co/VIh6bJ013T",en,Tweet,106,1296,325,1176,1156868,2025-07-02 23:50:59,"<a href=""http://twitter.com/download/iphone"" rel=""nofollow"">Twitter for iPhone</a>",,,photo,https://pbs.twimg.com/media/Gu4yQmkWAAEJYYI.jpg
'1940534638205972728',"🚨Rep. Self on the Senate's reconciliation bill: “You’re going to hear a lot about the tax cuts, but nobody is talking about the deficit...We are going to get the tax cuts done in some fashion, but we cannot saddle our children and grandchildren with an exploding national debt.” https://t.co/MTOucEzd1m",en,Tweet,10,278,64,242,19546,2025-07-02 23:14:45,"<a href=""http://twitter.com/download/iphone"" rel=""nofollow"">Twitter for iPhone</a>",,,video,https://video.twimg.com/amplify_video/1940534473998667776/vid/avc1/1280x720/uqxIqEIBn3vlV4B4.mp4?tag=21
'1940451990523543901',"Thank you, @tperkins. 

It is important for Americans to realize the Senate has relinquished the moral high ground in their version of the BBB.",en,Tweet,1,26,3,25,4868,2025-07-02 17:46:21,"<a href=""http://twitter.com/download/iphone"" rel=""nofollow"">Twitter for iPhone</a>",,,,
'1940432529326272588',"The Senate has failed us.

Their version of the BBB increases our deficit, plunges our country into further debt, and rolls back conservative wins the House secured.

I support President Trump, but this is not an acceptable bill. https://t.co/vkS0n1AxlG",en,Tweet,10,555,70,267,23467,2025-07-02 16:29:01,"<a href=""http://twitter.com/download/iphone"" rel=""nofollow"">Twitter for iPhone</a>",,,video,https://video.twimg.com/amplify_video/1940432437982494721/vid/avc1/960x960/cR3EQyd-b-49tZIn.mp4?tag=21
'1940405318154121240',Rep. Keith Self: “We sent over there a framework that the Speaker of the House was very clear to the Senate: Don't send me back a bill that is materially different and they certainly have.” https://t.co/lqlhlrcEGL,en,Tweet,3,157,47,88,5143,2025-07-02 14:40:53,"<a href=""http://twitter.com/download/iphone"" rel=""nofollow"">Twitter for iPhone</a>",,https://www.audacy.com/krld/news/politics/some-house-republicans-not-happy-with-bill-changes,,
'1940387679620980971',"Fifty years ago today, I set out on my career fighting for America, “in the teeth of a summer storm.”

I am still fighting, but this “summer storm” is very different. 🇺🇸 https://t.co/eYCZOuYKsY",en,Tweet,1,83,17,39,3545,2025-07-02 13:30:48,"<a href=""http://twitter.com/download/iphone"" rel=""nofollow"">Twitter for iPhone</a>",,,photo,https://pbs.twimg.com/media/Gu2kT4CXsAEW88o.jpg
'1940220052017402095',"Many Senators thought they were voting for a bill that would end the Green New Scam.

Turns out, a last-minute paragraph inserted by lobbyists and agreed to by leadership does the exact opposite. 

What else is lurking in this bill? And why is the House being pressured to vote on it with less than 24 hours to review?",en,Tweet,43,2010,696,400,55705,2025-07-02 02:24:42,"<a href=""http://twitter.com/download/iphone"" rel=""nofollow"">Twitter for iPhone</a>",,,,
'1940150264729940224',"The Senate has done some serious damage to President Trump’s Big Beautiful Bill!

Let’s see if we can fix it. https://t.co/Z1Fax5HuNJ",en,Tweet,6,63,17,35,3387,2025-07-01 21:47:24,"<a href=""https://mobile.twitter.com"" rel=""nofollow"">Twitter Web App</a>",,,photo,https://pbs.twimg.com/media/GuzMV42WgAAuKQr.jpg
'1940138192726061182',"The Senate’s BBB EXTENDS the Green New Scam.

This is NOT what the American people voted for.

This is NOT President Trump’s BBB — this is a swamp creation!",en,Tweet,13,572,189,141,29688,2025-07-01 20:59:25,"<a href=""http://twitter.com/download/iphone"" rel=""nofollow"">Twitter for iPhone</a>",,,,
'1940123790744465795',"The Senate’s version of the OBBB is UNACCEPTABLE:

❌ Keeps able-bodied, working-age adults on Medicaid
❌ Only defunds Planned Parenthood for one year instead of ten
❌ Subsidizes the Green New Scam

The American people deserve better.",en,Tweet,18,749,198,143,13679,2025-07-01 20:02:12,"<a href=""https://mobile.twitter.com"" rel=""nofollow"">Twitter Web App</a>",,,,
'1940096810162253945',"Go @RepOgles!

The American people are with you. 🇺🇸",en,Tweet,1,101,30,22,3560,2025-07-01 18:14:59,"<a href=""https://mobile.twitter.com"" rel=""nofollow"">Twitter Web App</a>",,,,
'1940090886848672091',"“The most significant threat to our national security is our debt.”

- Joint Chiefs of Staff, Adm. Mike Mullen",en,Tweet,0,56,13,24,2587,2025-07-01 17:51:27,"<a href=""https://mobile.twitter.com"" rel=""nofollow"">Twitter Web App</a>",,,,
'1940058764327198922',"The United States is $37 TRILLION in the red. 🚨

This is unsustainable.

I support President Trump and his tax cuts, but we cannot saddle our children and grandchildren with TRILLIONS upon TRILLIONS in new debt. https://t.co/lhHImZg4uz",en,Tweet,3,63,8,40,3884,2025-07-01 15:43:48,"<a href=""http://twitter.com/download/iphone"" rel=""nofollow"">Twitter for iPhone</a>",,,video,https://video.twimg.com/amplify_video/1940058636534874112/vid/avc1/886x490/eEs_Uf8U-bBoj2SM.mp4?tag=21
'1940024424528318674',"Why do POLITICIANS keep kicking the can down the road and burdening our children and grandchildren with an unbearable financial crisis?

THEY are killing the American dream!",en,Tweet,1,212,37,50,4381,2025-07-01 13:27:21,"<a href=""http://twitter.com/download/iphone"" rel=""nofollow"">Twitter for iPhone</a>",,,,
'1939844823378251859',"🚨🚨🚨

14.6 billion reasons to reform healthcare in America.",en,Tweet,0,99,25,10,4719,2025-07-01 01:33:41,"<a href=""http://twitter.com/download/iphone"" rel=""nofollow"">Twitter for iPhone</a>",,,,
'1939808119145865496',"Thank you, @SpeakerJohnson!

I agree.",en,Tweet,1,21,6,11,3216,2025-06-30 23:07:50,"<a href=""https://mobile.twitter.com"" rel=""nofollow"">Twitter Web App</a>",,,,
'1939807002407903667',"The House was clear: no new deficit spending. 

The Senate isn’t listening—their version adds over $1T to the deficit, completely ignoring the House framework.

This isn’t just reckless—it’s fiscally criminal.",en,Tweet,2,210,57,73,30067,2025-06-30 23:03:23,"<a href=""https://mobile.twitter.com"" rel=""nofollow"">Twitter Web App</a>",,,,
'1939805268121981274',"Illegal aliens should be on a flight back to their home country, not on Medicaid (funded by American taxpayers)!!!",en,Tweet,15,3761,1304,324,46522,2025-06-30 22:56:30,"<a href=""https://mobile.twitter.com"" rel=""nofollow"">Twitter Web App</a>",,,,
'1939784519285952911',"The Senate Parliamentarian has become one of the most powerful people in DC, wreaking havoc on the BBB.

No unelected bureaucrat should have the right to overturn the will of 77M Americans.

The Founding Fathers gave the power to the people, not the parliamentarian.",en,Tweet,136,19836,6335,2063,454666,2025-06-30 21:34:03,"<a href=""https://mobile.twitter.com"" rel=""nofollow"">Twitter Web App</a>",,,,
'1939774814916686278',"The Senate watered down the defunding of Planned Parenthood from ten years to one.

This is just one of the many conservative losses in this bill.

American tax dollars should not be funding this moral decay.",en,Tweet,25,2604,821,196,53388,2025-06-30 20:55:29,"<a href=""http://twitter.com/download/iphone"" rel=""nofollow"">Twitter for iPhone</a>",,,,
'1939743424304881880',"We must save Medicaid for those who truly need it.

That’s exactly what @SenRickScott’s amendment to the BBB accomplishes. 

Every Senator — Democrat and Republican alike — should support it.",en,Tweet,0,43,7,9,1796,2025-06-30 18:50:45,"<a href=""http://twitter.com/download/iphone"" rel=""nofollow"">Twitter for iPhone</a>",,,,
