tweet_id,text,language,type,bookmark_count,favorite_count,retweet_count,reply_count,view_count,created_at,client,hashtags,urls,media_type,media_urls
'1942934212492804459',"Trump’s reckless tariffs on our allies play right into the hands of our adversaries — especially China.

My bipartisan Trade Review Act will return the power to impose tariffs to Congress and protect hardworking Jersey families from Trump’s tariff chaos.
https://t.co/FiU00XphoE",en,Tweet,0,2,0,4,617,2025-07-09 14:09:48,"<a href=""http://www.oneupapp.io"" rel=""nofollow"">OneUp App</a>",,https://www.cnn.com/2025/07/07/economy/trump-letters-tariffs,,
'1942715066215981254',"I am disgusted by the vile antisemitic attacks in Australia this weekend, including a synagogue set on fire while 20 people were inside eating Shabbat dinner.

With violent threats against Jews on the rise around the world, we must stand together against these vile acts of hate. Jewish families deserve to live and worship without fear.",en,Tweet,4,493,64,88,23613,2025-07-08 23:39:00,"<a href=""http://twitter.com"" rel=""nofollow"">Twitter Web Client</a>",,,,
'1942694266255392943',"Trump’s ‘Big F’ed Up Bill’ puts lives at risk by stripping away women’s health care — including access to cancer screenings, and maternal and reproductive care.

While the federal court’s decision to halt these changes is good news, our fight is far from over.

I’ll always fight to protect women’s health care.",en,Tweet,0,2,1,4,1165,2025-07-08 22:16:21,"<a href=""https://mobile.twitter.com"" rel=""nofollow"">Twitter Web App</a>",,,,
'1942625737783279872',"It’s outrageous and shameful that the NJ Assembly still refuses to vote on adopting the IHRA definition of antisemitism — even with 70% of the Assembly supporting the bill.

No more delays. Our Jewish communities deserve better.
https://t.co/t9oiMXpZXt",en,Tweet,1,12,3,5,750,2025-07-08 17:44:02,"<a href=""https://mobile.twitter.com"" rel=""nofollow"">Twitter Web App</a>",,https://newjerseyglobe.com/congress/gottheimer-want-quick-assembly-vote-on-anti-semitism-bill/,,
'1942577661110587664',"Jersey native and U.S. Coast Guard Petty Officer Scott Ruskan demonstrated incredible bravery and true Jersey Values — helping save nearly 200 lives in the Texas floods.

I’m grateful to him and all the heroes working around the clock to protect those impacted by these heartbreaking floods.",en,Tweet,0,13,0,3,1185,2025-07-08 14:33:00,"<a href=""http://twitter.com"" rel=""nofollow"">Twitter Web Client</a>",,,,
'1942351484907106374',#TeamGottheimer was proud to join the Ridgefield Park Fourth of July Flag Raising Ceremony and the Bergen County Star Spangled Spectacular to celebrate the greatest country in the world! https://t.co/ErLq6xuwaT,en,Tweet,0,4,0,2,1279,2025-07-07 23:34:15,"<a href=""http://www.oneupapp.io"" rel=""nofollow"">OneUp App</a>",#TeamGottheimer,,photo,"https://pbs.twimg.com/media/GvSeXp6XkAERIms.jpg,https://pbs.twimg.com/media/GvSeX6wXUAADC46.jpg,https://pbs.twimg.com/media/GvSeYLdXgAAo1q5.jpg,https://pbs.twimg.com/media/GvSeYeCWAAEstGi.jpg"
'1942320200554082701',"Severe storms and flash flood warnings are impacting parts of Jersey, with some communities seeing up to six inches of rain.

Please stay safe, and thank you to our first responders working tirelessly to protect our families in these hazardous weather conditions.",en,Tweet,0,1,0,6,1810,2025-07-07 21:29:57,"<a href=""https://mobile.twitter.com"" rel=""nofollow"">Twitter Web App</a>",,,,
'1942252922428932198',"35 years ago, Congress passed the Americans with Disabilities Act — one of our country's most critical civil rights laws.

This Disability Pride Month, we must continue to do all we can to support the 60+ million Americans with disabilities. https://t.co/82hrv0tGFY",en,Tweet,0,4,0,4,1471,2025-07-07 17:02:36,"<a href=""http://www.oneupapp.io"" rel=""nofollow"">OneUp App</a>",,,photo,https://pbs.twimg.com/media/GvREvYbXUAA3mYg.jpg
'1941965539401978309',"Trump’s Tax Hike Bill will jack up utility bills, slash health care for millions of Americans, and gut food assistance to hungry children — whacking Jersey families with a $3,300-per-year tax to cover the costs.

It’s not the Big Beautiful Bill. In Jersey, we call it a ‘Big F’ed Up Bill’.",en,Tweet,0,8,1,4,3074,2025-07-06 22:00:39,"<a href=""https://mobile.twitter.com"" rel=""nofollow"">Twitter Web App</a>",,,photo,https://pbs.twimg.com/media/GvM_SmtXkAIWHXC.jpg
'1941871302656090508',"I’m praying for the victims and their families affected by the catastrophic flooding in Texas — especially the young campers at Camp Mystic. Such an awful tragedy.

Thank you to the first responders working around-the-clock to save lives in these perilous conditions.",en,Tweet,0,17,2,3,4398,2025-07-06 15:46:11,"<a href=""https://mobile.twitter.com"" rel=""nofollow"">Twitter Web App</a>",,,,
'1941854395479515258',"As commonsense Democrats, we're against socialism, higher taxes, and antisemitism.

“Globalize the Intifada” refers to a horrific wave of terror — attacks that left more than a thousand Jews dead.

With antisemitic violence at record highs, @ZohranKMamdani's refusal to condemn violent and hateful rhetoric is unacceptable.",en,Tweet,100,1292,220,402,299446,2025-07-06 14:39:00,"<a href=""http://twitter.com"" rel=""nofollow"">Twitter Web Client</a>",,,video,https://video.twimg.com/amplify_video/1941174870995353600/vid/avc1/1280x720/lqcSlh7ajo0hGfyz.mp4?tag=21
'1941610286382780614',"Iran has completely cut off all cooperation with the IAEA as it attempts to rebuild its nuclear program.

Now with the regime cornered, we must continue applying maximum pressure to ensure they cannot be allowed to obtain a nuclear weapon.",en,Tweet,0,26,6,15,3490,2025-07-05 22:29:00,"<a href=""https://mobile.twitter.com"" rel=""nofollow"">Twitter Web App</a>",,,,
'1941563981832835255',"Trump’s Big F’ed Up Bill will gut Medicaid — ripping health care away from more than 12 million Americans, screwing over our veterans, and tossing seniors out of nursing homes.

These are the opposite of our Jersey Values. That’s why I voted NO.",en,Tweet,0,7,1,3,1702,2025-07-05 19:25:00,"<a href=""https://mobile.twitter.com"" rel=""nofollow"">Twitter Web App</a>",,,,
'1941501692010176589',"North Jersey is blessed to be near some of our country’s best nature preserves, parks, and trails, including the Appalachian Trail.

As we celebrate National Parks and Recreation Month, I hope everyone has the opportunity to enjoy all the nature our region has to offer! https://t.co/AzXC9BfRDV",en,Tweet,0,4,1,5,1000,2025-07-05 15:17:29,"<a href=""http://www.oneupapp.io"" rel=""nofollow"">OneUp App</a>",,,photo,https://pbs.twimg.com/media/GvGZgAqWMAAWbt6.jpg
'1941267817237512574',"President Trump promised to make life more affordable, but all he’s done is raise costs on hardworking families with his chaotic and reckless tariffs.

Now, his Tax Hike Bill will make it even worse — whacking Jersey families with a $3,300 Trump Tax.",en,Tweet,0,21,5,21,2284,2025-07-04 23:48:09,"<a href=""http://www.oneupapp.io"" rel=""nofollow"">OneUp App</a>",,,,
'1941231570368516441',"Iran’s UN Ambassador made it clear: they have no intention of stopping uranium enrichment.

The United States must continue applying maximum pressure and stand with our key ally, Israel, and ensure Iran can never build a nuclear weapon.
https://t.co/fyZnRKbcqw",en,Tweet,1,79,30,18,7297,2025-07-04 21:24:07,"<a href=""http://www.oneupapp.io"" rel=""nofollow"">OneUp App</a>",,https://www.theguardian.com/world/2025/jun/29/iran-nuclear-enrichment-un-ambassador,,
'1941160749948416138',"Happy Independence Day!

I am proud to join North Jersey's families, friends, and neighbors in celebrating the birth of our great nation, the greatest democracy in the world, and all those who work every day to protect our freedoms. https://t.co/SGvth2ISPH",en,Tweet,0,10,1,3,702,2025-07-04 16:42:42,"<a href=""https://mobile.twitter.com"" rel=""nofollow"">Twitter Web App</a>",,,photo,https://pbs.twimg.com/media/GvBjY1XWQAAltfH.jpg
'1940887272498381101',"My constituent Edan Alexander was brutally held hostage at the hands of Hamas terrorists for 584 days.

Seeing him home safe and at the White House today is nothing short of incredible!

In America and Jersey, we never leave anyone behind. 🇺🇸🇮🇱",en,Tweet,0,43,7,7,2391,2025-07-03 22:36:00,"<a href=""https://mobile.twitter.com"" rel=""nofollow"">Twitter Web App</a>",,,,
'1940856586630545885',"Trump’s Tax Hike Bill is a complete debacle — jacking up utility bills, kicking seniors out of nursing homes, and taking food away from hungry children.

It will gut critical federal investments and leave Jersey to pick up the tab — whacking families with a new $3,300-a-year Trump Tax.

This is not the Big Beautiful Bill — it’s the Big F’ed Up Bill.",en,Tweet,0,7,4,13,993,2025-07-03 20:34:04,"<a href=""http://twitter.com/download/iphone"" rel=""nofollow"">Twitter for iPhone</a>",,,video,https://video.twimg.com/amplify_video/1940856418099245056/vid/avc1/720x1280/nqo2OvuBSSGQFBLI.mp4?tag=21
'1940830956832878912',"Trump’s Big F’ed Up Bill guts critical federal dollars and sticks Jersey families with the tab — whacking them with a $3,300-a-year Trump Tax.

It jacks up utility bills, tosses seniors out of nursing homes, screws over our veterans, and takes food from hungry children.

Just another way Trump is making life more expensive for families.",en,Tweet,0,6,1,7,1011,2025-07-03 18:52:13,"<a href=""https://mobile.twitter.com"" rel=""nofollow"">Twitter Web App</a>",,,video,https://video.twimg.com/amplify_video/1940830765991759872/vid/avc1/1280x720/CVLtgbLa-7wihtCa.mp4?tag=21
'1940764631867552144',"My friend, @RepJeffries — always fighting for the American people with grit and principle.

Keep going, Hakeem. Give ’em hell!",en,Tweet,0,84,14,25,10803,2025-07-03 14:28:40,"<a href=""https://mobile.twitter.com"" rel=""nofollow"">Twitter Web App</a>",,,,
'1940627440365457753',"Trump’s Big Beautiful Bill?

In Jersey, we call it the Big F’ed Up Bill.

I’m at the Capitol burning the midnight oil, fighting to protect Jersey seniors, kids, and families from devastating cuts to health care, energy, and food for hungry children. Stay tuned. https://t.co/unCoIL5OHF",en,Tweet,1,29,6,17,2433,2025-07-03 05:23:31,"<a href=""http://twitter.com/download/iphone"" rel=""nofollow"">Twitter for iPhone</a>",,,video,https://video.twimg.com/amplify_video/1940627203525349376/vid/avc1/1080x1920/Fyi37NdfNhddPc1O.mp4?tag=21
'1940608026353742166',"Trump’s Tax Hike Bill will jack up utility bills, kick seniors out of nursing homes, and take food away from hungry children.

Jersey families will be whacked with a $3,300 per year tax to cover the damage.

It’s not the Big Beautiful Bill. In Jersey, we call it a Big F’ed Up Bill.",en,Tweet,1,16,8,2,2252,2025-07-03 04:06:22,"<a href=""http://twitter.com/download/iphone"" rel=""nofollow"">Twitter for iPhone</a>",,,video,https://video.twimg.com/amplify_video/1940607632315650048/vid/avc1/1280x720/7OpfF0VtnTs8whRR.mp4?tag=21
'1940546840237125890',"By gutting the critical investments I fought for — including for electric vehicles and clean energy — extremists are slashing American jobs and raising utility bills for Jersey families.

I’m fighting to lower costs for families, not screw them over. https://t.co/Prpck6J7XY",en,Tweet,0,5,4,6,1221,2025-07-03 00:03:14,"<a href=""http://www.oneupapp.io"" rel=""nofollow"">OneUp App</a>",,,photo,https://pbs.twimg.com/media/Gu41EXAWAAAr0Rs.jpg
'1940483934157983966',"Iran is the world’s leading state sponsor of terror and is responsible for the deaths of thousands of Americans. As Iran rebuilds its nuclear program, we must maintain maximum deterrence.

My bipartisan Bunker Buster Act will give Israel the tools she needs to deter Iranian aggression and take out their underground nuclear sites — strengthening U.S. national security.",en,Tweet,20,471,90,122,58052,2025-07-02 19:53:17,"<a href=""https://mobile.twitter.com"" rel=""nofollow"">Twitter Web App</a>",,,,
'1940437831622545712',"Far-right extremists are slashing Medicaid — ripping away access to basic health care, essential medications, and nursing care from nearly 12 million Americans.

I’ll never stop fighting to defend our Jersey Values and protect our seniors and families who rely on this life-saving care.",en,Tweet,0,10,3,9,3361,2025-07-02 16:50:05,"<a href=""https://mobile.twitter.com"" rel=""nofollow"">Twitter Web App</a>",,,,
'1940185733211267462',"This #NationalPostalWorkersDay, we recognize the countless postal workers who work hard each day to support our communities.

As a member of @Labor_Caucus, I will always get the backs of our hardworking public servants in Jersey and across the country. https://t.co/e0SOcDRFML",en,Tweet,0,10,5,4,3055,2025-07-02 00:08:20,"<a href=""http://www.oneupapp.io"" rel=""nofollow"">OneUp App</a>",#NationalPostalWorkersDay,,photo,https://pbs.twimg.com/media/GuzspLFWwAAS35M.jpg
'1940116866715746566',"The Senate just passed Trump’s far-right budget bill:

🆘 12M Americans will lose health care
🆘 5M will lose food assistance
🆘 $3.3 trillion added to the deficit

It’s a disaster — and Jersey families will pay the price.",en,Tweet,1,21,7,14,3662,2025-07-01 19:34:41,"<a href=""https://mobile.twitter.com"" rel=""nofollow"">Twitter Web App</a>",,,,
'1940074185721630752',"Trump’s far-right budget bill makes the biggest cuts to health care and food assistance in our nation’s history — betraying our children, seniors, and families.

Hospitals and nursing homes will shut down. Families will go hungry.

It’s cruel, heartless, and a complete disaster. https://t.co/5IqzY9MHPt",en,Tweet,0,9,3,6,905,2025-07-01 16:45:05,"<a href=""https://mobile.twitter.com"" rel=""nofollow"">Twitter Web App</a>",,,video,https://video.twimg.com/amplify_video/1940073840043851776/vid/avc1/1280x720/3qx4x-gMs_W4WanN.mp4?tag=21
'1940037982691422315',"Over the weekend, the CBO confirmed what we already knew: Trump’s reckless budget bill would rip away health care for nearly 12 million Americans and add $3.9 trillion to the national debt.

Jersey families — and all Americans — deserve better.",en,Tweet,1,4,2,4,1425,2025-07-01 14:21:13,"<a href=""https://mobile.twitter.com"" rel=""nofollow"">Twitter Web App</a>",,,,
'1939843509604745341',"Every day, our brave first responders answer the siren at a moment’s notice to protect innocent lives.

I’m disgusted by this horrific act of violence against firefighters in Idaho.

My heart is with the victims and their families. Their bravery and sacrifice will never be forgotten.",en,Tweet,0,7,1,2,1862,2025-07-01 01:28:27,"<a href=""https://mobile.twitter.com"" rel=""nofollow"">Twitter Web App</a>",,,,
'1939830411510829351',"This weekend, the stage at the Glastonbury music festival was used to blatantly incite violence against Jews.
 
Violent rhetoric like this puts Jewish lives at risk. It must be condemned in the strongest of terms.",en,Tweet,0,9,2,0,1696,2025-07-01 00:36:25,"<a href=""http://twitter.com/download/iphone"" rel=""nofollow"">Twitter for iPhone</a>",,,,
'1939691859422445740',"We honor Alzheimer’s &amp; Brain Awareness Month by working hard to ensure that those with Alzheimer’s and those who care for them get the support they need.

In Congress, I will continue to fight to protect NIH and research grants to support families affected by this disease. https://t.co/BLpaVKQO7X",en,Tweet,0,5,2,2,684,2025-06-30 15:25:51,"<a href=""http://www.oneupapp.io"" rel=""nofollow"">OneUp App</a>",,,photo,https://pbs.twimg.com/media/Gusrd4eXYAAN46e.jpg
'1939436744820109367',"Seniors are leaving our state in record numbers. We must make Jersey more affordable so they can afford to stay and thrive.

Great to meet with @AARPNJ to discuss my work on lowering costs and easing the burden on older adults across our great state. https://t.co/T2DJKr7K0v",en,Tweet,0,5,1,2,910,2025-06-29 22:32:07,"<a href=""http://www.oneupapp.io"" rel=""nofollow"">OneUp App</a>",,,photo,https://pbs.twimg.com/media/GupDcRdW0AAb9Ba.jpg
'1939361469679743483',"As we head into the summer, I am glad to see that the @NJDA is distributing nutritious meals to families in need.

Sign up for these critical benefits at:
https://t.co/kH70oMeEiL",en,Tweet,0,5,2,3,1389,2025-06-29 17:33:00,"<a href=""https://mobile.twitter.com"" rel=""nofollow"">Twitter Web App</a>",,https://www.nj.gov/humanservices/njsnap/apply/app/,,
'1939313937062781369',"It’s outrageous and shameful that the NJ Assembly still refuses to vote on adopting the IHRA definition of antisemitism — even as antisemitic hate surges across our state.

No more delays. Our Jewish communities deserve better.
https://t.co/qQtqUf4jam",en,Tweet,2,127,33,17,10966,2025-06-29 14:24:07,"<a href=""http://www.oneupapp.io"" rel=""nofollow"">OneUp App</a>",,https://www.jns.org/outrageous-shameful-nj-assembly-wont-adopt-ihra-jew-hatred-definition-gottheimer-says/,,
'1939088671128649966',"This is absolutely ridiculous. DOGE’s chaotic mismanagement has caused severe disruptions and delays to Social Security — screwing over our seniors.

I’m for making government more efficient, but not recklessly gutting our most essential benefits that so many rely on.",en,Tweet,0,4,2,4,2134,2025-06-28 23:29:00,"<a href=""https://mobile.twitter.com"" rel=""nofollow"">Twitter Web App</a>",,,,
'1939064795551989933',"Congrats to Bergen County native Dylan Harper on being selected second overall in the NBA draft! 🏀

Through your hard work and dedication, I know you will continue to make North Jersey proud.
https://t.co/LRPqW91O34",en,Tweet,0,4,1,0,810,2025-06-28 21:54:07,"<a href=""http://www.oneupapp.io"" rel=""nofollow"">OneUp App</a>",,https://www.nj.com/rutgersbasketball/2025/06/star-guard-dylan-harper-becomes-rutgers-highest-nba-draft-pick.html,,
'1939045565284712456',"56 years ago today, the Stonewall riots in nearby Manhattan — which included some Jersey natives — helped start the modern LGBTQ+ rights movement.

Today, we honor their courage by continuing the fight for equality and standing up against discrimination — now and in the years ahead.",en,Tweet,0,3,1,2,888,2025-06-28 20:37:43,"<a href=""http://twitter.com/download/iphone"" rel=""nofollow"">Twitter for iPhone</a>",,,,
'1938989753703051500',".@RepDonBacon has been a principled, commonsense voice in Congress, and a very good friend.

A proud veteran and dedicated public servant, Don has brought integrity and determination to everything he’s done. I’ve deeply valued our partnership, especially in the Problem Solvers Caucus, where he helped pass the Bipartisan Infrastructure Bill and helped us find common ground on scores of major issues facing our great country.

Don’s leadership and voice will be sorely missed in the House.",en,Tweet,2,62,10,9,5886,2025-06-28 16:55:56,"<a href=""https://mobile.twitter.com"" rel=""nofollow"">Twitter Web App</a>",,,photo,https://pbs.twimg.com/media/Guis2jDXgAAxQAa.jpg
'1938768021352239307',"A slap in the face to the millions of Jersey families who subsidize Red State Moochers like yours, @chiproytx.

Restoring SALT means real tax relief for hardworking teachers, cops, nurses, and firefighters. It’s time to restore the SALT deduction and actually cut taxes!",en,Tweet,0,6,2,6,1861,2025-06-28 02:14:51,"<a href=""http://twitter.com/download/iphone"" rel=""nofollow"">Twitter for iPhone</a>",,,,
'1938716871827583126',"The Senate’s SALT proposal is a complete joke. Red State Moochers are trying to pull the wool over the eyes of Jersey families instead of offering real tax relief.
 
We need to restore the SALT deduction — not stick it to middle class families by capping SALT again in just a few years.",en,Tweet,0,13,5,8,6202,2025-06-27 22:51:36,"<a href=""http://twitter.com/download/iphone"" rel=""nofollow"">Twitter for iPhone</a>",,,,
'1938696621950386585',"It was great to join Bitcoin Policy Institute’s 2025 Summit with my friend @RepRitchie to discuss commonsense, bipartisan ways to promote American innovation in blockchain and stablecoin markets.

Thanks for having us, @btcpolicyorg! https://t.co/5sjnavCkvc",en,Tweet,0,22,6,7,5287,2025-06-27 21:31:08,"<a href=""https://mobile.twitter.com"" rel=""nofollow"">Twitter Web App</a>",,,photo,https://pbs.twimg.com/media/GueiDdgXMAAGTya.jpg
'1938575506791690684',"The Supreme Court’s decision allowing states to block Medicaid patients from accessing health care at Planned Parenthood is dangerous and wrong.

This will end access to cancer screenings, reproductive care, and more — putting lives at risk.

We can’t allow extremism to win. We must fight to protect reproductive freedom.",en,Tweet,0,5,2,3,1289,2025-06-27 13:29:52,"<a href=""https://mobile.twitter.com"" rel=""nofollow"">Twitter Web App</a>",,,,
'1938363087033082072',"After 12 days of strikes, Iran’s military and nuclear program are severely weakened.

Now is the time to fully assess the damage to their nuclear capabilities.

By now, Congress should have been fully briefed.

The Trump Administration should not be limiting intelligence sharing with Congress.",en,Tweet,0,1,1,4,832,2025-06-26 23:25:47,"<a href=""https://mobile.twitter.com"" rel=""nofollow"">Twitter Web App</a>",,,video,https://video.twimg.com/amplify_video/1938362840370323456/vid/avc1/1280x720/z26oT2v2qt0AsR35.mp4?tag=21
'1938332507193450958',"Hate has no place in our government. It’s disgusting that Trump’s Pentagon Press Secretary @KingsleyCortes has a history of spewing antisemitic hate.

I joined 21 of my colleagues in demanding answers from @SecDef on how the Trump Administration is addressing this and ensuring hate has no place in America.",en,Tweet,0,4,0,5,1110,2025-06-26 21:24:16,"<a href=""https://mobile.twitter.com"" rel=""nofollow"">Twitter Web App</a>",,,,
'1938270345313591601',"After sacrificing so much, our veterans should never struggle to get the care and respect they have rightfully earned.

I was proud to pass three amendments that will:
✅Require a veteran advocate in every VA home
✅Strengthen veteran suicide prevention programs
✅Help provide kosher meal options for Jewish veterans",en,Tweet,0,1,0,3,597,2025-06-26 17:17:16,"<a href=""https://mobile.twitter.com"" rel=""nofollow"">Twitter Web App</a>",,,video,https://video.twimg.com/amplify_video/1938270237440327680/vid/avc1/960x720/i61FcuwyKlBrwDgl.mp4?tag=21
'1938236865309552684',"Today marks 10 years since the Supreme Court's historic ruling in Obergefell v. Hodges legalized same-sex marriage across the country!

I'm proud to celebrate this landmark ruling with the @EqualityCaucus today, and to fight for North Jersey’s LGBTQ community every day. https://t.co/uuwtgSq7ZS",en,Tweet,1,8,2,10,893,2025-06-26 15:04:14,"<a href=""http://www.oneupapp.io"" rel=""nofollow"">OneUp App</a>",,,photo,https://pbs.twimg.com/media/GuYAKBrWEAAzGlt.jpg
'1938211618942247271',"Join me TODAY at 10 AM for my 109th Cup of Joe with Josh — live on Facebook!

I’ll be taking your questions and sharing updates on the latest developments in the Middle East, as well as my work to make life more affordable. https://t.co/bR2Cs96RUF",en,Tweet,0,3,0,3,767,2025-06-26 13:23:54,"<a href=""http://www.oneupapp.io"" rel=""nofollow"">OneUp App</a>",,,photo,https://pbs.twimg.com/media/GuXpMkvXoAAI_4A.jpg
'1937970554604064781',"I was in the House Chamber on January 6, watching through a gas mask as lawless thugs stormed the United States Capitol.

Now, far-right extremists in Congress refuse to honor the heroes who protected us.

As Co-Chair of the bipartisan Law Enforcement Caucus, I’m proud to display a plaque outside my office honoring the bravery and sacrifice of the Capitol Police.",en,Tweet,0,7,1,6,981,2025-06-25 21:26:00,"<a href=""http://twitter.com"" rel=""nofollow"">Twitter Web Client</a>",,,photo,https://pbs.twimg.com/media/GuUKJCsWMAApxPP.jpg
'1937909683786060260',"The Route 80 sinkhole crisis severely impacted life for Jersey families, small businesses, and commuters who rely on this critical highway.

After working with @NewJerseyDOT and @USDOT to get things moving again, I’m glad to see Route 80 finally reopened.",en,Tweet,0,4,0,3,1230,2025-06-25 17:24:07,"<a href=""https://mobile.twitter.com"" rel=""nofollow"">Twitter Web App</a>",,,,
'1937683833291223102',"Iran is the world’s leading sponsor of terror and is responsible for the deaths of thousands of Americans.

Now, Iran is severely weakened, and their nuclear program is diminished. We must work to ensure the ceasefire holds and that Iran never gains access to a nuclear weapon. https://t.co/rWGn9aH22D",en,Tweet,0,28,8,16,14537,2025-06-25 02:26:40,"<a href=""http://www.oneupapp.io"" rel=""nofollow"">OneUp App</a>",,,video,https://video.twimg.com/ext_tw_video/1937683705926979584/pu/vid/avc1/1280x720/uud5YDYLB8qOJ3qn.mp4?tag=12
'1937631318143303880',"Three years ago, the Supreme Court turned back the clock on progress and overturned Roe v. Wade — ripping away the fundamental rights of millions of women to make personal and private medical decisions, and putting their health and safety at risk.

I'll never stop fighting to ensure health decisions stay between a woman, her doctor, and her faith.",en,Tweet,0,2,1,5,996,2025-06-24 22:58:00,"<a href=""http://twitter.com"" rel=""nofollow"">Twitter Web Client</a>",,,,
'1937599956447002625',"I proudly helped write, negotiate, and pass the Bipartisan Infrastructure Bill to fund projects like the Hudson-Bergen Light Rail extension.

We can’t let red tape and bureaucracy stop Jersey families from seeing loved ones and getting to work. This critical project must be full speed ahead.
https://t.co/ERNmEfkeIA",en,Tweet,0,5,0,2,983,2025-06-24 20:53:23,"<a href=""https://mobile.twitter.com"" rel=""nofollow"">Twitter Web App</a>",,,,
