tweet_id,text,language,type,bookmark_count,favorite_count,retweet_count,reply_count,view_count,created_at,client,hashtags,urls,media_type,media_urls
'1887193112503632341',"Today is National Girls and Women in Sports Day! President Trump and my @HouseGOP colleagues are fighting to protect women’s sports and keep men out of girls’ locker rooms.

We’re standing up for our daughters, nieces, sisters, and granddaughters—because fairness isn’t up for debate.",en,Tweet,0,8,0,1,567,2025-02-05 17:34:35,"<a href=""https://mobile.twitter.com"" rel=""nofollow"">Twitter Web App</a>",,,,
'1887192330999841097',This crap is ridiculous. Trump won! Elections have consequences.,en,Tweet,0,6,1,1,677,2025-02-05 17:31:28,"<a href=""https://mobile.twitter.com"" rel=""nofollow"">Twitter Web App</a>",,,,
'1887184081173008435',"Congratulations to our new Attorney General! 

President Trump's cabinet continues to earn their confirmations - it's absolutely critical for the Senate to continue confirming these nominees so we can move on with the work of restoring the America FIRST Agenda!",en,Tweet,0,33,4,8,1120,2025-02-05 16:58:41,"<a href=""https://mobile.twitter.com"" rel=""nofollow"">Twitter Web App</a>",,,,
'1886950138079334790',Free Mzia Amaghlobeli!,de,Tweet,11,768,107,74,47794,2025-02-05 01:29:05,"<a href=""http://twitter.com/download/iphone"" rel=""nofollow"">Twitter for iPhone</a>",,,,
'1886948557787189607',"@RepJoeWilson @GOPpolicy Thank you for your work on this important legislation, Joe!",en,Reply,0,6,0,0,255,2025-02-05 01:22:48,"<a href=""http://twitter.com/download/iphone"" rel=""nofollow"">Twitter for iPhone</a>",,,,
'1886912333861003527',"The United States will continue to stand with Israel until all the hostages are brought home!

President Trump’s meeting with Prime Minister @Netanyahu is a true testament to our country's unshakable bond.",en,Tweet,0,66,12,22,12884,2025-02-04 22:58:52,"<a href=""https://mobile.twitter.com"" rel=""nofollow"">Twitter Web App</a>",,,,
'1886890971566367211',🎯,art,Tweet,0,22,4,6,1785,2025-02-04 21:33:59,"<a href=""https://mobile.twitter.com"" rel=""nofollow"">Twitter Web App</a>",,,,
'1886857574726950967',"@RepublicanStudy @RepJoeWilson What does Max Pressure do? 
Here's a thread explaining it from when we introduced this legislation in 2023: https://t.co/8Al6erzGGC",en,Reply,1,49,19,2,2806,2025-02-04 19:21:16,"<a href=""https://twitter.com"" rel=""nofollow"">TweetDeck Web App</a>",,https://x.com/repkevinhern/status/1719835104598483405,,
'1886857086379655646',"The Maximum Pressure Act was a key priority from my tenure as Chairman of the @RepublicanStudy Committee. 

Alongside @RepJoeWilson, who is an incredible and talented leader on foreign policy and national security, we worked to ensure that the Biden Admin - or any future Democrat president - couldn't undo the successful Maximum Pressure strategy of the Trump Administration. This remains a priority now that President Trump has reinstated this critical policy.",en,Tweet,10,304,98,97,70013,2025-02-04 19:19:20,"<a href=""https://mobile.twitter.com"" rel=""nofollow"">Twitter Web App</a>",,,photo,https://pbs.twimg.com/media/Gi90EkZXMAA_nrB.jpg
'1886836142848532538',Biden broke it - Trump will fix it. 🇺🇸,en,Tweet,1,27,6,7,1811,2025-02-04 17:56:06,"<a href=""https://mobile.twitter.com"" rel=""nofollow"">Twitter Web App</a>",,,,
'1886833265438310664',"The Maximum Pressure Campaign was a powerful policy from the first Trump Administration. Last Congress, I introduced the Maximum Pressure Act with @RepJoeWilson intending to codify that successful strategy into law. 

Today, @POTUS is putting the Maximum Pressure Campaign back in action! Strength has returned to the White House, and American leadership on the global stage is BACK. 
https://t.co/gkDvkCERgl",en,Tweet,0,8,2,2,701,2025-02-04 17:44:40,"<a href=""https://mobile.twitter.com"" rel=""nofollow"">Twitter Web App</a>",,,,
'1886819210359185719',"President Trump has been in office for 2 weeks and has done more in that time than Joe Biden did in 4 years. 

It's thrilling to see @POTUS back in the @WhiteHouse working around-the-clock to restore the AMERICA FIRST agenda!",en,Tweet,0,23,4,7,786,2025-02-04 16:48:49,"<a href=""https://mobile.twitter.com"" rel=""nofollow"">Twitter Web App</a>",,,,
'1886816989769044275',"It’s rare to see a politician put the taxpayers first and it’s even more rare to see a politician follow through on their promises, but that’s exactly what we’ve got with @POTUS @realDonaldTrump 🇺🇸

America First! Taxpayers First!",en,Tweet,0,32,8,11,1012,2025-02-04 16:40:00,"<a href=""https://twitter.com"" rel=""nofollow"">TweetDeck Web App</a>",,,,
'1886813215059009663',President Trump is ripping the woke soul out of our government - and I applaud him for it.,en,Tweet,1,160,25,111,9241,2025-02-04 16:25:00,"<a href=""https://twitter.com"" rel=""nofollow"">TweetDeck Web App</a>",,,,
'1886809440352903622',"Every taxpaying citizen should celebrate an Administration dead-set on lowering the cost of government to be better stewards of your tax dollars.

Accountability matters.

The federal government SHOULD be accountable to the taxpayers for every penny spent.",en,Tweet,0,83,19,14,2044,2025-02-04 16:10:00,"<a href=""https://twitter.com"" rel=""nofollow"">TweetDeck Web App</a>",,,,
'1886806653900656915',"Democrats and the deep-state, unelected bureaucracy both stand to benefit from runaway government spending, minimal oversight, and a government that’s too big to properly audit.

That's why they're so resistant to DOGE.",en,Tweet,0,9,4,4,751,2025-02-04 15:58:56,"<a href=""https://mobile.twitter.com"" rel=""nofollow"">Twitter Web App</a>",,,,
'1886533922021937501',"Great work, @POTUS! 

It sure is nice to have the author of THE ART OF THE DEAL in the @WhiteHouse 🇺🇸",en,Tweet,1,18,4,6,992,2025-02-03 21:55:11,"<a href=""https://mobile.twitter.com"" rel=""nofollow"">Twitter Web App</a>",,,,
'1886454591744614535',American strength is back!,en,Tweet,0,9,0,2,842,2025-02-03 16:39:57,"<a href=""http://twitter.com/download/iphone"" rel=""nofollow"">Twitter for iPhone</a>",,,,
'1885508592561705188',Another great move from the Trump-Vance Administration!,en,Tweet,0,13,2,6,1570,2025-02-01 02:00:54,"<a href=""http://twitter.com/download/iphone"" rel=""nofollow"">Twitter for iPhone</a>",,,,
'1885461850105557422',"Democrats want to fight Trump in Congress, in the courts, and even in the streets, according to the leader of the Democrat Party, @RepJeffries.

President Trump has done more in 11 days than Joe Biden did in four years. https://t.co/hk9MB3Epnt",en,Tweet,2,41,10,11,2035,2025-01-31 22:55:09,"<a href=""https://mobile.twitter.com"" rel=""nofollow"">Twitter Web App</a>",,,video,https://video.twimg.com/ext_tw_video/1885461592340410368/pu/vid/avc1/1280x720/aVuW3K0BC6P5iRyI.mp4?tag=12
'1885450186924695984',🚨Joining @NEWSMAX live — tune in!,en,Tweet,0,8,0,4,858,2025-01-31 22:08:49,"<a href=""http://twitter.com/download/iphone"" rel=""nofollow"">Twitter for iPhone</a>",,,,
'1885161697289130204',"Baseless lies in the face of an unspeakable tragedy. It’s shameful &amp; embarrassing. 

I’d advise my colleagues to stop making up information while the investigations into the accident are still underway.",en,Tweet,0,44,10,24,5792,2025-01-31 03:02:27,"<a href=""http://twitter.com/download/iphone"" rel=""nofollow"">Twitter for iPhone</a>",,,,
'1885097133029667310',"I joined @ToddStarnes on @Newsmax to discuss the tragic mid-air collision at Reagan National Airport.

As a pilot, I know what it’s like to fly in and out of high-stress areas like DCA. I hope that the investigations will provide some closure to the families as we try to make sense of this awful accident.",en,Tweet,0,7,2,0,774,2025-01-30 22:45:54,"<a href=""https://mobile.twitter.com"" rel=""nofollow"">Twitter Web App</a>",,,video,https://video.twimg.com/ext_tw_video/1885096895543934976/pu/vid/avc1/1280x720/DO_DlgZX31xukD3X.mp4?tag=12
'1885001274497646767',".@POTUS is right - for the good of every nation on this planet, the CCP cannot gain a foothold in the Panama Canal. If Panama can’t uphold their end of the bargain, the US has options to take it back. 

https://t.co/Uw8N4pkSXW",en,Tweet,2,48,10,9,74069,2025-01-30 16:25:00,"<a href=""http://twitter.com/download/iphone"" rel=""nofollow"">Twitter for iPhone</a>",,https://www.foxnews.com/politics/taking-back-internal-house-gop-memo-outlines-case-trump-buy-panama-canal,,
'1884805393676652990',"Tammy and I are praying for everyone affected by tonight’s tragic mid-air collision at Reagan National Airport. 

Our hearts are with the families of those on board and the search and rescue teams on the scene.",en,Tweet,1,37,3,3,1997,2025-01-30 03:26:38,"<a href=""http://twitter.com/download/iphone"" rel=""nofollow"">Twitter for iPhone</a>",,,,
'1884691390442954964',"President Trump just signed the Laken Riley Act into law - the first one of the Trump-Vance Administration! 

This is a big win for national security. 

We can't bring Laken back, but we can ensure that violent criminals entering our country illegally are DEPORTED!",en,Tweet,0,15,5,3,519,2025-01-29 19:53:38,"<a href=""https://mobile.twitter.com"" rel=""nofollow"">Twitter Web App</a>",,,,
'1884649744468771175',".@HouseGOP is united behind President Trump’s agenda—securing the border, cutting spending, and restoring America’s strength. https://t.co/Pf9odE1iPo",en,Tweet,2,149,21,13,8895,2025-01-29 17:08:08,"<a href=""https://mobile.twitter.com"" rel=""nofollow"">Twitter Web App</a>",,,video,https://video.twimg.com/ext_tw_video/1884649699954876418/pu/vid/avc1/1280x720/RfyvroIwyxVEcTFh.mp4?tag=12
'1884353353737531478',"Spreading these lies - FACT-CHECKABLE LIES - is dereliction of duty. 

Senator, you should be ashamed of yourself.",en,Tweet,1,9,1,10,1523,2025-01-28 21:30:23,"<a href=""http://twitter.com/download/iphone"" rel=""nofollow"">Twitter for iPhone</a>",,,,
'1884349612863156622',These are all LIES - Democrats have to make up extreme falsehoods and use scare tactics because they have no real agenda for the American people to support.,en,Tweet,1,16,4,2,1299,2025-01-28 21:15:31,"<a href=""http://twitter.com/download/iphone"" rel=""nofollow"">Twitter for iPhone</a>",,,,
'1884322866461909214',"Mayors like Brandon Johnson, who shirk their duty to protect citizens, are the face of failed Democrat policies letting convicted, undocumented criminals prey on American communities. https://t.co/mGFjyzgZCv",en,Tweet,2,22,7,4,1708,2025-01-28 19:29:15,"<a href=""https://mobile.twitter.com"" rel=""nofollow"">Twitter Web App</a>",,,video,https://video.twimg.com/ext_tw_video/1884322665495658496/pu/vid/avc1/1280x720/6ORnxeMDVvR_VKqz.mp4?tag=12
'1884314290796319087',American strength is back!,en,Tweet,1,18,1,14,10581,2025-01-28 18:55:10,"<a href=""https://mobile.twitter.com"" rel=""nofollow"">Twitter Web App</a>",,,,
'1884273276232556755',"Promises made, promises kept!",en,Tweet,0,13,0,6,1004,2025-01-28 16:12:11,"<a href=""https://mobile.twitter.com"" rel=""nofollow"">Twitter Web App</a>",,,,
'1884028159294914938',"Congratulations, Secretary Bessent!",en,Tweet,0,35,4,4,1442,2025-01-27 23:58:11,"<a href=""http://twitter.com/download/iphone"" rel=""nofollow"">Twitter for iPhone</a>",,,,
'1883990948985856451',It is fantastic to have President Trump and Vice President Vance in the White House!,en,Tweet,2,32,6,7,1216,2025-01-27 21:30:19,"<a href=""https://mobile.twitter.com"" rel=""nofollow"">Twitter Web App</a>",,,,
'1883988965570797902',True leadership!,en,Tweet,0,7,2,2,633,2025-01-27 21:22:26,"<a href=""https://mobile.twitter.com"" rel=""nofollow"">Twitter Web App</a>",,,,
'1883979664013897805',President Trump is making America Safe Again!,en,Tweet,1,31,3,7,1430,2025-01-27 20:45:29,"<a href=""http://twitter.com/download/iphone"" rel=""nofollow"">Twitter for iPhone</a>",,,,
'1883947934087004315',"We honor the six million Jews murdered in the Holocaust, the countless others who perished under Nazi tyranny, and the survivors who bear its memory. 

On Holocaust Remembrance Day, we vow to never forget those lost and to stand resolute in defending the survivors who carry their legacy.",en,Tweet,0,22,6,22,16354,2025-01-27 18:39:24,"<a href=""http://twitter.com/download/iphone"" rel=""nofollow"">Twitter for iPhone</a>",,,photo,https://pbs.twimg.com/media/GiUgqXhWAAAur7K.jpg
'1883591897324908544',American strength is back and President Trump is taking names!,en,Tweet,0,22,3,5,1489,2025-01-26 19:04:38,"<a href=""http://twitter.com/download/iphone"" rel=""nofollow"">Twitter for iPhone</a>",,,,
'1882982808001384619',"Congratulations to our new SECDEF @PeteHegseth! 

I’m behind you, Pete. President Trump is behind you. AMERICA is behind you!",en,Tweet,0,37,5,8,933,2025-01-25 02:44:20,"<a href=""http://twitter.com/download/iphone"" rel=""nofollow"">Twitter for iPhone</a>",,,,
'1882981473336389797',"I gladly welcome the @nytimes to the pro-life movement! 

https://t.co/cDag2kZZHL",en,Tweet,0,13,2,4,822,2025-01-25 02:39:02,"<a href=""http://twitter.com/download/iphone"" rel=""nofollow"">Twitter for iPhone</a>",,https://www.foxnews.com/media/desantis-jokes-hes-ready-welcome-ny-times-pro-life-movement-after-headline-recognizing-unborn,,
'1882829105609277855',"Protecting the lives of the unborn is one of the most important moral obligations we have. 

I will always stand on the side of life, defending those who cannot defend themselves.",en,Tweet,0,26,2,8,959,2025-01-24 16:33:34,"<a href=""https://mobile.twitter.com"" rel=""nofollow"">Twitter Web App</a>",,,,
'1882535156332073338',Peace through strength! 💪🇺🇸,en,Tweet,0,4,1,2,678,2025-01-23 21:05:31,"<a href=""https://mobile.twitter.com"" rel=""nofollow"">Twitter Web App</a>",,,,
'1882524201564909692',"Violent criminal illegal aliens have been running rampant in our cities. 

President Trump is taking action, enforcing the law, and restoring safety to American streets! https://t.co/BkWCmEYMBS",en,Tweet,0,11,5,3,460,2025-01-23 20:21:59,"<a href=""https://mobile.twitter.com"" rel=""nofollow"">Twitter Web App</a>",,,video,https://video.twimg.com/ext_tw_video/1882524109529022464/pu/vid/avc1/1280x720/RmDKO_-RQ2BhvYrB.mp4?tag=12
'1882479033126138121',The Trump-Vance Administration is delivering on Making America Safe Again!,en,Tweet,0,23,1,4,1004,2025-01-23 17:22:30,"<a href=""http://twitter.com/download/iphone"" rel=""nofollow"">Twitter for iPhone</a>",,,,
'1882458206418661772',"Earlier this week, I met with @POTUS in the Oval Office as he delivered on securing the border, restoring American energy independence, and cutting reckless Biden regulations.

Promises made, promises kept. Delivering the America First Agenda! https://t.co/qjgaMsffYC",en,Tweet,1,9,4,1,603,2025-01-23 15:59:45,"<a href=""https://mobile.twitter.com"" rel=""nofollow"">Twitter Web App</a>",,,video,https://video.twimg.com/ext_tw_video/1882457930714198016/pu/vid/avc1/1280x720/qLR-9nI5EFlsFC4d.mp4?tag=12
'1882190476029432319',The Laken Riley Act is on its way to @POTUS' desk. Cracking down on illegal immigration—it's a new day in America!,en,Tweet,0,22,2,7,723,2025-01-22 22:15:53,"<a href=""https://mobile.twitter.com"" rel=""nofollow"">Twitter Web App</a>",,,,
'1882088259347706334',"Within 24 hours of taking office, @POTUS ended DEI madness in a bold move to restore merit at the core of government.

America is back—leading with merit, not madness!",en,Tweet,2,27,3,7,829,2025-01-22 15:29:43,"<a href=""https://mobile.twitter.com"" rel=""nofollow"">Twitter Web App</a>",,,,
'1881934430526435777',"A good first step - next, I wanna hear him say “YOU’RE FIRED!”",en,Tweet,0,19,6,4,1199,2025-01-22 05:18:27,"<a href=""http://twitter.com/download/iphone"" rel=""nofollow"">Twitter for iPhone</a>",,,,
'1881931751809056790',There never should have been any other policy! President Trump is restoring sanity - THANK YOU JESUS!,en,Tweet,1,73,11,12,1809,2025-01-22 05:07:48,"<a href=""http://twitter.com/download/iphone"" rel=""nofollow"">Twitter for iPhone</a>",,,,
'1881901539205492844',@LeaderJohnThune I like this - let’s Make Congress Tired Again!,en,Reply,0,14,1,1,423,2025-01-22 03:07:45,"<a href=""http://twitter.com/download/iphone"" rel=""nofollow"">Twitter for iPhone</a>",,,,
'1881900369909088427',@RepJoeWilson Glad to call you a friend &amp; partner in this fight to MAKE AMERICA GREAT AGAIN! 🇺🇸,en,Reply,0,6,0,2,358,2025-01-22 03:03:06,"<a href=""http://twitter.com/download/iphone"" rel=""nofollow"">Twitter for iPhone</a>",,,,
'1881890383237619821',As it should be! Old glory &amp; nothing else 🇺🇸,en,Tweet,0,59,7,3,3501,2025-01-22 02:23:25,"<a href=""http://twitter.com/download/iphone"" rel=""nofollow"">Twitter for iPhone</a>",,,,
'1881886052442640877',Are you watching @seanhannity tonight? Glad to be here with my colleagues to discuss the important work ahead of us now that President Trump is BACK in the White House! https://t.co/9ywqK4Rd2N,en,Tweet,0,34,3,7,72454,2025-01-22 02:06:13,"<a href=""http://twitter.com/download/iphone"" rel=""nofollow"">Twitter for iPhone</a>",,,photo,https://pbs.twimg.com/media/Gh3NY-PXYAAx8I0.jpg
'1881856098933813249',"Elise is one of the best advocates for President Trump’s AMERICA FIRST agenda that we have. She’s going to be the powerful voice we need at the UN. 

We are truly going to miss her in the House, but @POTUS made the right choice!",en,Tweet,2,354,39,15,38542,2025-01-22 00:07:11,"<a href=""http://twitter.com/download/iphone"" rel=""nofollow"">Twitter for iPhone</a>",,,,
'1881770431545581610',"Like Reagan, who ushered in a renaissance of American greatness, President @realDonaldTrump's inauguration marks the beginning of a new golden age in America. 

His vision and leadership will secure a brighter future for our nation!",en,Tweet,0,5,4,2,1022,2025-01-21 18:26:47,"<a href=""https://mobile.twitter.com"" rel=""nofollow"">Twitter Web App</a>",,,,
'1881731279043117231',"Proud to support my good friend and America First fighter, @EliseStefanik. 

With President Trump’s leadership, she’ll be unstoppable as Ambassador to the @UN! https://t.co/7cfHVQR7gr",en,Tweet,0,304,26,8,15119,2025-01-21 15:51:12,"<a href=""http://twitter.com/download/iphone"" rel=""nofollow"">Twitter for iPhone</a>",,,photo,https://pbs.twimg.com/media/Gh1AoDMXAAAQ_cE.jpg
'1881727232051458442',"The Great American Comeback has begun! Biden broke it, but TRUMP WILL FIX IT. 

It sure is good to have President Donald J. Trump back in the White House, isn't it?",en,Tweet,1,20,2,7,861,2025-01-21 15:35:07,"<a href=""https://mobile.twitter.com"" rel=""nofollow"">Twitter Web App</a>",,,,
'1881399065675739550',@RepJoeWilson The best one ever!,en,Reply,0,1,1,0,1510,2025-01-20 17:51:06,"<a href=""http://twitter.com/download/iphone"" rel=""nofollow"">Twitter for iPhone</a>",,,,
'1881396952203760118',"“We are Americans, the future is ours.” 

God bless you, President Trump! https://t.co/q7quNxuVjG",en,Tweet,0,18,3,4,3329,2025-01-20 17:42:42,"<a href=""https://mobile.twitter.com"" rel=""nofollow"">Twitter Web App</a>",,,video,https://video.twimg.com/ext_tw_video/1881396763107471360/pu/vid/avc1/1280x720/MeHc1oO9CmxT4Q1g.mp4?tag=12
'1881396459607863407',"Our golden age has just begun!  

God bless America, God bless President Trump 🇺🇸",en,Tweet,1,131,10,18,22931,2025-01-20 17:40:45,"<a href=""http://twitter.com/download/iphone"" rel=""nofollow"">Twitter for iPhone</a>",,,,
'1881395930349572515',We are going to win like never before! #TrumpWillFixIt,en,Tweet,0,7,2,4,579,2025-01-20 17:38:39,"<a href=""http://twitter.com/download/iphone"" rel=""nofollow"">Twitter for iPhone</a>",#TrumpWillFixIt,,,
'1881395395349434777',"I am honored to be in the Capitol Rotunda this morning witnessing President Trump’s historic inaugural address. 

I am humbled to be serving in Congress at this important moment in history. 

President Trump is setting a bold agenda &amp; it’s time for Congress to get it done!",en,Tweet,0,17,4,3,5882,2025-01-20 17:36:31,"<a href=""http://twitter.com/download/iphone"" rel=""nofollow"">Twitter for iPhone</a>",,,,
'1881394106343260489',"President Trump will strengthen our military, bring manufacturing back, restore American energy dominance, and resume a place of strength on the world stage. 

The great American comeback starts RIGHT NOW!",en,Tweet,0,16,0,7,5728,2025-01-20 17:31:24,"<a href=""http://twitter.com/download/iphone"" rel=""nofollow"">Twitter for iPhone</a>",,,,
'1881394100110549051',LAW AND ORDER! It’s time to Make America Safe Again! https://t.co/7RduVe4i7o,en,Tweet,0,5,1,4,474,2025-01-20 17:31:22,"<a href=""https://mobile.twitter.com"" rel=""nofollow"">Twitter Web App</a>",,,video,https://video.twimg.com/ext_tw_video/1881393829141446656/pu/vid/avc1/1280x720/Cj6EDBfwkw0Rtfrc.mp4?tag=12
'1881392407218094422',"“America will be a manufacturing nation again.” Yes, sir!",en,Tweet,0,14,2,5,717,2025-01-20 17:24:39,"<a href=""http://twitter.com/download/iphone"" rel=""nofollow"">Twitter for iPhone</a>",,,,
'1881392243501887574',Drill baby drill!,en,Tweet,0,18,0,1,582,2025-01-20 17:24:00,"<a href=""http://twitter.com/download/iphone"" rel=""nofollow"">Twitter for iPhone</a>",,,,
'1881391956770857221',America's decline is over! https://t.co/5kXLGy5vWD,en,Tweet,0,8,1,2,447,2025-01-20 17:22:51,"<a href=""https://mobile.twitter.com"" rel=""nofollow"">Twitter Web App</a>",,,video,https://video.twimg.com/ext_tw_video/1881391895487598592/pu/vid/avc1/1280x720/PrYXnbbd8muuOkOj.mp4?tag=12
'1881390663302049909',Yes he was! 🇺🇸,en,Tweet,0,25,1,1,6867,2025-01-20 17:17:43,"<a href=""http://twitter.com/download/iphone"" rel=""nofollow"">Twitter for iPhone</a>",,,,
'1881390492656759004',"The golden age of America begins, right now! https://t.co/E1tMu7ap7Y",en,Tweet,1,16,1,2,508,2025-01-20 17:17:02,"<a href=""https://mobile.twitter.com"" rel=""nofollow"">Twitter Web App</a>",,,video,https://video.twimg.com/ext_tw_video/1881390452097568768/pu/vid/avc1/1280x720/ttQYj2wQqDK2pYjq.mp4?tag=12
'1881383475724607616',"The 45th and 47th President of the United States, @realDonaldTrump! https://t.co/NvhOW9AEVl",en,Tweet,0,9,2,1,1253,2025-01-20 16:49:09,"<a href=""https://mobile.twitter.com"" rel=""nofollow"">Twitter Web App</a>",,,video,https://video.twimg.com/ext_tw_video/1881383201647611904/pu/vid/avc1/1280x720/xEMbUdNrSvfrMfi_.mp4?tag=12
'1881353739052908575',"Today marks the beginning of four years dedicated to Making America Great Again.

President @realDonaldTrump, congratulations!",en,Tweet,0,42,7,12,1106,2025-01-20 14:50:59,"<a href=""http://twitter.com/download/iphone"" rel=""nofollow"">Twitter for iPhone</a>",,,,
'1881343753295962617',"Joe Biden’s pardons of those behind the coverups of COVID, Afghanistan, and January 6th cements his legacy as a corrupt and disgraceful soon-to-be former president.",en,Tweet,0,69,16,17,1724,2025-01-20 14:11:19,"<a href=""http://twitter.com/download/iphone"" rel=""nofollow"">Twitter for iPhone</a>",,,,
'1880643663384162694',"Merrick Garland presided over the wicked weaponization of the federal government against the American people. 

He has caused irreparable damage to the institution. 

Good riddance.",en,Tweet,2,160,36,40,3350,2025-01-18 15:49:24,"<a href=""http://twitter.com/download/iphone"" rel=""nofollow"">Twitter for iPhone</a>",,,,
'1880334342263828960',"The Supreme Court's ruling highlights the Chinese Communist Party’s threat through TikTok. 

It’s time for TikTok to sell or shut down.",en,Tweet,0,8,3,6,719,2025-01-17 19:20:16,"<a href=""http://twitter.com/download/iphone"" rel=""nofollow"">Twitter for iPhone</a>",,,,
'1880000395277398051',Great to join @semafor at an @Franchising411 event to discuss how House Republicans will tackle challenges for small businesses—from taxes to regulations—and create an economic environment where small businesses and franchises can thrive. https://t.co/0ZmnDYNERs,en,Tweet,0,4,2,2,715,2025-01-16 21:13:17,"<a href=""https://mobile.twitter.com"" rel=""nofollow"">Twitter Web App</a>",,,photo,https://pbs.twimg.com/media/GhcaPMBWEAAma_O.jpg
'1879942060234699245',"@BreitbartNews Medicare Advantage has become much more popular than the single-payer, traditional Medicare. 

It's more popular, a better value for seniors, and costs less for the American taxpayer - so of course Democrats want to get rid of it!",en,Reply,0,2,0,2,329,2025-01-16 17:21:29,"<a href=""https://mobile.twitter.com"" rel=""nofollow"">Twitter Web App</a>",,,,
'1879941774602596650',"@BreitbartNews 54% of seniors eligible for Medicare choose MA over traditional Medicare. So, why slash such an important program? 

Because it's modeled after the free market, a successful public-private partnership, and it actually works.",en,Reply,0,2,0,2,360,2025-01-16 17:20:21,"<a href=""https://mobile.twitter.com"" rel=""nofollow"">Twitter Web App</a>",,,,
'1879940986215989685',"Alarming stats from this @BreitbartNews piece: 

-1.3 million Americans enrolled in MA lost their plan due to Biden's cuts 
-Seniors with MA plans will see an average increase of at least 10% across 19 states
-Median out-of-pocket spending for MA plans will increase by $400",en,Reply,0,1,1,2,182,2025-01-16 17:17:13,"<a href=""https://mobile.twitter.com"" rel=""nofollow"">Twitter Web App</a>",,,,
'1879939113744494605',".@BobbyJindal warned about this last month ➡️➡️

Don’t let Biden sneak in more Medicare cuts on his way out the door https://t.co/ntdQ4qEtE7",en,Reply,0,1,0,1,285,2025-01-16 17:09:46,"<a href=""http://twitter.com/download/iphone"" rel=""nofollow"">Twitter for iPhone</a>",,https://www.foxnews.com/opinion/dont-let-biden-sneak-more-medicare-cuts-his-way-out-door,,
