tweet_id,text,language,type,bookmark_count,favorite_count,retweet_count,reply_count,view_count,created_at,client,hashtags,urls,media_type,media_urls
'1970580003835519448',"Democrats demand we let them spend an additional $1.5T in wasteful, woke spending or else they’ll shut down our government. They can’t be trusted to govern responsibly. If a shutdown occurs, it will be the Schumer Shutdown, and Democrats will have no one to blame but themselves. https://t.co/NNNVRYh9GH",en,Tweet,12,714,379,241,12818,2025-09-23 21:04:19,"<a href=""http://twitter.com/download/iphone"" rel=""nofollow"">Twitter for iPhone</a>",,,photo,https://pbs.twimg.com/media/G1joEXBXMAA36RC.jpg
'1970537209125114139',"🚨Don’t Be The First!🚨

No Republican has EVER voted for Obamacare subsidies. Don’t be the first.",en,Tweet,0,105,26,17,2231,2025-09-23 18:14:16,"<a href=""http://twitter.com/download/iphone"" rel=""nofollow"">Twitter for iPhone</a>",,,,
'1970490873969267185',"Democrats are threatening to shut down our government unless they secure over $1 trillion in reckless, anti-American spending. 

I stand firmly with President Trump—we must reject these outrageous demands and not give in to the Schumer Shakedown.",en,Tweet,2,472,148,140,6976,2025-09-23 15:10:08,"<a href=""https://mobile.twitter.com"" rel=""nofollow"">Twitter Web App</a>",,,,
'1970478776317591788',"Congratulations to Chairman @RepBrianMast for leading the first Department of State Reauthorization out of @HouseForeignGOP in 20+ years.

Proud to be a part of this process to support an America First State Department.

Here are a few of the top wins I secured ⬇️ https://t.co/5DtIx6ahLk",en,Tweet,1,8,0,5,673,2025-09-23 14:22:04,"<a href=""https://mobile.twitter.com"" rel=""nofollow"">Twitter Web App</a>",,,photo,https://pbs.twimg.com/media/G1iL7i9XcAAmxm5.jpg
'1970264053357387996',"My Oath of Office was a sacred vow to support and defend the Constitution from those who seek to undermine it, including ideologies like Sharia that are completely incompatible with our founding principles and way of life.",en,Tweet,0,59,7,11,1069,2025-09-23 00:08:50,"<a href=""http://twitter.com/download/iphone"" rel=""nofollow"">Twitter for iPhone</a>",,,,
'1970230717754855906',"Biden’s COVID-era Obamacare subsidies are a taxpayer rip-off. 

Over $35 billion a year goes to insurance companies for “phantom” enrollees—people who don’t exist or never use their free plans. 

End this fraud. Let these subsidies expire!",en,Tweet,0,32,3,8,989,2025-09-22 21:56:22,"<a href=""http://twitter.com/download/iphone"" rel=""nofollow"">Twitter for iPhone</a>",,,,
'1970182153729401000',"House Republicans did our jobs and passed a clean CR, funding the government for another 7 weeks. 

The ball is 100% in Chuck Schumer’s court. 

If a shutdown occurs, it will be a Schumer Shutdown.",en,Tweet,0,47,4,9,3127,2025-09-22 18:43:24,"<a href=""http://twitter.com/download/iphone"" rel=""nofollow"">Twitter for iPhone</a>",,,,
'1970168102810984890',"If you or someone you know is struggling with suicidal thoughts, help is available. The Veterans Crisis Line can be reached by calling 988 and pressing 1, texting 838522, or visiting https://t.co/jS5ng6yN80.",en,Reply,0,9,3,2,552,2025-09-22 17:47:34,"<a href=""http://twitter.com/download/iphone"" rel=""nofollow"">Twitter for iPhone</a>",,http://Veteranscrisisline.net,,
'1970168100013199825',"Every day, an average of 22 American Veterans tragically die by suicide.

My resolution designates September 22 of every year as National Military and Veterans Suicide Awareness Day, calling on our nation to honor their sacrifices, raise awareness of this crisis, and strengthen our commitment to providing Veterans with the mental health support they deserve.",en,Tweet,0,18,4,4,799,2025-09-22 17:47:33,"<a href=""http://twitter.com/download/iphone"" rel=""nofollow"">Twitter for iPhone</a>",,,photo,https://pbs.twimg.com/media/G1dxcgyXUAAocxK.jpg
'1969423975362007087',"Proud to co-sponsor this bill to ban Sharia in the United States with @RepFine. Sharia is NOT compatible with the U.S. Constitution.

https://t.co/CK0sddBhgN",en,Tweet,75,4983,1134,410,59204,2025-09-20 16:30:40,"<a href=""http://twitter.com/download/iphone"" rel=""nofollow"">Twitter for iPhone</a>",,https://www.dailywire.com/news/florida-congressman-introduces-bill-to-ban-sharia-law-we-are-not-going-to-become-a-muslim-nation,,
'1969125195047641157',"House Republicans did our jobs and passed a government funding bill. 

If the Democrats shut the government down over ONE TRILLION $ in unrelated policy demands, the American people will know who to blame. 

See you in October. ✌️",en,Tweet,1,77,15,9,2839,2025-09-19 20:43:25,"<a href=""http://twitter.com/download/iphone"" rel=""nofollow"">Twitter for iPhone</a>",,,,
'1969065059658641764',West Point: “Much of the history we teach was made by those we taught.” https://t.co/rtPx5jYv1f,en,Tweet,0,29,5,4,1683,2025-09-19 16:44:28,"<a href=""http://twitter.com/download/iphone"" rel=""nofollow"">Twitter for iPhone</a>",,,photo,https://pbs.twimg.com/media/G1OGO59XAAARQ3x.jpg
'1969055829056688625',"58 House Democrats just voted against a resolution honoring the life of Charlie Kirk and condemning political violence.

FIFTY-EIGHT.

What is wrong with the modern-day Left? https://t.co/Om5en3sr6F",en,Tweet,3,183,56,96,26135,2025-09-19 16:07:47,"<a href=""http://twitter.com/download/iphone"" rel=""nofollow"">Twitter for iPhone</a>",,,photo,https://pbs.twimg.com/media/G1N911mXcAA5gK_.jpg
'1969020718240219472',"On National POW/MIA Recognition Day, we honor the extraordinary courage and sacrifice of prisoners of war (POWs) and those missing in action (MIA).

This day calls to mind heroes like former Texas Congressman Sam Johnson, who survived nearly seven years as a POW in Vietnam after his plane was shot down. Enduring solitary confinement in a tiny concrete cell—bound in leg irons and under constant light—he never broke, emerging in 1973 as a symbol of the unbreakable American spirit. His legacy inspires us to keep fighting for those still listed as missing.",en,Tweet,0,27,7,5,1279,2025-09-19 13:48:16,"<a href=""http://twitter.com/download/iphone"" rel=""nofollow"">Twitter for iPhone</a>",,,photo,https://pbs.twimg.com/media/G1Nd6D1WsAA4rgM.jpg
'1968776937683202490',Requiring ID to vote is a straightforward measure to ensure election integrity. https://t.co/3HJdWIDk3w,en,Tweet,1,54,8,5,1342,2025-09-18 21:39:34,"<a href=""http://twitter.com/download/iphone"" rel=""nofollow"">Twitter for iPhone</a>",,,video,https://video.twimg.com/amplify_video/1968776865256030208/vid/avc1/960x544/3pl_tHyWErBFtrLQ.mp4?tag=21
'1968760460364107895',Congress must let Biden’s COVID-era Obamacare subsidies expire. https://t.co/rvGd1kZlHs,en,Tweet,4,248,43,16,32218,2025-09-18 20:34:06,"<a href=""https://mobile.twitter.com"" rel=""nofollow"">Twitter Web App</a>",,,photo,https://pbs.twimg.com/media/G1JxIQUWEAA1qnn.jpg
'1968727000043946212',"The Wren Collective has quietly infiltrated over 40 prosecutors offices nationwide. These Soros-backed DAs prioritize criminals over victims. 

Congress needs to take immediate action and create a select committee to investigate, expose, and hold this radical network accountable.",en,Tweet,7,172,69,19,11781,2025-09-18 18:21:08,"<a href=""http://twitter.com/download/iphone"" rel=""nofollow"">Twitter for iPhone</a>",,,,
'1968692629400404257',It’s time to DOGE the Global Small Business Grants Programs. https://t.co/HcXWEmxr8Q,en,Tweet,0,22,1,4,642,2025-09-18 16:04:34,"<a href=""http://twitter.com/download/iphone"" rel=""nofollow"">Twitter for iPhone</a>",,,video,https://video.twimg.com/amplify_video/1968692557031882752/vid/avc1/1280x720/fX1BBgYc6tR0K2a-.mp4?tag=21
'1968666964559008194',"Happy Birthday to the United States Air Force! 🇺🇸

Your courage, dedication, and innovation keep our country safe and strong. To all those who have served in the Air Force or are still serving today, our nation thanks you for your service. https://t.co/U1gWf9RlNJ",en,Tweet,1,64,9,8,2591,2025-09-18 14:22:35,"<a href=""https://mobile.twitter.com"" rel=""nofollow"">Twitter Web App</a>",,,photo,https://pbs.twimg.com/media/G1IcKEpXUAAUcTS.jpg
'1968468717638914385',"It was an honor to receive the Institute for Legislative Analysis’ Champion of Limited Government Award. 

I will continue to protect the limited government principles our great nation was founded on. 🇺🇸 https://t.co/dHfH2nYBjD",en,Tweet,1,29,3,4,1339,2025-09-18 01:14:49,"<a href=""http://twitter.com/download/iphone"" rel=""nofollow"">Twitter for iPhone</a>",,,photo,https://pbs.twimg.com/media/G1Fn3YXWcAExOy6.jpg
'1968409099571175841',"Personal charity has been largely outsourced to the federal government as taxpayer-funded programs.

No one should be shocked that the United States is $37 trillion in debt. Relying on taxpayers to fund everything is a recipe for fiscal disaster. https://t.co/DAg2Xwy5G8",en,Tweet,2,48,11,9,1750,2025-09-17 21:17:55,"<a href=""https://mobile.twitter.com"" rel=""nofollow"">Twitter Web App</a>",,,video,https://video.twimg.com/amplify_video/1968408868628705280/vid/avc1/1280x720/9nD8r_ldObtPRmRU.mp4?tag=21
'1968401925906567411',"Congress may vote to fund the government through November 21, 2025.

With the open enrollment beginning on November 1, premium rates will be mailed to enrollees in late October. 

The pressure on Congress will be fierce to extend Biden’s COVID-era subsidies.

This is not good. Now is the time to deal with this.",en,Tweet,0,22,4,6,900,2025-09-17 20:49:24,"<a href=""https://mobile.twitter.com"" rel=""nofollow"">Twitter Web App</a>",,,,
'1968370508069785752',"Not a SINGLE Republican has voted for Obamacare subsidies—EVER!

Why would ANY Republican vote to extend them now?",en,Tweet,3,199,49,46,25012,2025-09-17 18:44:34,"<a href=""https://mobile.twitter.com"" rel=""nofollow"">Twitter Web App</a>",,,,
'1968362625580110212',Sharia has no place in America. https://t.co/kELEe3lPWK,en,Tweet,18,1391,325,143,101247,2025-09-17 18:13:15,"<a href=""https://mobile.twitter.com"" rel=""nofollow"">Twitter Web App</a>",,,photo,https://pbs.twimg.com/media/G1EHXCwWUAEcQRd.jpg
'1968319121369809304',"On September 17, 1787, the greatest political document ever written was signed in Philadelphia, establishing the framework for our government, safeguarding freedom, and securing its blessings for generations.

Today, we honor the profound wisdom of our Founders and renew our shared commitment to preserve and protect this enduring charter of freedom.

Happy Constitution Day! 🇺🇸",en,Tweet,1,51,13,4,1853,2025-09-17 15:20:22,"<a href=""https://mobile.twitter.com"" rel=""nofollow"">Twitter Web App</a>",,,photo,https://pbs.twimg.com/media/G1DfpC5W4AA0JN-.jpg
'1968047182214467653',"Put on the full armor of God.

Speak the truth.

Fight for something bigger than yourself. Fight for America! 💪🇺🇸",en,Tweet,4,64,12,16,3546,2025-09-16 21:19:47,"<a href=""http://twitter.com/download/iphone"" rel=""nofollow"">Twitter for iPhone</a>",,,,
'1968034517282947270',"Charlie Kirk is an American martyr who had a profound impact on millions.

I am proud to have cosponsored @RepMaryMiller‘s resolution honoring his life.

They killed Charlie to silence him, but this despicable move has only made his legacy and his message more powerful.",en,Tweet,1,16,3,4,1066,2025-09-16 20:29:27,"<a href=""https://mobile.twitter.com"" rel=""nofollow"">Twitter Web App</a>",,,,
'1968006991865057457',They tried to silence the voice of freedom but they cannot silence the spirit of freedom in this nation. https://t.co/N1KGkbrUBt,en,Tweet,2,60,6,7,2143,2025-09-16 18:40:05,"<a href=""http://twitter.com/download/iphone"" rel=""nofollow"">Twitter for iPhone</a>",,,photo,https://pbs.twimg.com/media/G0_D5LBXAAAS3AB.jpg
'1967984979708891238',"🚨53% of Americans want Congress to allow Biden’s COVID-era Obamacare subsidies to expire.

Republicans in the House and the Senate should NOT extend them. 

LISTEN TO THE AMERICAN PEOPLE. LET THEM EXPIRE! https://t.co/GYJOkSdpfL",en,Tweet,1,33,7,8,860,2025-09-16 17:12:37,"<a href=""https://mobile.twitter.com"" rel=""nofollow"">Twitter Web App</a>",,,photo,https://pbs.twimg.com/media/G0-v5ViXkAAAuXc.jpg
'1967735029003587593',"JD Vance is correct—there is no unity with evil. 

Thankful for a Vice President who speaks with such moral clarity.",en,Tweet,4,149,34,26,5785,2025-09-16 00:39:24,"<a href=""http://twitter.com/download/iphone"" rel=""nofollow"">Twitter for iPhone</a>",,,,
'1967701567844364743',"🚨2012 terrorist attack against the conservative Christian think tank, the Family Research Council

🚨Steve Scalise shot at a Republican practice for the Congressional Baseball Game

🚨Rand Paul attacked on his own lawn

🚨Supreme Court Justice Brett Kavanaugh almost assassinated

🚨President Trump nearly assassinated not just once, but twice

🚨Charlie Kirk assassinated 

We have to put an end to this madness.

A Select Committee must investigate the radical left’s coordinated assault on America.",en,Tweet,10,246,65,49,10892,2025-09-15 22:26:26,"<a href=""https://mobile.twitter.com"" rel=""nofollow"">Twitter Web App</a>",,,,
'1967676773971399082',"President Trump is right.

The attacks of the radical Left are strategic, funded, and dangerous.

I stand with @chiproytx. We need a Select Committee to investigate the radical left’s anti-American network that is coordinated to attack our way of life.",en,Tweet,1,111,26,33,7066,2025-09-15 20:47:55,"<a href=""https://mobile.twitter.com"" rel=""nofollow"">Twitter Web App</a>",,,,
'1967644722626957652',"The United States is $37 trillion in debt.

Why on earth would a Republican Congress give Democrats a win and extend Joe Biden’s COVID-era Obamacare subsidies that cost the American taxpayer $40 billion a year?!

It is concerning that this is even being considered.",en,Tweet,9,169,58,50,3821,2025-09-15 18:40:33,"<a href=""https://mobile.twitter.com"" rel=""nofollow"">Twitter Web App</a>",,,,
'1967608730918518846',"An unspeakable crime that never should have taken place, but did because of open border policies.

Illegal aliens cannot be allowed into our country, and if they somehow manage to enter our country, they absolutely cannot be allowed to stay. This should not be controversial.",en,Tweet,1,114,25,14,11163,2025-09-15 16:17:32,"<a href=""https://mobile.twitter.com"" rel=""nofollow"">Twitter Web App</a>",,,,
'1967588397658300853',"🗳️Rep. Self on the SAVE Act: “We aren’t going to give up until it passes. This is something we must get done because it’s a foundational principle: only U.S. citizens, in a secure election, elect our representatives... This is a vital bill for the future of our republic.” https://t.co/TxHZbPjoZA",en,Tweet,0,23,5,7,640,2025-09-15 14:56:44,"<a href=""http://twitter.com/download/iphone"" rel=""nofollow"">Twitter for iPhone</a>",,,video,https://video.twimg.com/amplify_video/1967588312811528192/vid/avc1/960x544/s5qgmYOunVSdIFXw.mp4?tag=21
'1967047757509881966',Recognize any of these Communist goals? https://t.co/AOQrfOfQMA,en,Tweet,7,22,4,10,1440,2025-09-14 03:08:26,"<a href=""http://twitter.com/download/iphone"" rel=""nofollow"">Twitter for iPhone</a>",,,photo,"https://pbs.twimg.com/media/G0xbgpmW8AAvRxq.jpg,https://pbs.twimg.com/media/G0xbgpiXIAA0I0W.jpg,https://pbs.twimg.com/media/G0xbgpmWAAAAg3n.jpg,https://pbs.twimg.com/media/G0xbgpfXYAAzM03.jpg"
'1966615346787336581',"“We can no longer pretend to be bound together by shared ideals when a well-funded, vitriolic cadre of our fellow Americans and foreign interests are at war with the very values of faith in God, fidelity to our Constitution, and respect for the principles of liberty and Western Civilization that define us as Americans—including, notably, the free speech practiced and exemplified by Charlie Kirk.”",en,Tweet,6,165,43,53,4924,2025-09-12 22:30:11,"<a href=""http://twitter.com/download/iphone"" rel=""nofollow"">Twitter for iPhone</a>",,,photo,"https://pbs.twimg.com/media/G0rSO-SXoAAfX21.jpg,https://pbs.twimg.com/media/G0rSO-RXUAAwegy.jpg,https://pbs.twimg.com/media/G0rSO-PWMAAQxdf.jpg"
'1966606560869613801',"It was a privilege to witness Governor @GregAbbott_TX sign Texas House Bill 4211 into law, legislation banning discriminatory Sharia-based communities, such as EPIC City.

Sharia has no place in America, and this law reinforces our commitment to equality and justice for all. https://t.co/qc9JcYuXNP",en,Tweet,3,44,11,8,1491,2025-09-12 21:55:16,"<a href=""http://twitter.com/download/iphone"" rel=""nofollow"">Twitter for iPhone</a>",,,photo,"https://pbs.twimg.com/media/G0rKPk-XUAAlE1x.jpg,https://pbs.twimg.com/media/G0rKPk-WsAIomep.jpg,https://pbs.twimg.com/media/G0rKPk1W0AAX6Tg.jpg"
'1966606273245245503',Enough is enough. https://t.co/hGzbLLIyfQ,en,Tweet,4,116,24,44,5394,2025-09-12 21:54:07,"<a href=""http://twitter.com/download/iphone"" rel=""nofollow"">Twitter for iPhone</a>",,https://thehill.com/homenews/house/5500902-republicans-committee-investigate-kirk-assassination/,,
'1966600925415698723',"On this day in 1782, Congress endorsed “the Bible of the Revolution,” America’s first complete English-language Bible. 

I joined @RepCloudTX’s resolution to designate Sept 12 as “The Day of the Bible,” commemorating this historic milestone and celebrating the enduring influence of biblical values on America’s founding principles.",en,Tweet,0,23,2,3,870,2025-09-12 21:32:52,"<a href=""https://mobile.twitter.com"" rel=""nofollow"">Twitter Web App</a>",,,photo,https://pbs.twimg.com/media/G0rFEzjXgAAilhZ.jpg
'1966572922362818666',"This chart reveals critical insights into the ongoing struggle we face.

Freedom of thought is under attack.",en,Tweet,5,29,7,2,1465,2025-09-12 19:41:36,"<a href=""https://mobile.twitter.com"" rel=""nofollow"">Twitter Web App</a>",,,,
'1966560010818740439',"A voice that will be missed forever, a seat that nobody will ever be able to fill.

Congress must do everything it can to identify those behind the anti-American assaults being carried out against us and stop them.",en,Tweet,3,69,13,15,3766,2025-09-12 18:50:18,"<a href=""https://mobile.twitter.com"" rel=""nofollow"">Twitter Web App</a>",,,,
'1966554727346237576',"The SPLC is a domestic terrorist group. They targeted Charlie Kirk and Turning Point USA, smearing them as “hard-right” and pushing “Christian supremacy.”

Congress MUST form a select committee NOW to investigate and stop the SPLC and other radical Left-wing groups like them. https://t.co/zyDKNAplJt",en,Tweet,1,29,10,7,994,2025-09-12 18:29:18,"<a href=""https://mobile.twitter.com"" rel=""nofollow"">Twitter Web App</a>",,,photo,https://pbs.twimg.com/media/G0qbDr6WQAAQQNW.jpg
'1966538717629206600',"🚨🚨🚨I signed on to @RepChipRoy’s letter demanding formation of a select committee to investigate the Left's assault on America and the rule of law. 

Congress must act with clarity, courage, and urgency.",en,Tweet,6,184,39,159,30924,2025-09-12 17:25:41,"<a href=""http://twitter.com/download/iphone"" rel=""nofollow"">Twitter for iPhone</a>",,,,
'1966145504313757919',Rep. Self calls for a spiritual revival following the assassination of Charlie Kirk: “He was an evangelist for everything that was good and righteous…we need a spiritual revival. We need people like Charlie Kirk to stand up and be vocal about their faith just as he was.” https://t.co/ZOIVV7vkfS,en,Tweet,0,35,9,6,1137,2025-09-11 15:23:12,"<a href=""http://twitter.com/download/iphone"" rel=""nofollow"">Twitter for iPhone</a>",,,video,https://video.twimg.com/amplify_video/1966145419370508288/vid/avc1/1920x1080/W4c_Al_MRJmFPMV0.mp4?tag=21
'1966133482360369585',"Americans watched in horror as terrorists attacked on September 11, 2001, killing nearly 3,000 people in New York City, Washington, D.C., and Shanksville, PA. 

We pledged that dark day to never forget, yet somehow, many have.

During the days that followed 9/11, simple acts of kindness broke through the darkness, revealing that the American spirit was indeed still intact.

Those simple acts transcended politics. Today would be a good day to rekindle that spirit.",en,Tweet,0,34,7,6,2512,2025-09-11 14:35:25,"<a href=""https://mobile.twitter.com"" rel=""nofollow"">Twitter Web App</a>",,,photo,https://pbs.twimg.com/media/G0kb-2SWAAADGg3.jpg
'1965881861067907501',"It is hard to find the words to describe how tragic this loss is. Charlie Kirk was a remarkable man of God who accomplished so much at only 31 years old. One of the most important and influential conservative Christian voices in America and the world, he changed hearts and minds toward truth and righteousness. Tracy and I are praying for his family and friends during this unspeakably hard time. We have lost a true warrior. It is a tragic day in America.",en,Tweet,12,613,83,57,44621,2025-09-10 21:55:34,"<a href=""https://mobile.twitter.com"" rel=""nofollow"">Twitter Web App</a>",,,,
'1965864662358176004',We are clearly in a spiritual battle between good and evil.,en,Tweet,0,217,24,17,3487,2025-09-10 20:47:14,"<a href=""http://twitter.com/download/iphone"" rel=""nofollow"">Twitter for iPhone</a>",,,,
'1965856409842848004',Pray for Charlie Kirk.,da,Tweet,0,68,8,3,4196,2025-09-10 20:14:26,"<a href=""https://mobile.twitter.com"" rel=""nofollow"">Twitter Web App</a>",,,,
'1965832161149464852',"At least four NATO nations engaged in helping intercept and destroy multiple Russian drones violating Polish airspace.

One misstep could expand this tense conflict, but Europe stands prepared should Putin choose escalation. He would be wise to avoid further miscalculation.",en,Tweet,0,12,3,7,772,2025-09-10 18:38:05,"<a href=""http://twitter.com/download/iphone"" rel=""nofollow"">Twitter for iPhone</a>",,,,
'1965805147965338076',"COVID-19 is over. 

Congress MUST reject extending Biden’s temporary COVID-era Obamacare subsidies.

These handouts cost American taxpayers $40B annually, are riddled with fraud, and primarily go directly to insurance companies, not patients, often with no claims made at all.",en,Tweet,0,39,4,3,894,2025-09-10 16:50:44,"<a href=""https://mobile.twitter.com"" rel=""nofollow"">Twitter Web App</a>",,,,
'1965786629207150646',"When you don’t enforce the law, crime increases.

It’s common sense.

How do radical Democrats not understand this?",en,Tweet,0,29,5,7,2304,2025-09-10 15:37:09,"<a href=""https://mobile.twitter.com"" rel=""nofollow"">Twitter Web App</a>",,,,
'1965548684592177276',"Thankfully, @RepBobOnder has an amendment (#1146) that would strip this anti-Trump language out of the bill.

I will be standing with President Trump and voting for amendment #1146. 

I urge all House Republicans to do the same.",en,Reply,0,13,1,3,500,2025-09-09 23:51:39,"<a href=""http://twitter.com/download/iphone"" rel=""nofollow"">Twitter for iPhone</a>",,,,
'1965548680607613094',"🚨🚨🚨Buried in section 1110 of the National Defense Authorization Act is language blocking implementation of President Trump's Executive Order 14251, which prevents radical union bosses from having leverage over our national defense. https://t.co/JNSZMzofDb",en,Tweet,1,5,1,3,676,2025-09-09 23:51:38,"<a href=""http://twitter.com/download/iphone"" rel=""nofollow"">Twitter for iPhone</a>",,,photo,https://pbs.twimg.com/media/G0cIG5cXEAAwLrr.jpg
'1965525989766963352',The so-called “job growth” under the Biden administration was pure malarkey! https://t.co/xlzfYK6001,en,Tweet,3,69,21,8,2235,2025-09-09 22:21:28,"<a href=""https://mobile.twitter.com"" rel=""nofollow"">Twitter Web App</a>",,,photo,https://pbs.twimg.com/media/G0bzZalXoAA43b5.jpg
'1965479289807405442',"Historic. 

President Trump, all of America thanks you for securing our border and protecting our communities!",en,Tweet,1,40,8,6,2693,2025-09-09 19:15:54,"<a href=""https://mobile.twitter.com"" rel=""nofollow"">Twitter Web App</a>",,,,
'1965470943486378329',"⚠️Beware: The alliance of chaos is hard at work, tearing through the fabric of American values like faith, family, and freedom. https://t.co/Iq3TnXzO5N",en,Tweet,41,597,206,93,96938,2025-09-09 18:42:44,"<a href=""https://mobile.twitter.com"" rel=""nofollow"">Twitter Web App</a>",,,photo,https://pbs.twimg.com/media/G0bBXEhW8AANQgz.jpg
'1965457183329624239',"House conservatives have shattered decades of massive omnibus spending bills. 

To maintain this momentum, we must unite behind a yearlong Continuing Resolution (CR) at the very least. https://t.co/Bg0DVpzwba",en,Tweet,3,16,3,6,1761,2025-09-09 17:48:03,"<a href=""http://twitter.com/download/iphone"" rel=""nofollow"">Twitter for iPhone</a>",,,video,https://video.twimg.com/amplify_video/1965457097509777408/vid/avc1/1280x720/_T_BX5vWcU3MmeVn.mp4?tag=21
'1965411307701878817',House Freedom Caucus = approved by the Border Czar 💪🇺🇸,en,Tweet,0,21,5,4,2508,2025-09-09 14:45:45,"<a href=""http://twitter.com/download/iphone"" rel=""nofollow"">Twitter for iPhone</a>",,,,
'1965394315263217742',"🚨Good news! The Anti-Central Bank Digital Currency (CBDC) Surveillance State Act was included in the FY26 National Defense Authorization Act (NDAA)

This wouldn’t have been possible without HFC fighting to ensure the financial privacy and freedom of all Americans.

I will be watching closely to ensure this remains in the bill as it makes its journey into law.",en,Tweet,1,25,6,5,1998,2025-09-09 13:38:14,"<a href=""http://twitter.com/download/iphone"" rel=""nofollow"">Twitter for iPhone</a>",,,photo,"https://pbs.twimg.com/media/G0Z7tedXwAAFnbo.jpg,https://pbs.twimg.com/media/G0Z7tehWgAAvtC7.jpg,https://pbs.twimg.com/media/G0Z7teZWMAAV-3D.jpg,https://pbs.twimg.com/media/G0Z7teYXsAAqkpW.jpg"
