tweet_id,text,language,type,bookmark_count,favorite_count,retweet_count,reply_count,view_count,created_at,client,hashtags,urls,media_type,media_urls
'1919391643863777733',"Mobile Office Hours! 

My staff is here to help with everything from obtaining a passport to Social Security and VA benefits and Service Academy nominations.
Come meet with my staff on Tuesday, May 6, from 1 - 5 pm at the Huntington Public Library, 338 Main Street, Huntington. https://t.co/4CoFXQMoxP",en,Tweet,0,3,0,1,674,2025-05-05 15:00:03,"<a href=""https://mobile.twitter.com"" rel=""nofollow"">Twitter Web App</a>",,,photo,https://pbs.twimg.com/media/GqMEuIpXgAAGv_L.jpg
'1918344570334789943',"Wayne, a constituent from Woodbury and owner of Worksman Cycles—the oldest bicycle manufacturer in America—already has parts from China stuck on container ships, with prices more than doubling due to tariffs. His business, and his employees, are bearing the brunt of these misguided tariffs. What happens in Washington has real consequences for local businesses. We need smarter, more thoughtful policies.",en,Tweet,32,874,383,594,108526,2025-05-02 17:39:21,"<a href=""http://twitter.com/download/iphone"" rel=""nofollow"">Twitter for iPhone</a>",,,video,https://video.twimg.com/amplify_video/1918343802261008384/vid/avc1/540x960/IJN-AGswnCvfTB7W.mp4?tag=16
'1917961149359804572',"For eight long years, my constituent Kai Li was unjustly imprisoned in China—separated from his family, his home, and his freedom. I’m proud to have helped bring him back, and even more grateful for the chance to stand by him as he rebuilds his life here in America. https://t.co/FN2pdqJ4VI",en,Tweet,1,51,8,5,12593,2025-05-01 16:15:46,"<a href=""http://twitter.com/download/iphone"" rel=""nofollow"">Twitter for iPhone</a>",,,video,https://video.twimg.com/amplify_video/1917960869461237760/vid/avc1/540x960/3sQpUTqNm8JFKICa.mp4?tag=16
'1917717422678708465',The New York Democrat is doing things the ‘Suozzi way’ in a district Donald Trump carried. https://t.co/z0lttkUSN8 https://t.co/sK867AAn2t,en,Tweet,9,240,81,22,64793,2025-05-01 00:07:17,"<a href=""http://twitter.com/download/iphone"" rel=""nofollow"">Twitter for iPhone</a>",,https://rollcall.com/2025/04/30/tom-suozzi-take-five/,photo,https://pbs.twimg.com/media/Gp0Z1RuXUAANFsV.jpg
'1917650549308109196',"President Trump,

My constituent, Omer Neutra, who was murdered on October 7, 2023, posted this 8 years ago when he was only 16 years old.

His body is still held by Hamas. He and the other 5 American Hostages held by Hamas (1 living) must be brought home!

When you were inaugurated you said that the Americans must be released by Hamas or there would be “hell to pay!” Please bring them home!",en,Tweet,11,514,82,26,24435,2025-04-30 19:41:33,"<a href=""http://twitter.com/download/iphone"" rel=""nofollow"">Twitter for iPhone</a>",,,photo,https://pbs.twimg.com/media/GpzdAs0XAAAr1kh.jpg
'1917351404441657750',America is founded on two powerful forces: democracy and capitalism. Our strength lies in how well we balance them. https://t.co/xCg0TeDnTP,en,Tweet,1,60,16,10,4686,2025-04-29 23:52:52,"<a href=""http://twitter.com/download/iphone"" rel=""nofollow"">Twitter for iPhone</a>",,,video,https://video.twimg.com/amplify_video/1917351241715261441/vid/avc1/720x1560/OogDnNLqNkpJ_uyv.mp4?tag=16
'1916976504661016786',Suozzi secures millions to improve Glen Cove’s water infrastructure! https://t.co/SVZln1Avp1 https://t.co/iN6juxHXad,en,Tweet,0,23,10,4,5528,2025-04-28 23:03:09,"<a href=""http://twitter.com/download/iphone"" rel=""nofollow"">Twitter for iPhone</a>",,https://www.longislandpress.com/2025/04/28/glen-cove-water-2/,photo,https://pbs.twimg.com/media/Gpp34YwW8AIRNui.jpg
'1916885122067943680',"Mobile Office Hours! 
My staff is here to help with everything from obtaining a passport to Social Security and VA benefits and Service Academy nominations.
Come meet with my staff on Tuesday, April 29, from 2 - 4:30pm at the Westbury Memorial Library, 445 Jefferson St., Westbury.",en,Tweet,0,3,0,3,772,2025-04-28 17:00:01,"<a href=""http://twitter.com"" rel=""nofollow"">Twitter Web Client</a>",,,photo,https://pbs.twimg.com/media/GpEhq65WMAAk8oC.jpg
'1916510701440450889',"My quote from today’s Newsday:

“It was such a great honor to be there, celebrating the life of a man that really stood for the values that I try to live by — imperfectly — but the idea of love one another, and forgive one another, and try not to judge. Those are the basic things that Francis said and that my faith teaches, and I was thinking that today and praying for the people that I know that have gone through difficult times, and people that I care about — and even people that I’m not so fond of necessarily.”",en,Tweet,0,11,0,2,963,2025-04-27 16:12:12,"<a href=""http://twitter.com/download/iphone"" rel=""nofollow"">Twitter for iPhone</a>",,,photo,https://pbs.twimg.com/media/GpjQU1QWEAACFEY.jpg
'1916158719466864851',"Because of my father’s story, I define my whole outlook of America through the lens of the American Dream and immigration. That’s why it’s so painful how politicized it’s become, but I know if we work together, we can solve this problem and many more. https://t.co/SjP5o4yb2g",en,Tweet,11,236,31,23,46388,2025-04-26 16:53:33,"<a href=""http://twitter.com/download/iphone"" rel=""nofollow"">Twitter for iPhone</a>",,,video,https://video.twimg.com/amplify_video/1916158627125063682/vid/avc1/1280x720/sRs1-ks76jhgjck-.mp4?tag=16
'1916154655148515810',"As we celebrate the Pope’s life, let’s remember these basic values. Love one another. Forgive one another. Don’t judge each other. https://t.co/wHlUGRqfgC",en,Tweet,8,330,68,26,20227,2025-04-26 16:37:24,"<a href=""http://twitter.com/download/iphone"" rel=""nofollow"">Twitter for iPhone</a>",,,video,https://video.twimg.com/amplify_video/1916154596403101696/vid/avc1/1280x720/VT4H1G8cwbkNc5-z.mp4?tag=16
'1915933939840975096',The world is so chaotic that we should always remember the basics: Love one another. Forgive one another. Don’t judge one another. Life would be a lot better if we all lived by Pope Francis’ example. https://t.co/6zq0CoC4gK,en,Tweet,105,3912,551,132,106256,2025-04-26 02:00:22,"<a href=""http://twitter.com/download/iphone"" rel=""nofollow"">Twitter for iPhone</a>",,,video,https://video.twimg.com/amplify_video/1915933830852026368/vid/avc1/1280x720/UueGZmbtbwjWg7bE.mp4?tag=16
'1915918094624604258',I’m in Rome and about to join Anderson Cooper at 8:20pm but taking a moment first to think about the legacy of Pope Francis. https://t.co/OfcM2yFzdL,en,Tweet,3,52,6,5,1714,2025-04-26 00:57:24,"<a href=""http://twitter.com/download/iphone"" rel=""nofollow"">Twitter for iPhone</a>",,,video,https://video.twimg.com/amplify_video/1915918022147014656/vid/avc1/720x1280/G0X5fj9zJwprdIUy.mp4?tag=16
'1915911370635415977',I will be joining Anderson Cooper in Rome to honor the Pope’s legacy. Join me at 8:20 PM tonight on CNN. https://t.co/3HoaaV1x8r,en,Tweet,1,2,1,1,946,2025-04-26 00:30:41,"<a href=""http://twitter.com/download/iphone"" rel=""nofollow"">Twitter for iPhone</a>",,,photo,https://pbs.twimg.com/media/GpavPBhWcAA-s9H.jpg
'1915841251439497246',"Suozzi secures millions in funding for upgrades to Glen Cove’s water system. 

“Congressman Suozzi is always fighting for Glen Cove and we are grateful for his advocacy. This is not the first time Congressman Suozzi has helped Glen Cove secure millions of dollars in federal assistance, and we are sure it will not be the last,” said Glen Cove Mayor, Pam Panzenbeck.",en,Tweet,1,4,1,2,974,2025-04-25 19:52:03,"<a href=""http://twitter.com/download/iphone"" rel=""nofollow"">Twitter for iPhone</a>",,,photo,https://pbs.twimg.com/media/GpZvdlyXQAAC3_b.jpg
'1915765931151708411',"I am on my way to the Vatican to pay my respects and celebrate the life and service of Pope Francis.

It is a great honor to be one of only 10 Members of House invited to be part of the US delegation.

Paying my respects in person is deeply meaningful. I’m looking forward to sharing my reflections.",en,Tweet,2,107,19,12,6656,2025-04-25 14:52:45,"<a href=""http://twitter.com/download/iphone"" rel=""nofollow"">Twitter for iPhone</a>",,,photo,https://pbs.twimg.com/media/GpYq9apWMAAu--u.jpg
'1915438484614980035',"Today is Yom HaShoah, Holocaust Remembrance Day, a day to pause and remember the six million Jews and millions of others who perished in the most brutal genocide in history.

On this solemn occasion, I am also expressing concern over widespread Holocaust denialism that is happening all across social media platforms, and especially on X. This year marks the 80th anniversary of the liberation of Auschwitz. Each year that has passed, the truth Allied soldiers witnessed becomes even more fragile. We must speak up loudly against all who try and deny or minimize the Holocaust.",en,Tweet,4,79,22,10,6184,2025-04-24 17:11:36,"<a href=""http://twitter.com/download/iphone"" rel=""nofollow"">Twitter for iPhone</a>",,,photo,https://pbs.twimg.com/media/GpUBJptWoAABsaT.jpg
'1915123605526003905',Myth 5: Social Security is wasteful and inefficient. https://t.co/gqIMdkFtmH,en,Reply,4,48,19,13,1574,2025-04-23 20:20:23,"<a href=""http://twitter.com/download/iphone"" rel=""nofollow"">Twitter for iPhone</a>",,,photo,https://pbs.twimg.com/media/GpPixPhWUAAbOVU.jpg
'1915123598903169105',Myth 4: Illegal immigrants are stealing Social Security. https://t.co/XNefEBin5w,en,Reply,3,44,19,11,1626,2025-04-23 20:20:21,"<a href=""http://twitter.com/download/iphone"" rel=""nofollow"">Twitter for iPhone</a>",,,photo,https://pbs.twimg.com/media/GpPiw1KWkAAKo9g.jpg
'1915123592582353241',Myth 3: There is rampant fraud. https://t.co/lQBCJfV3YI,en,Reply,3,34,15,6,987,2025-04-23 20:20:20,"<a href=""http://twitter.com/download/iphone"" rel=""nofollow"">Twitter for iPhone</a>",,,photo,https://pbs.twimg.com/media/GpPiwfCWgAApogI.jpg
'1915123585506476395',Myth 2: Social Security is going bankrupt. https://t.co/Fc1oxjhQV4,en,Reply,3,38,18,11,1081,2025-04-23 20:20:18,"<a href=""http://twitter.com/download/iphone"" rel=""nofollow"">Twitter for iPhone</a>",,,photo,https://pbs.twimg.com/media/GpPiwFGXcAEKEm0.jpg
'1915123578665685202',"On Monday, I held a townhall on Social Security. We discussed 5 important myths on Social Security and corrected the record. Here they are. 🧵 https://t.co/9Ww7D9X7gb",en,Tweet,35,345,165,281,40654,2025-04-23 20:20:17,"<a href=""http://twitter.com/download/iphone"" rel=""nofollow"">Twitter for iPhone</a>",,,photo,https://pbs.twimg.com/media/GpPivpJW8AAAPqi.jpg
'1915042993884827702',"100 years of the Nassau County Police Department! 

Congratulations to everyone who makes NCPD work, including Commissioner Patrick Ryder. What a great evening to unveil the new state-of-the-art David S. Mack Center for Training and Intelligence. https://t.co/ZXcggxfDoD",en,Tweet,0,6,1,1,892,2025-04-23 15:00:04,"<a href=""https://mobile.twitter.com"" rel=""nofollow"">Twitter Web App</a>",,,photo,"https://pbs.twimg.com/media/GpL5fbnXwAAFBjp.jpg,https://pbs.twimg.com/media/GpL5fbrXgAATxP8.jpg,https://pbs.twimg.com/media/GpL5fc6WAAA6Z5P.jpg"
'1914828049591259489',There is no place for terrorism in our world. It must be stopped. https://t.co/Vrrs9wgAId,en,Tweet,0,18,7,2,2461,2025-04-23 00:45:57,"<a href=""http://twitter.com/download/iphone"" rel=""nofollow"">Twitter for iPhone</a>",,,photo,https://pbs.twimg.com/media/GpLV9kxWwAAkbvM.jpg
'1914801391601598640',"🌎Earth Day, Every Day!🌎

💦Water - We must protect the Long Island Sound, clean up our groundwater, replace lead pipes, ensure the safety of our drinking water, remediate the Navy Grumman plume, manage stormwater effectively, eliminate microplastics in our waterways, and pick up trash!

🌱Land - We need to stop illegal dumping, preserve open spaces, recycle more, expedite the cleanup of Superfund, Hazardous Waste, and Brownfield sites, and prevent the spread of invasive species!

🔋Air - Let's promote renewable energy sources, hybrid and electric vehicles, and energy-efficient cars. We should also work to reduce emissions and enhance public transportation options.

We all need to reassess how we eat, move, produce, and consume to protect our environment and support a more sustainable global economy. We must be smarter and do better. It’s essential to nurture our resources rather than exploit them in order to advance climate action. Together, we can make a difference!",en,Tweet,0,55,16,4,5393,2025-04-22 23:00:01,"<a href=""http://twitter.com"" rel=""nofollow"">Twitter Web Client</a>",,,photo,https://pbs.twimg.com/media/GpKwBAmXIAAv8o6.jpg
'1914784744426102993',"It’s a great Earth Day honor to receive this award from the New York League of Conservation Voters. @nylcv 

https://t.co/bjTUkJZ3Ag https://t.co/l3KLlxdtlT",en,Tweet,3,81,26,4,13371,2025-04-22 21:53:52,"<a href=""http://twitter.com/download/iphone"" rel=""nofollow"">Twitter for iPhone</a>",,https://nylcv.org/press-item/nylcv-presents-congressman-tom-suozzi-with-2025-clean-water-champion-award/,photo,"https://pbs.twimg.com/media/GpKtWf7XYAAfuA9.jpg,https://pbs.twimg.com/media/GpKtWf8WcAAoagD.jpg"
'1914717520554234257',"I don’t want people to panic, but I do want them to stay engaged. I am holding these town halls, on key issues like the budget and Social Security, to help educate my constituents on the facts as to what’s happening, what I am doing to protect them, and what they can do to make their government work for them.

https://t.co/Ip82Nx7MnZ",en,Tweet,2,53,16,7,4449,2025-04-22 17:26:45,"<a href=""https://mobile.twitter.com"" rel=""nofollow"">Twitter Web App</a>",,,,
'1914675217344954592',"Last night, Congresswoman Gillen and I hosted a town hall to address constituent’s concerns about DOGE’s staffing cuts at Social Security, which have already caused increased wait times. There is a lot of uncertainty, but after a two hour meeting (question and answer period starts at 1:09:32), we helped dispel any unnecessary panic and helped provide direction to stay active and involved.

https://t.co/f14GUJkfdC",en,Tweet,5,64,20,8,5092,2025-04-22 14:38:39,"<a href=""http://twitter.com/download/iphone"" rel=""nofollow"">Twitter for iPhone</a>",,,photo,https://pbs.twimg.com/media/GpJK9jxXwAA1iRu.jpg
'1914423904111652867',"Coming up at 6pm, I will be hosting an in-person Social Security Briefing with @RepLauraGillen and former Social Security Commissioner and Governor @MartinOMalley. 

The response has been overwhelming, and we have now reached full capacity. For those who cannot attend in person, we will be livestreaming the briefing on my Facebook page. Please join us as we discuss the threats to Social Security and how we are taking action to protect it.

https://t.co/ZcbSeSsj80",en,Tweet,0,6,1,5,1563,2025-04-21 22:00:01,"<a href=""http://twitter.com"" rel=""nofollow"">Twitter Web Client</a>",,,photo,https://pbs.twimg.com/media/GpFfVwtXcAAhUS6.jpg
'1914348404496277798',"Mobile Office Hours! 
My staff is here to help with everything from obtaining a passport to Social Security and VA benefits and Service Academy nominations.
Come meet with my staff on Tuesday, April 22, from 10am - 2 pm at the Great Neck Public Library, 159 Bayview Ave., Great Neck.",en,Tweet,0,4,3,2,870,2025-04-21 17:00:01,"<a href=""http://twitter.com"" rel=""nofollow"">Twitter Web Client</a>",,,photo,https://pbs.twimg.com/media/GpEN9U2XsAAmVMh.jpg
'1914263894790459451',"Thank God for Pope Francis.  He always reminded us that the poor, the homeless, and migrants are all made in God’s image, that the earth is part of God’s divine creation, and that the modern problems of income inequality, and the dangerous and unequal spread of technology are further dividing and distracting us from our obligation to serve the common good. We can be better.

Rest in peace, good and faithful servant. 

Ad maiorem Dei gloriam – For the greater glory of God.",en,Tweet,8,340,40,20,7848,2025-04-21 11:24:12,"<a href=""http://twitter.com/download/iphone"" rel=""nofollow"">Twitter for iPhone</a>",,,photo,https://pbs.twimg.com/media/GpDU3VyX0AE0M_W.jpg
'1913925624181522684',"Happy Easter! 
Easter reminds us that despite the darkness and despair of Good Friday, Easter Sunday brings the hope of resurrection and new life. May God continue to bless us all. https://t.co/2Lwmiz9rze",en,Tweet,0,27,4,3,1119,2025-04-20 13:00:02,"<a href=""https://mobile.twitter.com"" rel=""nofollow"">Twitter Web App</a>",,,photo,https://pbs.twimg.com/media/Gov880SWMAANayP.jpg
'1913699122890301654',"I will be hosting an in-person Social Security Briefing with @RepLauraGillen and former Social Security Commissioner and Governor @MartinOMalley  on Monday at 6 p.m. The response has been overwhelming, and we have now reached full capacity. For those who cannot attend in person, we will be livestreaming the briefing on my Facebook page. Please join us as we discuss the threats to Social Security and how we are taking action to protect it.

https://t.co/ZcbSeSsQXy",en,Tweet,0,11,2,2,1004,2025-04-19 22:00:00,"<a href=""http://twitter.com"" rel=""nofollow"">Twitter Web Client</a>",,,photo,https://pbs.twimg.com/media/Go6fwUaXQAI-EMy.jpg
'1913629794937250080',"Today we mark 250 years since the Battles of Lexington and Concord— “The shot heard round the world.”

People busy with jobs and families—working people, farmers, blacksmiths, and tradesmen—decided they would risk it all for freedom.

Their stand wasn’t just against a king; it was for the radical idea that government should answer to the people.

That idea is under pressure today. We honor their legacy not just by remembering their bravery, but by continuing their struggle —every day— defending democracy, standing up for what’s right and making sure that every American has a real say in the future we build together.",en,Tweet,9,165,70,6,9916,2025-04-19 17:24:31,"<a href=""http://twitter.com/download/iphone"" rel=""nofollow"">Twitter for iPhone</a>",,,photo,https://pbs.twimg.com/media/Go6UJ2FWIAAgCXY.jpg
'1913590528093888854',"Instead of cutting taxes for the wealthiest Americans, President Trump should follow through on his campaign pledge to restore the full SALT deduction. Let’s go. 

https://t.co/LFFRyEK8jt https://t.co/KrUTE9a0kX",en,Tweet,4,73,20,8,6841,2025-04-19 14:48:29,"<a href=""http://twitter.com/download/iphone"" rel=""nofollow"">Twitter for iPhone</a>",,https://www.newsday.com/news/region-state/salt-cap-tax-cuts-congress-i8upslds,photo,https://pbs.twimg.com/media/Go5wcZNXEAAxp8x.jpg
'1913231046037877066',"Today, we remember the betrayal, suffering, and death of Good Friday. Our faith guides us to believe that, just as spring blooms follow the dark and gray of winter, we will rejoice on Easter morning. https://t.co/w7y5sN7Wjs",en,Tweet,0,9,0,3,732,2025-04-18 15:00:02,"<a href=""https://mobile.twitter.com"" rel=""nofollow"">Twitter Web App</a>",,,photo,https://pbs.twimg.com/media/Gov552pW0AAdUgz.jpg
'1912974352481734935',"‼️Attention all high school students in NY-03 ~ the deadline for submissions to the 2025 Congressional Art Competition is one week away!

All framed artwork must be dropped off to either our Glen Cove office (51 Glen St., 2nd Floor) or our Douglaston Office, 242-09 Northern Blvd., by Friday, April 25th at 4:00 pm.

Please click on the link below, and read submission rules and guidelines carefully.
Good luck!

https://t.co/toxLzlZ0dy",en,Tweet,0,4,1,2,859,2025-04-17 22:00:01,"<a href=""http://twitter.com"" rel=""nofollow"">Twitter Web Client</a>",,,photo,https://pbs.twimg.com/media/Gov3JX-XUAAjA1N.jpg
'1912905524112241044',I will be hosting a Social Security Briefing with @RepLauraGillen and Gov. @MartinOMalley. We will discuss the ways Social Security is endangered and what we’re doing to step up and protect you. https://t.co/VYcSH5c2kQ,en,Tweet,0,38,19,4,5504,2025-04-17 17:26:31,"<a href=""http://twitter.com/download/iphone"" rel=""nofollow"">Twitter for iPhone</a>",,,photo,https://pbs.twimg.com/media/GowBbuqXsAAoPuy.jpg
'1912143878125220155',"It's Tax Day, a reminder that while we all pay federal income taxes, New Yorkers face the second highest state and local tax (SALT) burden in the country (behind Hawaii), at 13.56 percent!

During my time in Congress, I earned the nickname ""Mr. SALT"" for successfully passing legislation three times to restore the SALT deduction with bipartisan support. Restoring the full SALT deduction remains a top priority for me.

https://t.co/Vphrl96atv",en,Tweet,2,22,6,21,3866,2025-04-15 15:00:01,"<a href=""http://twitter.com"" rel=""nofollow"">Twitter Web Client</a>",,,photo,https://pbs.twimg.com/media/Goh_hNLXAAAfWjB.jpg
'1911887188809388133',"Mobile Office Hours! 
My staff is here to help with everything from obtaining a passport to Social Security and VA benefits and Service Academy nominations.
Come meet with my staff on Tuesday, April 15, from 1- 5 pm at the Huntington Public Library, 338 Main Street, Huntington. https://t.co/5y9eSD1jru",en,Tweet,0,4,0,22,2207,2025-04-14 22:00:01,"<a href=""https://mobile.twitter.com"" rel=""nofollow"">Twitter Web App</a>",,,photo,https://pbs.twimg.com/media/Gog6aibW0AAeHb0.jpg
'1911872791839649920',"I traveled to Pakistan to work on counter-terrorism and mutual economic issues. While there, I visited a remote part of the country — Kartarpur in Punjab — and saw people from Hicksville, Syosset, and Bellrose at one of the Sikh religion’s most holy sites! Wow! 🙏🏻 https://t.co/YFG6QtiY9e",en,Tweet,0,87,26,126,7141,2025-04-14 21:02:49,"<a href=""http://twitter.com/download/iphone"" rel=""nofollow"">Twitter for iPhone</a>",,,photo,"https://pbs.twimg.com/media/GohWFB8XoAA8ZPq.jpg,https://pbs.twimg.com/media/GohWFB7WQAERLAs.jpg,https://pbs.twimg.com/media/GohWFDOWoAAZcdw.jpg,https://pbs.twimg.com/media/GohWFB-W4AANYj5.jpg"
'1911822879554961613',"History made: This Vaisakhi, I became the first member of Congress to visit Kartarpur Sahib on a Congressional Delegation. 

I had the rare honor of seeing historical relics associated with Guru Nanak Dev Ji, the founder of Sikhism.

I also participated in the Langar, the community meal started by Guru Nanak Dev Ji, to fight against the caste system. I was gifted a beautiful “kirpan,” which symbolizes kirpa (compassion) and “aan” (dignity), values I strive to fight for every day in Congress.

More photos of my Pakistan trip to come.

https://t.co/OPygXkDHmp",en,Tweet,3,41,14,30,3280,2025-04-14 17:44:29,"<a href=""http://twitter.com/download/iphone"" rel=""nofollow"">Twitter for iPhone</a>",,,photo,https://pbs.twimg.com/media/GogoxqhWoAAxNdr.jpg
'1911449299088810444',"I would like to wish a Happy Vaisakhi to the Sikh community. Today, Sikhs around the world celebrate the creation of the Khalsa Panth by Guru Gobind Singh. When a Sikh becomes part of the Khalsa, they vow to dedicate their lives to fighting for compassion and equality. https://t.co/sxxJ7F8E3Z",en,Tweet,1,69,13,34,6829,2025-04-13 17:00:00,"<a href=""https://mobile.twitter.com"" rel=""nofollow"">Twitter Web App</a>",,,video,https://video.twimg.com/amplify_video/1911421305045331968/vid/avc1/720x960/dG564mDeeQYY9vXz.mp4?tag=14
'1911388900733362279',"Today, Christians around the world celebrate the start of Holy Week with the joyful observance of Palm Sunday. May the spirit of this day bring you a blessed Holy Week. https://t.co/H8UsL1JZ4n",en,Tweet,0,20,3,14,4400,2025-04-13 13:00:00,"<a href=""https://mobile.twitter.com"" rel=""nofollow"">Twitter Web App</a>",,,photo,https://pbs.twimg.com/media/GoWPuhmW8AAMPZD.jpg
'1911192609567244789',"Chag Pesach Sameach!  

My Jewish friends have celebrated Passover for over 3,000 years. Is there another holiday that has been celebrated for as long? May your Passover be meaningful and blessed with good health, happiness, and peace. https://t.co/Cr7MUoWxg4",en,Tweet,1,31,2,24,4475,2025-04-13 00:00:01,"<a href=""https://mobile.twitter.com"" rel=""nofollow"">Twitter Web App</a>",,,photo,https://pbs.twimg.com/media/GoWM-WMXUAArxNm.jpg
'1910437637514821798',"📣Calling All High School Students Living in NY-03!

I am pleased to announce the 2025 Congressional Art Competition🖼️

All framed artwork must be dropped off to either our Glen Cove office (51 Glen St., 2nd Floor) or our Douglaston Office, 242-09 Northern Blvd., by Friday, April 25th at 4:00 pm.

Please click on the link below, and read submission rules and guidelines carefully.
Good luck!

https://t.co/XEdw75OqEL",en,Tweet,0,10,0,20,5252,2025-04-10 22:00:01,"<a href=""http://twitter.com"" rel=""nofollow"">Twitter Web Client</a>",,,photo,https://pbs.twimg.com/media/GoL94lcXcAAI53u.jpg
'1910398403223204114',"Acta Non Verba!

It’s great when persistence, hard work, and bipartisanship pay off for my constituents.

Thank you, Secretary Duffy, for taking the lessons from our tour of the U.S. Merchant Marine Academy to your cabinet meeting at the White House. Investing in our mariners is common sense",en,Tweet,0,4,1,15,4021,2025-04-10 19:24:07,"<a href=""http://twitter.com/download/iphone"" rel=""nofollow"">Twitter for iPhone</a>",,,video,https://video.twimg.com/amplify_video/1910398316988256256/vid/avc1/1280x720/dV49-NsBFTb2NqeD.mp4?tag=16
'1910329618122293260',"Tariff Chaos:

The “switcheroo” from the President yesterday on his tariffs was yet another indicator he lacks a serious plan to rebuild the middle class and reenergize our industrial base. The American people deserve better.

https://t.co/E5wVdApqmO https://t.co/4lAw65QZpk",en,Tweet,0,93,36,18,7110,2025-04-10 14:50:47,"<a href=""http://twitter.com/download/iphone"" rel=""nofollow"">Twitter for iPhone</a>",,https://www.politico.com/newsletters/new-york-playbook/2025/04/10/spano-for-cuomo-00283182,photo,https://pbs.twimg.com/media/GoLaqUWWYAA3Mmk.jpg
