tweet_id,text,language,type,bookmark_count,favorite_count,retweet_count,reply_count,view_count,created_at,client,hashtags,urls,media_type,media_urls
'1843661651276673521',"During Breast Cancer Awareness Month, we pray for survivors and those currently battling this disease, and remember those we’ve lost. Let us continue to raise awareness and advocate for advanced research and early detection efforts. https://t.co/NhvsVpisDm",en,Tweet,0,1,0,0,176,2024-10-08 15:36:05,"<a href=""http://twitter.com/download/iphone"" rel=""nofollow"">Twitter for iPhone</a>",,,photo,https://pbs.twimg.com/media/GZYAf6GWgAAu8WY.jpg
'1841527233480990844',"Happy Filipino American History Month! This month, we celebrate the history and culture of Filipino Americans across the U.S., especially in Guam. I am proud to honor the deep ties between our Filipino and Chamorro communities. Mabuhay! 🇵🇭🇺🇸 https://t.co/0zJmybf7J0",en,Tweet,0,1,0,0,178,2024-10-02 18:14:41,"<a href=""http://twitter.com/download/iphone"" rel=""nofollow"">Twitter for iPhone</a>",,,photo,https://pbs.twimg.com/media/GY5rQWXWoAAwC6I.jpg
'1840795784112943597',"Last week, the House passed my bill, H.R. 522. This piece of legislation will not only support our veterans in Guam, but also cover adaptive vehicle shipping costs for eligible veterans in American Samoa, CNMI, and other remote U.S. regions. https://t.co/9FtczPyCDc",en,Tweet,0,6,1,1,640,2024-09-30 17:48:09,"<a href=""http://twitter.com/download/iphone"" rel=""nofollow"">Twitter for iPhone</a>",,,video,https://video.twimg.com/ext_tw_video/1840795756665417728/pu/vid/avc1/640x352/PBbsZu8aeNfLt5ul.mp4?tag=12
'1839074848250708141',"I am proud to announce that the House has passed my bill, the Deliver for Veterans Act. This piece of legislation authorizes the DVA to provide grants that cover the cost of shipping a modified automobile or other conveyance to disabled veterans who served our nation. https://t.co/NglfgMkbXy",en,Tweet,0,2,2,19,374,2024-09-25 23:49:46,"<a href=""http://twitter.com/download/iphone"" rel=""nofollow"">Twitter for iPhone</a>",,,photo,https://pbs.twimg.com/media/GYW008UXUAAZbkV.jpg
'1839017269768134762',"Today, I am proud to announce that the House has passed my bill, the Deliver for Veterans Act. This piece of legislation authorizes the DVA to provide grants that cover the cost of shipping modified automobiles or other conveyance to disabled veterans who served our nation.",en,Tweet,0,1,0,0,130,2024-09-25 20:00:59,"<a href=""http://twitter.com/download/iphone"" rel=""nofollow"">Twitter for iPhone</a>",,,,
