tweet_id,text,language,type,bookmark_count,favorite_count,retweet_count,reply_count,view_count,created_at,client,hashtags,urls,media_type,media_urls
'1915873753654841768',"Survivors of domestic violence and sexual assault should never have to worry about not having a place to turn for immediate assistance.

That’s why I’m leading a bipartisan coalition with 120+ colleagues urging @AGPamBondi to restore VAWA grant opportunities and ensure these life-saving services remain available.",en,Tweet,1,6,1,3,1055,2025-04-25 22:01:12,"<a href=""https://mobile.twitter.com"" rel=""nofollow"">Twitter Web App</a>",,,,
'1915849145572634705',"Beginning May 7, everyone flying in the U.S. or entering a federal building will need a REAL ID.

@NJ_MVC is providing emergency REAL ID appointments for families with urgent travel or a life-or-death emergency.

More below ⬇️
https://t.co/jk3P2New3w",en,Tweet,0,0,1,4,547,2025-04-25 20:23:25,"<a href=""http://www.oneupapp.io"" rel=""nofollow"">OneUp App</a>",,https://www.northjersey.com/story/news/new-jersey/2025/04/21/nj-emergency-real-id-appointments-thursday/83200603007/,,
'1915769716724867137',"I'm deeply saddened to hear of the passing of @RepMcGovern’s daughter.

I’m praying for the McGovern family and all who knew and loved her. No parent should ever have to endure such a loss.

May her memory be a blessing.",en,Tweet,0,1,1,2,827,2025-04-25 15:07:48,"<a href=""https://mobile.twitter.com"" rel=""nofollow"">Twitter Web App</a>",,,,
'1915465540992454688',"The Trump Administration is canceling more than 365 public safety grants, cutting funding for everything from mental health care for cops to support for victims of crime and sexual assault.

It’s a gut punch to law enforcement and survivors across the country — absolutely outrageous and wrong.",en,Tweet,1,1,0,5,876,2025-04-24 18:59:07,"<a href=""http://twitter.com/download/iphone"" rel=""nofollow"">Twitter for iPhone</a>",,,,
'1915451168924295507',"Today, we remember and honor the 1.5 million innocent lives lost during the Armenian genocide 110 years ago.

I’m proudly co-sponsoring the Armenian Genocide Education Act to ensure this history is never forgotten and never repeated. By telling the truth about the Armenian genocide, we honor the memory of those lost and reaffirm our commitment to condemning hate and violence around the world.",en,Tweet,3,176,29,20,3103,2025-04-24 18:02:00,"<a href=""http://twitter.com"" rel=""nofollow"">Twitter Web Client</a>",,,,
'1915409644228624870',"During Attorney General Bondi’s confirmation hearing, she swore under oath to support survivors of domestic violence.

I’m leading 100+ colleagues demanding that she keep her word and protect Violence Against Women Act funding — so these life-saving investments remain available to support our communities.",en,Tweet,1,4,4,4,2596,2025-04-24 15:17:00,"<a href=""http://twitter.com"" rel=""nofollow"">Twitter Web Client</a>",,,,
'1915198503011201230',"On Yom HaShoah, we remember the six million Jews killed by the Nazis during the Holocaust.

With record-high antisemitism and mounting evidence that knowledge of the Holocaust is fading, we must commit to standing strong against hatred and intolerance in all forms. This is even more true after the atrocities on October 7. #NeverAgain",en,Tweet,1,30,8,11,833,2025-04-24 01:18:00,"<a href=""http://twitter.com"" rel=""nofollow"">Twitter Web Client</a>",,,photo,https://pbs.twimg.com/media/GpQiT6zWkAATdpC.jpg
'1915184264884142583',".@SecDef Pete Hegseth must be replaced by someone who can properly protect America’s classified information and the lives of our brave service members.
 
His reckless actions endanger our troops and weaken our national security. https://t.co/zsXpiTpiXO",en,Tweet,0,8,1,3,761,2025-04-24 00:21:25,"<a href=""https://mobile.twitter.com"" rel=""nofollow"">Twitter Web App</a>",,,video,https://video.twimg.com/amplify_video/1915183966073614336/vid/avc1/1280x720/hvoSUPHHG97ysj5n.mp4?tag=16
'1915084848714125655',"We need 21st-century tools to crack down on fraudsters who use every trick in the book to swindle Americans out of billions of dollars every year.

I’m proudly co-leading the bipartisan GUARD Act to ensure that law enforcement can access cutting-edge technologies to stop these scams and protect our communities.",en,Tweet,1,1,0,3,937,2025-04-23 17:46:23,"<a href=""https://mobile.twitter.com"" rel=""nofollow"">Twitter Web App</a>",,,,
'1915009256052625817',"Right now, too many families are being forced to choose between keeping the lights on or putting food on the table. No one in Jersey, or anywhere across the country, should have to make that choice.

That’s why I’m working to give hardworking families a break on their utility bills — not break their bank.",en,Tweet,0,5,0,5,770,2025-04-23 12:46:00,"<a href=""http://twitter.com"" rel=""nofollow"">Twitter Web Client</a>",,,video,https://video.twimg.com/amplify_video/1914799874366693376/vid/avc1/1080x1920/dGGTZmAShZazEKcy.mp4?tag=16
'1914872493254316060',"I'm praying for everyone impacted by the devastating wildfire in Ocean County. Thank you to our brave first responders battling the flames and helping families evacuate.

Please stay safe and follow all official evacuation orders.",en,Tweet,1,3,0,2,1436,2025-04-23 03:42:33,"<a href=""https://mobile.twitter.com"" rel=""nofollow"">Twitter Web App</a>",,,,
'1914810445765959787',"The despicable and depressing surge in antisemitism across New Jersey and our country should sound an alarm for every single American.

We must work together to ensure that there truly is no place for hate of any kind here in the greatest country in the world.",en,Tweet,1,18,1,10,1687,2025-04-22 23:36:00,"<a href=""https://mobile.twitter.com"" rel=""nofollow"">Twitter Web App</a>",,,,
'1914749021387739262',"Happy Earth Day, Jersey! As we commemorate the 55th anniversary of Earth Day, let's continue to fight to protect our climate and keep our air and water clean for our children and families. https://t.co/4heaZlghMy",en,Tweet,0,4,0,1,523,2025-04-22 19:31:55,"<a href=""http://www.oneupapp.io"" rel=""nofollow"">OneUp App</a>",,,photo,https://pbs.twimg.com/media/GpKOFqJWEAAeJoh.jpg
'1914723847690924361',"Jersey utility companies have a monopoly on electricity — and now they’re claiming they don’t have enough supply to meet the demand, so they’re jacking up rates. 
 
A 40% rate increase in one year isn’t good price management — it’s flat-out incompetence, and Jersey families are the ones paying the price.",en,Tweet,0,4,1,5,662,2025-04-22 17:51:53,"<a href=""https://mobile.twitter.com"" rel=""nofollow"">Twitter Web App</a>",,,video,https://video.twimg.com/amplify_video/1914723128728580096/vid/avc1/1080x1920/VtK0ct3qKl7MYMnv.mp4?tag=16
'1914418775174135917',My Know Your Rates Act will also require utility companies to directly notify customers if their energy usage rises above their monthly average — so they can adjust before it’s too late.,en,Reply,0,1,0,1,515,2025-04-21 21:39:38,"<a href=""https://mobile.twitter.com"" rel=""nofollow"">Twitter Web App</a>",,,,
'1914418773676662874',"Finally, I’m fighting to pass my legislation, the Energy Costs Relief Act, which provides a refundable tax credit of up to $350 to help offset rising energy costs and put money directly back into families’ pockets.",en,Reply,0,1,0,1,521,2025-04-21 21:39:38,"<a href=""https://mobile.twitter.com"" rel=""nofollow"">Twitter Web App</a>",,,,
'1914418771827286058',"I’m also calling on Health and Human Services @SecKennedy, who oversees LIHEAP, to immediately rehire LIHEAP staff and work with us to strengthen &amp; modernize the program.

Gutting LIHEAP staff isn’t about efficiency — it’s more chaos with zero strategy.",en,Reply,0,0,1,1,75,2025-04-21 21:39:38,"<a href=""https://mobile.twitter.com"" rel=""nofollow"">Twitter Web App</a>",,,,
'1914418770145124651',"I won’t let the Trump Administration stick it to children and seniors, which is why I’m introducing legislation to ensure LIHEAP is fully staffed and equipped to deliver the assistance families rely on — especially as energy costs rise.",en,Reply,0,0,0,1,62,2025-04-21 21:39:37,"<a href=""https://mobile.twitter.com"" rel=""nofollow"">Twitter Web App</a>",,,,
'1914418768517677460',"Third, I’m fighting back against the Trump Administration for slashing the Low-Income Home Energy Assistance Program, which is a critical lifeline for hundreds of thousands of Jersey families who rely on the program to keep the heat on in the winter &amp; the AC in the summer.",en,Reply,0,0,0,1,70,2025-04-21 21:39:37,"<a href=""https://mobile.twitter.com"" rel=""nofollow"">Twitter Web App</a>",,,,
'1914418766969966652',"Second, I’m calling on New Jersey’s utility companies to reverse their price increases and fighting back against the monopolies that are jacking up prices.

Jersey families just can’t afford higher prices now, especially with Trump’s tariffs wreaking havoc and gutting people’s retirement savings.",en,Reply,0,0,0,1,81,2025-04-21 21:39:36,"<a href=""https://mobile.twitter.com"" rel=""nofollow"">Twitter Web App</a>",,,,
'1914418765015736632',Jersey families shouldn’t have to pay the price of PJM’s jaw-dropping incompetence. I’m fighting to ensure they don’t have to.,en,Reply,0,0,0,1,60,2025-04-21 21:39:36,"<a href=""https://mobile.twitter.com"" rel=""nofollow"">Twitter Web App</a>",,,,
'1914418763338002616',"First, I'm joining state leaders in calling on the Federal Energy Regulatory Commission @FERC to immediately investigate PJM @pjminterconnect — our energy grid operator — for skyrocketing costs from overpaying at auction.",en,Reply,0,0,1,1,81,2025-04-21 21:39:36,"<a href=""https://mobile.twitter.com"" rel=""nofollow"">Twitter Web App</a>",,,,
'1914418760649466302',"There is a harsh reality coming to Jersey families on their summer utility bills: a 40% rate increase on their utility bills.

With Jersey families already getting crushed by higher costs, we must do everything we can to get utility bills down. We must make Jersey more affordable for families.⬇️",en,Tweet,0,1,0,4,702,2025-04-21 21:39:35,"<a href=""https://mobile.twitter.com"" rel=""nofollow"">Twitter Web App</a>",,,photo,https://pbs.twimg.com/media/GpFgmgvXoAAZQLW.jpg
'1914306074326282669',"Throughout his life, Pope Francis consistently reminded us of the importance of kindness and empathy — values that go beyond faith, country, or politics.

My full statement on his passing ⬇️ https://t.co/5las4H5pyV",en,Tweet,0,5,1,3,705,2025-04-21 14:11:48,"<a href=""http://www.oneupapp.io"" rel=""nofollow"">OneUp App</a>",,,photo,https://pbs.twimg.com/media/GpD7OtRXoAABdzS.jpg
'1914279698525200539',"Trump’s reckless auto tariffs are about to whack Jersey families with higher costs on everything from cars to repairs to insurance.

These price hikes will hit everyone on the road — raising prices, threatening jobs, and creating more uncertainty.

I’m fighting to stop this chaos.
https://t.co/abSpFCOUrf",en,Tweet,0,9,1,8,1125,2025-04-21 12:27:00,"<a href=""http://twitter.com"" rel=""nofollow"">Twitter Web Client</a>",,,,
'1914139400989983228',"Pete Hegseth’s reckless actions are directly endangering the lives of our brave service members.

As I said before, and as a member of the House Intelligence Committee, he should be fired and replaced by someone who can properly protect America’s sensitive information.",en,Tweet,0,12,2,9,2001,2025-04-21 03:09:30,"<a href=""https://mobile.twitter.com"" rel=""nofollow"">Twitter Web App</a>",,,,
'1914055722574229972',"DeepSeek poses a serious threat to our national security. That’s why @RepLahood and I introduced bipartisan legislation to ban it from all federal devices — and we wrote to governors across the country to ensure they understand the danger it poses.

I’m encouraged to see more governors now taking action to ban DeepSeek.",en,Tweet,1,0,0,2,1141,2025-04-20 21:37:00,"<a href=""http://twitter.com"" rel=""nofollow"">Twitter Web Client</a>",,,,
'1914028040746852853',"Last week, I met with the National Beer Wholesalers Association to discuss how we can support Jersey’s small businesses.

President Trump’s tariffs are only whacking our hardworking business owners with higher costs. I’ll keep fighting to ensure Jersey businesses can grow and thrive.",en,Tweet,0,4,0,8,829,2025-04-20 19:47:00,"<a href=""http://twitter.com"" rel=""nofollow"">Twitter Web Client</a>",,,photo,https://pbs.twimg.com/media/Go2FG0TW4AA_IRM.jpg
'1913936219051901275',"To everyone celebrating in New Jersey and around the world today, Happy Easter! 🐇 https://t.co/MTdVHtOIPI",en,Tweet,0,5,1,5,713,2025-04-20 13:42:08,"<a href=""http://www.oneupapp.io"" rel=""nofollow"">OneUp App</a>",,,photo,https://pbs.twimg.com/media/Go-q2UuWMAAUrlF.jpg
'1913693586123809227',"AmeriCorps volunteers were on the ground in Jersey after Hurricane Sandy, and they’ve helped families across the country recover after disasters.

DOGE’s chaotic cuts to this critical program could leave families stranded in their time of need.
https://t.co/mcl0n0BdKH",en,Tweet,2,11,2,4,955,2025-04-19 21:38:00,"<a href=""https://mobile.twitter.com"" rel=""nofollow"">Twitter Web App</a>",,https://apnews.com/article/americorps-volunteers-fema-doge-05b1d1cd53e0b5b9f64c17eaba7adf95,,
'1913641493056962929',"With the 2026 World Cup headed to Jersey, I’m ramping up efforts to keep our families and communities safe while they enjoy the matches. That’s why I’m calling on @FBI & @DHSgov to ensure the matches at MetLife Stadium are properly secure.

This is a national event, and it requires a national response.
https://t.co/bvP3hPml5L",en,Tweet,1,5,1,2,921,2025-04-19 18:11:00,"<a href=""http://twitter.com"" rel=""nofollow"">Twitter Web Client</a>",,,,
'1913597704749678694',"I’m proudly leading bipartisan legislation to strengthen our strategic security partnerships with Israel, Greece, and Cyprus. 🇺🇸🇮🇱🇬🇷🇨🇾

This legislation continues the fight to combat terrorism, bolster security in the Eastern Mediterranean, and hold bad actors accountable for their continued aggression.",en,Tweet,4,177,27,25,22081,2025-04-19 15:17:00,"<a href=""http://twitter.com"" rel=""nofollow"">Twitter Web Client</a>",,,,
'1913368444092764277',"Liz Hirsh Naftali and I are fighting to bring Edan Alexander — an all-American kid from Jersey, and the last living American held hostage by Hamas terrorists — home.

We must keep the pressure on and ensure every hostage remains front and center, every single day. @capitolcoffpod",en,Tweet,2,13,1,3,1365,2025-04-19 00:06:00,"<a href=""http://twitter.com"" rel=""nofollow"">Twitter Web Client</a>",,,,
'1913343278008897911',"Tens of thousands of families in NJ-5 rely on Medicaid for affordable, quality health care — but proposed cuts by far-right extremists are putting them all at risk.

I’ll fight tooth and nail to ensure our most vulnerable can access the critical health care benefits they need & deserve.",en,Tweet,0,2,2,2,551,2025-04-18 22:26:00,"<a href=""http://twitter.com"" rel=""nofollow"">Twitter Web Client</a>",,,video,https://video.twimg.com/amplify_video/1913299648409669632/vid/avc1/1080x1080/me72Xt1ZNrVPJaoa.mp4?tag=16
'1913313721184559217',"Trump’s tariffs will kneecap Jersey families.

This week, @federalreserve Chair Jerome Powell confirmed tariffs will fuel “higher inflation and slower growth.”

This is pure economic chaos.
https://t.co/TRVM3fqzxg",en,Tweet,0,5,1,10,1091,2025-04-18 20:28:33,"<a href=""https://mobile.twitter.com"" rel=""nofollow"">Twitter Web App</a>",,https://abcnews.go.com/Business/fed-chair-powell-sounds-alarm-tariffs-sending-stocks/story?id=120863770,,
'1913295517796487388',"Glad to see the House Select Committee on China @CommitteeonCCP confirm what I’ve been warning: the Chinese Communist Party is using DeepSeek to spy on Americans and spread disinformation. It’s a five alarm national security fire.

I’m leading the charge to protect our national security with bipartisan legislation to ban DeepSeek from all U.S. government devices.",en,Tweet,1,1,0,3,1257,2025-04-18 19:16:13,"<a href=""https://mobile.twitter.com"" rel=""nofollow"">Twitter Web App</a>",,,,
'1913243820860338649',"Small businesses and hardworking families will be crushed by reckless tariffs. 

That’s why I introduced the Trade Review Act to ensure no president can abuse “national emergency” powers to whack us with tariffs without any approval from Congress.
https://t.co/1nvR16yadw",en,Tweet,0,3,2,2,541,2025-04-18 15:50:47,"<a href=""http://www.oneupapp.io"" rel=""nofollow"">OneUp App</a>",,https://www.cnbc.com/2025/04/14/us-businesses-sue-to-block-trump-tariffs-say-trade-deficits-are-not-an-emergency.html,,
'1913034100576772117',I’m sickened by the shooting today in Florida. I’m praying for the families who lost loved ones and for a speedy recovery of those injured.,en,Tweet,0,3,0,3,803,2025-04-18 01:57:26,"<a href=""http://www.oneupapp.io"" rel=""nofollow"">OneUp App</a>",,,,
'1912962015959622100',"I’m thrilled to see champion and trailblazer Billie Jean King honored with a star on the Hollywood Walk of Fame! ⭐

As the first woman recognized with this honor in sports entertainment, she is paving the way for so many. Our shared fight to protect Title IX will ensure she’s not the last.",en,Tweet,1,1,1,2,1145,2025-04-17 21:11:00,"<a href=""http://twitter.com"" rel=""nofollow"">Twitter Web Client</a>",,,photo,https://pbs.twimg.com/media/GowNNU6XEAAFGTE.jpg
'1912938863594463665',"Electric bills in Jersey will rise by 20% starting in June, with even more hikes expected next year — squeezing hardworking families’ and seniors’ pocketbooks heading into the summer months.

I’m fighting to lower utility costs with my Energy Costs Relief Act — giving families a $350 tax credit to help cover rising utility bills.",en,Tweet,0,1,1,4,1285,2025-04-17 19:39:00,"<a href=""http://twitter.com"" rel=""nofollow"">Twitter Web Client</a>",,,,
'1912905418168238342',"I’m glad to see @Amtrak making upgrades to NJ Transit’s busiest rail lines as they work to avoid another “Summer of Hell.”

I’ll keep fighting to pass my All Aboard Act to protect Jersey commuters and ensure passengers get refunds for delayed trains.
https://t.co/pODSYP4rvY",en,Tweet,0,2,0,2,521,2025-04-17 17:26:06,"<a href=""http://www.oneupapp.io"" rel=""nofollow"">OneUp App</a>",,https://www.northjersey.com/story/news/transportation/2025/04/15/amtrak-starts-repairs-reduce-delays-nj-transit-riders-2025/83101755007/,,
'1912885976013156647',"Every year, high school student artists from across NJ-5 submit their incredible pieces of artwork to the Congressional Art Competition. 🎨🖼🖌
 
Cast your vote here to decide which work will represent New Jersey’s 5th District in the halls of Congress!
https://t.co/0xuX3IT0Ge",en,Tweet,0,2,0,1,505,2025-04-17 16:08:51,"<a href=""http://www.oneupapp.io"" rel=""nofollow"">OneUp App</a>",,https://forms.gle/mEQR4x7itJUV57g46,,
'1912636873417121907',"From the front page of today’s @NJHerald: Trump’s tariffs “would affect every aspect of New Jersey’s supply chain industry.”

This chaos whacks Jersey’s businesses, families, and communities with higher prices and more uncertainty. It’s crushing our economy.

We need common-sense strategies, not knee-jerk decisions that kneecap our businesses and workers.",en,Tweet,0,5,3,4,839,2025-04-16 23:39:00,"<a href=""http://twitter.com"" rel=""nofollow"">Twitter Web Client</a>",,,photo,https://pbs.twimg.com/media/GorvFeNXUAArGsS.jpg
'1912568377832255685',"Nearly a third of Jersey seniors rely on Social Security to get by each month. Now, far-right extremists are trying to gut these hard-earned benefits.

I'm fighting back:
✔️Helping lead the Keeping Our Field Offices Open Act
✔️Protecting seniors' data from Elon Musk's DOGE cronies
✔️Defending seniors’ earned benefits",en,Tweet,0,9,5,7,1215,2025-04-16 19:06:49,"<a href=""https://mobile.twitter.com"" rel=""nofollow"">Twitter Web App</a>",,,,
'1912541890504778039',"New reporting makes clear: The arson attack targeting Governor Shapiro was an act of antisemitic violence, plain and simple.

At a time when antisemitism is rampant across our country, we must fight this vile hatred and hold antisemites accountable.",en,Tweet,6,660,123,55,29453,2025-04-16 17:21:34,"<a href=""https://mobile.twitter.com"" rel=""nofollow"">Twitter Web App</a>",,,,
'1912531268606083310',"President Trump’s tariffs are kneecapping hardworking Jersey farmers, creating chaos and cutting off access to key markets.

Our farmers deserve a strategy — not reckless policies that put their livelihoods at risk.
https://t.co/xoE0qbCJyu",en,Tweet,0,5,1,3,570,2025-04-16 16:39:22,"<a href=""http://www.oneupapp.io"" rel=""nofollow"">OneUp App</a>",,https://www.washingtonpost.com/politics/2025/04/14/north-carolina-farmers-trump-tariffs-us-exports/,,
'1912210968454521059',"For more than 550 days, Tenafly, NJ native Edan Alexander has been suffering at the hands of Hamas, a terrorist organization that shamelessly uses innocent people as human shields.

We will not rest until Hamas is crushed and all of the hostages, including the five Americans, are safely reunited with their loved ones.",en,Tweet,1,196,33,35,12599,2025-04-15 19:26:36,"<a href=""https://mobile.twitter.com"" rel=""nofollow"">Twitter Web App</a>",,,,
'1912179442379559164',"Jersey families are feeling crushed by the economy than at nearly any other time in American history.

Trump’s tariffs have tanked our economy and skyrocketed costs for hardworking families. We must restore consumer confidence, and lower costs of everyday goods, and make life more affordable.",en,Tweet,0,3,1,6,1251,2025-04-15 17:21:20,"<a href=""https://mobile.twitter.com"" rel=""nofollow"">Twitter Web App</a>",,,,
'1911923925392511300',"In 2020, a violent extremist showed up at Judge Salas’ home dressed as a FedEx delivery man and heartbreakingly shot and killed her only child, Daniel. Now, her late son’s name is being used to intimidate other judges — it’s disgusting.

Our judges and their families deserve to feel safe, and we must stand firm in defending the rule of law and those who uphold it.",en,Tweet,0,17,8,7,2278,2025-04-15 00:26:00,"<a href=""http://twitter.com"" rel=""nofollow"">Twitter Web Client</a>",,,,
'1911889910841106899',"Today, I was proud to celebrate the first anniversary of @valleyhealthnj’s expansion into Paramus — strengthening medical care across North Jersey.

I’ll keep fighting to advance medical research, support our incredible health care workers, and ensure our families stay healthy and safe.",en,Tweet,0,4,2,1,746,2025-04-14 22:10:50,"<a href=""https://mobile.twitter.com"" rel=""nofollow"">Twitter Web App</a>",,,photo,"https://pbs.twimg.com/media/GohlpLgWsAAo-eF.jpg,https://pbs.twimg.com/media/GohlqPLWsAAnjEM.jpg"
'1911870751973450090',"President Trump’s sweeping tariffs are crushing our economy and the pocketbooks of hardworking middle-class families with a $3,800 a year tax.

Tariffs don’t make our country stronger — they only raise costs across the board.
https://t.co/5rrP5i807C",en,Tweet,0,6,1,4,719,2025-04-14 20:54:42,"<a href=""http://www.oneupapp.io"" rel=""nofollow"">OneUp App</a>",,https://www.njspotlightnews.org/2025/04/small-bipartisan-effort-in-house-of-representatives-to-thwart-president-trumps-tariffs/,,
'1911749526680912120',"We must fund — not defund — local law enforcement to keep them and our communities safe.

I’m proud to be introducing my bipartisan, bicameral Invest to Protect Act to get the backs of our law enforcement and to make critical, targeted investments in local police departments.
https://t.co/oEc2kV7lDz",en,Tweet,1,2,1,21,754,2025-04-14 12:53:00,"<a href=""http://twitter.com"" rel=""nofollow"">Twitter Web Client</a>",,,,
'1911518286728314891',"I’m relieved that @GovernorShapiro and his family are safe after an arson attack at the Governor’s residence on the first night of Passover. 

At a time when antisemitism is at record levels, the perpetrator must be held accountable and prosecuted to the fullest extent of the law.

Grateful to the brave first responders whose swift actions ensured the Governor and his family’s safety.",en,Tweet,3,277,22,78,8961,2025-04-13 21:34:08,"<a href=""http://twitter.com/download/iphone"" rel=""nofollow"">Twitter for iPhone</a>",,,,
'1911502174124724682',"This week, I met with the National Council of Jewish Women to discuss reproductive freedom and the impact of antisemitism on women.

I’m proud to stand with @NCJW to protect the rights of women and families. https://t.co/veDIgfgh8K",en,Tweet,0,5,3,26,963,2025-04-13 20:30:06,"<a href=""http://www.oneupapp.io"" rel=""nofollow"">OneUp App</a>",,,photo,https://pbs.twimg.com/media/GocFGP0WQAA5I1G.jpg
'1911457385635361156',"The personal information of millions of Jersey drivers is stored by E-ZPass, which will now be operated by a China-linked company.

I won’t allow China to steal hardworking Jersey families’ data.
https://t.co/mwJqKmQqsc",en,Tweet,1,0,0,21,695,2025-04-13 17:32:08,"<a href=""http://www.oneupapp.io"" rel=""nofollow"">OneUp App</a>",,https://nj1015.com/nj-turnpikes-1-7b-china-linked-deal-draws-more-questions/,,
'1911420106099576902',"Last week, I voted against the far-right budget resolution —  a direct assault on Jersey seniors.

It paves the way for cuts to brutal programs like Medicare and Medicaid that millions rely on, including more than 50% of Jersey seniors in nursing homes who depend on Medicaid for their care.",en,Tweet,0,4,0,20,820,2025-04-13 15:04:00,"<a href=""http://twitter.com"" rel=""nofollow"">Twitter Web Client</a>",,,,
