tweet_id,text,language,type,bookmark_count,favorite_count,retweet_count,reply_count,view_count,created_at,client,hashtags,urls,media_type,media_urls
'1942249730555392070',"Watch my full interview with Morning Joe. 

Let’s get something done in Congress on immigration! https://t.co/2gDenKeDXW",en,Tweet,5,47,19,17,6657,2025-07-07 16:49:55,"<a href=""http://twitter.com/download/iphone"" rel=""nofollow"">Twitter for iPhone</a>",,,video,https://video.twimg.com/amplify_video/1942249297111650304/vid/avc1/1280x720/YPWxu8UfivDnF1cV.mp4?tag=21
'1942199418448707803',"Good morning! Coming up at around 9:20, I will be live on MSNBC’s Morning Joe. Please tune in. https://t.co/0QIx1B0a19",en,Tweet,0,8,0,10,1333,2025-07-07 13:30:00,"<a href=""https://mobile.twitter.com"" rel=""nofollow"">Twitter Web App</a>",,,photo,https://pbs.twimg.com/media/GvOcPLiXgAAfVpC.jpg
'1941926433632272388',"Watch my full interview on Face the Nation.

Cutting Medicaid and food assistance programs for Americans most in need is unacceptable, especially when at the same time we’re cutting taxes for the wealthiest Americans and blowing up the deficit. The math just doesn’t add up. https://t.co/8c7jw8OYfd",en,Tweet,21,405,142,30,39056,2025-07-06 19:25:15,"<a href=""http://twitter.com/download/iphone"" rel=""nofollow"">Twitter for iPhone</a>",,,video,https://video.twimg.com/amplify_video/1941926322583851008/vid/avc1/1280x720/zXq2R59sO9gY5nOU.mp4?tag=21
'1941859686791442826',"Coming up at around 10:45, I will be live on CBS News’ “Face the Nation.” Please tune in! https://t.co/kK8BfzzHMH",en,Tweet,0,8,0,10,1102,2025-07-06 15:00:01,"<a href=""https://mobile.twitter.com"" rel=""nofollow"">Twitter Web App</a>",,,photo,https://pbs.twimg.com/media/GvLD-SvWMAEL-67.jpg
'1941104712738316791',"Happy 4th of July!🇺🇸

Our nation was founded on a simple principle: that we are all created equal. Today, let us reflect on how far we have come and rededicate ourselves to our nation’s founding principles, ensuring that all men and women are treated equally.

Please have a safe and happy Fourth of July. 🙏🏼🇺🇸",en,Tweet,2,47,4,6,1989,2025-07-04 13:00:02,"<a href=""http://twitter.com"" rel=""nofollow"">Twitter Web Client</a>",,,photo,https://pbs.twimg.com/media/Gu9YfHaXEAAzhp7.jpg
'1940849050426737017',"The “Big Ugly” has now passed despite members from both parties opposing it. I voted no for three important reasons:

1. It gives unnecessary tax breaks to the wealthiest Americans.
2. It slashes health insurance and food benefits to some of the neediest Americans.
3. It explodes the deficit to the record largest amount in our nation’s history.

Most Americans, regardless of their politics, still believe in a simple, fair concept: that if you work hard, you should be able to afford to buy a house, put food on the table, educate your kids, have health insurance, and retire one day without being scared.

This bill moves us in the opposite direction, making life more expensive, more uncertain, and further out of reach for middle-class families and those aspiring to the middle class.",en,Tweet,0,19,9,9,2517,2025-07-03 20:04:07,"<a href=""http://twitter.com/download/iphone"" rel=""nofollow"">Twitter for iPhone</a>",,,,
'1940745011035099182',"My good friend and colleague Hakeem Jeffries has been holding the floor in the House all night to bring the impacts of this bill out from darkness and into the light. The American people deserve to know what the so called big, beautiful bill really does. https://t.co/JTOlPpJBua",en,Tweet,23,1079,348,228,114935,2025-07-03 13:10:42,"<a href=""http://twitter.com/download/iphone"" rel=""nofollow"">Twitter for iPhone</a>",,,video,https://video.twimg.com/amplify_video/1940744939953848320/vid/avc1/720x1280/S_1DMWyB5K_votmk.mp4?tag=21
'1940559712766120317',"“Democrats can embrace the need to address the people’s angst about the economy and affordability without embracing the socialism of Mr. Mamdani or the extremism of Mr. Trump.”

https://t.co/JKvugRceqk https://t.co/FiYtTbBl8C",en,Tweet,1,36,10,33,12229,2025-07-03 00:54:24,"<a href=""http://twitter.com/download/iphone"" rel=""nofollow"">Twitter for iPhone</a>",,https://www.wsj.com/opinion/for-democrats-mamdani-is-a-wake-up-call-and-a-bad-example-7e43189c?st=8rDDQk&reflink=desktopwebshare_permalink,photo,https://pbs.twimg.com/media/Gu5AxgBXYAAFNax.jpg
'1940520233288323112',"“Mr. Mamdani didn’t win because of socialism—he won because too many voters think the rest of the Democratic Party no longer stands for them. That’s the warning from New York, and Democrats ignore it at their peril.”

https://t.co/JKvugRceqk https://t.co/Z2D3kYN5xc",en,Tweet,9,150,36,49,11204,2025-07-02 22:17:31,"<a href=""http://twitter.com/download/iphone"" rel=""nofollow"">Twitter for iPhone</a>",,https://www.wsj.com/opinion/for-democrats-mamdani-is-a-wake-up-call-and-a-bad-example-7e43189c?st=8rDDQk&reflink=desktopwebshare_permalink,photo,https://pbs.twimg.com/media/Gu4c3VoWAAAyBVj.jpg
'1940467670471876728',"To read the full op-ed:
https://t.co/JKvugRceqk",en,Reply,3,23,7,4,3186,2025-07-02 18:48:39,"<a href=""http://twitter.com/download/iphone"" rel=""nofollow"">Twitter for iPhone</a>",,https://www.wsj.com/opinion/for-democrats-mamdani-is-a-wake-up-call-and-a-bad-example-7e43189c?st=8rDDQk&reflink=desktopwebshare_permalink,,
'1940467543241838779',The Wall Street Journal just posted my op-ed on Zohran Mamdani’s victory in New York City’s Democratic Mayoral primary.  To read more ⬇️ https://t.co/M4Gs2K11VI,en,Tweet,20,100,37,51,35086,2025-07-02 18:48:09,"<a href=""http://twitter.com/download/iphone"" rel=""nofollow"">Twitter for iPhone</a>",,,video,https://video.twimg.com/amplify_video/1940467484601032704/vid/avc1/688x960/doJ0gyNxRh0-P10m.mp4?tag=21
'1940379482172621012',"I’m heading to Washington today to vote NO on a budget that unnecessarily provides tax breaks to the wealthiest Americans, and cuts much-needed healthcare and food programs while blowing the largest hole in the deficit in American history. https://t.co/3cZPB0v9JD",en,Tweet,10,471,117,77,21738,2025-07-02 12:58:13,"<a href=""http://twitter.com/download/iphone"" rel=""nofollow"">Twitter for iPhone</a>",,,video,https://video.twimg.com/amplify_video/1940378944873590784/vid/avc1/720x1280/sBS8rguetaUIsHQ-.mp4?tag=21
'1939835271337381924',"This can’t be real! Is it? 

He must just be trying to distract us from the awful bill which unnecessarily gives a tax break to the wealthiest Americans while cutting healthcare and food for some of the most needy, all while exploding the largest deficit in the history of America.

Bizarre.",en,Tweet,19,613,153,98,90929,2025-07-01 00:55:43,"<a href=""http://twitter.com/download/iphone"" rel=""nofollow"">Twitter for iPhone</a>",,,,
'1938654960628957576',"I disagree with Zohran Mamdani on many issues, but Congressman Ogles’ Islamophobic, anti-immigrant, hateful tweet is unacceptable! Hate has no place here.",en,Tweet,4,167,24,27,11737,2025-06-27 18:45:35,"<a href=""http://twitter.com/download/iphone"" rel=""nofollow"">Twitter for iPhone</a>",,,,
'1938643518844699097',"Funny how it’s ‘class warfare’ when middle-class taxpayers  ask for fairness -not being taxed twice- but just ‘good policy’ when millionaires billionaires get huge tax cuts, while incurring huge deficits.",en,Reply,0,32,8,5,1130,2025-06-27 18:00:07,"<a href=""http://twitter.com/download/iphone"" rel=""nofollow"">Twitter for iPhone</a>",,,,
'1938643456022454586',"The GOP capped SALT, then handed the savings to the ultra-wealthy. Real man of the people, Chip.",en,Reply,0,29,6,1,1127,2025-06-27 17:59:52,"<a href=""http://twitter.com/download/iphone"" rel=""nofollow"">Twitter for iPhone</a>",,,,
'1938643397872333279',"Teachers, nurses, carpenters, and cops aren’t ‘rich Yankees’ — they’re just getting federal income taxes charged on the State and Local Taxes they have already paid. https://t.co/vsyR75KTk7",en,Tweet,12,246,90,26,34319,2025-06-27 17:59:38,"<a href=""http://twitter.com/download/iphone"" rel=""nofollow"">Twitter for iPhone</a>",,,photo,https://pbs.twimg.com/media/Gudx5YAXoAAUc1W.jpg
'1938608288972607524',We all know Tik Tok is in the pocket of the Chinese Communist Party. The House and Senate passed overwhelmingly bipartisan legislation to ban it. President Trump needs to stop delaying and enforce the ban. https://t.co/RxNGoYrjsE,en,Tweet,10,121,40,21,10134,2025-06-27 15:40:08,"<a href=""http://twitter.com/download/iphone"" rel=""nofollow"">Twitter for iPhone</a>",,,video,https://video.twimg.com/amplify_video/1938608197478084608/vid/avc1/720x1280/2LraXtbwSpZglUt-.mp4?tag=21
'1938351947591123321',"Northeast Queens is a 'transit desert!

After years of advocating for a solution, the first phase of the Queens’ bus network redesign has been launched!!

This is a transformative step forward, that will provide our Northeast Queens residents with faster, more reliable service and better connections. Let’s Go!",en,Tweet,1,14,1,7,1538,2025-06-26 22:41:31,"<a href=""http://twitter.com/download/iphone"" rel=""nofollow"">Twitter for iPhone</a>",,,photo,"https://pbs.twimg.com/media/GuZo0l2WkAAIT1h.jpg,https://pbs.twimg.com/media/GuZo0lyWAAAnW--.jpg,https://pbs.twimg.com/media/GuZo0l6WgAAij8u.jpg"
'1938277278061936953',"Rest in peace, good and faithful servant.

Congresswoman Carolyn McCarthy was one of our nation’s great champions in the fight against gun violence.

In 1993, Carolyn’s husband, Dennis, was murdered, and her son was seriously wounded by the LIRR gunman who opened fire on a crowded Long Island Railroad car.

Carolyn channeled her grief and loss into advocacy for change, becoming one of the most dedicated gun violence prevention advocates.

I first met Carolyn in early 1994, when I was the young mayor of Glen Cove, and her son, Kevin, was undergoing rehabilitation at Glen Cove Hospital. I followed her closely from her entry into politics and throughout her years in office. Our nation and our Island have lost a fierce champion.
 
https://t.co/RadwR9yrKY",en,Tweet,3,168,40,13,12000,2025-06-26 17:44:49,"<a href=""http://twitter.com/download/iphone"" rel=""nofollow"">Twitter for iPhone</a>",,,photo,https://pbs.twimg.com/media/GuYk6UvWoAETyoB.jpg
'1938220705587343634',"Mobile Office Hours! 

My staff is here to help with everything from obtaining a passport to Social Security and VA benefits and Service Academy nominations.

Come meet with my staff today, June 26 from 1 - 5 pm at the Queens Library at Bellerose, 250-06 Hillside Avenue, Bellerose.",en,Tweet,0,3,0,3,911,2025-06-26 14:00:01,"<a href=""http://twitter.com"" rel=""nofollow"">Twitter Web Client</a>",,,photo,https://pbs.twimg.com/media/GuV929iXAAAKs2g.jpg
'1936786251962871855',"On this day in 1944, President Franklin D. Roosevelt took a monumental step by signing the Servicemen’s Readjustment Act of 1944, more commonly known as the G.I. Bill, into law.

My father, my hero, and an astounding 8 million World War II veterans like him reaped the benefits of this transformative legislation.

Today the GI Bill has empowered 29 million veterans.

This legacy showcases the incredible impact we can have when we unite for a common cause. Together, we can achieve remarkable things!",en,Tweet,0,16,2,9,2080,2025-06-22 15:00:00,"<a href=""http://twitter.com"" rel=""nofollow"">Twitter Web Client</a>",,,photo,https://pbs.twimg.com/media/GuA0cSrWIAAsnVR.jpg
'1936616964224606365',"Iran is a terrorist nation, and we must do everything we can to stop it from acquiring a nuclear weapon.

Debates will now ensue about presidential authority and the President working with Congress. The President should work with Congress, especially those of us who recognize how important it is  to finally stop Iran. 

Following today’s attacks on military nuclear sites, let us pray for a path to peace. 🙏",en,Tweet,12,305,42,38,24963,2025-06-22 03:47:19,"<a href=""http://twitter.com/download/iphone"" rel=""nofollow"">Twitter for iPhone</a>",,,,
'1936146841894072659',https://t.co/WR3H82SK3P,zxx,Reply,0,3,0,0,1079,2025-06-20 20:39:13,"<a href=""http://twitter.com/download/iphone"" rel=""nofollow"">Twitter for iPhone</a>",,,photo,"https://pbs.twimg.com/media/Gt6TSo3WsAAhIVq.jpg,https://pbs.twimg.com/media/Gt6TSo6WkAAnStI.jpg,https://pbs.twimg.com/media/Gt6TSo3XYAAD2JC.jpg"
'1936146747509612585',"Earlier today, I joined a bipartisan group of elected officials and stakeholders from both sides of Long Island Sound to celebrate 40 years of progress in restoring and protecting this vital resource. Together, we endorsed a 10-year plan aimed at revitalizing the Sound as an essential ecological, economic, and recreational treasure.

Throughout my 30-plus years in public service, I have committed myself to cleaning up pollution in and around Long Island Sound. This has included reducing nitrogen emissions from sewage treatment plants, addressing stormwater runoff, and restoring and reseeding shellfishing beds in our harbors. Since I came to Congress in 2017, I have secured a 1,000% increase in funding to enhance the Long Island Sound.

Protecting and preserving Long Island Sound—our “National Park”—is a top priority and a shared responsibility. I am thankful for the bipartisan and collaborative efforts of many individuals, and I am encouraged by the EPA's commitment to revitalizing the Sound for future generations.",en,Tweet,0,43,10,8,6386,2025-06-20 20:38:51,"<a href=""http://twitter.com/download/iphone"" rel=""nofollow"">Twitter for iPhone</a>",,,photo,"https://pbs.twimg.com/media/Gt6TM9vW4AAosLG.jpg,https://pbs.twimg.com/media/Gt6TM9pWkAALI9N.jpg,https://pbs.twimg.com/media/Gt6TM9gXoAAct-r.jpg,https://pbs.twimg.com/media/Gt6TM9hXkAAqK6s.jpg"
'1935862514924851471',"Watch my full interview with Chris Cuomo. 

Now’s the time. Democrats and Republicans need to move past trying to appease their own political bases and get something done on immigration. Let’s go. https://t.co/XnnzBBgvpY",en,Tweet,8,58,15,16,9245,2025-06-20 01:49:24,"<a href=""http://twitter.com/download/iphone"" rel=""nofollow"">Twitter for iPhone</a>",,,video,https://video.twimg.com/amplify_video/1935862270984167424/vid/avc1/1280x720/yyaioZ-gnkHUyBIV.mp4?tag=21
'1935845048202973693',"Coming up at around 8:15, I’ll be joining Chris Cuomo live on @NewsNation -  Tune in! https://t.co/tNIEncRZ0o",en,Tweet,1,2,0,3,1269,2025-06-20 00:40:00,"<a href=""https://mobile.twitter.com"" rel=""nofollow"">Twitter Web App</a>",,,photo,https://pbs.twimg.com/media/Gt16tLyWQAAfpGV.jpg
'1935683997562269809',"The struggle for justice has been long but cannot be denied.

On June 19, 1865, a Union General arrived in Galveston, Texas, and issued an order officially freeing all enslaved people in the state. This was more than two and a half years after President Abraham Lincoln issued the Emancipation Proclamation.

Today, as we commemorate Juneteenth, now in its fifth year as a federal holiday, let us renew our commitment to working together on meaningful reforms to build a society that is truly equitable, fair, and just.",en,Tweet,0,15,1,1,1614,2025-06-19 14:00:02,"<a href=""http://twitter.com"" rel=""nofollow"">Twitter Web Client</a>",,,photo,https://pbs.twimg.com/media/GtxSULlWcAATdfb.jpg
'1935392093226033251',"Today, I hosted a send-off reception for students who will be attending our nation's service academies: the United States Military Academy, the United States Naval Academy, the United States Air Force Academy, and the United States Merchant Marine Academy.

These students are deserving, hardworking, and committed individuals who will serve our country with pride.  I wish them the very best, and offer my heartfelt gratitude for their service.

If you are considering a path to a service academy, please reach out to my office for more information. Your journey to serve begins here!

https://t.co/K6E1dp7jyt",en,Tweet,1,7,0,5,1094,2025-06-18 18:40:07,"<a href=""http://twitter.com/download/iphone"" rel=""nofollow"">Twitter for iPhone</a>",,,photo,"https://pbs.twimg.com/media/Gtvk2THWsAAQ5dl.jpg,https://pbs.twimg.com/media/Gtvk2S8WEAAVfUZ.jpg,https://pbs.twimg.com/media/Gtvk2S9XwAAJVFj.jpg"
'1935053568286896190',"Couldn’t agree more.

https://t.co/OdTB7EQpzL https://t.co/Q7bwQ0F7pv",en,Tweet,18,192,51,36,19779,2025-06-17 20:14:56,"<a href=""http://twitter.com/download/iphone"" rel=""nofollow"">Twitter for iPhone</a>",,https://open.substack.com/pub/demwinsmedia/p/tom-suozzi-a-new-kind-of-old-fashioned?r=ac9ay&utm_medium=ios,photo,https://pbs.twimg.com/media/Gtqw8tAWYAAIhdo.jpg
'1935033914046742753',"Immigration is a hot-button topic for Catholics. I’ve got a three-step bipartisan legislative solution I’m working to enact. 

Secure the border. 
Fix the broken asylum system. 
Protect our dreamers, TPS recipients, and economic contributors. 

Let’s get it done. https://t.co/j9JRBbARuE",en,Tweet,6,138,46,29,60674,2025-06-17 18:56:50,"<a href=""http://twitter.com/download/iphone"" rel=""nofollow"">Twitter for iPhone</a>",,,video,https://video.twimg.com/amplify_video/1935033421392191488/vid/avc1/568x320/5KRL2Vpc0t__3bup.mp4?tag=21
'1934995107322954071',"It’s not worth doing these jobs just to win. We have to work hard, make compromises, and get things done to make the lives of the American people better. https://t.co/CoS7vUGUPV",en,Tweet,4,79,21,17,16013,2025-06-17 16:22:38,"<a href=""http://twitter.com/download/iphone"" rel=""nofollow"">Twitter for iPhone</a>",,,video,https://video.twimg.com/amplify_video/1934995013173121024/vid/avc1/1280x720/2I9IpF3nTeysv3ny.mp4?tag=21
'1934957919189319978',"The American people are hungering for leaders who want to solve problems and make their lives better. It’s time for Congress to come together, work in a bipartisan fashion, to solve our most challenging problems. https://t.co/czkV5SoQtd",en,Tweet,2,134,36,14,7014,2025-06-17 13:54:52,"<a href=""http://twitter.com/download/iphone"" rel=""nofollow"">Twitter for iPhone</a>",,,video,https://video.twimg.com/amplify_video/1934957842261266432/vid/avc1/1280x720/OiY4RPERF1VpQlJn.mp4?tag=21
'1934649162131476793',"If we keep doing punch, counterpunch, an eye for an eye…we’ll all end up blind. As the Co-Chair of the Problem Solvers Caucus, I am pushing against blatant partisanship in favor of working together to solve America’s most challenging problems. https://t.co/xS2IbQHJOh",en,Tweet,2,35,10,17,5197,2025-06-16 17:27:58,"<a href=""http://twitter.com/download/iphone"" rel=""nofollow"">Twitter for iPhone</a>",,,video,https://video.twimg.com/amplify_video/1934649070913540101/vid/avc1/1280x720/HSnG1hjjgSvOczKV.mp4?tag=21
'1934601462358610335',"America was built on two great systems: capitalism and democracy. We need to find a balance between the two to ensure our economy grows, hard work is rewarded, and we enhance people’s quality of life. https://t.co/gekoqqrpRH",en,Tweet,4,153,36,23,14312,2025-06-16 14:18:26,"<a href=""http://twitter.com/download/iphone"" rel=""nofollow"">Twitter for iPhone</a>",,,video,https://video.twimg.com/amplify_video/1934601354615390209/vid/avc1/960x540/Vgb8o7jQWsSnhh55.mp4?tag=21
'1934219346559287406',"Happy Father’s Day!
I am so grateful for the gift of my father. He was the best man at our wedding and the best man I ever knew. 

To all fathers–whether soon-to-be, new, seasoned, grand, great-grand, in-law, step, foster, bereaved, heavenly, father-at-heart, or a combination thereof—Happy Father's Day!",en,Tweet,0,20,0,0,1225,2025-06-15 13:00:02,"<a href=""http://twitter.com"" rel=""nofollow"">Twitter Web Client</a>",,,photo,https://pbs.twimg.com/media/Gtbi3J5WAAAcZKK.jpg
'1933958290079350967',"The American dream can be summed up simply: Whether you’re a right wing conservative or a left wing liberal, everyone in America should believe, if you work hard, you should be able to buy a home, educate your children, pay for health insurance, and retire without being scared. https://t.co/vrkhCYVVF1",en,Tweet,13,321,65,40,13376,2025-06-14 19:42:42,"<a href=""http://twitter.com/download/iphone"" rel=""nofollow"">Twitter for iPhone</a>",,,video,https://video.twimg.com/amplify_video/1933958225289678848/vid/avc1/1280x720/Rut2byTfii6KTCp1.mp4?tag=21
'1933907248792711202',"On this day in 1777, the Second Continental Congress officially adopted the Flag Act of 1777, declaring: ""Resolved, That the flag of the United States shall feature thirteen alternating red and white stripes; and that the union shall consist of thirteen white stars on a blue field, symbolizing a new constellation of hope and unity.""

Our flag represents the story of America. Regardless of gender, race, wealth, or origin—whether born in America or as an immigrant—every individual should be recognized as a human being of value. Together, let's work towards restoring our country as a beacon of hope and stand against those who seek to steer us away from the ideals envisioned by our forefathers.

Wave that flag; wave it wide and high!",en,Tweet,0,11,1,5,1090,2025-06-14 16:19:53,"<a href=""http://twitter.com/download/iphone"" rel=""nofollow"">Twitter for iPhone</a>",,,photo,https://pbs.twimg.com/media/GtaeZF0XwAAzCHW.jpg
'1933904752401600869',"Trustworthy
Loyal
Helpful
Friendly
Courteous
Kind
Obedient
Cheerful
Thrifty
Brave
Clean, and
Reverent!

If only we could all live according to the Scout Law!!

Last night, I honored the scouts from my district who have attained the rank of Eagle Scout. 

This is an incredible achievement as only 4% of all Cub Scouts go on to become Eagle Scouts.
Congratulations! And, a special thank you to all the parents for raising such engaged young citizens. The future of our community—and country—is brighter because of them!",en,Tweet,0,24,1,2,1362,2025-06-14 16:09:57,"<a href=""http://twitter.com/download/iphone"" rel=""nofollow"">Twitter for iPhone</a>",,,photo,"https://pbs.twimg.com/media/GtacG9HWEAASf57.jpg,https://pbs.twimg.com/media/GtacG9LX0AAzVjw.jpg,https://pbs.twimg.com/media/GtacG9EWoAEGNo_.jpg,https://pbs.twimg.com/media/GtacG9HWIAADS_Q.jpg"
'1933582905936093518',Democrats stand for the middle class and those who aspire to the middle class. We need to spread that message. https://t.co/1CkeNLemeG,en,Tweet,5,170,48,420,35709,2025-06-13 18:51:03,"<a href=""http://twitter.com/download/iphone"" rel=""nofollow"">Twitter for iPhone</a>",,,video,https://video.twimg.com/amplify_video/1933582698674524160/vid/avc1/1280x720/8lvZUyHdU_-eihg7.mp4?tag=21
'1933554821031764224',"Bishop Barron is right. It’s not just politicians and religious leaders who shouldn’t talk past one another—we all need more honest, collective dialogue. We can’t tackle our toughest issues by talking over each other. We need to talk, debate, and work together to move our nation forward.",en,Tweet,0,8,1,3,1109,2025-06-13 16:59:27,"<a href=""http://twitter.com/download/iphone"" rel=""nofollow"">Twitter for iPhone</a>",,,video,https://video.twimg.com/amplify_video/1933554456106295296/vid/avc1/1280x720/ekr82ekJNVKuRc0h.mp4?tag=21
'1933524762032287964',"Bishop Barron brings up a good point. Many traditional Democrats do not recognize the Democratic Party today. We have to talk about the issues most pressing to the American people: the economy, immigration, taxes, crime, and healthcare. https://t.co/gCaXeAP8Gl",en,Tweet,2,50,13,12,5474,2025-06-13 15:00:01,"<a href=""https://mobile.twitter.com"" rel=""nofollow"">Twitter Web App</a>",,,video,https://video.twimg.com/amplify_video/1933345132943716352/vid/avc1/1280x720/V3PmKhK_76Yvzz1S.mp4?tag=21
'1933501769344020690',"The United States stands with Israel. 🇺🇸🇮🇱

Israel and the United States’ relations remain ironclad. We stand with Israel in support of their right to self-defense. 

Iran is a terrorist nation. They spend millions funding terrorist proxies across the Middle East like Hamas, Hezbollah, and the Houthis who have attacked Israel relentlessly since the October 7th terrorist attacks. Allowing such a terrorist nation to possess a nuclear weapon is an existential threat to Israel and something the United States stands firmly against.",en,Tweet,12,476,64,95,42122,2025-06-13 13:28:39,"<a href=""http://twitter.com/download/iphone"" rel=""nofollow"">Twitter for iPhone</a>",,,,
'1933331717160644713',"I joined Bishop Barron’s Word on Fire podcast. Watch the full interview here. 

https://t.co/gp2Nc7sXT1 https://t.co/P1PrYe4dIG",en,Tweet,1,5,0,4,1356,2025-06-13 02:12:55,"<a href=""http://twitter.com/download/iphone"" rel=""nofollow"">Twitter for iPhone</a>",,https://youtu.be/JngRoPi54Tc?si=lACMgNNKFUuJ6P1D,photo,https://pbs.twimg.com/media/GtSS8zEWMAAHItp.jpg
'1933245086919426178',I am heartbroken by the tragic Air India plane crash and the tremendous loss of life it has caused. My thoughts and prayers are with all those affected by this unimaginable tragedy. May they find strength and comfort in the face of such sorrow.,en,Tweet,0,8,1,0,1259,2025-06-12 20:28:41,"<a href=""http://twitter.com/download/iphone"" rel=""nofollow"">Twitter for iPhone</a>",,,,
'1933236964829888740',"Earned. Not Given.

Established by Congress in 1970, the Congressional Award recognizes initiative, service, and achievement among young people. It was an honor to meet with the six students and future leaders from #NY03 who earned this distinction during their visit to Washington for the 2025 Gold Medal Summit. 

Congratulations to Ryan Smith, Saanvi Peri, Ayan Mahajan, Ramya Reddi, Rajit Reddi, and Sahana Sundar!",en,Tweet,0,9,2,3,1134,2025-06-12 19:56:24,"<a href=""http://twitter.com/download/iphone"" rel=""nofollow"">Twitter for iPhone</a>",#NY03,,photo,https://pbs.twimg.com/media/GtQ8xWyWkAELVyT.jpg
