tweet_id,text,language,type,bookmark_count,favorite_count,retweet_count,reply_count,view_count,created_at,client,hashtags,urls,media_type,media_urls
'1881485573275242765',"It was an honor to be in the Capitol today and witness history as @realDonaldTrump was sworn in as the 47th President of the United States.

Today begins a new chapter for our nation. I look forward to working with President Trump to reduce our national debt, restore America’s strength on the world stage, secure our borders, and address the many challenges ahead.",en,Tweet,1,18,1,3,614,2025-01-20 23:34:51,"<a href=""http://twitter.com/download/iphone"" rel=""nofollow"">Twitter for iPhone</a>",,,photo,"https://pbs.twimg.com/media/GhxhIUnWEAAbtzu.jpg,https://pbs.twimg.com/media/GhxhIU6WoAEmgKf.jpg,https://pbs.twimg.com/media/GhxhIUlXgAAaFap.jpg,https://pbs.twimg.com/media/GhxhIUkX0AAB5Ej.jpg"
'1881385043454808371',This morning I had the privilege of walking from my office to the rotunda. It’s a historic day. Let’s take a walk. https://t.co/GxbMRU88Ne,en,Tweet,0,9,2,1,500,2025-01-20 16:55:23,"<a href=""http://twitter.com/download/iphone"" rel=""nofollow"">Twitter for iPhone</a>",,,video,https://video.twimg.com/amplify_video/1881384962923909120/vid/avc1/1280x720/rioE5s1weE5B6E7F.mp4?tag=16
'1880687540740723159',"Patty was an amazing woman, Shelby and I are deeply saddened to hear of her passing. Our thoughts and prayers are with you and your family.",en,Tweet,0,6,0,1,861,2025-01-18 18:43:45,"<a href=""http://twitter.com/download/iphone"" rel=""nofollow"">Twitter for iPhone</a>",,,,
'1879972705912639772',"I am proud to co-sponsor @RepRWilliams bill to make President Trump's “Remain in Mexico” policy permanent. 

This bill establishes the foundation to restore law and order while securing our nation by requiring individuals awaiting a court date to remain in their country of origin. As a nation built on laws, it’s time we uphold them.",en,Tweet,0,12,2,2,558,2025-01-16 19:23:15,"<a href=""http://twitter.com/download/iphone"" rel=""nofollow"">Twitter for iPhone</a>",,,,
'1879940203101712687',"A bet is a bet. Tough to see Texas lose. I was on the wrong side of this one, but I’ll get the next one @RepDaveJoyce! https://t.co/QgVSf1TS2A",en,Tweet,0,11,1,3,1037,2025-01-16 17:14:06,"<a href=""http://twitter.com/download/iphone"" rel=""nofollow"">Twitter for iPhone</a>",,,photo,https://pbs.twimg.com/media/GhbjpmfWoAAvfJl.jpg
'1879585055972159639',It’s a privilege to serve as co-chair of the @BipartisanVets alongside @RepDonDavis in the 119th Congress. This caucus has a history of putting our nation’s wellbeing above all else and I look forward to continuing that tradition.,en,Tweet,0,6,1,1,1000,2025-01-15 17:42:53,"<a href=""http://twitter.com/download/iphone"" rel=""nofollow"">Twitter for iPhone</a>",,,,
'1879304423132066186',Proud to have voted for and to have been an original co-sponsor of this important piece of legislation. It’s a good day in Washington.,en,Tweet,0,23,3,4,1281,2025-01-14 23:07:44,"<a href=""http://twitter.com/download/iphone"" rel=""nofollow"">Twitter for iPhone</a>",,,,
'1879203755675250880',It’s always fun to meet with the folks at NASA. Had a great meeting with Director Wyche and Astronaut Kayla Barron. Thanks to the leadership of the Johnson Space Center for making the trip up to D.C. https://t.co/IKURmLttwZ,en,Tweet,0,7,0,1,754,2025-01-14 16:27:43,"<a href=""http://twitter.com/download/iphone"" rel=""nofollow"">Twitter for iPhone</a>",,,photo,https://pbs.twimg.com/media/GhRF2UYWoAgrovX.jpg
'1877465497832247808',Congratulations @CaterpillarInc for 100 years of business! We’re glad to have you in Texas. https://t.co/0jy64SEEZD,en,Tweet,0,11,2,1,510,2025-01-09 21:20:30,"<a href=""http://twitter.com/download/iphone"" rel=""nofollow"">Twitter for iPhone</a>",,,video,https://video.twimg.com/amplify_video/1877465410842341376/vid/avc1/886x468/yCNg5rQvI0xBn8jT.mp4?tag=16
'1877192837416034637',My thoughts and prayers go out to those impacted by the wildfires. Thank you to all who are working tirelessly to keep folks safe.,en,Tweet,1,6,1,2,976,2025-01-09 03:17:03,"<a href=""http://twitter.com/download/iphone"" rel=""nofollow"">Twitter for iPhone</a>",,,,
'1877074940727328806',@RusssellStover @ShinerBeer @CollinStreet,qam,Reply,0,0,0,0,309,2025-01-08 19:28:34,"<a href=""http://twitter.com/download/iphone"" rel=""nofollow"">Twitter for iPhone</a>",,,,
'1877067999737188832',"@RepDaveJoyce you’re on!

I’ll put up some Russell Stover chocolates from my district, a fruitcake from Collins Street Bakery, and a case of Shiner Bock to represent Texas. But don’t get too excited—those Buckeyes don’t stand a chance.

Hook ’em Horns!",en,Tweet,0,3,1,3,1021,2025-01-08 19:01:00,"<a href=""http://twitter.com/download/iphone"" rel=""nofollow"">Twitter for iPhone</a>",,,,
'1877064139148861483',Proud to be a co-sponsor of this important piece of legislation!,en,Tweet,0,15,4,2,1091,2025-01-08 18:45:39,"<a href=""http://twitter.com/download/iphone"" rel=""nofollow"">Twitter for iPhone</a>",,,,
'1876697055675969832',"Im proud to join @RepNateMoran as a co-sponsor of this legislation and as a former small business owner, I know how difficult it can be to make a living. Over-regulation doesn’t help American businesses owners; it hurts them. The federal government shouldn’t be working to make it more difficult to make a dollar.",en,Tweet,0,15,5,2,1275,2025-01-07 18:27:00,"<a href=""http://twitter.com/download/iphone"" rel=""nofollow"">Twitter for iPhone</a>",,,,
'1876364834801131641',"Hey everyone, it’s a cold day in DC, let’s take a walk. https://t.co/cA1NE6PuZ4",en,Tweet,1,72,3,9,4736,2025-01-06 20:26:52,"<a href=""http://twitter.com/download/iphone"" rel=""nofollow"">Twitter for iPhone</a>",,,video,https://video.twimg.com/amplify_video/1876364706983583744/vid/avc1/1280x720/T1-xtyP8y4jxVA7j.mp4?tag=16
'1876347563034480872',"Today, I had the honor of certifying the election results for President Donald Trump, the 47th President of the United States.

The American people made their voices heard this November, and I’m eager to work with the new administration and my colleagues in Congress to address the challenges facing our nation and move America forward. 🇺🇸",en,Tweet,0,18,2,5,1241,2025-01-06 19:18:14,"<a href=""http://twitter.com/download/iphone"" rel=""nofollow"">Twitter for iPhone</a>",,,,
'1876329742590505468',"Hey everyone, as temperatures drop, please stay safe! I will continue to give updates as I receive them. https://t.co/7kWbkvWd1D",en,Tweet,0,11,0,0,525,2025-01-06 18:07:25,"<a href=""https://mobile.twitter.com"" rel=""nofollow"">Twitter Web App</a>",,,photo,https://pbs.twimg.com/media/GgoP8AIXoAAUFzL.png
'1875272529641963778',"Congratulations @SpeakerJohnson! 

I have immense respect for the Speaker and his leadership. Now, it’s time to get to work for the American people.",en,Tweet,0,43,5,6,1782,2025-01-03 20:06:26,"<a href=""http://twitter.com/download/iphone"" rel=""nofollow"">Twitter for iPhone</a>",,,,
'1875218830030737900',"Welcome to Congress, my friend!",en,Tweet,0,12,0,2,855,2025-01-03 16:33:03,"<a href=""http://twitter.com/download/iphone"" rel=""nofollow"">Twitter for iPhone</a>",,,,
'1875218596575789498',"Hey everyone, happy new year! Let’s take a walk. https://t.co/tF7MidHWPv",en,Tweet,2,70,5,7,2605,2025-01-03 16:32:07,"<a href=""http://twitter.com/download/iphone"" rel=""nofollow"">Twitter for iPhone</a>",,,video,https://video.twimg.com/amplify_video/1875218497862619137/vid/avc1/1280x720/UfzHBidAoojfKiod.mp4?tag=16
'1874639341521432601',"My thoughts and prayers are with all the folks in Louisiana.

I ask that all Texans join together in support those who were impacted by this horrific attack.",en,Tweet,0,12,1,1,569,2025-01-02 02:10:22,"<a href=""http://twitter.com/download/iphone"" rel=""nofollow"">Twitter for iPhone</a>",,,,
'1871402014573490494',"All day, I debated what to say. I kept writing and rewriting, but nothing sounded right. So, I’ll just say thank you—thank you, Officer Isaiah Patrick Bias. You will be missed. https://t.co/j5riCC23HH",en,Tweet,0,12,3,1,628,2024-12-24 03:46:23,"<a href=""http://twitter.com/download/iphone"" rel=""nofollow"">Twitter for iPhone</a>",,,photo,"https://pbs.twimg.com/media/GfiONkXXkAAl9oU.jpg,https://pbs.twimg.com/media/GfiONkXWMAAuz3L.jpg,https://pbs.twimg.com/media/GfiONkbX0AApHN3.jpg,https://pbs.twimg.com/media/GfiONkYW8AAQT81.jpg"
'1869447160233906221',"While I’ve been in DC, the district team has been on the move! Before school let out for Christmas, they made stops at Penelope ISD, Malone ISD, and Palmer ISD! https://t.co/UvXpvuvrk1",en,Tweet,0,5,0,15,881,2024-12-18 18:18:30,"<a href=""http://twitter.com/download/iphone"" rel=""nofollow"">Twitter for iPhone</a>",,,photo,"https://pbs.twimg.com/media/GfGcRUoWMAAVXpP.jpg,https://pbs.twimg.com/media/GfGcRUpWkAAMPyT.jpg,https://pbs.twimg.com/media/GfGcRUpWEAArsFN.jpg,https://pbs.twimg.com/media/GfGcRUsXUAAhS2s.jpg"
'1868120962522120633',"Democrats in Congress are putting the very people who feed the American people at risk by not passing the FARM Act. This bill is designed to support farmers growing key crops like corn, cotton, soybeans, and wheat, ensuring they can continue their vital work. Today, I was fortunate enough to eat—and that’s because of our farmers. It’s time to stand with them and pass the FARM Act.",en,Tweet,0,16,1,23,2282,2024-12-15 02:28:40,"<a href=""http://twitter.com/download/iphone"" rel=""nofollow"">Twitter for iPhone</a>",,,,
'1867989372085416400',"The picture says it all. Go Navy, beat Army! https://t.co/30Xfcg5ZCz",en,Tweet,0,3,1,2,612,2024-12-14 17:45:46,"<a href=""http://twitter.com/download/iphone"" rel=""nofollow"">Twitter for iPhone</a>",,,photo,https://pbs.twimg.com/media/GexubtfWQAAqhaV.jpg
'1867658161265816019',I’m making the most of my day by making a quick stop at the Old Gin in Wortham! https://t.co/9DdAaJbZer,en,Tweet,0,9,1,1,685,2024-12-13 19:49:39,"<a href=""http://twitter.com/download/iphone"" rel=""nofollow"">Twitter for iPhone</a>",,,video,https://video.twimg.com/amplify_video/1867658079950532608/vid/avc1/1280x720/io-0zWrE3lqR5SaZ.mp4?tag=16
'1867643584675283247',"Hey, everyone’s happy Friday! I’m back in the district; let’s take a walk. https://t.co/9Ycqi6PsgL",en,Tweet,0,6,1,2,430,2024-12-13 18:51:44,"<a href=""http://twitter.com/download/iphone"" rel=""nofollow"">Twitter for iPhone</a>",,,video,https://video.twimg.com/amplify_video/1867643570233946112/vid/avc1/224x128/HHU-3Ot36PLd66a3.mp4?tag=16
'1867346452009136343',Thank you for stopping by!,en,Tweet,0,5,0,0,604,2024-12-12 23:11:02,"<a href=""http://twitter.com/download/iphone"" rel=""nofollow"">Twitter for iPhone</a>",,,,
'1867346289337180448',"Spreading holiday cheer across Hill County today! My staff had the pleasure of delivering treats and visiting first responders who work tirelessly to keep our communities safe.

Grateful for the opportunity to thank these incredible men and women in person this holiday season! https://t.co/kbswnTdvOL",en,Tweet,0,10,0,1,474,2024-12-12 23:10:23,"<a href=""http://twitter.com/download/iphone"" rel=""nofollow"">Twitter for iPhone</a>",,,photo,"https://pbs.twimg.com/media/GeoljCJXcAAUQWz.jpg,https://pbs.twimg.com/media/GeoljCIWIAAOK6C.jpg"
'1866647100810989700',It was a privilege to honor @RepKayGranger on the house floor today. Your boots will never be filled. Thank you for being a true friend. https://t.co/fjWxW5Mqmp,en,Tweet,2,78,8,5,6059,2024-12-11 00:52:04,"<a href=""http://twitter.com/download/iphone"" rel=""nofollow"">Twitter for iPhone</a>",,,video,https://video.twimg.com/amplify_video/1866646909982515200/vid/avc1/886x500/HUEzSOJLL6c5N5Up.mp4?tag=16
'1865489007284834600',Only 19 veterans of the Pearl Harbor attack are still with us today—a testament to the passage of time and the enduring legacy of their sacrifice. These men represent the extraordinary courage displayed on one of the most challenging days in our nation’s history. Let us pause to honor their heroism and remember the countless individuals who stood in defense of our freedom against incredible odds.,en,Tweet,0,15,2,3,1070,2024-12-07 20:10:13,"<a href=""http://twitter.com/download/iphone"" rel=""nofollow"">Twitter for iPhone</a>",,,,
'1864790361178001504',"Yesterday, I had the privilege of being on a panel alongside Senator Pete Ricketts  discussing what the next four years look like under the Trump Administration. Thank you, IDU, for hosting such an insightful and informative event. I was proud to be apart of it. https://t.co/Hxo8tc0cYN",en,Tweet,0,6,0,2,826,2024-12-05 21:54:02,"<a href=""http://twitter.com/download/iphone"" rel=""nofollow"">Twitter for iPhone</a>",,,photo,"https://pbs.twimg.com/media/GeEQ8xiXMAAh5Z5.jpg,https://pbs.twimg.com/media/GeEQ8xkWsAI7_Px.jpg"
'1863600307739001052',"Hey everyone! Folks in Ennis—there’s a boil water notice in effect right now due to water quality issues. Be sure to check out the link for all the details and stay safe!

https://t.co/iLpUJQOZxr",en,Tweet,0,2,1,0,452,2024-12-02 15:05:12,"<a href=""https://mobile.twitter.com"" rel=""nofollow"">Twitter Web App</a>",,https://www.cbsnews.com/texas/news/ennis-boil-water-notice-dec/?fbclid=IwZXh0bgNhZW0CMTEAAR1dBVVsPr3ejjeUJK3ayEbUMSJQgpcsqxNTAW9nwHhx0oJo6x6qgtNHUkg_aem_g_yIHLvtp2JwvHRLxvCTWQ,,
'1861192200723255710',"As many of us begin this week reflecting on what we’re thankful for, I want to take a moment to highlight our law enforcement. I am deeply grateful for the hard work and dedication of these remarkable individuals. I also want to congratulate the Mansfield Police Department on the opening of their new headquarters. This building stands as a reminder of the department’s commitment to serving and protecting our community.",en,Tweet,0,11,1,3,578,2024-11-25 23:36:14,"<a href=""http://twitter.com/download/iphone"" rel=""nofollow"">Twitter for iPhone</a>",,,photo,"https://pbs.twimg.com/media/GdRIbSdWwAEF8Cv.jpg,https://pbs.twimg.com/media/GdRIbSYW0AACLQh.jpg,https://pbs.twimg.com/media/GdRIbSYXgAAcddB.jpg,https://pbs.twimg.com/media/GdRIbSXXcAEr9CG.jpg"
'1859696563536175601',"Yesterday, my AG advisory board had a productive meeting in Hillsboro. I cannot express how impactful the input of these community leaders is on my legislative agenda. I know it is a sacrifice for them to take time away from their farms, businesses, and families to be a part of this board, and I cannot thank them enough.",en,Tweet,0,4,1,2,458,2024-11-21 20:33:06,"<a href=""http://twitter.com/download/iphone"" rel=""nofollow"">Twitter for iPhone</a>",,,photo,"https://pbs.twimg.com/media/Gc74Io1WQAAmiwh.jpg,https://pbs.twimg.com/media/Gc74IowWQAAAAD1.jpg,https://pbs.twimg.com/media/Gc74IoyWoAAuKbP.jpg,https://pbs.twimg.com/media/Gc74IoxWIAAV_vO.jpg"
'1859619199678595507',"Thank you Chairwoman @RepKayGranger, your leadership will be missed. Thank you for being such a great friend and mentor.",en,Tweet,0,9,3,8,1861,2024-11-21 15:25:41,"<a href=""http://twitter.com/download/iphone"" rel=""nofollow"">Twitter for iPhone</a>",,,,
'1859373868919685156',"Today, in the Subcommittee on Interior, Environment, and Related Agencies, we were confronted with the heartbreaking reality of the crisis of missing and murdered Indigenous women within our borders. This is unacceptable and evil. We cannot allow these atrocities to continue. I’m proud to work with my colleagues to combat this issue at its core and provide the resources needed for folks to protect themselves. We cannot allow this to happen in America.",en,Tweet,0,15,3,2,1409,2024-11-20 23:10:50,"<a href=""http://twitter.com/download/iphone"" rel=""nofollow"">Twitter for iPhone</a>",,,video,https://video.twimg.com/amplify_video/1859373718557847552/vid/avc1/886x500/n_Ho9yTyfV4PwifV.mp4?tag=16
'1858912412126376173',"Yesterday, we passed H.R. 8371, the Senator Elizabeth Dole 21st Century Veterans Healthcare and Benefits Improvement Act. As a Navy veteran, I couldn't be more proud of this body. Thank you Chairman @RepBost and the @HouseVetAffairs, for all of your dedication on this bill. https://t.co/qYgeSX8S0G",en,Tweet,1,19,4,5,1312,2024-11-19 16:37:10,"<a href=""https://mobile.twitter.com"" rel=""nofollow"">Twitter Web App</a>",,,photo,https://pbs.twimg.com/media/Gcwu5VDXAAA49Zr.png
'1857135326206046515',It’s always a pleasure to meet with the Texas Farm Bureau. We had a great conversation about critical priorities of farmers and rural America. Thanks for stopping by! https://t.co/BF8sffaR0q,en,Tweet,0,9,2,3,514,2024-11-14 18:55:40,"<a href=""http://twitter.com/download/iphone"" rel=""nofollow"">Twitter for iPhone</a>",,,photo,"https://pbs.twimg.com/media/GcXeu9_aEAAJJbR.jpg,https://pbs.twimg.com/media/GcXeu9VXQAAL6R_.jpg"
'1856063346933653612',"Veterans Day always makes me stop and think about the Privilege, Service, and Sacrifice of our veterans. Every service member has a unique story, but we all share one thing in common: the privilege of serving this great country. We raised our right hands, swore an oath, and gave a part of ourselves to defend and protect the freedoms we hold dear. And we did it willingly, knowing full well that service would ask a lot from us—and our families.

The sacrifices of military life are different for each person, but they’re no less real. For me, as a Navy guy, service meant long hours on the flight line, days spent getting ready for missions that would take me into the sky or out on the water. There were plenty of thrills, but there were also the long hours of prepping and debriefing, making sure every part of the aircraft was good to go, and taking care of the young sailors who worked hard to make it all happen. Every mission, every day, was a reminder that service isn’t just about the big moments—it’s about the daily grind and the commitment to something bigger than yourself.

Today is a day to say “thank you” to all those who served, who made it through and came back home to build their lives alongside the rest of us. For me, that means spending time with my wife and kids, enjoying the freedoms our veterans fought for and making up for some of the time I missed while I was standing watch.

So, if you see a veteran today, take a minute to thank them. For what they did, for who they defended, and for the country they served.",en,Tweet,0,17,3,2,758,2024-11-11 19:56:00,"<a href=""http://twitter.com/download/iphone"" rel=""nofollow"">Twitter for iPhone</a>",,,photo,"https://pbs.twimg.com/media/GcIPwqzXIAAe285.jpg,https://pbs.twimg.com/media/GcIPwqyXAAAeI4B.jpg,https://pbs.twimg.com/media/GcIPwqyXAAEx6rP.jpg"
'1855694728324636883',"To my fellow brothers and sisters in arms, happy 249th birthday!",en,Tweet,0,4,0,3,555,2024-11-10 19:31:15,"<a href=""http://twitter.com/download/iphone"" rel=""nofollow"">Twitter for iPhone</a>",,,,
'1853534698838114706',"In 1918, when Mansfield residents donated the original funds to construct Memorial Hall to honor World War I veterans, they could have never imagined what it would become. It was truly an honor to be there today as they broke ground. This facility will be a testament to the sacrifices of those before us who gave their lives for the freedoms we enjoy today.",en,Tweet,0,7,0,1,583,2024-11-04 20:28:03,"<a href=""http://twitter.com/download/iphone"" rel=""nofollow"">Twitter for iPhone</a>",,,photo,"https://pbs.twimg.com/media/GbkT-qyXgAQM7Ft.jpg,https://pbs.twimg.com/media/GbkT-qvW4AAcIq-.jpg,https://pbs.twimg.com/media/GbkT-qwXgAAAZUr.jpg,https://pbs.twimg.com/media/GbkT-qvXAAAsa8Q.jpg"
'1852064430688702912',I really enjoy sitting down and having productive conversations with constituents in my Corsicana Office. Thank you Kathy for reaching out and taking the time to discuss issues facing our farmers. https://t.co/F5yuKCH81J,en,Tweet,0,1,0,3,412,2024-10-31 19:05:44,"<a href=""http://twitter.com/download/iphone"" rel=""nofollow"">Twitter for iPhone</a>",,,photo,https://pbs.twimg.com/media/GbPaxpUWoAEhGnT.jpg
'1851743420596863385',A well earned accolade! This is a testament to the great leadership of the city and our community.,en,Tweet,0,3,0,1,696,2024-10-30 21:50:09,"<a href=""http://twitter.com/download/iphone"" rel=""nofollow"">Twitter for iPhone</a>",,,,
'1851705138949529881',"Elections have consequences, and there are few elections as consequential as the one taking place this November. We must ensure that every citizen has their voice heard, and I am grateful to the members of my staff who have volunteered to participate in the Election Observer Program. Through this program, they will be deployed across the country in New Mexico’s 2nd district, Michigan's 13th, and Connecticut's 5th. These races currently sit within the margin of error, and we must ensure that every vote is counted.",en,Tweet,0,13,3,3,859,2024-10-30 19:18:02,"<a href=""https://mobile.twitter.com"" rel=""nofollow"">Twitter Web App</a>",,,photo,https://pbs.twimg.com/media/GbKT_qnWIAAi3SO.png
'1851696376280686966',"Today I am out exploring our Anderson County and I had the pleasure of stopping by Charles E Dickens Jewelry. It’s a wonderful shop in Palestine, just don’t tell my wife about it! https://t.co/ZvIGgqbyZv",en,Tweet,0,8,1,0,585,2024-10-30 18:43:13,"<a href=""http://twitter.com/download/iphone"" rel=""nofollow"">Twitter for iPhone</a>",,,photo,https://pbs.twimg.com/media/GbKMCRlXoAA7bX9.jpg
'1851363683974144064',Aviation innovation is happening right here in Texas. We are leading the nation in its defense development. I was proud to be with AVX this morning as they opened their doors in Fort Worth. What started from humble beginnings and a dream of five engineers has now blossomed into a company that develops technology to keep our nation safe. This is the American dream. This is patriotism.,en,Tweet,0,5,1,2,470,2024-10-29 20:41:13,"<a href=""http://twitter.com/download/iphone"" rel=""nofollow"">Twitter for iPhone</a>",,,photo,"https://pbs.twimg.com/media/GbFddOzWoAAthiI.jpg,https://pbs.twimg.com/media/GbFddO3XoAASs4x.jpg,https://pbs.twimg.com/media/GbFddO2XUAAD1Tk.jpg"
'1851292087297221082',I am proud to join my colleagues in demanding answers from this administration. The United States should be leading not handicapping American production.,en,Tweet,0,9,2,1,808,2024-10-29 15:56:43,"<a href=""http://twitter.com/download/iphone"" rel=""nofollow"">Twitter for iPhone</a>",,,,
'1849967559111762262',Please join me in praying for the people of Israel. We must stand together 🇺🇸,en,Tweet,12,2919,159,727,92698,2024-10-26 01:13:31,"<a href=""http://twitter.com/download/iphone"" rel=""nofollow"">Twitter for iPhone</a>",,,,
'1849125097216368893',"I had a great conversation at a round table with Irving business leaders. We discussed issues that are facing our business communities, economic growth in the area, and workforce development. Thanks to the to the Las Colinas Chamber for hosting. https://t.co/faET1oY4QR",en,Tweet,0,4,1,5,971,2024-10-23 17:25:52,"<a href=""http://twitter.com/download/iphone"" rel=""nofollow"">Twitter for iPhone</a>",,,photo,https://pbs.twimg.com/media/GalpcmuXYAAlCjt.jpg
'1847650523941363774',"It was a true blessing and privilege to spend Friday morning with the men Bible study at Prestonwood Church in Plano, discussing what it means to be a man of faith and sharing thoughts on the conflict in Israel. Grateful for the fellowship and the opportunity to grow together. Groups like this help remind me that He has it and that America is the Shining City on the Hill. 

Keep your faith in God and have hope in man.",en,Tweet,0,11,0,5,606,2024-10-19 15:46:27,"<a href=""http://twitter.com/download/iphone"" rel=""nofollow"">Twitter for iPhone</a>",,,photo,"https://pbs.twimg.com/media/GaQsVrlXEAAbdKD.jpg,https://pbs.twimg.com/media/GaQsVrjWkAAormN.jpg,https://pbs.twimg.com/media/GaQsVrqWcAAZkAX.jpg,https://pbs.twimg.com/media/GaQsVrqXMAEs2Hc.jpg"
'1846584887459095032',"I am proud to stand with 
@RepMcCaul in support of Texas farmers, ranchers, and landowners. While infrastructure is important, we must ensure projects respect private property rights and protect the land that generations have worked to care for.",en,Tweet,0,9,0,3,744,2024-10-16 17:11:59,"<a href=""http://twitter.com/download/iphone"" rel=""nofollow"">Twitter for iPhone</a>",,,,
'1845495734914679241',"Happy Birthday to the U.S. Navy! For 249 years, the Navy has defended our freedom across the globe and maintained dominance of the seas. I was honored to serve alongside so many brave men and women, and I’m grateful for the dedication of those who continue to serve today. To properly celebrate I jumped in the back of a Super Hornet! It was like riding a bike.",en,Tweet,0,23,1,3,853,2024-10-13 17:04:05,"<a href=""http://twitter.com/download/iphone"" rel=""nofollow"">Twitter for iPhone</a>",,,video,https://video.twimg.com/amplify_video/1845495597878452236/vid/avc1/960x540/PNF4VadzjPGD3u-C.mp4?tag=16
'1844806900073758877',Our team spent the morning showing our appreciation for the incredible teachers at Venus ISD! A huge thank you to the district for allowing us to visit all four schools and see firsthand the hard work and dedication that make this community thrive. https://t.co/m66qynmImS,en,Tweet,0,8,1,5,515,2024-10-11 19:26:54,"<a href=""http://twitter.com/download/iphone"" rel=""nofollow"">Twitter for iPhone</a>",,,photo,"https://pbs.twimg.com/media/GZoSBIfXYAwWqve.jpg,https://pbs.twimg.com/media/GZoSBIKXEAg0FY7.jpg,https://pbs.twimg.com/media/GZoSBIQWsAsshnz.jpg,https://pbs.twimg.com/media/GZoSBINXQCsKJd4.jpg"
