tweet_id,text,language,type,bookmark_count,favorite_count,retweet_count,reply_count,view_count,created_at,client,hashtags,urls,media_type,media_urls
'1970573475405521155',Proud to stand with my Problem Solvers Caucus colleagues to condemn all political violence.,en,Tweet,0,14,2,7,1829,2025-09-23 20:38:22,"<a href=""http://twitter.com/download/iphone"" rel=""nofollow"">Twitter for iPhone</a>",,,,
'1970246728780517502',"L'Shanah Tovah!  

Happy New Year to my friends in the Jewish community celebrating the start of the High Holidays this evening. As we navigate the challenges of life, including the dangerous rise in antisemitism all around the world, let us come together as friends and neighbors to celebrate the abundance of blessings that surround us. May this year bring you good health, many blessings, and peace.",en,Tweet,1,13,1,2,818,2025-09-22 23:00:00,"<a href=""http://twitter.com"" rel=""nofollow"">Twitter Web Client</a>",,,photo,https://pbs.twimg.com/media/G1d4IYbXMAAFq4J.jpg
'1970180247631933939',"Democrats need to talk about the 5 most important issues facing the American people. Affordability/the economy, immigration, taxes, crime and healthcare. This is where our focus should be. https://t.co/dBAfzJzkIv",en,Tweet,10,202,71,246,13963,2025-09-22 18:35:49,"<a href=""http://twitter.com/download/iphone"" rel=""nofollow"">Twitter for iPhone</a>",,,video,https://video.twimg.com/amplify_video/1970180164840468480/vid/avc1/1280x720/RfFK9kGR3okIX-Wb.mp4?tag=21
'1970095739616542760',"It was a pleasure to attend the 25th Annual Egyptian Festival at St. Mark Coptic Church in Woodbury this weekend. The event, which continues next weekend, featured authentic Egyptian cuisine, traditional music, tours of the Coptic Church, and provided a wonderful opportunity to engage with the community.",en,Tweet,1,7,2,3,1068,2025-09-22 13:00:01,"<a href=""http://twitter.com"" rel=""nofollow"">Twitter Web Client</a>",,,photo,"https://pbs.twimg.com/media/G1aeug8WIAA7WqU.jpg,https://pbs.twimg.com/media/G1aeug_XEAEiJmV.jpg,https://pbs.twimg.com/media/G1aeuhEW0AEXMev.jpg"
'1969420825712316584',"I’m working on a bipartisan solution to help Koreans gain access to E-3 visas following the awful raid in Georgia that saw 300+ Koreans treated like common criminals. We must do better. Korea is the largest foreign investor in America, they share our values, and we should be doing everything we can to strengthen our relationship. https://t.co/8t8I1PTwn5",en,Tweet,1,8,3,9,1004,2025-09-20 16:18:09,"<a href=""http://twitter.com/download/iphone"" rel=""nofollow"">Twitter for iPhone</a>",,,photo,https://pbs.twimg.com/media/G1TJzX0XEAETJk5.jpg
'1969402097373200696',"EPA Administrator Lee Zeldin knows about the risks posed to our drinking water by PFAS. When he represented Long Island in Congress, he helped set up the PFAS Task Force. Now the EPA is reversing course on PFAS water standards? It makes no sense. Let’s work together to protect the public. https://t.co/eOBmi3FCLF",en,Tweet,0,67,23,7,6997,2025-09-20 15:03:44,"<a href=""http://twitter.com/download/iphone"" rel=""nofollow"">Twitter for iPhone</a>",,,photo,https://pbs.twimg.com/media/G1S4xRRX0AA_951.jpg
'1969078628303454376',"The Problem Solvers Caucus had launched a bipartisan effort to unleash American lower energy costs, cut red tape and expediting permitting reform, while protecting the environment. We can promote our energy independence, create strong, clean energy and green energy production. There’s a lot of optimism on both sides of the aisle. To read more: https://t.co/mpP12uQr9F",en,Tweet,0,5,0,9,814,2025-09-19 17:38:23,"<a href=""http://twitter.com/download/iphone"" rel=""nofollow"">Twitter for iPhone</a>",,,photo,https://pbs.twimg.com/media/G1OSk7XXkAIOEzl.jpg
'1969057837981581741',"Utilities are too expensive! Let’s bring costs down.

For way too long, infrastructure and energy production has been slowed by our outdated and red-tape laden system. We need bipartisan permitting reform to cut the red-tape and help unleash America’s true manufacturing power. https://t.co/EoPLztNpL3",en,Tweet,8,211,61,39,29279,2025-09-19 16:15:46,"<a href=""http://twitter.com/download/iphone"" rel=""nofollow"">Twitter for iPhone</a>",,,video,https://video.twimg.com/amplify_video/1969057592237256704/vid/avc1/1920x1080/5tMC5QUQJdQjtALc.mp4?tag=21
'1969008573100286417',God bless America. Let’s rise together and build a more perfect union. https://t.co/KeczrVBDjX,en,Tweet,7,99,30,35,7398,2025-09-19 13:00:00,"<a href=""https://mobile.twitter.com"" rel=""nofollow"">Twitter Web App</a>",,,video,https://video.twimg.com/amplify_video/1968853892550008833/vid/avc1/960x540/480yyydaWsQp3rta.mp4?tag=21
'1968781414197072323',"I love my country. I’m blessed to have been born and live here. But with everything happening, I’m saddened. 

Our country needs bipartisanship now more than ever. We need leaders willing to sit down, discuss our differences and make headway on the issues most important to the American people. We can right this ship. Let’s do it.",en,Tweet,3,113,26,29,14712,2025-09-18 21:57:21,"<a href=""http://twitter.com/download/iphone"" rel=""nofollow"">Twitter for iPhone</a>",,,,
'1968686915219075158',I came to Congress to make life better for my constituents and the American people. Many of my colleagues on both sides want the same. Let’s end the gridlock and work together to deliver solutions that matter. https://t.co/E7mCDOjQIU,en,Tweet,4,96,24,44,6996,2025-09-18 15:41:51,"<a href=""http://twitter.com/download/iphone"" rel=""nofollow"">Twitter for iPhone</a>",,,video,https://video.twimg.com/amplify_video/1968686846595981313/vid/avc1/854x480/LwKXjCKuD-yuftHu.mp4?tag=21
'1968683869135147042',"The number one issue Americans are concerned about is the cost of living. Sky-high energy costs play an enormous role—electricity prices rose more than 6.5% in just the last year, and demand is skyrocketing. Right now it takes years, even decades, for new green energy and other projects to get connected to the grid and start generating energy to meet demand. We need commonsense, bipartisan solutions to cut red tape, bring projects online faster, and make energy more affordable for American families. That’s exactly what this framework does.",en,Tweet,0,9,1,6,4903,2025-09-18 15:29:45,"<a href=""http://twitter.com/download/iphone"" rel=""nofollow"">Twitter for iPhone</a>",,,photo,https://pbs.twimg.com/media/G1Iri4vXoAEQrYP.jpg
'1968676540503261389',"Republicans and Democrats in the Problem Solvers Caucus have been working hard to find common ground to lower energy costs. This permitting reform framework is step one. 

Working Group co-chairs @RepScottPeters and @RepGabeEvans have led the way to release the first of many frameworks from the PSC this Congress. I’m proud of this work and hopeful for the future of our Caucus.",en,Tweet,2,23,6,5,5819,2025-09-18 15:00:38,"<a href=""http://twitter.com/download/iphone"" rel=""nofollow"">Twitter for iPhone</a>",,,,
'1968401916192522712',"Watch my full remarks at today’s Ways and Means Mark-up. 

Healthcare affordability is a top priority for the American people. Congress has the opportunity to stop an increase in healthcare costs if we act now to stop key tax credits from expiring. This is a bipartisan issue. Let’s get it done.",en,Tweet,2,34,13,8,3713,2025-09-17 20:49:22,"<a href=""http://twitter.com/download/iphone"" rel=""nofollow"">Twitter for iPhone</a>",,,video,https://video.twimg.com/amplify_video/1968401773959270401/vid/avc1/854x480/7XCqqSCLX-xmL5z_.mp4?tag=21
'1968392070860591204',"""One of the most difficult concepts that Jesus ever preached was to ‘love your enemies’,"" Suozzi said. ""And that's what we need to be doing right now.""https://t.co/AP9If1k2wr",en,Tweet,0,11,2,12,1072,2025-09-17 20:10:15,"<a href=""http://twitter.com/download/iphone"" rel=""nofollow"">Twitter for iPhone</a>",,https://www.foxnews.com/politics/house-dem-warns-both-sides-road-ruin-political-divide-deepens-over-kirk-assassination,,
'1968097796663263458',"Healthcare is already too expensive in this country and we need Speaker Johnson and the Trump Administration to work with Democrats to stop it from getting more expensive. I’m the Democratic co-lead on a bipartisan bill to stop health insurance costs from rising. Now’s not the time to let these credits expire. Democrats, Republicans, and policy experts agree!",en,Tweet,9,257,71,34,14017,2025-09-17 00:40:54,"<a href=""http://twitter.com/download/iphone"" rel=""nofollow"">Twitter for iPhone</a>",,,video,https://video.twimg.com/amplify_video/1968097656208601088/vid/avc1/854x480/uKy59W0GpPGLlcpA.mp4?tag=21
'1968024888083628148',We need leadership right now. We can disagree with each other without holding each other in contempt. Let’s find a way to love our enemy. To move away from an eye for an eye and move towards more productive collaboration.,en,Tweet,0,5,0,10,1521,2025-09-16 19:51:12,"<a href=""http://twitter.com/download/iphone"" rel=""nofollow"">Twitter for iPhone</a>",,,,
'1968000538072723873',"Is bipartisanship dead? 

No. Allow me to explain. https://t.co/kOcJrn0ECx",en,Tweet,2,24,11,8,6838,2025-09-16 18:14:26,"<a href=""http://twitter.com/download/iphone"" rel=""nofollow"">Twitter for iPhone</a>",,,video,https://video.twimg.com/amplify_video/1968000384032485376/vid/avc1/1280x720/PadcPT1YIpDHPzv6.mp4?tag=21
'1967978194872725608',"Congratulations to the New York State 2025 MathCounts Team for making it to the national finals competition (think national math bee). All four of these middle school mathletes—and their dedicated coach—hail from NY03. I couldn’t be prouder of their achievement. You’ve made your families, your schools, and our entire community proud, and you’ve shown what hard work, talent, and a love of learning can accomplish.",en,Tweet,0,3,0,1,708,2025-09-16 16:45:39,"<a href=""http://twitter.com/download/iphone"" rel=""nofollow"">Twitter for iPhone</a>",,,photo,https://pbs.twimg.com/media/G0-pvM8WMAAN3Bh.jpg
'1967624023791251520',"Our media ecosystem is being abused by our adversaries, abused by those seeking political gains or financial compensation. It’s corrupting our ability to come together. We need to call this out and rally against it. https://t.co/BzNNIUfcR6",en,Tweet,3,45,15,9,5258,2025-09-15 17:18:18,"<a href=""http://twitter.com/download/iphone"" rel=""nofollow"">Twitter for iPhone</a>",,,video,https://video.twimg.com/amplify_video/1967623855809183747/vid/avc1/1280x720/DTX5kKIp4XqLMpnE.mp4?tag=21
'1967376388950032611',"Watch my full interview on ABC with Bill Ritter. 

We discuss the need for leaders to bring decency back to politics, and the future of New York City and the Democratic Party. Let me make this clear. Socialism is not the future of the Democratic Party. https://t.co/3BaTJLoSnt",en,Tweet,2,18,6,23,2155,2025-09-15 00:54:17,"<a href=""http://twitter.com/download/iphone"" rel=""nofollow"">Twitter for iPhone</a>",,,video,https://video.twimg.com/amplify_video/1967375640572710912/vid/avc1/1280x720/mZIhunhJ9OxogKsv.mp4?tag=21
'1967280629290033376',We need bipartisan leadership now more than ever. Let’s work across the aisle to restore civility to our politics. Our nation is counting on us. https://t.co/8ECzd4KxgE,en,Tweet,8,138,36,39,25080,2025-09-14 18:33:46,"<a href=""http://twitter.com/download/iphone"" rel=""nofollow"">Twitter for iPhone</a>",,,video,https://video.twimg.com/amplify_video/1967280510482194432/vid/avc1/1280x720/Hgb9F8HMYe2h6bgN.mp4?tag=21
'1967234382793462004',"Good Morning! Coming up at 11:00 am, I will be joining Bill Ritter on @ABC7NY’s Up Close With Bill Ritter. Tune in! https://t.co/umf4cKlOft",en,Tweet,0,1,1,2,960,2025-09-14 15:30:00,"<a href=""https://mobile.twitter.com"" rel=""nofollow"">Twitter Web App</a>",,,photo,https://pbs.twimg.com/media/G0z6VeBXsAAP_tO.jpg
'1966549017724150011',"Hometown Heroes!

Earlier today, I honored and acknowledged the extraordinary heroism of 12 law enforcement officers from across the 3rd Congressional District, including the Nassau County Police Department, Glen Cove Police Department, and three NYPD precincts (105th, 109th, and 111th), all of whom have displayed exemplary heroism in the line of duty in service to our communities. 

Thank you to all our men and women in blue🙏",en,Tweet,0,11,2,3,1260,2025-09-12 18:06:37,"<a href=""http://twitter.com/download/iphone"" rel=""nofollow"">Twitter for iPhone</a>",,,photo,https://pbs.twimg.com/media/G0qV59GWcAAQ8dF.jpg
'1966290598870323334',I’m sad for our country. The political violence needs to end. Democrats and Republicans must unite together to push back against this scourge of hate and violence. https://t.co/Drd8u7JnQz,en,Tweet,6,232,56,228,52635,2025-09-12 00:59:45,"<a href=""http://twitter.com/download/iphone"" rel=""nofollow"">Twitter for iPhone</a>",,,video,https://video.twimg.com/amplify_video/1966290504452071424/vid/avc1/1280x720/aZEMYtujhNeWS92H.mp4?tag=21
'1966109474063544784',"""On Sept. 11, 2001, everything changed. Twenty-four years later, the memories are still raw. The grief still lingers. But so, too, does the possibility of renewal. If we remember well, and recommit ourselves, Sept. 11 will not only be a day of mourning, but also a day of resolve. That’s how we can best honor those we lost: by building a country worthy of their sacrifice.""

https://t.co/9hxP8e2fdH?",en,Tweet,0,16,3,4,1414,2025-09-11 13:00:01,"<a href=""http://twitter.com"" rel=""nofollow"">Twitter Web Client</a>",,,photo,https://pbs.twimg.com/media/G0h9Da0WQAANZt6.jpg
'1965949798952939923',"Violence over political differences has to stop!

Today a young leader in the Conservative movement, Charlie Kirk, was assassinated. He was 31 years old. He had a wife and two young children. I’m praying for them as they navigate through this impossible tragedy. 

In the last year, an arsonist set fire to PA Gov Josh Shapiro’s residence, the the Speaker of the Minnesota State House Melissa Horman and her husband were assassinated, there was an assassination attempt on State Senator John Hoffman and his wife and there was the assassination attempt on Donald Trump. 

This cannot be what we as a society turn into! 

We need to come together as a country. We need to heal. 

I offer my hand in friendship to my Republican and Democratic colleagues who don’t look at things the way I do. 

Let’s strive to strengthen our relationship as colleagues. America is counting on us to right the ship. We can do it. 

We need to look past our differences and start loving and accepting each other more. We have big jobs and important examples to set. I am offering my hand as an olive branch, and even if it gets slapped away, I will do my best to offer it again.
 
🙏🏼",en,Tweet,2,34,6,15,3353,2025-09-11 02:25:32,"<a href=""http://twitter.com/download/iphone"" rel=""nofollow"">Twitter for iPhone</a>",,,,
'1965881191179120827',My thoughts and prayers are with Charlie Kirk’s family and loved ones. There is absolutely no place for violence in our political discourse or in any disagreement. Today should be a rallying cry for all Americans to urgently confront and reject the dangerous rhetoric in our nation and come together as Americans to stand united against all forms of political violence.,en,Tweet,3,153,43,24,12658,2025-09-10 21:52:54,"<a href=""http://twitter.com/download/iphone"" rel=""nofollow"">Twitter for iPhone</a>",,,,
'1965790172743934178',We need to stop the cartels. Democrats and Republicans must unite together to stop these criminal enterprises. Sitting on our hands and doing nothing isn’t an option. Now’s the time. https://t.co/BVHXFz0Yda,en,Tweet,4,61,16,18,6712,2025-09-10 15:51:14,"<a href=""http://twitter.com/download/iphone"" rel=""nofollow"">Twitter for iPhone</a>",,,video,https://video.twimg.com/amplify_video/1965789276794228736/vid/avc1/2160x3840/7CHYmE41UgzweYw7.mp4?tag=21
'1965751478812889270',"Watch my full CNN interview with Kaitlan Collins and my Problem Solver Caucus Co-Chair Brian Fitzpatrick. 

The President was right. We need to secure the border, but now he’s squandering the opportunity to make his legacy permanent. Let’s focus on fighting the cartels and not doing mass deportations that raids workplaces and beaks up families. Let’s pass bipartisan immigration legislation that secures the border, fixes the broken asylum system and protects the individuals who have been here for decades living peacefully and contributing to our society.",en,Tweet,1,8,3,6,2057,2025-09-10 13:17:29,"<a href=""http://twitter.com/download/iphone"" rel=""nofollow"">Twitter for iPhone</a>",,,video,https://video.twimg.com/amplify_video/1965751232854630400/vid/avc1/1280x720/BuQYWhsxZ8tkw21P.mp4?tag=21
'1965580988345639226',"Coming up at about 9:40, @RepBrianFitz, my Co-Chair of the Problem Solvers Caucus, will be joining me live on CNN’s The Source with Kaitlan Collins. Tune in! https://t.co/hfwNqR7brW",en,Tweet,1,4,1,7,1439,2025-09-10 02:00:01,"<a href=""https://mobile.twitter.com"" rel=""nofollow"">Twitter Web App</a>",,,photo,https://pbs.twimg.com/media/G0cf5F7XgAAo2xF.jpg
'1965543918856274076',"Democrats and Republicans need to stop fighting one another and focus on our common enemy. The cartels. Let’s unite a coalition of businesses, badges and the bible to get bipartisan immigration reform done. Let’s go. https://t.co/YH5KKDC6mg",en,Tweet,7,81,18,75,18116,2025-09-09 23:32:42,"<a href=""http://twitter.com/download/iphone"" rel=""nofollow"">Twitter for iPhone</a>",,,video,https://video.twimg.com/amplify_video/1965543155421388800/vid/avc1/3840x2160/1Ou6X5IZScwNswO0.mp4?tag=21
'1965158202363760727',"📣🇺🇸Attention all #NY03 high school students and graduates under the age of 23 interested in attending one of our nation’s Service Academies, my office is NOW accepting Service Academy Nominations. The deadline for submitting a nomination packet to the Glen Cove District Office is October 31, 2025.

For more information, please visit my website⬇️
https://t.co/gBpfUjuiEg",en,Tweet,0,2,2,2,966,2025-09-08 22:00:00,"<a href=""http://twitter.com"" rel=""nofollow"">Twitter Web Client</a>",#NY03,,photo,https://pbs.twimg.com/media/G0WDITqWMAAqTSw.jpg
'1965055523645960198',I’ve just returned from the Southern Border where I received some excellent briefings. One thing is clear. Democrats and Republicans must come together and focus on our common enemy: the cartels and organized crime who profit off drug smuggling and sex trafficking through our southern border. It’s time to work together to win this fight. Let’s do it.,en,Tweet,8,89,32,21,21553,2025-09-08 15:12:00,"<a href=""http://twitter.com/download/iphone"" rel=""nofollow"">Twitter for iPhone</a>",,,video,https://video.twimg.com/amplify_video/1965055427613278208/vid/avc1/1018x1520/9xqlQOv703INClJT.mp4?tag=21
'1964354132153946434',"""Today we honor the legacy of your fathers, your grandfathers and your great-grandfathers who served our nation under extreme circumstances and despite intense discrimination. We are all better for their service,"" Suozzi said. https://t.co/Hol2TGaooC",en,Tweet,0,11,5,6,1160,2025-09-06 16:44:55,"<a href=""http://twitter.com/download/iphone"" rel=""nofollow"">Twitter for iPhone</a>",,https://www.npr.org/2025/09/06/g-s1-87313/amid-debate-about-u-s-history-harlem-hellfighters-receive-congressional-gold-medal,,
'1964338689544175908',"It’s never too late to do the right thing. This week, we honored the sacrifice and patriotism of the Harlem Hellfighters. This capped my 6 year effort to get the Hellfighters the recognition they rightfully deserved. https://t.co/O3JWq3s0sK",en,Tweet,3,138,44,6,14666,2025-09-06 15:43:33,"<a href=""http://twitter.com/download/iphone"" rel=""nofollow"">Twitter for iPhone</a>",,,video,https://video.twimg.com/amplify_video/1964338612410933248/vid/avc1/640x356/ylFhwwdHa6W2xfQU.mp4?tag=21
'1963711877776892369',"Do you have an interesting app idea? You can now turn your idea into reality. The 2025 Congressional App Challenge is open to all middle & high school students in #NY03.
The deadline for submissions is Thursday, October 30 - I can’t wait to see your ideas!

Rules, registration, and more ➡️ 

https://t.co/6CdUB91Nrg",en,Tweet,0,4,2,11,1127,2025-09-04 22:12:50,"<a href=""http://twitter.com/download/iphone"" rel=""nofollow"">Twitter for iPhone</a>",#NY03,,photo,https://pbs.twimg.com/media/G0CBivzWkAAMw-5.jpg
'1963628116036698237',"It’s never too late to do the right thing. To the Harlem Hellfighters and your families, thank you. You will never be forgotten. https://t.co/mAwgxS44pc",en,Tweet,1,19,9,5,1104,2025-09-04 16:39:59,"<a href=""http://twitter.com/download/iphone"" rel=""nofollow"">Twitter for iPhone</a>",,,video,https://video.twimg.com/amplify_video/1963627989372968960/vid/avc1/886x496/Fuc6wh4A0smge-pv.mp4?tag=21
'1963369819564019734',"Who would have thought Tom Suozzi, Leader Hakeem Jeffries, Defense Secretary Pete Hegseth and Speaker Mike Johnson would all come together to honor Black soldiers from World War I?

That’s exactly what happened today after Rep. Suozzi’s six-year long effort to honor the Harlem Hellfighters with the Congressional Gold Medal here at the Capitol in Emancipation Hall. It’s never too late to do the right thing!",en,Tweet,4,92,24,23,10323,2025-09-03 23:33:37,"<a href=""http://twitter.com/download/iphone"" rel=""nofollow"">Twitter for iPhone</a>",,,photo,"https://pbs.twimg.com/media/Gz9KcWUWMAAlDoh.jpg,https://pbs.twimg.com/media/Gz9KcWOW8AA1MZe.jpg,https://pbs.twimg.com/media/Gz9KcWKXcAAEAeP.jpg,https://pbs.twimg.com/media/Gz9KcWVWAAAyAOM.jpg"
'1963256480133423390',"We started working on a Congressional Gold Medal for the Harlem Hellfighters 5 years ago, and today, at 3:00pm at the Capitol, it will finally be unveiled. You can tune into the event on my Facebook page where I will be live streaming it. https://t.co/nWxGRt51GW https://t.co/6QLH5HJiCH",en,Tweet,1,14,4,15,2385,2025-09-03 16:03:15,"<a href=""http://twitter.com/download/iphone"" rel=""nofollow"">Twitter for iPhone</a>",,https://www.newsday.com/long-island/politics/harlem-hellfighters-ud11fcpi,photo,https://pbs.twimg.com/media/Gz7jXPAXsAAPb6L.jpg
'1962503558231662877',"Happy Labor Day!

For decades, America has created wealth—but workers haven’t shared enough in it.

My bipartisan SHARE Plan Act helps change that by giving the middle class real ownership, fair rewards for hard work, and a stronger stake in the future—especially as AI transforms the workplace.

Let’s make the American Dream real again!",en,Tweet,0,29,6,20,4277,2025-09-01 14:11:24,"<a href=""http://twitter.com/download/iphone"" rel=""nofollow"">Twitter for iPhone</a>",,,photo,https://pbs.twimg.com/media/Gzw2lVJWQAAHk-A.jpg
'1962318925061828859',"Watch my full interview with Marcia Kramer. 

To win on affordability and the economy, Democrats need to reclaim Democratic capitalism, an approach that puts workers, families, and small businesses at the center of growth. https://t.co/60yLHwk3tk",en,Tweet,5,26,8,33,6000,2025-09-01 01:57:44,"<a href=""http://twitter.com/download/iphone"" rel=""nofollow"">Twitter for iPhone</a>",,,video,https://video.twimg.com/amplify_video/1962318781201383424/vid/avc1/886x1920/CcRz4NqMR-niordq.mp4?tag=21
'1962168518033457507',"Coming up at 11:30, I will be joining @MKramerTV  on @CBSNewYork ‘s The Point. Tune in! https://t.co/IirqdHIrnO",en,Tweet,0,4,0,4,1369,2025-08-31 16:00:04,"<a href=""https://mobile.twitter.com"" rel=""nofollow"">Twitter Web App</a>",,,photo,https://pbs.twimg.com/media/GzoqKF9X0AEez0A.jpg
'1961461675556536523',"When I return to Congress, my focus will be on delivering real, bipartisan legislation that fixes our immigration crisis. Along with the Problem Solvers, I will be helping solve an issue that’s perplexed legislators on both sides of the aisle for decades. Let’s get it done. https://t.co/q53AwS93p7",en,Tweet,4,78,21,22,11944,2025-08-29 17:11:20,"<a href=""http://twitter.com/download/iphone"" rel=""nofollow"">Twitter for iPhone</a>",,,video,https://video.twimg.com/amplify_video/1961461609777262593/vid/avc1/854x480/IkvPlgHClba0NuIU.mp4?tag=21
'1961086026568376388',"“I am encouraged that the Musk team gave such [a] thorough response,” Suozzi said. “However, their investigation highlights a critical point: AI companies, in their race to create the most innovative and commercially successful product, must be vigilant in combatting biased, slanted, bigoted and antisemitic outputs. It’s a very slippery and dangerous slope.”https://t.co/lleN5Xb2q7",en,Tweet,2,4,2,5,1109,2025-08-28 16:18:38,"<a href=""http://twitter.com/download/iphone"" rel=""nofollow"">Twitter for iPhone</a>",,,photo,https://pbs.twimg.com/media/GzctWIDXYAIJDGL.jpg
'1960740010530865323',"Sending my heartfelt prayers to the families affected by the devastating floods across India and Pakistan. 

In a matter of hours, these floods have destroyed homes and taken the lives of many innocent families. 

The holy shrines of Sikhs, Muslims, Hindus, and Christians have also been devastated.

There have been more than 30 deaths at Vaishno Devi, one of the holiest Hindu temples and Kartarpur Sahib, the Gurudwara I just visited a couple of months ago in Pakistan is underwater. 

Kartarpur Sahib, is a powerful symbol of peace between India and Pakistan, and it is the only place where citizens of both nations can cross freely without visas. It’s important to remember extreme weather knows no borders and does not discriminate. Let there be a shared purpose between all friends and neighbors to support those in need now. 🙏 https://t.co/HIzmGjfpJn",en,Tweet,0,9,1,3,1469,2025-08-27 17:23:41,"<a href=""http://twitter.com/download/iphone"" rel=""nofollow"">Twitter for iPhone</a>",,,photo,https://pbs.twimg.com/media/GzXypbjWEAA-PuH.jpg
