tweet_id,text,language,type,bookmark_count,favorite_count,retweet_count,reply_count,view_count,created_at,client,hashtags,urls,media_type,media_urls
'1889793351874138404',"If you are a SNAP or WFNJ recipient and your benefits were stolen between September 1, 2023, and December 20, 2024 — act now. Protect your benefits by changing your pin regularly.

You can request replacements at the link below ⬇️
https://t.co/LJRRDWD7Yl",en,Tweet,0,2,1,11,715,2025-02-12 21:47:00,"<a href=""https://mobile.twitter.com"" rel=""nofollow"">Twitter Web App</a>",,https://nj.gov/humanservices/dfd/resources/stolen/,,
'1889769696360050847',"After whacking Jersey families with their Congestion Tax scheme, the MTA claims they still need $68 billion ON TOP of what they’ll get from Congestion Tax to address their woeful mismanagement.

Nothing is ever enough for the MTA — they are a bottomless pit for taxpayer dollars.

https://t.co/Fnf30JYzT3",en,Tweet,0,2,0,23,1020,2025-02-12 20:13:00,"<a href=""http://twitter.com"" rel=""nofollow"">Twitter Web Client</a>",,,,
'1889745788848447530',"I’m all for government efficiency and cutting bureaucracy, and have a record of fighting to do so. But, it requires a cohesive plan — not pulling the pin on a grenade, throwing it into the federal budget, and walking away.

We must make life more affordable for our hard working families, instead of destroying programs designed to help them.",en,Tweet,0,2,0,18,962,2025-02-12 18:38:00,"<a href=""http://twitter.com"" rel=""nofollow"">Twitter Web Client</a>",,,,
'1889726664625516970',"Jersey families want lower prices — not chaos and uncertainty.
 
I’ll never stop fighting to lower costs, protect your pocketbooks, and make life more affordable.",en,Tweet,0,4,1,19,887,2025-02-12 17:22:00,"<a href=""http://www.oneupapp.io"" rel=""nofollow"">OneUp App</a>",,,,
'1889489710088630744',"Medicaid is a vital lifeline that millions of families, seniors, and people with disabilities count on.

I’ll fight tooth and nail against anyone who tries to cut programs that help Jersey families and seniors. https://t.co/GfkswwJezg",en,Tweet,1,8,4,43,1292,2025-02-12 01:40:26,"<a href=""http://www.oneupapp.io"" rel=""nofollow"">OneUp App</a>",,,photo,https://pbs.twimg.com/media/GjjQ4PbXoAA_Mxv.jpg
'1889449991741030803',"Promises made, promises broken. Despite President Trump’s promises of lowering grocery costs, egg prices are skyrocketing.
 
I’ve demanded @POTUS reverse his decision to halt communication at the CDC on the bird flu outbreak, which is driving up costs and hurting Jersey families. https://t.co/6u46HaA82A",en,Tweet,1,3,2,49,1555,2025-02-11 23:02:36,"<a href=""http://www.oneupapp.io"" rel=""nofollow"">OneUp App</a>",,,video,https://video.twimg.com/ext_tw_video/1889449883477680129/pu/vid/avc1/1280x720/C0x3PrZoClEkH6qx.mp4?tag=12
'1889389467091321261',"While I’m relieved that 3 more Israeli hostages were reunited with their families, I’m disgusted by how Hamas terrorists returned them: severely malnourished &amp; unrecognizable.
 
We must free all the hostages, ensuring their health &amp; safety.
https://t.co/W8LwMyU4dC",en,Tweet,2,130,17,31,12256,2025-02-11 19:02:06,"<a href=""http://www.oneupapp.io"" rel=""nofollow"">OneUp App</a>",,https://www.wsj.com/world/middle-east/hostage-accounts-raise-alarm-about-how-long-those-left-in-gaza-can-survive-6edbc924?mod=hp_lead_pos9,,
'1889356767785631817',"Cutting biomedical research puts our families at risk. Any effort to slash this critical funding is unacceptable.

I’ll never stop fighting to secure investments in healthcare research for @NIH to ensure Americans have access to lifesaving medical care.
https://t.co/AZHYkX32tb",en,Tweet,0,3,1,19,741,2025-02-11 16:52:10,"<a href=""http://www.oneupapp.io"" rel=""nofollow"">OneUp App</a>",,https://www.washingtonpost.com/health/2025/02/08/nih-cuts-billions-dollars-biomedical-funding-effective-immediately/,,
'1889328104113332668',"My constituents are deeply concerned about Elon Musk having unrestricted access to their SSNs, tax refunds, and bank account information.

That’s why I’m cosponsoring the Taxpayer Data Protection Act to ensure your private data is protected and secure. https://t.co/SjispFPjDo",en,Tweet,0,19,0,70,3534,2025-02-11 14:58:16,"<a href=""https://mobile.twitter.com"" rel=""nofollow"">Twitter Web App</a>",,https://abcnews.go.com/Politics/house-democrats-launch-bill-block-musk-accessing-personal/story?id=118539345,,
'1889130047539229068',"Once again, Hamas has violated the terms of the pause and is putting the lives of innocent hostages at risk.

Hamas cannot continue to stall — they must release all the hostages, including the Americans, immediately.",en,Tweet,7,378,47,79,35119,2025-02-11 01:51:16,"<a href=""http://twitter.com/download/iphone"" rel=""nofollow"">Twitter for iPhone</a>",,,,
'1889058549147279746',"As a member of @HouseIntelDems, I’ve called for a classified briefing on DeepSeek.

I’ll do everything possible to stop our adversaries from stealing our families’ private, personal, and sensitive information.",en,Tweet,0,4,1,20,1001,2025-02-10 21:07:09,"<a href=""https://mobile.twitter.com"" rel=""nofollow"">Twitter Web App</a>",,,,
'1888965405185569071',"Last week, I joined Jersey's congressional delegation &amp; @govmurphy to discuss ways to deliver key priorities for our communities.

I’ll keep fighting alongside my colleagues to restore the SALT Deduction, end NY’s Congestion Tax, and protect our shared Jersey Values. https://t.co/wXh9a0i8LP",en,Tweet,1,14,3,28,7850,2025-02-10 14:57:02,"<a href=""http://www.oneupapp.io"" rel=""nofollow"">OneUp App</a>",,,photo,"https://pbs.twimg.com/media/Gjb0BRQWoAAnH4W.jpg,https://pbs.twimg.com/media/Gjb0BouWMAAO9en.jpg"
'1888724085963657542',"Every year, #SuperBowl Sunday unites the country 🏈
 
No matter who you support today, eat some good food &amp; spend time with your loved ones as we watch some great football ‼️",en,Tweet,0,8,0,6,969,2025-02-09 22:58:07,"<a href=""http://www.oneupapp.io"" rel=""nofollow"">OneUp App</a>",#SuperBowl,,,
'1888627923030028636',"Teachers, #ValentinesForVets allows our students in NJ-5 to thank our veterans for their service. Send your students’ letters to one of my District Offices!

Our vets &amp; active-duty service members always have our backs, and I’ll always have theirs in Congress. https://t.co/bZPDs3HXqm",en,Tweet,0,8,3,25,1011,2025-02-09 16:36:00,"<a href=""https://mobile.twitter.com"" rel=""nofollow"">Twitter Web App</a>",#ValentinesForVets,,photo,https://pbs.twimg.com/media/GjR_NXGWUAA-5HE.jpg
'1888307561465577844',"I won’t let extremists play games with the education and futures of our children.

President Trump’s move to kill the Department of Education is insane and against our Jersey Values. https://t.co/cSkT6p6KSA",en,Tweet,0,20,3,53,2130,2025-02-08 19:23:00,"<a href=""https://mobile.twitter.com"" rel=""nofollow"">Twitter Web App</a>",,,video,https://video.twimg.com/ext_tw_video/1888271283072245760/pu/vid/avc1/720x720/4NBHJzd_qNqiTDe6.mp4?tag=12
'1888284695613370610',"Relieved that three more hostages are being reunited with their families and loved ones today. I won’t stop fighting until we free all the hostages, including the Americans.
https://t.co/zMDxRZlfrv",en,Tweet,0,25,2,22,2774,2025-02-08 17:52:08,"<a href=""http://www.oneupapp.io"" rel=""nofollow"">OneUp App</a>",,https://www.bbc.com/news/articles/c4g9vyz747eo,,
'1888268088606364081',My Affordability Agenda for Jersey will help families afford the crushing cost of childcare in three steps 📚👇 https://t.co/NZLlDxysJX,en,Tweet,0,2,1,20,934,2025-02-08 16:46:09,"<a href=""http://www.oneupapp.io"" rel=""nofollow"">OneUp App</a>",,,photo,https://pbs.twimg.com/media/GjR50fyXgAAugw2.jpg
'1888021793891311753',"Banning DeepSeek from US government devices shouldn’t be controversial — it's common sense.

The app is already banned by the @USNavy and the governments of Taiwan, Italy, and Australia. We must move swiftly to protect our national security and stand up to the CCP. https://t.co/I9D5Jl9YX5",en,Tweet,1,8,2,28,1627,2025-02-08 00:27:28,"<a href=""http://twitter.com/download/iphone"" rel=""nofollow"">Twitter for iPhone</a>",,,video,https://video.twimg.com/amplify_video/1888021677155528704/vid/avc1/1280x720/b5ZN0LfF1vkjbDG3.mp4?tag=16
'1887966613707653543',"Great meeting with @njfop to discuss the problems facing our first responders in Jersey.

As Co-Chair of the Law Enforcement Caucus, I’ll always have the backs of our first responders, just as they’ve always had our backs. https://t.co/sM05IuEHnd",en,Tweet,0,3,2,22,979,2025-02-07 20:48:12,"<a href=""https://mobile.twitter.com"" rel=""nofollow"">Twitter Web App</a>",,,photo,https://pbs.twimg.com/media/GjNnKxwWkAAx5a_.jpg
'1887852114589671625',"China keeps trying to steal Americans’ data. Their newest target: Jersey families.

@NJTurnpike toll booths are set to be owned by TransCore, with links to the Chinese Communist Party. We cannot allow our personal information and whereabouts to get into the hands of our number one adversary.",en,Tweet,1,3,2,12,929,2025-02-07 13:13:13,"<a href=""https://mobile.twitter.com"" rel=""nofollow"">Twitter Web App</a>",,,,
'1887698306228240413',https://t.co/EgLB7dX9yh,zxx,Tweet,0,36,6,35,3924,2025-02-07 03:02:02,"<a href=""http://www.oneupapp.io"" rel=""nofollow"">OneUp App</a>",,,photo,https://pbs.twimg.com/media/GjJzmz9WUAAmS7D.jpg
'1887673843906716133',"We’ve seen China’s playbook stealing American’s data before, and they are trying to do it again with DeepSeek.

My new legislation, “No DeepSeek on Government Devices Act,” will protect our national security and ensure the CCP can’t infiltrate our government devices & data.
https://t.co/nOJdy5rbwo",en,Tweet,0,4,1,16,1391,2025-02-07 01:24:50,"<a href=""https://mobile.twitter.com"" rel=""nofollow"">Twitter Web App</a>",,,,
'1887586968059478133',"DeepSeek is collecting the sensitive data of American citizens and sending it directly to the Chinese Communist Party — a national security threat.

That's why I’m introducing bipartisan legislation to immediately ban DeepSeek from all US gov devices.
https://t.co/bNlGZogu4O",en,Tweet,0,7,2,11,859,2025-02-06 19:39:37,"<a href=""http://www.oneupapp.io"" rel=""nofollow"">OneUp App</a>",,https://www.wsj.com/tech/ai/lawmakers-push-to-ban-deepseek-app-from-u-s-government-devices-6a76151a,,
'1887568902596796791',"We can’t stand idly by as protesters call for the death of Jews.

I successfully fought to pass the Antisemitism Awareness Act out of the House last year with overwhelming bipartisan support, just for the Senate to refuse to act on it.  I’m bringing the fight back to ensure it becomes law.",en,Tweet,0,7,2,17,1187,2025-02-06 18:27:50,"<a href=""http://twitter.com/download/iphone"" rel=""nofollow"">Twitter for iPhone</a>",,,video,https://video.twimg.com/amplify_video/1887568777425891329/vid/avc1/1264x712/dE0HvgFIeEnhjxnJ.mp4?tag=16
'1887242325304254871',"Jersey families are already struggling to make ends meet.
 
Trump’s new 25% tariff on all imports from Mexico and Canada will only make things worse. Families who are already hurting will be hit the hardest.",en,Tweet,0,6,1,23,1451,2025-02-05 20:50:08,"<a href=""http://www.oneupapp.io"" rel=""nofollow"">OneUp App</a>",,,,
'1887220183833415976',"My LITTLE Act will help Jersey families afford one of their biggest expenses:
 
✅Increase the Child &amp; Dependent Care Tax Credit to $7.5K for one child &amp; $15K for 2 or more.
✅Lower childcare costs for families.
✅Decreases barriers to open childcare centers.",en,Tweet,0,2,1,13,1166,2025-02-05 19:22:09,"<a href=""http://www.oneupapp.io"" rel=""nofollow"">OneUp App</a>",,,,
'1887135304529678383',"I’m glad to see that @united is resuming non-stop flights to Tel Aviv from @EWRairport, which I have been urging them to do for months.
 
NJ will once again be just one non-stop flight away from our families and friends in Israel.",en,Tweet,2,29,1,15,6413,2025-02-05 13:44:52,"<a href=""http://www.oneupapp.io"" rel=""nofollow"">OneUp App</a>",,,,
'1886867197898719486',"That’s why I’m also joining countless leaders across the country to make it clear to President Trump that he can’t just shut down @usedgov.

We just can’t let far-right extremists deny what our families need.",en,Reply,1,1,2,11,744,2025-02-04 19:59:30,"<a href=""https://mobile.twitter.com"" rel=""nofollow"">Twitter Web App</a>",,,,
'1886867196934070350',There’s nothing partisan about investing in our childcare and our children’s futures.,en,Reply,0,0,0,6,736,2025-02-04 19:59:30,"<a href=""https://mobile.twitter.com"" rel=""nofollow"">Twitter Web App</a>",,,,
'1886867195705040954',"Third, ahead of the government funding deadline next month, I’m writing a letter to congressional leadership &amp; the Appropriations Committee stressing the importance of childcare funding and urging them to commit to not cutting a single dime of any childcare-related funding.",en,Reply,0,0,0,1,86,2025-02-04 19:59:30,"<a href=""https://mobile.twitter.com"" rel=""nofollow"">Twitter Web App</a>",,,,
'1886867194673311959',My bill also creates a tax credit for start-up childcare centers to lower childcare costs &amp; boost entrepreneurship for small business owners.,en,Reply,0,0,0,1,69,2025-02-04 19:59:30,"<a href=""https://mobile.twitter.com"" rel=""nofollow"">Twitter Web App</a>",,,,
'1886867193595367653',"Second, I’m reintroducing the LITTLE Act, which will increase the Child &amp; Dependent Care Tax Credit to $7.5K for one child and $15K for two or more.",en,Reply,0,0,0,1,86,2025-02-04 19:59:29,"<a href=""https://mobile.twitter.com"" rel=""nofollow"">Twitter Web App</a>",,,,
'1886867192563552745',"This legislation will make payments available every month, so families don’t have to wait until the end of the year for support.

It also includes a “baby bonus,” which gives an additional $2,000 to new families, regardless of when their child was born.",en,Reply,0,0,0,1,62,2025-02-04 19:59:29,"<a href=""https://mobile.twitter.com"" rel=""nofollow"">Twitter Web App</a>",,,,
'1886867191133561255',"First, I’m sponsoring legislation to expand the Child Tax Credit to $300 per month, or $3,600 per year. This is up from $2,000 per year for children ages 6 to 17.

If your child is under the age of 6, that amount will increase to $360 a month or $4,320 a year.",en,Reply,0,0,0,2,90,2025-02-04 19:59:29,"<a href=""https://mobile.twitter.com"" rel=""nofollow"">Twitter Web App</a>",,,,
'1886867188780556763',"🧵Childcare is one of the biggest expenses for Jersey families — costing up to 50% of their monthly budget.

That’s why I’m announcing new actions as part of my Affordability Agenda for Jersey — to make childcare more affordable & put $$$ back into hardworking Jersey families’ pockets.",en,Tweet,1,3,0,13,1462,2025-02-04 19:59:28,"<a href=""https://mobile.twitter.com"" rel=""nofollow"">Twitter Web App</a>",,,photo,"https://pbs.twimg.com/media/Gi9_L29XsAAeZQB.jpg,https://pbs.twimg.com/media/Gi9_TnlXwAEj3tR.jpg"
'1886853361229574333',"From day one, I’ve been clear — while the reported drone activity doesn’t pose a national security threat, Jersey families deserve answers.

The FAA must provide them. https://t.co/kwSdOwvCKq",en,Tweet,0,2,1,8,988,2025-02-04 19:04:32,"<a href=""http://www.oneupapp.io"" rel=""nofollow"">OneUp App</a>",,,video,https://video.twimg.com/ext_tw_video/1886853283727192065/pu/vid/avc1/640x360/dH_w8V7ku8xwyUVa.mp4?tag=12
'1886808937158107293',"Jersey families are already struggling to make ends meet.

Trump’s new 25% tariff on all imports from Mexico and Canada will only make things worse. Families who are already hurting will be hit the hardest.",en,Tweet,0,3,2,17,1412,2025-02-04 16:08:00,"<a href=""https://mobile.twitter.com"" rel=""nofollow"">Twitter Web App</a>",,,,
'1886788301044031911',"Don’t be fooled: Tariffs are just taxes on our families and businesses.

Trump’s reckless tariffs will cost Jersey families an extra $830 a year.",en,Tweet,0,6,0,9,1661,2025-02-04 14:46:00,"<a href=""https://mobile.twitter.com"" rel=""nofollow"">Twitter Web App</a>",,,,
'1886617889395880276',"During the “Summers of Hell,” Jersey families faced endless, hours-long delays on @NJTRANSIT &amp; @Amtrak.

That’s why I introduced the All Aboard Act, which guarantees passengers receive full, automatic refunds when trains are canceled or delayed.
https://t.co/JzCOx07wlP",en,Tweet,0,4,1,9,941,2025-02-04 03:28:51,"<a href=""https://mobile.twitter.com"" rel=""nofollow"">Twitter Web App</a>",,https://www.nj.com/news/2025/02/summer-of-hell-amtrak-nj-transit-problems-inspire-bills-to-give-commuters-refunds.html,,
'1886545380914970821',"I’m so relieved that Keith Siegel is finally home.  Now, we must work to free every hostage from the Hamas terrorists — including my constituent, Edan Alexander.
https://t.co/0GrEzbYA9h",en,Tweet,0,78,10,11,7279,2025-02-03 22:40:43,"<a href=""https://mobile.twitter.com"" rel=""nofollow"">Twitter Web App</a>",,https://www.jns.org/white-house-members-of-congress-celebrate-release-of-keith-siegel-israelis/,,
'1886511476460150931',"What do Trump’s new tariffs mean for Jersey families?

Prices on 🥑🍅🫑🥒🍓🍋🥭🐄🍗 will all ⬆️

Tariffs are just TAXES that will hurt Jersey families.
https://t.co/L869NrcLnQ",en,Tweet,0,5,3,35,1054,2025-02-03 20:26:00,"<a href=""https://mobile.twitter.com"" rel=""nofollow"">Twitter Web App</a>",,https://www.axios.com/2025/02/03/trump-tariffs-mexico-canada-china-cost,,
'1886490395212697737',"Shutting down @USAID is disastrous for our national security &amp; will only strengthen our adversaries, like China.
 
USAID provides critical humanitarian aid around the world — pulling the plug will lead to a weaker America on the world stage. https://t.co/9xXUspbh5h",en,Tweet,0,18,5,35,1658,2025-02-03 19:02:14,"<a href=""http://www.oneupapp.io"" rel=""nofollow"">OneUp App</a>",,,photo,https://pbs.twimg.com/media/Gi4pBJqWAAAR6zU.jpg
'1886184697799090345',"I won’t let higher costs pull up a seat at the kitchen table &amp; steal from our families — my Affordability Agenda will help lower prices for Jersey families.
https://t.co/JdToZdQKjS",en,Tweet,0,4,0,15,940,2025-02-02 22:47:30,"<a href=""http://www.oneupapp.io"" rel=""nofollow"">OneUp App</a>",,https://patch.com/new-jersey/montclair/if-trump-won-t-lower-grocery-prices-we-will-nj-democrats-say,,
'1886073491167834389',"Jersey deserves better, and I will keep fighting to protect your pocketbooks, lower costs, and make life more affordable.",en,Reply,0,7,1,4,930,2025-02-02 15:25:36,"<a href=""https://mobile.twitter.com"" rel=""nofollow"">Twitter Web App</a>",,,,
'1886073490010251722',"Who will suffer most? American consumers — who will face skyrocketing prices on everything from groceries to gas to cars. 

Families who are already hurting will be hit hardest.",en,Reply,0,6,2,10,1029,2025-02-02 15:25:36,"<a href=""https://mobile.twitter.com"" rel=""nofollow"">Twitter Web App</a>",,,,
'1886073488940671462',"Middle class families are already struggling to make ends meet with the high cost of everyday goods. 

Instead of offering a real plan to lower costs, the President is making things worse by slapping a 25% tariff on our closest trading partners, Mexico and Canada.",en,Reply,0,2,0,3,355,2025-02-02 15:25:35,"<a href=""https://mobile.twitter.com"" rel=""nofollow"">Twitter Web App</a>",,,,
'1886073487913066708',"President Trump just whacked Jersey families with a NEW $830 A YEAR TAX.

It’s utterly absurd. 🧵",en,Tweet,0,38,6,16,3357,2025-02-02 15:25:35,"<a href=""https://mobile.twitter.com"" rel=""nofollow"">Twitter Web App</a>",,,,
'1885826253799752144',"Happy Black History Month! This month, and every month, we celebrate the incredible contributions of Jersey’s Black community across NJ-5.",en,Tweet,0,6,1,5,1416,2025-02-01 23:03:10,"<a href=""http://www.oneupapp.io"" rel=""nofollow"">OneUp App</a>",,,,
'1885753616427868296',"🧂 = State + And + Local + Tax

Full SALT Deduction &gt; SALT Cap",en,Tweet,0,5,1,4,1130,2025-02-01 18:14:32,"<a href=""http://www.oneupapp.io"" rel=""nofollow"">OneUp App</a>",,,,
'1885751922000273468',"Reports that the Administration is considering firing thousands of nonpartisan FBI investigators are outrageous.

Law enforcement must remain independent.

As Co-Chair of the Law Enforcement Caucus, I will always get the backs of the brave men &amp; women who keep us safe.",en,Tweet,0,3,2,0,1235,2025-02-01 18:07:48,"<a href=""https://mobile.twitter.com"" rel=""nofollow"">Twitter Web App</a>",,,,
'1885718203650748481',"After 484 days of unimaginable suffering in captivity, 3 more hostages, including Keith Siegel, a 65 year old American-Israeli citizen, are back with their loved ones.

We won’t rest until we bring all the hostages, including all of the Americans and my constituent, Edan Alexander, home.",en,Tweet,2,110,19,24,8196,2025-02-01 15:53:49,"<a href=""https://mobile.twitter.com"" rel=""nofollow"">Twitter Web App</a>",,,,
'1885500777185018287',"I'm closely monitoring reports of a small plane crash in NE Philly – and heartbroken to hear about casualties. 

Thank you to all our brave first responders on the scene. Praying for our neighbors across the river.",en,Tweet,0,4,0,9,1413,2025-02-01 01:29:50,"<a href=""https://mobile.twitter.com"" rel=""nofollow"">Twitter Web App</a>",,,,
'1885468779401867298',"The HEAL Act is crucial to ensuring we continue the fight against antisemitism in Jersey and around our country.

Our bipartisan, bicameral bill will make sure we never allow history to repeat itself.",en,Tweet,0,8,0,4,1944,2025-01-31 23:22:41,"<a href=""http://twitter.com/download/iphone"" rel=""nofollow"">Twitter for iPhone</a>",,,,
'1885444229725388954',"While middle class Jersey families are struggling with the high cost of groceries, as four main meat producers control 85% of the market — jacking up prices.

My bill will take on the meat monopolies and help lower food prices for Jersey families. https://t.co/HQ2vwEVV63",en,Tweet,0,6,0,3,982,2025-01-31 21:45:08,"<a href=""http://www.oneupapp.io"" rel=""nofollow"">OneUp App</a>",,,video,https://video.twimg.com/ext_tw_video/1885444111441842176/pu/vid/avc1/720x720/mmfqwWCFLMQLDZ0O.mp4?tag=12
'1885422239014621386',"I’ve always fought to fully fund crucial agencies like @FAANews and address the growing air traffic controller shortage.

We must ensure the FAA has the resources they need to keep our families and skies safe.",en,Reply,0,1,0,1,529,2025-01-31 20:17:45,"<a href=""https://mobile.twitter.com"" rel=""nofollow"">Twitter Web App</a>",,,,
'1885422238054130024',I’m also incredibly grateful to all the first responders who have been working tirelessly in the face of this disaster.,en,Reply,0,0,0,1,531,2025-01-31 20:17:45,"<a href=""https://mobile.twitter.com"" rel=""nofollow"">Twitter Web App</a>",,,,
'1885422237106294869',"As we pray for the victims and their families, we must also do everything in our power to ensure our air space is safe and that this tragedy can never happen again.",en,Reply,0,0,0,1,65,2025-01-31 20:17:45,"<a href=""https://mobile.twitter.com"" rel=""nofollow"">Twitter Web App</a>",,,,
'1885422236107968719',"While I continue to monitor the plane and helicopter collision over the Potomac, my heart goes out to all of the families who are impacted by this incredible loss.",en,Tweet,0,2,0,1,821,2025-01-31 20:17:45,"<a href=""https://mobile.twitter.com"" rel=""nofollow"">Twitter Web App</a>",,,,
'1885401987765743814',"NJ-5 has the most talented minds in the nation. I’m proud to congratulate Rachel Kim, our Congressional App Challenge winner🏆
 
Rachel created Particulate Prognostics, an app that predicts air pollution levels to protect those with respiratory conditions.
https://t.co/PIv61ydsnY",en,Tweet,0,3,1,1,652,2025-01-31 18:57:17,"<a href=""http://www.oneupapp.io"" rel=""nofollow"">OneUp App</a>",,https://wrnjradio.com/gottheimer-announces-2025-congressional-app-challenge-winner-creator-of-particulate-prognostics-app/,,
'1885347724335227098',"Every day, I hear the same thing from Jersey families: costs are TOO high.

My Affordability Agenda includes my Lower Grocery Prices Act — which would deliver critical relief to families struggling with everyday expenses by establishing a national plan to combat high prices.",en,Tweet,0,3,0,5,705,2025-01-31 15:21:40,"<a href=""http://www.oneupapp.io"" rel=""nofollow"">OneUp App</a>",,,,
'1885082576240382421',"Trump’s decision to pause nearly all foreign aid, including to our ally Ukraine, severely weakens our leadership on the world stage.

Our support for Ukraine is key to the fight against one of our greatest adversaries, Russia. We cannot let the Axis of Evil destabilize democracy.",en,Tweet,0,8,5,2,1254,2025-01-30 21:48:03,"<a href=""http://www.oneupapp.io"" rel=""nofollow"">OneUp App</a>",,,,
'1884981500292067455',"I won’t let higher costs pull up a seat at the kitchen table &amp; steal from our families — my Affordability Agenda will help lower prices for Jersey families.
https://t.co/JdToZdQKjS",en,Tweet,0,5,0,2,785,2025-01-30 15:06:25,"<a href=""http://www.oneupapp.io"" rel=""nofollow"">OneUp App</a>",,https://patch.com/new-jersey/montclair/if-trump-won-t-lower-grocery-prices-we-will-nj-democrats-say,,
'1884734975041278327',"For months, I have been calling on @FBI, @DHS, &amp; @FAA to publicly brief Jersey families on drone activity over our skies.
 
Transparency is essential, and Jersey deserves clear answers. https://t.co/SE3LXSY4Cn",en,Tweet,0,7,2,5,1162,2025-01-29 22:46:49,"<a href=""http://www.oneupapp.io"" rel=""nofollow"">OneUp App</a>",,,video,https://video.twimg.com/ext_tw_video/1884734911006859264/pu/vid/avc1/1280x720/wR7tfSgxz5rvqcNV.mp4?tag=12
