tweet_id,text,language,type,bookmark_count,favorite_count,retweet_count,reply_count,view_count,created_at,client,hashtags,urls,media_type,media_urls
'1920153867062264283',".@RepArrington is spot on.

The slow, politically managed fiscal decline of our nation is not what over 77 million Americans voted for.

I implore my @HouseGOP colleagues to take a stand and make the serious spending cuts needed to save future generations from our current unsustainable financial path.",en,Tweet,3,170,49,31,5329,2025-05-07 17:28:51,"<a href=""http://twitter.com/download/iphone"" rel=""nofollow"">Twitter for iPhone</a>",,,,
'1920126779181736432',"🚨TRUST BUT VERIFY!
The current situation with Iran is extremely dynamic—the U.S. must stay vigilant.

REP. KEITH SELF: “We need to make sure that we continue to monitor what Iran is doing. Actions speak louder than words when it comes to Iran.” https://t.co/vEOPuV3F6Z",en,Tweet,0,17,4,6,957,2025-05-07 15:41:13,"<a href=""http://twitter.com/download/iphone"" rel=""nofollow"">Twitter for iPhone</a>",,,video,https://video.twimg.com/amplify_video/1920126704321753088/vid/avc1/886x494/bA2sLsLmv5o5zju0.mp4?tag=16
'1919813507681333393',"The American people continue to rack up wins as the playing field of trade is leveled.

#USA🇺🇸",en,Tweet,1,32,5,6,1156,2025-05-06 18:56:23,"<a href=""http://twitter.com/download/iphone"" rel=""nofollow"">Twitter for iPhone</a>",#USA,,,
'1919779055177433359',"Since taking office, President Trump has brought home 47 Americans detained overseas, fulfilling his promise to leave no one behind. Under Biden, Americans were left defenseless; under Trump, they’re welcomed home!",en,Tweet,1,51,15,5,1598,2025-05-06 16:39:29,"<a href=""http://twitter.com/download/iphone"" rel=""nofollow"">Twitter for iPhone</a>",,,,
'1919778467698151689',"The influence of a good teacher can never be erased. 

Our TX-3 educators are dedicated to teaching skills including Science, Technology, Engineering and Mathematics (STEM) needed to excel in a complex world. 

Happy National Teacher Appreciation Day! https://t.co/sjZNXEcDaz",en,Tweet,0,6,1,0,481,2025-05-06 16:37:09,"<a href=""http://twitter.com/download/iphone"" rel=""nofollow"">Twitter for iPhone</a>",,,photo,https://pbs.twimg.com/media/GqRsV1kWsAABnp8.jpg
'1919777253619069095',"Conservatives support assistance for those in need, including pregnant women and children.

Republicans are working to preserve safety net programs while enacting meaningful reforms. 

Thank you @RepArrington for breaking down the facts and exposing the lies of the left! https://t.co/Y1faqEtwRY",en,Tweet,0,12,2,4,947,2025-05-06 16:32:19,"<a href=""http://twitter.com/download/iphone"" rel=""nofollow"">Twitter for iPhone</a>",,,video,https://video.twimg.com/amplify_video/1919777179849674752/vid/avc1/480x264/4n_kmGPLoyn5VoZ8.mp4?tag=16
'1918806745620644005',Sovereignty beating out journalism is so 2025,en,Tweet,0,80,15,16,2504,2025-05-04 00:15:52,"<a href=""http://twitter.com/download/iphone"" rel=""nofollow"">Twitter for iPhone</a>",,,,
'1918396578366464205',"JOBS JOBS JOBS 🇺🇸

President Trump continues crushing expectations! In April, 177,00 jobs were added including:

✅ Over 70,000 private education and health services jobs 
✅ Over 29,000 transportation and warehousing jobs
✅ Over 24,000 leisure and hospitality jobs
✅ Over 14,000 finance jobs",en,Tweet,1,23,8,9,851,2025-05-02 21:06:01,"<a href=""http://twitter.com/download/iphone"" rel=""nofollow"">Twitter for iPhone</a>",,,,
'1918361688044187875',"You left out the fact that over 77 million Americans voted to clean out the waste, fraud, and abuse from our government.

The U.S. Government Accountability Office found that this program provided assistance $$ to thousands of applicants who were DEAD!

👉 https://t.co/BEYqOwQ0dl",en,Tweet,0,32,7,13,1293,2025-05-02 18:47:22,"<a href=""http://twitter.com/download/iphone"" rel=""nofollow"">Twitter for iPhone</a>",,https://www.gao.gov/assets/gao-10-621-highlights.pdf,,
'1918360689510432786',"President Trump announced his non-defense discretionary budget plan with $163 BILLION in savings. 

The Swamp hates losing your taxpayer dollars. Expect many Establishment tears to flow! 

Keep it up, Mr. President! 🇺🇸",en,Tweet,2,102,25,22,3619,2025-05-02 18:43:24,"<a href=""http://twitter.com/download/iphone"" rel=""nofollow"">Twitter for iPhone</a>",,,,
'1918311046345097310',"Obamacare drastically expanded Medicaid far outside its intended recipients.

Today, able-bodied adults are on track to become the largest subgroup on Medicaid.

👉Congress must put an end to this abuse of taxpayer dollars immediately.",en,Tweet,1,270,89,43,7535,2025-05-02 15:26:08,"<a href=""http://twitter.com/download/iphone"" rel=""nofollow"">Twitter for iPhone</a>",,,,
'1918049209657508163',"Thanks @AlexEpstein.

I’m proud to stand with this group of fellow patriots fighting to repeal Biden’s reckless green energy subsides.

@HouseGOP must stop funding this anti-energy nonsense.",en,Tweet,0,122,22,6,15305,2025-05-01 22:05:41,"<a href=""http://twitter.com/download/iphone"" rel=""nofollow"">Twitter for iPhone</a>",,,,
'1917995468501741675',"Prayer is the voice of faith, and there is great power in unified prayer. On this National Day of Prayer, I invite my constituents, colleagues, family, and friends to join me in lifting up our great nation and honoring our almighty Creator. 🙏

""Do not be anxious about anything, but in every situation, by prayer and petition, with thanksgiving, present your requests to God. And the peace of God, which transcends all understanding, will guard your hearts and your minds in Christ Jesus.""– Philippians 4:6–7 (NIV)",en,Tweet,0,25,5,10,800,2025-05-01 18:32:08,"<a href=""http://twitter.com/download/iphone"" rel=""nofollow"">Twitter for iPhone</a>",,,photo,https://pbs.twimg.com/media/Gp4WtpmXQAAaqKJ.jpg
'1917986772170027161',"Democrats want dead people to get social security benefits. 

Democrats want illegal aliens to get free housing.

Democrats want healthy able-bodied adults to collect Medicaid checks.",en,Tweet,0,73,22,25,2259,2025-05-01 17:57:35,"<a href=""http://twitter.com/download/iphone"" rel=""nofollow"">Twitter for iPhone</a>",,,,
'1917684322787639776',"Thank you for shedding light on this issue @SecKennedy. I’m not popular with Big Soda right now either! 🥤💵

I’ve introduced the FIZZ-NO Act, which would remove funding for sodas from SNAP. I hope to see this legislation passed!",en,Tweet,2,44,6,7,1550,2025-04-30 21:55:46,"<a href=""http://twitter.com/download/iphone"" rel=""nofollow"">Twitter for iPhone</a>",,,,
'1917675079665869023',"The @DOGE team reported that @SocialSecurity combed through their records and marked 11 MILLION numberholders above the age of 120+ as deceased.

Congress needs to enact a similar cleanup with Medicaid. Americans are cutting checks for an est. 24.6 MILLION able-bodied adults.",en,Tweet,0,22,3,6,1260,2025-04-30 21:19:02,"<a href=""http://twitter.com/download/iphone"" rel=""nofollow"">Twitter for iPhone</a>",,,,
'1917372047325553079',This is the same fake news media that refused to cover the fact that Joe Biden created a Silk Road for child traffickers by opening our southern border for 4 years — “losing” HUNDREDS OF THOUSANDS of unaccompanied migrant children.,en,Tweet,1,53,10,20,2227,2025-04-30 01:14:53,"<a href=""http://twitter.com/download/iphone"" rel=""nofollow"">Twitter for iPhone</a>",,,,
'1917319721935941966',"Since taking office in January, President Trump has created 345,000 JOBS! 

Mr. President, this is what over 77 million Americans signed up for. 🚀🙌🇺🇸",en,Tweet,1,58,10,17,1405,2025-04-29 21:46:58,"<a href=""http://twitter.com/download/iphone"" rel=""nofollow"">Twitter for iPhone</a>",,,,
'1917318216218509790',"100 days of BORDER WINS under President Donald Trump 💪🇺🇸

✅ Launched the largest deportation operation in U.S. history
✅ Over 100,000 illegal aliens deported 
✅ Ended Catch and Release
✅ Construction of southern border wall restarted
✅ Signed executive order ending birthright citizenship for the children of illegal aliens
✅ Biden’s CBP One App is now the CBP Home App, allowing illegal aliens to self-deport 
✅ Signed executive order calling for the death penalty for any illegal alien that kills an American citizen or law enforcement officer",en,Tweet,1,13,1,3,1262,2025-04-29 21:40:59,"<a href=""http://twitter.com/download/iphone"" rel=""nofollow"">Twitter for iPhone</a>",,,,
'1917317495272153133',"TEXAS has been chosen as the new hub for Stargate’s FIRST data center project. 

President Trump’s initiative to BOOST AI infrastructure is going to thrive in the Lone Star State! 🇺🇸

https://t.co/ruVxds1w9t",en,Tweet,0,16,1,5,622,2025-04-29 21:38:07,"<a href=""http://twitter.com/download/iphone"" rel=""nofollow"">Twitter for iPhone</a>",,https://spectrumlocalnews.com/tx/south-texas-el-paso/news/2025/01/25/stargate-s-first-data-center-to-be-built-in-texas,,
'1917252730399138159',"President Trump’s first 100 days embody the spirit of leadership, strength, and America First values. 

By upholding Reagan’s legacy of peace through strength, he fights to secure our nation and defend our freedoms. 

Thank you, @realDonaldTrump! 🇺🇸 https://t.co/QkFtSExi9d",en,Tweet,1,112,23,23,6770,2025-04-29 17:20:46,"<a href=""http://twitter.com/download/iphone"" rel=""nofollow"">Twitter for iPhone</a>",,,photo,https://pbs.twimg.com/media/GptzMqYXcAAKMS9.jpg
'1917246873070428195',"President Trump is delivering TEXAS SIZED WINS for American investment!

Check out the new plans for a 250,000 sq ft AI server manufacturing facility in Houston👇

https://t.co/47yVi2qDVF",en,Tweet,1,9,2,3,843,2025-04-29 16:57:29,"<a href=""http://twitter.com/download/iphone"" rel=""nofollow"">Twitter for iPhone</a>",,https://odsc.medium.com/apple-to-open-ai-server-factory-in-texas-as-part-of-500-billion-u-s-investment-748e8a417526,,
'1917244283301884356',"In just 100 days, President Trump has pursued and secured major American investments, delivering on his promises to the American people. 

The America First agenda is revitalizing industries, creating jobs, and strengthening our nation! 🇺🇸

📈 Stargate Project: $500B partnership for data centers and energy infrastructure across the U.S.
🚗 Hyundai: $21B investment in U.S. car manufacturing
📱 Apple: $500B U.S. investment",en,Tweet,0,26,3,6,1496,2025-04-29 16:47:12,"<a href=""http://twitter.com/download/iphone"" rel=""nofollow"">Twitter for iPhone</a>",,,,
'1916942760965271583',"“We will close the border. We will stop the invasion of illegals into our country.” — DJT, October 11, 2024

When President Trump makes a promise, HE KEEPS IT! 🇺🇸 

100 Days In:
✅Launched the largest deportation operation in U.S. history
✅Over 100,000 illegal aliens deported
✅Border crossings at an all-time low
✅655% spike in arrests of terrorists 
✅Catch and release ended
✅Violent terrorist gang members deported to El Salvador",en,Tweet,1,23,3,13,898,2025-04-28 20:49:03,"<a href=""http://twitter.com/download/iphone"" rel=""nofollow"">Twitter for iPhone</a>",,,,
'1916919856462446694',"This is despicable.

CNN is the propaganda arm of designated foreign terrorists.",en,Tweet,2,90,19,22,2305,2025-04-28 19:18:03,"<a href=""http://twitter.com/download/iphone"" rel=""nofollow"">Twitter for iPhone</a>",,,,
'1915854055563206733',"Accountability is here. 

Thank you @FBIDirectorKash. 🇺🇸",en,Tweet,1,271,44,33,3649,2025-04-25 20:42:56,"<a href=""http://twitter.com/download/iphone"" rel=""nofollow"">Twitter for iPhone</a>",,,,
'1915522093355274711',"🚨The Crown Jewel of Reconciliation: THE TRUMP TAX CUTS!

If the Trump-era tax cuts expire, the bottom tax bracket jumps from 10% to 15%. American families are relying on Congress to quickly extend! https://t.co/1RtEs8Xtc9",en,Tweet,0,24,5,10,1202,2025-04-24 22:43:50,"<a href=""http://twitter.com/download/iphone"" rel=""nofollow"">Twitter for iPhone</a>",,,video,https://video.twimg.com/amplify_video/1915522025063432192/vid/avc1/886x458/nOn3qRrdFbspcZq-.mp4?tag=16
'1915516905873445125',"On National Holocaust Days of Remembrance, we honor the memory of the six million Jews who perished in the Holocaust and recognize the resilience of the survivors who carry their stories forward.

""Never Again"" is more than a phrase—it’s a responsibility. https://t.co/x99ntni0sZ",en,Tweet,0,28,8,11,1123,2025-04-24 22:23:13,"<a href=""http://twitter.com/download/iphone"" rel=""nofollow"">Twitter for iPhone</a>",,,photo,https://pbs.twimg.com/media/GpVIeTWWAAAkK5g.jpg
'1915145345962553500',Looking forward to joining Washington Watch today at the top of the 5:00pm ET hour!🇺🇸,en,Tweet,0,8,2,6,1847,2025-04-23 21:46:46,"<a href=""http://twitter.com/download/iphone"" rel=""nofollow"">Twitter for iPhone</a>",,,,
'1915080025428132242',"🚨Rep. Keith Self: Democrats are bent on self-destruction.

@CSalcedoShow is correct.
Democrats are completely out of touch with their constituents by continuing their field trips to El Salvador to visit violent gangsters. It’s astounding. https://t.co/v7UrBGAPwg",en,Tweet,2,82,24,31,2474,2025-04-23 17:27:13,"<a href=""http://twitter.com/download/iphone"" rel=""nofollow"">Twitter for iPhone</a>",,,video,https://video.twimg.com/amplify_video/1915079963364986880/vid/avc1/1066x598/R1wwayLkOsEFTeI5.mp4?tag=16
'1915056182085165436',"When you hear Democrats lie about the “Maryland Man,” smear Pete Hegseth, or equate voter ID with voter suppression, remember that these are the same people who engaged in one of the greatest coverups in American history—the cognitive decline of Joe Biden.",en,Tweet,0,48,14,7,1561,2025-04-23 15:52:28,"<a href=""http://twitter.com/download/iphone"" rel=""nofollow"">Twitter for iPhone</a>",,,,
'1915048634565230729',"Spending cuts around the edges won’t save America from financial collapse. 

Congress must make the significant spending cuts America needs.",en,Tweet,0,220,30,77,3707,2025-04-23 15:22:29,"<a href=""http://twitter.com/download/iphone"" rel=""nofollow"">Twitter for iPhone</a>",,,,
'1914760995412598860',Looking forward to joining The Chris Salcedo Show @ 4:00pm ET on Newsmax! 🇺🇸 https://t.co/SsUYSXrOxR,en,Tweet,0,10,0,7,813,2025-04-22 20:19:30,"<a href=""http://twitter.com/download/iphone"" rel=""nofollow"">Twitter for iPhone</a>",,,photo,https://pbs.twimg.com/media/GpKY-TvXgAAq7fC.jpg
'1914740239954010155',"Agreed. The Trump administration is making huge gains in the American education system by restoring parental rights and returning education to the states.

Congress must make significant cuts to government spending.",en,Tweet,1,41,7,9,2953,2025-04-22 18:57:02,"<a href=""http://twitter.com/download/iphone"" rel=""nofollow"">Twitter for iPhone</a>",,,,
'1914680498980336122',"It’s no coincidence that the man chosen by President Trump to restore our U.S. military is now facing a siege of smears.

The Pentagon Swamp is very deep.

Keep fighting @SecDef. 🇺🇸",en,Tweet,19,4629,830,323,27871,2025-04-22 14:59:38,"<a href=""http://twitter.com/download/iphone"" rel=""nofollow"">Twitter for iPhone</a>",,,,
'1914678369393705255',Yes.,qst,Tweet,0,50,5,11,1780,2025-04-22 14:51:10,"<a href=""http://twitter.com/download/iphone"" rel=""nofollow"">Twitter for iPhone</a>",,,,
'1914447347318219000',"How many other rogue judges are harboring Tren de Aragua gang members?

“A New Mexico judge resigned from the bench after an alleged Tren de Aragua gang member was arrested at his home.”

https://t.co/twvEK4EKA4",en,Tweet,3,110,23,22,1890,2025-04-21 23:33:10,"<a href=""http://twitter.com/download/iphone"" rel=""nofollow"">Twitter for iPhone</a>",,https://www.foxnews.com/us/new-mexico-judge-resigns-after-alleged-tda-member-arrested-his-home,,
'1914427917943390441',"I’ll never stop fighting to rein in government spending.

Our soaring national debt threatens American families, American pocketbooks, and American sovereignty.

To save America, we must slash the spending.",en,Tweet,0,112,17,27,1820,2025-04-21 22:15:58,"<a href=""http://twitter.com/download/iphone"" rel=""nofollow"">Twitter for iPhone</a>",,,,
'1914427104046858327',"This is where we are in 2025…

The Left will do anything to tear away parental rights.",en,Tweet,2,42,10,13,1595,2025-04-21 22:12:44,"<a href=""http://twitter.com/download/iphone"" rel=""nofollow"">Twitter for iPhone</a>",,,,
'1914427007527436545',"The Trump administration took another terrorist off our streets! 🇺🇸

Will Democrats buy plane tickets to visit Harpreet Singh? 👇
 
“Harpreet Singh is wanted in India for his terror links, including allegedly planning more than a dozen grenade attacks on police officials”",en,Tweet,1,41,11,7,1562,2025-04-21 22:12:21,"<a href=""http://twitter.com/download/iphone"" rel=""nofollow"">Twitter for iPhone</a>",,,,
'1914381993871032385',"This poll has to be devastating to Sen. Hollen and other DeMS-13 members. 

Americans overwhelmingly support the enforcement of U.S. immigration law!",en,Tweet,3,197,60,31,4075,2025-04-21 19:13:29,"<a href=""http://twitter.com/download/iphone"" rel=""nofollow"">Twitter for iPhone</a>",,,,
'1914366764185764213',"On this day in 1836, Texan forces led by General Sam Houston changed the course of history in just 18 minutes at the Battle of San Jacinto. 

Their courage secured Texas' independence and carved the path for the Lone Star Republic. Today, we honor their bravery and the enduring spirit of Texas. Happy San Jacinto Day!",en,Tweet,0,28,5,2,737,2025-04-21 18:12:58,"<a href=""http://twitter.com/download/iphone"" rel=""nofollow"">Twitter for iPhone</a>",,,photo,https://pbs.twimg.com/media/GpEybS3WcAAJIAh.jpg
'1914333448006672588',"Our hearts are extremely heavy today as we pray for the recovery of our dear friend, Denton County Commissioner Bobbie Mitchell, and mourn for the loss of her husband, Fred Mitchell. It’s hard to even comprehend this heartbreaking news. Please join Tracy and me in lifting Bobbie and the entire Mitchell family in prayer—for healing, strength, and comfort during this unimaginable time.",en,Tweet,0,22,3,1,1526,2025-04-21 16:00:35,"<a href=""http://twitter.com/download/iphone"" rel=""nofollow"">Twitter for iPhone</a>",,,,
'1913946130661966190',"On Easter, this joyful and holy day, my office wishes you and your family hope and joy. HE IS RISEN!

""He is not here, for he has risen, as he said. Come, see the place where he lay."" - Matthew 28:6 https://t.co/XgLuePyYDS",en,Tweet,0,107,9,18,1652,2025-04-20 14:21:31,"<a href=""http://twitter.com/download/iphone"" rel=""nofollow"">Twitter for iPhone</a>",,,photo,https://pbs.twimg.com/media/Go-z3NRWYAAFFD1.jpg
'1913225073680372183',"Wishing everyone a blessed Good Friday, as we reflect on the sacrifice and love shown through the crucifixion of Jesus Christ.

“He himself bore our sins in his body on the tree, that we might die to sin and live to righteousness. By his wounds you have been healed.” - 1 Peter 2:24",en,Tweet,1,55,6,14,1712,2025-04-18 14:36:18,"<a href=""http://twitter.com/download/iphone"" rel=""nofollow"">Twitter for iPhone</a>",,,photo,https://pbs.twimg.com/media/Go0kEHQWEAAS4Be.jpg
'1912901109267431749',Beautiful to see. God Bless America.,en,Tweet,1,91,17,10,2600,2025-04-17 17:08:59,"<a href=""http://twitter.com/download/iphone"" rel=""nofollow"">Twitter for iPhone</a>",,,,
'1912618189738901960',Important information here on the “Maryland Man” that Sen. @ChrisVanHollen wants to bring back to America 👇,en,Tweet,3,54,22,13,3162,2025-04-16 22:24:45,"<a href=""http://twitter.com/download/iphone"" rel=""nofollow"">Twitter for iPhone</a>",,,,
'1912598123433676846',"Couldn’t pick up the phone for the family of Rachel Morin.

Holds a press conference for the return of an MS-13 gang member. 

This is the Democrat Party.",en,Tweet,1,178,49,23,4750,2025-04-16 21:05:01,"<a href=""http://twitter.com/download/iphone"" rel=""nofollow"">Twitter for iPhone</a>",,,,
'1912597903517827109',"Democrat Senator Chris Van Hollen didn’t even call the family of Rachel Morin, one of HIS constituents, who was savagely murdered by an illegal alien. No, he couldn’t do that.
 
Instead, he’s fighting to return an MS-13 gang member who was here illegally.",en,Tweet,0,130,36,13,3980,2025-04-16 21:04:09,"<a href=""http://twitter.com/download/iphone"" rel=""nofollow"">Twitter for iPhone</a>",,,,
'1912498639928172614',"Well said, @SecRubio. 🇺🇸",en,Tweet,0,22,1,6,1153,2025-04-16 14:29:42,"<a href=""http://twitter.com/download/iphone"" rel=""nofollow"">Twitter for iPhone</a>",,,,
'1912222011402686785',"I’m honored to receive @FRCAction’s One Hundred Percent Award for my pro-faith, pro-family, and pro-freedom voting record in Congress. And a special thank you to @tperkins and @JodyHiceFRCA for amplifying the importance of family values in America every day! 🇺🇸",en,Tweet,0,24,3,7,1428,2025-04-15 20:10:29,"<a href=""http://twitter.com/download/iphone"" rel=""nofollow"">Twitter for iPhone</a>",,,,
'1912177998280753516',"🚨President Trump has deported over 100,000 illegal migrants since January 20th. 

Thank God we have a president who puts the safety of its citizens FIRST! https://t.co/9eBQxrKr6K",en,Tweet,0,46,4,12,1036,2025-04-15 17:15:35,"<a href=""http://twitter.com/download/iphone"" rel=""nofollow"">Twitter for iPhone</a>",,,photo,https://pbs.twimg.com/media/GolrwThWQAAP4Ai.jpg
'1912166308856164639',"If @SecScottBessent succeeds in turning around America’s debt and deficit, history will remember him as a leader who truly changed the nation's course.

➡️https://t.co/S925u7A6Ys https://t.co/oiCGcaAZm3",en,Tweet,0,12,1,2,655,2025-04-15 16:29:09,"<a href=""http://twitter.com/download/iphone"" rel=""nofollow"">Twitter for iPhone</a>",,https://apple.news/AtSMeOxkIRDmnGrK6Ws0TxA,photo,https://pbs.twimg.com/media/GolhH3DWYAAexjm.jpg
'1911845787203490222',"Our adversaries view the growing $36 trillion debt - caused by deficit spending - as the way to destroy America without firing a shot…

They are right.

Cutting spending through the reconciliation process is where Making America Great Again begins. 🇺🇸",en,Tweet,0,116,18,24,1660,2025-04-14 19:15:30,"<a href=""http://twitter.com/download/iphone"" rel=""nofollow"">Twitter for iPhone</a>",,,,
'1911842367771988165',"Your tax dollars paid for the Medicaid benefits that liberals want to use for illegal aliens. 

https://t.co/7Q3tFEjzBR",en,Tweet,0,12,5,4,714,2025-04-14 19:01:55,"<a href=""http://twitter.com/download/iphone"" rel=""nofollow"">Twitter for iPhone</a>",,https://www.foxnews.com/politics/should-illegal-immigrants-qualify-medicaid,,
'1910754282619482343',"Friendly reminder that 208 House Democrats betrayed the American people yesterday and put illegal aliens first by opposing the SAVE Act. 
 
Unacceptable. The @HouseGOP is working to ensure that US citizens come first and that illegal aliens don’t vote in federal elections. 🇺🇸🗳️",en,Tweet,0,38,6,31,1632,2025-04-11 18:58:15,"<a href=""https://mobile.twitter.com"" rel=""nofollow"">Twitter Web App</a>",,,,
'1910744608621158682',"Thank you for your leadership, @SecKennedy.
 
I’m with you in the fight to Make America Healthy Again!
 
My FIZZ-NO bill would eliminate carbonated beverages from SNAP eligibility. We must put a stop to taxpayer dollars subsidizing obesity in America.",en,Tweet,0,32,8,17,1836,2025-04-11 18:19:49,"<a href=""https://mobile.twitter.com"" rel=""nofollow"">Twitter Web App</a>",,,,
'1910373579213906324',"Today @HouseGOP passed the SAVE Act. 🇺🇸

This legislation requires proof of U.S. citizenship for voter registration and requires states to remove non-citizens from existing voter rolls.

A HUGE win for election integrity! https://t.co/NRChHkE2el",en,Tweet,1,41,16,11,1347,2025-04-10 17:45:28,"<a href=""http://twitter.com/download/iphone"" rel=""nofollow"">Twitter for iPhone</a>",,,photo,https://pbs.twimg.com/media/GoMCpUIWIAAkVUM.jpg
'1910360695524229202',"ONE BIG, BEAUTIFUL BILL PASSED!

My top priority in Congress is reining in Washington’s reckless spending.
 
At some point, Congress must stop piling debt upon debt for the next generation. While this negotiation is a major win for conservatives—significant spending reductions are necessary to pay for President Trump’s historic tax cuts. There is still more heavy lifting to come.

Thanks to President Trump, Leader Thune, and Speaker Johnson for the assurances that made this One Big Beautiful Bill happen—including paving the way to make the Trump Tax Cuts PERMANENT!🇺🇸",en,Tweet,2,183,29,27,3250,2025-04-10 16:54:17,"<a href=""http://twitter.com/download/iphone"" rel=""nofollow"">Twitter for iPhone</a>",,,,
'1909994626527752230',".@Seanspicer on the Senate’s budget resolution: 

“I got fired up about what you guys did—yeah, let’s cut some spending! And then the Senate sends back a pittance!”

I agree, Sean! https://t.co/5tJtXugT74",en,Tweet,0,32,11,11,2095,2025-04-09 16:39:39,"<a href=""http://twitter.com/download/iphone"" rel=""nofollow"">Twitter for iPhone</a>",,,video,https://video.twimg.com/amplify_video/1909994561272696833/vid/avc1/1280x720/fnPiIy4hUTeuX3QE.mp4?tag=16
